id	source_text	target_text
GEN_031_0048	032<TAB>Dangan linaog niya an tolda ni Rachel.	030<TAB>Si Jacob mitubag, Nahadlok ako nga dili mo pakuyogon kanako ang imong mga anak nga babaye.
GEN_031_0049	033<TAB>Kinua na palan ni Rachel an mga dios-dios ni Laban, itinago sa kamadero kan kamelyo asin tinukawan an mga ini.	031<TAB>Apan bahin sa imong mga dios, kon hikit-an mo gani kini sa usa kanamo, angay siyang patyon.
GEN_031_0050	033<TAB>Naghanap si Laban kan saiyang mga dios-dios sa bilog na tolda, alagad dai niya nakua duman.	031<TAB>Atubangan sa atong mga tawo pangitag bisan unsa nga imoha ug kuhaa kini.
GEN_031_0051	034<TAB>Olay ni Rachel sa saiyang ama, Kagurangnan, dai ka logod maanggot sako.	031<TAB>Apan wala masayod si Jacob nga si Raquel maoy nagkawat sa mga diosdios.
GEN_031_0052	034<TAB>Dai ako pwedeng magtindog sa saimong atubang huli ta nareregla ako.	032<TAB>Busa misulod si Laban sa tolda ni Jacob ug gisusi niya kini.
GEN_031_0053	034<TAB>Nagpadagos sa paghanap si Laban alagad dai niya nakua an saiyang mga dios-dios.	032<TAB>Misulod usab siya sa tolda ni Lea ug sa tolda sa duha ka ulipong babaye apan wala niya hikaplagi didto ang iyang mga diosdios.
GEN_031_0054	035<TAB>Dangan naanggot si Jacob asin hinapot si Laban, Anong krimen an naginibo ko?	032<TAB>Unya miadto siya sa tolda ni Raquel.
GEN_031_0055	035<TAB>Anong kasalan ko ta linamag mo ako?	033<TAB>Apan didto tagoi ni Raquel ang mga diosdios sa ilalom sa muntora sa kamelyo ug iya kining gilingkoran.
GEN_031_0056	036<TAB>Ngunyan na nahalungkat mo na an gabos kong pagsadiri, ano an nakua mo na pagsadiri mo?	033<TAB>Gisusi ni Laban ang tibuok tolda apan wala niya kini hikaplagi.
GEN_031_0057	036<TAB>Iluwas mo digdi sa atubang kan satong mga tawohan tanganing sinda an magsabi kun siisay sa sato an tama.	034<TAB>Miingon si Raquel sa iyang amahan, Ayaw ug kasuko kanako nga dili ako makatindog sa imong atubangan kay giregla ako.
GEN_031_0058	037<TAB>Sa laog nin beynteng taon yaon ako sa kaibahan mo; mayong naghulos minsan saro kan saimong babaeng karnero o kanding; asin minsan saro kan saimong hayop dai ko kinakan.	034<TAB>Mipadayon si Laban sa pagpangita apan wala gayod niya hikaplagi ang iyang mga diosdios.
GEN_031_0059	038<TAB>Kun igwang saro na ginadan kan mga maringis na hayop, dai ko na dinadara saimo tanganing ipahiling na mayo akong sala; binabayadan ko na sana huli ta pinapabayadan mo an arin man na hinabon sa aldaw o sa banggi.	035<TAB>Unya si Jacob wala na makapugong sa iyang kaugalingon ug masuk-anon nga miingon kang Laban, Unsa may akong sala kanimo nga imo man akong gigukod?
GEN_031_0060	039<TAB>Tinios ko an init kan aldaw asin an lipot kan banggi; dai na ako nagkakatorog.	036<TAB>Karon nga nasusi mo na ang tanan kong kabtangan, unsa may nakaplagan mo nga imoha?
GEN_031_0061	040<TAB>Iyan an nagin buhay ko sa laog nin beynteng taon na yaon ako saimo.	036<TAB>Kon aduna dad-a diri sa gawas aron nga ang imo ug akong mga tawo makakita ug silay mohukom kinsa kanato ang husto.
GEN_031_0062	040<TAB>Naglingkod ako saimo sa laog nin katorseng taon para sa duwang aki mo, asin anom na taon para sa saimong mga hayop.	037<TAB>Nitipon ako kanimo sa 20 ka tuig ug wala gayod mahitabo nga wala manganak ang imong mga kanding ug mga karnero apan wala gayod ako makakaon ug karne sa laking karnero nga imoha.
GEN_031_0063	040<TAB>Alagad sampolong beses mo pang liniwat an sweldo ko.	038<TAB>Kon may karnero nga gitukob sa ihalas nga mga mananap, wala ko kini dad-a kanimo aron ipakita nga ang nahitabo dili akong sayop kondili giilisan ko ang karnero.
GEN_031_0064	041<TAB>Kun dai ako inibahan kan Dios nin sakong mga magurang, an Dios ni Abraham asin ni Isaac, tibaad haloy mo na akong pinalayas na mayo nin ano man na dara.	038<TAB>Gipabayran mo kanako ang gikawat nga karnero panahon sa adlaw o sa gabii.
GEN_031_0065	041<TAB>Alagad nahiling nin Dios an sakong kasakitan asin an sakong kapagalan, kaya naanggotan ka niya kasubanggi.	039<TAB>Sa daghang higayon giantos ko ang kainit sa adlaw ug ang katugnaw sa gabii ug wala akoy maayong kinatulgan.
GEN_031_0066	042<TAB>Sinimbag ni Laban si Jacob, Mga aki ko an mga babaeng ini; sadiri ko an saindang mga aki asin rogaring ko an mga hayop na ini.	040<TAB>Mao kini ang akong nahimo sulod sa 20 ka tuig sa akong pagpuyo tipon kanimo.
GEN_031_0067	042<TAB>An totoo, sadiri ko an gabos na nahihiling mo.	040<TAB>Napulog-upat ka tuig ang pag-alagad ko kanimo alang sa duha mo ka anak nga babaye ug unom ka tuig alang sa imong mga kahayopan.
GEN_031_0068	042<TAB>Alagad huli ta dai na akong magigibo tanganing mapugol sinda,	040<TAB>Apan kanapulo mo usab-usaba ang akong suhol.
GEN_031_0069	043<TAB>andam ako na makipagtipan sa saimo.	041<TAB>Kon wala pa ako ubani sa Dios sa akong amahan nga mao ang Dios ni Abraham ug ang Dios nga gisimba ni Isaac, gipapahawa mo na unta ako nga walay dala.
GEN_031_0070	043<TAB>Magtambak kita nin mga gapo na iyo an danay na magpapagiromdom sato kan satong tipan.	041<TAB>Apan nakita sa Dios ang akong kalisod ug ang akong nahimo kanimo ug kagabii gipahimangnoan ka niya.
GEN_031_0071	044<TAB>Kaya kuminua si Jacob nin gapo asin pinatindog ini bilang sarong hariging giromdom,	042<TAB>Unya mitubag si Laban kang Jacob, Kining mga babaye akong mga anak ug ang ilang mga anak akong mga apo.
GEN_031_0072	045<TAB>dangan sinabihan an saiyang mga tawohan na magtambak nin mga gapo; duman na sinda nagkakan sa kataed kan tinambak na mga gapo.	042<TAB>Ang mga kahayopan akoa.
GEN_031_0073	046<TAB>Nginaranan ini ni Laban nin Jegar-Sahaduta asin Galeed naman an inginaran kaini ni Jacob.	042<TAB>Akoa ang tanan nga nakita mo.
GEN_031_0074	047<TAB>Sinabihan ni Laban si Jacob, An tambak na gapong ini iyo an magpapagiromdom sato.	042<TAB>Apan karon unsa pa may mahimo ko sa akong mga anak o sa akong mga apo?
GEN_031_0075	047<TAB>Kaya an lugar na idto nginaranan Galeed.	043<TAB>Busa maghimo kitag kasabotan ug magpundok kitag mga bato silbing handomanan nato bahin niini.
GEN_031_0076	048<TAB>Nagsabi pa si Laban, Bantayan logod kita nin Kagurangnan mantang harayo kita sa lambang saro.	044<TAB>Unya nag-ugbok si Jacob ug bato agig handomanan
GEN_031_0077	048<TAB>Kaya an lugar inapod man Mizpa.	045<TAB>ug gisugo niya ang iyang mga tawo sa pagkuhag mga bato ug ila kining gipatongpatong.
GEN_031_0078	049<TAB>Nagsabi pa si Laban, Kun maglaen an saimong pagtratar sa mga aki kong babae, o kun mag-agom ka nin ibang mga babae, minsan dai ko maisihan, giromdoma na nagbabantay sato an Dios.	045<TAB>Unya nangaon sila tupad sa batong tinapok.
GEN_031_0079	050<TAB>Uya an tinambak na gapo asin an hariging giromdom na ibinugtak ko sa pagultanan tang duwa.	046<TAB>Ginganlan kini ni Laban ug Jegar-sahaduta, apan Galeed ang gingalan ni Jacob niini.
GEN_031_0080	051<TAB>Ini an mga saksi na dai ako malampas sa tambak na ini tanganing kalabanon ka asin dai ka man malampas digdi o sa hariging giromdom na ini tanganing kalabanon ako.	047<TAB>Miingon si Laban, Kining pinundok nga mga bato handomanan nato.
GEN_031_0081	052<TAB>Husgaran logod kita kan Dios ni Abraham, ni Nahor, asin nin saindang mga magurang.	047<TAB>Busa ginganlag Galeed ang maong dapit.
GEN_031_0082	052<TAB>Kaya nanumpa si Jacob sa ngaran kan Dios na sinamba ni Isaac na saiyang ama.	048<TAB>Ug miingon usab si Laban, Bantayan unta kita ni Yahweh samtang magkalinay-anay kita.
GEN_031_0083	053<TAB>Nagbuno siya nin hayop na saiyang idinolot duman sa bukid dangan inapod niya an saiyang mga tawohan tanganing magkakan.	048<TAB>Busa ginganlan usab ug Mispa ang maong dapit.
GEN_031_0084	053<TAB>Duman na sinda naagahan sa bukid.	049<TAB>Mipadayon si Laban sa pag-ingon, Kon daugdaogon mo ang akong mga anak o mangasawa kag laing mga babaye bisan ako dili masayod niini, hinumdomi nga ang Dios nagtan-aw kanato.
GEN_031_0085	054<TAB>Pagkaagang amay, hinadokan ni Laban an saiyang mga makoapo asin mga aki dangan benendisyonan niya sinda; pakatapos, nagpuli na siya sa saiyang harong.	050<TAB>Unya miingon si Laban kang Jacob, Ania ang gipatongpatong ko nga mga bato tali kanato ug ania ang handomanan nga bato.
GEN_031_0086	<MISSING_TRANSLATION>	051<TAB>Kining gipatongpatong nga mga bato ug kining giugbok nga bato maoy atong mga utlanan.
GEN_031_0087	<MISSING_TRANSLATION>	051<TAB>Dili ako molatas niining gipundok nga mga bato aron sa pagpakig-away kanimo o ikaw molatas niini aron sa pagpakig-away kanako.
GEN_031_0088	<MISSING_TRANSLATION>	052<TAB>Maoy atong pahukmon ang Dios ni Abraham ug ang Dios ni Nahor.
GEN_031_0089	<MISSING_TRANSLATION>	052<TAB>Unya nanumpa si Jacob sa ngalan sa Dios nga gisimba ni Isaac nga iyang amahan.
GEN_031_0090	<MISSING_TRANSLATION>	053<TAB>Nag-ihaw siyag usa ka hayop ug iyang gihalad didto sa bukid ug gidapit niya ang iyang mga tawo sa pagpangaon.
GEN_031_0091	<MISSING_TRANSLATION>	053<TAB>Human sila mangaon, didto sila mangatulog sa bukid niadtong gabhiona.
GEN_031_0092	<MISSING_TRANSLATION>	054<TAB>Sayo sa buntag, gipanghagkan ni Laban ang iyang mga apo ug mga anak agig panamilit ug gipanalanginan niya sila.
GEN_031_0093	<MISSING_TRANSLATION>	054<TAB>Unya mipauli siya sa ila.
GEN_032_0001	verse<TAB>content	verse<TAB>content
GEN_032_0002	001<TAB>Mantang naglalakaw si Jacob, sinabat siya kan mga anghel nin Dios.	001<TAB>Mipadayon si Jacob sa iyang panaw ug gisugat siyag mga anghel sa Dios.
GEN_032_0003	002<TAB>Kan mahiling niya sinda, nagsaboot siya, Kampo ini nin Dios!	002<TAB>Sa pagkakita ni Jacob kanila, miingon siya, Mga sundalo kini sa Dios.
GEN_032_0004	002<TAB>Kaya an lugar inapod niyang Mahanaim.	002<TAB>Busa ginganlan niyag Mahanaim ang maong dapit.
GEN_032_0005	003<TAB>Nagsugo nin mga tawo si Jacob pasiring sa saiyang tugang na si Esau sa daga nin Edom.	003<TAB>Nagsugo si Jacob ug mga tawo sa pag-una kaniya ngadto sa iyang igsoon nga si Esau didto sa Seir sa nasod sa Edomea.
GEN_032_0006	004<TAB>Pinasunod niya sinda na magsabi ki Esau: Kagurangnan, ako si Jacob, na saimong sorogoon, nagpapahayag saimo na nakierok ako ki Laban asin ngunyan pa sana mapuli.	004<TAB>Gisugo niya sila nga sultihan si Esau niini: Si Jacob, ang imong sulugoon, didto mipuyo tipon kang Laban ug karon pa lamang mopauli.
GEN_032_0007	005<TAB>Dakul na an sadiri kong baka, asno, karnero, kanding asin oripon.	005<TAB>Aduna na siyay daghang baka, asno, karnero, kanding ug mga ulipon.
GEN_032_0008	005<TAB>Nagpasugo ako saimo sa paglaom na magigin marahay an pag-ako mo sako.	005<TAB>Gipasugoan ka niya aron pagsugilon kanimo niini basin na lag mahimuot ka kaniya.
GEN_032_0009	006<TAB>Kan magbalik ki Jacob an mga sinugo, nagsabi sinda, Nakaolay mi an tugang mong si Esau.	006<TAB>Sa nahibalik na ang mga sinugo ni Jacob, miingon sila, Didto na kami sa imong igsoon nga si Esau ug nagpaingon na siya nganhi aron pagtagbo kanimo.
GEN_032_0010	006<TAB>Pasiring na siya digdi sa pagsabat saimo kaiba an kwatro syentos kan saiyang mga tawohan.	006<TAB>May kuyog siyang 400 ka tawo.
GEN_032_0011	007<TAB>Natakot asin nahandal si Jacob, kaya binanga niya sa duwang grupo an mga tawo asin mga hayop na kaiba niya.	007<TAB>Nahadlok ug nabalaka pag-ayo si Jacob.
GEN_032_0012	008<TAB>Nagsaboot siya, Kun salakayon asin gadanon ni Esau an enot na grupo, pwedeng makadulag an ikaduwa.	007<TAB>Busa gibahin niya sa duha ka panon ang iyang mga tawo ingon man ang iyang mga karnero, kanding, baka ug mga kamelyo.
GEN_032_0013	009<TAB>Dangan namibi si Jacob, O Dios ni Abraham saka ni Isaac na sakuyang ama, dangoga ako!	008<TAB>Naghunahuna siya nga kon ugaling atakihon ni Esau ang unang pundok, makahimo pag-ikyas ang ikaduha.
GEN_032_0014	009<TAB>Ika, Kagurangnan , an nagtaram sako na magpuli sa sakong daga saka sa sakong mga kadugo, asin papakarahayon mo an gabos para sa sako.	009<TAB>Unya nag-ampo si Jacob, Dios sa akong apohan nga si Abraham ug sa akong amahan nga si Isaac, pamatia intawon ako!
GEN_032_0015	010<TAB>Bako akong maninigo kan danay mong pagkamoot asin kan pagkamaimbod na ipinahiling mo sako, na saimong oripon.	009<TAB>Ginoo , ikaw nag-ingon kanako, Pauli sa inyo ug sa imong kaparyentihan ug salig nga walay mahitabo kanimo.
GEN_032_0016	010<TAB>Binalyo ko an Jordan na sugkod sana an dara alagad ngunyan nagbalik ako na may kaiba nang duwang grupo.	010<TAB>Dili ako takos sa tanan mong kaluoy ug kaayo kanako nga imong sulugoon.
GEN_032_0017	011<TAB>Nakikimaherak ako na iligtas mo ako sa tugang kong si Esau, huli ta natatakot ako saiya; tibaad salakayon asin gadanon niya kami gabos sagkod an kababaehan saka kaakian.	010<TAB>Mitabok ako sa Jordan nga walay dala gawas sa akong sungkod apan karon mibalik ako uban niining duha ka pundok.
GEN_032_0018	012<TAB>Giromdoma an saimong panuga na papakarahayon mo an gabos para sako asin na tatawan mo ako nin dakul na mga kapagarakian na dai mabilang arog kan baybay sa dagat.	011<TAB>Busa luwasa intawon ako gikan sa mga kamot sa akong igsoon nga si Esau.
GEN_032_0019	013<TAB>Duman sa lugar na idto naagahan si Jacob.	011<TAB>Nahadlok ako nga siya mipaingon nganhi aron pamatyon kaming tanan lakip ang mga babaye ug kabataan.
GEN_032_0020	013<TAB>Dangan, sa mga hayop niya, nagpili siya nin panregalo sa tugang niyang si Esau: dos syentos na babaeng kanding saka beynteng lalaking kanding, dos syentos na babaeng karnero dangan beynteng lalaking karnero, treyntang mag-inang kamelyo, kwarentang babaeng baka asin sampolong lalaking baka, beynteng babaeng asno saka sampolong lalaking asno.	012<TAB>Hinumdomi ang imong saad nga walay daotang mahitabo kanako ug nga hatagan mo akog daghang kaliwat nga dili maihap sama kadaghan sa balas sa baybayon.
GEN_032_0021	014<TAB>Sinuhay niya ini gabos, pinaggrupo-grupo dangan ipinadara sa saiyang mga oripon; sarong oripon sa lambang grupo.	013<TAB>Human siya magpalabay sa gabii niadtong dapita, nagpili siyag gasa alang sa iyang igsoon nga si Esau.
GEN_032_0022	014<TAB>Sinabihan niya sinda, Mag-enot na kamo sako asin bugtakan nindo nin distansya an lambang grupo nin hayop.	014<TAB>Kini ang iyang gigasa: 200 ka baye ug 20 ka laking kanding, 200 ka baye ug 20 ka laking karnero, 30 ka gatasan nga kamelyo lakip ang mga anak nila, 40 ka baye nga baka ug 10 ka toro ug 20 ka baye ug 10 ka laking asno.
GEN_032_0023	015<TAB>Tinogon niya an enot na oripon, Sa oras na masabatan ka kan tugang kong si Esau asin hapoton ka, Siisay an saimong kagurangnan?	015<TAB>Matag panon gipadumala niya sa usa ka sulugoon ug giingnan niya, Una kamo kanako ug kinahanglan nga dili magkadug-ol ang matag panon.
GEN_032_0024	015<TAB>Masaen ka?	016<TAB>Gimandoan niya ang unang sulugoon, Kon mangutana kaninyo ang akong igsoon nga si Esau kon kinsa ang inyong agalon, asa kamo paingon ug kinsay tag-iya niining kahayopan,
GEN_032_0025	015<TAB>Siisay an kagsadiri kan mga hayop sa enotan mo?	017<TAB>ingna siya, Kini iya ni Jacob nga imong sulugoon.
GEN_032_0026	016<TAB>simbagon mo siya nin, Sadiri ini kan saimong oripon na si Jacob.	017<TAB>Iya kining igasa kanimo ug nagsunod siya kanamo.
GEN_032_0027	016<TAB>Ipinapadara niya an mga ini bilang regalo sa kagurangnan niyang si Esau.	018<TAB>Mao usab kini ang iyang gisugo sa ikaduha ug sa ikatulo ingon man sa tanan nga nagdumala sa nagsunod nga mga panon,
GEN_032_0028	016<TAB>Kasunod mi na si Jacob.	019<TAB>Ingna si Esau, Ang imong sulugoon nga si Jacob nagsunod kanamo.
GEN_032_0029	017<TAB>Siring man an itinogon niya sa ikaduwa, sa ikatolo asin sa iba pang namamahala kan mga hayop: Ini an sabihon nindo ki Esau sa oras na masabat nindo siya.	019<TAB>Nagtuo si Jacob nga maluoy kaniya ang iyang igsoon tungod sa mga gasa nga iyang gipadala pag-una ug nga pasayloon siya ni Esau.
GEN_032_0030	018<TAB>Sabihon nindong, Kasunod mi na si Jacob na saimong oripon.	020<TAB>Gipadala niya pag-una ang mga gasa ug mipahulay siya didto sa kampo niadtong gabhiona.
GEN_032_0031	018<TAB>Nagsaboot si Jacob, Sa kadaklan kan regalo ko, mawawara na an saiyang kaanggotan sako.	021<TAB>Niadtong gabhiona, mibangon si Jacob ug gidala niya ang duha niya ka asawa, ang duha niya ka ulipong babaye ug ang 11 niya ka anak ug mitabok sila sa tabokanan sa Suba sa Jaboc.
GEN_032_0032	018<TAB>Kaya sa oras na masabat ko siya, papatawadon na niya ako.	022<TAB>Human niya ikatabok sila, iya usab nga gipatabok ang tanan niyang kabtangan.
GEN_032_0033	019<TAB>Pinaenot niya an mga regalo alagad duman na siya nagpaaga sa kampo.	023<TAB>Siya na lamang ang nagpabilin.
GEN_032_0034	020<TAB>Kan bangging idto, nagbangon si Jacob asin dinara sa ibong kan Salog nin Jabbok an saiyang duwang agom, an duwa niyang kasaroan asin an onse niyang aki.	024<TAB>Unya may tawong nakigdumog kaniya hangtod sa kaadlawon.
GEN_032_0035	021<TAB>Pakabalyohan niya sainda, sunod niyang pinaibong an gabos niyang pagsadiri,	025<TAB>Sa pagkamatikod sa tawo nga dili siya makadaog sa ilang panagdumog, giigo niya ang dapidapi ni Jacob ug naligas ang lutahan niini.
GEN_032_0036	022<TAB>alagad nagpawalat siya.	026<TAB>Miingon ang tawo, Buhii ako kay hayag na.
GEN_032_0037	023<TAB>Dangan nagtunga an sarong lalaki asin nakigumolan ki Jacob sagkod na madali nang magliwanag an aldaw.	027<TAB>Apan si Jacob mitubag, Dili ko ikaw buhian hangtod nga panalanginan mo ako.
GEN_032_0038	024<TAB>Kan mahiling kan lalaki na dai siya nanggagana, sinuntok niya sa piad si Jacob na ikinataplis kan tolang sa piad kaini.	028<TAB>Nangutana ang tawo, Unsay imong ngalan?
GEN_032_0039	025<TAB>Dangan nagsabi an lalaki, Butasi ako, huli ta nagliliwanag na.	028<TAB>Mitubag siya, Jacob.
GEN_032_0040	026<TAB>Nagsimbag si Jacob, Dai taka bubutasan sagkod na dai mo ako bendisyonan.	029<TAB>Ang tawo miingon, Dili na Jacob ang imong ngalan kondili Israel kay nakigdumog ka sa Dios ug sa mga tawo ug midaog ka.
GEN_032_0041	027<TAB>Naghapot an lalaki, Ano an ngaran mo?	030<TAB>Si Jacob miingon, Tug-ani lagi ako sa imong ngalan.
GEN_032_0042	028<TAB>Jacob, an simbag kaini.	031<TAB>Apan mitubag ang tawo, Nganong nangutana ka man sa akong ngalan?
GEN_032_0043	029<TAB>Nagsabi an lalaki, Poon ngunyan bako nang Jacob an ngaran mo kundi Israel, huli ta nakigumolan ka sa Dios saka sa mga tawo, asin nanggana ka.	031<TAB>Unya gipanalanginan niya si Jacob.
GEN_032_0044	030<TAB>Nagsabi si Jacob, Sabihan man sako an ngaran mo.	032<TAB>Miingon si Jacob, Nakakita na gayod ako sa nawong sa Dios ug buhi gihapon ako.
GEN_032_0045	031<TAB>Nagsimbag an lalaki, Tano ta gusto mong maaraman an sakong ngaran?	032<TAB>Busa ginganlan niyag Peniel ang maong dapit.
GEN_032_0046	031<TAB>Dangan benendisyonan niya si Jacob.	033<TAB>Misubang na ang adlaw sa pagbiya ni Jacob sa Peniel ug nagkiang siya tungod sa nalisa niyang dapidapi.
GEN_032_0047	032<TAB>Nagsabi si Jacob, Nahiling ko an lalawogon nin Dios alagad buhay pa ako; kaya an lugar nginaranan niyang Peniel.	034<TAB>Busa, hangtod karon ang mga kaliwat ni Israel dili mokaon sa unod sa dapidapi sa mananap kay diha mang bahina sa lawas naigo si Jacob.
GEN_032_0048	033<TAB>Nagsirang na an aldaw kan maghale si Jacob sa Peniel; pilay siyang naglakaw huli sa saiyang piad.	<MISSING_TRANSLATION>
GEN_032_0049	034<TAB>Kaya sagkod ngunyan, dai kinakakan kan mga Israelita an laman na yaon sa piad kan hayop huli ta iyo iyan an parte na tinamaan kan suntokon si Jacob.	<MISSING_TRANSLATION>
GEN_033_0001	verse<TAB>content	verse<TAB>content
GEN_033_0002	001<TAB>Nahiling ni Jacob na nagdadangadang si Esau kaiba an kwatro syentos na kalalakihan, kaya an kaakian binanga niya ki Lea, ki Rachel saka sa duwa niyang kasaroan.	001<TAB>Nakita ni Jacob si Esau uban sa 400 ka tawo nga nagpaingon kaniya busa gibahinbahin niya ang iyang mga anak kanila ni Lea, ni Raquel ug sa duha ka ulipon nga babaye.
GEN_033_0003	002<TAB>Pinaenot niya an duwa niyang kasaroan sagkod an saindang mga aki; isinunod niya si Lea saka an mga aki kaini dangan pinahudyan niya si Rachel asin si Jose.	002<TAB>Maoy iyang gipauna ang mga ulipon ug ang ilang kabataan unya gipasunod si Lea ug ang iyang mga anak ug gipaulahi niya si Raquel ug si Jose.
GEN_033_0004	003<TAB>Nangenotan si Jacob sainda asin pitong beses siyang nagdapa sa daga mantang naglalakaw pasiring ki Esau.	003<TAB>Unya miuna si Jacob kanila ug miyukbo sa makapito hangtod miabot siya duol kang Esau.
GEN_033_0005	004<TAB>Alagad nagdalagan si Esau sa pagsabat saiya, kinugos siya dangan hinadokan; pareho sindang naghibi.	004<TAB>Apan midagan si Esau aron pagtagbo kang Jacob ug migakos ug mihalok kaniya.
GEN_033_0006	005<TAB>Kan mahiling ni Esau an kababaehan asin kaakian naghapot siya, Siisay an mga kairiba mong ini?	004<TAB>Nanghilak silang duha.
GEN_033_0007	006<TAB>Nagsimbag si Jacob, Sinda an mga aking pinagmarahay nin Dios na itao sako.	005<TAB>Ug sa pagkakita ni Esau sa mga babaye ug sa mga kabataan, nangutana siya, Kinsa man kining mga kuyog nimo?
GEN_033_0008	007<TAB>Enot na nagdolok ki Esau an mga kasaroan ni Jacob saka an saindang mga aki; nagduko sinda sa paggalang;	006<TAB>Mitubag si Jacob, Kini sila mao ang mga anak nga gikaluoy sa Dios paghatag kanako.
GEN_033_0009	008<TAB>dangan nagdolok si Lea kaiba an saiyang mga aki.	007<TAB>Unya miduol ang mga ulipon nga mga babaye uban sa ilang mga anak ug miyukbo.
GEN_033_0010	008<TAB>Huring nagdolok si Jose saka si Rachel; nagduko man sinda ki Esau sa paggalang.	008<TAB>Miduol usab si Lea ug ang iyang mga anak ug sa kataposan si Raquel ug si Jose nga miyukbo usab.
GEN_033_0011	009<TAB>Naghapot si Esau, Ano an kahulogan kaidtong nasabatan kong sarong grupo?	009<TAB>Nangutana si Esau, Unsa man diay kadtong laing panon nga akong gikatagbo?
GEN_033_0012	010<TAB>Mga regalo ko idto saimo tanganing makua ko an saimong marahay na boot, an simbag ni Jacob.	009<TAB>Unsa may buot ipasabot niadto?
GEN_033_0013	011<TAB>Alagad nagsabi si Esau, Igwa na ako kan magkakanigo sako, tugang ko; saimo na sana iyan.	010<TAB>Si Jacob mitubag, Igasa ko kadto kanimo aron mahimuot ka kanako.
GEN_033_0014	012<TAB>Nagsimbag si Jacob, Bakong siring kaiyan; kun talagang marahay na an boot mo sako, akoon mo an sakong regalo.	011<TAB>Apan miingon si Esau, Igsoon, aduna akoy akoa nga igo na kanako.
GEN_033_0015	012<TAB>Huli ta, kan mahiling ko an lalawogon mo, garo man sanang nahiling ko an lalawogon nin Dios, orog na ngunyan na inako mo ako sa marahay na boot.	011<TAB>Busa ayaw na lamang akog hatagi.
GEN_033_0016	013<TAB>Kaya nakikimaherak ako na akoon mo an regalong dara ko saimo; nagin marahay sako an Dios asin tinawan ako kan gabos kong kaipuhan.	012<TAB>Miingon si Jacob, Dili mahimo.
GEN_033_0017	013<TAB>Nagparapirit si Jacob kaya inako ni Esau an regalo.	012<TAB>Kon tinuod nga gipasaylo mo na ako, dawata ang akong gasa kanimo.
GEN_033_0018	014<TAB>Nagsabi si Esau, Magpadagos na kita sa satong paglakaw; ako an mangengenot saindo.	012<TAB>Alang kanako ang pagtan-aw sa imong nawong sama ra nga nagtan-aw ako sa nawong sa Dios karon nga gidawat mo ako.
GEN_033_0019	015<TAB>Alagad nagsimbag si Jacob, Aram mo man sana na maluluya pa an mga aki, asin kaipuhan na mangnohon ko an mga ogbon kan karnero saka baka patin an saindang ina.	013<TAB>Busa dawata intawon kining akong gasa kanimo.
GEN_033_0020	015<TAB>Kun manganaan an mga hayop sa saindang paglakaw sa sarong aldaw, magagadan sinda gabos.	013<TAB>Maayo kaayo kanako ang Dios ug gihatagan niya ako sa tanan kong gikinahanglan.
GEN_033_0021	016<TAB>Mag-enot ka na sako, huli ta aantabayan ko an mga hayop asin kaakian sosog sa rikas kan saindang paglakaw sagkod na maabotan taka sa Edom.	013<TAB>Namugos gayod si Jacob kang Esau busa gidawat na lamang ni Esau ang gasa.
GEN_033_0022	017<TAB>Kun siring mawalat ako nin nagkapira sa mga tawohan ko, an sabi ni Esau.	014<TAB>Miingon si Esau, Tana!
GEN_033_0023	018<TAB>Alagad nagsimbag si Jacob, Dai na kaipuhan huli ta gusto ko sanang makua an marahay mong boot.	014<TAB>Manglakaw na kita ug akoy mag-una.
GEN_033_0024	019<TAB>Kaya nagpuli sa Edom si Esau kan aldaw na idto,	015<TAB>Mitubag si Jacob, Nasayod ka nga luya ang mga bata ug anaa pay anakan nga mga karnero ug mga baka nga nagkinahanglan sa akong pag-atiman.
GEN_033_0025	020<TAB>alagad nagpaduman sa Sukkot si Jacob.	015<TAB>Kon pugson sila sa paglakawg paspas bisag usa lang ka adlaw, mangamatay silang tanan.
GEN_033_0026	020<TAB>Nagpatindog siya duman nin harong asin mga harong-harong para sa saiyang mga hayop; kaya an lugar na idto nginaranan nin Sukkot.	016<TAB>Busa una lang kanamo ug mohinayhinay ra akog sunod.
GEN_033_0027	021<TAB>Sa saiyang pagpuli hale sa Mesopotamia, nakaabot si Jacob sa syudad nin Shekem, sa daga nin Canaan.	016<TAB>Agdon lang nako ang gikusgon sa linaktan sa mga hayop ug sa mga kabataan hangtod maabtan ka namo sa Seir sa Edomea.
GEN_033_0028	021<TAB>Nagkampo siya sa sarong oma na harani sa syudad.	017<TAB>Si Esau miingon, Kon mao kana, ibilin ko kanimo ang pipila sa akong mga tawo.
GEN_033_0029	022<TAB>Binakal niya sa mga kapagarakian ni Hamor, na ama ni Shekem, an dagang pinatindogan niya kan saiyang kampo sa halagang sanggatos na pedaso nin plata.	018<TAB>Apan si Jacob mitubag, Pagkamaayo nimo kanako, apan ayaw na lang kana buhata.
GEN_033_0030	023<TAB>Nagpatindog siya nin altar duman asin nginaranan niyang El-Elohe-Israel.	019<TAB>Busa niadtong adlawa mibalik si Esau balik sa Seir.
GEN_033_0031	<MISSING_TRANSLATION>	020<TAB>Apan si Jacob mipaingon sa Sucot ug didto nagbalay siya ug naghimog silonganan sa iyang mga hayop.
GEN_033_0032	<MISSING_TRANSLATION>	020<TAB>Busa ginganlan ang maong dapit ug Sucot.
GEN_033_0033	<MISSING_TRANSLATION>	021<TAB>Gikan sa Mesopotamia, miabot si Jacob sa siyudad sa Siquem sa yuta sa Canaan nga walay kadaot nga nahitabo.
GEN_033_0034	<MISSING_TRANSLATION>	021<TAB>Nagkampo siya didto sa usa ka uma nga atbang sa siyudad.
GEN_033_0035	<MISSING_TRANSLATION>	022<TAB>Gipalit niya ang maong uma gikan sa mga kaliwat ni Hamor nga amahan ni Siquem ug 100 ka salapi.
GEN_033_0036	<MISSING_TRANSLATION>	023<TAB>Unya naghimo siya didtog halaran ug ginganlan niya kinig El, ang Dios sa Israel.
GEN_034_0001	verse<TAB>content	verse<TAB>content
