id	source_text	target_text
GEN_010_0012	008<TAB>Si Cus iyo an ama ni Nimrod; iyo ini an enot na tawo sa kinaban na nabantog bilang sarong mapangyaring mananakop.	007<TAB>Ang mga anak ni Raama mao sila si Sheba ug Dedan.
GEN_010_0013	009<TAB>Sa atubang nin Kagurangnan , siya sarong dakulang paraayam, kun kaya nagkaigwa nin kasabihan, Siring ki Nimrod na dakulang paraayam sa atubangan nin Kagurangnan !	008<TAB>May anak si Cus nga ginganlag Nimrod nga maoy unang bantogang tawo sa kalibotan.
GEN_010_0014	010<TAB>Kaayon sa kaenot-enoteng kahadean na sakop niya iyo an Babilon, an Erek, asin an Accad, na gabos yaon sa daga kan Babilonia.	009<TAB>Pinaagi sa tabang sa Ginoo nahimo siyang labing maayong mangangayam sa tibuok kalibotan busa ang mga tawo moingon, Himoon ka unta sa Ginoo nga sama ka maayong mangangayam ni Nimrod.
GEN_010_0015	011<TAB>Hale sa dagang ini nagduman siya sa Asiria asin itinugdok an mga syudad nin Nineve, Rehobot-ir, Cala,	010<TAB>Ang unang gingharian nga iyang gimandoan naglakip sa Babel, Erac ug Acad.
GEN_010_0016	012<TAB>asin Resen na nasa pagultanan kan Nineve asin Cala, an dakulang syudad.	010<TAB>Nahimutang kini sila sa yuta sa Shinar.
GEN_010_0017	013<TAB>An mga aking lalaki ni Egipto iyo si Lydia, Anam, Lehab, Naftu,	011<TAB>Gikan sa maong yuta mipanaw si Nimrod paingon sa Asiria ug gitukod niya ang mga siyudad sa Ninibe, Rehobot-Ir, Cala
GEN_010_0018	014<TAB>Patrus, Caslu, na ginikanan kan mga Filisteo, asin ni Caftor.	012<TAB>ug Resen nga diha sa tungatunga sa Ninibe ug sa dakong siyudad sa Cala.
GEN_010_0019	015<TAB>Si Canaan iyo an ama si Sidon, na matua niyang aking lalaki, asin ni Het.	013<TAB>Si Ehipto maoy ginikanan sa katawhan sa Ludim, sa Anamim, sa Lahabim, sa Naftuhim,
GEN_010_0020	016<TAB>Si Canaan iyo man an ginikanan kan mga Jebuseo, Amoreo, Gergeseo,	014<TAB>Petrusim, Caftorim ug Casluhim nga maoy gigikanan sa mga Filistihanon.
GEN_010_0021	017<TAB>Heveo, Araceo, Sineo,	015<TAB>Ang mga anak ni Canaan mao sila si Sidon, ang kamagulangan, ug si Het.
GEN_010_0022	018<TAB>Arvadeo, Zemareo asin Hamateo.	016<TAB>Kaliwat usab ni Canaan ang mga Jebusihanon, ang mga Amorihanon, ang mga Girgasihanon,
GEN_010_0023	018<TAB>Dangan nakalakop an manlaen-laen na tribu kan mga Cananeo.	017<TAB>ang mga Hibihanon, ang mga Arkihanon, ang mga Sinaihanon,
GEN_010_0024	019<TAB>Hale sa Sidon, an saindang teritoryo nakaabot sa Gerar harani sa Gaza sa habagat asin sa Sodoma, Gomorra, Adma saka Zeboiim harani sa Lasa sa sirangan.	018<TAB>ang mga Arvadihanon, ang mga Semarihanon ug ang mga Hamatihanon.
GEN_010_0025	020<TAB>Iyo ini an mga aki ni Ham, na an lambang saro nagin dakulang nasyon na may sadiring daga asin lengwahe.	018<TAB>Unya, nagbulagbulag ang nagkalainlaing mga banay sa mga taga-Canaan
GEN_010_0026	021<TAB>Si Sem na matuang tugang ni Jafet, iyo an ginikanan kan gabos na Hebreyo.	019<TAB>hangtod nga ang ilang mga utlanan nagsukad sa Sidon padulong sa Gerar hangtod sa Gaza ug paingon sa Sodoma, Gomora, Adma ug Zeboim, hangtod sa Lasa.
GEN_010_0027	022<TAB>An mga aking lalaki ni Sem iyo si Elam, Assur, Arpaksad, Lud asin Aram.	020<TAB>Mao kini ang mga kaliwat ni Ham nga nagpuyo sa nagkalainlaing mga kabanayan ug kanasoran.
GEN_010_0028	023<TAB>An mga aking lalaki ni Aram iyo si Uz, Hul, Geter asin Mas.	020<TAB>Ang matag usa ka pundok may kaugalingong pinulongan.
GEN_010_0029	024<TAB>Si Arpaksad iyo an ama ni Sela na ama ni Eber.	021<TAB>Si Sem, ang magulang ni Japet, mao ang ginikanan sa tanang Hebreo.
GEN_010_0030	025<TAB>Duwa an nagin aking lalaki ni Eberan saro inapod niyang Peleg, huli ta sa panahon kaini nabanga an mga tawo sa daga; asin an ikaduwa, nginaranan niyang Joktan.	022<TAB>Ang mga lalaking anak ni Sem mao sila si Elam, si Asur, si Arfacsad, si Lud ug si Aram nga maoy mga ginikanan sa mga katawhan nga nagdala sa ilang mga ngalan.
GEN_010_0031	026<TAB>Si Joktan iyo an ama ninda Almodad, Selef, Hazarmavet, Jera,	023<TAB>Ang mga anak ni Aram mao sila si Uz, si Hul, si Geter ug si Mas.
GEN_010_0032	027<TAB>Hadoram, Uzal, Dikla,	024<TAB>Si Arfacsad mao ang amahan ni Sela ug si Shela mao ang amahan ni Eber.
GEN_010_0033	028<TAB>Obal, Abimael, Sheba,	025<TAB>Duha ang anak ni Eber: ang usa ginganlag Peleg kay sa iyang panahon ang katawhan sa kalibotan nabahin man ug ang ngalan sa iyang igsoon mao si Joctan.
GEN_010_0034	029<TAB>Ofir, Havila, asin Jobab.	026<TAB>Si Joctan mao ang amahan ni Almodad, Selap, Hasarmabet, Jera,
GEN_010_0035	029<TAB>Gabos sinda gikan ki Joktan.	027<TAB>Hadoram, Uzal, Dicla,
GEN_010_0036	030<TAB>An teritoryo na saindang pinag-erokan nagpoon sa Mesa pasiring sa Sefar sagkod sa kabubuldan sa sirangan.	028<TAB>Obal, Abimael, Sheba,
GEN_010_0037	031<TAB>Ini an mga aki ni Sem, na an lambang nasyon na may sadiring daga asin lengwahe.	029<TAB>Ofir, Habila ug ni Jobab.
GEN_010_0038	032<TAB>Iyo ini an mga pamilya kan mga aking lalaki ni Noe, sosog sa saindang mga kapagarakian.	029<TAB>Silang tanan mga anak ni Joctan.
GEN_010_0039	032<TAB>Sa sainda nagpoon an gabos na nasyon sa kinaban na nakalakop sa daga pakatapos kan baha.	030<TAB>Ang yuta nga ilang gipuy-an nagsukad sa Mesa paingon sa Separ sa kabukiran dapit sa silangan.
GEN_010_0040	<MISSING_TRANSLATION>	031<TAB>Mao kini sila ang mga kaliwat ni Sem nga nagpuyo sa ilang nagkalainlaing mga kabanayan ug kanasoran.
GEN_010_0041	<MISSING_TRANSLATION>	031<TAB>Ang matag usa ka pundok may kaugalingong pinulongan.
GEN_010_0042	<MISSING_TRANSLATION>	032<TAB>Kining tanan mao ang mga banay sa mga kaliwat ni Noe sumala sa ilang tagsatagsa ka kaliwat ug nasod.
GEN_010_0043	<MISSING_TRANSLATION>	032<TAB>Ang tanang kanasoran sa kalibotan naggikan niining mga anak ni Noe human sa lunop.
GEN_011_0001	verse<TAB>content	verse<TAB>content
GEN_011_0002	001<TAB>Kaidto, saro sana an lengwahe kan mga tawo sa kinaban.	001<TAB>Sa sinugdan may usa lamang ka pinulongan sa tibuok kalibotan.
GEN_011_0003	002<TAB>Sa pagparalakaw kan mga tawo sa sirangan, nakaabot sinda sa sarong kapatagan sa daga kan Babilonia asin duman na sinda nag-erok.	002<TAB>Sa pagpamalhin sa mga tawo gikan sa sidlakan, nahiabot sila sa usa ka patag sa Shinar ug mipuyo sila didto.
GEN_011_0004	003<TAB>Nag-orolay-olay sinda, Gumibo kita nin mga ladrilyo asin lutoon ta nin marahay.	003<TAB>Ug nag-ingnanay sila, Dali!
GEN_011_0005	003<TAB>Kaya nagkaigwa sinda nin mga ladrilyo embes na gapo asin aspalto embes na semento.	003<TAB>Maghimo kitag tisa ug ipaagi nato kinig kalayo aron mogahi.
GEN_011_0006	004<TAB>Dangan nagsabi sinda, Gumibo kita nin sarong syudad, na igwa nin tore na abot sa langit, tanganing mabantog kita asin dai magkasiriblag sa bilog na kinaban.	003<TAB>Busa nakabaton silag tisa ug aspalto aron ipatapot niini.
GEN_011_0007	005<TAB>Naghilig an Kagurangnan tanganing hilingon an syudad asin an tore na ginibo kan mga tawo.	004<TAB>Unya miingon sila, Karon magbuhat kitag siyudad nga may tore nga sangko sa langit.
GEN_011_0008	006<TAB>Nagtaram siya, An mga tawong ini nagkakasararo asin saro sana an saindang lengwahe; iyo ini an kapinonan kan saindang mga gigibohon.	004<TAB>Himoon tang bantogan ang atong ngalan aron dili kita magkatibulaag sa tibuok kalibotan.
GEN_011_0009	006<TAB>Dai mahahaloy magigibo na ninda an ano man na saindang mawoton.	005<TAB>Unya nanaog ang Ginoo aron pagtan-aw sa siyudad ug sa tore nga gitukod sa mga tawo
GEN_011_0010	007<TAB>Magduman kita asin ribongon ta an saindang lengwahe tanganing dai na sinda magkasinarabotan.	006<TAB>ug miingon ang Ginoo , Karon usa na sila ka katawhan ug usa ra ang ilang pinulongan ug sinugdanan lamang kini sa ilang pagabuhaton.
GEN_011_0011	008<TAB>Kaya iwinarak nin Kagurangnan an mga tawo sa bilog na kinaban asin binayaan kan mga ini an pagtugdok kan syudad.	006<TAB>Dili madugay makahimo na sila sa tanan nga gusto nilang buhaton.
GEN_011_0012	009<TAB>An syudad nginaranan Babilon, huli ta duman rinibong nin Kagurangnan an lengwahe kan gabos na tawo, asin hale duman iwinarak niya sinda sa bilog na kinaban.	007<TAB>Busa manganaog kita ug libogon ta ang ilang pinulongan aron dili sila magkasinabtanay.
GEN_011_0013	010<TAB>Iyo ini an mga kapagarakian ni Sem.	008<TAB>Busa gipatibulaag sila sa Ginoo sa tibuok kalibotan ug mihunong sila pagtukod sa siyudad.
GEN_011_0014	010<TAB>Duwang taon pakatapos kan baha, kan sanggatos na an edad ni Sem, nagkaigwa siya nin aking lalaki na iyo si Arpaksad.	009<TAB>Babel ang ngalan sa siyudad kay didto gilibog man sa Ginoo ang pinulongan sa tanang tawo ug gikan didto gipatibulaag niya sila sa tibuok kalibotan.
GEN_011_0015	011<TAB>Dangan nabuhay pa siya sa laog nin kinyentos na taon asin nagkaigwa pa nin ibang mga aki.	010<TAB>Mao kini ang mga kaliwat ni Sem.
GEN_011_0016	012<TAB>Kan treynta y singkong taon na si Arpaksad, namundag an aki niyang si Sela.	010<TAB>Duha ka tuig human sa lunop, sa dihang 100 na ka tuig si Sem, nakaliwat siyag lalaki nga si Arfacsad.
GEN_011_0017	013<TAB>Dangan nabuhay pa siya sa laog nin kwatro syentos tres na taon asin nagkaigwa pa nin ibang mga aki.	011<TAB>Unya nakaabot pa siya ug laing 500 ka tuig ug nakaliwat pa siyag ubang mga anak.
GEN_011_0018	014<TAB>Kan treyntang taon na si Sela, namundag an aki niyang si Eber.	012<TAB>Sa 35 na ang panuigon ni Arfacsad, nakaliwat siyag lalaki nga si Shela.
GEN_011_0019	015<TAB>Dangan nabuhay pa siya sa laog nin kwatro syentos tres na taon asin nagkaigwa pa nin ibang mga aki.	013<TAB>Unya nakaabot pa siya ug laing 403 ka tuig ug may lain pa siyang mga anak.
GEN_011_0020	016<TAB>Kan treynta y kwatrong taon na si Eber, namundag an aki niyang si Peleg.	014<TAB>Sa 30 na ang panuigon ni Shela, natawo ang iyang anak nga lalaki nga si Eber.
GEN_011_0021	017<TAB>Dangan nabuhay pa siya sa laog nin kwatro syentos treyntang taon asin nagkaigwa pa nin ibang mga aki.	015<TAB>Human matawo si Eber, nakaabot pa si Shela ug laing 403 ka tuig ug may lain pa siyang mga anak.
GEN_011_0022	018<TAB>Kan treyntang taon na an edad ni Peleg, namundag an aki niyang si Reu.	016<TAB>Sa 34 na ang panuigon ni Eber, may anak siyang lalaki nga si Peleg.
GEN_011_0023	019<TAB>Dangan nabuhay pa siya sa laog nin dos syentos nwebeng taon asin nagkaigwa pa nin ibang mga aki.	017<TAB>Human matawo si Peleg, nakaabot si Eber ug laing 430 ka tuig ug nakaliwat pag ubang mga anak.
GEN_011_0024	020<TAB>Kan treynta y dos na an edad ni Reu, namundag an aki niyang si Serug.	018<TAB>Sa 30 na ang panuigon ni Peleg, nakaliwat siyag lalaki nga si Reu.
GEN_011_0025	021<TAB>Dangan nabuhay pa siya sa laog nin dos syentos syeteng taon asin nagkaigwa pa nin ibang mga aki.	019<TAB>Human matawo si Reu, nakaabot pa si Peleg ug laing 209 ka tuig ug nakaliwat pag ubang mga anak.
GEN_011_0026	022<TAB>Kan treyntang taon na an edad ni Serug, namundag an aki niyang si Nahor.	020<TAB>Sa 32 na ang panuigon ni Reu, nakaliwat siyag lalaki nga si Serug.
GEN_011_0027	023<TAB>Dangan nabuhay pa siya sa laog nin dos syentos na taon asin nagkaigwa pa nin ibang mga aki.	021<TAB>Human niini, nakaabot pa si Reu ug laing 207 ka tuig ug nakaliwat pag ubang mga anak.
GEN_011_0028	024<TAB>Kan beynte y nwebeng taon na an edad ni Nahor, namundag an aki niyang si Tera.	022<TAB>Sa 30 na ang panuigon ni Serug, nakaliwat siyag lalaki nga si Nahor.
GEN_011_0029	025<TAB>Dangan nabuhay pa siya sa laog nin syento dyes y nwebeng taon asin nagkaigwa pa nin ibang mga aki.	023<TAB>Human matawo si Nahor, nakaabot pa si Serug ug laing 200 ka tuig ug nakaliwat pag ubang mga anak.
GEN_011_0030	026<TAB>Kan setenta na an edad ni Tera, namundag an mga aki niya na iyo si Abram, si Nahor asin si Haran.	024<TAB>Sa 29 na ang panuigon ni Nahor, nakaliwat siyag lalaki nga si Tera.
GEN_011_0031	027<TAB>Iyo ini an mga kapagarakian ni Tera, na ama ni Abram, Nahor asin Haran.	025<TAB>Human niini, nakaabot pa si Nahor ug laing 119 ka tuig ug nakaliwat pag ubang mga anak.
GEN_011_0032	027<TAB>Si Haran iyo an ama ni Lot.	026<TAB>Sa lapas na sa 70 ang panuigon ni Tera, nakaliwat siyag mga lalaki nga si Abram, si Nahor ug si Haran.
GEN_011_0033	028<TAB>Naenot na nagadan si Haran ki sa ama niyang si Tera, duman sa dagang namundagan niya, sa Ur kan Babilonia.	027<TAB>Mao kini ang mga kaliwat ni Tera: si Abram, si Nahor ug si Haran.
GEN_011_0034	029<TAB>Naagom ni Abram si Sarai asin naagom ni Nahor si Milca na aki ni Haran asin tugang ni Isca.	027<TAB>Si Haran maoy amahan ni Lot
GEN_011_0035	030<TAB>Alagad baog si Sarai kaya dai siya nagkaaki.	028<TAB>ug si Haran namatay didto sa iyang lungsod nga natawhan nga mao ang Ur sa Caldea samtang buhi pa ang iyang amahan.
GEN_011_0036	031<TAB>Kan maghale si Tera sa Ur kan Babilonia tanganing magduman sa Canaan, ipinag-iba niya si Abram na saiyang aki, an makoapo niyang si Lot na aki ni Haran asin an manugang niyang si Sarai; alagad kan makaabot sinda sa Haran, duman na sinda nag-erok.	029<TAB>Nangasawa si Abram kang Sarai ug si Nahor nangasawa usab kang Milca, ang anak ni Haran nga amahan usab ni Isca.
GEN_011_0037	032<TAB>Nagadan si Tera sa Haran sa edad na dos syentos singkong taon.	030<TAB>Walay anak si Sarai kay dili man siya makapanganak.
GEN_011_0038	<MISSING_TRANSLATION>	031<TAB>Gidala ni Tera ang iyang anak nga si Abram, ang iyang apo nga si Lot nga anak ni Haran ug ang iyang umagad nga si Sarai, ang asawa ni Abram ug mibiya sila sa siyudad sa Ur sa Caldea ug mipadulong sa yuta sa Canaan.
GEN_011_0039	<MISSING_TRANSLATION>	031<TAB>Nahiabot sila kutob sa Haran ug mipuyo sila didto
GEN_011_0040	<MISSING_TRANSLATION>	032<TAB>ug namatay si Tera sa panuigong 205.
GEN_012_0001	verse<TAB>content	verse<TAB>content
GEN_012_0002	001<TAB>Tinaraman nin Kagurangnan si Abram, Bayaan mo an saimong daga, an saimong mga kadugo asin an harong kan saimong ama dangan magduman ka sa dagang ipapahiling ko saimo.	001<TAB>Ang Ginoo miingon kang Abram, Biyai ang imong nasod ug ang imong mga paryenti ug ang balay sa imong amahan ug lakaw ngadto sa usa ka nasod nga ipakita ko kanimo.
GEN_012_0003	002<TAB>Gigibohon takang sarong dakulang nasyon, bebendisyonan taka asin gigibohon kong bantog an saimong ngaran tanganing ika magin sarong bendisyon.	002<TAB>Hatagan ko ikaw ug daghang kaliwat ug mahimo silang dakong nasod.
GEN_012_0004	003<TAB>Bebendisyonan ko an mga mabendisyon saimo,	002<TAB>Panalanginan ko ikaw ug himoon kong bantogan ang imong ngalan aron mahimo kang panalangin alang sa uban.
GEN_012_0005	004<TAB>Asin isusumpa ko an mga masumpa saimo;	003<TAB>Panalanginan ko kadtong magapanalangin kanimo,
GEN_012_0006	005<TAB>Sa paagi mo, bebendisyonan ko man an gabos na nasyon sa daga.	004<TAB>apan tunglohon ko kadtong magtunglo kanimo.
GEN_012_0007	006<TAB>Kaya kan setenta y singko na an edad ni Abram, binayaan niya an Haran sosog sa itinaram saiya nin Kagurangnan ; nag-iba saiya si Lot.	005<TAB>Pinaagi kanimo, panalanginan ko ang tanan nga nasod sa kalibotan.
GEN_012_0008	007<TAB>Ipinag-iba ni Abram si Sarai na saiyang agom, asin an sobrino niyang si Lot patin an mga oripon na napasainda sa Haran; dara man ninda an gabos nindang pagsadiri.	006<TAB>Sa nagpanuigon nag 75 si Abram, mibiya siya sa Haran sumala sa gisugo kaniya sa Ginoo ug mikuyog si Lot kaniya.
GEN_012_0009	007<TAB>Dangan naglakaw sinda pasiring sa daga nin Canaan.	007<TAB>Gidala ni Abram si Sarai nga iyang asawa ug ang iyang pag-umangkon nga si Lot ingon man ang tanan nilang katigayonan ug mga ulipon nga ilang napanag-iya didto sa Haran ug migikan sila paingon sa yuta sa Canaan.
GEN_012_0010	008<TAB>Pag-abot ninda duman,	008<TAB>Sa pag-abot nila sa Canaan,
GEN_012_0011	009<TAB>nagpadagos pa sa paglakaw si Abram sagkod na makaabot siya sa sagradong kahoy nin More, an banal na lugar sa Shekem.	009<TAB>milatas si Abram sa maong yuta hangtod nga nahiabot sa sagradong kahoy sa Moreh, ang balaang dapit sa siyudad sa Siquem.
GEN_012_0012	009<TAB>Kaidtong panahon duman pa nag-eerok an mga Cananeo.	009<TAB>Niadtong panahona ang mga Canaanhon nagpuyo pa sa maong yuta.
GEN_012_0013	010<TAB>Nagpahiling an Kagurangnan ki Abram asin nagtaram saiya, Iyo ini an daga na itatao ko sa saimong mga kapagarakian.	010<TAB>Unya ang Ginoo mipakita kang Abram ug miingon kaniya, Mao kining yutaa ang ihatag ko sa imong mga kaliwat.
GEN_012_0014	010<TAB>Kaya naggibo siya duman nin altar para sa Kagurangnan na nagpahiling saiya.	010<TAB>Ug didto nagbuhat si Abram ug halaran alang sa Ginoo nga mipakita kaniya.
GEN_012_0015	011<TAB>Dangan nagpasiring siya sa mabulod na lugar sa sirangan kan Betel asin itinugdok an saiyang tolda sa pagultanan kan Betel na nasa solnopan asin kan Ai na nasa sirangan.	011<TAB>Human niini, mipadayon siya paingon sa habagatan ngadto sa bukid sa silangan sa siyudad sa Betel ug nagkampo siya didto sa tungatunga sa Betel sa kasadpan ug sa Ai sa silangan.
GEN_012_0016	011<TAB>Guminibo siya duman nin altar asin nagsamba sa Kagurangnan .	011<TAB>Nagbuhat usab siya didtog halaran ug gisimba niya ang Ginoo .
GEN_012_0017	012<TAB>Dangan nagpadagos sa paglakaw si Abram pasiring sa habagat na parte kan Canaan.	012<TAB>Unya mipadayon siya latas sa nagkalainlaing dapit padulong sa habagatan paingon sa Negeb.
GEN_012_0018	013<TAB>Nagkaigwa nin gutom sa Canaan, asin makuring gayo an gutom duman, kaya nagpasiring sa Egipto si Abram tanganing duman ngona mag-erok.	013<TAB>Apan nahitabo nga dihay gutom didto sa Canaan.
GEN_012_0019	014<TAB>Kan malaog na siya sa Egipto, sinabihan niya si Sarai na saiyang agom, Saro kang magayon na babae.	013<TAB>Tungod kay misamot man ang gutom, miadto si Abram sa Ehipto aron didto magpuyo sa makadiyot.
GEN_012_0020	015<TAB>Kun mahiling ka kan mga Egipcio, sasabihon nindang agom taka kaya gagadanon ninda ako alagad bubuhayon ka.	014<TAB>Sa dayon na niyang latas sa utlanan sa Ehipto, giingnan niya ang iyang asawa nga si Sarai, Maanyag ka nga babaye.
GEN_012_0021	016<TAB>Sabihan mo sindang tugang taka tanganing huli saimo magin marahay an pag-ako ninda sako asin dai ninda ako paggadanon.	015<TAB>Inigkakita sa mga Ehiptohanon kanimo, moingon gayod sila, Asawa kini niya, ug patyon ako nila apan ikaw dili.
GEN_012_0022	017<TAB>Kan maglaog na si Abram sa Egipto, nahiling kan mga Egipcio na talagang magayon an saiyang agom.	016<TAB>Busa sultihi sila nga igsoon ko ikaw aron dili ako nila patyon kondili ayohon hinuon pagtagad tungod kanimo.
GEN_012_0023	018<TAB>Nahiling man siya kan mga opisyal kan hade nin Egipto asin inosip ninda saiya na talagang magayon si Sarai, kaya dinara ninda ini sa palasyo.	017<TAB>Sa dihang miabot na si Abram sa Ehipto, nakita tuod sa mga Ehiptohanon nga maanyag ang iyang asawa.
GEN_012_0024	019<TAB>Huli ki Sarai, nagin marahay an pag-ako ki Abram kan hade.	018<TAB>Nakakita kaniya ang mga opisyal sa palasyo ug gisuginlan nila si Paraon nga matahom siya kaayo ug busa gidala si Sarai ngadto sa palasyo ni Paraon.
GEN_012_0025	019<TAB>Tinawan siya kaini nin mga karnero, kanding, baka, asno, oripon asin kamelyo.	019<TAB>Tungod kaniya gitagad pag-ayo ni Paraon si Abram ug gihatagan ug mga karnero ug kanding, mga baka, ug asno, mga ulipon nga lalaki ug babaye ug mga kamelyo.
GEN_012_0026	020<TAB>Alagad huli ta kinua kan hade si Sarai, siya asin an mga yaon sa saiyang palasyo pinadarahan nin Kagurangnan nin mga makangirhat na helang.	020<TAB>Apan tungod kay gikuha man ni Paraon si Sarai, gipahamtangan sa Ginoo ug makalilisang nga mga sakit si Paraon ingon man ang namuyo sa iyang palasyo.
GEN_012_0027	021<TAB>Kaya ipinaapod kan hade si Abram asin hinapot, Ano ining ginibo mo sako?	021<TAB>Busa gipatawag niya si Abram ug gipangutana, Unsa ba kining imong gihimo kanako?
GEN_012_0028	021<TAB>Tano ta dai ka nagtaram na agom mo an babaeng ini?	021<TAB>Nganong wala mo man ako tug-ani nga imo diay siyang asawa?
GEN_012_0029	022<TAB>Tano ta nagsabi kang tugang mo siya, kun kaya kinua ko siya na magin agom ko?	022<TAB>Nganong miingon ka man nga siya imong igsoon ug tungod niini gikuha ko siya aron mahimong akong asawa?
GEN_012_0030	022<TAB>Uya an agom mo; kuaha siya asin hale na kamo!	022<TAB>Ania ang imong asawa; kuhaa siya ug panlakaw kamo!
GEN_012_0031	023<TAB>Nagboot an hade sa mga tawohan niya manongod ki Abram, kaya pinahale ninda ini sa Egipto kaiba an saiyang agom asin an gabos niyang rogaring.	023<TAB>Ug nagsugo si Paraon sa iyang mga tawo nga ubanan si Abram ug gidala nila siya ug gipagawas sa Ehipto uban sa iyang asawa ug sa tanan nga iyaha.
GEN_013_0001	verse<TAB>content	verse<TAB>content
GEN_013_0002	001<TAB>Pakahale sa Egipto, naglakaw si Abram pasiring sa habagat na parte kan Canaan kaiba an saiyang agom asin an gabos niyang rogaring; nag-iba man saiya si Lot.	001<TAB>Gikan sa Ehipto mipaingon si Abram sa amihanan ngadto sa Negeb uban sa iyang asawa ug sa tanan nga iyaha.
GEN_013_0003	002<TAB>Mayaman nang marahay si Abram huli ta kadakul na kan saiyang mga hayop, plata asin bulawan.	001<TAB>Mikuyog usab kaniya si Lot.
GEN_013_0004	003<TAB>Hale sa duman, nagpadagos siyang maglakaw sagkod na makaabot sa pagultanan kan Betel asin Ai, sa lugar na tinugdokan niya kaidto kan saiyang tolda,	002<TAB>Dato na kaayo si Abram.
GEN_013_0005	004<TAB>asin pinatindogan niya nin altar.	002<TAB>May mga karnero siya, mga kanding, mga baka ug mga plata ug bulawan.
GEN_013_0006	004<TAB>Duman nagsamba si Abram sa Kagurangnan .	003<TAB>Mipadayon si Abram gikan sa Negeb ngadto sa Betel, sa dapit nga iyang gitoldahan kaniadto, tungatunga sa Betel ug sa Ai.
GEN_013_0007	005<TAB>Si Lot, na nag-iba ki Abram, igwa man nin mga karnero, kanding asin baka.	004<TAB>Mibalik siya sa dapit diin nagbuhat siya kaniadto ug halaran ug gisimba niya didto ang Ginoo .
GEN_013_0008	005<TAB>Igwa man siya nin pamilya asin mga oripon.	005<TAB>Si Lot nga mikuyog kang Abram may mga karnero usab, mga kanding ug mga baka ug may mga tawo nga uban kaniya sa iyang pagkampo.
GEN_013_0009	006<TAB>Huli ta kadakul na kan mga hayop na pagsadiri ni Abram asin ni Lot, an daga dai na magkanigo para sa saindang duwa.	006<TAB>Ug tungod kay daghan na man kaayog kahayopan sila si Abram ug si Lot, dili na paigo ang sibsibanan alang sa ilang mga kahayopan kon magtipon sila pagpuyo.
GEN_013_0010	007<TAB>Kaya nagkaigwa nin pag-iriwal an mga pastor ni Abram asin ni Lot.	007<TAB>Busa nagkaaway ang mga magbalantay sa kahayopan ni Abram ug ang mga magbalantay sa kahayopan ni Lot.
GEN_013_0011	007<TAB>Kaidto, an mga Cananeo asin Perezeo iyo an nag-eerok sa lugar na idto.	007<TAB>Niadtong panahona ang mga Canaanhon ug mga Perisihanon nagpuyo pa sa maong yuta.
GEN_013_0012	008<TAB>Dangan sinabihan ni Abram si Lot, Magkadugo kitang duwa, kaya dai dapat na mag-iriwal an satong mga pastor.	008<TAB>Unya miingon si Abram kang Lot, Dili angay mag-away ang imong mga tawo ug ang akoa kay paryenti man kita.
GEN_013_0013	009<TAB>Mas marahay pang magsuhay kita; pilion mo an arin man na parte kan daga na magustohan mo; kun pumawala ka, mapatoo ako; kun pumatoo ka, mapawala ako.	009<TAB>Busa magbulag kita.
GEN_013_0014	010<TAB>Nangalagkalag si Lot asin nahiling niya na mayaman sa tubig an bilog na Kapantayan nin Jordan sagkod sa Zoar, arog kan tatamnan kan Kagurangnan o arog kan daga nin Egipto.	009<TAB>Pagpilig yuta nga buot mong puy-an ug biya kanako.
GEN_013_0015	010<TAB>Ini an kamugtakan kan daga bago tunawon nin Kagurangnan an Sodoma asin an Gomorra.	009<TAB>Kon adto ka sa usa ka dapit, adto ako sa lain.
GEN_013_0016	011<TAB>Kaya pinili ni Lot an bilog na Kapantayan nin Jordan, asin naglakaw siya pasiring sa sirangan; sa siring na paagi nagsuhay sindang duwa.	010<TAB>Busa gilukop ni Lot pagtan-aw ang palibot ug nakita niya nga ang tibuok Walog sa Jordan hangtod ngadto sa Zoar daghag tubig sama sa tanaman sa Ginoo o sama sa yuta sa Ehipto.
GEN_013_0017	012<TAB>Nagpawalat si Abram sa Canaan mantang si Lot nag-erok sa mga syudad duman sa kapantayan na harani sa Sodoma.	010<TAB>Nahitabo kini sa wala pa laglaga sa Ginoo ang mga siyudad sa Sodoma ug Gomora.
GEN_013_0018	013<TAB>An nag-eerok sa Sodoma mga maraot na tawo asin mga parakasala sa Kagurangnan .	011<TAB>Gipili ni Lot ang tibuok Walog sa Jordan ug mipanaw siya padulong sa sidlakan.
GEN_013_0019	014<TAB>Pakahale ni Lot, nagtaram an Kagurangnan ki Abram, Mangalagkalag ka sa palibot mo,	011<TAB>Sa ingon niining paagiha nagbulag sila si Abram.
GEN_013_0020	015<TAB>huli ta an gabos na daga na nahihiling mo itatao ko sa saimo asin sa mga kapagarakian mo sagkod lamang.	012<TAB>Si Abram didto magpuyo sa Canaan ug si Lot didto sa mga siyudad sa kapatagan.
GEN_013_0021	016<TAB>Papadakulon ko siring sa alpog kan daga an saimong mga kapagarakian.	012<TAB>Nagkampo si Lot duol sa Sodoma.
GEN_013_0022	016<TAB>Dai nin makakabilang sainda huli ta mayo nin makakabilang kan alpog kan daga.	013<TAB>Daotan kaayo ang mga tawo didto ug nagpakasala sila batok sa Ginoo .
GEN_013_0023	017<TAB>Lakaw asin hilinga an bilog na daga ta itatao ko gabos iyan saimo.	014<TAB>Sa mibiya na si Lot, ang Ginoo miingon kang Abram, Gikan sa imong nahimutangan, lantawa pag-ayo ang tanang dapit.
GEN_013_0024	018<TAB>Kaya naghale duman si Abram asin nag-erok harani sa sagradong mga kahoy ni Mamre sa Hebron.	015<TAB>Ihatag ko kanimo ug sa imong mga kaliwat ang tanang yuta nga imong makita ug maimo na kini sa dayon.
GEN_013_0025	018<TAB>Nagpatindog siya nin altar duman para sa Kagurangnan .	016<TAB>Padaghanon ko ang imong mga kaliwat ug walay makaihap kanila.
GEN_013_0026	<MISSING_TRANSLATION>	016<TAB>Mas sayon pa ang pag-ihap sa abog kay sa pag-ihap unya sa imong mga kaliwat.
GEN_013_0027	<MISSING_TRANSLATION>	017<TAB>Busa pangandam ug suroya ang tibuok yuta kay ihatag ko kining tanan kanimo.
GEN_013_0028	<MISSING_TRANSLATION>	018<TAB>Mibalhin si Abram ug mipuyo siya duol sa sagradong mga kahoy ni Mamre didto sa Hebron ug nagbuhat siya didto ug halaran alang sa Ginoo .
GEN_014_0001	verse<TAB>content	verse<TAB>content
GEN_014_0002	001<TAB>Igwa nin apat na hade, si Amrafel kan Babilonia, si Ariok kan Ellasar, si Kedorlaomer kan Elam, asin si Tidal kan Goiim,	001<TAB>Si Amrafel nga hari sa Shinar, si Arioc nga hari sa Elasar, si Cadorlahomor nga hari sa Elam ug si Tidal nga hari sa Goyim
