id	source_text	target_text
EXO_020_0008	006<TAB>Alagad ipinapahiling ko an danay kong pagkamoot sa rinibong henerasyon kan mga namomoot sako asin nag-ootob kan sakong mga togon.	006<TAB>Balet aroen ko ray nilibon kailalakan na saray mangarod siak tan mangonur na saray ganggan ko.
EXO_020_0009	007<TAB>Dai nindo paggamiton an sakong ngaran nin basang lamang, huli ta ako, an Kagurangnan na saindong Dios, mapadusa sa kiisay man na magbasang-basang kan sakong ngaran.	007<TAB>Ag mo ikakanad maoges iran getma so ngaran ko a Yahweh a Dios mo, ta dusaen koy siopaman a mangikanad ngaran ko diad andi-kakanaan a pamaakaran.
EXO_020_0010	008<TAB>Giromdoma nindo an Sabbath asin pakabanala nindo iyan.	008<TAB>Ngilinan moy Agew na Panagpainawa tan ipasen mon masanto.
EXO_020_0011	009<TAB>Igwa kamo nin anom na aldaw tanganing gibohon an saindong mga trabaho,	009<TAB>Anem agew a makapankimey ka,
EXO_020_0012	010<TAB>alagad an ikapitong aldaw, sarong aldaw nin pahingalo na talaan para sako.	010<TAB>balet say kumapiton agew et agew na panagpainawa a nisaklang ed siak.
EXO_020_0013	010<TAB>Sa aldaw na iyan, mayo nin siisay man saindo na magtrabahokamo, an saindong mga aki, an saindong mga oripon, an saindong mga hayop o an mga dayuhan na nag-eerok sa saindong banwa.	010<TAB>Diad sayan agew nepeg ya anggapoy toon mankimey: sika, saray anak mo, saray aripen mo, saray ayayep mo, odino saray sangkailin manaayam ed bansam.
EXO_020_0014	011<TAB>Huli ta sa anom na aldaw ginibo ko an daga, an langit, an kadagatan sagkod an gabos na yaon diyan, alagad sa ikapitong aldaw, nagpahingalo ako.	011<TAB>Diad loob na anemiran agew siak a Katawan et pinalsak so tawen tan dalin, saray dayat tan amin a logan da, balet diad kumapiton agew nampainawa ak.
EXO_020_0015	011<TAB>Kaya benendisyonan ko an Sabbath asin pinabanal iyan.	011<TAB>Sikato yay makasengeg a siak a Katawan et binindisionan koy Agew na Panagpainawa tan ginawak a masanto.
EXO_020_0016	012<TAB>Galangan nindo an saindong ama asin ina, tanganing mabuhay kamo nin halawig sa dagang itatao ko sa saindo.	012<TAB>Igalang moy amam tan say inam, pian andokey so pambilay mo ed dalin ya iter kod sika.
EXO_020_0017	013<TAB>Dai kamo maggadan.	013<TAB>Ag ka mamapatey.
EXO_020_0018	014<TAB>Dai kamo magdorog sa bako nindong agom.	014<TAB>Ag ka mikakaloguran.
EXO_020_0019	015<TAB>Dai kamo maghabon.	015<TAB>Ag ka mantatakew.
EXO_020_0020	016<TAB>Dai kamo magsaksi nin putik laban sa saindong kapwa.	016<TAB>Ag ka mantitila no mantasi ka sumpad kaparam a too.
EXO_020_0021	017<TAB>Dai kamo maara sa harong kan ibang tawo; dai kamo maara sa saiyang agom, sa saiyang mga oripon, asin sa saiyang mga baka, mga asno o sa ano man na pagsadiri niya.	017<TAB>Ag mo iibegan so abung na kaparam a too; ag mo iibegan so asawa to, saray aripen to, saray baka to, saray asno to, odino antokaman a kayaryan to.
EXO_020_0022	018<TAB>Kan madangog kan mga tawo an daguldol saka an tanog kan trompeta asin kan mahiling ninda an kikilat sagkod an nag-aasong bukid, nagtarakig sinda sa takot; kaya nagtirindog sinda sa harayo.	018<TAB>Nen nadngel na saray totoo so karul tan say tanul na trumpita tan anengneng day kirmat tan manasasewek a palandey, manggiwgiw irad takot da tan nanalagey irad arawdawin pasen.
EXO_020_0023	019<TAB>Nagsarabi sinda ki Moises, Ika an magtaram samo asin madangog kami; alagad dai mo pagpataramon samo an Dios huli ta tibaad magadan kami.	019<TAB>Inkuandad kinen Moises, No mansalita kad sikami, ondengel kami; balet ag mo pansasalitaen ed sikami so Dios, ta ompan ompatey kami.
EXO_020_0024	020<TAB>Nagsimbag si Moises, Dai kamo matakot; huli ta an Dios napadigdi sa pagbalo sa saindo.	020<TAB>Inmebat si Moises, Ag kayo natatakot; sinmabi so Dios, ta suboken to kayo tan labay to kayon mangonur lawas ed sikato, pian ag kayo mankasalanan.
EXO_020_0025	020<TAB>Boot niyang magkaigwa kamo nin takot sa saiya tanganing dai kamo magkasala.	021<TAB>Balet nansiansian nanalagey ed arawdawi a pasen iray katoowan, tan si Moises labat so sinmingger ed abay na makapal a lorem a kawalaan na Dios.
EXO_020_0026	021<TAB>Alagad padagos na nagtindog sa harayo an mga tawo; si Moises sana an nagdolok sa mahibog na panganoron saen yaon an Dios.	022<TAB>Say Katawan ingganggan toy Moises ya ibaga tod saray Israelita: Anengneng yon dili a siak a Katawan et nansalita ed sikayo manlapud tawen.
EXO_020_0027	022<TAB>Nagboot an Kagurangnan ki Moises na taraman an mga Israelita, Nahiling nindo kun paano ako, an Kagurangnan , nagtaram sa saindo hale sa langit.	023<TAB>Ag yo igagawaay sikayon dili na saray diriyos a pilak odino balituk, insan kaibak iran galangen yo.
EXO_020_0028	023<TAB>Dai kamo maggibo nin mga dios-dios na plata o bulawan na sasambahon bilang dugang sa sako.	024<TAB>Manggawa kayo na dalin ya altar a para siak tan diad tapew to so pambagatan yo na karniro yo tan baka yo a sikaray bagat a popoolan tan bagat a para kareenan.
EXO_020_0029	024<TAB>Gumibo kamo nin altar na daga para sako; sa ibabaw kaiyan idolot nindo an saindong karnero saka an saindong baka bilang tinutong na atang asin atang para sa katoninongan.	024<TAB>Diad amin a pasen ya ibiig kon pangigalangan yod siak, onla ak ed sikayo tan bindisionan ta kayo.
EXO_020_0030	024<TAB>Sa lambang lugar na pinili ko na pagsasambahan nindo sako, madatong ako dangan bebendisyonan ko kamo.	025<TAB>No manggawa kayoy baton altar a para siak, aliwan saray tinabas a bato so ikana yo, ta no mangikana kayo na sinsil ed saray bato, pagmaliwen yo ran aliwan manepeg ya ikanak.
EXO_020_0031	025<TAB>Kun maggibo kamo nin altar na gapo para sako, dai kamo maggamit nin sinapsapan na gapo, huli ta kun gamitan nindo nin pansapsap an gapo, bako na iyan maninigo para sako.	026<TAB>Ag kayo manggagawa na altar a para siak a wala ray balitang to; ta no wala ray balitang to, nanengneng so laman yo no ontakayan kayo.
EXO_020_0032	026<TAB>Dai nindo ako ipaggibo nin altar na may mga tangga, huli ta kun magsakat kamo diyan, mahihiling an saindong pagkanihuba.	<MISSING_TRANSLATION>
EXO_021_0001	verse<TAB>content	verse<TAB>content
EXO_021_0002	001<TAB>Ini an mga togon na itatao mo sa mga Israelita	001<TAB>Iter mod saray Israelita iray onggendan a ganggan
EXO_021_0003	002<TAB>Kun magbakal ka nin oripon na Hebreyo, anom na taon siyang maglilingkod saimo.	002<TAB>No manaliw kayo na Hebreon aripen, manlingkur ed sikayo ed loob na anem taon.
EXO_021_0004	002<TAB>Sa ikapitong taon papatalingkason mo siya na dai papabayadon nin maski ano.	002<TAB>Diad kumapiton taon ibolus yo ya anggapoy nepeg a bayaran to.
EXO_021_0005	003<TAB>Kun siya mayong agom kan siya magin oripon mo, mahale siyang mayong agom; alagad kun siya may agom kan siya magin oripon mo, mahale siyang kaiba an saiyang agom.	003<TAB>No anggapoy asawa to nen nagmaliw ya aripen yo, nepeg ya ag to awiten so asawa to no ontaynan; balet no walay asawa to nen nagmaliw ya aripen yo, nepeg ya awiten toy asawa to.
EXO_021_0006	004<TAB>Kun tawan siya kan saiyang kagurangnan nin agom asin nagkaigwa siya nin mga aki, an saiyang agom sagkod mga aki pagsadiri kan kagurangnan niya, asin an lalaki solong mahale.	004<TAB>No itdan na amo na asawa tan naanakan to na lalaki odino bibii, say ina tan saray anak to et kayaryan ira na amo tan samay aripen nepeg ya ontaynan a bukor.
EXO_021_0007	005<TAB>Alagad kun magpahayag an oripon na habo na siyang maghale huli ta namomotan niya an saiyang kagurangnan, agom saka mga aki,	005<TAB>Balet no ibaga ton malinew ya inaro toy amo to, say asawa to, tan saray anak to tan ag to labay so nawalaan na kawayangan,
EXO_021_0008	006<TAB>kun siring, dadarahon siya kan saiyang kagurangnan sa lugar na pinagsasambahan asin papatindogon siya sa may pinto o sa may hamba kan pintoan, dangan lalabotan an saiyang talinga asin magigin oripon siya kan saiyang kagurangnan sagkod na buhay siya.	006<TAB>say amo tod satan awiten tod pasen a panangigalangan.
EXO_021_0009	007<TAB>Kun ipabakal kan ama an saiyang aking babae tanganing magin oripon, dai siya matatalingkasan na arog kan mga lalaking oripon.	006<TAB>Diman say amo pasaralen to may aripen ed puirta odino diad lusek na puirta, insan to tebengan ed layag.
EXO_021_0010	008<TAB>Kun siya ipinabakal sa sarong lalaking boot umagom saiya, alagad dai siya kaini nagustohan, ipapatubos siya sa sadiri niyang ama.	006<TAB>Diad ontan magmaliw lan aripen to ya anggad ag to ipatey.
EXO_021_0011	008<TAB>Dai siya pwedeng ipabakal kan saiyang kagurangnan sa mga dayuhan huli ta bakong tama an pagtratar niya saiya.	007<TAB>No say sakey a laki et ilako ton aripen so anak ton bii, sayan bii et naitdan na kawayangan ya aliwan singa pangiter na kawayangan ed saray lalakin aripen.
EXO_021_0012	009<TAB>Kun an sarong lalaki magbakal nin babaeng oripon tanganing magin agom kan saiyang aking lalaki, kaipuhan trataron niya an oripon bilang tunay na aking babae.	008<TAB>No nilakod sakey a lakin getma ton asawaen, balet ta ag to labay lamlamang, nepeg ya ipadondon tod ama na samay bii; ag nayarin ilako tod sangkaili, lapud nilamang to.
EXO_021_0013	010<TAB>Kun an sarong lalaki mag-agom pa nin iba, dai niya dapat pag-inaan an itinatao niyang pagkakan, gubing asin mga deretso nin agom sa enot niyang agom.	009<TAB>No say sakey a laki et manaliw na sakey a biin aripen, ta iter tod lakin anak to, nepeg ton ipasen ya anak ton dili.
EXO_021_0014	011<TAB>Kun an tolong bagay na ini dai niya maotob sa babae, dapat niya ining patalingkason na dai na papabayadon.	010<TAB>No say sakey a laki et mangala na kumadwan asawa to, nepeg ton ituloy ya itdan so ononan asawa to na gendat a karakel na kakanen tan kakawesen to tan saray gendat a kanepegan to nen bukor to niy asawa to.
EXO_021_0015	012<TAB>An siisay man na magkulog nin iba dangan nagadan siya, dapat na gadanon man.	011<TAB>No say laki et ag to sumpalen iray nepeg ton gawaen ed inmonan asawa to, nepeg ya itdan to na kawayangan tan nepeg ya ag bayaran imay laki.
EXO_021_0016	013<TAB>Alagad kun dai man tinuyong kulogan an sarong tawo asin nagadan ini, an nakagadan pwedeng dumulag sa lugar na pipilion ko asin magigin ligtas siya duman.	012<TAB>Siopamay mangabil na kapara ton too tan apatey to, nepeg a pateyen.
EXO_021_0017	014<TAB>Alagad kun tinuyong salakayon an sarong tawo tanganing pasaluib na gadanon, an nakagadan kuahon nindo dangan gadanon maski nakatago na siya sa sakong altar.	013<TAB>Balet no ag to tinalaranan tan ag to ginagalan apatey imay too, nayarian toy ombatik ed sakey a pasen a pilien kon para sikayo.
EXO_021_0018	015<TAB>An siisay man na magkulog kan sadiring ama o ina dapat gadanon.	014<TAB>Balet no say sakey a too et akapasnuk tan ginagala ton pinatay so kapara ton too, nepeg ya alaen a pateyen anggan binmatik lad altar ko.
EXO_021_0019	016<TAB>An siisay man na magkidnap nin tawo tanganing ipabakal o gibohon na oripon dapat gadanon.	015<TAB>Siopamay mangabil na ama to odino ina to, nepeg a pateyen.
EXO_021_0020	017<TAB>An siisay man na magmaldisyon sa sadiring ama o ina dapat gadanon.	016<TAB>Siopamay mamasoot a mangala na too ya ilako to odino aripenen to, nepeg a pateyen.
EXO_021_0021	018<TAB>Kun igwang mag-iwal dangan nanggapo o nanuntok an saro alagad dai man nakagadan, an nanggapo o nanuntok dai papadusahan.	017<TAB>Siopamay mangisamba ed ama to odino ina to, nepeg a pateyen.
EXO_021_0022	018<TAB>Alagad kun an biktima nahaloy sa higdaan,	018<TAB>No wala ray manlalaban tan say sakey et tapalan to na bato so sakey odino ponitien to, balet ta ag to apatey, nepeg ya ag dusaen.
EXO_021_0023	019<TAB>dangan nakalakaw sa tabang nin sugkod, kaipuhan atamanon siya kan nagkulog sagkod na marahay asin bayadan siya kaini kan saiyang panahon na nasayang.	018<TAB>No say toon akabil et nepeg a manayam ed dokulan,
EXO_021_0024	020<TAB>Kun pakolon nin sugkod kan sarong tawo an saiyang oripon na lalaki o babae, dangan nagadan tolos an saiyang oripon, an kagurangnan dapat na padusahan.	019<TAB>insan makabangon lamlamang tan makaakar ed paway ya akabaston, say angabil ed sikato et nepeg a bayaran to so panaon ya ag to pakapankimey tan asikasoen to ya anggad ag to iyabig.
EXO_021_0025	021<TAB>Alagad kun nabuhay pa an oripon sa laog nin saro o duwang aldaw, dai na papadusahan an kagurangnan; an mawaraan siya nin oripon maninigo nang padusa saiya.	020<TAB>No say sakey a too et pekpeken toy aripen ton laki odino bii tan inatey ed samay bektan impamekpek to, nepeg a dusaen.
EXO_021_0026	022<TAB>Kun an mga nag-iiwal makakulog nin sarong bados na nagin dahelan na ini makuahan, alagad mayo na nin ibang maraot na nangyari sa babae, an nakakulog mabayad kan kantidad na hahagadon saiya kan agom kan babae sosog sa pagboot kan mga hukom.	021<TAB>Balet no ag ompatey ed loob na sakey odino duaran agew, nepeg ya ag dusaen.
EXO_021_0027	023<TAB>Alagad kun may iba pang maraot na nangyari sa babae, an kabayadan: buhay sa buhay,	021<TAB>Masarag lan dusa to so inkaandi na kayaryan ton aripen.
EXO_021_0028	024<TAB>mata sa mata, ngipon sa ngipon, kamot sa kamot, bitis sa bitis,	022<TAB>No walay pigaran totoon manlalaban tan apasakitan day sakey a biin malokun, et nakalan, balet ta ag nanliknay arum a kairapan, samay akapasakit ed sikato et nepeg a bayaran toy labay na asawa to may bii, onung na pangabubon na saray huis.
EXO_021_0029	025<TAB>paso sa paso, lugad sa lugad, kulog sa kulog.	023<TAB>Balet no manliknay arum a kairapan imay ina, saya so dusa: say bilay bayaran na bilay,
EXO_021_0030	026<TAB>Kun tamaan kan sarong lalaki an sarong mata kan saiyang oripon na lalaki o babae, dangan nabuta ini, tatalingkasan niya an oripon bilang kabayadan para sa mata.	024<TAB>say mata bayaran na mata, say ngipen bayaran na ngipen, say lima bayaran na lima, say sali bayaran na sali,
EXO_021_0031	027<TAB>Kun natipoan niya nin ngipon an saiyang oripon, tatalingkasan niya an oripon bilang kabayadan para sa ngipon.	025<TAB>say apoolan bayaran na apoolan, say sugat bayaran na sugat, tan say biret ed laman bayaran na biret ed laman.
EXO_021_0032	028<TAB>Kun an sarong lalaki o babae magadan sa suag nin baka, gagapoon an baka asin dai pagkakanon an karne kaiyan, alagad an kagsadiri dai dapat padusahan.	026<TAB>No say sakey a too et kabilen tod mata so aripen ton laki odino bii tan aderal so matan nakna to, nepeg ton ibolus imay aripen a pinagkabayar tod pinmultak a mata.
EXO_021_0033	029<TAB>Kun an baka dati nang parasuag nin tawo asin pinatanidan na an kagsadiri alagad dai man niya iyan linaom, dangan nakagadan iyan nin tawo, gagapoon an torong baka asin gagadanon man an kagsadiri.	027<TAB>No apangpangan to na ngipen, nepeg ton ibolus so aripen a pinagkabayar tod nakal a ngipen.
EXO_021_0034	030<TAB>Alagad kun an kagsadiri tugotan na magmulta tanganing dai siya gadanon, dapat bayadan niya an bilog na kantidad na hahagadon.	028<TAB>No bonoen na sakey a bakan kalakyan so sakey a too tan inatey, say baka nepeg a tupaken, tan ag kanen so laman to; balet ag nepeg a dusaen so akanbaka.
EXO_021_0035	031<TAB>Kun aking lalaki o babae an nagadan kan baka, parehong reglamento an susunodon.	029<TAB>Balet no say bakan kalakyan et kagagawa to lay mambono na too tan apasakbayan la so akanayep et ag to nin siansia ikolung ed koralinsan mamono yan baka tan inatey so binono to, nepeg a tupaken so baka tan nepeg met a pateyen so akanbaka.
EXO_021_0036	032<TAB>Kun an sarong oripon na lalaki o babae nagadan sa suag kan baka, an kagsadiri kan baka mabayad nin treyntang pedaso nin plata sa kagurangnan kan oripon, asin gagapoon an baka sagkod na magadan.	030<TAB>Balet no naabuloyan a mambayar so akanayep pian ag pateyen, nepeg to ya iter so intiron bayar.
EXO_021_0037	033<TAB>Kun an kalot binayaan nin sarong tawo na daing lukdo o kun nagkalot siya asin dai niya iyan tinakopan, dangan nahulog duman an sarong baka o asno,	031<TAB>No ogaw a laki odino bii so apatey na baka, namparan totontonen so tombuken.
EXO_021_0038	034<TAB>an kagsadiri kan kalot mabayad para sa hayop.	032<TAB>No laki odino bii ya aripen so apatey na bakan kalakyan, nepeg a say akanbaka bayaran to na talomplon pilak a kuarta so akankayaryan na inatey ya aripen tan nepeg a tupaken so baka ya anggad ompatey.
EXO_021_0039	034<TAB>Babayadan niya nin kwarta an kagsadiri kan hayop, asin mapapasaiya an nagadan na hayop.	033<TAB>No ekalen na sakey a too so sakub na aralem ya abut odino mangotkot na aralem ya abut, et ag to sakuban, tan napelag diman so sakey a bakan kalakyan odino asno,
EXO_021_0040	035<TAB>Kun an baka nin sarong tawo makagadan nin baka na sadiri nin iba, an buhay na baka ipapabakal kan duwang kagsadiri asin babangaon ninda an kabayadan; babangaon man ninda an karne kan nagadan na hayop.	034<TAB>nepeg a mambayar imay too.
EXO_021_0041	036<TAB>Alagad kun an baka dati nang parasuag asin dai linaom kan kagsadiri, an nagadan na baka riribayan niya nin buhay na baka dangan mapapasaiya an gadan na hayop.	034<TAB>Bayaran to na kuarta so akanayep tan kayaryan to la may inatey ya ayep.
EXO_021_0042	<MISSING_TRANSLATION>	035<TAB>No napatey na sakey a bakan kalakyan so sakey a bakan kalakyan na sananey a too, saramay akanayep nepeg da ya ilako so mabilay a baka tan panapagan day panlakoan; panapagan da met so karni to may inatey.
EXO_021_0043	<MISSING_TRANSLATION>	036<TAB>Balet no samay baka et kagagawa to lay mambono na too tan apasakbayan la may akanayep, et ag to nin siansia ikolung ed koral, nepeg ton itdan na mabilay a bakan kalakyan imay akanayep na inatey, pian nasalatan so naandi tan kayaryan to la may inatey ya ayep.
EXO_022_0001	verse<TAB>content	verse<TAB>content
EXO_022_0002	001<TAB>Kun an sarong tawo maghabon nin sarong baka o sarong karnero, dangan ini saiyang binuno o ipinabakal, mabayad siya nin limang baka para sa sarong baka o apat na karnero para sa sarong karnero.	001<TAB>No say sakey a too et manakew na sakey a baka odino sakey a karniro tan pateyen to odino ilako to, nepeg to a bayaran na limaran baka so sakey a baka tan apatiran karniro so sakey a karniro.
EXO_022_0003	002<TAB>Dapat niyang bayadan an saiyang hinabon; kun dai siyang ibabayad, siya an ipapabakal bilang oripon tanganing mabayadan niya an saiyang hinabon.	002<TAB>Nepeg ton bayaran so tinakew to.
EXO_022_0004	002<TAB>Kun an hinabon na hayop, baka, asno o karnero man, buhay pang nakua sa saiya, an sarong hayop babayadan niya nin duwa.	002<TAB>No anggapon balut so kayaryan to, nepeg ya ilako a sakey ya aripen pian nabayaran so tinakew to.
EXO_022_0005	003<TAB>Kun bangging nadakop asin nagadan an nagsalakat sa sarong harong, dai sasalaon an nakagadan.	002<TAB>No nalmo ed sikato a mabilay so tinakew to a baka odino asno odino karniro, nepeg to a bayaran na duara so sakey.
EXO_022_0006	003<TAB>Alagad kun aldaw ini nangyari, sisimbagon niya an buhay kan nagadan.	003<TAB>No diad labi et nasiwa so sakey a matakew ya onloloob ed sakey ya abung tan apatey, say akapatey ed sikato et ag mankasalanan na impamatey.
EXO_022_0007	004<TAB>Kun an sarong tawo magpasabsab kan saiyang mga hayop sa sarong oma o ubasan o kun binutasan niya an saiyang mga hayop asin nanabsab ini sa oma kan iba, an ano man na naraot sa oma babayadan kan kagsadiri kan hayop; ibabayad niya an pinakamarahay na produkto hale sa saiyang oma o ubasan.	003<TAB>Balet no diad agew so kagawa to, mankasalanan na impamatey.
EXO_022_0008	005<TAB>Kun an sarong tawo magsulo sa saiyang oma, asin magkanap an kalayo sa kadootan pasiring sa oma kan iba dangan nasulo an tindog pang mga tinanom o an mga inaning tinambak na, an nagsulo mabayad kan gabos na nasulo.	004<TAB>No say sakey a too et ipastol to ray ayep to ed alog odino diad kaubasan, et akaarawi ra tan kinan da ray bunga na tanaman ed alog na sakey a too, say akanayep nepeg ton bayaran so kinen na ayep to na saray sankaabigan a bungay tanaman ed kaalogan to odino kaubasan to.
EXO_022_0009	006<TAB>Kun ipasaray nin sarong tawo sa saiyang kataed an saiyang kwarta o an ano man na pagrogaring niya, asin hinabon ini sa harong kan nagsaray, mabayad nin doble an mahabon kun siya madakop.	005<TAB>No say sakey a too et mamool ed alog to tan onkayamkam so apoy ed alog na arum a too tan napoolan iray ontutubon tanaman diman odino saray pinalot a nisimbun diman, say angigapoy apoy et nepeg a bayaran toy adarak.
EXO_022_0010	007<TAB>Alagad kun dai madakop an mahabon, an nagsaray iaatubang sa Dios tanganing magsumpa na dai niya hinabon an pagrogaring na iwinalat saiya.	006<TAB>No say sakey a too et mipaknaan ya isinup toy kuarta odino antokaman a mablin kayaryan na sakey a too, insan natakew ira ed abung to, say nantakew nepeg a dobli so ibayar to no narel.
EXO_022_0011	008<TAB>Sa lambang kaso nin pag-iriwal manongod sa mga pagrogaring arog kan baka, asno, karnero, gubing asin iba pa, an duwang tawo na parehong nagsasabi, Iyo ini an nawawara ko, iaatubang sa Dios.	007<TAB>Balet no ag narel so nantakew, say toon angisinup na kayaryan et nepeg ya iyakar ed pasen a panangigalangan tan diman mansamba ya ag to tinakew so kayaryan na toon akipaknaan to.
EXO_022_0012	008<TAB>An ipahayag nin Dios na igwang sala, mabayad nin doble sa tunay na kagsadiri.	008<TAB>Diad balang kolkolan a nipaakar ed pankayaryan na bengatlan, singa bilang baka, asno, karniro, kawes, odino antokaman ya abalang, saray duaran totoon mangakayaryan et nepeg iran niyakar ed pasen a panangigalangan.
EXO_022_0013	009<TAB>Kun ipaataman nin sarong tawo sa saiyang kapwa an sarong asno, baka, karnero o ano man na hayop, asin ini nagadan o nalugadan o kaya nawara alagad mayo nin nakahiling,	008<TAB>Say toon ibawag na Dios a sikatoy nankasalanan et nepeg a mambayar na dobli ed samay sakey a too.
EXO_022_0014	010<TAB>an nag-ataman maatubang sa Kagurangnan asin masumpa na dai niya hinabon an hayop.	009<TAB>No say sakey a too et mipaknaan ya asikasoen toy asno, baka, karniro odino arum ya ayep na sananey a too, tan samay ayep et inatey odino asugatan odino imbatik na matatakew, tan anggapoy makatasi ed inkagawa,
EXO_022_0015	010<TAB>Kun dai hinabon an hayop, matubod an kagsadiri sa sumpa kan nag-ataman asin dai niya ini papabayadon.	010<TAB>samay too nepeg ya onlad pasen a panangigalangan tan sambaan to ya ag to tinakew imay ayep na sakey a too.
EXO_022_0016	011<TAB>Alagad kun hinabon saiya an hayop, kaipuhan bayadan niya an kagsadiri.	010<TAB>No ag atakew, say akanayep nepeg ton akoen a naandi, tan samay sakey a too et ag la nepeg a mambayar;
EXO_022_0017	012<TAB>Kun an hayop ginadan nin mga lalaw na hayop, ipapahiling kan nag-ataman an natadang parte kan hayop bilang ebidensya asin dai siya kaipuhan magbayad para sa ginadan na hayop.	011<TAB>balet no atakew so ayep, samay too nepeg a bayaran to so akanayep.
EXO_022_0018	013<TAB>Kun an sarong tawo nagsubli nin sarong hayop asin ini nalugadan o nagadan na dai an kagsadiri, babayadan ini kan nagsubli.	012<TAB>No pinatey na saray ayep ed takel, say toon manaasikaso alaen to so laman na ayep a pamaneknek ed agawa; ag to nepeg a bayaran ed akanayep so pinatey na saray ayep ed takel.
EXO_022_0019	014<TAB>Alagad kun yaon duman an kagsadiri kan mangyari ini, dai na mabayad an nagsubli; kun an hayop inarkila, an arkila iyo na an magigin bayad.	013<TAB>No say sakey a too et ombayes na sakey ya ayep ed sakey a too tan asugatan odino inatey imay ayep nen andid man so akanayep, say toon binmayes et nepeg a bayaran to may binayes to.
EXO_022_0020	015<TAB>Kun matentaran asin madorogan nin sarong lalaki an sarong birhen na dai pa nakatalaan na ikasal, kaipuhan tawan niya ini nin dote dangan papakasalan.	014<TAB>Balet no say akanayep et wadman nen abalang so ayep, say binmayes ag nepeg a mambayar.
EXO_022_0021	016<TAB>Alagad kun habong ipakasal kan ama an saiyang aking babae, an lalaki dapat magtao sa ama kan kantidad na pareho kan dote para sa sarong birhen.	014<TAB>No inabangan ya ayep, say abang et pinagkabayar la.
EXO_022_0022	017<TAB>Dai nindo pagtugotan na mabuhay an babaeng mangkukulam.	015<TAB>No say sakey a laki et tuksoen toy sakey a marikit ya ag ni akisipanan a mikasal tan akdulan to, say laki nepeg ya iter toy bayar a para nobia tan asawaen to may bii.
EXO_022_0023	018<TAB>Dapat gadanon an siisay man na magdorog sa hayop.	016<TAB>Balet no ag onabuloy so ama ya asawaen day anak to, samay laki nepeg a bayaran to may ama na singa karakel na kuartan ibayar ed nobian marikit.
EXO_022_0024	019<TAB>Dapat gadanon an siisay man na mag-atang sa arin man na dios-dios, huli ta ako sana, an Kagurangnan , an dapat dolotan nin atang.	017<TAB>Nepeg a pateyen so siopaman a biin managsalamangka diad pananulong na maoges ya ispiritu.
EXO_022_0025	020<TAB>Dai nindo pagpasakitan o pagdaog-daogon an sarong dayuhan; giromdomon nindo na nagin mga dayuhan man kamo sa Egipto.	018<TAB>Nepeg a pateyen so siopaman a lakin misiping ed ayep.
EXO_022_0026	021<TAB>Dai nindo pagpasakitan an mga babaeng balo o an mga ilo.	019<TAB>Nepeg a pateyen so siopaman a mangibagat ed anggan anton dios likud ed siak a Katawan .
EXO_022_0027	022<TAB>Kun pasakitan nindo sinda dangan maghagad sinda sako nin tabang, ako, an Kagurangnan , matabang sa sainda.	020<TAB>Ag yo lulukoen odino papairapen so sangkaili; ag yo lilingwanan a sangkaili kayo met nen saman ed Egipto.
EXO_022_0028	023<TAB>Maaanggot ako asin gagadanon ko kamo sa gera.	021<TAB>Ag yo papairapen so siopaman a balon bii odino siopaman ya olila.
EXO_022_0029	023<TAB>Mababalo an saindong mga agom asin maiilo an saindong mga aki.	022<TAB>No pairapen yo ra, siak a Katawan ebatan ko ra no onkerew irad siak na tulong,
EXO_022_0030	024<TAB>Kun kamo magpautang nin kwarta sa mga dukha sa sakong banwaan, dai nindo pag-arogon an ibang parapautang; dai nindo sinda pagpatuboan.	023<TAB>tan mampasnuk ak tan pateyen ta kayo ed bakal.
EXO_022_0031	025<TAB>Kun kuahon nindo an alikboy nin saindong kapwa bilang sangra, iuli nindo iyan saiya bago magsolnop an aldaw,	023<TAB>Nabalo ray kaasawaan yo tan naolila ed ama iray anak yo.
EXO_022_0032	026<TAB>huli ta iyo sana iyan an gamit niyang tamong na makakapahimbong kan saiyang hawak.	024<TAB>No mampabayes kayo na kuarta ed siopaman a took a mairap so bilay to, ag yo ipapasey sikayon dili a managpaabang tan ag yo pangaabangen.
