id	book	chapter	sentence_no	source_text	target_text
EXO_019_1	EXO	019	1	Inapod siya nin Kagurangnan hale sa bukid asin tinaraman, Sabihan mo an mga kapagarakian ni Jacob, an banwaan nin Israel	Inawagan ni Yahweh ni Moises manipud iti bantay ket imbagana kenkuana ti sawenna kadagiti Israelita a kaputotan ni Jacob
EXO_019_1	EXO	019	1	Nahiling nindo kun ano an ginibo ko sa mga Egipcio asin kun paano ko kamo dinara sa sakuya siring sa pagdara kan agila sa saiyang siwo sa ibabaw nin saiyang pakpak.	Nakitayo ti inaramidko kadagiti Egipcio ken no kasano ti panangawitko kadakayokaslaak la agila a nangitayab kadagiti sibong a nangipan kadakayo ditoy.
EXO_019_1	EXO	019	1	Kaya ngunyan, kun susunodon nindo ako asin kun ootobon nindo an sakong tipan, pipilion ko kamo bilang sadiri ko sa gabos na banwaan huli ta rogaring ko an bilog na kinaban.	Ita, no agtulnogkayo kaniak ket salimetmetanyo ti tulagko, dakayonto dagiti tattaok. Kukuak ti entero a daga, ngem dakayto dagiti napili a tattaok,
EXO_019_1	EXO	019	1	Kamo magigin kahadean nin mga padi asin sarong banal na nasyon para sa sako. Ini an itaram mo sa mga Israelita.	tattao a naikonsagrar nga agpaay laeng kaniak ket agserbikayonto kaniak a kas papadi.
EXO_019_1	EXO	019	1	Kaya naghilig si Moises asin tiniripon an mga lider nin Israel dangan sinabihan kan gabos na ipinagboot saiya nin Kagurangnan .	Simmalog ngarud ni Moises ket inayabanna dagiti amin a panglakayen dagiti tattao. Imbagana kadakuada ti amin nga imbilin ni Yahweh.
EXO_019_1	EXO	019	1	Sarabay na nagsimbag an mga tawo, Gigibohon mi an gabos na itinaram nin Kagurangnan , asin ibinareta ni Moises sa Kagurangnan an simbag kan mga tawo.	Sangsangkamaysa a simmungbat dagiti amin a tattao a tungpalenda ti amin nga imbaga ni Yahweh. Ket impakaammo ni Moises ken ni Yahweh ti insungbat dagiti tattao.
EXO_019_1	EXO	019	1	Nagtaram an Kagurangnan ki Moises, Madolok ako saimo sa mahibog na panganoron, tanganing madangog kan mga tawo an pagtaram ko saimo, asin tanganing sagkod lamang magtubod sinda sa saimo.	Kinuna ni Yahweh ken ni Moises, Umayakto kenka iti napuskol nga ulep tapno mangngeg dagiti tattao a makisasaoak kenka ket mamatida kenkan manipud ita.
EXO_019_1	EXO	019	1	Ibinareta ni Moises sa Kagurangnan an simbag kan mga tawo.	Imbaga ni Moises ken ni Yahweh ti insungbat dagiti tattao
EXO_019_1	EXO	019	1	Naghale sa Refidim an mga Israelita asin nakaabot sinda sa kalangtadan nin Sinai sa enot na aldaw kan ikatolong bulan pakahale ninda sa Egipto.	Pimmanaw dagiti Israelita iti Refidim ket iti umuna nga aldaw iti maikatlo a bulan kalpasan ti ipapanawda idiay Egipto, dimtengda iti let-ang ti Sinai.
EXO_019_1	EXO	019	1	Dinara ni Moises sa luwas kan kampo an mga tawo tanganing magsabat sa Dios;	Indauloan ida ni Moises a rimmuar iti kampo tapno sabtenda ti Dios.
EXO_019_1	EXO	019	1	asin mag-andam sinda sa ikatolong aldaw;	ket sisasaganadanton iti maikatlo nga aldaw.
EXO_019_1	EXO	019	1	Maski an mga padi na minadolok sako kaipuhan magpakabanal man; kun dai, papadusahan ko sinda.	Uray dagiti papadi nga umasideg kaniak, masapul a dalusanda dagiti bagbagida, ta no saan, dusaek ida.
EXO_019_1	EXO	019	1	Bugtakan mo nin kasagkoran sa palibot kan bukid na dai dapat lampasan kan mga tawo, asin sabihan mo sinda na dai magtukad o magrani sa bukid.	Mangikabilkanto iti beddeng iti aglikmut ti bantay a pagpatinggaan dagiti tattao. Ibagam kadakuada a dida sumang-at wenno umasideg iti bantay.
EXO_019_1	EXO	019	1	Tinaraman siya nin Kagurangnan , Maghilig ka asin patanidan mo an mga tawo na dai maglampas sa kasagkoran sa paghiling sako.	ket kinuna ni Yahweh kenkuana, Sumalogka ket ballaagam dagiti tattao a dida labsan ti beddeng nga umay kumita kaniak.
EXO_019_1	EXO	019	1	mayo nin magduta saiya alagad dapat siyang gapoon o panaon.	Maubor wenno mapana agingga a matay ket maiparit ti mangsagid kenkuana.
EXO_019_1	EXO	019	1	Naghilig si Moises asin sinabihan an mga tawo.	Simmalog ngarud ni Moises ket imbagana kadagiti tattao ti sinao ti Apo .
EXO_019_1	EXO	019	1	Huminilig an Kagurangnan sa alitoktok kan bukid asin inapod niya si Moises, kaya nagtukad ini.	Bimmaba ni Yahweh iti tapaw ti Bantay Sinai, ket inayabanna ni Moises a sumang-at. Napan ni Moises iti tapaw,
EXO_019_1	EXO	019	1	Naghilig sa bukid si Moises asin pinaandam an mga tawo para sa pagsamba.	Simmalog ni Moises iti bantay ket pinagsaganana dagiti tattao nga agdaydayaw.
EXO_019_1	EXO	019	1	Mantang orog na nagkokosog an tanog kan trompeta, nagtaram si Moises, asin sinimbag siya nin Dios sa daguldol.	Pimmigsa a pimmigsa ti uni ti trumpeta. Nagsao ni Moises ket sinungbatan ti Dios babaen iti panangibulosna iti gurruod.
EXO_019_1	EXO	019	1	Sinabihan sinda ni Moises, Magin andam kamo sa ikatolong aldaw;	ket imbagana kadakuada, Nakasaganakayton iti maikatlo nga aldaw.
EXO_019_1	EXO	019	1	Napatos nin aso an bukid huli ta naghilig duman an Kagurangnan sa porma nin kalayo.	Nakumotan ti Bantay Sinai iti asuk gapu ta bimmaba sadiay ni Yahweh babaen iti apuy.
EXO_019_1	EXO	019	1	Pagkaaga kan ikatolong aldaw, nagkaigwa nin daguldol saka kikilat, nagtunga sa bukid an sarong mahibog na panganoron asin nadangog an makosog na tanog kan trompeta.	Iti agsapa iti maikatlo nga aldaw, naggurruod ken nagkimat iti bantay. Nagparang ti napuskol nga ulep. Immaweng ti nakapigpigsa nga uni ti trumpeta.
EXO_019_2	EXO	019	2	Tawo man o hayop, dapat na gadanon.	Kasta ti aramidenyo iti tao wenno iti animal; masapul a mapapatay.
EXO_019_2	EXO	019	2	An gabos na tawo sa kampo nagtarakig sa takot.	Nagpigerger dagiti amin a tattao iti kampo gapu iti buteng.
EXO_019_2	EXO	019	2	nagtindog sinda sa pamitisan kan bukid.	Nagtakderda iti arisadsad ti bantay.
EXO_019_2	EXO	019	2	mayo ngona nin magdorog.	Dikay pay la makikaidda iti assawayo.
EXO_019_2	EXO	019	2	Nag-itaas an aso arog sa aso nin sarong horno asin naglinog nin makosog an bilog na bukid.	Nagpangato ti asuk a kas iti asuk ti urno ket kasta unay ti panagkintayeg ti bantay.
EXO_019_2	EXO	019	2	Kaya linabahan ninda an saindang mga gubing.	Isu a linabaanda dagiti pagan-anayda,
EXO_019_2	EXO	019	2	An maggibo kaiyan, gagadanon;	No adda bumaddek iti bantay, masapul a mapapatay
EXO_019_2	EXO	019	2	Kun gibohon ninda iyan, dakul sainda an magagadan.	No labsanda, adunto kadakuada ti matay.
EXO_019_2	EXO	019	2	huli ta sa aldaw na iyan mahilig ako sa Bukid nin Sinai tanganing mahiling kan mga tawo.	Iti dayta nga aldaw, bumabaakto iti Bantay Sinai tapno makitadak dagiti amin a tattao.
EXO_019_2	EXO	019	2	Palabahan mo sainda an saindang mga gubing	Masapul a labaanda dagiti pagan-anayda
EXO_019_2	EXO	019	2	Nagkampo sinda sa pamitisan kan bukid.	Nagkampoda iti arisadsad ti Bantay Sinai, ket
EXO_019_2	EXO	019	2	Alagad dai mo pagtugotan an mga padi asin an mga tawo na maglampas sa kasagkoran tanganing makarani sako; kun gibohon ninda iyan, papadusahan ko sinda.	Ngem saan a labsan dagiti papadi ken dagiti tattao ti beddeng nga umasideg kaniak ta dusaek ida no aramidenda ti kasta.
EXO_019_3	EXO	019	3	Pagtanog kan trompeta, dangan na magrani sa bukid an mga tawo.	Ngem inton mapuyot ti tangguyob, sumang-atton dagiti tattao iti bantay.
EXO_020_1	EXO	020	1	Kun maggibo kamo nin altar na gapo para sako, dai kamo maggamit nin sinapsapan na gapo, huli ta kun gamitan nindo nin pansapsap an gapo, bako na iyan maninigo para sako.	No yaramidandak iti altar a bato, diyo usaren dagiti natikapan a bato agsipud ta no aramatenyo dagiti paetyo, matulawan ti altar nga aramidenyo.
EXO_020_1	EXO	020	1	Nagsarabi sinda ki Moises, Ika an magtaram samo asin madangog kami;	Kinunada ken ni Moises, No sika ti makisao kadakami, dumngegkami.
EXO_020_1	EXO	020	1	Dai nindo ako ipaggibo nin altar na may mga tangga, huli ta kun magsakat kamo diyan, mahihiling an saindong pagkanihuba.	Dikay agaramid iti altar nga adda agdanna ta makita ti kinalamolamoyo no umulikayo.
EXO_020_1	EXO	020	1	Gumibo kamo nin altar na daga para sako; sa ibabaw kaiyan idolot nindo an saindong karnero saka an saindong baka bilang tinutong na atang asin atang para sa katoninongan.	Yaramidandak iti altar a daga ket sadiay ti pangpuoranyo kadagiti datonyo para iti kappia ken kadagiti karnero ken baka a sakrifisioyo para iti panagkakadua.
EXO_020_1	EXO	020	1	Dai kamo maggibo nin mga dios-dios na plata o bulawan na sasambahon bilang dugang sa sako.	Dikay agaramid kadagiti didiosenyo a pirak wenno balitok a pagdaydayawanyo a kas iti panagdayawyo kaniak.
EXO_020_1	EXO	020	1	Nagboot an Kagurangnan ki Moises na taraman an mga Israelita, Nahiling nindo kun paano ako, an Kagurangnan , nagtaram sa saindo hale sa langit.	Imbilin ni Yahweh ken ni Moises nga ibagana daytoy kadagiti Israelita: Nakitayo ti pannakisaok kadakayo manipud langit.
EXO_020_1	EXO	020	1	Alagad padagos na nagtindog sa harayo an mga tawo; si Moises sana an nagdolok sa mahibog na panganoron saen yaon an Dios.	Nupay kasta, nagtalinaed dagiti tattao a nakatakder iti adayo ket ni la Moises ti immasideg iti napuskol nga ulep a yan ti Dios.
EXO_020_1	EXO	020	1	Nagsimbag si Moises, Dai kamo matakot;	Dikay agbuteng, kinuna ni Moises.
EXO_020_1	EXO	020	1	Kan madangog kan mga tawo an daguldol saka an tanog kan trompeta asin kan mahiling ninda an kikilat sagkod an nag-aasong bukid, nagtarakig sinda sa takot; kaya nagtirindog sinda sa harayo.	Idi mangngeg dagiti tattao ti gurruod ken ti tangguyob, idi makitada ti kimat ken ti umas-asuk a bantay, nagpigergerda iti buteng ket immadayoda.
EXO_020_1	EXO	020	1	Dai kamo maara sa harong kan ibang tawo;	Dimo aguman ti balay ti sabali a tao.
EXO_020_1	EXO	020	1	Dai kamo magsaksi nin putik laban sa saindong kapwa.	Dika agsaksi iti ulbod a maibusor iti padam a tao.
EXO_020_1	EXO	020	1	Dai kamo maghabon.	Dika agtakaw.
EXO_020_1	EXO	020	1	Dai kamo magdorog sa bako nindong agom.	Dika makikamalala.
EXO_020_1	EXO	020	1	Dai kamo maggadan.	Dika mamapatay.
EXO_020_1	EXO	020	1	Galangan nindo an saindong ama asin ina, tanganing mabuhay kamo nin halawig sa dagang itatao ko sa saindo.	Dayawem da amam ken inam tapno napaut ti panagbiagmo iti daga nga itedko kenka.
EXO_020_1	EXO	020	1	Huli ta sa anom na aldaw ginibo ko an daga, an langit, an kadagatan sagkod an gabos na yaon diyan, alagad sa ikapitong aldaw, nagpahingalo ako.	Iti las-ud ti innem nga aldaw, siak, ni Yahweh, inaramidko ti langit, daga, dagiti baybay agraman dagiti amin a linaonda, ngem naginanaak iti maikapito nga aldaw.
EXO_020_1	EXO	020	1	Nagtaram an Dios, asin ini an saiyang mga tataramon	Nagsao ti Dios ket adtoy dagiti balikasna
EXO_020_1	EXO	020	1	Ako an Kagurangnan na saindong Dios na nagdara saindo sa luwas kan daga nin Egipto, sa luwas kan harong nin kaoripnan.	Siak ni Yahweh a Diosyo a nangiruar kadakayo idiay Egipto, iti daga a nakatagabuanyo.
EXO_020_1	EXO	020	1	Dai kamo nin ibang dios na sasambahon kundi ako sana.	Dika agdaydayaw iti sabali a dios no di laeng siak.
EXO_020_1	EXO	020	1	Dai kamo maggibo nin ladawan kan ano man na nasa langit o nasa daga o nasa tubig sa irarom kan daga.	Dika agaramid iti agpaay kenka a kinitikitan a ladawan wenno aniaman a kapadpada ti parsua iti langit wenno iti daga wenno iti danum nga adda iti uneg ti daga.
EXO_020_1	EXO	020	1	Dai kamo magduko sa mga dios-dios o magsamba sa sainda, huli ta ako an Kagurangnan na saindong Dios, sarong maimon na Dios.	Dika agrukbab wenno agdaydayaw iti uray ania a kinitikitan a ladawan agsipud ta siak, ni Yahweh a Diosmo, ket managimonak.
EXO_020_1	EXO	020	1	alagad an ikapitong aldaw, sarong aldaw nin pahingalo na talaan para sako.	ngem aginanaka iti maikapito nga aldaw a maipaay kaniak.
EXO_020_1	EXO	020	1	Alagad ipinapahiling ko an danay kong pagkamoot sa rinibong henerasyon kan mga namomoot sako asin nag-ootob kan sakong mga togon.	Ngem ipakitak ti panagayatko iti rinibu a kaputotan dagiti agayat kaniak ken mangtungpal kadagiti bilinko.
EXO_020_1	EXO	020	1	Dai nindo paggamiton an sakong ngaran nin basang lamang, huli ta ako, an Kagurangnan na saindong Dios, mapadusa sa kiisay man na magbasang-basang kan sakong ngaran.	Dimo aramaten ti naganko iti dakes a panggep gapu ta, siak, ni Yahweh a Diosmo, dusaek ti siasinoman a barengbareng ti panangusarna iti naganko.
EXO_020_1	EXO	020	1	Giromdoma nindo an Sabbath asin pakabanala nindo iyan.	Ngilinem ti Aldaw a Panaginana ket ibilangmo a nasantoan.
EXO_020_1	EXO	020	1	Igwa kamo nin anom na aldaw tanganing gibohon an saindong mga trabaho,	Innem nga aldaw ti panagtrabahom,
EXO_020_2	EXO	020	2	dai kamo maara sa saiyang agom, sa saiyang mga oripon, asin sa saiyang mga baka, mga asno o sa ano man na pagsadiri niya.	Dimo aguman ti asawana, dagiti tagabuna, dagiti bakana, dagiti asnona wenno ti aniaman a sanikuana.
EXO_020_2	EXO	020	2	Sa aldaw na iyan, mayo nin siisay man saindo na magtrabahokamo, an saindong mga aki, an saindong mga oripon, an saindong mga hayop o an mga dayuhan na nag-eerok sa saindong banwa.	Dika agtrabaho iti dayta nga aldawsika wenno dagiti annakmo wenno dagiti tagabum wenno dagiti animalmo wenno dagiti ganggannaet nga agnaed iti pagiliam.
EXO_020_2	EXO	020	2	Pinapadusahan ko an mga naoongis sako pati an saindang mga aki sagkod sa ikatolo saka sa ikaapat na henerasyon.	Dusaek dagiti gumura kaniak, agraman dagiti annakda agingga iti maikatlo ken maikapat a kaputotan.
EXO_020_2	EXO	020	2	Kaya benendisyonan ko an Sabbath asin pinabanal iyan.	Isut' gapuna a siak, ni Yahweh, binendisionak ti Aldaw a Panaginana ket intuyangko nga aldaw a nasantoan.
EXO_020_2	EXO	020	2	Sa lambang lugar na pinili ko na pagsasambahan nindo sako, madatong ako dangan bebendisyonan ko kamo.	Umaykayto bendisionan iti sadinoman a lugar nga itudingko a pagdaydayawanyo kaniak.
EXO_020_2	EXO	020	2	huli ta an Dios napadigdi sa pagbalo sa saindo. Boot niyang magkaigwa kamo nin takot sa saiya tanganing dai kamo magkasala.	Immaynakayo la suoten ti Dios tapno kanayon a tungpalenyo ti saona ket dikay agbasol.
EXO_020_2	EXO	020	2	alagad dai mo pagpataramon samo an Dios huli ta tibaad magadan kami.	Ngem saan koma a ti Dios amangan no mataykami.
EXO_021_1	EXO	021	1	Kun an mga nag-iiwal makakulog nin sarong bados na nagin dahelan na ini makuahan, alagad mayo na nin ibang maraot na nangyari sa babae, an nakakulog mabayad kan kantidad na hahagadon saiya kan agom kan babae sosog sa pagboot kan mga hukom.	No adda agkakabil a lallaki ket masaktanda ti maysa a masikog a pakaigapuan ti pannakaalisna ngem awanen ti sabali a dunorna, mamulta ti nakadunor iti gatad nga ikeddeng ti asawa ti nadangran, kas mayannurot iti inkeddeng ti ukom.
EXO_021_1	EXO	021	1	mata sa mata, ngipon sa ngipon, kamot sa kamot, bitis sa bitis,	mata iti mata, ngipen iti ngipen, ima iti ima, saka iti saka,
EXO_021_1	EXO	021	1	Alagad kun an kagsadiri tugotan na magmulta tanganing dai siya gadanon, dapat bayadan niya an bilog na kantidad na hahagadon.	Ngem no mapalubosan nga agmulta ti akimbaka tapno maispal ti biagna, bayadanna ti amin a naikeddeng a pagbayad.
EXO_021_1	EXO	021	1	Kun an sarong lalaki o babae magadan sa suag nin baka, gagapoon an baka asin dai pagkakanon an karne kaiyan, alagad an kagsadiri dai dapat padusahan.	No matay ti siasinoman a sangdoen ti baka, masapul a maubor ti baka agingga a matay ket saan a sidaen ti karnena; nupay kasta, saan a madusa ti akimbaka.
EXO_021_1	EXO	021	1	Kun aking lalaki o babae an nagadan kan baka, parehong reglamento an susunodon.	No ubing a lalaki wenno babai ti mapatay ti baka, daytoy met laeng a linteg ti masurot.
EXO_021_1	EXO	021	1	Kun an baka nin sarong tawo makagadan nin baka na sadiri nin iba, an buhay na baka ipapabakal kan duwang kagsadiri asin babangaon ninda an kabayadan;	No ti baka ti maysa a tao patayenna ti baka ti sabali, mailako ti sibibiag a baka sada pagguduaan ti naglakoanda.
EXO_021_1	EXO	021	1	Kun natipoan niya nin ngipon an saiyang oripon, tatalingkasan niya an oripon bilang kabayadan para sa ngipon.	Ket no natuppolanna ti tagabu, rebbengna a wayawayaan a kas bayad ti ngipenna.
EXO_021_1	EXO	021	1	Kun an sarong oripon na lalaki o babae nagadan sa suag kan baka, an kagsadiri kan baka mabayad nin treyntang pedaso nin plata sa kagurangnan kan oripon, asin gagapoon an baka sagkod na magadan.	No tagabu a lalaki wenno babai ti mapatayna, agbayad ti akimbaka iti 30 a bagi ti pirak iti among ti tagabu ket mabato ti baka agingga a matay.
EXO_021_1	EXO	021	1	Kun tamaan kan sarong lalaki an sarong mata kan saiyang oripon na lalaki o babae, dangan nabuta ini, tatalingkasan niya an oripon bilang kabayadan para sa mata.	No kabilen ti maysa a tao ti tagabuna, lalaki man wenno babai ket nabuldinganna, rebbengna a wayawayaan ti tagabu a kas bayad ti matana.
EXO_021_1	EXO	021	1	Kun an kalot binayaan nin sarong tawo na daing lukdo o kun nagkalot siya asin dai niya iyan tinakopan, dangan nahulog duman an sarong baka o asno,	No ikkaten ti maysa a tao ti kalub ti abut a pagurnongan iti danum wenno agkali iti sabali sa dina kaluban ket adda baka wenno asno a matnag ditoy,
EXO_021_1	EXO	021	1	an kagsadiri kan kalot mabayad para sa hayop.	masapul a bayadanna ti animal.
EXO_021_1	EXO	021	1	Kun an baka dati nang parasuag nin tawo asin pinatanidan na an kagsadiri alagad dai man niya iyan linaom, dangan nakagadan iyan nin tawo, gagapoon an torong baka asin gagadanon man an kagsadiri.	Ngem no sumasangdo ti baka ken napakdaaran ti akinkukua ngem dina ipupok, ket matay ti tao a sinangdona, maubor ti baka agingga a matay; mapapatay pay ti akinkukua.
EXO_021_1	EXO	021	1	Alagad kun an baka dati nang parasuag asin dai linaom kan kagsadiri, an nagadan na baka riribayan niya nin buhay na baka dangan mapapasaiya an gadan na hayop.	Ngem no ugali ti baka ti sumangdo ngem saan nga ipupok ti akimbaka, masapul a sukatanna iti sibibiag a baka, ket kukuana metten ti natay nga animal.
EXO_021_1	EXO	021	1	paso sa paso, lugad sa lugad, kulog sa kulog.	puor iti puor, sugat iti sugat, dunor iti dunor.
EXO_021_1	EXO	021	1	Ini an mga togon na itatao mo sa mga Israelita	Ipaulogmo dagitoy a linteg kadagiti Israelita
EXO_021_1	EXO	021	1	Kun magbakal ka nin oripon na Hebreyo, anom na taon siyang maglilingkod saimo.	No gumatangkayo iti lalaki a tagabu a Hebreo, agserbinto kadakayo iti innem a tawen.
EXO_021_1	EXO	021	1	Alagad kun may iba pang maraot na nangyari sa babae, an kabayadan: buhay sa buhay,	Ngem no madunor ti babai, madusa ti nangdangran: biag iti biag,
EXO_021_1	EXO	021	1	Alagad kun magpahayag an oripon na habo na siyang maghale huli ta namomotan niya an saiyang kagurangnan, agom saka mga aki,	Ngem no dina kayat gapu ta ay-ayatenna ti amongna, ti asawa ken dagiti annakna, ket dina kayat ti mawayawayaan,
EXO_021_1	EXO	021	1	Alagad kun nabuhay pa an oripon sa laog nin saro o duwang aldaw, dai na papadusahan an kagurangnan; an mawaraan siya nin oripon maninigo nang padusa saiya.	Ngem no saan a matay ti tagabu kalpasan ti maysa wenno dua nga aldaw, saan a madusa ti amo ta umdasen a dusana ti pannakapukaw ti tagabuna.
EXO_021_1	EXO	021	1	Kun pakolon nin sugkod kan sarong tawo an saiyang oripon na lalaki o babae, dangan nagadan tolos an saiyang oripon, an kagurangnan dapat na padusahan.	Siasinoman a mangpang-or iti tagabuna, lalaki man wenno babai, rumbeng a madusa no matay a dagus ti pinang-orna.
EXO_021_1	EXO	021	1	dangan nakalakaw sa tabang nin sugkod, kaipuhan atamanon siya kan nagkulog sagkod na marahay asin bayadan siya kaini kan saiyang panahon na nasayang.	ket mabalinna ti bumangon ken magna uray no agsarukod, bayadan ti nakadunor dagiti aldaw a napukawna ken taripatoenna agingga nga umimbag.
EXO_021_1	EXO	021	1	Kun siya mayong agom kan siya magin oripon mo, mahale siyang mayong agom;	No awan asawana idi magatang, pumanawto met nga awan asawana.
EXO_021_1	EXO	021	1	Kun igwang mag-iwal dangan nanggapo o nanuntok an saro alagad dai man nakagadan, an nanggapo o nanuntok dai papadusahan.	No adda agapa ket madunor ti maysa babaen iti bato wenno gemgemna, saan a madusa no saan a matay ti dinangranna.
EXO_021_1	EXO	021	1	An siisay man na magmaldisyon sa sadiring ama o ina dapat gadanon.	Siasinoman a mangilunod iti ama wenno iti inana, rumbeng a mapapatay.
EXO_021_1	EXO	021	1	An siisay man na magkidnap nin tawo tanganing ipabakal o gibohon na oripon dapat gadanon.	Siasinoman a mangkidnap iti maysa a tao tapno ilako wenno tagabuenna, rumbeng a mapapatay.
EXO_021_1	EXO	021	1	An siisay man na magkulog kan sadiring ama o ina dapat gadanon.	Siasinoman a mangkabil iti ama wenno inana, rumbeng a mapapatay.
EXO_021_1	EXO	021	1	Alagad kun tinuyong salakayon an sarong tawo tanganing pasaluib na gadanon, an nakagadan kuahon nindo dangan gadanon maski nakatago na siya sa sakong altar.	Ngem no makapungtot ti maysa a tao ket igagarana a patayen ti sabali, masapul a mapapatay uray no agkamang iti altarko.
EXO_021_1	EXO	021	1	Alagad kun dai man tinuyong kulogan an sarong tawo asin nagadan ini, an nakagadan pwedeng dumulag sa lugar na pipilion ko asin magigin ligtas siya duman.	No dina inggagara wenno pinanggep a patayen, mabalinna ti mapan agkamang iti lugar nga itudingkonto ket awanto ti pakaan-annoanna sadiay.
EXO_021_1	EXO	021	1	An siisay man na magkulog nin iba dangan nagadan siya, dapat na gadanon man.	Siasinoman a mangkabil iti maysa a tao a pakaigapuan ti ipapatayna, rumbeng met a mapapatay.
EXO_021_1	EXO	021	1	Kun an tolong bagay na ini dai niya maotob sa babae, dapat niya ining patalingkason na dai na papabayadon.	No dina tungpalen dagitoy a pagrebbengan, masapul a wayawayaanna ti babai ket saanen a masapul nga agbayad ti babai iti pannakawayawayana.
EXO_021_1	EXO	021	1	Kun an sarong lalaki mag-agom pa nin iba, dai niya dapat pag-inaan an itinatao niyang pagkakan, gubing asin mga deretso nin agom sa enot niyang agom.	No mangasawa dayta a lalaki iti sabali, masapul nga ituloyna nga ited ti sigud a taraon, kawes ken kalinteganna.
EXO_021_1	EXO	021	1	Kun an sarong lalaki magbakal nin babaeng oripon tanganing magin agom kan saiyang aking lalaki, kaipuhan trataron niya an oripon bilang tunay na aking babae.	No gumatang ti maysa a tao iti babai a tagabu nga ipaasawana iti anakna, masapul nga ibilangna a kas bukodna nga anak.
EXO_021_1	EXO	021	1	Kun tawan siya kan saiyang kagurangnan nin agom asin nagkaigwa siya nin mga aki, an saiyang agom sagkod mga aki pagsadiri kan kagurangnan niya, asin an lalaki solong mahale.	No ikkan ti amongna iti asawa ket aganak, kukua ti amongna ti asawana ken ti tunggal anakna. Ti lalaki laeng ti pumanawto.
EXO_021_1	EXO	021	1	Kun siya ipinabakal sa sarong lalaking boot umagom saiya, alagad dai siya kaini nagustohan, ipapatubos siya sa sadiri niyang ama.	No mailako iti agpanggep a mangasawa kenkuana ngem dinto kayat ti lalaki, masapul a sakaen met laeng ti amana.
EXO_021_1	EXO	021	1	Kun ipabakal kan ama an saiyang aking babae tanganing magin oripon, dai siya matatalingkasan na arog kan mga lalaking oripon.	No ilako ti maysa nga ama ti anakna a babai a kas tagabu, saanto a mawayawayaan daytoy a kas iti pannakawayawaya ti tagabu a lalaki.
EXO_021_1	EXO	021	1	kun siring, dadarahon siya kan saiyang kagurangnan sa lugar na pinagsasambahan asin papatindogon siya sa may pinto o sa may hamba kan pintoan, dangan lalabotan an saiyang talinga asin magigin oripon siya kan saiyang kagurangnan sagkod na buhay siya.	ipanto ngarud ti amongna iti lugar a pagdaydayawan. Sadiay, pagtakderento ti amongna iti ruangan wenno iti baotek ti ruangan ket tebbengannanto. Ket tagabunanto agingga't tungpal biagna.
EXO_021_2	EXO	021	2	Babayadan niya nin kwarta an kagsadiri kan hayop, asin mapapasaiya an nagadan na hayop.	Itedna ti kuarta iti akinkukua iti abut ket alaenna ti natay nga animal.
EXO_021_2	EXO	021	2	Dai siya pwedeng ipabakal kan saiyang kagurangnan sa mga dayuhan huli ta bakong tama an pagtratar niya saiya.	Awan kalintegan ti amongna a mangilako kenkuana kadagiti ganggannaet ta saan a nasayaat ti panangtratarna kenkuana.
EXO_021_2	EXO	021	2	alagad kun siya may agom kan siya magin oripon mo, mahale siyang kaiba an saiyang agom.	Ngem no adda asawana idi magatang, pumanawto agraman ti asawana.
EXO_021_2	EXO	021	2	Alagad kun an biktima nahaloy sa higdaan,	Ngem no maidalit ti nadangran,
EXO_021_2	EXO	021	2	Sa ikapitong taon papatalingkason mo siya na dai papabayadon nin maski ano.	Iti maikapito a tawen, mawayawayaanto nga awan bayadanna.
EXO_021_2	EXO	021	2	babangaon man ninda an karne kan nagadan na hayop.	Pagguduaanda met ti natay nga animal.
EXO_022_1	EXO	022	1	Alagad kun habong ipakasal kan ama an saiyang aking babae, an lalaki dapat magtao sa ama kan kantidad na pareho kan dote para sa sarong birhen.	Ngem no madi ti ama ti babai nga ipaasawa ti anakna, masapul nga ited ti lalaki ti naituding a gatad ti sab-ong; yawatna daytoy iti ama ti babai.
EXO_022_1	EXO	022	1	Dai nindo pag-abalahon an pagdolot nin mga tinagba kan saindong inani, kan saindong arak asin kan lana na hale sa mga oliba.	Itedyo kaniak a dagus dagiti daton nga agtaud iti apit, iti arak ken iti lanayo no tiempo ti panagited.
EXO_022_1	EXO	022	1	Kamo an sakuyang banwaan, kaya dai nanggad nindo pagkakanon an karne kan arin man na hayop na ginadan nin mga lalaw na hayop;	Dakayo dagiti tattaok, isu a dikay agsida iti karne ti animal a pinatay dagiti narungsot nga ayup.
EXO_022_1	EXO	022	1	Itao man nindo sakuya an matua kan saindong mga baka asin mga karnero;	agraman ti inauna a kalakian dagiti baka ken karneroyo;
EXO_022_1	EXO	022	1	Itao nindo sakuya an saindong matuang aking lalaki.	Itedyo kaniak ti inauna nga anakyo a lalaki,
EXO_022_1	EXO	022	1	Dai kamo maglanghad sa Dios asin dai nindo pagsumpaon an sarong namamayo kan saindong banwaan.	Dikay agsao iti maibusor iti Dios ket diyo ilunod ti siasinoman a panguloyo.
EXO_022_1	EXO	022	1	huli ta iyo sana iyan an gamit niyang tamong na makakapahimbong kan saiyang hawak.	ta dayta laeng ti pagimengna pangpapudot iti bagina.
EXO_022_1	EXO	022	1	Kun kuahon nindo an alikboy nin saindong kapwa bilang sangra, iuli nindo iyan saiya bago magsolnop an aldaw,	No alaenyo ti kagay ti siasinoman a kas pangigawidyo iti utangna, masapul nga isubliyo sakbay a lumnek ti init;
