id	source_text	target_text
GEN_030_0046	034<TAB>tugotan mong pilion ko asin laenon sa mga hayop mo an mga karnero asin kanding na may patak-patak saka may raya-raya asin an gabos na itom an kolor; ini an magigin kabayadan ko.	032<TAB>tepet nen Laban.
GEN_030_0047	035<TAB>Sa maabot na aldaw madali mong maaaraman kun ako nagin onesto sa saimo; kun makahiling ka nin hayop na bakong may patak-patak saka may raya-raya o bakong itom an kolor sa mga hayop ko, ibilang mo iyan na hinabonan ko.	033<TAB>Inmebat si Jacob, Anggapoy labay kon upa.
GEN_030_0048	036<TAB>Nagsimbag si Laban, Sige, gibohon ta an sinabi mo.	033<TAB>Ituloy koy pangasikasok ed saray karniro yo no onabubon kayod sayan paknaan
GEN_030_0049	037<TAB>Alagad kan aldaw na iyan, hinale ni Laban an gabos na lalaki asin babaeng kanding na may patak-patak asin may raya-raya; hinale man niya an mga itom na karnero asin ipinaataman an mga ini sa mga aki niya.	034<TAB>Onla ak natan ed kawalaan na saray karniro, tan alaen koy balang andeket a kordiro tan balang kanding a batekan o baklayan.
GEN_030_0050	038<TAB>Dinara ni Laban an mga hayop sa sarong lugar na an rayo hale ki Jacob tolong aldaw kun lalakawon.	034<TAB>Saraya labat so labay kon iyupa yod siak.
GEN_030_0051	038<TAB>Si Jacob an nag-ataman kan mga natadang hayop ni Laban.	035<TAB>Diad panakar na panaon, mainomay yon amtaen no niluko ta kayo o andi.
GEN_030_0052	039<TAB>Kuminua si Jacob nin mga sanga nin mga kahoy na alamo, abellano asin kastanyo dangan binakbak niya an ibang kabtang kan mga ubak tanganing magkaigwa nin puting patak-patak.	035<TAB>No nengnengen yo ray ayayep ya inyupa yod siak, tan walay nanengneng yon kanding ya aliwan baklayan o batekan tan karniron aliwan andeket, nibaga yon tinakew.
GEN_030_0053	040<TAB>Ibinugtak niya an mga sanga sa atubang kan mga raraan kan hayop huli ta nagmamaroan an mga ini kun sinda minaduman sa pagrara.	036<TAB>Inmebat si Laban, Marakep itan!
GEN_030_0054	041<TAB>Kaya an mga hayop na nangidam sa atubang kan mga sanga, nag-ogbon nin may patak-patak asin may raya-raya.	036<TAB>Ontan sirin so gawaen ta.
GEN_030_0055	042<TAB>Linaen ni Jacob an mga karnero sa mga kanding.	037<TAB>Balet diad saman ya agew inekal nen Laban iray kanding a kalakyan a gulisan o batekan tan saray kabatyan a baklayan tan batekan o walay ampotin batek; inekal to met iray andeket a karniro.
GEN_030_0056	042<TAB>Pinaatubang niya an mga karnero sa may mga raya-raya asin mga itom na hayop ni Laban.	037<TAB>Impaasikaso to rad saray anak ton lalaki,
GEN_030_0057	042<TAB>Sa paaging ini, napadakul niya an saiyang mga hayop asin sinuhay niya an mga ini sa mga hayop ni Laban.	038<TAB>insan to ra inyarawid kinen Jacob a taloy agew no akaren so kaarawi to.
GEN_030_0058	043<TAB>Kun an makokosog na hayop an nagmamaroan, ibinubugtak ni Jacob an mga sanga sa mga raraan, sa atubang kan mga hayop tanganing pangidaman ninda an mga sanga.	038<TAB>Inasikaso nen Jacob ira may atilak ya ayayep nen Laban.
GEN_030_0059	044<TAB>Alagad dai niya ibinubugtak an mga sanga sa atubang kan mga maniwang na hayop.	039<TAB>Angalay Jacob na saray sanga na estoraki, almindra, tan platano, insan to inobakan iray arum a partiy sanga pian singa walay gulis dan ampoti.
GEN_030_0060	044<TAB>Kaya an gabos na maniwang napaduman ki Laban, asin an gabos na makosog napaduman ki Jacob.	040<TAB>Inyan to ra yan sanga ed arap na saramay ayayep, diad pasen a paniinoman da.
GEN_030_0061	045<TAB>Sa paaging ini, nagyaman nin marahay si Jacob.	040<TAB>Inyan to rad man, ta mankakastaan ira no onla ran oninom.
GEN_030_0062	045<TAB>Nagkaigwa siya nin dakul na hayop, oripon, kamelyo asin asno.	041<TAB>Lapud akastaan ira diad arap na saramay sanga nananak iray baklayan a binmawer, baklayan, tan batekan.
GEN_030_0063	<MISSING_TRANSLATION>	042<TAB>Imbiig nen Jacob iray karniro ed saray kanding, tan impaarap to rad saray baklayan a binmawer tan andeket ya ayayep nen Laban.
GEN_030_0064	<MISSING_TRANSLATION>	042<TAB>Diad onya, dinmakel lan dinmakel so ayayep nen Jacob tan imbiig to rad saray ayayep nen Laban.
GEN_030_0065	<MISSING_TRANSLATION>	043<TAB>No mankasta ray ayayep a maung so laman da, iyan nen Jacob ira may sanga ed arap da diad paniinoman da, pian mannginew ira ed pegley na saramay sanga.
GEN_030_0066	<MISSING_TRANSLATION>	044<TAB>Balet ag to iyan ira may sanga ed arap na saray ayayep a makapoy so laman.
GEN_030_0067	<MISSING_TRANSLATION>	044<TAB>Ag abayag, kayaryan nen Laban iray makapoy so laman, tan kayaryan nen Jacob iray maung so laman.
GEN_030_0068	<MISSING_TRANSLATION>	045<TAB>Lapud saya nagmaliw a mayamyaman si Jacob.
GEN_030_0069	<MISSING_TRANSLATION>	045<TAB>Amayamay iray karniro, kanding, kamilyo tan asno to, tan aripen to.
GEN_031_0001	verse<TAB>content	verse<TAB>content
GEN_031_0002	001<TAB>Nadangog ni Jacob na ipinapamareta kan mga aking lalaki ni Laban na, Kinua ni Jacob an gabos na sadiri kan samong ama.	001<TAB>Nadngelan nen Jacob a kuan na saray lalakin anak nen Laban, Inala nen Jacob so amin a kayaryan nen ama tayo.
GEN_031_0003	001<TAB>An gabos niyang yaman gikan sa sadiri kan samong ama.	001<TAB>Nanlapud ama tayo so amin a kayamanan to.
GEN_031_0004	002<TAB>Nahiling man ni Jacob na malaen na an pagtratar saiya ni Laban.	002<TAB>Alikas to met a nanaoman lay panangaro nen Laban ed sikato.
GEN_031_0005	003<TAB>Dangan tinaraman nin Kagurangnan si Jacob, Bumalik ka sa daga nin saimong mga magurang asin nin saimong mga kadugo; iibahan taka.	003<TAB>Insan inkuan na Katawan ed sikato, Pawil ka lad dalin na saray atateng mo tan saray kakanayon mo.
GEN_031_0006	004<TAB>Kaya pinasugoan ni Jacob si Rachel asin si Lea na sabaton siya duman sa oma na namumugtakan kan saiyang mga hayop,	003<TAB>Olupen ta ka.
GEN_031_0007	005<TAB>asin sinabihan niya sinda, Namasdan ko na iba na an pagtratar sako kan saindong ama; alagad an Dios kan sakong ama iniibahan ako.	004<TAB>Kanyan nampabakian nen Jacob ira di Raquel tan Lea ya abeten dad alog a kawalaan da ray ayayep to.
GEN_031_0008	006<TAB>Aram nindong duwa na pinaglingkodan ko an saindong ama sa bilog kong kosog;	005<TAB>Inkuantod sikara, Nalilikas kon mangooman lay panangarod siak di ama tayo; balet aasikasoen ak lawas na Dios nen amak.
GEN_031_0009	007<TAB>dinaya niya ako asin sampolong beses niyang liniwat an sakong sweldo.	006<TAB>Kabat yon dua ya inyoput koy biskeg ko ed impanlingkur kod ama yo.
GEN_031_0010	007<TAB>Alagad dai itinugot nin Dios na kulogon niya ako.	007<TAB>Anggaman ontan, sinaol da ak tan amimpulon inooman day upak.
GEN_031_0011	008<TAB>Kan magsabi si Laban, Saimo an mga hayop na may patak-patak, an gabos na hayop nag-orogbon nin may patak-patak, asin kan magsabi siyang, Saimo an may raya-raya, an gabos na hayop nag-orogbon nin may raya-raya.	007<TAB>Balet ag inyabuloy na Dios a napasakitan da ak.
GEN_031_0012	009<TAB>Sa paaging iyan, kinua nin Dios an mga hayop kan saindong ama asin itinao sako.	008<TAB>Nen inkuandi ama tayon Laban, Saray baklayan a kanding so upam, nananak na baklayan iray kabatyan.
GEN_031_0013	010<TAB>Kan tig-maroan nin mga hayop, nagkaigwa ako nin pangatorogan asin nahiling ko na an mga lalaking kanding na nagmamaro anas may patak-patak asin may raya-raya.	008<TAB>Nen inkuanda, Saray gulisan a kanding so upam, nananak na gulisan iray kabatyan.
GEN_031_0014	011<TAB>Dangan sinabihan ako kan anghel nin Dios sa sakong pangatorogan, Jacob!	009<TAB>Inala na Dios iray ayayep nen ama yo tan inter to rad siak.
GEN_031_0015	011<TAB>Uya ako!	010<TAB>Nen panaon na panagkasta, walay kogip ko.
GEN_031_0016	011<TAB>an simbag ko.	010<TAB>Anengneng kon saray kalakyan a kanding a mankakasta et gulisan, batekan, tan baklayan so kolor da.
GEN_031_0017	012<TAB>Nagsabi siya, Hilinga, an mga lalaking nagmamaro anas may patak-patak asin may raya-raya.	011<TAB>Inkuan ed siak na anghil na Dios diad kogip, Jacob!
GEN_031_0018	012<TAB>Pinapangyari ko ini huli ta nahiling ko an gabos na ginigibo saimo ni Laban.	011<TAB>On, wadya ak, ebat ko.
GEN_031_0019	013<TAB>Ako an Dios na nagpahiling saimo sa Betel, saen nagpatindog ka nin hariging giromdoman na inulaan mo nin lana, asin saen nanumpa ka sako.	012<TAB>Intuloy ton inkuan, Nengneng mo, amin a kanding a kalakyan a mankakasta et gulisan, batekan, tan baklayan ira.
GEN_031_0020	013<TAB>Mag-andam ka asin magbalik ka sa dagang saimong namundagan.	012<TAB>Gagawaen ko ya, ta nanenengneng koy gagawaen nen Laban ed sika.
GEN_031_0021	014<TAB>Nagsimbag si Rachel asin si Lea ki Jacob, Mayo na kaming mamanahon sa samong ama.	013<TAB>Siak imay Dios a pinmayawar ed sika diad Betel, a dimay angipaalageyan moy bato a pakanudnunotan tan insaklang mon masanto ed siaktan diman met so nanggawaan moy sakey a sinambaan a sipan ed siak.
GEN_031_0022	015<TAB>An pagtratar niya samo arog sa mga dayuhan.	013<TAB>Natan mamparaan ka, taynan kad sayan dalin tan pawil kad dalin a nianakan mo.
GEN_031_0023	015<TAB>Ipinabakal niya kami dangan inubos an kwartang kabakalan.	014<TAB>Inmebat ira di Raquel tan Lea, Anggapo lay nakdaan a tawiren mid ama mi.
GEN_031_0024	016<TAB>An gabos na pagrogaring na ini na kinua nin Dios sa samong ama sadiri nyamo asin nin samong mga aki.	015<TAB>Singa kami la sangkailid sikato.
GEN_031_0025	016<TAB>Kaya giboha an ano man na itinaram saimo nin Dios.	015<TAB>Inlako to kami, tan inggastos to lan amin so kuartan nanlakoan tod sikami.
GEN_031_0026	017<TAB>Kaya nag-andam si Jacob tanganing magbalik sa Canaan, sa daga kan saiyang ama na si Isaac.	016<TAB>Amin iray kayamanan ya inalay Dios ed kinen ama mi et kayaryan mi tan kayaryan na saray anak mi.
GEN_031_0027	017<TAB>Ilinunad niya sa mga kamelyo an gabos niyang aki asin agom dangan inalaw niya an gabos na hayop na napasaiya duman sa Mesopotamia.	016<TAB>Sumpal moy imbaga na Dios ed sika.
GEN_031_0028	018<TAB>Mayo duman si Laban huli ta ginuguntingan niya an saiyang mga karnero, kaya nahabon ni Rachel an saiyang mga dios-dios.	017<TAB>Namparaan sirin si Jacob ya ompawil ed kinen ama to diad dalin na Canaan.
GEN_031_0029	019<TAB>Nadaya ni Jacob si Laban huli sa dai niya pagpaisi saiya na mahale na siya.	017<TAB>Impakabayo tod saray kamilyo iray anak to tan saray asawa to, tan pinaona to ray amin ya ayayep to tan antokaman a kayaryan a nalmoan tod Mesopotamia.
GEN_031_0030	020<TAB>Nagdulag siyang dara an gabos niyang rogaring.	018<TAB>Linmay Laban a mangatlid saray karniro to; et nen andid man ed abung, tinakew nen Raquel iray talintaoy diriyos na pamilya tan kayaryan nen ama to.
GEN_031_0031	020<TAB>Inibong ninda an Salog nin Eufrates dangan naglakaw sinda pasiring sa mabulod na daga nin Gilead.	019<TAB>Pinalikdo nen Jacob si Laban diad ag to impangibagay itaynan to.
GEN_031_0032	021<TAB>Pakalihis nin tolong aldaw, naosipan si Laban na duminulag si Jacob.	020<TAB>Inawit ton amin iray kayaryan to tan ginanatan toy tinmaynan.
GEN_031_0033	022<TAB>Kaya ipinag-iba niya an saiyang mga tawohan asin linamag niya si Jacob sa laog nin pitong aldaw sagkod na maabotan niya ini sa mabulod na daga nin Gilead.	020<TAB>Binaliw toy Ilog na Eufrates tan amaarap ed Palandey na Galaad.
GEN_031_0034	023<TAB>Alagad sa sarong pangatorogan kan bangging idto, nagpahiling an Dios saiya asin nagtaram, Laban, hare nanggad pagtakota si Jacob sa ano man na paagi.	021<TAB>Kalabas na taloy agew nibagad kinen Laban a tinmaynan si Jacob.
GEN_031_0035	024<TAB>Kan maabotan ni Laban si Jacob, nakapatindog na ini kan saiyang tolda sa sarong bukid, kaya duman si Laban nagkampo sa mabulod na daga nin Gilead.	022<TAB>Intagar to ray totoo to tan inosilan ton pitoy agew si Jacob, et nabot to ed palandey na Galaad.
GEN_031_0036	025<TAB>Sinabihan ni Laban si Jacob, Tano ta dinaya mo ako, asin dinara mo an sakong mga aki na siring sa mga bihag sa gera?	023<TAB>Diad kogip nen Laban ed saman a labi, linmay Dios ed sikato tan inkuanto, Manalwar ka!
GEN_031_0037	026<TAB>Tano ta dinaya mo ako asin naghale ka na daing paisi?	023<TAB>Ag mo didiwiten a balut si Jacob.
GEN_031_0038	026<TAB>Kun sinabihan mo ako, kutana dinespedir ko kamo na may kaogmahan asin karantahan, sa tanog nin tamborin saka arpa.	024<TAB>Nanayam si Jacob ed kapokdulan, balet si Laban tan saray kakanayon to et nankampo rad kapokdulan na Galaad.
GEN_031_0039	027<TAB>Tano ta dai mo sako pinahadokan an sakong mga makoapo asin mga aki bago kamo naghale.	025<TAB>Inkuanen Laban ed kinen Jacob, Akin et pinalikdo mo ak diad impangawit mod saray bibiin anak ko a singa ra asamsam ed bakal?
GEN_031_0040	027<TAB>Sala an ginibo mo.	026<TAB>Akin et pinalikdo mo ak diad inyalis mon ag ko amta?
GEN_031_0041	028<TAB>Pwede takang kulogan, alagad pinatanidan ako kan Dios nin saimong ama kasubanggi na dai taka nanggad pagtakoton sa ano man na paagi.	026<TAB>No imbagam labat komun ed siak, pinasiput ta kan walay liket, kansion, tan togtog na saray arpa tan pandirita.
GEN_031_0042	029<TAB>Aram kong naghale ka huli ta gusto mong makapuli sa saindo, alagad tano ta hinabon mo an sakong mga dios-dios?	027<TAB>Ag mo anggan impaanguban iray apok tan saray anak ko kasakbay dan inmalis.
GEN_031_0043	030<TAB>Nagsimbag si Jacob, Natakot ako huli ta paghona ko aagawon mo sako an saimong mga aking babae.	027<TAB>Makapoy man a ginawam!
GEN_031_0044	031<TAB>Ngunyan, kun may makuahan ka digdi kan saimong mga dios-dios, gagadanon siya.	028<TAB>Walay pakayarik a mamasakit ed sika, balet pinasakbayan ak na Dios nen amam ya ag ta kan balut diwiten.
GEN_031_0045	031<TAB>Kaya sa atubang kan satong mga tawohan, hanapa an ano man na sadiri mo na yaon sako asin kuaha.	029<TAB>Kabat kon tinmaynan ka, lapud labay mo lay makasempet ed abung mo, balet akin et tinakew mo ray diriyos ko?
GEN_031_0046	031<TAB>Dai aram ni Jacob na hinabon ni Rachel an mga dios-dios ni Laban.	030<TAB>Inmebat si Jacob, Antakot ak, ta inisip kon alaen yod siak iray anak yon bibii.
GEN_031_0047	032<TAB>Linaog ni Laban an tolda ni Jacob asin naghanap duman; isinunod niya an tolda ni Lea asin an tolda kan duwang babaeng oripon, alagad dai niya nakua duman an saiyang mga dios-dios.	031<TAB>Balet no narumog yo dia iray diriyos yo, nakaukolan a pateyen so siopaman a pakarumogan.
GEN_031_0048	032<TAB>Dangan linaog niya an tolda ni Rachel.	031<TAB>Nia ray lalakin mantasi.
GEN_031_0049	033<TAB>Kinua na palan ni Rachel an mga dios-dios ni Laban, itinago sa kamadero kan kamelyo asin tinukawan an mga ini.	031<TAB>Mananap kayoy antokaman a kayaryan yo tan ala yoy gawa yo.
GEN_031_0050	033<TAB>Naghanap si Laban kan saiyang mga dios-dios sa bilog na tolda, alagad dai niya nakua duman.	031<TAB>Ag amta nen Jacob a tinakew nen Raquel iray diriyos nen Laban.
GEN_031_0051	034<TAB>Olay ni Rachel sa saiyang ama, Kagurangnan, dai ka logod maanggot sako.	032<TAB>Sinukisok nen Laban so tulda nen Jacob; insan linmoob ed tulda nen Lea tan diad tulda na saramay duaran aripen a bibii, balet ag to arumog iray diriyos to.
GEN_031_0052	034<TAB>Dai ako pwedeng magtindog sa saimong atubang huli ta nareregla ako.	032<TAB>Linmoob ed satan diad tulda nen Raquel.
GEN_031_0053	034<TAB>Nagpadagos sa paghanap si Laban alagad dai niya nakua an saiyang mga dios-dios.	033<TAB>Balet inala la nen Raquel ira may diriyos, inkarga to rad supot ya apis na beneg na kamilyo, insan to inirungan.
GEN_031_0054	035<TAB>Dangan naanggot si Jacob asin hinapot si Laban, Anong krimen an naginibo ko?	033<TAB>Inanap ira nen Laban diad intiron tulda, balet ag to ra narumog.
GEN_031_0055	035<TAB>Anong kasalan ko ta linamag mo ako?	034<TAB>Inkuanen Raquel ed kinen ama to, Ag yo ak pamapasnukan; ta ag ak makaalagey ed arap yo, ta sinmabid siak so binulan a sakit min bibii.
GEN_031_0056	036<TAB>Ngunyan na nahalungkat mo na an gabos kong pagsadiri, ano an nakua mo na pagsadiri mo?	034<TAB>Inanap nen Laban iray diriyos to, balet ag to ra nalmo.
GEN_031_0057	036<TAB>Iluwas mo digdi sa atubang kan satong mga tawohan tanganing sinda an magsabi kun siisay sa sato an tama.	035<TAB>Naingungotan si Jacob.
GEN_031_0058	037<TAB>Sa laog nin beynteng taon yaon ako sa kaibahan mo; mayong naghulos minsan saro kan saimong babaeng karnero o kanding; asin minsan saro kan saimong hayop dai ko kinakan.	035<TAB>Inkuanto, Antoy kasalanan a ginawak?
GEN_031_0059	038<TAB>Kun igwang saro na ginadan kan mga maringis na hayop, dai ko na dinadara saimo tanganing ipahiling na mayo akong sala; binabayadan ko na sana huli ta pinapabayadan mo an arin man na hinabon sa aldaw o sa banggi.	035<TAB>Antoy ganggan a sinumlang ko, et naitdan kayoy kanepegan a mangosil ed siak?
GEN_031_0060	039<TAB>Tinios ko an init kan aldaw asin an lipot kan banggi; dai na ako nagkakatorog.	036<TAB>Natan ta inonaan yo lan amin iray kayaryan ko, antoy nalmo yon kagawaay abung a kayaryan yo?
GEN_031_0061	040<TAB>Iyan an nagin buhay ko sa laog nin beynteng taon na yaon ako saimo.	036<TAB>Ipaway yo diad arap na totook tan totoo yo, pian nanengneng da tan nasintinsiaan da no siopay nalilingod sikatayo.
GEN_031_0062	040<TAB>Naglingkod ako saimo sa laog nin katorseng taon para sa duwang aki mo, asin anom na taon para sa saimong mga hayop.	037<TAB>Duamploy taon ko lad sikayo; ag tinmondan nananak iray karniro tan saray kanding yo, tan ag ak angan na anggan sakey a kordiro.
GEN_031_0063	040<TAB>Alagad sampolong beses mo pang liniwat an sweldo ko.	038<TAB>No walay karniron pinatey na ayep ed takel, inakok so inkaandi to; ag ko la inyakar ed sikayo, pian ag yo la naamtaan a siak so akankasalanan.
GEN_031_0064	041<TAB>Kun dai ako inibahan kan Dios nin sakong mga magurang, an Dios ni Abraham asin ni Isaac, tibaad haloy mo na akong pinalayas na mayo nin ano man na dara.	038<TAB>Pinasoot yo ak a mambayar ed amin ya atakew ed agew man o labi.
GEN_031_0065	041<TAB>Alagad nahiling nin Dios an sakong kasakitan asin an sakong kapagalan, kaya naanggotan ka niya kasubanggi.	039<TAB>Naynay ak a nanirap, lapud petang na agew tan betel na labi.
GEN_031_0066	042<TAB>Sinimbag ni Laban si Jacob, Mga aki ko an mga babaeng ini; sadiri ko an saindang mga aki asin rogaring ko an mga hayop na ini.	039<TAB>Ag ak makaogip.
GEN_031_0067	042<TAB>An totoo, sadiri ko an gabos na nahihiling mo.	040<TAB>Onyay agawgawa diad loob na duamploy taon kod sikayo.
GEN_031_0068	042<TAB>Alagad huli ta dai na akong magigibo tanganing mapugol sinda,	040<TAB>Labinapat a taon so impankimey ko pian naalak iray bibiin anak yo, tan anem taon pian naalak iray ayayep yo.
GEN_031_0069	043<TAB>andam ako na makipagtipan sa saimo.	040<TAB>Anggaman ontan, amimpulon inooman yoy upak.
GEN_031_0070	043<TAB>Magtambak kita nin mga gapo na iyo an danay na magpapagiromdom sato kan satong tipan.	041<TAB>No ag ak labat tutulongan na Dios da ray atateng ko, say Dios ya inggalang di Abraham tan Isaac, pinataynan yo ak la komun a kalima-lima.
GEN_031_0071	044<TAB>Kaya kuminua si Jacob nin gapo asin pinatindog ini bilang sarong hariging giromdom,	041<TAB>Balet anengneng na Dios so gunigon ko tan say kimey ko; kalabyan inter to lay sintinsia to.
GEN_031_0072	045<TAB>dangan sinabihan an saiyang mga tawohan na magtambak nin mga gapo; duman na sinda nagkakan sa kataed kan tinambak na mga gapo.	042<TAB>Inmebat si Laban ed kinen Jacob, Anak ko ra yan bibii, kayaryan ko ray anak da, tan kayaryan ko met ira yan ayayep.
GEN_031_0073	046<TAB>Nginaranan ini ni Laban nin Jegar-Sahaduta asin Galeed naman an inginaran kaini ni Jacob.	042<TAB>Kayaryan koy amin a nanenengneng mo dia.
GEN_031_0074	047<TAB>Sinabihan ni Laban si Jacob, An tambak na gapong ini iyo an magpapagiromdom sato.	042<TAB>Balet anggapoy nagawaan kon mamokpok ed saray anak ko tan saray anak da.
GEN_031_0075	047<TAB>Kaya an lugar na idto nginaranan Galeed.	043<TAB>Kanyan sipaparaan aka mipaknaan ed sika.
GEN_031_0076	048<TAB>Nagsabi pa si Laban, Bantayan logod kita nin Kagurangnan mantang harayo kita sa lambang saro.	043<TAB>Mangibunton tay bato a pakanudnunotan ed sayan paknaan ta.
GEN_031_0077	048<TAB>Kaya an lugar inapod man Mizpa.	044<TAB>Angala sirin na bato si Jacob tan impaalagey tod man a sakey a pakanudnunotan.
GEN_031_0078	049<TAB>Nagsabi pa si Laban, Kun maglaen an saimong pagtratar sa mga aki kong babae, o kun mag-agom ka nin ibang mga babae, minsan dai ko maisihan, giromdoma na nagbabantay sato an Dios.	045<TAB>Ingganggan to ray totoo to a mantipon iray bato tan ibunton da.
GEN_031_0079	050<TAB>Uya an tinambak na gapo asin an hariging giromdom na ibinugtak ko sa pagultanan tang duwa.	045<TAB>Insan angan ira diad abay to may bunton.
GEN_031_0080	051<TAB>Ini an mga saksi na dai ako malampas sa tambak na ini tanganing kalabanon ka asin dai ka man malampas digdi o sa hariging giromdom na ini tanganing kalabanon ako.	046<TAB>Inngaran nen Laban iman a pasen na Jegar-sahaduta; si Jacob balet inggaran to na Galeed.
GEN_031_0081	052<TAB>Husgaran logod kita kan Dios ni Abraham, ni Nahor, asin nin saindang mga magurang.	047<TAB>Inkuanen Laban ed kinen Jacob, Sayan bunton na bato so mangipanunot ed sikatan dua.
GEN_031_0082	052<TAB>Kaya nanumpa si Jacob sa ngaran kan Dios na sinamba ni Isaac na saiyang ama.	047<TAB>Sikato yay makasengeg ya atawag na Galeed iman a pasen.
GEN_031_0083	053<TAB>Nagbuno siya nin hayop na saiyang idinolot duman sa bukid dangan inapod niya an saiyang mga tawohan tanganing magkakan.	048<TAB>Inkuan met ni nen Laban, Bantayan ita komun na Katawan legan a nanarawiyan ita.
GEN_031_0084	053<TAB>Duman na sinda naagahan sa bukid.	048<TAB>Kanyan atawag met iman a pasen na Mispa.
GEN_031_0085	054<TAB>Pagkaagang amay, hinadokan ni Laban an saiyang mga makoapo asin mga aki dangan benendisyonan niya sinda; pakatapos, nagpuli na siya sa saiyang harong.	049<TAB>Intuloy nen Laban ya inkuan, No makapoy so ipatnag mod saray anak ko, o mangasawa ka na arum a bibii, anggaman ya ag ko amta, ag mo lilingwanan a bambantayan ita na Dios.
GEN_031_0086	<MISSING_TRANSLATION>	050<TAB>Nia ray baton imbunton ko ed nanleetan ta, tan niay baton pakanudnunotan.
GEN_031_0087	<MISSING_TRANSLATION>	051<TAB>Sayan bunton na bato tan sayan baton pakanudnunotan et sikaray manangipanunot.
GEN_031_0088	<MISSING_TRANSLATION>	051<TAB>Ag kon balut onlad labas to yan bunton a dogpaan ta ka, tan ag kan balut oonlad labas to yan bunton o labas to yan baton pakanudnunotan a dogpaan mo ak.
GEN_031_0089	<MISSING_TRANSLATION>	052<TAB>Say Dios nen Abraham tan say Dios nen Nacor so manintinsiad sikatan dua.
GEN_031_0090	<MISSING_TRANSLATION>	052<TAB>Insan diad ngaran na Dios ya inggalang nen ama ton Isaac, sinambaan nen Jacob a tooren to yan sipan.
GEN_031_0091	<MISSING_TRANSLATION>	053<TAB>Amatey na sakey ya ayep tan imbagat tod man ed palandey, insan to inimbitaan a mangan iray totoo to.
GEN_031_0092	<MISSING_TRANSLATION>	053<TAB>Kasumpal dan angan, pinalabas day labi diad saman a palandey.
GEN_031_0093	<MISSING_TRANSLATION>	054<TAB>Kabkabwasan, inaanguban nen Laban iray apo to tan saray anak ton bibii a pamasiput tod sikara, insan la sinmempet.
GEN_032_0001	verse<TAB>content	verse<TAB>content
GEN_032_0002	001<TAB>Mantang naglalakaw si Jacob, sinabat siya kan mga anghel nin Dios.	001<TAB>Intuloy nen Jacob so pankukurang to.
GEN_032_0003	002<TAB>Kan mahiling niya sinda, nagsaboot siya, Kampo ini nin Dios!	001<TAB>Inabet na pigaran anghil.
GEN_032_0004	002<TAB>Kaya an lugar inapod niyang Mahanaim.	002<TAB>Nen anengneng to ra, inkuanto, Kampo ya na Dios; kanyan inngaran to man a pasen na Mahanaim.
GEN_032_0005	003<TAB>Nagsugo nin mga tawo si Jacob pasiring sa saiyang tugang na si Esau sa daga nin Edom.	003<TAB>Angibakiy Jacob na totoo to ed kinen agi ton Esau diad dalin na Edom.
GEN_032_0006	004<TAB>Pinasunod niya sinda na magsabi ki Esau: Kagurangnan, ako si Jacob, na saimong sorogoon, nagpapahayag saimo na nakierok ako ki Laban asin ngunyan pa sana mapuli.	004<TAB>Imbilin tod sikaran onyay ibaga ra: Siak a si Jacob, say mapaabeban aripen mo, ipapakabat kod sika Esau, ya abayag ak a nanayam ed kindi pangamaen tan Laban tan natan ak labat ompawil.
GEN_032_0007	005<TAB>Dakul na an sadiri kong baka, asno, karnero, kanding asin oripon.	005<TAB>Wala ray bakak, asno, kanding, karniro, tan aripen ko.
GEN_032_0008	005<TAB>Nagpasugo ako saimo sa paglaom na magigin marahay an pag-ako mo sako.	005<TAB>Imbakik ed sika ra yan totoo, ta labay koy mipulangan ed sika.
GEN_032_0009	006<TAB>Kan magbalik ki Jacob an mga sinugo, nagsabi sinda, Nakaolay mi an tugang mong si Esau.	006<TAB>Nen pinmawil ed kinen Jacob ira may imbaki to, inkuanda, Linma kamid kinen agim ya Esau, tan wala lad dalan a mangabet ed sika.
GEN_032_0010	006<TAB>Pasiring na siya digdi sa pagsabat saimo kaiba an kwatro syentos kan saiyang mga tawohan.	006<TAB>Kaiba toy apat a lasus a lalaki.
GEN_032_0011	007<TAB>Natakot asin nahandal si Jacob, kaya binanga niya sa duwang grupo an mga tawo asin mga hayop na kaiba niya.	007<TAB>Ataktakot tan agunigon si Jacob.
GEN_032_0012	008<TAB>Nagsaboot siya, Kun salakayon asin gadanon ni Esau an enot na grupo, pwedeng makadulag an ikaduwa.	007<TAB>Impankadwa to ray totoon kaiba to, saray karniro, kanding, baka, tan saray kamilyo.
GEN_032_0013	009<TAB>Dangan namibi si Jacob, O Dios ni Abraham saka ni Isaac na sakuyang ama, dangoga ako!	008<TAB>Inkuantod sikaton dili, No dogpaan toy onaan ya olup, nayarin makabatik so walad onur ya olup.
GEN_032_0014	009<TAB>Ika, Kagurangnan , an nagtaram sako na magpuli sa sakong daga saka sa sakong mga kadugo, asin papakarahayon mo an gabos para sa sako.	009<TAB>Insan nampikasiy Jacob, Dios nen lakik ya Abraham tan Dios nen amak ya Isaac, dengel mo ak pa!
GEN_032_0015	010<TAB>Bako akong maninigo kan danay mong pagkamoot asin kan pagkamaimbod na ipinahiling mo sako, na saimong oripon.	009<TAB>Imbagam ed siak, Katawan , ya ompawil ak ed dalin ko tan saray kakanayon ko, tan ag mo ak paolyan pian maung so pansumpalan ko.
GEN_032_0016	010<TAB>Binalyo ko an Jordan na sugkod sana an dara alagad ngunyan nagbalik ako na may kaiba nang duwang grupo.	010<TAB>O matoor a Katawan , ag ak manepeg a mangawat na panangarom tan panangasim ya impatnag mod siak a mapaabeban aripen mo.
