id	book	chapter	sentence_no	source_text	target_text
GEN_011_1	GEN	011	1	An syudad nginaranan Babilon, huli ta duman rinibong nin Kagurangnan an lengwahe kan gabos na tawo, asin hale duman iwinarak niya sinda sa bilog na kinaban.	Napanaganan ti siudad iti Babel agsipud ta kinirokiro ni Yahweh ti pagsasao dagiti amin a tattao ket manipud sadiay, impanna ida iti nadumaduma a paset ti daga.
GEN_011_1	GEN	011	1	Iyo ini an mga kapagarakian ni Sem.	Dagitoy dagiti kaputotan ni Sem.
GEN_011_1	GEN	011	1	Dangan nabuhay pa siya sa laog nin kwatro syentos tres na taon asin nagkaigwa pa nin ibang mga aki.	Nagbiag pay ni Sela iti 403 a tawen ket naaddaan pay iti dadduma nga annak.
GEN_011_1	GEN	011	1	Dangan nabuhay pa siya sa laog nin kinyentos na taon asin nagkaigwa pa nin ibang mga aki.	Nagbiag pay ni Sem iti 500 a tawen ket naaddaan pay iti dadduma nga annak.
GEN_011_1	GEN	011	1	Kan treynta y singkong taon na si Arpaksad, namundag an aki niyang si Sela.	Idi agtawen ni Arpaksad iti 35, naparaburan iti anak a lalaki, ni Sela.
GEN_011_1	GEN	011	1	Dangan nabuhay pa siya sa laog nin kwatro syentos tres na taon asin nagkaigwa pa nin ibang mga aki.	Nagbiag pay ni Arpaksad iti 403 a tawen ket naaddaan iti dadduma nga annak.
GEN_011_1	GEN	011	1	Kan treyntang taon na si Sela, namundag an aki niyang si Eber.	Idi agtawen ni Sela iti tallopulo, naparaburan iti anak a lalaki, ni Eber.
GEN_011_2	GEN	011	2	Duwang taon pakatapos kan baha, kan sanggatos na an edad ni Sem, nagkaigwa siya nin aking lalaki na iyo si Arpaksad.	Dua a tawen kalpasan ti layus, naparaburan iti anak a lalaki a napanaganan iti Arpaksad. Agtawen idin ni Sem iti sangagasut.
GEN_011_2	GEN	011	2	iyo ini an kapinonan kan saindang mga gigibohon.	Pangrugian la daytoy ti panggepda nga aramiden.
GEN_011_2	GEN	011	2	Kaya nagkaigwa sinda nin mga ladrilyo embes na gapo asin aspalto embes na semento.	Ket naaddaanda kadagiti ladrilio a pagbangonda ken alketran a pannakasementoda.
GEN_011_2	GEN	011	2	Si Haran iyo an ama ni Lot.	Ni Haran ti ama ni Lot.
GEN_011_2	GEN	011	2	alagad kan makaabot sinda sa Haran, duman na sinda nag-erok.	Agturongda idiay Canaan, ngem idi dumanonda idiay Haran, nagsardengda ket sadiay ti nagnaedanda.
GEN_011_3	GEN	011	3	Dai mahahaloy magigibo na ninda an ano man na saindang mawoton.	Kabaelandanton nga aramiden ti aniaman a kaykayatda.
GEN_012_1	GEN	012	1	Kaya kan setenta y singko na an edad ni Abram, binayaan niya an Haran sosog sa itinaram saiya nin Kagurangnan ; nag-iba saiya si Lot.	Tinungpal ni Abram ti bilin ni Yahweh ket pimmanaw idiay Haran idi agtawen iti pitopulo ket lima.
GEN_012_1	GEN	012	1	Kaya ipinaapod kan hade si Abram asin hinapot, Ano ining ginibo mo sako?	Pinaayaban ti ari ni Abram ket sinaludsodna, Ania ti inaramidmo kaniak?
GEN_012_1	GEN	012	1	Nagboot an hade sa mga tawohan niya manongod ki Abram, kaya pinahale ninda ini sa Egipto kaiba an saiyang agom asin an gabos niyang rogaring.	Nagbilin ti ari ket napapanaw ni Abraham idiay Egipto a kaduana ti asawana agraman amin a sanikuana.
GEN_012_1	GEN	012	1	Nahiling man siya kan mga opisyal kan hade nin Egipto asin inosip ninda saiya na talagang magayon si Sarai, kaya dinara ninda ini sa palasyo.	Adda dagiti ofisiales ti palasio a nakakita kenkuana ket imbagada iti Faraon ti kinapintasna. Ket naipan ni Sarai iti palasio.
GEN_012_1	GEN	012	1	Nagkaigwa nin gutom sa Canaan, asin makuring gayo an gutom duman, kaya nagpasiring sa Egipto si Abram tanganing duman ngona mag-erok.	Ngem rimsua ti nakaro a panagbisin iti dayta a daga, isut' gapuna a nagpa-abagatan ni Abram agingga a dimteng idiay Egipto tapno agnaed sadiay iti apagbiit.
GEN_012_1	GEN	012	1	Dangan nagpadagos sa paglakaw si Abram pasiring sa habagat na parte kan Canaan.	Kalpasanna, nagalis-alis iti pagnaedan iti panagturongna iti akin-abagatan a paset ti Canaan.
GEN_012_1	GEN	012	1	Kan maglaog na si Abram sa Egipto, nahiling kan mga Egipcio na talagang magayon an saiyang agom.	Idi addadan idiay Egipto, nakita dagiti Egipcio a pudno a napintas ti asawa ni Abram.
GEN_012_1	GEN	012	1	Dangan nagpasiring siya sa mabulod na lugar sa sirangan kan Betel asin itinugdok an saiyang tolda sa pagultanan kan Betel na nasa solnopan asin kan Ai na nasa sirangan.	Kalpasan dayta, intuloyna ti panagdaliasatna agingga iti katurturodan iti daya ti siudad ti Betel. Nagkampo iti nagbaetan ti Betel iti laud ken Ai iti daya.
GEN_012_1	GEN	012	1	Sabihan mo sindang tugang taka tanganing huli saimo magin marahay an pag-ako ninda sako asin dai ninda ako paggadanon.	Ibagam kadakuada nga agkabsatta. Gapu kenka, saandakto a patayen ket nasayaatto ti pannakilangenda kaniak.
GEN_012_1	GEN	012	1	Nagpahiling an Kagurangnan ki Abram asin nagtaram saiya, Iyo ini an daga na itatao ko sa saimong mga kapagarakian.	Nagparang ni Yahweh ken ni Abram ket kinunana kenkuana, Daytoy ti daga nga itedko kadagiti kaputotam.
GEN_012_1	GEN	012	1	Kun mahiling ka kan mga Egipcio, sasabihon nindang agom taka kaya gagadanon ninda ako alagad bubuhayon ka.	Inton makitadaka dagiti Egipcio, ipapandanto nga asawaka, ket patayendakto ngem saandakanto nga an-anoen.
GEN_012_1	GEN	012	1	nagpadagos pa sa paglakaw si Abram sagkod na makaabot siya sa sagradong kahoy nin More, an banal na lugar sa Shekem.	sinursor ni Abram ti daga agingga a dimmanon idiay Sikem nga ayan ti kayo a lugo ti More.
GEN_012_1	GEN	012	1	Pag-abot ninda duman,	Idi dumtengda idiay Canaan,
GEN_012_1	GEN	012	1	Tano ta nagsabi kang tugang mo siya, kun kaya kinua ko siya na magin agom ko?	Apay nga imbagam a kabsatmo ket impalubosmo nga alaek a kas asawak?
GEN_012_1	GEN	012	1	Ipinag-iba ni Abram si Sarai na saiyang agom, asin an sobrino niyang si Lot patin an mga oripon na napasainda sa Haran;	Inkuyogna ni Sarai nga asawana ken ni Lot a kaanakanna.
GEN_012_1	GEN	012	1	Alagad huli ta kinua kan hade si Sarai, siya asin an mga yaon sa saiyang palasyo pinadarahan nin Kagurangnan nin mga makangirhat na helang.	Ngem gapu iti naaramid, nagpungtot ni Yahweh, ket nagsagaba ti ari ken dagiti tattao iti palasio. Nakaro a sakit ti indissuor kadakuada ni Yahweh.
GEN_012_1	GEN	012	1	Kan malaog na siya sa Egipto, sinabihan niya si Sarai na saiyang agom, Saro kang magayon na babae.	Idi dandani bumallasiw iti beddeng ti Egipto, kinunana iti asawana, Nalibnoska, Sarai.
GEN_012_1	GEN	012	1	Sa paagi mo, bebendisyonan ko man an gabos na nasyon sa daga.	Dawatento dagiti amin a nasion ditoy daga a bendisionak ida a kas iti panangbendisionko kenka.
GEN_012_1	GEN	012	1	Asin isusumpa ko an mga masumpa saimo;	ngem ilunodkonto dagiti mangilunod kenka.
GEN_012_1	GEN	012	1	Bebendisyonan ko an mga mabendisyon saimo,	Bendisionakto dagiti mangbendision kenka,
GEN_012_1	GEN	012	1	Gigibohon takang sarong dakulang nasyon, bebendisyonan taka asin gigibohon kong bantog an saimong ngaran tanganing ika magin sarong bendisyon.	Paraburankanto iti adu nga annak ken appoko ket agbalindanto a dakkel a pagilian. Bendisionankanto ket agdinamagto ti naganmo tapno mausar ti naganmo a pagbendision.
GEN_012_1	GEN	012	1	Tinaraman nin Kagurangnan si Abram, Bayaan mo an saimong daga, an saimong mga kadugo asin an harong kan saimong ama dangan magduman ka sa dagang ipapahiling ko saimo.	Kinuna ni Yahweh ken ni Abram, Panawam ti pagiliam, dagiti kabagiam ken amam ket inka iti daga nga ipakitakto kenka.
GEN_012_1	GEN	012	1	Huli ki Sarai, nagin marahay an pag-ako ki Abram kan hade.	Gapu ken ni Sarai, nasayaat ti pannakilangen ti ari ken ni Abram.
GEN_012_2	GEN	012	2	Tano ta dai ka nagtaram na agom mo an babaeng ini?	Apay a dimo imbaga nga asawam?
GEN_012_2	GEN	012	2	dara man ninda an gabos nindang pagsadiri. Dangan naglakaw sinda pasiring sa daga nin Canaan.	Intugotna ti amin a sanikua a naurnongna ken amin a nagbalin a tagabuna idiay Haran ket nagluasda a napan iti daga ti Canaan.
GEN_012_2	GEN	012	2	Uya an agom mo;	Adtoy ti asawam;
GEN_012_2	GEN	012	2	Kaidtong panahon duman pa nag-eerok an mga Cananeo.	Kadagidi a tiempo, agnanaed pay laeng dagiti Cananeo iti dayta a daga.
GEN_012_2	GEN	012	2	Kaya naggibo siya duman nin altar para sa Kagurangnan na nagpahiling saiya.	Nangbangon sadiay ni Abram iti altar nga agpaay ken ni Yahweh a nagparang kenkuana.
GEN_012_2	GEN	012	2	Guminibo siya duman nin altar asin nagsamba sa Kagurangnan .	Nangbangon met sadiay iti altar ket nagdaydayaw ken ni Yahweh.
GEN_012_2	GEN	012	2	Tinawan siya kaini nin mga karnero, kanding, baka, asno, oripon asin kamelyo.	Inikkanna ni Abram kadagiti arban ti karnero ken kalding, baka, asno, tagabu ken kamelio.
GEN_012_3	GEN	012	3	kuaha siya asin hale na kamo!	alaem ket pumanawkayon!
GEN_013_1	GEN	013	1	Mas marahay pang magsuhay kita;	Nasaysayaat no agsinata.
GEN_013_1	GEN	013	1	Mayaman nang marahay si Abram huli ta kadakul na kan saiyang mga hayop, plata asin bulawan.	Baknang idin ni Abram. Adu ti karnero, kalding ken bakana agraman pirak ken balitok.
GEN_013_1	GEN	013	1	Papadakulon ko siring sa alpog kan daga an saimong mga kapagarakian.	Paraburankanto iti adu a kaputotan.
GEN_013_1	GEN	013	1	huli ta an gabos na daga na nahihiling mo itatao ko sa saimo asin sa mga kapagarakian mo sagkod lamang.	Itedko kenka ken kadagiti kaputotam ti amin a daga a makitam ket kukuayonto iti agnanayon.
GEN_013_1	GEN	013	1	Pakahale ni Lot, nagtaram an Kagurangnan ki Abram, Mangalagkalag ka sa palibot mo,	Kalpasan ti panagsina da Abram ken ni Lot, kinuna ni Yahweh ken ni Abram, Iwarasmo ti panagkitam iti aglawlawmo.
GEN_013_1	GEN	013	1	An nag-eerok sa Sodoma mga maraot na tawo asin mga parakasala sa Kagurangnan .	Managdakdakes dagiti tattao ti Sodoma ket nakaro ti panagbasolda ken ni Yahweh.
GEN_013_1	GEN	013	1	Nagpawalat si Abram sa Canaan mantang si Lot nag-erok sa mga syudad duman sa kapantayan na harani sa Sodoma.	Nagtalinaed ni Abram iti daga ti Canaan. Nagnaed met ni Lot kadagiti siudad ti tanap, iti asideg ti Sodoma.
GEN_013_1	GEN	013	1	Pakahale sa Egipto, naglakaw si Abram pasiring sa habagat na parte kan Canaan kaiba an saiyang agom asin an gabos niyang rogaring;	Manipud idiay Egipto, nagdaliasat ni Abram nga agpa-amianan ket napan iti akin-abagatan a paset ti Canaan.
GEN_013_1	GEN	013	1	Kaya pinili ni Lot an bilog na Kapantayan nin Jordan, asin naglakaw siya pasiring sa sirangan;	Pinili ngarud ni Lot ti entero a Tanap ti Jordan.
GEN_013_1	GEN	013	1	Huli ta kadakul na kan mga hayop na pagsadiri ni Abram asin ni Lot, an daga dai na magkanigo para sa saindang duwa.	Saan a makaanay ti daga a pagpastoranda ta adu unay ti animalda.
GEN_013_1	GEN	013	1	Kaya naghale duman si Abram asin nag-erok harani sa sagradong mga kahoy ni Mamre sa Hebron.	Inyalis ngarud ni Abram ti kampona ket nagnaed iti asideg dagiti kayo ti lugo ti Mamre idiay Hebron.
GEN_013_1	GEN	013	1	Lakaw asin hilinga an bilog na daga ta itatao ko gabos iyan saimo.	Ita, inka sursoren ti entero a daga gapu ta itedko amin kenka daytoy.
GEN_013_1	GEN	013	1	Hale sa duman, nagpadagos siyang maglakaw sagkod na makaabot sa pagultanan kan Betel asin Ai, sa lugar na tinugdokan niya kaidto kan saiyang tolda,	Manipud sadiay, nagturong idiay Betel ket nadumaduma ti nagsardenganna iti dalan. Dimteng iti nagbaetan ti Betel ken Ai a sigud a nagkampoanna.
GEN_013_1	GEN	013	1	Nangalagkalag si Lot asin nahiling niya na mayaman sa tubig an bilog na Kapantayan nin Jordan sagkod sa Zoar, arog kan tatamnan kan Kagurangnan o arog kan daga nin Egipto.	Inwaras ni Lot ti panagkitana ket naimatanganna ti entero a Tanap ti Jordan agingga idiay Zoar. Adu ti danumna a kas iti Minuyongan ni Yahweh wenno ti daga ti Egipto.
GEN_013_1	GEN	013	1	asin pinatindogan niya nin altar. Duman nagsamba si Abram sa Kagurangnan .	Napan iti lugar a nangbangonanna idi iti altar ket nagdaydayaw ken ni Yahweh.
GEN_013_1	GEN	013	1	Dangan sinabihan ni Abram si Lot, Magkadugo kitang duwa, kaya dai dapat na mag-iriwal an satong mga pastor.	Kinuna ni Abram ken ni Lot, Saanta koma nga agrirriri, kasta met dagiti pastorta, agsipud ta agkabagianta.
GEN_013_1	GEN	013	1	Si Lot, na nag-iba ki Abram, igwa man nin mga karnero, kanding asin baka.	Adu met ti karnero, kalding ken baka ni Lot.
GEN_013_1	GEN	013	1	Kaya nagkaigwa nin pag-iriwal an mga pastor ni Abram asin ni Lot.	Daytoy ti gapuna a masansan nga agririri dagiti agay-aywan kadagiti animalda.
GEN_013_2	GEN	013	2	sa siring na paagi nagsuhay sindang duwa.	Nagsinada ken ni Abram, ket nagturong iti daya.
GEN_013_2	GEN	013	2	Igwa man siya nin pamilya asin mga oripon.	Adda bukodna a familia ken adu nga adipen.
GEN_013_2	GEN	013	2	Kaidto, an mga Cananeo asin Perezeo iyo an nag-eerok sa lugar na idto.	Agnanaed pay laeng idi dagiti Cananeo ken Perezeo iti dayta a deppaar.
GEN_013_2	GEN	013	2	pilion mo an arin man na parte kan daga na magustohan mo; kun pumawala ka, mapatoo ako; kun pumatoo ka, mapawala ako.	Piliem ti aniaman a paset ti daga a kayatmo a pagyanan ket innak met iti sabali.
GEN_013_2	GEN	013	2	Ini an kamugtakan kan daga bago tunawon nin Kagurangnan an Sodoma asin an Gomorra.	Saan pay idi a nadadael dagiti siudad ti Sodoma ken Gomorra.
GEN_013_2	GEN	013	2	Nagpatindog siya nin altar duman para sa Kagurangnan .	Nangbangon sadiay iti altar nga agpaay ken ni Yahweh.
GEN_013_2	GEN	013	2	nag-iba man saiya si Lot.	Intugotna ti asawana ken dagiti amin a sanikuana agraman ni Lot.
GEN_013_2	GEN	013	2	Dai nin makakabilang sainda huli ta mayo nin makakabilang kan alpog kan daga.	Awanto ti makabilang iti kaaduda ket nalaklakanto a bilangen ti tapok iti daga.
GEN_014_1	GEN	014	1	Si Melkizedek, na hade kan Salem asin padi kan Kahorohalangkaweng Dios, nagdara nin tinapay asin arak ki Abram.	Nangyeg met ni Melkisedec nga ari ti Salem ken padi pay ti Kangatoan a Dios iti tinapay ken arak ken ni Abram.
GEN_014_1	GEN	014	1	Nagsimbag si Abram, Sa atubang nin Kagurangnan , an Kahorohalangkaweng Dios, kaggibo kan langit asin daga, minasumpa ako	Insungbat ni Abram, Isapatak iti Apo a Kangatoan a Dios, ti namarsua iti langit ken daga,
GEN_014_1	GEN	014	1	Igwa nin apat na hade, si Amrafel kan Babilonia, si Ariok kan Ellasar, si Kedorlaomer kan Elam, asin si Tidal kan Goiim,	Uppat nga arini Amrafel nga ari ti Siniar, ni Arioc nga ari ti Elasar, ni Kedorlaomer nga ari ti Elam ken ni Tidal nga ari ti Goiim,
GEN_014_1	GEN	014	1	na nakigera sa lima pang hade na si Bera kan Sodoma, Birsa kan Gomorra, Sinab kan Adma, Semeber kan Zeboiim asin sa hade kan Bela o Zoar.	ti napan nanggubat iti lima nga ari: Bera nga ari ti Sodoma, Birsa nga ari ti Gomorra, Sinab nga ari ti Adma, Semeber nga ari ti Zeboiim ken ti ari ti Bela wenno Soar.
GEN_014_1	GEN	014	1	Pinagsararo kan limang hadeng ini an saindang mga hukbo duman sa Kapantayan nin Siddim na ngunyan iyo na an Gadan na Dagat.	Nagkaykaysa dagitoy lima nga ari ket pinagtitiponda dagiti buyotda iti Tanap ti Siddim nga isu ita ti Natay a Baybay.
GEN_014_1	GEN	014	1	na dai ako makua nin ano man na sadiri mo, minsan torsido o sintas kan sandalyas, tanganing dai mo masabing, Ako an nagpayaman ki Abram!	nga awan ti alaek a kukuam, uray la koma sinulid wenno kordon ti sapatos tapno dimonto kuna a sika ti nangpabaknang kaniak.
GEN_014_1	GEN	014	1	Sa laog nin doseng taon naglingkod sinda ki Kedorlaomer, alagad sa ikatreseng taon, nagrebelde sinda saiya.	Sangapulo ket dua a tawen nga inturayan ida ni Kedorlaomer ngem iti maika-13 a tawen, immalsada a maibusor kenkuana.
GEN_014_1	GEN	014	1	Sa ikakatorseng taon, ginera asin dinaog ni Kedorlaomer patin kan saiyang kaapil na mga hade an mga Refaim kan Asterot-karnaim, an mga Zuzim duman sa Ham, an mga Emim sa kapatagan nin Kiriataim,	Iti maika-14 a tawen, dimteng ni Kedorlaomer ken dagiti kakaduana agraman dagiti armadada ket pinarmekda dagiti Refaim idiay Asterot Karnaim, dagiti Zuzim idiay Ham, dagiti Emim idiay Tanap ti Kiriataim
GEN_014_1	GEN	014	1	asin an mga Horeo sa kabubuldan kan Edom, na saindang rinalamag sagkod sa El-paran na harani na sa desyerto.	ken dagiti Horeo iti kabambantayan ti Edomsinunsonda ida agingga idiay Elparan iti pungto ti let-ang.
GEN_014_1	GEN	014	1	Dangan nagbalik sinda asin nagduman sa Enmispat o Kades saka nasakop ninda an gabos na daga kan mga Amalekita asin dinaog ninda an mga Amoreo na nag-eerok sa Hazazon-tamar.	Kalpasanna, nagsublida ket dimtengda idiay Kades maaw-awagan idi iti Enmispat. Sinakupda ti amin a daga dagiti Amalekita ket pinarmekda dagiti Amorreo nga agnanaed idiay Hazazon Tamar.
GEN_014_1	GEN	014	1	Mayo akong kukuahon para sako. An aakoon ko sana iyo an ginamit kan sakong mga tawohan.	Awan ti alaek no di la dagiti inaramat dagiti tattao.
GEN_014_1	GEN	014	1	Dangan an mga hade kan Sodoma, Gomorra, Adma, Zeboiim asin Bela nag-andam kan saindang hukbo asin duman sa Kapantayan nin Siddim nakigera sinda	Inummong dagiti ari ti Sodoma, Gomorra, Adma, Zeboiim ken Bela dagiti armadada iti Tanap ti Siddim tapno gubatenda
GEN_014_1	GEN	014	1	laban sa mga hade kan Elam, Goiim, Babilonia, asin Ellasar;	dagiti ari ti Elam, Goiim, Siniar ken Elasar.
GEN_014_1	GEN	014	1	Sa Kapantayan nin Siddim kadakul an mga kalot na igwang aspalto, kaya kan magdulag sa ralaban an mga hade kan Sodoma asin Gomorra, nahulog sinda duman;	Nasaknapan ti tanap kadagiti abut a naikkan iti alketran ket idi itarayan dagiti ari ti Sodoma ken Gomorra ti paggugubatan, natnagda kadagiti palab-og.
GEN_014_1	GEN	014	1	Kaya sinamsam kan apat na hade an gabos na yaon sa Sodoma asin Gomorra, sagkod an gabos na kakanon duman dangan naghale sinda.	Innala dagiti uppat nga ari ti amin nga adda idiay Sodoma ken Gomorra agraman dagiti taraon sada pimmanaw.
GEN_014_1	GEN	014	1	Binihag man ninda an sobrino ni Abram na si Lot, na nag-eerok sa Sodoma, asin sinamsam an gabos niyang rogaring.	Innalada met ni Lot ken ti amin a sanikuana. Agnanaed idi ti kaanakan ni Abram idiay Sodoma.
GEN_014_1	GEN	014	1	Alagad igwa nin sarong lalaki na nakadulag, asin an gabos na nangyari inosip niya ki Abram, an Hebreyo na nag-eerok harani sa sagradong mga kahoy ni Mamre na Amorita.	Ngem adda lalaki a nakalibas ket impadamagna daytoy ken ni Abram a Hebreo nga agnanaed idi iti asideg dagiti lugo a kayo a kukua ni Mamre nga Amorreo.
GEN_014_1	GEN	014	1	Kan madangog ni Abram na binihag si Lot, inapod niya an gabos niyang tawohan sa kampo, mga tres syentos dyes y otso gabos, asin linamag ninda an apat na hade sagkod sa Dan.	Apaman a naammoan ni Abram a natiliw ti kaanakanna, inummongna dagiti amin a mannakigubat iti kampona nga agdagup iti 318 ket sinunsonda dagiti uppat nga ari agingga idiay Dan.
GEN_014_1	GEN	014	1	Pag-abot ninda duman, binaranga ni Abram sa nagkapirang grupo an saiyang tawohan, asin pagkabanggi sinalakay ninda an kalaban na saindang dinaog.	Sadiay, biningayna dagiti tattaona iti dua a bunggoy, dinarupda ti kabusor iti rabii ket pinarmekda ida.
GEN_014_1	GEN	014	1	dangan nabawi niya an gabos na sinamsam.	Naalada amin a nasamsam.
GEN_014_1	GEN	014	1	Kan magbalik si Abram hale sa panggana niya laban ki Kedorlaomer asin sa ibang mga hade, sinabat siya kan hade kan Sodoma duman sa Kapantayan nin Shave na inaapod man Kapantayan kan Hade.	Idi agsubli ni Abram kalpasan ti panangparmekna ken ni Kedorlaomer ken dagiti dadduma nga ari, sinabat ti ari ti Sodoma idiay Tanap ti Save a maaw-awagan met iti Tanap ti Ari.
GEN_014_1	GEN	014	1	Benendisyonan ni Melkizedek si Abram na an sabi, Bendisyonan logod si Abram kan Kahorohalangkaweng Dios, na kaggibo kan langit asin daga!	Indawat ni Melkisedec a mabendisionan ni Abram ket kinunana, Sapay koma ta bendisionan ti Kangatoan a Dios ni Abram.
GEN_014_1	GEN	014	1	Pag-omawon logod an Kahorohalangkaweng Dios na nagtao saimo nin kapangganahan laban sa saimong mga kaiwal!	Madaydayaw koma ti Kangatoan a Dios a nangted iti panagballigim kadagiti kabusormo.
GEN_014_1	GEN	014	1	Nagsabi ki Abram an hade kan Sodoma, Saimo na an sinamsaman, alagad balikan sako an mga tawohan ko.	Kinuna ti ari ti Sodoma ken Abram, Alaem dagiti sinamsammo ngem isublim dagiti amin a tattaok.
GEN_014_2	GEN	014	2	alagad an tolong hade nakadulag sa kabubuldan.	Nakataray dagiti tallo nga ari ket nagkamangda kadagiti kabambantayan.
GEN_014_2	GEN	014	2	Dangan tinawan ni Abram si Melkizedek kan ikasampolong parte kan gabos na sinamsam.	Ket inted ni Abram kenkuana ti apagkapullo ti amin a sinamsamna.
GEN_014_2	GEN	014	2	Alagad tugotan mong kumua kan saindang kahirasan an mga kaapil kong si Aner, si Escol, asin si Mamre.	Ngem ipalubosmo koma nga alaen dagiti kakaduak, da Aner, Escol ken Mamre, ti bingayda.
GEN_014_2	GEN	014	2	limang hade laban sa apat.	Lima nga ari kontra uppat nga ari.
GEN_014_2	GEN	014	2	Si Mamre asin an saiyang mga tugang na si Escol asin Aner, mga kaapil ni Abram.	Kadua ni Abram ni Mamre agraman da Escol ken Aner a kakabsatna.
GEN_014_2	GEN	014	2	Linamag niya sinda sagkod sa Hobah, sa amihan kan Damasco	Kinamatkamatda ida agingga idiay Hobah iti amianan ti Damasco.
GEN_014_2	GEN	014	2	Nabawi man niya si Lot na saiyang sobrino asin an mga rogaring kaini, kaiba an kababaehan saka an iba pang bilanggo.	Inyawidna met ni Lot a kaanakanna ken dagiti amin a sanikuana, agraman dagiti babbai ken dagiti dadduma a balud.
GEN_015_1	GEN	015	1	Kan nagsosolnop na an aldaw, nangatorog nin marahay si Abram asin nagkaigwa siya nin makuring takot.	Idi lumnek ti init, immapay ken ni Abram ti nargaan a turog. Nariknana ti panagbuteng ken panagamak gapu iti nakaro a kinasipnget.
GEN_015_1	GEN	015	1	Alagad naghapot si Abram, O Kagurangnan Dios , paano ko maaaraman na mapapasako ini?	Ngem kinuna ni Abram, O Apo Dios , kasano a maammoak a kukuak daytoy a daga?
GEN_015_1	GEN	015	1	Alagad nagsimbag si Abram, O Kagurangnan Dios , anong halaga kan itatao mo sakong premyo huli ta mayo akong aki, asin an sakong eredero iyo si Eliezer kan Damasco.	Ngem kinuna ni Abram, O Apo Dios , ania ti serbi kaniak ti gunggona nga itedmo idinto ta awan anakko? Ni laeng Eleazar a taga-Damasco ti agtawid kadagiti sanikuak.
GEN_015_1	GEN	015	1	Amoreo, Cananeo, Gergeseo asin mga Jebuseo.	dagiti Amorreo, dagiti Cananeo, dagiti Gergeseo ken dagiti Jebuseo.
GEN_015_1	GEN	015	1	Dinara ni Abram sa Dios an mga hayop;	Indatag ni Abram dagiti animal iti Dios.
GEN_015_1	GEN	015	1	Heteo, Perezeo, Refaim,	dagiti Heteo, dagiti Perezeo, dagiti Refaim,
GEN_015_1	GEN	015	1	Nadangog niya giraray na nagtaram saiya an Kagurangnan , Bako si Eliezer na saimong oripon an saimong magigin eredero kundi an sadiri mong aki.	Kalpasanna, nangngegna manen ni Yahweh a makisasao kenkuana, Saan a ni Eleazar a tagabu ti agtawid iti sanikuam no di ket ti bukodmo nga anak.
GEN_015_1	GEN	015	1	kaiba an mga dagang sadiri kan mga Cineo, Cenezeo, Cadmoneo,	agraman ti daga dagiti Kineo, dagiti Kenezeo, dagiti Kadmoneo,
GEN_015_1	GEN	015	1	Sa oras na idto nakipagtipan an Kagurangnan ki Abram asin nagtaram, Nanunuga ako na itatao ko sa saimong mga kapagarakian an bilog na dagang ini, magpoon sa Egipto sagkod sa Salog nin Eufrates,	Iti dayta met la a kanito, nakitulag ni Yahweh ken ni Abram. Kinunana, Ikarik nga itedko iti kaputotam amin daytoy a daga manipud iti beddeng ti Egipto agingga iti Karayan Eufrates,
GEN_015_1	GEN	015	1	Pakatapos kan mga pangyayaring ini, nagtaram an Kagurangnan ki Abram sa sarong bisyon, Dai ka matakot, Abram.	Kalpasan daytoy, nagparmata ni Abram ket nangngegna ni Yahweh a makisasao kenkuana: Dika agbuteng, Abram.
GEN_015_1	GEN	015	1	Kan solnop na an aldaw asin madiklom na, sarong nag-aasong koron saka sarong naglalaad na karaba an biglang nagtunga dangan nag-agi sa pagultanan kan binaraak na mga hayop.	Idi nakalneken ti init ket nagsaknapen ti sipnget, pagammoan adda nagparang nga umas-asuk a banga ken sumsumged nga aluten a limmasat iti nagbaetan dagiti nagudua-gudua nga animal.
GEN_015_1	GEN	015	1	Dangan dinara nin Kagurangnan si Abram sa luwas asin tinaraman, Hilinga an kalangitan asin bilanga an mga bitoon kun kaya mo;	Inruar ni Yahweh ni Abram ket kinunana, Tumangadka ket padasem a bilangen dagiti bituen.
GEN_015_1	GEN	015	1	Dai mo ako tinawan nin aki, asin sarong oripon na namundag sa sakong harong an sakong magigin eredero.	Dinak pinaraburan iti anak ket maysa kadagiti tagabuk ti agtawid iti sanikuak.
GEN_015_1	GEN	015	1	Apat na henerasyon pa an maagi bago makabalik digdi an saimong kapagarakian huli ta dai ko papahaleon an mga Amoreo sagkod na dai pa nagsobra an saindang karatan kaya kaipuhan nang padusahan sinda.	Mapalabasto ti uppat a kaputotan santo agsubli ditoy dagiti kaputotam agsipud ta sakonto la pagtalawen dagiti Amorreo inton nakaro ti kinadakesda ket masapul a madusada.
GEN_015_1	GEN	015	1	Alagad ika mabubuhay sa halawig na panahon, magagadan asin ilulubong na matoninong.	Atiddogto ti panagbiagmo, mataykanto a sitatalna ket maitanemkanto.
GEN_015_1	GEN	015	1	Dangan tinaraman nin Kagurangnan si Abram, Ako an Kagurangnan na nagkua saimo sa Ur kan Babilonia tanganing itao saimo ining daga bilang sadiri.	Kalpasanna, kinuna ni Yahweh kenkuana, Siak ni Yahweh a nangiruar kenka iti Ur idiay Caldea tapno ipatagikuak kenka daytoy a daga.
GEN_015_1	GEN	015	1	Nagtubod si Abram sa Kagurangnan , asin huli kaini, ibinilang nin Kagurangnan an pagtubod ni Abram bilang sarong katanosan.	Nagtalek ni Abram ken ni Yahweh ket gapu iti daytoy, naragsakan kenkuana ni Yahweh ket inawatna a kas nalinteg ni Abram.
GEN_015_1	GEN	015	1	Nag-arabot an mga bwitre tanganing kakanon an binaraak na mga hayop, alagad binugaw sinda ni Abram.	Nagdisso dagiti buitre kadagiti bangkay dagiti animal ngem binugawna ida.
GEN_015_1	GEN	015	1	Nagsimbag an Kagurangnan , Darahan mo ako nin sarong baka, sarong kanding asin sarong karnero na anas tolong taon an edad, saka sarong salampati asin sarong agbaan.	Insungbatna, Yegannak iti baka, kalding, kalakian a karnero nga agtawen iti tallo ti tunggal maysa, ken saggaysa a kalapati ken pagaw.
GEN_015_1	GEN	015	1	Dangan nagtaram saiya an Kagurangnan , An saimong mga kapagarakian magigin mga dayuhan sa bako nindang daga, magigin mga oripon duman asin pag-aapihon sa laog nin kwatro syentos na taon.	Kinuna ni Yahweh, Ganggannaetto dagiti kaputotam iti sabali a daga. Agbalindanto a tagabu sadiay ket 400 a tawen a maparparigatdanto.
