id	source_text	target_text
GEN_010_0036	030<TAB>An teritoryo na saindang pinag-erokan nagpoon sa Mesa pasiring sa Sefar sagkod sa kabubuldan sa sirangan.	030<TAB>Say dalin a panaayaman da sakop toy manlapud Mesa ya anggad Sefar, diad nipokdul a pasen ed bokig.
GEN_010_0037	031<TAB>Ini an mga aki ni Sem, na an lambang nasyon na may sadiring daga asin lengwahe.	031<TAB>Sikara yay kabyangay boleg nen Sem; manaayam so balang sakey ed dilin tribu to tan bansa to, tan walay dilin salita na balang tribu.
GEN_010_0038	032<TAB>Iyo ini an mga pamilya kan mga aking lalaki ni Noe, sosog sa saindang mga kapagarakian.	032<TAB>Si Noe so sengeg na amin da ra yan totoo, a walay bansa ra tan kailalakan da.
GEN_010_0039	032<TAB>Sa sainda nagpoon an gabos na nasyon sa kinaban na nakalakop sa daga pakatapos kan baha.	032<TAB>Kasumpal na delap, saray anak nen Noe so sengeg na amin a totood balang bansa ed tapew na dalin.
GEN_011_0001	verse<TAB>content	verse<TAB>content
GEN_011_0002	001<TAB>Kaidto, saro sana an lengwahe kan mga tawo sa kinaban.	001<TAB>Nen saman saksakey so salita tan panagbalikas na amin a katoowan ed intiron mundo.
GEN_011_0003	002<TAB>Sa pagparalakaw kan mga tawo sa sirangan, nakaabot sinda sa sarong kapatagan sa daga kan Babilonia asin duman na sinda nag-erok.	002<TAB>Nen amaarap irad bokig, asabi ray patar ed Babilonia tan nanayam irad man.
GEN_011_0004	003<TAB>Nag-orolay-olay sinda, Gumibo kita nin mga ladrilyo asin lutoon ta nin marahay.	003<TAB>Inkuandad sakey tan sakey, Manggawa tayoy laryo tan palbaen tayo ran maung.
GEN_011_0005	003<TAB>Kaya nagkaigwa sinda nin mga ladrilyo embes na gapo asin aspalto embes na semento.	003<TAB>Kanyan wala ray laryo ra a pinagkabato ra, tan alkitran a pinagkasiminto.
GEN_011_0006	004<TAB>Dangan nagsabi sinda, Gumibo kita nin sarong syudad, na igwa nin tore na abot sa langit, tanganing mabantog kita asin dai magkasiriblag sa bilog na kinaban.	004<TAB>Insan inkuanda, Mangipaalagey tayoy sakey a siudad a walay tori ton toktokdulen toy tawen, pian ombantug itayo ta ag la pigan nikaykayat itayod intiron mundo.
GEN_011_0007	005<TAB>Naghilig an Kagurangnan tanganing hilingon an syudad asin an tore na ginibo kan mga tawo.	005<TAB>Inmakseb so Katawan , ta nengnengen toy siudad tan say tori ya impaalagey na saraman a totoo,
GEN_011_0008	006<TAB>Nagtaram siya, An mga tawong ini nagkakasararo asin saro sana an saindang lengwahe; iyo ini an kapinonan kan saindang mga gigibohon.	006<TAB>insan inkuanto, Natan, saksakey ira yan totoo tan saksakey so salita ra.
GEN_011_0009	006<TAB>Dai mahahaloy magigibo na ninda an ano man na saindang mawoton.	006<TAB>Gapo labat ya na getma ran gawaen.
GEN_011_0010	007<TAB>Magduman kita asin ribongon ta an saindang lengwahe tanganing dai na sinda magkasinarabotan.	006<TAB>Ag mabayag, nagawaan da lay labalabay dan gawaen.
GEN_011_0011	008<TAB>Kaya iwinarak nin Kagurangnan an mga tawo sa bilog na kinaban asin binayaan kan mga ini an pagtugdok kan syudad.	007<TAB>Onakseb itayo tan pandoromaen tayoy salita ra, pian ag ira makapantatalusan.
GEN_011_0012	009<TAB>An syudad nginaranan Babilon, huli ta duman rinibong nin Kagurangnan an lengwahe kan gabos na tawo, asin hale duman iwinarak niya sinda sa bilog na kinaban.	008<TAB>Inkayat ira sirin na Katawan diad intiron mundo, kanyan tinondaan da ya impaalagey imay siudad.
GEN_011_0013	010<TAB>Iyo ini an mga kapagarakian ni Sem.	009<TAB>Babilonia so impanawag dad saman a siudad, ta diad sayan lugar impandoroma na Katawan so salita na amin a katoowan tan manlapud man, inkayat to ran amin ed intiron mundo.
GEN_011_0014	010<TAB>Duwang taon pakatapos kan baha, kan sanggatos na an edad ni Sem, nagkaigwa siya nin aking lalaki na iyo si Arpaksad.	010<TAB>Sikara yay kabyangay boleg nen Sem.
GEN_011_0015	011<TAB>Dangan nabuhay pa siya sa laog nin kinyentos na taon asin nagkaigwa pa nin ibang mga aki.	010<TAB>Kalabas na duay taon kayari to may linmabas a delap, si Sem, nen mantaon na sanlasus, walay anak ton laki a manngaray Arpaksad.
GEN_011_0016	012<TAB>Kan treynta y singkong taon na si Arpaksad, namundag an aki niyang si Sela.	011<TAB>Nambilay ni na liman lasus a taon tan wala ni ray arum ya anak ton lalaki tan bibii.
GEN_011_0017	013<TAB>Dangan nabuhay pa siya sa laog nin kwatro syentos tres na taon asin nagkaigwa pa nin ibang mga aki.	012<TAB>Nen mantaon na talomplo tan lima si Arpaksad, awalaay ilalak a laki a si Sela;
GEN_011_0018	014<TAB>Kan treyntang taon na si Sela, namundag an aki niyang si Eber.	013<TAB>nambilay ni na apat a lasus tan taloy taon tan wala ni ray arum ya anak ton lalaki tan bibii.
GEN_011_0019	015<TAB>Dangan nabuhay pa siya sa laog nin kwatro syentos tres na taon asin nagkaigwa pa nin ibang mga aki.	014<TAB>Nen mantaoy talomplo si Sela, walay anak ton laki a si Eber;
GEN_011_0020	016<TAB>Kan treynta y kwatrong taon na si Eber, namundag an aki niyang si Peleg.	015<TAB>nambilay ni na apat a lasus tan taloran taon tan wala ni ray arum ya anak ton lalaki tan bibii.
GEN_011_0021	017<TAB>Dangan nabuhay pa siya sa laog nin kwatro syentos treyntang taon asin nagkaigwa pa nin ibang mga aki.	016<TAB>Nen mantaoy talomplo tan apat si Eber, walay anak ton laki a si Peleg;
GEN_011_0022	018<TAB>Kan treyntang taon na an edad ni Peleg, namundag an aki niyang si Reu.	017<TAB>nambilay ni na apat a lasus tan talomplon taon tan wala ni ray arum ya anak ton lalaki tan bibii.
GEN_011_0023	019<TAB>Dangan nabuhay pa siya sa laog nin dos syentos nwebeng taon asin nagkaigwa pa nin ibang mga aki.	018<TAB>Nen mantaon na talomplo si Peleg, walay anak ton laki a si Reu;
GEN_011_0024	020<TAB>Kan treynta y dos na an edad ni Reu, namundag an aki niyang si Serug.	019<TAB>nambilay ni na duan lasus tan siamira a taon tan wala ni ray arum ya anak ton lalaki tan bibii.
GEN_011_0025	021<TAB>Dangan nabuhay pa siya sa laog nin dos syentos syeteng taon asin nagkaigwa pa nin ibang mga aki.	020<TAB>Nen mantaon na talomplo tan dua si Reu, walay anak ton laki a si Serug;
GEN_011_0026	022<TAB>Kan treyntang taon na an edad ni Serug, namundag an aki niyang si Nahor.	021<TAB>nambilay ni na duan lasus tan piton taon tan wala ni ray anak ton lalaki tan bibii.
GEN_011_0027	023<TAB>Dangan nabuhay pa siya sa laog nin dos syentos na taon asin nagkaigwa pa nin ibang mga aki.	022<TAB>Nen mantaon na talomplo si Serug, walay anak ton laki a si Nacor;
GEN_011_0028	024<TAB>Kan beynte y nwebeng taon na an edad ni Nahor, namundag an aki niyang si Tera.	023<TAB>nambilay ni na duan lasus taon tan wala ni ray arum ya anak ton lalaki tan bibii.
GEN_011_0029	025<TAB>Dangan nabuhay pa siya sa laog nin syento dyes y nwebeng taon asin nagkaigwa pa nin ibang mga aki.	024<TAB>Nen mantaon na duamplo tan siam si Nacor, walay anak ton laki a si Tare;
GEN_011_0030	026<TAB>Kan setenta na an edad ni Tera, namundag an mga aki niya na iyo si Abram, si Nahor asin si Haran.	025<TAB>nambilay ni na sanlasus tan labinsiam taon tan wala ni ray arum ya anak ton lalaki tan bibii.
GEN_011_0031	027<TAB>Iyo ini an mga kapagarakian ni Tera, na ama ni Abram, Nahor asin Haran.	026<TAB>Nen mantaon na pitomplo si Tare, walay anak ton lalaki a di Abram, Nacor, tan Haran.
GEN_011_0032	027<TAB>Si Haran iyo an ama ni Lot.	027<TAB>Sikara yay kabyangay boleg nen Tare: si Tare so ama di Abram, Nacor, tan Haran.
GEN_011_0033	028<TAB>Naenot na nagadan si Haran ki sa ama niyang si Tera, duman sa dagang namundagan niya, sa Ur kan Babilonia.	027<TAB>Si Haran so ama nen Lot,
GEN_011_0034	029<TAB>Naagom ni Abram si Sarai asin naagom ni Nahor si Milca na aki ni Haran asin tugang ni Isca.	028<TAB>tan inatey si Haran diad dilin baley ton Ur na Babilonia nen mabilay niy ama to.
GEN_011_0035	030<TAB>Alagad baog si Sarai kaya dai siya nagkaaki.	029<TAB>Inasawa nen Abram si Sarai, tan inasawa nen Nacor si Milca ya anak nen Haran ya ama nen Isca.
GEN_011_0036	031<TAB>Kan maghale si Tera sa Ur kan Babilonia tanganing magduman sa Canaan, ipinag-iba niya si Abram na saiyang aki, an makoapo niyang si Lot na aki ni Haran asin an manugang niyang si Sarai; alagad kan makaabot sinda sa Haran, duman na sinda nag-erok.	030<TAB>Anggapoy anak nen Sarai, ta lepes.
GEN_011_0037	032<TAB>Nagadan si Tera sa Haran sa edad na dos syentos singkong taon.	031<TAB>Tinmaynan si Tare ed baley na Ur na Babilonia, a kaiba toy anak ton Abram, si apo ton Lot ya anak nen Haran, tan si manugang ton Sarai ya asawa nen Abram.
GEN_011_0038	<MISSING_TRANSLATION>	031<TAB>Linma rad dalin na Canaan, et nen asabi ray dalin na Haran, diman la ra nanayam.
GEN_011_0039	<MISSING_TRANSLATION>	032<TAB>Inatey diman si Tare nen mantaoy duan lasus tan lima.
GEN_012_0001	verse<TAB>content	verse<TAB>content
GEN_012_0002	001<TAB>Tinaraman nin Kagurangnan si Abram, Bayaan mo an saimong daga, an saimong mga kadugo asin an harong kan saimong ama dangan magduman ka sa dagang ipapahiling ko saimo.	001<TAB>Inkuan na Katawan ed kinen Abram, Taynan moy baley mo, saray kakanayon mo, tan say abung na amam, insan ka onlad bansan ipanengneng kod sika.
GEN_012_0003	002<TAB>Gigibohon takang sarong dakulang nasyon, bebendisyonan taka asin gigibohon kong bantog an saimong ngaran tanganing ika magin sarong bendisyon.	002<TAB>Itdan ta kay amayamay a kabyangay boleg mo, tan magmaliw iran sakey a bansan matalonggaring.
GEN_012_0004	003<TAB>Bebendisyonan ko an mga mabendisyon saimo,	002<TAB>Bindisionan ta ka tan pagmaliwen kon bantug so ngaran mo, pian sikay pakabindisionan na arum a totoo.
GEN_012_0005	004<TAB>Asin isusumpa ko an mga masumpa saimo;	003<TAB>Bindisionan ko ray mamindision ed sika,
GEN_012_0006	005<TAB>Sa paagi mo, bebendisyonan ko man an gabos na nasyon sa daga.	004<TAB>Balet isambak iray mangisambad sika.
GEN_012_0007	006<TAB>Kaya kan setenta y singko na an edad ni Abram, binayaan niya an Haran sosog sa itinaram saiya nin Kagurangnan ; nag-iba saiya si Lot.	005<TAB>Diad panamegley mo bindisionan kon amin iray bansa ed mundo.
GEN_012_0008	007<TAB>Ipinag-iba ni Abram si Sarai na saiyang agom, asin an sobrino niyang si Lot patin an mga oripon na napasainda sa Haran; dara man ninda an gabos nindang pagsadiri.	006<TAB>Nen mantaon na pitomplo tan lima si Abram, tinaynan toy Haran, onung na imbagay Katawan ed sikato.
GEN_012_0009	007<TAB>Dangan naglakaw sinda pasiring sa daga nin Canaan.	007<TAB>Inawit nen Abram si Sarai ya asawa to, si Lot a kaanakan to, tan amin iray kayamanan tan saray aripen ya atipon da nen wala rad Haran, insan ira amaarap ed dalin na Canaan.
GEN_012_0010	008<TAB>Pag-abot ninda duman,	008<TAB>Nen sinmabi rad Canaan,
GEN_012_0011	009<TAB>nagpadagos pa sa paglakaw si Abram sagkod na makaabot siya sa sagradong kahoy nin More, an banal na lugar sa Shekem.	009<TAB>tinmuloy si Abram ya anggad masanton kiew ed More, say masanton lugar na Sikem.
GEN_012_0012	009<TAB>Kaidtong panahon duman pa nag-eerok an mga Cananeo.	009<TAB>Diad saman a panaon, manaayam ni rad may Cananeo.
GEN_012_0013	010<TAB>Nagpahiling an Kagurangnan ki Abram asin nagtaram saiya, Iyo ini an daga na itatao ko sa saimong mga kapagarakian.	010<TAB>Pinmanengneng so Katawan ed kinen Abram tan inkuantod sikato, Sikato yay bansa ya iter kod saray kabyangay boleg mo.
GEN_012_0014	010<TAB>Kaya naggibo siya duman nin altar para sa Kagurangnan na nagpahiling saiya.	010<TAB>Nanggawad may Abram na altar a para Katawan a pinmanengneng ed sikato.
GEN_012_0015	011<TAB>Dangan nagpasiring siya sa mabulod na lugar sa sirangan kan Betel asin itinugdok an saiyang tolda sa pagultanan kan Betel na nasa solnopan asin kan Ai na nasa sirangan.	011<TAB>Insan tinmuloy ed bandad abalaten diad nipokdul a pasen a nibokig na Betel, tan nankampod nanleetan na Betel tan Hai diad bokig.
GEN_012_0016	011<TAB>Guminibo siya duman nin altar asin nagsamba sa Kagurangnan .	011<TAB>Nanggawa met diman na altar tan inggalang toy Katawan .
GEN_012_0017	012<TAB>Dangan nagpadagos sa paglakaw si Abram pasiring sa habagat na parte kan Canaan.	012<TAB>Manlapud man, tinmonda-tondan nanaayam ed nandoroman pasen ya anggad akasabid bandad abalaten a parti na Canaan.
GEN_012_0018	013<TAB>Nagkaigwa nin gutom sa Canaan, asin makuring gayo an gutom duman, kaya nagpasiring sa Egipto si Abram tanganing duman ngona mag-erok.	013<TAB>Balet walay eras ed saman a lugar, et lapud mapalalo la linmay Abram ed bandad abalaten, diad Egipto, ta manayam diman a magano.
GEN_012_0019	014<TAB>Kan malaog na siya sa Egipto, sinabihan niya si Sarai na saiyang agom, Saro kang magayon na babae.	014<TAB>Nen asingger to lan beltangen so ketegan a mamaarap ed Egipto, inkuantod kinen Sarai ya asawa to, Maganggana kan bii.
GEN_012_0020	015<TAB>Kun mahiling ka kan mga Egipcio, sasabihon nindang agom taka kaya gagadanon ninda ako alagad bubuhayon ka.	015<TAB>No nanengneng da ka ray Egipsio, ibaga ran asawa ta ka.
GEN_012_0021	016<TAB>Sabihan mo sindang tugang taka tanganing huli saimo magin marahay an pag-ako ninda sako asin dai ninda ako paggadanon.	015<TAB>Pateyen da ak ed satan, balet bilayen da ka.
GEN_012_0022	017<TAB>Kan maglaog na si Abram sa Egipto, nahiling kan mga Egipcio na talagang magayon an saiyang agom.	016<TAB>Walay maung, ibagam ed sikaran agi ta ka, pian ag da ak pateyen, no ag ingen asikasoen da ak lapud sika.
GEN_012_0023	018<TAB>Nahiling man siya kan mga opisyal kan hade nin Egipto asin inosip ninda saiya na talagang magayon si Sarai, kaya dinara ninda ini sa palasyo.	017<TAB>Nen akasabi rad Egipto, anengneng a tua na saray tagad man a magangganay asawa nen Abram.
GEN_012_0024	019<TAB>Huli ki Sarai, nagin marahay an pag-ako ki Abram kan hade.	018<TAB>Anengneng na pigarad saray opisyal na palasio tan imbalita rad ari so ontan lan ganggana to; kanyan inawit day Sarai ed palasio na ari.
GEN_012_0025	019<TAB>Tinawan siya kaini nin mga karnero, kanding, baka, asno, oripon asin kamelyo.	019<TAB>Lapud sikato, maung so imapangasikaso na ari ed kinen Abram tan initdan to na saray karniro tan kanding, saray baka tan asno, saray kamilyo tan pati saray aripen a lalaki tan bibii.
GEN_012_0026	020<TAB>Alagad huli ta kinua kan hade si Sarai, siya asin an mga yaon sa saiyang palasyo pinadarahan nin Kagurangnan nin mga makangirhat na helang.	020<TAB>Balet lapud inalay ari si Sarai, say Katawan impansakit to na ambelat so ari tan saray totood palasio.
GEN_012_0027	021<TAB>Kaya ipinaapod kan hade si Abram asin hinapot, Ano ining ginibo mo sako?	021<TAB>Impaawit na ari si Abram tan tinepet to, Antoy ginawam ed siak?
GEN_012_0028	021<TAB>Tano ta dai ka nagtaram na agom mo an babaeng ini?	021<TAB>Akin et ag mo imbagad siak ya asawam manaya si Sarai?
GEN_012_0029	022<TAB>Tano ta nagsabi kang tugang mo siya, kun kaya kinua ko siya na magin agom ko?	022<TAB>Akin et imbagam ya agim tan inabuloyan mon inalak ya asawa?
GEN_012_0030	022<TAB>Uya an agom mo; kuaha siya asin hale na kamo!	022<TAB>Niay asawam, alam la tan taynan ki la!
GEN_012_0031	023<TAB>Nagboot an hade sa mga tawohan niya manongod ki Abram, kaya pinahale ninda ini sa Egipto kaiba an saiyang agom asin an gabos niyang rogaring.	023<TAB>Ingganggan na ari ray totoo to a paekalen da rad bansa, kanyan pinataynan day Abram, samay asawa to tan amin a kayaryan to.
GEN_013_0001	verse<TAB>content	verse<TAB>content
GEN_013_0002	001<TAB>Pakahale sa Egipto, naglakaw si Abram pasiring sa habagat na parte kan Canaan kaiba an saiyang agom asin an gabos niyang rogaring; nag-iba man saiya si Lot.	001<TAB>Manlapud Egipto linmay Abram ed bandad abalaten na Canaan a kaiba to si Sarai ya asawa to tan amin a kayaryan to; akilad sikato si Lot.
GEN_013_0003	002<TAB>Mayaman nang marahay si Abram huli ta kadakul na kan saiyang mga hayop, plata asin bulawan.	002<TAB>Mayamyaman lay Abram, ta amayamay la ray karniro, kanding, baka, pilak tan balituk to.
GEN_013_0004	003<TAB>Hale sa duman, nagpadagos siyang maglakaw sagkod na makaabot sa pagultanan kan Betel asin Ai, sa lugar na tinugdokan niya kaidto kan saiyang tolda,	003<TAB>Tinmaynan lamet diman tan nanalis-alis so nankampoan to ya anggad akasabid Betel.
GEN_013_0005	004<TAB>asin pinatindogan niya nin altar.	003<TAB>Insan asabi to may pasen a nanleetan na Betel tan Ai a nanayaman to nen saman
GEN_013_0006	004<TAB>Duman nagsamba si Abram sa Kagurangnan .	004<TAB>tan nanggawaan toy altar.
GEN_013_0007	005<TAB>Si Lot, na nag-iba ki Abram, igwa man nin mga karnero, kanding asin baka.	004<TAB>Diman to inggalang so Katawan .
GEN_013_0008	005<TAB>Igwa man siya nin pamilya asin mga oripon.	005<TAB>Si Lot a kaiba nen Abram et wala met iray karniro to, kanding tan saray baka to; wala met so dilin pamilya to tan saray dilin aripen to.
GEN_013_0009	006<TAB>Huli ta kadakul na kan mga hayop na pagsadiri ni Abram asin ni Lot, an daga dai na magkanigo para sa saindang duwa.	006<TAB>Kulang so pampastolan no manolup iran dua, ta dakerakel iray ayayep da.
GEN_013_0010	007<TAB>Kaya nagkaigwa nin pag-iriwal an mga pastor ni Abram asin ni Lot.	007<TAB>Lapud saya mabetbet so siblangan da ray pumapastol nen Abram tan saray pumapastol nen Lot.
GEN_013_0011	007<TAB>Kaidto, an mga Cananeo asin Perezeo iyo an nag-eerok sa lugar na idto.	007<TAB>Diad saman a panaon, manaayam nid man iray Cananeo tan saray Perezeo.
GEN_013_0012	008<TAB>Dangan sinabihan ni Abram si Lot, Magkadugo kitang duwa, kaya dai dapat na mag-iriwal an satong mga pastor.	008<TAB>Inkuanen Abram ed kinen Lot, Sankanayon ita, tan ag nepeg a mansebeg iray totook tan saray totoom.
GEN_013_0013	009<TAB>Mas marahay pang magsuhay kita; pilion mo an arin man na parte kan daga na magustohan mo; kun pumawala ka, mapatoo ako; kun pumatoo ka, mapawala ako.	009<TAB>Say maung, mansiyan ita la.
GEN_013_0014	010<TAB>Nangalagkalag si Lot asin nahiling niya na mayaman sa tubig an bilog na Kapantayan nin Jordan sagkod sa Zoar, arog kan tatamnan kan Kagurangnan o arog kan daga nin Egipto.	009<TAB>Pilim so labalabay mon dalin.
GEN_013_0015	010<TAB>Ini an kamugtakan kan daga bago tunawon nin Kagurangnan an Sodoma asin an Gomorra.	009<TAB>Lakad sakey a pasen; onla ak balet ed sananey.
GEN_013_0016	011<TAB>Kaya pinili ni Lot an bilog na Kapantayan nin Jordan, asin naglakaw siya pasiring sa sirangan; sa siring na paagi nagsuhay sindang duwa.	010<TAB>Ninengneng sirin nen Lot so kaliber-liber tan abantag ton say patar na Jordan ya anggad Zoar et dakel so danum to, a singa Tanamanan na Katawan o singa dalin na Egipto.
GEN_013_0017	012<TAB>Nagpawalat si Abram sa Canaan mantang si Lot nag-erok sa mga syudad duman sa kapantayan na harani sa Sodoma.	010<TAB>Diad saman a panaon, ag ni dineral na Katawan so siudad na Sodoma tan say siudad na Gomorra.
GEN_013_0018	013<TAB>An nag-eerok sa Sodoma mga maraot na tawo asin mga parakasala sa Kagurangnan .	011<TAB>Kanyan pinili nen Lot a betang to so intiron Patar na Jordan, insan amaarap diman ed bokig.
GEN_013_0019	014<TAB>Pakahale ni Lot, nagtaram an Kagurangnan ki Abram, Mangalagkalag ka sa palibot mo,	011<TAB>Onyay impansian dan dua.
GEN_013_0020	015<TAB>huli ta an gabos na daga na nahihiling mo itatao ko sa saimo asin sa mga kapagarakian mo sagkod lamang.	012<TAB>Tinmilak si Abram ed Canaan, balet nanayam si Lot ed saray siudad diad patar ya asingger ed Sodoma.
GEN_013_0021	016<TAB>Papadakulon ko siring sa alpog kan daga an saimong mga kapagarakian.	013<TAB>Maoges iray totood man; mapalaloy kasalanan dad Katawan .
GEN_013_0022	016<TAB>Dai nin makakabilang sainda huli ta mayo nin makakabilang kan alpog kan daga.	014<TAB>Kasiput nen Lot, inkuan na Katawan ed kinen Abram, Manlapud tan ed kawalaan mo, nengneng mon maung so kaliber-liber mo;
GEN_013_0023	017<TAB>Lakaw asin hilinga an bilog na daga ta itatao ko gabos iyan saimo.	015<TAB>amin a dalin a nabantag mo, iter kod sika tan diad saray kabyangay boleg mo, tan kayaryan mo ra ya anggad angga.
GEN_013_0024	018<TAB>Kaya naghale duman si Abram asin nag-erok harani sa sagradong mga kahoy ni Mamre sa Hebron.	016<TAB>Diad karakel na iter kod sikan kabyangay boleg mo, no bilangen mo ra singa ka mambibilang na dabuk.
GEN_013_0025	018<TAB>Nagpatindog siya nin altar duman para sa Kagurangnan .	017<TAB>Natan sirin, liber mo yan dalin, ta iter kod sikan amin.
GEN_013_0026	<MISSING_TRANSLATION>	018<TAB>Inyalis nen Abram so tulda to ed abay na saray masanton kiew ed Mamre diad Hebron tan nanayam diman.
GEN_013_0027	<MISSING_TRANSLATION>	018<TAB>Nanggawad man met na altar a para Katawan .
GEN_014_0001	verse<TAB>content	verse<TAB>content
GEN_014_0002	001<TAB>Igwa nin apat na hade, si Amrafel kan Babilonia, si Ariok kan Ellasar, si Kedorlaomer kan Elam, asin si Tidal kan Goiim,	001<TAB>Saray apatiran arari a di Amrafel na Babilonia, Arioc na Elasar, Kedorlaomer na Elam, tan Tidal na Goiim
GEN_014_0003	002<TAB>na nakigera sa lima pang hade na si Bera kan Sodoma, Birsa kan Gomorra, Sinab kan Adma, Semeber kan Zeboiim asin sa hade kan Bela o Zoar.	002<TAB>et akibakal irad limaran arari a di Bera na Sodoma, Birsa na Gomorra, Sinab na Adma, Semeber na Ziboiim, tan say ari na Bela o Zoar.
GEN_014_0004	003<TAB>Pinagsararo kan limang hadeng ini an saindang mga hukbo duman sa Kapantayan nin Siddim na ngunyan iyo na an Gadan na Dagat.	003<TAB>Sarayan limaran ari nankakasakey ira tan impanoolup da ray sondalo ra ed Patar na Sidim ya Inatey a Dayat natan.
GEN_014_0005	004<TAB>Sa laog nin doseng taon naglingkod sinda ki Kedorlaomer, alagad sa ikatreseng taon, nagrebelde sinda saiya.	004<TAB>Labinduay taon la ran walad silong na pakaoley nen Kedorlaomer, balet diad kumalabintalon taon nilabanan da.
GEN_014_0006	005<TAB>Sa ikakatorseng taon, ginera asin dinaog ni Kedorlaomer patin kan saiyang kaapil na mga hade an mga Refaim kan Asterot-karnaim, an mga Zuzim duman sa Ham, an mga Emim sa kapatagan nin Kiriataim,	005<TAB>Diad kumalabinapat taon si Kedorlaomer, saray ararin kakaiba to, tan saray sondalo ra et linma ran linmaban ed saramay limara.
GEN_014_0007	006<TAB>asin an mga Horeo sa kabubuldan kan Edom, na saindang rinalamag sagkod sa El-paran na harani na sa desyerto.	005<TAB>Diad inyakar da tinalo da ray Refaita ed Astarot-Carnaim, saray Zuzita ed Ham, saray Emita ed Save-kiryataim.
GEN_014_0008	007<TAB>Dangan nagbalik sinda asin nagduman sa Enmispat o Kades saka nasakop ninda an gabos na daga kan mga Amalekita asin dinaog ninda an mga Amoreo na nag-eerok sa Hazazon-tamar.	006<TAB>Tinalo da met iray Horeo diad kapalandeyan na Edom, tan inosilan da ra ya anggad Elparan, diad samput na kalawakan.
GEN_014_0009	008<TAB>Dangan an mga hade kan Sodoma, Gomorra, Adma, Zeboiim asin Bela nag-andam kan saindang hukbo asin duman sa Kapantayan nin Siddim nakigera sinda	007<TAB>Insan ira amoliktar, pinmawil irad Cades Enmispat nen saman, sinakop da ray amin a dalin na saray Amalecita, tan tinalo da ray Amorreo a manaayam ed Hazazontamar.
GEN_014_0010	009<TAB>laban sa mga hade kan Elam, Goiim, Babilonia, asin Ellasar; limang hade laban sa apat.	008<TAB>Tinipon na saray ari na Sodoma, Gomorra, Adma, Zeboim, tan Bela ed patar na Sidim iray sondalo ra tan akilaban irad
GEN_014_0011	010<TAB>Sa Kapantayan nin Siddim kadakul an mga kalot na igwang aspalto, kaya kan magdulag sa ralaban an mga hade kan Sodoma asin Gomorra, nahulog sinda duman; alagad an tolong hade nakadulag sa kabubuldan.	009<TAB>saray ari na Elam, Goiim, Babilonia, tan Elasar; limara laban ed apatira.
GEN_014_0012	011<TAB>Kaya sinamsam kan apat na hade an gabos na yaon sa Sodoma asin Gomorra, sagkod an gabos na kakanon duman dangan naghale sinda.	010<TAB>Dakel diman iray maawang a bobun na alkitran, et nen ibabatikan day bakal ira may ari na Sodoma tan Gomorra naplag irad saraman a bobun, balet akabatik ed kapalandeyan ira may taloran ari.
GEN_014_0013	012<TAB>Binihag man ninda an sobrino ni Abram na si Lot, na nag-eerok sa Sodoma, asin sinamsam an gabos niyang rogaring.	011<TAB>Inala na apatiran arari iray amin a walad Sodoma tan Gomorra, pati saray kakanen, insan la ra tinmaynan.
GEN_014_0014	013<TAB>Alagad igwa nin sarong lalaki na nakadulag, asin an gabos na nangyari inosip niya ki Abram, an Hebreyo na nag-eerok harani sa sagradong mga kahoy ni Mamre na Amorita.	012<TAB>Manaayam diman si Lot a kaanakan nen Abram, kanyan inala ra met tan amin a kayaryan to.
GEN_014_0015	013<TAB>Si Mamre asin an saiyang mga tugang na si Escol asin Aner, mga kaapil ni Abram.	013<TAB>Balet walay toon akabatik tan imbaga to ra yan amin ed kinen Abram a Hebreo, a manaayam ed abay na saray masanton kiew nen Mamre ya Amorreo.
GEN_014_0016	014<TAB>Kan madangog ni Abram na binihag si Lot, inapod niya an gabos niyang tawohan sa kampo, mga tres syentos dyes y otso gabos, asin linamag ninda an apat na hade sagkod sa Dan.	013<TAB>Si Mamre tan di Escol tan Aner ya agagi to et kagampi ray Abram.
GEN_014_0017	015<TAB>Pag-abot ninda duman, binaranga ni Abram sa nagkapirang grupo an saiyang tawohan, asin pagkabanggi sinalakay ninda an kalaban na saindang dinaog.	014<TAB>Nen nadngelan nen Abram ya adakep si kaanakan to, tinawag ton amin iray totoo ton sarag day mibakal tan akatipon na talon lasus tan labinwalon lalaki.
GEN_014_0018	015<TAB>Linamag niya sinda sagkod sa Hobah, sa amihan kan Damasco	014<TAB>Inosilan to ya anggad Dan ira may apatiran arari.
GEN_014_0019	016<TAB>dangan nabawi niya an gabos na sinamsam.	015<TAB>Kasabi tod man, impankadwa to ray totoo to, dinogpaan dad labi iray kalaban da tan tinalo da ra.
GEN_014_0020	016<TAB>Nabawi man niya si Lot na saiyang sobrino asin an mga rogaring kaini, kaiba an kababaehan saka an iba pang bilanggo.	015<TAB>Inosilan to ran anggad Hoba a walad baybay na Damasco,
GEN_014_0021	017<TAB>Kan magbalik si Abram hale sa panggana niya laban ki Kedorlaomer asin sa ibang mga hade, sinabat siya kan hade kan Sodoma duman sa Kapantayan nin Shave na inaapod man Kapantayan kan Hade.	016<TAB>tan abawi to ray amin ya asamsam da.
GEN_014_0022	018<TAB>Si Melkizedek, na hade kan Salem asin padi kan Kahorohalangkaweng Dios, nagdara nin tinapay asin arak ki Abram.	016<TAB>Abawi to met si Lot tan saray kayaryan to, pati saray bibii tan arum ni ran totoon adakep.
