id	source_text	target_text
GEN_031_0033	Mitabok siya sa Suba sa Eufrates ug mipaingon sa Bukid sa Gilead.	Dinaya mo ako at dinala ang aking mga anak na babae na parang mga bihag ng tabak?
GEN_031_0034	Human molabay ang tulo ka adlaw gisuginlan si Laban nga mikagiw si Jacob.	Bakit ka lihim na tumakas at dinaya mo ako at hindi ka nagsabi sa akin?
GEN_031_0035	Busa gidala niya ang iyang mga tawo ug giagpas nila si Jacob.	Naihatid sana kita na may pagsasaya at awitan, may tambol at may alpa.
GEN_031_0036	Mipanaw silag pito ka adlaw hangtod nga naapsan nila si Jacob didto sa Bukid sa Gilead.	Hindi mo man lamang ipinahintulot sa akin na mahalikan ang aking mga anak na lalaki at babae?
GEN_031_0037	Ug niadtong gabhiona ang Dios mipakita kang Laban nga Arameanhon pinaagi sa damgo ug miingon, Ayaw gayod pasipad-i si Jacob.	Ang ginawa mo'y isang kahangalan.
GEN_031_0038	Naapsan ni Laban si Jacob nga nagkampo didto sa kabungtoran.	Nasa aking kapangyarihan ang gawan kayo ng masama.
GEN_031_0039	Nagkampo usab si Laban didto sa Bukid sa Gilead.	Ngunit ang Diyos ng inyong ama ay nagsalita sa akin kagabi, na sinasabi, Ingatan mong huwag kang magsalita kay Jacob ng mabuti o masama man.
GEN_031_0040	Unya si Laban miingon kang Jacob, Nganong gilimbongan mo man ako ug gidala mo ang akong mga anak nga morag mga binihag sa gubat?	Kahit kailangan mong umalis sapagkat nasasabik ka na sa bahay ng iyong ama, bakit mo ninakaw ang aking mga diyos?
GEN_031_0041	Nganong milakaw ka man nga wala mananghid kanako?	At sumagot si Jacob kay Laban, Sapagkat ako'y natakot; iniisip ko na baka kunin mo nang sapilitan sa akin ang iyong mga anak.
GEN_031_0042	Kon nananghid ka pa, pagikanon ko unta ikaw uban sa kalipay ug mga pag-awit, dinuyogan sa tamborin ug sa alpa.	Ngunit kanino mo man matagpuan ang iyong mga diyos ay hindi mabubuhay.
GEN_031_0043	Wala mo gani ako pahagka sa akong mga apo ug mga anak agig panamilit.	Sa harapan ng ating mga kamag-anak, ituro mo kung anong iyo na nasa akin, at kunin mo iyon.
GEN_031_0044	Pagkadakong binuang niining imong gibuhat!	Hindi nalalaman ni Jacob na si Raquel ang nagnakaw noon.
GEN_031_0045	Mahimo nga pasipad-an ko ikaw apan kagabii, ang Dios sa imong amahan miingon kanako, Ayaw baya pasipad-i si Jacob.	Kaya pumasok si Laban sa tolda nina Jacob, Lea, at ng dalawang alilang babae, subalit hindi niya natagpuan.
GEN_031_0046	Nasayod ako nga milayas ka kay gimingaw ka na sa inyo apan nganong gikawat mo man ang akong mga dios?	Lumabas siya sa tolda ni Lea at pumasok sa tolda ni Raquel.
GEN_031_0047	Si Jacob mitubag, Nahadlok ako nga dili mo pakuyogon kanako ang imong mga anak nga babaye.	Nakuha nga ni Raquel ang mga diyos ng sambahayan at inilagay ang mga ito sa mga dala-dalahan ng kamelyo at kanyang inupuan.
GEN_031_0048	Apan bahin sa imong mga dios, kon hikit-an mo gani kini sa usa kanamo, angay siyang patyon.	Hinalughog ni Laban ang buong palibot ng tolda, ngunit hindi niya natagpuan.
GEN_031_0049	Atubangan sa atong mga tawo pangitag bisan unsa nga imoha ug kuhaa kini.	At sinabi ni Raquel sa kanyang ama, Huwag magalit ang aking panginoon na ako'y hindi makatayo sa harap mo; sapagkat dinatnan ako ngayon.
GEN_031_0050	Apan wala masayod si Jacob nga si Raquel maoy nagkawat sa mga diosdios.	Kaya't kanyang hinanap, ngunit hindi natagpuan ang mga diyos ng sambahayan.
GEN_031_0051	Busa misulod si Laban sa tolda ni Jacob ug gisusi niya kini.	At si Jacob ay nagalit at nakipagtalo kay Laban.
GEN_031_0052	Misulod usab siya sa tolda ni Lea ug sa tolda sa duha ka ulipong babaye apan wala niya hikaplagi didto ang iyang mga diosdios.	Sinabi ni Jacob kay Laban, Ano ang aking paglabag at ang aking kasalanan, at habulin mo ako na may pag-iinit?
GEN_031_0053	Unya miadto siya sa tolda ni Raquel.	Kahit hinalughog mo ang lahat ng aking kasangkapan, anong natagpuan mong kasangkapan ng iyong bahay?
GEN_031_0054	Apan didto tagoi ni Raquel ang mga diosdios sa ilalom sa muntora sa kamelyo ug iya kining gilingkoran.	Ilagay mo rito sa harapan ng aking mga kamag-anak at ng iyong mga kamag-anak at hayaan mong magpasiya sila sa ating dalawa.
GEN_031_0055	Gisusi ni Laban ang tibuok tolda apan wala niya kini hikaplagi.	Ako'y kasama mo sa loob ng dalawampung taon; ang iyong mga babaing tupa at ang iyong mga babaing kambing ay hindi nakunan, at hindi ako kumain ng mga tupang lalaki ng iyong kawan.
GEN_031_0056	Miingon si Raquel sa iyang amahan, Ayaw ug kasuko kanako nga dili ako makatindog sa imong atubangan kay giregla ako.	Ang nilapa ng mababangis na hayop ay hindi ko dinala sa iyo; ako mismo ang nagpasan ng pagkawala.
GEN_031_0057	Mipadayon si Laban sa pagpangita apan wala gayod niya hikaplagi ang iyang mga diosdios.	Sa aking kamay mo hiningi iyon, maging ninakaw sa araw o sa gabi.
GEN_031_0058	Unya si Jacob wala na makapugong sa iyang kaugalingon ug masuk-anon nga miingon kang Laban, Unsa may akong sala kanimo nga imo man akong gigukod?	Naging ganoon ako; sa araw ay pinahihirapan ako ng init, at sa gabi ay ng lamig; at ako ay nalipasan na ng antok.
GEN_031_0059	Karon nga nasusi mo na ang tanan kong kabtangan, unsa may nakaplagan mo nga imoha?	Nitong dalawampung taon ay nakatira ako sa iyong bahay.
GEN_031_0060	Kon aduna dad-a diri sa gawas aron nga ang imo ug akong mga tawo makakita ug silay mohukom kinsa kanato ang husto.	Pinaglingkuran kita ng labing-apat na taon dahil sa iyong dalawang anak, at anim na taon dahil sa iyong kawan, at sampung ulit na binago mo ang aking sahod.
GEN_031_0061	Nitipon ako kanimo sa 20 ka tuig ug wala gayod mahitabo nga wala manganak ang imong mga kanding ug mga karnero apan wala gayod ako makakaon ug karne sa laking karnero nga imoha.	Kung ang Diyos ng aking ama, ang Diyos ni Abraham, at ang Kinatatakutan ni Isaac ay wala sa aking panig, tiyak na palalayasin mo ako ngayon na walang dala.
GEN_031_0062	Kon may karnero nga gitukob sa ihalas nga mga mananap, wala ko kini dad-a kanimo aron ipakita nga ang nahitabo dili akong sayop kondili giilisan ko ang karnero.	Nakita ng Diyos ang aking kapighatian, ang aking pagpapagod, at sinaway ka niya kagabi.
GEN_031_0063	Gipabayran mo kanako ang gikawat nga karnero panahon sa adlaw o sa gabii.	Sumagot si Laban kay Jacob, Ang mga anak na babae ay aking mga anak at ang mga anak ay mga anak ko, at ang mga kawan ay aking mga kawan at ang lahat ng iyong nakikita ay akin.
GEN_031_0064	Sa daghang higayon giantos ko ang kainit sa adlaw ug ang katugnaw sa gabii ug wala akoy maayong kinatulgan.	Subalit anong magagawa ko ngayon sa mga anak kong babae, o sa kanilang mga anak na ipinanganak nila?
GEN_031_0065	Mao kini ang akong nahimo sulod sa 20 ka tuig sa akong pagpuyo tipon kanimo.	Halika ngayon, gumawa tayo ng isang tipan, ako at ikaw; at hayaang iyon ay maging saksi sa akin at sa iyo.
GEN_031_0066	Napulog-upat ka tuig ang pag-alagad ko kanimo alang sa duha mo ka anak nga babaye ug unom ka tuig alang sa imong mga kahayopan.	Kaya't kumuha si Jacob ng isang bato, at iyon ay itinayo bilang isang bantayog.
GEN_031_0067	Apan kanapulo mo usab-usaba ang akong suhol.	At sinabi ni Jacob sa kanyang mga kamag-anak, Magtipon kayo ng mga bato, at kumuha sila ng mga bato at kanilang ginawang isang bunton at sila'y nagkainan doon sa malapit sa bunton.
GEN_031_0068	Kon wala pa ako ubani sa Dios sa akong amahan nga mao ang Dios ni Abraham ug ang Dios nga gisimba ni Isaac, gipapahawa mo na unta ako nga walay dala.	Tinawag ito ni Laban na Jegarsahadutha, subalit tinawag ito ni Jacob na Gilead.
GEN_031_0069	Apan nakita sa Dios ang akong kalisod ug ang akong nahimo kanimo ug kagabii gipahimangnoan ka niya.	Sinabi ni Laban, Ang buntong ito ay saksi sa akin at sa iyo ngayon.
GEN_031_0070	Unya mitubag si Laban kang Jacob, Kining mga babaye akong mga anak ug ang ilang mga anak akong mga apo.	Kaya't tinawag niya ito sa pangalang Gilead; at ang bantayog ay Mizpa sapagkat sinabi niya, Bantayan ng Panginoon ako at ikaw, kapag tayo'y hindi magkasama sa isa't isa.
GEN_031_0071	Ang mga kahayopan akoa.	Kapag pinahirapan mo ang aking mga anak, o kung mag-asawa ka sa iba bukod sa aking mga anak, kahit wala tayong kasama, alalahanin mo, ang Diyos ay saksi sa akin at sa iyo.
GEN_031_0072	Akoa ang tanan nga nakita mo.	At sinabi ni Laban kay Jacob, Tingnan mo ang buntong ito at ang haligi na aking inilagay sa gitna natin.
GEN_031_0073	Apan karon unsa pa may mahimo ko sa akong mga anak o sa akong mga apo?	Ang buntong ito ay isang saksi, at ang haligi ay isang saksi na hindi ako lalampas sa buntong patungo sa inyo, at hindi ka lalampas sa buntong ito at sa haligi patungo sa akin upang saktan ako.
GEN_031_0074	Busa maghimo kitag kasabotan ug magpundok kitag mga bato silbing handomanan nato bahin niini.	Nawa'y ang Diyos ni Abraham at ang Diyos ni Nahor, ang Diyos ng kanilang ama ang humatol sa atin.
GEN_031_0075	Unya nag-ugbok si Jacob ug bato agig handomanan ug gisugo niya ang iyang mga tawo sa pagkuhag mga bato ug ila kining gipatongpatong.	At si Jacob ay sumumpa ng ayon sa Kinatatakutan ng kanyang amang si Isaac.
GEN_031_0076	Unya nangaon sila tupad sa batong tinapok.	At naghandog si Jacob ng handog sa bundok, at tinawag ang kanyang mga kamag-anak upang kumain ng tinapay; at sila'y kumain ng tinapay, at nanatili sa bundok.
GEN_031_0077	Ginganlan kini ni Laban ug Jegar-sahaduta, apan Galeed ang gingalan ni Jacob niini.	Kinaumagahan, maagang bumangon si Laban, hinagkan ang kanyang mga anak na lalaki at babae, at binasbasan sila; at umalis siya at bumalik sa kanyang tahanan.
GEN_031_0078	Miingon si Laban, Kining pinundok nga mga bato handomanan nato.	<MISSING TRANSLATION>
GEN_031_0079	Busa ginganlag Galeed ang maong dapit.	<MISSING TRANSLATION>
GEN_031_0080	Ug miingon usab si Laban, Bantayan unta kita ni Yahweh samtang magkalinay-anay kita.	<MISSING TRANSLATION>
GEN_031_0081	Busa ginganlan usab ug Mispa ang maong dapit.	<MISSING TRANSLATION>
GEN_031_0082	Mipadayon si Laban sa pag-ingon, Kon daugdaogon mo ang akong mga anak o mangasawa kag laing mga babaye bisan ako dili masayod niini, hinumdomi nga ang Dios nagtan-aw kanato.	<MISSING TRANSLATION>
GEN_031_0083	Unya miingon si Laban kang Jacob, Ania ang gipatongpatong ko nga mga bato tali kanato ug ania ang handomanan nga bato.	<MISSING TRANSLATION>
GEN_031_0084	Kining gipatongpatong nga mga bato ug kining giugbok nga bato maoy atong mga utlanan.	<MISSING TRANSLATION>
GEN_031_0085	Dili ako molatas niining gipundok nga mga bato aron sa pagpakig-away kanimo o ikaw molatas niini aron sa pagpakig-away kanako.	<MISSING TRANSLATION>
GEN_031_0086	Maoy atong pahukmon ang Dios ni Abraham ug ang Dios ni Nahor.	<MISSING TRANSLATION>
GEN_031_0087	Unya nanumpa si Jacob sa ngalan sa Dios nga gisimba ni Isaac nga iyang amahan.	<MISSING TRANSLATION>
GEN_031_0088	Nag-ihaw siyag usa ka hayop ug iyang gihalad didto sa bukid ug gidapit niya ang iyang mga tawo sa pagpangaon.	<MISSING TRANSLATION>
GEN_031_0089	Human sila mangaon, didto sila mangatulog sa bukid niadtong gabhiona.	<MISSING TRANSLATION>
GEN_031_0090	Sayo sa buntag, gipanghagkan ni Laban ang iyang mga apo ug mga anak agig panamilit ug gipanalanginan niya sila.	<MISSING TRANSLATION>
GEN_031_0091	Unya mipauli siya sa ila.	<MISSING TRANSLATION>
GEN_032_0001	Mipadayon si Jacob sa iyang panaw ug gisugat siyag mga anghel sa Dios.	Nagpatuloy si Jacob sa kanyang paglakad, at sinalubong siya ng mga anghel ng Diyos.
GEN_032_0002	Sa pagkakita ni Jacob kanila, miingon siya, Mga sundalo kini sa Dios.	Nang makita sila ni Jacob ay sinabi niya sa kanila, Ito'y kampo ng Diyos!
GEN_032_0003	Busa ginganlan niyag Mahanaim ang maong dapit.	Kaya't tinawag niya ang pangalan ng lugar na iyon na Mahanaim.
GEN_032_0004	Nagsugo si Jacob ug mga tawo sa pag-una kaniya ngadto sa iyang igsoon nga si Esau didto sa Seir sa nasod sa Edomea.	Si Jacob ay nagpasugo kay Esau na kanyang kapatid sa lupain ng Seir, sa bayan ng Edom.
GEN_032_0005	Gisugo niya sila nga sultihan si Esau niini: Si Jacob, ang imong sulugoon, didto mipuyo tipon kang Laban ug karon pa lamang mopauli.	Sila'y kanyang inutusan na sinasabi, Ganito ang inyong sasabihin kay Esau na aking panginoon.
GEN_032_0006	Aduna na siyay daghang baka, asno, karnero, kanding ug mga ulipon.	Ganito ang sabi ng iyong lingkod na si Jacob, Ako'y tumigil ng ilang panahon kay Laban at namalagi roon hanggang ngayon.
GEN_032_0007	Gipasugoan ka niya aron pagsugilon kanimo niini basin na lag mahimuot ka kaniya.	Mayroon akong mga baka, mga asno, mga kawan, at mga aliping lalaki at babae; at ako'y nagpasugo sa aking panginoon, upang ako'y makatagpo ng biyaya sa iyong paningin.
GEN_032_0008	Sa nahibalik na ang mga sinugo ni Jacob, miingon sila, Didto na kami sa imong igsoon nga si Esau ug nagpaingon na siya nganhi aron pagtagbo kanimo.	Ang mga sugo ay bumalik kay Jacob, na nagsasabi, Nakarating kami sa iyong kapatid na si Esau, at siya ay darating din upang sumalubong sa iyo, at kasama niya ang apatnaraang tao.
GEN_032_0009	May kuyog siyang 400 ka tawo.	Kaya't natakot nang husto at nabahala si Jacob; at kanyang hinati sa dalawa ang mga taong kasama niya, ang mga kawan, ang mga bakahan, at ang mga kamelyo.
GEN_032_0010	Nahadlok ug nabalaka pag-ayo si Jacob.	At kanyang sinabi, Kung dumating si Esau sa isang pulutong at kanyang puksain ito, ang pulutong na natitira ay tatakas.
GEN_032_0011	Busa gibahin niya sa duha ka panon ang iyang mga tawo ingon man ang iyang mga karnero, kanding, baka ug mga kamelyo.	Sinabi ni Jacob, O Diyos ng aking amang si Abraham, at Diyos ng aking amang si Isaac, O Panginoon , na nagsabi sa akin, Bumalik ka sa iyong lupain at sa iyong kamag-anak at gagawa ako ng mabuti sa iyo.
GEN_032_0012	Naghunahuna siya nga kon ugaling atakihon ni Esau ang unang pundok, makahimo pag-ikyas ang ikaduha.	Hindi ako karapat-dapat sa lahat ng kaawaan, at lahat ng katotohanan na iyong ginawa sa iyong lingkod sapagkat dumaan ako sa Jordang ito na dala ang aking tungkod, at ngayo'y naging dalawang pulutong ako.
GEN_032_0013	Unya nag-ampo si Jacob, Dios sa akong apohan nga si Abraham ug sa akong amahan nga si Isaac, pamatia intawon ako!	Hinihiling ko sa iyo na iligtas mo ako sa kamay ng aking kapatid na si Esau.
GEN_032_0014	Ginoo , ikaw nag-ingon kanako, Pauli sa inyo ug sa imong kaparyentihan ug salig nga walay mahitabo kanimo.	Ako'y natatakot sa kanya, baka siya'y dumating at kaming lahat ay pagpapatayin niya, ang mga ina pati ang mga anak.
GEN_032_0015	Dili ako takos sa tanan mong kaluoy ug kaayo kanako nga imong sulugoon.	Hindi ba't ikaw ang nagsabi, Gagawa ako ng mabuti sa iyo at ang iyong binhi ay gagawin kong parang buhangin sa dagat na hindi mabibilang dahil sa karamihan.
GEN_032_0016	Mitabok ako sa Jordan nga walay dala gawas sa akong sungkod apan karon mibalik ako uban niining duha ka pundok.	Siya'y namalagi roon nang gabing iyon, at kumuha siya ng panregalo mula sa kanya para sa kanyang kapatid na si Esau; dalawang daang kambing na babae, dalawampung lalaking kambing, dalawang daang tupang babae, at dalawampung tupang lalaki, tatlumpung kamelyong inahin, kasama ng kanilang mga anak, apatnapung baka, at sampung toro, dalawampung babaing asno at sampung lalaking asno.
GEN_032_0017	Busa luwasa intawon ako gikan sa mga kamot sa akong igsoon nga si Esau.	Ang mga ito ay ibinigay niya sa kanyang mga alipin, ang bawat kawan ay nakabukod at sinabi niya sa kanyang mga alipin, Lumampas kayo sa aking unahan at lagyan ninyo ng pagitan ang bawat kawan.
GEN_032_0018	Nahadlok ako nga siya mipaingon nganhi aron pamatyon kaming tanan lakip ang mga babaye ug kabataan.	Iniutos niya sa una, Kapag ikaw ay natagpuan ni Esau na aking kapatid, at tanungin ka, Kanino ka?
GEN_032_0019	Hinumdomi ang imong saad nga walay daotang mahitabo kanako ug nga hatagan mo akog daghang kaliwat nga dili maihap sama kadaghan sa balas sa baybayon.	Saan ka pupunta?
GEN_032_0020	Human siya magpalabay sa gabii niadtong dapita, nagpili siyag gasa alang sa iyang igsoon nga si Esau.	At kanino itong nasa unahan mo?
GEN_032_0021	Kini ang iyang gigasa: 200 ka baye ug 20 ka laking kanding, 200 ka baye ug 20 ka laking karnero, 30 ka gatasan nga kamelyo lakip ang mga anak nila, 40 ka baye nga baka ug 10 ka toro ug 20 ka baye ug 10 ka laking asno.	Kung magkagayo'y sasabihin mo, Sa iyong lingkod na si Jacob.
GEN_032_0022	Matag panon gipadumala niya sa usa ka sulugoon ug giingnan niya, Una kamo kanako ug kinahanglan nga dili magkadug-ol ang matag panon.	Ito ay isang regalo na padala para sa aking panginoong si Esau; at bukod dito, siya'y nasa hulihan namin.
GEN_032_0023	Gimandoan niya ang unang sulugoon, Kon mangutana kaninyo ang akong igsoon nga si Esau kon kinsa ang inyong agalon, asa kamo paingon ug kinsay tag-iya niining kahayopan, ingna siya, Kini iya ni Jacob nga imong sulugoon.	Gayundin, iniutos niya sa ikalawa, sa ikatlo, at sa lahat ng sumusunod sa mga kawan, na sinasabi, Sasabihin ninyo ang gayunding bagay kay Esau, kapag nakasalubong ninyo siya, at sasabihin ninyo, Bukod dito, ang iyong lingkod na si Jacob ay nasa hulihan namin.
GEN_032_0024	Iya kining igasa kanimo ug nagsunod siya kanamo.	Sapagkat kanyang iniisip, Baka mapaglubag ko ang kanyang galit sa pamamagitan ng regalo na ipinauna ko, at pagkatapos ay makikita ko ang kanyang mukha, marahil ay tatanggapin niya ako.
GEN_032_0025	Mao usab kini ang iyang gisugo sa ikaduha ug sa ikatulo ingon man sa tanan nga nagdumala sa nagsunod nga mga panon, Ingna si Esau, Ang imong sulugoon nga si Jacob nagsunod kanamo.	Kaya't ang regalo ay ipinadala na nauna sa kanya; at siya'y nanatili sa kampo nang gabing iyon.
GEN_032_0026	Nagtuo si Jacob nga maluoy kaniya ang iyang igsoon tungod sa mga gasa nga iyang gipadala pag-una ug nga pasayloon siya ni Esau.	Nang gabing iyon, siya'y bumangon at isinama niya ang kanyang dalawang asawa, ang kanyang dalawang aliping babae, at ang kanyang labing-isang anak at tumawid sa tawiran ng Jaboc.
GEN_032_0027	Gipadala niya pag-una ang mga gasa ug mipahulay siya didto sa kampo niadtong gabhiona.	Sila'y kanyang isinama at itinawid sa batis, at kanya ring itinawid ang lahat ng kanyang ari-arian.
GEN_032_0028	Niadtong gabhiona, mibangon si Jacob ug gidala niya ang duha niya ka asawa, ang duha niya ka ulipong babaye ug ang 11 niya ka anak ug mitabok sila sa tabokanan sa Suba sa Jaboc.	Naiwang nag-iisa si Jacob at nakipagbuno sa kanya ang isang lalaki hanggang sa magbukang-liwayway.
GEN_032_0029	Human niya ikatabok sila, iya usab nga gipatabok ang tanan niyang kabtangan.	Nang makita ng lalaki na hindi siya manalo laban kay Jacob, hinawakan niya ang kasu-kasuan ng hita ni Jacob, at ang kasu-kasuan ni Jacob ay nalinsad samantalang nakikipagbuno sa kanya.
GEN_032_0030	Siya na lamang ang nagpabilin.	Sinabi niya, Bitawan mo ako, sapagkat nagbubukang-liwayway na.
GEN_032_0031	Unya may tawong nakigdumog kaniya hangtod sa kaadlawon.	At sinabi ni Jacob, Hindi kita bibitawan malibang ako ay mabasbasan mo.
GEN_032_0032	Sa pagkamatikod sa tawo nga dili siya makadaog sa ilang panagdumog, giigo niya ang dapidapi ni Jacob ug naligas ang lutahan niini.	Sinabi ng lalaki kay Jacob, Ano ang pangalan mo?
GEN_032_0033	Miingon ang tawo, Buhii ako kay hayag na.	At kanyang sinabi, Jacob.
GEN_032_0034	Apan si Jacob mitubag, Dili ko ikaw buhian hangtod nga panalanginan mo ako.	Sinabi niya, Ang iyong pangalan ay hindi na tatawaging Jacob, kundi Israel; sapagkat ikaw ay nakipaglaban sa Diyos at sa mga tao, at ikaw ay nagtagumpay.
GEN_032_0035	Nangutana ang tawo, Unsay imong ngalan?	Siya'y tinanong ni Jacob, Hinihiling ko sa iyo na sabihin mo sa akin ang iyong pangalan.
GEN_032_0036	Mitubag siya, Jacob.	At kanyang sinabi, Bakit itinatanong mo ang aking pangalan?
GEN_032_0037	Ang tawo miingon, Dili na Jacob ang imong ngalan kondili Israel kay nakigdumog ka sa Dios ug sa mga tawo ug midaog ka.	At siya'y binasbasan doon.
GEN_032_0038	Si Jacob miingon, Tug-ani lagi ako sa imong ngalan.	Tinawag ni Jacob ang pangalan ng lugar na iyon na Peniel na sinasabi, Sapagkat nakita ko ang Diyos sa harapan, at naligtas ang aking buhay.
GEN_032_0039	Apan mitubag ang tawo, Nganong nangutana ka man sa akong ngalan?	Sinikatan siya ng araw nang siya'y dumaraan sa Penuel; at siya'y papilay-pilay dahil sa kanyang hita.
GEN_032_0040	Unya gipanalanginan niya si Jacob.	Dahil dito, hanggang ngayon ay hindi kumakain ang mga anak ni Israel ng litid ng balakang na nasa kasu-kasuan ng hita, sapagkat dito hinampas ng taong nakipagbuno ang kasu-kasuan ng hita ni Jacob, sa litid ng balakang.
GEN_032_0041	Miingon si Jacob, Nakakita na gayod ako sa nawong sa Dios ug buhi gihapon ako.	<MISSING TRANSLATION>
GEN_032_0042	Busa ginganlan niyag Peniel ang maong dapit.	<MISSING TRANSLATION>
GEN_032_0043	Misubang na ang adlaw sa pagbiya ni Jacob sa Peniel ug nagkiang siya tungod sa nalisa niyang dapidapi.	<MISSING TRANSLATION>
GEN_032_0044	Busa, hangtod karon ang mga kaliwat ni Israel dili mokaon sa unod sa dapidapi sa mananap kay diha mang bahina sa lawas naigo si Jacob.	<MISSING TRANSLATION>
GEN_033_0001	Nakita ni Jacob si Esau uban sa 400 ka tawo nga nagpaingon kaniya busa gibahinbahin niya ang iyang mga anak kanila ni Lea, ni Raquel ug sa duha ka ulipon nga babaye.	Tumanaw si Jacob at nakita niyang si Esau ay dumarating na may kasamang apatnaraang katao.
GEN_033_0002	Maoy iyang gipauna ang mga ulipon ug ang ilang kabataan unya gipasunod si Lea ug ang iyang mga anak ug gipaulahi niya si Raquel ug si Jose.	Kaya't kanyang pinaghiwalay ang mga bata kina Lea at Raquel, at sa dalawang aliping babae.
GEN_033_0003	Unya miuna si Jacob kanila ug miyukbo sa makapito hangtod miabot siya duol kang Esau.	Inilagay niya ang mga alipin na kasama ng kanilang mga anak sa unahan, at si Lea na kasama ng kanyang mga anak bilang pangalawa, at sina Raquel at Jose na pinakahuli.
GEN_033_0004	Apan midagan si Esau aron pagtagbo kang Jacob ug migakos ug mihalok kaniya.	At siya naman ay lumampas sa unahan nila, at pitong ulit na yumuko sa lupa hanggang sa siya ay mapalapit sa kanyang kapatid.
GEN_033_0005	Nanghilak silang duha.	At tumakbo si Esau upang salubungin siya, niyakap siya, niyapos siya sa leeg, hinagkan at sila ay nag-iyakan.
GEN_033_0006	Ug sa pagkakita ni Esau sa mga babaye ug sa mga kabataan, nangutana siya, Kinsa man kining mga kuyog nimo?	Nang itaas ni Esau ang kanyang paningin, at nakita ang mga babae at ang mga bata, ay kanyang sinabi, Sino itong mga kasama mo?
GEN_033_0007	Mitubag si Jacob, Kini sila mao ang mga anak nga gikaluoy sa Dios paghatag kanako.	At kanyang sinabi, Ang mga anak na ipinagkaloob ng Diyos sa iyong lingkod.
GEN_033_0008	Unya miduol ang mga ulipon nga mga babaye uban sa ilang mga anak ug miyukbo.	Nang magkagayo'y lumapit ang mga aliping babae at ang kanilang mga anak, at nagsiyuko.
GEN_033_0009	Miduol usab si Lea ug ang iyang mga anak ug sa kataposan si Raquel ug si Jose nga miyukbo usab.	Lumapit din si Lea at ang kanyang mga anak, at nagsiyuko, pagkatapos ay nagsilapit sina Jose at Raquel, at nagsiyuko.
GEN_033_0010	Nangutana si Esau, Unsa man diay kadtong laing panon nga akong gikatagbo?	Sinabi ni Esau, Ano ang kahulugan ng lahat na ito na nasalubong ko?
GEN_033_0011	Unsa may buot ipasabot niadto?	At sumagot si Jacob, Upang makakita ng biyaya sa paningin ng aking panginoon.
GEN_033_0012	Si Jacob mitubag, Igasa ko kadto kanimo aron mahimuot ka kanako.	Subalit sinabi ni Esau, Sapat na ang nasa akin, kapatid ko.
GEN_033_0013	Apan miingon si Esau, Igsoon, aduna akoy akoa nga igo na kanako.	Ang nasa iyo ay sa iyo na.
GEN_033_0014	Busa ayaw na lamang akog hatagi.	Sinabi sa kanya ni Jacob, Hindi, nakikiusap ako sa iyo, na kung ngayo'y nakatagpo ako ng biyaya sa iyong paningin, ay tanggapin mo nga ang aking kaloob mula sa aking kamay; sapagkat nakita ko ang iyong mukha, na gaya ng nakakita ng mukha ng Diyos, at ikaw ay nalugod sa akin.
GEN_033_0015	Miingon si Jacob, Dili mahimo.	Nakikiusap ako sa iyo, tanggapin mo ang kaloob na dala ko sa iyo sapagkat lubos na ang ipinagkaloob sa akin ng Diyos, at mayroon ako ng lahat na kailangan ko.
GEN_033_0016	Kon tinuod nga gipasaylo mo na ako, dawata ang akong gasa kanimo.	Kaya't hinimok ni Jacob si Esau at kanyang tinanggap.
GEN_033_0017	Alang kanako ang pagtan-aw sa imong nawong sama ra nga nagtan-aw ako sa nawong sa Dios karon nga gidawat mo ako.	Sinabi niya, Tayo'y humayo at maglakbay at ako'y sasama sa iyo.
GEN_033_0018	Busa dawata intawon kining akong gasa kanimo.	Subalit sinabi ni Jacob sa kanya, Nalalaman ng aking panginoon na ang mga bata ay mahihina pa at mayroon sa mga kawan at mga baka na nagpapasuso; kapag sila'y pinagmadali nila sa isang araw lamang ay mamamatay ang lahat ng kawan.
GEN_033_0019	Maayo kaayo kanako ang Dios ug gihatagan niya ako sa tanan kong gikinahanglan.	Magpauna na ang aking panginoon sa kanyang lingkod at ako'y magpapatuloy na dahan-dahan, ayon sa hakbang ng mga hayop na nasa aking unahan, at sa hakbang ng mga bata, hanggang sa makarating ako sa aking panginoon sa Seir.
GEN_033_0020	Namugos gayod si Jacob kang Esau busa gidawat na lamang ni Esau ang gasa.	Kaya't sinabi ni Esau, Pahintulutan mong iwan ko sa iyo ang ilan sa mga taong kasama ko.
GEN_033_0021	Miingon si Esau, Tana!	Kanyang sinabi, Bakit kailangan pa?
GEN_033_0022	Manglakaw na kita ug akoy mag-una.	Sapat na ang makakita ako ng biyaya sa paningin ng aking panginoon.
GEN_033_0023	Mitubag si Jacob, Nasayod ka nga luya ang mga bata ug anaa pay anakan nga mga karnero ug mga baka nga nagkinahanglan sa akong pag-atiman.	Kaya't nagbalik si Esau nang araw ding iyon sa kanyang lakad patungo sa Seir.
GEN_033_0024	Kon pugson sila sa paglakawg paspas bisag usa lang ka adlaw, mangamatay silang tanan.	Si Jacob ay naglakbay sa Sucot, at nagtayo ng isang bahay para sa kanya, at iginawa niya ng mga balag ang kanyang hayop.
GEN_033_0025	Busa una lang kanamo ug mohinayhinay ra akog sunod.	Kaya't tinawag ang pangalan ng lugar na iyon na Sucot.
GEN_033_0026	Agdon lang nako ang gikusgon sa linaktan sa mga hayop ug sa mga kabataan hangtod maabtan ka namo sa Seir sa Edomea.	Payapang dumating si Jacob sa bayan ng Shekem, na nasa lupain ng Canaan, nang siya'y dumating mula sa Padan-aram; at siya'y tumigil sa tapat ng bayan.
