id	source_text	target_text
EXO_021_0006	Apan kon ang ulipon moingon, Gihigugma ko ang akong agalon ug ang akong asawa ingon man ang akong mga anak ug dili ako buot mobiya dinhi, dad-on siya sa iyang agalon ngadto sa dapit diin gisimba ang Dios ug didto sa pultahan o sa haligi sa pultahan lungagan niya ang dalunggan sa ulipon ug maulipon siya sa iyang agalon sa tibuok niyang kinabuhi.	Kung ipagbili ng isang lalaki ang kanyang anak na babae bilang isang alipin, hindi siya aalis na gaya ng pag-alis ng mga aliping lalaki.
EXO_021_0007	Kon ibaligya sa usa ka tawo ang iyang anak nga babaye aron mahimong ulipon, dili siya buhian sama sa mga ulipong lalaki.	Kung hindi siya kinalugdan ng kanyang amo na umangkin sa kanya bilang asawa, ay kanyang ipapatubos siya; wala siyang karapatang ipagbili siya sa isang dayuhan, yamang siya'y hindi niya pinakitunguhan nang tapat.
EXO_021_0008	Kon dili siya makapahimuot sa iyang agalon nga nagtinguha sa pagpangasawa kaniya, kinahanglan nga ipalukat siya.	Kung siya ay itinalaga niya para sa kanyang anak na lalaki, kanyang papakitunguhan siya tulad sa isang malayang anak na babae.
EXO_021_0009	Apan ang agalon walay katungod sa pagbaligya sa maong ulipon ngadto sa mga langyaw kay wala kini mahisubay sa kaangayan.	Kung siya'y mag-asawa ng iba, ang kanyang pagkain, damit, at karapatan bilang asawa ay hindi niya babawasan.
EXO_021_0010	Kon ang agalon naglaraw sa paghatag sa maong ulipon ngadto sa iyang anak, kinahanglan nga isipon niya siya sama sa iyang anak nga babaye.	Kung hindi niya gawin ang tatlong bagay na ito para sa kanya, siya ay aalis na walang bayad, na walang itinubos na salapi.
EXO_021_0011	Kon maminyo siyag laing babaye, kinahanglan magpadayon siya sa paghatag sa una niyang asawa sa samang gidaghanon sa pagkaon ug bisti.	Sinumang manakit ng isang tao at mamatay ito, ay walang pagsalang papatayin.
EXO_021_0012	Ang iyang mga katungod kaniadto isip asawa magpadayon nga mao gihapon.	Ngunit kung hindi ito sinasadya ng isang tao, kundi Diyos ang naghulog sa kanyang kamay; ay ipaglalaan kita ng isang lugar na maaaring takbuhan ng nakamatay.
EXO_021_0013	Kon dili niya tumanon kining maong mga katungdanan ngadto sa unang asawa, kinahanglan iyang hatagag kagawasan ang maong babaye ug dili niya pabayron bisag diyutay.	Kung magbalak ang sinuman sa kanyang kapwa na patayin siya nang pataksil, aalisin mo siya sa aking dambana upang siya'y mamatay.
EXO_021_0014	Ang makadagmal ug makapatayg tawo kinahanglan nga patyon usab.	Ang manakit sa kanyang ama o sa kanyang ina ay papatayin.
EXO_021_0015	Apan kon makapatay siya nga dili tinuyo, makadangop siya sa usa ka dapit nga akong pilion alang kaninyo.	Ang magnakaw ng isang tao, ipagbili man siya o matagpuan sa kanyang kamay, siya ay papatayin.
EXO_021_0016	Apan kon tuyoon niya pagpatay ang usa ka tawo pinaagi sa lipot, mahimo nga kuhaon ninyo siya ug patyon bisan pag midangop siya didto sa akong halaran.	Ang magmura sa kanyang ama, o sa kanyang ina ay papatayin.
EXO_021_0017	Ang modagmal sa iyang amahan o inahan kinahanglang patyon.	Kapag may nag-away at sinaktan ng isang tao ang kanyang kapwa sa pamamagitan ng bato o ng kanyang kamay, at hindi namatay ang tao, kundi naratay sa higaan; kung makabangon siya uli at makalakad sa tulong ng kanyang tungkod, ligtas sa parusa ang nanakit sa kanya; babayaran lamang niya ang panahong nasayang, at kanyang ipapagamot siyang lubos.
EXO_021_0018	Ang modagit ug tawo aron ibaligya o tagoan kinahanglang patyon.	Kung saktan ng sinuman ang kanyang aliping lalaki o aliping babae ng tungkod at mamatay sa kanyang kamay, siya ay parurusahan.
EXO_021_0019	Ang motunglo sa iyang amahan o inahan kinahanglang patyon.	Gayunma'y, kung tumagal ang alipin ng isa o dalawang araw, hindi siya parurusahan; sapagkat siya'y kanyang salapi.
EXO_021_0020	Kon may mag-away ug ang usa kanila hampakon ug bato o sumbagon ba hinuon apan dili siya mamatay, ang naghampak o nagsumbag dili silotan.	Kung mag-away ang dalawang lalaki at makasakit ng isang babaing nagdadalang-tao, na anupa't makunan, at gayunma'y walang pinsalang sumunod, pagbabayarin ang nakasakit, ayon sa iaatang sa kanya ng asawa ng babae; at siya'y magbabayad ng ayon sa ipasiya ng mga hukom.
EXO_021_0021	Apan kon naangol ang tawong nasumbagan, unya makatindog ug makasuroy na sa gawas bisag maggamit siyag sungkod, ang tawo nga nagdagmal kaniya kinahanglan nga mobayad sa iyang panahon nga nausik ug mag-atiman kaniya hangtod mamaayo siya.	Subalit kung may anumang pinsalang sumunod, magbibigay ka nga ng buhay para sa buhay, mata sa mata, ngipin sa ngipin, kamay sa kamay, paa sa paa, pas sa pas, sugat sa sugat, hagupit sa hagupit.
EXO_021_0022	Kon bunalan sa usa ka tawo ang iyang ulipon nga lalaki o babaye ug dihadiha mamatay ang maong ulipon, silotan siya.	At kung saktan ng sinuman ang mata ng kanyang aliping lalaki, o ang mata ng kanyang aliping babae at mabulag, kanyang papalayain ang alipin upang matumbasan ang mata.
EXO_021_0023	Apan kon nagpabilin pang buhi ang maong ulipon sa usa o duha ka adlaw, dili silotan ang iyang agalon kay ang ulipon katigayonan man sa agalon.	Kung kanyang bungian ng ngipin ang kanyang aliping lalaki o babae ay kanyang palalayain ang alipin dahil sa kanyang ngipin.
EXO_021_0024	Kon may mag-away ug maangin ang usa ka mabdos ug makuhaan siya sa iyang gisabak apan walay kadaot nga miabot, ang nakaingon niini multahan sa kantidad nga pangayoon sa bana ug magbayad sumala sa hukom sa mga maghuhukom.	Kung suwagin ng isang baka ang isang lalaki o ang isang babae, anupa't namatay, babatuhin ang baka at ang kanyang laman ay hindi kakainin; subalit ang may-ari ng baka ay pawawalang-sala.
EXO_021_0025	Apan kon nahiagom sa kadaot ang babaye, ang silot mao nga ang kinabuhi bayrag kinabuhi; mata bayrag mata, ngipon bayrag ngipon, kamot bayrag kamot, tiil bayrag tiil, paso bayrag paso, samad bayrag samad, pangos bayrag pangos.	Ngunit kung ang baka ay dati nang nanunuwag at naisumbong na sa may-ari ngunit hindi niya ikinulong, anupa't nakamatay ng isang lalaki, o isang babae, babatuhin ang baka at ang may-ari niyon ay papatayin din.
EXO_021_0026	Kon ang usa ka tawo makasumbag sa iyang ulipong lalaki o babaye diha sa mata ug mabuta ang ulipon, kinahanglan nga buhian niya ang maong ulipon ingon nga bayad sa iyang mata.	Kung siya'y atangan ng pantubos, magbibigay siya ng pantubos sa kanyang buhay anuman ang iniatang sa kanya.
EXO_021_0027	Kon makapangag siyag ulipon, kinahanglang buhian niya ang maong ulipon ingon nga bayad sa iyang ngipon.	Kung suwagin nito ang anak na lalaki o babae ng isang tao ay gagawin sa kanya ayon sa kahatulang ito.
EXO_021_0028	Kon ang usa ka baka makasungag ug tawo ug mamatay ang tawo, batoon ang baka ug dili kan-on ang unod niini apan dili silotan ang tag-iya.	Kung suwagin ng baka ang isang aliping lalaki o babae ay magbabayad ang may-ari ng tatlumpung siklong pilak sa kanilang amo, at ang baka ay babatuhin.
EXO_021_0029	Apan kon ang baka naanad na sa pagpanungag ug mga tawo ug gipahimangnoan na ang tag-iya niini apan wala niya kini ipasulod sa koral, kon makapatay kinig tawo batoon kini ug patyon usab ang tag-iya niini.	Kung iwanang bukas ng sinuman ang isang balon, o kung huhukay ng isang balon at hindi ito tatakpan, at ang isang baka o ang isang asno ay mahulog dito, magbabayad ang may-ari ng balon; magbabayad siya ng salapi sa may-ari niyon, at ang patay na hayop ay magiging kanya.
EXO_021_0030	Apan kon lukaton sa tag-iya ang iyang kinabuhi, bayran niya ang tibuok kantidad nga gipangayo tumbas sa iyang kinabuhi.	Kung ang baka ng sinuman ay nanakit sa baka ng iba, na anupa't namatay, kanila ngang ipagbibili ang bakang buhy, at kanilang paghahatian ang halaga niyon; at ang patay ay paghahatian din nila.
EXO_021_0031	Kon ang baka makapatay ug bata, lalaki man o babaye, sundon gihapon ang maong lagda.	O kung kilala na ang baka ay dati nang manunuwag, at hindi ikinulong ng may-ari, magbabayad siya ng baka sa baka, at ang patay na hayop ay magiging kanya.
EXO_021_0032	Kon ang baka makapatay ug ulipon, lalaki man o babaye, ang tag-iya sa baka magbayad ug 30 ka buok nga plata ngadto sa tag-iya sa ulipon ug batoon ang baka hangtod nga mamatay.	<MISSING TRANSLATION>
EXO_021_0033	Kon ang usa ka tawo magkuha sa tabon sa usa ka lungag o kon maglungag siya ug dili niya kini tabonan ug mahulog niini ang usa ka baka o asno, bayran niya ang tag-iya sa maong mananap ug siya na ang tag-iya sa patayng mananap.	<MISSING TRANSLATION>
EXO_021_0034	Kon ang baka sa usa ka tawo makapatay ug baka sa laing tawo, ibaligya nila ang baka nga buhi ug bahinon nila ang halin.	<MISSING TRANSLATION>
EXO_021_0035	Bahinon usab nila ang karne sa patayng mananap.	<MISSING TRANSLATION>
EXO_021_0036	Apan kon masayran nga ang nakapatay nga mananap naanad na sa pagpanungag apan wala kini korala sa tag-iya, magbayad siya ug maghatag siyag buhing baka ilis sa namatay ug iyaha na ang patay nga baka.	<MISSING TRANSLATION>
EXO_022_0001	Kon ang usa ka tawo mangawat ug baka o karnero ug patyon o ibaligya niya kini, kinahanglan nga ilisan niyag lima ka baka ang usa ka baka ug upat ka karnero ang iilis sa usa ka karnero.	Kung ang isang tao ay magnakaw ng isang baka, o ng tupa at patayin, o ipagbili, siya'y magbabayad ng limang baka para sa isang baka, at ng apat na tupa para sa isang tupa.
EXO_022_0002	Kinahanglan nga bayran niya kini.	Ang magnanakaw ay gagawa ng pagsasauli; kung wala siyang maisauli, siya'y ipagbibili dahil sa kanyang pagnanakaw.
EXO_022_0003	Kon wala siyay nahot, ibaligya siya aron ibayad sa iyang nakawat.	Kung ang isang magnanakaw ay mahuling pumapasok at siya'y hinampas na kanyang ikinamatay, hindi magkakaroon ng pananagutan sa dugo ang nakapatay, ngunit kung sikatan siya ng araw ay magkakaroon siya ng pananagutan sa dugo.
EXO_022_0004	Kon ang baka o asno o karnero nga iyang nakawat makaplagan nga buhi diha sa iyang kamot, magbayad siyag doble.	Kung ang ninakaw ay matagpuang buhy sa kanyang kamay, maging baka o asno, o tupa, ay magbabayad siya ng doble.
EXO_022_0005	Kon ang usa ka kawatan madakpan nga mosulod sa usa ka balay panahon sa kagabhion ug mapatay siya, ang makapatay kaniya dili isipon nga mamumuno.	Kung ang sinuman ay magpastol sa isang bukid, o sa isang ubasan, at pakawalan ang kanyang hayop at manginain sa bukid ng iba, siya'y magsasauli mula sa pinakamainam sa kanyang sariling bukid, at mula sa kanyang sariling ubasan.
EXO_022_0006	Apan kon mahitabo kini panahon sa adlaw, ang makapatay kaniya isipon nga mamumuno.	Kung may magningas na apoy at umabot sa mga tinik, na anupa't ang mga mandala, o ang mga uhay, o ang bukid ay masunog, ang nagpaningas ng apoy ay magbabayad ng buo.
EXO_022_0007	Kon pasibsibon sa usa ka tawo ang iyang kahayopan diha sa usa ka uma o parasan ug kon makabuhi kini ug manibsib sa uma sa laing tawo, kinahanglan nga bayran sa tag-iya sa hayop ang nasibsib nga tanom sa labing maayo nga abot gikan sa iyang uma o parasan.	Kung ang sinuman ay magpatago sa kanyang kapwa ng salapi o pag-aari, at ito'y ninakaw sa bahay ng taong iyon, at pagkatapos, kung matagpuan ang magnanakaw, magbabayad siya ng doble.
EXO_022_0008	Kon ang usa ka tawo magdaob didto sa iyang uma ug mokuyanap kini sa kasagbotan ngadto sa uma sa laing tawo ug makasunog sa tanom nga nagtubo pa o sa mga gihabas ug gitapok na, ang nakaingon sa sunog hingpit nga magbayad sibo sa kadaot nga iyang nahimo.	Kung hindi matagpuan ang magnanakaw, lalapit ang may-ari ng bahay sa Diyos, upang ipakita kung pinakialaman niya o hindi ang pag-aari ng kanyang kapwa.
EXO_022_0009	Kon patipigan sa usa ka tawo ang iyang kuwarta o mahalon nga butang ngadto sa laing tawo ug kawaton kini gikan sa balay sa maong tawo, ang kawatan kon madakpan kinahanglan nga pabayrog doble.	Sapagkat sa lahat ng pagsuway, maging para sa baka, sa asno, sa tupa, sa kasuotan, o sa anumang bagay na nawala, na may magsabi na iyon nga ay sa kanya, dadalhin sa harapan ng Diyos ang usapin ng dalawa; ang parurusahan ng Diyos ay magbabayad ng doble sa kanyang kapwa.
EXO_022_0010	Apan kon dili madakpan ang kawatan, ang tag-iya sa balay dad-on sa atubangan sa halaran sa Dios ug didto kinahanglan manumpa siya nga wala siya mangawat sa kabtangan sa iyang isigkatawo.	Kung ang sinuman ay maghabilin sa kanyang kapwa ng isang asno, o ng isang baka, o ng isang tupa, o ng anumang hayop; at namatay ito, o nasaktan, o hinuli, na walang nakakakitang sinuman, ang pagsumpa nilang dalawa sa Panginoon ang mamamagitan sa kanila upang makita kung pinakialaman niya o hindi ang pag-aari ng kanyang kapwa; at tatanggapin ng may-ari ang sumpa, at siya'y hindi magsasauli.
EXO_022_0011	Sa tanang panaglalis bahin sa kabtangan sama sa baka, asno, karnero, bisti o bisan unsang butanga nga nawala ug giangkon sa laing tawo, kinahanglan nga ang ilang panaglalis husayon sa atubangan sa halaran sa Dios.	Subalit kung ninakaw ito sa kanya ay isasauli niya iyon sa may-ari.
EXO_022_0012	Ang tawo nga hukman sa Dios nga sad-an kinahanglan magbayad ug doble sa iyang gikalalis.	Kung nilapa ito ng mga hayop, dadalhin niya ito bilang katibayan; hindi siya magsasauli ng anumang nilapa.
EXO_022_0013	Kon ipiyal sa usa ka tawo ngadto sa laing tawo ang iyang asno, baka, karnero o bisan unsang hayop aron atimanon niya, unya mamatay kini, masamad o kawaton ug walay laing nakakita sa pagkahitabo niini, ang maong tawo kinahanglan moadto sa dapit nga alampoanan ug manumpa sa Ginoo nga wala siya mangawat sa maong hayop.	Kung ang sinuman ay humiram ng anuman sa kanyang kapwa, at nasaktan ito, o namatay, na hindi kaharap ang may-ari, ang humiram ay magsasauli ng buo.
EXO_022_0014	Kon wala kini kawata, isipon kini sa tag-iya nga nawala ug ang tawo nga nakawala niini dili kinahanglan nga magbayad.	Kung ang may-ari niyon ay kaharap, hindi siya magsasauli; kung ito'y inupahan, dumating ito para sa upa nito.
EXO_022_0015	Apan kon gikawat ang maong hayop gikan kaniya, kinahanglan nga magbayad siya sa tag-iya.	At kung akitin ng isang lalaki ang isang dalaga na hindi pa naipagkakasundong mag-asawa at kanyang sipingan, kanyang ibibigay ang kanyang dote at gagawing kanyang asawa.
EXO_022_0016	Kon ang hayop gipatay sa ihalas nga mananap, kinahanglang dad-on niya ang patayng lawas ingon nga kamatuoran ug dili kinahanglan nga bayran niya kini.	Kung mahigpit na tumutol ang kanyang ama na ibigay siya sa kanya, ay magbabayad siya ng salapi katumbas ng dote para sa mga dalaga.
EXO_022_0017	Kon ang usa ka tawo mohulam ug hayop sa laing tawo, ug masamad o mamatay samtang wala diha ang tag-iya niini, kinahanglang bayran niya kini.	Huwag mong pahintulutang mabuhay ang isang babaing mangkukulam.
EXO_022_0018	Apan kon kuyog ang tag-iya sa pagkahitabo niini, ang tawo nga mihulam dili kinahanglang mobayad niini.	Sinumang sumiping sa isang hayop ay papatayin.
EXO_022_0019	Kon giabangan ang hayop, ang kadaot mataplan sa abang.	Ang maghandog sa alinmang diyos, maliban sa Panginoon lamang, ay lubos na pupuksain.
EXO_022_0020	Kon tintalon sa usa ka lalaki ang usa ka dalagang ulay nga dili sinayoran ug makighilawas siya kaniya, bayran niya ang bayranan sa kasal ug pangasaw-on niya ang babaye.	At huwag mong aapihin, o pahihirapan ang dayuhan, sapagkat kayo'y mga dayuhan din sa lupain ng Ehipto.
EXO_022_0021	Apan kon ang amahan sa babaye dili mosugot nga pangasaw-on ang iyang anak, kinahanglan nga bayran sa lalaki ang kantidad nga tukma sa bili sa bugay sa kaminyoon sa usa ka ulay.	Huwag ninyong pahihirapan ang sinumang babaing balo, o batang ulila.
EXO_022_0022	Patya ninyo ang babayeng diwatahan o barangan.	Kung iyong pahihirapan sila sa anumang paraan, at dumaing sa akin, tiyak na aking diringgin ang kanilang daing; ang aking poot ay mag-aalab, at papatayin ko kayo ng tabak, at ang inyong mga asawa ay magiging mga balo, at ang inyong mga anak ay magiging mga ulila.
EXO_022_0023	Kinahanglan patyon si bisan kinsa nga makighilawas ug mananap.	Kung magpautang ka ng salapi sa kaninuman sa aking bayan sa dukhang kasama mo, huwag mo silang papakitunguhan bilang tagapagpautang; huwag mo siyang papatungan ng tubo.
EXO_022_0024	Ang maghalad ngadto sa laing dios gawas kanako, ang Ginoo , kinahanglan patyon.	Kung iyong kunin ang damit ng iyong kapwa bilang sangla, isasauli mo iyon sa kanya bago lumubog ang araw; sapagkat iyon lamang ang kanyang saplot, iyon ang kanyang pantakip sa kanyang katawan, ano pa ang kanyang ipapantulog?
EXO_022_0025	Ayaw ninyo palabilabihi o daugdaoga ang usa ka langyaw kay kamo usab mga langyaw man kaniadto didto sa Ehipto.	At kapag siya'y dumaing sa akin ay aking diringgin sapagkat ako'y mahabagin.
EXO_022_0026	Ayaw ninyo daugdaoga ang mga biyuda o ang mga wala nay ginikanan.	Huwag mong lalapastanganin ang Diyos, ni lalaitin man ang pinuno ng iyong bayan.
EXO_022_0027	Kon daugdaogon ninyo sila, tabangan ko sila inigpakitabang nila kanako ug masuko ako pag-ayo ug pamatyon ko kamo pinaagi sa espada.	Huwag mong ipagpapaliban ang paghahandog ng mula sa iyong mga ani, at ng mula sa umagos sa iyong mga pisaan.
EXO_022_0028	Mabiyuda ang inyong mga asawa ug mawad-an ug amahan ang inyong mga anak.	Ang panganay sa iyong mga anak na lalaki ay ibibigay mo sa akin.
EXO_022_0029	Kon magpahulam kamog salapi sa akong katawhan nga mga kabos, ayaw kamo pagpangayog tubo sama sa gihimo sa tigpatanto.	Gayundin ang gagawin mo sa iyong mga baka at sa iyong mga tupa: pitong araw itong makakasama ng kanyang ina; sa ikawalong araw ay ibibigay mo ito sa akin.
EXO_022_0030	Kon kuhaon ninyo ang kupo sa usa ka tawo ingon nga garantiya nga mobayad siya kaninyo, kinahanglan nga iuli ninyo kini kaniya sa dili pa mosalop ang adlaw kay mao ra kini ang iyang magamit aron mainitan siya inigkatulog niya.	Kayo'y magiging mga taong itinalaga para sa akin; kaya't huwag kayong kakain ng anumang laman na nilapa ng mababangis na hayop sa parang; inyong itatapon ito sa mga aso.
EXO_022_0031	Tabangan ko siya inigpakitabang niya kanako kay ako maluluy-on man.	<MISSING TRANSLATION>
EXO_022_0032	Ayaw kamo pagsultig daotan batok sa Dios ug ayaw ninyo tungloha ang usa ka pangulo sa inyong katawhan.	<MISSING TRANSLATION>
EXO_022_0033	Ayaw ninyo ihikaw kanako ang paghalad sa inyong ani ug sa bino ug lana.	<MISSING TRANSLATION>
EXO_022_0034	Ihatag kanako ang inyong kamagulangang anak nga lalaki.	<MISSING TRANSLATION>
EXO_022_0035	Ihatag usab kanako ang panganay sa inyong baka ug karnero.	<MISSING TRANSLATION>
EXO_022_0036	Magpabilin usa kini uban sa inahan sulod sa pito ka adlaw ug sa ikawalo ihalad ninyo kini kanako.	<MISSING TRANSLATION>
EXO_022_0037	Kinahanglan nga ihalad ninyo kanako ang inyong kinabuhi.	<MISSING TRANSLATION>
EXO_022_0038	Busa ayaw kamo pagkaon sa karne sa bisan unsang mananap nga gipatay sa ihalas nga mananap.	<MISSING TRANSLATION>
EXO_022_0039	Ipakaon kini sa mga iro.	<MISSING TRANSLATION>
EXO_023_0001	Ayaw kamo pagsulti ug tinumotumo nga taho.	Huwag kang magkakalat ng di-totoong balita.
EXO_023_0002	Ayaw pakig-abin sa tawong sad-an pinaagi sa pagsaksig bakak.	Huwag kang makikipagkapit-kamay sa taong masama upang maging isang saksing may masamang hangarin.
EXO_023_0003	Ayaw kamo pagpahiuyon sa kadaghanan sa pagbuhat ug daotan ug ayaw pagsaksi sukwahi sa hustisya aron lamang sa pagpahimuot sa kadaghanan.	Huwag kang susunod sa marami upang gumawa ng masama, ni magbibigay patotoo sa isang usapin na kumakampi sa marami upang baluktutin ang katarungan; ni huwag mo ring papanigan ang dukha sa kanyang usapin.
EXO_023_0004	Ayaw kamo pagpakitag dili makatarunganong pagdapig sa kabos kon husayon siya.	Kung iyong makita ang baka ng iyong kaaway o ang kanyang asno na nakawala, ito ay ibabalik mo sa kanya.
EXO_023_0005	Kon makit-an ninyo ang nakabuhi nga baka o asno sa inyong kaaway, dad-a kini balik kaniya.	Kung iyong makita ang asno ng napopoot sa iyo na nakalugmok sa ilalim ng kanyang pasan, huwag mo siyang iiwan sa gayong kalagayan, tulungan mo siyang buhatin ito.
EXO_023_0006	Kon ang asno sa nagdumot kanimo natumba tungod sa kabug-at sa karga niini, ayaw siyag pasagdi.	Huwag mong babaluktutin ang katarungang nararapat sa iyong dukha sa kanyang usapin.
EXO_023_0007	Tabangi hinuon siya sa pagpatindog niini.	Layuan mo ang maling paratang at huwag mong papatayin ang walang sala at ang matuwid, sapagkat hindi ko pawawalang-sala ang masama.
EXO_023_0008	Ayaw hikawi ug hustisya ang mga kabos diha sa hukmanan.	Huwag kang tatanggap ng suhol, sapagkat ang suhol ay bumubulag sa mga pinuno at sinisira ang mga salita ng mga banal.
EXO_023_0009	Likayi ang pagpamasangil.	Ang dayuhan ay huwag mong aapihin, sapagkat alam ninyo ang puso ng dayuhan yamang kayo'y naging mga dayuhan sa lupain ng Ehipto.
EXO_023_0010	Ayaw patya ang tawo nga dili sad-an kay silotan ko ang tawo nga maghimo niining daotang buhat.	Anim na taong hahasikan mo ang iyong lupa at aanihin mo ang bunga niyon; subalit sa ikapitong taon ay iyong pagpahingahin ito at hayaang tiwangwang, upang ang dukha sa iyong bayan ay makakain.
EXO_023_0011	Ayaw kamo pagdawat ug suborno kay ang suborno makabuta sa mga tawo nga anaa sa katungdanan ug makatuis sa katarongan niadtong dili sad-an.	Ang kanilang maiiwan ay kakainin ng hayop sa bukid.
EXO_023_0012	Ayaw palabilabihi ang usa ka langyaw.	Gayundin ang iyong gagawin sa iyong ubasan at sa iyong taniman ng olibo.
EXO_023_0013	Nasayod kamo sa bation sa usa ka langyaw tungod kay kamo mga langyaw man usab didto sa Ehipto.	Anim na araw na gagawin mo ang iyong gawain, ngunit sa ikapitong araw ay magpapahinga ka upang ang iyong baka at ang iyong asno ay makapagpahinga, at ang anak na lalaki ng iyong aliping babae, at ang taga-ibang bayan ay makapagpahinga.
EXO_023_0014	Sulod sa unom ka tuig tamni ninyo ang inyong yuta ug aniha ang abot niini.	Ingatan ninyo ang lahat ng mga bagay na aking sinabi sa inyo; at huwag ninyong banggitin ang pangalan ng ibang diyos, o marinig man sa inyong bibig.
EXO_023_0015	Apan papahulaya kini sa ikapito nga tuig ug ayaw aniha ang bisan unsa nga motubo niini aron nga ang mga kabos kaninyo makakaon sa mga tanom nga motubo niini ug ang mga ihalas nga mananap makapahimulos sa salin niini.	Tatlong beses sa bawat taon na magdiriwang ka ng pista para sa akin.
EXO_023_0016	Mao usab kini ang buhaton ninyo sa inyong parasan ug mga olibo.	Ang pista ng tinapay na walang pampaalsa ay iyong ipagdiriwang; pitong araw na kakain ka ng tinapay na walang pampaalsa, gaya ng iniutos ko sa iyo, sa takdang panahon, sa buwan ng Abib, sapagkat noon ka umalis sa Ehipto.
EXO_023_0017	Pagtrabaho kamo sulod sa unom ka adlaw apan ayaw pagtrabaho sa ikapito aron makapahulay ang inyong baka ug asno ug mahibalik ang kabaskog sa inyong mga ulipon ug sa mga langyaw nga nagtrabaho alang kanimo.	Walang lalapit sa harap ko na walang dala.
EXO_023_0018	Pamatia ang tanan kong gisulti kaninyo ug ayaw pag-ampo ngadto sa ubang mga diosdios o maghisgot bisan sa ilang ngalan.	Iyong ipagdiriwang ang pista ng pag-aani ng mga unang bunga ng iyong pagpapagal, na iyong inihasik sa bukid.
EXO_023_0019	Paghimo ug kasaulogan katulo sa usa ka tuig aron pagpasidungog kanako.	Ipagdiriwang mo rin ang pista ng pag-aani, sa katapusan ng taon, kapag inaani mo mula sa bukid ang bunga ng iyong pagpapagal.
EXO_023_0020	Tumana ninyo ang Kasaulogan sa Pan nga Walay Patubo.	Tatlong ulit sa bawat taon na ang lahat ng iyong mga kalalakihan ay haharap sa Panginoong Diyos .
EXO_023_0021	Pan nga walay patubo ang inyong kan-on sulod sa pito ka adlaw sa gitagal nga panahon sa bulan sa Abib kay sa maong bulan mibiya kamo sa Ehipto.	Huwag mong iaalay ang dugo ng aking handog na kasabay ng tinapay na may pampaalsa; o iiwan mo man ang taba ng aking pista hanggang sa kinaumagahan.
EXO_023_0022	Ang tanan nga moatubang kanako kinahanglan nga magdalag halad.	Ang mga pinakauna ng mga unang bunga ng iyong lupa ay iyong dadalhin sa bahay ng Panginoon mong Diyos.
EXO_023_0023	Himoa ninyo ang Kasaulogan sa Pagpangani pinaagi sa paghalad ninyo sa unang bunga sa inyong gitanom sa kaumahan.	Huwag mong pakukuluan ang batang kambing sa gatas ng kanyang ina.
EXO_023_0024	Himoa ninyo ang Kasaulogan sa mga Balongbalong inigkatapos sa tuig sa dihang pupuon ninyo ang mga bunga sa inyong kaparasan ug kakahoyan.	Aking isinusugo ang isang anghel sa unahan mo, upang ingatan ka sa daan, at upang dalhin ka sa dakong aking inihanda.
EXO_023_0025	Sa tulo ka higayon matag tuig, ang tanan ninyong mga lalaki moatubang kanako, ang inyong Ginoo nga Dios .	Mag-ingat kayo sa harap niya at dinggin ninyo ang kanyang tinig; huwag kayong maghimagsik sa kanya, sapagkat hindi niya patatawarin ang inyong pagsuway, sapagkat ang aking pangalan ay nasa kanya.
EXO_023_0026	Ayaw kamo paggamit ug pan nga may patubo sa dihang maghalad kamo kanakog mga mananap nga sunogon.	Subalit kung diringgin mong mabuti ang kanyang tinig at gagawin mo ang lahat ng aking sinasabi ay magiging kaaway ako ng iyong mga kaaway, at kalaban ng iyong mga kalaban.
EXO_023_0027	Ayaw pagsalin ug tambok sa mananap hangtod sa buntag.	Sapagkat ang aking anghel ay hahayo sa unahan mo at dadalhin ka sa mga Amoreo, mga Heteo, mga Perezeo, mga Cananeo, mga Heveo, at sa mga Jebuseo, at aking lilipulin sila.
EXO_023_0028	Dad-a ninyo sa balay sa Ginoo nga inyong Dios ang labing maayo sa unang ani gikan sa inyong kaumahan.	Huwag kang yuyukod sa kanilang mga diyos, o maglilingkod man sa mga iyon, o gagawa man ng ayon sa kanilang mga gawa, kundi iyong wawasakin at iyong dudurugin ang kanilang mga haligi.
EXO_023_0029	Ayaw ninyo lutoa ang nating karnero o nating kanding sa gatas sa inahan niini.	Inyong sasambahin ang Panginoon ninyong Diyos, at aking pagpapalain ang inyong tinapay at ang inyong tubig, at aalisin ko ang sakit sa gitna ninyo.
EXO_023_0030	Paanhaon ko ang usa ka anghel aron mag-una ug manalipod kaninyo diha sa dalan ug magdala kaninyo ngadto sa dapit nga akong giandam.	Walang babaing makukunan, o magiging baog man sa iyong lupain; aking lulubusin ang bilang ng iyong mga araw.
