id	source_text	target_text
GEN_030_0040	Impangagna ti kararagna; inikkanna iti gundaway nga aganak.	Inmebat si Jacob, Kabat yo no panoy impanlingkur kod sikayo tan no panoy imbolaslas na saray ayayep yo diad impangasikasok.
GEN_030_0041	Nagsikog ni Raquel ket naganak iti lalaki.	Say daiset a walad sikayo kasakbayay insabik et dinmakerakel, tan binindisionan kayoy Katawan lapud siak.
GEN_030_0042	Kinunana, Inikkat ti Dios ti pakaibabainak gapu iti pannangtedna kaniak iti anak.	Natan sinmabi lay panaon a nunoten ko lay pankaabigan na pamilyak.
GEN_030_0043	Ikkannak koma ti Apo iti sabali pay nga anak a lalaki.	Antoy upa ya iter kod sika?
GEN_030_0044	Iti kasta, pinanagananna ti ubing iti Jose.	tepet nen Laban.
GEN_030_0045	Kalpasan ti pannakaipasngay ni Jose, kinuna ni Jacob ken ni Laban, Palubosannak koma nga agawid.	Inmebat si Jacob, Anggapoy labay kon upa.
GEN_030_0046	Ikuyogko dagiti assawak ken dagiti annakko.	Ituloy koy pangasikasok ed saray karniro yo no onabubon kayod sayan paknaan Onla ak natan ed kawalaan na saray karniro, tan alaen koy balang andeket a kordiro tan balang kanding a batekan o baklayan.
GEN_030_0047	Nateggedko ida gapu iti panagserbik kenka.	Saraya labat so labay kon iyupa yod siak.
GEN_030_0048	Kinuna ni Laban, Palubosannak koma a mangibaga iti daytoy: Kas maibatay iti nasursurok maipapan iti panagpadles, ammok a binendisionannak ti Apo gapu kenka.	Diad panakar na panaon, mainomay yon amtaen no niluko ta kayo o andi.
GEN_030_0049	Ibagam ti kayatmo a sueldo ket itedko.	No nengnengen yo ray ayayep ya inyupa yod siak, tan walay nanengneng yon kanding ya aliwan baklayan o batekan tan karniron aliwan andeket, nibaga yon tinakew.
GEN_030_0050	Insungbat ni Jacob, Ammom no kasano ti panagserbik kenka ken no kasano ti yaadu dagiti arbanmo iti aywanko.	Inmebat si Laban, Marakep itan!
GEN_030_0051	Bassit pay la ti sanikuam sakbay a simmangpetak ngem nakarangrang-aykan ta binendisionannaka ti Apo gapu kaniak.	Ontan sirin so gawaen ta.
GEN_030_0052	Ita, tiempona metten a tamingek ti pagimbagak.	Balet diad saman ya agew inekal nen Laban iray kanding a kalakyan a gulisan o batekan tan saray kabatyan a baklayan tan batekan o walay ampotin batek; inekal to met iray andeket a karniro.
GEN_030_0053	Ania ngarud ti itangdanko kenka?	Impaasikaso to rad saray anak ton lalaki, insan to ra inyarawid kinen Jacob a taloy agew no akaren so kaarawi to.
GEN_030_0054	sinaludsod ni Laban.	Inasikaso nen Jacob ira may atilak ya ayayep nen Laban.
GEN_030_0055	Diak dumawat iti sueldo, insungbat ni Jacob.	Angalay Jacob na saray sanga na estoraki, almindra, tan platano, insan to inobakan iray arum a partiy sanga pian singa walay gulis dan ampoti.
GEN_030_0056	Ituloyko a taraknen dagiti animalmo no umanamongka iti singasingko.	Inyan to ra yan sanga ed arap na saramay ayayep, diad pasen a paniinoman da.
GEN_030_0057	Ita met laeng, innak kadagiti arbanmo ket alaek amin a nangisit nga urbon ti karnero ken amin a labang wenno turikturikan nga urbon ti kalding.	Inyan to rad man, ta mankakastaan ira no onla ran oninom.
GEN_030_0058	Kukuakon dagitoy a kas tangdanko.	Lapud akastaan ira diad arap na saramay sanga nananak iray baklayan a binmawer, baklayan, tan batekan.
GEN_030_0059	Iti masakbayan, nalakamto a matakuatan no inallilawka.	Imbiig nen Jacob iray karniro ed saray kanding, tan impaarap to rad saray baklayan a binmawer tan andeket ya ayayep nen Laban.
GEN_030_0060	No umaymonto kitaen dagiti tangdanko nga animal, ket makitamto nga adda nailaok a saan a labang ken turikturikan a kalding wenno saan a nangisit a karnero, maammoamto a tinakawko daytoy kenka.	Diad onya, dinmakel lan dinmakel so ayayep nen Jacob tan imbiig to rad saray ayayep nen Laban.
GEN_030_0061	Ala, wen.	No mankasta ray ayayep a maung so laman da, iyan nen Jacob ira may sanga ed arap da diad paniinoman da, pian mannginew ira ed pegley na saramay sanga.
GEN_030_0062	Aramidenta ti imbagam, kinuna ni Laban.	Balet ag to iyan ira may sanga ed arap na saray ayayep a makapoy so laman.
GEN_030_0063	Ngem iti dayta nga aldaw, innala ni Laban ti amin a kalakian a kalding a garitan ken amin a kabaian a kalding a turikturikan ken labang, kasta met dagiti amin a nangisit a karnero sana impataraken dagitoy kadagiti annakna a lallaki.	Ag abayag, kayaryan nen Laban iray makapoy so laman, tan kayaryan nen Jacob iray maung so laman.
GEN_030_0064	Kalpasanna, pimmanawda nga agaama ket tallo nga aldawda a nagnagna agingga a dimmanonda iti maysa a disso nga adayo ken ni Jacob.	Lapud saya nagmaliw a mayamyaman si Jacob.
GEN_030_0065	Inaywanan ni Jacob dagiti nabati nga arban.	Amayamay iray karniro, kanding, kamilyo tan asno to, tan aripen to.
GEN_031_0001	Nadamag ni Jacob nga ibagbaga dagiti kayongna nga innalana amin a sanikua ni Laban.	Nadngelan nen Jacob a kuan na saray lalakin anak nen Laban, Inala nen Jacob so amin a kayaryan nen ama tayo.
GEN_031_0002	Nagtaud kano iti daytoy ti amin a kinabaknangna.	Nanlapud ama tayo so amin a kayamanan to.
GEN_031_0003	Nadlawna met a saanen a kas idi a naasideg ni Laban kenkuana.	Alikas to met a nanaoman lay panangaro nen Laban ed sikato.
GEN_031_0004	Kinuna ni Yahweh ken ni Jacob, Agsublika iti daga dagiti kapuonam ken kadagiti kakabagiam.	Insan inkuan na Katawan ed sikato, Pawil ka lad dalin na saray atateng mo tan saray kakanayon mo.
GEN_031_0005	Addaakto kenka.	Olupen ta ka.
GEN_031_0006	Nangibaon ngarud ni Jacob iti mapan mangibaga kada Raquel ken Lea nga agsasarakda iti taltalon a yan dagiti arbanna.	Kanyan nampabakian nen Jacob ira di Raquel tan Lea ya abeten dad alog a kawalaan da ray ayayep to.
GEN_031_0007	Kinunana kadakuada, Nadlawko a nagbaliwen ni tatangyo; saanen a kas idi a naasideg kaniak.	Inkuantod sikara, Nalilikas kon mangooman lay panangarod siak di ama tayo; balet aasikasoen ak lawas na Dios nen amak.
GEN_031_0008	Ngem kanayon nga adda kaniak ti Dios ni tatangko.	Kabat yon dua ya inyoput koy biskeg ko ed impanlingkur kod ama yo.
GEN_031_0009	Ammoyo nga inkabilko ti amin a kabaelak a nagserbi ken ni tatangyo.	Anggaman ontan, sinaol da ak tan amimpulon inooman day upak.
GEN_031_0010	Kaskasdi a sinaurnak ket naminsangapulo a binaliwanna ti tulagan iti panangtangdanna kaniak.	Balet ag inyabuloy na Dios a napasakitan da ak.
GEN_031_0011	Ngem saan nga impalubos ti Dios a dangrannak.	Nen inkuandi ama tayon Laban, Saray baklayan a kanding so upam, nananak na baklayan iray kabatyan.
GEN_031_0012	No kuna ni Laban, Dagiti turikturikan a kalding ti tangdanmo, aganak amin nga arban kadagiti turikturikan nga urbon.	Nen inkuanda, Saray gulisan a kanding so upam, nananak na gulisan iray kabatyan.
GEN_031_0013	No ibagana, Dagiti garitan a kalding ti tangdanmo, aganak amin nga arban kadagiti garitan nga urbon.	Inala na Dios iray ayayep nen ama yo tan inter to rad siak.
GEN_031_0014	Innala ti Dios ti arban ni tatangyo sana inted kaniak.	Nen panaon na panagkasta, walay kogip ko.
GEN_031_0015	Intuloy ni Jacob, Idi tiempo ti panagmaya dagiti arban, nagtagtagainepak.	Anengneng kon saray kalakyan a kanding a mankakasta et gulisan, batekan, tan baklayan so kolor da.
GEN_031_0016	Nakitak kampay idi a pasig a garitan, labang, ken turikturikan dagiti kalakian a kalding a tumaktakba.	Inkuan ed siak na anghil na Dios diad kogip, Jacob!
GEN_031_0017	Iti tagtagainepko, nagsao kaniak ti anghel ti Apo .	On, wadya ak, ebat ko.
GEN_031_0018	Jacob, kinunana.	Intuloy ton inkuan, Nengneng mo, amin a kanding a kalakyan a mankakasta et gulisan, batekan, tan baklayan ira.
GEN_031_0019	Ania, Apo?	Gagawaen ko ya, ta nanenengneng koy gagawaen nen Laban ed sika.
GEN_031_0020	insungbatko.	Siak imay Dios a pinmayawar ed sika diad Betel, a dimay angipaalageyan moy bato a pakanudnunotan tan insaklang mon masanto ed siaktan diman met so nanggawaan moy sakey a sinambaan a sipan ed siak.
GEN_031_0021	Kitaem, intuloyna, pasig a garitan, labang ken turikturikan dagiti kalakian a kalding a tumaktakba.	Natan mamparaan ka, taynan kad sayan dalin tan pawil kad dalin a nianakan mo.
GEN_031_0022	Siak ti akin-aramid iti daytoy ta nakitak ti amin nga ar-aramiden kenka ni Laban.	Inmebat ira di Raquel tan Lea, Anggapo lay nakdaan a tawiren mid ama mi.
GEN_031_0023	Siak ti Dios a nagparang kenka idi idiay Betel.	Singa kami la sangkailid sikato.
GEN_031_0024	Malagipmo daydiay a lugar?	Inlako to kami, tan inggastos to lan amin so kuartan nanlakoan tod sikami.
GEN_031_0025	Sadiay ti nagsapataam kaniak ken nangikonsagraram iti maysa a bato a pakalaglagipan babaen iti panangbuyatmo iti lana ti olibo.	Amin iray kayamanan ya inalay Dios ed kinen ama mi et kayaryan mi tan kayaryan na saray anak mi.
GEN_031_0026	Ita, agrubbuatka.	Sumpal moy imbaga na Dios ed sika.
GEN_031_0027	Panawamon daytoy a daga ket agsublika iti daga a nakayanakam.	Namparaan sirin si Jacob ya ompawil ed kinen ama to diad dalin na Canaan.
GEN_031_0028	Simmungbat da Raquel ken Lea: Awanen ti matawidmi ken ni tatangmi.	Impakabayo tod saray kamilyo iray anak to tan saray asawa to, tan pinaona to ray amin ya ayayep to tan antokaman a kayaryan a nalmoan tod Mesopotamia.
GEN_031_0029	Ibilangnakamin a kas ganggannaet.	Linmay Laban a mangatlid saray karniro to; et nen andid man ed abung, tinakew nen Raquel iray talintaoy diriyos na pamilya tan kayaryan nen ama to.
GEN_031_0030	Inlakonakami ket nabusbosnan ti amin a kuarta a nakailakoanmi.	Pinalikdo nen Jacob si Laban diad ag to impangibagay itaynan to.
GEN_031_0031	Kukuami kadagiti annakmi amin dagitoy a kinabaknang nga innala ti Dios ken ni tatangmi.	Inawit ton amin iray kayaryan to tan ginanatan toy tinmaynan.
GEN_031_0032	Aramidem ti aniaman nga imbaga kenka ti Dios.	Binaliw toy Ilog na Eufrates tan amaarap ed Palandey na Galaad.
GEN_031_0033	Nagrubbuat ngarud ni Jacob tapno agsubli iti Canaan, iti daga ti amana.	Kalabas na taloy agew nibagad kinen Laban a tinmaynan si Jacob.
GEN_031_0034	Pinagsakayna dagiti annakna ken dagiti assawana kadagiti kamelio.	Intagar to ray totoo to tan inosilan ton pitoy agew si Jacob, et nabot to ed palandey na Galaad.
GEN_031_0035	Intugotna dagiti arbanna ken ti amin a sanikuana a naurnongna idiay Padan-aram.	Diad kogip nen Laban ed saman a labi, linmay Dios ed sikato tan inkuanto, Manalwar ka!
GEN_031_0036	Awan idi ni Laban ta pukpukisanna dagiti karnero.	Ag mo didiwiten a balut si Jacob.
GEN_031_0037	Bayat ti kaawanna, napan ni Raquel iti tolda ti amana ket tinakawna dagiti didiosen a kukua ni tatangna.	Nanayam si Jacob ed kapokdulan, balet si Laban tan saray kakanayon to et nankampo rad kapokdulan na Galaad.
GEN_031_0038	Sinikapan ni Jacob ni Laban ta dina imbaga kenkuana ti ipapanawna.	Inkuanen Laban ed kinen Jacob, Akin et pinalikdo mo ak diad impangawit mod saray bibiin anak ko a singa ra asamsam ed bakal?
GEN_031_0039	Innalana ti amin a sanikuana sa nagdardaras a pimmanaw.	Akin et pinalikdo mo ak diad inyalis mon ag ko amta?
GEN_031_0040	Binallasiwna ti Karayan Eufrates ket nagturong iti katurturodan ti Galaad.	No imbagam labat komun ed siak, pinasiput ta kan walay liket, kansion, tan togtog na saray arpa tan pandirita.
GEN_031_0041	Tallo nga aldaw kalpasanna, naipadamag ken ni Laban a naglibas ni Jacob.	Ag mo anggan impaanguban iray apok tan saray anak ko kasakbay dan inmalis.
GEN_031_0042	Innalana dagiti tattaona ket pito nga aldaw a sinursurotda ni Jacob agingga a nakamakamda iti katurturodan ti Galaad.	Makapoy man a ginawam!
GEN_031_0043	Iti dayta a rabii, natagtagainep ni Laban a nagparang ti Dios kenkuana ket kinunana, Kitaem ta dimo dangran ni Jacob.	Walay pakayarik a mamasakit ed sika, balet pinasakbayan ak na Dios nen amam ya ag ta kan balut diwiten.
GEN_031_0044	Nakamakam ni Laban ni Jacob.	Kabat kon tinmaynan ka, lapud labay mo lay makasempet ed abung mo, balet akin et tinakew mo ray diriyos ko?
GEN_031_0045	Nagkampo ni Jacob iti maysa a bantay.	Inmebat si Jacob, Antakot ak, ta inisip kon alaen yod siak iray anak yon bibii.
GEN_031_0046	Nagkampo met ni Laban ken dagiti kaduana iti katurturodan ti Galaad.	Balet no narumog yo dia iray diriyos yo, nakaukolan a pateyen so siopaman a pakarumogan.
GEN_031_0047	Kinuna ni Laban ken ni Jacob, Apay a sinikapannak?	Nia ray lalakin mantasi.
GEN_031_0048	Apay nga impanawmo dagiti annakko a kasda la babbai a natiliw iti gubat?	Mananap kayoy antokaman a kayaryan yo tan ala yoy gawa yo.
GEN_031_0049	Apay a naglibaska?	Ag amta nen Jacob a tinakew nen Raquel iray diriyos nen Laban.
GEN_031_0050	No imbagam ti ipapanawmo, pinarubbuatanka koma nga adda ragragsak ken kankanta, iti baet ti musika ti pandereta ken arpa.	Sinukisok nen Laban so tulda nen Jacob; insan linmoob ed tulda nen Lea tan diad tulda na saramay duaran aripen a bibii, balet ag to arumog iray diriyos to.
GEN_031_0051	Dinak pay inikkan iti gundaway a mangagek kadagiti appokok ken kadagiti annakko sakbay a pimmanawda.	Linmoob ed satan diad tulda nen Raquel.
GEN_031_0052	Minamaag ti kasta nga inaramidmo!	Balet inala la nen Raquel ira may diriyos, inkarga to rad supot ya apis na beneg na kamilyo, insan to inirungan.
GEN_031_0053	Kabaelanka a dangran ngem idi rabii, binallaagannak ti Dios ni amam a dika an-anoen.	Inanap ira nen Laban diad intiron tulda, balet ag to ra narumog.
GEN_031_0054	Ammok a nagtalawka ta aggagarka unayen nga agawid.	Inkuanen Raquel ed kinen ama to, Ag yo ak pamapasnukan; ta ag ak makaalagey ed arap yo, ta sinmabid siak so binulan a sakit min bibii.
GEN_031_0055	Ngem apay a tinakawmo dagiti didiosek?	Inanap nen Laban iray diriyos to, balet ag to ra nalmo.
GEN_031_0056	Insungbat ni Jacob, Nagbutengak ta impagarupko a no maammoam a pumanawak, dimo ipalubos nga alaek dagiti annakmo.	Naingungotan si Jacob.
GEN_031_0057	Ngem no maipapan kadagiti didiosen, no adda kadakami ti masarakam a nangala kadagitoy, rumbeng a mapapatay.	Inkuanto, Antoy kasalanan a ginawak?
GEN_031_0058	Agpaay a saksi dagiti tattaota; kitaem no adda ditoy ti kukuam ket alaem no masarakam.	Antoy ganggan a sinumlang ko, et naitdan kayoy kanepegan a mangosil ed siak?
GEN_031_0059	Saan nga ammo ni Jacob a tinakaw ni Raquel dagiti didiosen.	Natan ta inonaan yo lan amin iray kayaryan ko, antoy nalmo yon kagawaay abung a kayaryan yo?
GEN_031_0060	Simrek ni Laban iti tolda ni Jacob ket nagsukisok.	Ipaway yo diad arap na totook tan totoo yo, pian nanengneng da tan nasintinsiaan da no siopay nalilingod sikatayo.
GEN_031_0061	Kasta met ti inaramidna iti tolda ni Lea ken iti tolda dagiti dua a babbai a tagabu ngem dina nasarakan dagiti didiosen.	Duamploy taon ko lad sikayo; ag tinmondan nananak iray karniro tan saray kanding yo, tan ag ak angan na anggan sakey a kordiro.
GEN_031_0062	Kalpasanna, simrek iti tolda ni Raquel.	No walay karniron pinatey na ayep ed takel, inakok so inkaandi to; ag ko la inyakar ed sikayo, pian ag yo la naamtaan a siak so akankasalanan.
GEN_031_0063	Ngem nailemmengen ni Raquel dagiti didiosen.	Pinasoot yo ak a mambayar ed amin ya atakew ed agew man o labi.
GEN_031_0064	Inkargana dagitoy iti pasanga ti kamelio ket nagtugawanna daytoy.	Naynay ak a nanirap, lapud petang na agew tan betel na labi.
GEN_031_0065	Nagsukisok ni Laban iti tolda ngem awan ti nasarakanna.	Ag ak makaogip.
GEN_031_0066	Kinuna ni Raquel iti amana, Dinak koma kaunget, tatang, iti saanko nga itatakder iti kaaddayo; agreglaak ngamin.	Onyay agawgawa diad loob na duamploy taon kod sikayo.
GEN_031_0067	Intuloy ni Laban ti nagbirok ngem dina nasarakan dagiti didiosenna.	Labinapat a taon so impankimey ko pian naalak iray bibiin anak yo, tan anem taon pian naalak iray ayayep yo.
GEN_031_0068	Kasla bumtak ti barukong ni Jacob iti napalalo a pungtotna.	Anggaman ontan, amimpulon inooman yoy upak.
GEN_031_0069	Ania kadi ti dakes nga inaramidko?	No ag ak labat tutulongan na Dios da ray atateng ko, say Dios ya inggalang di Abraham tan Isaac, pinataynan yo ak la komun a kalima-lima.
GEN_031_0070	sinaludsodna.	Balet anengneng na Dios so gunigon ko tan say kimey ko; kalabyan inter to lay sintinsia to.
GEN_031_0071	Adda aya sinalungasingko a linteg ta kaskayo la aso a mangkamkamat kaniak?	Inmebat si Laban ed kinen Jacob, Anak ko ra yan bibii, kayaryan ko ray anak da, tan kayaryan ko met ira yan ayayep.
GEN_031_0072	Ita ta nalpasen ti panangbukitkitmo iti amin nga alikamenko, adda kadi nasarakam a kukuam?	Kayaryan koy amin a nanenengneng mo dia.
GEN_031_0073	No adda, iruarmo ditoy tapno makita dagiti tattaota ket ikeddengda no siasino kadata ti nalinteg.	Balet anggapoy nagawaan kon mamokpok ed saray anak ko tan saray anak da.
GEN_031_0074	Duapulo a tawen a nagkadkaduata.	Kanyan sipaparaan aka mipaknaan ed sika.
GEN_031_0075	Pulos nga awan naalisan iti arbanmo ket immadu dagiti karnero ken kaldingmo.	Mangibunton tay bato a pakanudnunotan ed sayan paknaan ta.
GEN_031_0076	Saanko a naitured ti nagparti iti uray maysa la koma a karnerom.	Angala sirin na bato si Jacob tan impaalagey tod man a sakey a pakanudnunotan.
GEN_031_0077	No adda idi karnero a patayen ti narungsot nga animal, suktak a dagus.	Ingganggan to ray totoo to a mantipon iray bato tan ibunton da.
GEN_031_0078	Saankon nga ipakita kenka tapno agpaay a pammaneknek a saan a siak ti nagliway iti ipapatayna.	Insan angan ira diad abay to may bunton.
GEN_031_0079	Ket sinapulmo kaniak ti sukat ti animal a matakaw iti aldaw wenno iti rabii.	Inngaran nen Laban iman a pasen na Jegar-sahaduta; si Jacob balet inggaran to na Galeed.
GEN_031_0080	Kakaasiak a main-initan.	Inkuanen Laban ed kinen Jacob, Sayan bunton na bato so mangipanunot ed sikatan dua.
GEN_031_0081	Kakaasiak a malamlammiisan iti rabii.	Sikato yay makasengeg ya atawag na Galeed iman a pasen.
GEN_031_0082	Mapuypuyatanak.	Inkuan met ni nen Laban, Bantayan ita komun na Katawan legan a nanarawiyan ita.
GEN_031_0083	Kasta la a kasta iti unos ti duapulo a tawen a kaaddak kenka.	Kanyan atawag met iman a pasen na Mispa.
GEN_031_0084	Sangapulo ket uppat a tawen a nagpatagabuak kenka tapno maasawak dagiti dua nga annakmo.	Intuloy nen Laban ya inkuan, No makapoy so ipatnag mod saray anak ko, o mangasawa ka na arum a bibii, anggaman ya ag ko amta, ag mo lilingwanan a bambantayan ita na Dios.
GEN_031_0085	Innem met a tawen nga inaywanak dagiti arbanmo, ket naminsangapulo a binaliwam ti rumbeng a tangdanko.	Nia ray baton imbunton ko ed nanleetan ta, tan niay baton pakanudnunotan.
GEN_031_0086	No saannak a tinarabay ti Dios dagiti kapuonak, ti Dios ni Abraham ken ni Isaac, nalabit a pinapanawnak nga ima-ima.	Sayan bunton na bato tan sayan baton pakanudnunotan et sikaray manangipanunot.
GEN_031_0087	Ngem nakita ti Dios ti panagsagabak ken dagiti panagbambannogko ket idi rabii, impaulogna ti pangngeddengna kenka.	Ag kon balut onlad labas to yan bunton a dogpaan ta ka, tan ag kan balut oonlad labas to yan bunton o labas to yan baton pakanudnunotan a dogpaan mo ak.
GEN_031_0088	Insungbat ni Laban ken ni Jacob, Kukuak amin nga intugotmo: dagiti annakko, dagiti appokok ken uray pay dagitoy nga arban.	Say Dios nen Abraham tan say Dios nen Nacor so manintinsiad sikatan dua.
GEN_031_0089	Ngem ania pay ti maaramidko tapno agtalinaed kaniak dagiti annakko ken dagiti appokok?	Insan diad ngaran na Dios ya inggalang nen ama ton Isaac, sinambaan nen Jacob a tooren to yan sipan.
GEN_031_0090	Nasaysayaat laengen nga agaramidta iti katulagan.	Amatey na sakey ya ayep tan imbagat tod man ed palandey, insan to inimbitaan a mangan iray totoo to.
GEN_031_0091	Mangbuntonta iti batbato ket aramidenta a baton-lagip iti tulaganta.	Kasumpal dan angan, pinalabas day labi diad saman a palandey.
GEN_031_0092	Nangala ni Jacob iti bato ket impasdekna a kas baton-lagip.	Kabkabwasan, inaanguban nen Laban iray apo to tan saray anak ton bibii a pamasiput tod sikara, insan la sinmempet.
GEN_032_0001	Bayat ti panangituloy ni Jacob iti panagdaliasatna, adda sumagmamano nga angheles a nangsabat kenkuana.	Intuloy nen Jacob so pankukurang to.
GEN_032_0002	Idi makitana ida, kinunana, Daytoy ti kampo ti Dios.	Inabet na pigaran anghil.
GEN_032_0003	Iti kasta, pinanagananna ti lugar iti Mahanaim.	Nen anengneng to ra, inkuanto, Kampo ya na Dios; kanyan inngaran to man a pasen na Mahanaim.
GEN_032_0004	Pinauna ni Jacob ti sumagmamano a tattaona a mapan ken ni kabsatna nga Esau iti pagilian ti Edom.	Angibakiy Jacob na totoo to ed kinen agi ton Esau diad dalin na Edom.
GEN_032_0005	Kastoy ti pinaibagana: Siak ni Jacob a kabsatmo ken natulnog nga adipenmo.	Imbilin tod sikaran onyay ibaga ra: Siak a si Jacob, say mapaabeban aripen mo, ipapakabat kod sika Esau, ya abayag ak a nanayam ed kindi pangamaen tan Laban tan natan ak labat ompawil.
GEN_032_0006	Kayatko nga ipakaammo a nabayagak a nakipagtaeng ken ni uliteg a Laban ket ita la ti panagsublik.	Wala ray bakak, asno, kanding, karniro, tan aripen ko.
GEN_032_0007	Adu ti baka, asno, kalding, karnero ken tagabuk.	Imbakik ed sika ra yan totoo, ta labay koy mipulangan ed sika.
GEN_032_0008	Imbaonko dagitoy pannakabagik bareng magun-odko ti panagtalekmo.	Nen pinmawil ed kinen Jacob ira may imbaki to, inkuanda, Linma kamid kinen agim ya Esau, tan wala lad dalan a mangabet ed sika.
GEN_032_0009	Nagsubli dagiti naibaon ket kinunada ken ni Jacob, Nakasaomi ni Esau a kabsatmo ket umaynaka sabten.	Kaiba toy apat a lasus a lalaki.
GEN_032_0010	Addan iti dalan a kaduana ti 400 a lallaki.	Ataktakot tan agunigon si Jacob.
GEN_032_0011	Nagbuteng ken nariribukan ni Jacob.	Impankadwa to ray totoon kaiba to, saray karniro, kanding, baka, tan saray kamilyo.
GEN_032_0012	Biningayna iti dua a bunggoy dagiti tattaona, kasta met dagiti karnero, kalding, baka ken kamelio.	Inkuantod sikaton dili, No dogpaan toy onaan ya olup, nayarin makabatik so walad onur ya olup.
GEN_032_0013	Kinunana iti bagina, No darupennakami ni Esau, mabalin a makalibas ti maysa a bunggoy.	Insan nampikasiy Jacob, Dios nen lakik ya Abraham tan Dios nen amak ya Isaac, dengel mo ak pa!
GEN_032_0014	Ket nagkararag ni Jacob, O Dios ni apongko nga Abraham ken ni tatangko nga Isaac, tulongannak koma.	Imbagam ed siak, Katawan , ya ompawil ak ed dalin ko tan saray kakanayon ko, tan ag mo ak paolyan pian maung so pansumpalan ko.
GEN_032_0015	Imbagam kaniak, O Apo , nga agsubliak iti dagak ken kadagiti kakabagiak ket saannakto a baybay-an.	O matoor a Katawan , ag ak manepeg a mangawat na panangarom tan panangasim ya impatnag mod siak a mapaabeban aripen mo.
GEN_032_0016	Diak maikari iti amin nga imbag ken ayat nga impaaymo kaniak nga adipenmo.	Binaliw koy Jordan ya anggapoy awit ko no ag say baston labat, balet natan pinmawil ak a kaibak ira yan duaran olup.
GEN_032_0017	Idi bimmallasiwak iti Jordan, awan iggemko no di la sarukod, ngem ita ta nagsubliakon, duan a bunggoy ti kinakuyogko.	Kerewen kod sika ya iyagel mo ak ed kinen Esau.
GEN_032_0018	Isalakannak koma iti pannakabalin ni kabsatko nga Esau.	Antakot ak ta ompan onla dian ondogpad sikami et pateyen to kamin amin, pati saray bibii tan saray ogogaw.
GEN_032_0019	Mabutengak amangan no umaynakami patayen amin, pati dagiti babbai ken ubbing.	Ag mo pa lilingwanan ya insipan mon ag mo ak paolyan pian maung so pansumpalan ko; insipan mo met ya itdan mo ak na saray kabyangay boleg ko a diad kinarakel da et ag ira nabilang, ta singa kinarakel na buer ed gilig na dayat so bilang da.
GEN_032_0020	Inkarim kaniak a saannakto a baybay-an ket awanto ti dakes a mapagtengko.	Kasumpal na impamalabas day labid man, nampiliy Jacob ed saray ayayep to na irigalo tod kinen Esau: duan lasus a kabatyan a kanding tan duamplon kanding a kalakyan, duan lasus a kabatyan a karniro tan duamplon karniron kalakyan, talomplon kamilyon mampapasuso tan saray kilaw da, apataplon kabatyan a baka tan samploran bakan kalakyan, duamplon kabatyan ya asno tan samploran asno a kalakyan.
GEN_032_0021	Imbagam pay a paaduem dagiti kaputotak a kas iti kaadu ti darat iti igid ti baybay.	Impansisian to rad pigaran grupo tan impaasikaso tod sakey ya aripen to so balang grupo.
GEN_032_0022	Naturog sadiay ni Jacob iti dayta a rabii.	Inkuantod sikara, Onona kayo, balet panaarawian yoy balang sakey a grupo.
GEN_032_0023	Kabigatanna, insaganana dagiti regalona ken ni Esau.	Imbilin tod walad onaan ya aripen, No naabet moy Esau a kuyak tan tepeten to, Siopay amom?
GEN_032_0024	Nangpili iti dua gasut a kabaian a kalding ken duapulo a bulog, dua gasut a kabaian a karnero ken duapulo a kalakian, tallopulo a gagatasen a kamelio agraman dagiti urbonda, uppat a pulo a kabaian a baka ken sangapulo a toro, duapulo a kabaian nga asno ken sangapulo a kalakian.	Iner so laen mo?
GEN_032_0025	Adda adipen a nadutokan a mangaywan iti tunggal arban.	Siopay akankien ed saray ayayep a walad onaan mo?
GEN_032_0026	Kinunana kadakuada, Umun-unakayo, ngem saankayo nga aggigiddan; agsasarunokayo ket ikkanyo ti baet ti tunggal arban.	onyay iyebat mo, Kien ira nen aripen mon Jacob.
GEN_032_0027	Imbilinna iti umuna nga adipen, Inton masabatnaka ni kabsatko nga Esau ket saludsodenna, Siasino ti apom?	Ipapayakar to ran rigalo ed kuya ton Esau.
GEN_032_0028	Sadino ti papanam?	Onya met so imbilin tod kumadwan aripen, say kumatlo, tan amin da ni ray arum a managasikasoy ayayep: Onyay ibaga yod kinen Esau no naabet yo On, say aripen yon Jacob et wadtad bandad onur.
GEN_032_0029	Siasino ti akinkukua kadagitoy nga animal?	Inisip nen Jacob a diad pangiter to na rigalo napakepa toy pasnuk nen Esau, tan no naabet to, pirdonaen da.
GEN_032_0030	kastoyto ti isungbatmo, Kukua ni adipenmo a Jacob.	Impaiyona to la ra may rigalo to, tan naogip nid kampo to diad saman a labi.
GEN_032_0031	Paitedna dagitoy a kas sagut ken ni apona nga Esau.	Diad saman lamlamang a labi, binmangon si Jacob, intagar to ra may duaran asawa to, saramay duaran inamung ton aripen a bibii, tan saramay labinsakey ya anak to, insan da binaliw so Ilog na Jabok.
GEN_032_0032	Sumarsaruno kadakami ni Jacob.	Kasumpal to ran pinabaliw, impaibaliw to met iray amin a kayaryan to, balet tinmilak a bukbukor to.
GEN_032_0033	Kasta met ti imbilinna iti maikadua, iti maikatlo ken kadagiti amin nga adipen nga adda aywanna nga arban, Kastoyto amin ti ibagayo ken ni Esau inton masabatyo.	Insan sinmabiy sakey a too tan akibalsakan ed kinen Jacob ya anggad palbangon.
