id	source_text	target_text
GEN_013_0021	Nagtalinaed ni Abram iti daga ti Canaan.	Diad karakel na iter kod sikan kabyangay boleg mo, no bilangen mo ra singa ka mambibilang na dabuk.
GEN_013_0022	Nagnaed met ni Lot kadagiti siudad ti tanap, iti asideg ti Sodoma.	Natan sirin, liber mo yan dalin, ta iter kod sikan amin.
GEN_013_0023	Managdakdakes dagiti tattao ti Sodoma ket nakaro ti panagbasolda ken ni Yahweh.	Inyalis nen Abram so tulda to ed abay na saray masanton kiew ed Mamre diad Hebron tan nanayam diman.
GEN_013_0024	Kalpasan ti panagsina da Abram ken ni Lot, kinuna ni Yahweh ken ni Abram, Iwarasmo ti panagkitam iti aglawlawmo.	Nanggawad man met na altar a para Katawan .
GEN_014_0001	Uppat nga arini Amrafel nga ari ti Siniar, ni Arioc nga ari ti Elasar, ni Kedorlaomer nga ari ti Elam ken ni Tidal nga ari ti Goiim, ti napan nanggubat iti lima nga ari: Bera nga ari ti Sodoma, Birsa nga ari ti Gomorra, Sinab nga ari ti Adma, Semeber nga ari ti Zeboiim ken ti ari ti Bela wenno Soar.	Saray apatiran arari a di Amrafel na Babilonia, Arioc na Elasar, Kedorlaomer na Elam, tan Tidal na Goiim et akibakal irad limaran arari a di Bera na Sodoma, Birsa na Gomorra, Sinab na Adma, Semeber na Ziboiim, tan say ari na Bela o Zoar.
GEN_014_0002	Nagkaykaysa dagitoy lima nga ari ket pinagtitiponda dagiti buyotda iti Tanap ti Siddim nga isu ita ti Natay a Baybay.	Sarayan limaran ari nankakasakey ira tan impanoolup da ray sondalo ra ed Patar na Sidim ya Inatey a Dayat natan.
GEN_014_0003	Sangapulo ket dua a tawen nga inturayan ida ni Kedorlaomer ngem iti maika-13 a tawen, immalsada a maibusor kenkuana.	Labinduay taon la ran walad silong na pakaoley nen Kedorlaomer, balet diad kumalabintalon taon nilabanan da.
GEN_014_0004	Iti maika-14 a tawen, dimteng ni Kedorlaomer ken dagiti kakaduana agraman dagiti armadada ket pinarmekda dagiti Refaim idiay Asterot Karnaim, dagiti Zuzim idiay Ham, dagiti Emim idiay Tanap ti Kiriataim ken dagiti Horeo iti kabambantayan ti Edomsinunsonda ida agingga idiay Elparan iti pungto ti let-ang.	Diad kumalabinapat taon si Kedorlaomer, saray ararin kakaiba to, tan saray sondalo ra et linma ran linmaban ed saramay limara.
GEN_014_0005	Kalpasanna, nagsublida ket dimtengda idiay Kades maaw-awagan idi iti Enmispat.	Diad inyakar da tinalo da ray Refaita ed Astarot-Carnaim, saray Zuzita ed Ham, saray Emita ed Save-kiryataim.
GEN_014_0006	Sinakupda ti amin a daga dagiti Amalekita ket pinarmekda dagiti Amorreo nga agnanaed idiay Hazazon Tamar.	Tinalo da met iray Horeo diad kapalandeyan na Edom, tan inosilan da ra ya anggad Elparan, diad samput na kalawakan.
GEN_014_0007	Inummong dagiti ari ti Sodoma, Gomorra, Adma, Zeboiim ken Bela dagiti armadada iti Tanap ti Siddim tapno gubatenda dagiti ari ti Elam, Goiim, Siniar ken Elasar.	Insan ira amoliktar, pinmawil irad Cades Enmispat nen saman, sinakop da ray amin a dalin na saray Amalecita, tan tinalo da ray Amorreo a manaayam ed Hazazontamar.
GEN_014_0008	Lima nga ari kontra uppat nga ari.	Tinipon na saray ari na Sodoma, Gomorra, Adma, Zeboim, tan Bela ed patar na Sidim iray sondalo ra tan akilaban irad saray ari na Elam, Goiim, Babilonia, tan Elasar; limara laban ed apatira.
GEN_014_0009	Nasaknapan ti tanap kadagiti abut a naikkan iti alketran ket idi itarayan dagiti ari ti Sodoma ken Gomorra ti paggugubatan, natnagda kadagiti palab-og.	Dakel diman iray maawang a bobun na alkitran, et nen ibabatikan day bakal ira may ari na Sodoma tan Gomorra naplag irad saraman a bobun, balet akabatik ed kapalandeyan ira may taloran ari.
GEN_014_0010	Nakataray dagiti tallo nga ari ket nagkamangda kadagiti kabambantayan.	Inala na apatiran arari iray amin a walad Sodoma tan Gomorra, pati saray kakanen, insan la ra tinmaynan.
GEN_014_0011	Innala dagiti uppat nga ari ti amin nga adda idiay Sodoma ken Gomorra agraman dagiti taraon sada pimmanaw.	Manaayam diman si Lot a kaanakan nen Abram, kanyan inala ra met tan amin a kayaryan to.
GEN_014_0012	Innalada met ni Lot ken ti amin a sanikuana.	Balet walay toon akabatik tan imbaga to ra yan amin ed kinen Abram a Hebreo, a manaayam ed abay na saray masanton kiew nen Mamre ya Amorreo.
GEN_014_0013	Agnanaed idi ti kaanakan ni Abram idiay Sodoma.	Si Mamre tan di Escol tan Aner ya agagi to et kagampi ray Abram.
GEN_014_0014	Ngem adda lalaki a nakalibas ket impadamagna daytoy ken ni Abram a Hebreo nga agnanaed idi iti asideg dagiti lugo a kayo a kukua ni Mamre nga Amorreo.	Nen nadngelan nen Abram ya adakep si kaanakan to, tinawag ton amin iray totoo ton sarag day mibakal tan akatipon na talon lasus tan labinwalon lalaki.
GEN_014_0015	Kadua ni Abram ni Mamre agraman da Escol ken Aner a kakabsatna.	Inosilan to ya anggad Dan ira may apatiran arari.
GEN_014_0016	Apaman a naammoan ni Abram a natiliw ti kaanakanna, inummongna dagiti amin a mannakigubat iti kampona nga agdagup iti 318 ket sinunsonda dagiti uppat nga ari agingga idiay Dan.	Kasabi tod man, impankadwa to ray totoo to, dinogpaan dad labi iray kalaban da tan tinalo da ra.
GEN_014_0017	Sadiay, biningayna dagiti tattaona iti dua a bunggoy, dinarupda ti kabusor iti rabii ket pinarmekda ida.	Inosilan to ran anggad Hoba a walad baybay na Damasco, tan abawi to ray amin ya asamsam da.
GEN_014_0018	Kinamatkamatda ida agingga idiay Hobah iti amianan ti Damasco.	Abawi to met si Lot tan saray kayaryan to, pati saray bibii tan arum ni ran totoon adakep.
GEN_014_0019	Naalada amin a nasamsam.	Nen pinmawil si Abram, kayari ton tinalo si Kedorlaomer tan saramay arum ya arari, inabet na ari na Sodoma diad Patar na Save tatawagen met na Patar na Ari.
GEN_014_0020	Inyawidna met ni Lot a kaanakanna ken dagiti amin a sanikuana, agraman dagiti babbai ken dagiti dadduma a balud.	Inabet met nen Melkisedek ya ari na Salem tan pari na Sankatageyan a Dios.
GEN_014_0021	Idi agsubli ni Abram kalpasan ti panangparmekna ken ni Kedorlaomer ken dagiti dadduma nga ari, sinabat ti ari ti Sodoma idiay Tanap ti Save a maaw-awagan met iti Tanap ti Ari.	Inawitan toy Abram na tinapay tan alak, binindisionan to, tan inkuanto, Say Sankatageyan a Dios ya amalsay tawen tan dalin et bindisionan to komuy Abram.
GEN_014_0022	Nangyeg met ni Melkisedec nga ari ti Salem ken padi pay ti Kangatoan a Dios iti tinapay ken arak ken ni Abram.	Nagalang komun so Sankatageyan a Dios ya angiter ed sikay pananalod saray kalaban mo.
GEN_014_0023	Indawat ni Melkisedec a mabendisionan ni Abram ket kinunana, Sapay koma ta bendisionan ti Kangatoan a Dios ni Abram.	Inter nen Abram ed kinen Melkisedek so kakaplo na amin ya asamsam to.
GEN_014_0024	Madaydayaw koma ti Kangatoan a Dios a nangted iti panagballigim kadagiti kabusormo.	Inkuan na samay ari na Sodoma ed kinen Abram, Kayaryan mo la tay asamsam mo; ipawil mo labat ed siak iray amin a totook.
GEN_014_0025	Ket inted ni Abram kenkuana ti apagkapullo ti amin a sinamsamna.	Inmebat si Abram, Sambaan kod Katawan , say Sankatageyan a Dios a Manamalsay tawen tan dalin, ya ag kon balut mangala na antokaman a kayaryan mo, anggan tinebey o sakey a bariber na sandalya.
GEN_014_0026	Kinuna ti ari ti Sodoma ken Abram, Alaem dagiti sinamsammo ngem isublim dagiti amin a tattaok.	Ag mon balut nibagad satan, Siak so nampayaman ed Abram.
GEN_014_0027	Insungbat ni Abram, Isapatak iti Apo a Kangatoan a Dios, ti namarsua iti langit ken daga, nga awan ti alaek a kukuam, uray la koma sinulid wenno kordon ti sapatos tapno dimonto kuna a sika ti nangpabaknang kaniak.	Anggapoy alaen kon para siak.
GEN_014_0028	Awan ti alaek no di la dagiti inaramat dagiti tattao.	Say birbiren ko labat a nalak saray inaakan na totook.
GEN_014_0029	Ngem ipalubosmo koma nga alaen dagiti kakaduak, da Aner, Escol ken Mamre, ti bingayda.	Balet abuloyan yo ray kakaibak a di Aner, Escol, tan Mamre a mangalay betang da.
GEN_015_0001	Kalpasan daytoy, nagparmata ni Abram ket nangngegna ni Yahweh a makisasao kenkuana: Dika agbuteng, Abram.	Kasumpal to yan inkagawa, walay pasingayew ed kinen Abram tan arengel ton inkuan na Katawan ed sikato, Ag ka natatakot, Abram.
GEN_015_0002	Salaknibanka iti amin a peggad ket ikkanka iti naindaklan a gunggona.	Salimbengan ta kad kaatapan tan itdan ta kay baleg a tumang.
GEN_015_0003	Ngem kinuna ni Abram, O Apo Dios , ania ti serbi kaniak ti gunggona nga itedmo idinto ta awan anakko?	Balet inkuanen Abram, Katawan a DIOS , antoy kaabigan ya iter ed siak na tumang mo, anta anggapo met so anak ko.
GEN_015_0004	Ni laeng Eleazar a taga-Damasco ti agtawid kadagiti sanikuak.	Si Eliezer labat a taga Damasco so tumatawir ko.
GEN_015_0005	Dinak pinaraburan iti anak ket maysa kadagiti tagabuk ti agtawid iti sanikuak.	Ag mo ak initday anak, kanyan say sakey ed saray aripen ko so manawir ed saray kayaryan ko.
GEN_015_0006	Kalpasanna, nangngegna manen ni Yahweh a makisasao kenkuana, Saan a ni Eleazar a tagabu ti agtawid iti sanikuam no di ket ti bukodmo nga anak.	Arengel to lamet ya inkuan na Katawan , Ag tawiren nen Eliezer ya aripen mo iray kayaryan mo; say dilin anak mo so manawir.
GEN_015_0007	Inruar ni Yahweh ni Abram ket kinunana, Tumangadka ket padasem a bilangen dagiti bituen.	Say Katawan pinapaway to tan inkuanto, Nengneng moy tawen tan salim a bilangen iray bitewen; ontan naani so karakel na saray kabyangay boleg mo.
GEN_015_0008	Kastanto ti kaadu dagiti kaputotam.	Anisiay Abram ed Katawan , tan lapud sayan pananisia to say Katawan impasen ton matonung si Abram.
GEN_015_0009	Nagtalek ni Abram ken ni Yahweh ket gapu iti daytoy, naragsakan kenkuana ni Yahweh ket inawatna a kas nalinteg ni Abram.	Insan inkuan ed sikato na Katawan , Siak so Katawan ya amataynan ed sika manlapud Ur na Babilonia, pian niiter kod sika yan dalin.
GEN_015_0010	Kalpasanna, kinuna ni Yahweh kenkuana, Siak ni Yahweh a nangiruar kenka iti Ur idiay Caldea tapno ipatagikuak kenka daytoy a daga.	Balet tinepet nen Abram, Katawan a DIOS , panoy pakaamtak a nakayaryan ko yan dalin?
GEN_015_0011	Ngem kinuna ni Abram, O Apo Dios , kasano a maammoak a kukuak daytoy a daga?	Inmebat, Awit ka diay sakey a baka, sakey a kanding, tan sakey a karniro, a mantaon iran amin na talora.
GEN_015_0012	Insungbatna, Yegannak iti baka, kalding, kalakian a karnero nga agtawen iti tallo ti tunggal maysa, ken saggaysa a kalapati ken pagaw.	Awit ka dia met na sakey a sibong na malapati tan sakey a palekpek.
GEN_015_0013	Indatag ni Abram dagiti animal iti Dios.	Inawit nen Abram ira yan ayayep ed Dios, pinaldua to ra likud ed saramay manok, insan to ra impandarasig a nampepetekan so balang kapaldua.
GEN_015_0014	Pinatayna ida sana ginudua dagiti bangkay.	Dinapoan ira na saray buitri, balet inaabul ira nen Abram.
GEN_015_0015	Inintarna ida iti dua a linia nga agbinnatog dagiti agkapisi ngem dina ginudua ti kalapati ken ti pagaw.	Nen onseselek lay agew, akaogip na malmalet si Abram, tan balbaleg a takot so sinmabid sikato.
GEN_015_0016	Nagdisso dagiti buitre kadagiti bangkay dagiti animal ngem binugawna ida.	Inkuan na Katawan ed sikato, Magmaliw iran sangkaili ed sakey a bansa iray kabyangay boleg mo; aripenen da rad man tan pairapen da ran apat a lasus a taon.
GEN_015_0017	Idi lumnek ti init, immapay ken ni Abram ti nargaan a turog.	Balet dusaen koy bansan mangaripen ed sikara, tan dakel a kayamanan so awiten da no taynan da man a bansa.
GEN_015_0018	Nariknana ti panagbuteng ken panagamak gapu iti nakaro a kinasipnget.	Sika, andokey so bilay mo, mareen so ipatey mo, insan ka nipompon.
GEN_015_0019	Kinuna ni Yahweh, Ganggannaetto dagiti kaputotam iti sabali a daga.	Onlabas so apatiran kailalakan kasakbayan a makapawil ira diay kabyangay boleg mo.
GEN_015_0020	Agbalindanto a tagabu sadiay ket 400 a tawen a maparparigatdanto.	Pansiansiaen kon panayamen ira diay Amorreo ya anggad alablabas lay inkaoges da, insan ko ra dusaen tan pataynanen.
GEN_015_0021	Ngem dusaekto ti nasion a mangtagabu kadakuada ket inton pumanawda iti dayta a daga, adunto a kinabaknang ti alaenda.	Nen sinmelek lay agew tan ambilonget la, biglan walay banga a manasasewek tan kiew a mandarlang a dinmalan ed nanleetan na saramay pinalduan laman na ayayep.
GEN_015_0022	Atiddogto ti panagbiagmo, mataykanto a sitatalna ket maitanemkanto.	Diad saman ya agew, akisipanan so Dios ed kinen Abram.
GEN_015_0023	Mapalabasto ti uppat a kaputotan santo agsubli ditoy dagiti kaputotam agsipud ta sakonto la pagtalawen dagiti Amorreo inton nakaro ti kinadakesda ket masapul a madusada.	Inkuanto, Isipan kon iter ed saray kabyangay boleg mo yan dalin, manlapud ketegan na Egipto ya anggad Ilog na Eufrates, pati saray dalin da ray Cineo, Cinezeo, Cadmoneo, Heteo, Perezeo, Rafaita, Amorreo, Cananeo, Gergeseo, tan Jebuseo.
GEN_016_0001	Saan nga aganak ni Sarai nga asawa ni Abram.	Anggapoy anak nen Sarai ya asawa nen Abram.
GEN_016_0002	Ngem adda tagabuna a babai a taga-Egipto nga agnagan iti Agar.	Walay aripen ton bii ya Egipsia a manngaray Agar, kanyan inkuantod kinen Abram, Ag inyabuloy na Katawan a nawalaan ak na anak.
GEN_016_0003	Isu a kinunana ken ni Abram, Yantangay ta dinak pinaraburan ti Apo iti anak, apay a dimo kaiddaen ti tagabuk bareng no aganak iti agpaay kaniak?	Anta no akdulan mo may biin aripen ko?
GEN_016_0004	Immanamong ni Abram, ket naited ni Agar kenkuana a kas asawa nga agserbi kenkuana.	Nayarin makaanak na para siak.
GEN_016_0005	Sangapulo a tawen idin ni Abram iti daga ti Canaan.	Inmabuloy si Abram ed imbaga nen Sarai; kanyan inter nen Sarai ed sikato si Agar a piakdulan to.
GEN_016_0006	Kinaidda ni Abram ni Agar ket nagsikog.	Agawa ya nen samploy taon lan manaayam ed Canaan si Abram.
GEN_016_0007	Idi madlaw ni Agar a masikogen, timmangsit ket inumsina pay ni Sarai.	Inakdulan nen Abram si Agar, et nanlokun.
GEN_016_0008	Kinuna ni Sarai ken ni Abram, Sika ti nakaigapuan ti pananglais kaniak ni Agar.	Nen naamtaan nen Agar a malokun, nagmaliw a mapasirayew tan nilemlemew toy Sarai.
GEN_016_0009	Siak a mismo ti nangted kenka ngem um-umsiennakon manipud ammona a masikogen.	Inkuanen Sarai ed kinen Abram, Kasalanan mo so panlelemlemew nen Agar ed siak.
GEN_016_0010	Ikeddeng koma ti Apo no siasino kadata ti mapabasol.	Siak a dili so angiter ed sika na saman ya aripen ko, tan nanlapud naamtaan ton malokun la lelemlemewen to ak.
GEN_016_0011	Kinuna ni Abram, Tagabum daytoy a babai.	Say Katawan lay manintinsia no siopay nalilingod sikatan dua.
GEN_016_0012	Aramidem kenkuana ti aniaman a kayatmo.	Inmebat si Abram, Aripen mo tan walad silong na pakayarim; gawam ed sikatoy labay mo.
GEN_016_0013	Naranggas ni Sarai ken ni Agar agingga a nagtalaw ti tagabu.	Pinapairap nen Sarai si Agar, kanyan tinmaynan.
GEN_016_0014	Iti asideg ti maysa nga ubbog iti let-ang, iti dalan nga agturong idiay Sur, adda anghel ni Yahweh a nangsabat kenkuana.	Inabet na anghil na Katawan si Agar ed abay na sobul a walad kalawakan, diad dalan a mamaarap ed Sur, tan inkuanto, Agar ya aripen nen Sarai, nanlapwan mo tan iner so laen mo?
GEN_016_0015	Kinunana, Agar, tagabu ni Sarai, sadino ti naggapuam ken sadino ti papanam?	Inmebat, Ibabatikan koy amok a bii a si Sarai.
GEN_016_0016	Tinalawak ti apok, insungbat ni Agar.	Inkuanto may anghil sa Katawan , Pawil ka, tan paaripen kad sikato.
GEN_016_0017	Kinuna ti anghel ni Yahweh, Agsublika ket agserbika kenkuana.	Insan inyarum ton inkuan, Itdan ta ka na saray kabyangay boleg mo a diad karakel da et anggapoy makabilang.
GEN_016_0018	Ket innayonna, Ikkankanto iti adu nga annak ken appoko ket dinto mabilang ti kaaduda.	Mananak kay sakey a laki, tan ingaran mo na Ismael, ta nadngel na Katawan so tagleey mo.
GEN_016_0019	Aganakkanto iti lalaki ket panaganamto iti Ismael agsipud ta impangag ti Apo ti asugmo.	Balet mambilay a singa atap ya asno so anak mo; magmaliw a kalaban toy amin a too tan labanan dan amin.
GEN_016_0020	Ngem agbiagto ti anakmo a kas atap nga asno.	Siyanan to ray amin a kakanayon to, ta kabosul to ra.
GEN_016_0021	Kabusornanto ti tunggal maysa ket agbalinto met a kabusor ti amin.	Tinepet nen Agar ed sikaton dili, Anengneng ko tan talaga so Dios, et mabilay ak ni?
GEN_016_0022	Saanto nga agnaed iti sidong dagiti kabagianna.	Inngaran to sirin so Katawan ya akisalitad sikato na, Dios a Mannenengneng.
GEN_016_0023	Kinuna ni Agar iti bagina, Pudno kadi a nakitak ti Dios ket sibibiagak pay laeng kalpasan ti pannakakitak kenkuana?	Kanyan tatawagen na saray totoo imay bobun a walad nanleetay Cades tan Bered na Say Bobun na Mabilay a Nanenengneng to Ak.
GEN_016_0024	Ngarud, pinanagananna ni Yahweh a nakisarita kenkuana iti Ti Dios a Makakita.	Nananak si Agar na sakey a laki, tan inngaran to na Ismael.
GEN_016_0025	Daytoy ti gapuna a maaw-awagan ti bubon nga adda iti nagbaetan ti Kades ken Bered iti Beer-lahai-roi.	Wa lomplo tan anem lay taon nen Abram nen naanakan to si Agar.
GEN_017_0001	Idi agtawen ni Abram iti 99, nagparang ni Yahweh kenkuana.	Nen mantaoy siamaplo tan siam si Abram, pinmanengneng ed sikato so Katawan tan inkuanto, Siak so Dios a Makapanyarin-amin.
GEN_017_0002	Kinunana, Siak ti Dios a Mannakabalin-amin.	Toluk kad siak tan gawam lawas so kamaungan.
GEN_017_0003	Agtulnogka kaniak ket aramidem a kanayon ti naimbag.	Misipanan ak ed sika tan itdan ta kay amayamay a kabyangay boleg mo.
GEN_017_0004	Makitulagak kenka ket ikkankanto iti adu a kaputotam.	Dinmakmomoy Abram ya anggad dalin so lupa to, insan inkuan na Dios.
GEN_017_0005	Idi nangngegna daytoy, nagpakleb ni Abram iti daga.	Misipanan ak ed sika; pagmaliwen ta kan ama na amayamay a bansa.
GEN_017_0006	Kinuna ti Dios, Daytoy ti katulagak: Ikarik nga agbalinkanto a kapuonan ti adu a nasion.	Aliwa lan Abram so ngaran mo, no ag ta Abraham la, ta gawaen ta kan ama na amayamay a bansa.
GEN_017_0007	Saanen nga Abram ti naganmo no di ket Abraham agsipud ta pagbalinenka a kapuonan ti adu a nasion.	Amayamay so iter kod sikan kabyangay boleg mo, magmaliw iran amayamay a bansa, tan pigarad sikaray magmaliw ya arari.
GEN_017_0008	Ikkankanto iti adu a kaputotan.	Tooren koy impisipanan kod sika tan saray kabyangay boleg mo diad arapen iran panaon, tan ipasen kon sakey ya andi-anggaan a sipanan.
GEN_017_0009	Agbalinto nga ari ti sumagmamano kadakuada.	Siak so Dios mo tan siak so Dios na saray kabyangay boleg mo.
GEN_017_0010	Adunto unay ti kaputotam.	Sangkaili kayo natan ed sayan dalin a panaayaman yo; iter ko yan dalin ed sika tan saray kabyangay boleg mo.
GEN_017_0011	Ket agbalindanto nga adu a nasion.	Say intiron dalin na Canaan kayaryanen ya anggad angga na saray kabyangay boleg mo, tan siak so Dios da.
GEN_017_0012	Agnanayon daytoy a tulag ket tungpalekto ti karik kenka ken kadagiti sumarsaruno a kaputotam.	Inkuan ni na Dios ed kinen Abraham, Nakaukolan a tooren yo met so impisipanan kod sikayo, sika tan saray kabyangay boleg mo diad arapen a panaon.
GEN_017_0013	Siakto ti Diosmo ken ti Dios dagiti kaputotam.	Nakaukolan a sika tan saray kabyangay boleg mo et pasegat yo so balang sakey a laki ed sikayo.
GEN_017_0014	Itedkonto kenka ken kadagiti kaputotam daytoy a daga a pagnanaedam ita a kas ganggannaet.	Manlapud natan nakaukolan a pasegat yoy ogaw a laki no waloy agew to; pasegat yo met iray aripen a nianak ed abung yo tan saray aripen a sinaliw yod arum a bansa.
GEN_017_0015	Kukuanto dagiti kaputotam iti agnanayon ti entero a daga ti Canaan, ket siakto ti Diosda.	Sikato yay tanda na sipanan tayo.
GEN_017_0016	Kinuna ti Dios ken ni Abraham, Masapul a tungpalem met ti nagtulaganta, sika ken dagiti sumarsaruno a kaputotam.	Nakaukolan a mampasegat so balang sakey a laki ed sikayo, tan sikato yay tanda ed laman yo a pakanengnengan ya andi-anggaan so impisipanan kod sikayo.
GEN_017_0017	Masapul nga umanamongkayo, sika ken dagiti kaputotam, a makugit ti amin a lalaki kadakayo.	Siopamay lakin ag asegat et ag la nibilang a kabyangan na saray totook, ta ag to tinoor so impisipanan ko.
GEN_017_0018	Manipud ita, masapul a kugitem ti ubing a lalaki nga adda walo nga aldawnan, agraman dagiti tagabu a nayanak iti balaymo ken dagiti ginatangmo kadagiti ganggannaet.	Intuloy ni na Dios ya inkuan ed kinen Abraham, Ag mo la tatawagen na Sarai so asawam; manlapu lad natan Sara so ngaran to.
GEN_017_0019	Daytoy ti pakakitaan nga adda nagtulaganta.	Bindisionan ko tan makaanak kad sikato na sakey a laki.
GEN_017_0020	Masapul a makugit ti tunggal maysa ket daytoy a marka ti bagi ti mangipakita nga agnanayon ti nagtulaganta.	Bindisionan ko, et magmaliw ya ina na saray bansa, tan wala ray magmaliw ya arari ed saray kabyangay boleg to.
GEN_017_0021	Saanto a maibilang a taok ti siasinoman a lalaki a saan a nakugit agsipud ta dina tinungpal ti nagtulaganta.	Dinmakmomo si Abraham ya anggad dalin so lupa to, balet akalek nen ninunot tod sikaton dili, Makaanak ni kasiy sakey a lakin mantaon lay sanlasus?
GEN_017_0022	Kinuna ti Dios, Saanen a Sarai ti pangawagmo iti asawam.	Mananak ni kasiy Sara, anta siamaplo lay taon to?
GEN_017_0023	Manipud ita, Sara ti nagannan.	Inkuantod Dios, Abuloyan mo lay Ismael a sikato lay mananawir ko!
GEN_017_0024	Bendisionakto ket paraburankanto iti anak a lalaki nga ipasngayna.	Balet inkuan na Dios, Andi.
GEN_017_0025	Bendisionakto ket agbalinto nga ina dagiti nasion.	Mananak na sakey a laki si Sara ya asawam tan ingaran mo na Isaac.
GEN_017_0026	Agbalinto nga ari ti sumagmamano kadagiti kaputotanna.	Tooren ko so impisipanan kod sikato tan saray kabyangay boleg to.
GEN_017_0027	Nagpakleb ni Abraham iti daga ngem nagkatawa idi malagipna ti kinalakayna.	Anggad-angga yan sipanan.
GEN_017_0028	Kinunana iti bagina, Makaputot pay ngata ti lalaki a 100 ti tawenna?	Dinengel koy kerew mo nipaakar ed kinen Ismael, kanyan bindisionan ko tan itdan koy amayamay ya anak tan amayamay a kabyangay boleg.
GEN_017_0029	Aganak pay ngata ni Sara idinto a 90 ti tawennan?	Magmaliw ya ama na labinduan prinsipi, tan pagmaliwen kon sakey a bansa iray kabyangay boleg to.
GEN_017_0030	Kinunana iti Dios, Apay a dimo ipalubos a ni laengen Ismael ti agtawid kadagiti sanikuak?	Balet tooren koy impisipanan kod anak mon Isaac ya iyanak nen Sara diad singa onyan panaon, no ontombuk a taon.
GEN_017_0031	Ngem kinuna ti Dios, Saan.	Tinmaynan lay Dios nen asumpal ya akisalita ed kinen Abraham.
GEN_017_0032	Aganakto ni Sara iti lalaki ket panaganamto iti Isaac.	Diad saman lamlamang ya agew, inonur nen Abraham so imbagay Dios, ta sinegat toy anak ton Ismael tan amin da ray lalakid abung to, pati saray aripen a nianak ed abung to tan saray aripen a sinaliw to.
GEN_017_0033	Tungpalekto ti pagtulaganmi ken ni Isaac ken kadagiti kaputotanna.	Siamaplo tan siam lay taon nen Abraham nen asegat, tan labintaloy taon la nen Ismael.
GEN_017_0034	Agnanayon daytoy a tulag.	Asegat iran dua ed saksakey ya agew, pati saray amin ya aripen nen Abraham.
GEN_018_0001	Nagparang ni Yahweh ken ni Abraham idiay Mamre, iti ayan dagiti lugo a kayo.	Pinmanengneng so Katawan ed kinen Abraham diad saray masanton kiew nen Mamre.
GEN_018_0002	Agtugtugaw idi ni Abraham iti ruangan ti toldana iti kapudot ti aldaw ket idi tumangad, nakitana ti tallo a lallaki a nakatakder.	Manyodyorung si Abraham ed puirtay tulda to nen kapetapetangay agew; tinmangwa, et anengneng toy taloran totoo a manalalagey irad ag arawin pasen.
GEN_018_0003	Timmaray a nangsabat kadakuada apaman a nakitana ida.	Binatik to ran tampol ya inabet, insan dinmakmomo ya anggad dalin so lupa to.
GEN_018_0004	Nagpakleb iti daga sana kinuna, Appo, madadaanak nga agserbi kadakayo.	Inkuanto, Wadya ak a magter a manlingkur ed sikayo.
GEN_018_0005	Pangngaasiyo ta dumagaskayo iti taengko.	Ag yo komun lalabasay abung ko; tonda ki nin magano.
GEN_018_0006	Yalaankayo iti danum a pangbuggoyo kadagiti sakayo.	Abuloyan yo ak a mangalay danum a panoras yoy sali yo; nayarian yoy mampainawad silong to yan kiew.
GEN_018_0007	Mabalinyo ti aginana ditoy sirok dagiti kayo.	Mangala ak met na kanen yo, pian naitdan kayoy biskeg a mangituloy na panaakar yo.
GEN_018_0008	Yalaankayo met iti taraon tapno adda pamigsayo a mangituloy iti panagbiaheyo.	Pinagalangan yo ak ed inyakar yo dia, kanyan abuloyan yo ak a manlingkur ed sikayo.
GEN_018_0009	Mapadayawanak iti yaayyo iti taengko ket palubosandak kadi a mangsangaili kadakayo.	Inmebat ira, Salamat; sigi sirin.
GEN_018_0010	Agyamankami, insungbatda.	Linmoob a tampol si Abraham ed tulda tan inkuantod Sara, Ganatan mo, mangala kay sankaabigan ya arina, tan manggawa kay tinapay.
GEN_018_0011	Padayawanmi ti awismo.	Insan batik ed poluk na baka, tan angalay sakey a mataban kilaw, insan inter tod sakey ya aripen a nangganat ya angiparaan.
GEN_018_0012	Dinagdagus ni Abraham ti simrek iti toldana ket kinunana iti asawana, Sara, mangalaka iti sangasupot iti kasayaatan nga arina ket manglutoka iti tinapay.	Angalay kiso, gatas, tan samay niluton karniy kilaw, insan to ra imparongo ed saramay taloran totoo.
GEN_018_0013	Darasem!	Sikaton diliy nansirbid sikara legan dan angan diad silong na kiew.
GEN_018_0014	Kalpasanna, nagtaray a napan iti ayan dagiti arban ket nangpili iti nalukmeg nga urbon ti baka.	Tinepet dad sikato, Kawalaan nen asawam a Sara?
GEN_018_0015	Intedna iti maysa kadagiti adipenna a nagdardaras a napan nangisagana.	Wadyad dalem na tulda, ebat to.
GEN_018_0016	Nangala ni Abraham iti keso, gatas, ken ti karne a pinalutona ket impasangona kadagiti lallaki.	Inkuan na sakey ed sikara, Siam bulan a manlapud natan, ompawil ak dia, et wala lad satan so lakin anak nen Sara.
GEN_018_0017	Iti sirok ti kayo ti nangserbianna kadakuada.	Wadmay Sara ya onderengel ed biek na puirta a nibeneg nen Abraham.
GEN_018_0018	Bayat ti pannanganda, sinaludsodda, Yan ni Sara nga asawam?	Mataktakken la ra di Abraham tan Sara, tan ag la naliliberay Sara.
GEN_018_0019	Adda iti uneg ti tolda, insungbat ni Abraham.	Kanyan inmelek a bukor si Sara tan inkuantod sikaton dili, Natan ta akolaw ak la, manliket ak ni kasin miakdul?
GEN_018_0020	Kinuna ti maysa kadakuada, Siam a bulan manipud ita, agsubliakto ket addanton anak ni Sara nga asawam.	Insan sakey ni, matakken met lay masiken ko.
GEN_018_0021	Adda ni Sara iti ruangan ti tolda, iti likudan ti agsasao ket dumdumngeg iti saritaan.	Tinepet na Katawan ed kinen Abraham, Akin et inmelek si Sara tan inkuanto, Makapananak ak ni kasi, anta akolaw ak la?
