id	book	chapter	sentence_no	source_text	target_text
EXO_001_1	EXO	001	1	Immad-adu ken bimmilbileg dagiti Israelita.	Dahil ang mga hilot ay natakot sa Diyos, kanyang binigyan sila ng mga sambahayan.
EXO_001_1	EXO	001	1	Naglabas ti tiempo. Nagturay idiay Egipto ti baro nga ari nga awan ti ammona maipapan ken ni Jose.	At may bumangong isang bagong hari sa Ehipto na hindi kilala si Jose.
EXO_001_1	EXO	001	1	Imbilin ti ari ti Egipto kadagiti amin nga iturayanna nga ibellengda iti karayan Nile ti amin a kaippasngay a lallaki a Hebreo, ngem palubosanda nga agbiag dagiti babbai.	Pagkatapos, iniutos ni Faraon sa kanyang buong bayan, Itatapon ninyo sa ilog ang bawat lalaking ipanganak ngunit bawat babae ay hayaan ninyong mabuhay.
EXO_001_1	EXO	001	1	Sabali ngamin dagiti babbai a Hebreo, apo, insungbatda. Saanda a kas kadagiti babbai nga Egipcio.	Sinabi ng mga hilot sa Faraon, Sapagkat ang mga babaing Hebrea ay hindi gaya ng mga babaing Ehipcia.
EXO_001_1	EXO	001	1	Dan, Neftali, Gad ken Aser.	Dan, Neftali, Gad, at Aser.
EXO_001_1	EXO	001	1	Pinaayaban ngarud ti ari dagiti partera. Sinaludsodna, Apay a kasta ti ar-aramidenyo? Apay a palpalubosanyo nga agbiag dagiti lallaki a maladaga?	Ipinatawag ng hari ng Ehipto ang mga hilot at sinabi sa kanila, Bakit ninyo ginawa ang bagay na ito at hinayaan ninyong mabuhay ang mga batang lalaki?
EXO_001_1	EXO	001	1	Gapu ta managbuteng dagiti partera iti Dios, binendisionanna dagitoy, ket naikkanda iti bukodda a familia.	Kaya't ang Diyos ay naging mabuti sa mga hilot; at ang taong-bayan ay dumami at naging napakalakas.
EXO_001_1	EXO	001	1	Ngem managbuteng dagiti partera iti Dios ket saanda a tinungpal ti bilin ti ari. Binay-anda nga agbiag dagiti maladaga a lallaki.	Subalit ang mga hilot ay natakot sa Diyos at hindi nila ginawa ang gaya nang iniutos sa kanila ng hari ng Ehipto, kundi hinayaan nilang mabuhay ang mga batang lalaki.
EXO_001_1	EXO	001	1	Maysa kadagitoy a partera ti agnagan iti Zifra ket Pua ti nagan met ti sabali.	Kanyang sinabi, Paghilot ninyo sa mga babaing Hebrea at pagtingin ninyo sa kanila sa upuang panganganakan, kung lalaki ay papatayin ninyo; ngunit kung babae ay mabubuhay ito.
EXO_001_1	EXO	001	1	Kinasao ti ari ti Egipto dagiti partera a Hebreo ket imbilinna kadakuada, No paanakenyo dagiti Hebreo, patayenyo ti maladaga no lalaki. Ngem no babai, bay-anyo nga agbiag.	Ang hari ng Ehipto ay nagsalita sa mga hilot na mga Hebrea, na ang pangalan ng isa ay Sifra, at ang pangalan ng ikalawa ay Pua.
EXO_001_1	EXO	001	1	Issacar, Zabulon, Benjamin,	Isacar, Zebulon, Benjamin,
EXO_001_1	EXO	001	1	Rimmigat ti biagda. Pinilitda ida nga agtrabaho kadagiti talonda ken agipasdek kadagiti patakderda.	at kanilang pinapait ang kanilang buhay sa pamamagitan ng mahirap na paglilingkod, sa luwad at sa tisa, at sa lahat ng uri ng gawain sa bukid;
EXO_001_1	EXO	001	1	Naranggas ti panangtagabuda kadagiti Israelita.	Malupit na pinapaglingkod ng mga Ehipcio ang mga anak ni Israel;
EXO_001_1	EXO	001	1	Ruben, Simeon, Levi, Juda,	sina Ruben, Simeon, Levi, Juda,
EXO_001_1	EXO	001	1	Ngem no kasano ti panangparparigat dagiti Egipcio kadakuada, immad-aduda ketdi ket nagwarasda.	Subalit habang kanilang pinahihirapan sila, lalo silang dumarami at lalong lumalaganap.
EXO_001_1	EXO	001	1	Dagitoy ti nagan dagiti annak ni Jacob a kimmuyog kenkuana a napan idiay Egipto agraman dagiti familiada	Ito ang mga pangalan ng mga anak ni Israel na dumating sa Ehipto kasama si Jacob; bawat isa ay kasama ang kanya-kanyang sambahayan
EXO_001_1	EXO	001	1	Iti kasta, nangdutokda kadagiti narungsot a kapatas a mangparigat kadagiti Israelita nga agtrabaho iti nadagdagsen pay ngem iti sigud nga ar-aramidenda.	Kaya't naglagay sila ng mga tagapangasiwa upang pahirapan sila sa kanilang mga sapilitang paggawa.
EXO_001_1	EXO	001	1	Masapul nga agaramidtayo iti pamuspusan tapno malapdan ti panagaduda. Ta no adda gubat, amangan no kumapponda kadagiti kabusor a manggubat kadatayo, ket aglibasda a pumanaw iti dagatayo.	Halikayo, pakitunguhan natin sila nang may katusuhan, baka sila'y dumami at mangyari na kapag nagkaroon ng digmaan ay umanib sila sa ating mga kaaway, lumaban sa atin, at umalis sa lupain.
EXO_001_1	EXO	001	1	Kitaenyo, kinuna ti ari kadagiti iturayanna. Agpeggadtayo ta nakaad-adu ken nabileg unayen dagiti Israelita.	Sinabi niya sa kanyang bayan, Tingnan ninyo, ang sambayanan ng mga anak ni Israel ay mas marami at higit na malakas kaysa atin.
EXO_001_1	EXO	001	1	Pitopulo ti dagup dagiti annak a nagtaud ken ni Jacob. Adda idin ni Jose nga anakna idiay Egipto.	Lahat ng taong nagmula sa balakang ni Jacob ay pitumpung katao, at si Jose ay nasa Ehipto na.
EXO_001_1	EXO	001	1	Nupay kasta, napardas ti panagadu dagiti Israelita, isu a pimmigsada ket nagwaras dagiti kaputotanda iti entero nga Egipto.	Ang mga anak ni Israel ay lumago at nadagdagang mabuti; sila'y dumami at naging napakalakas kaya't ang lupain ay napuno nila.
EXO_001_1	EXO	001	1	Natay sadiay ni Jose, kasta met amin a kakabsatna ken amin daydi a kaputotan.	Namatay si Jose at ang lahat ng kanyang mga kapatid at ang buong salinlahing iyon.
EXO_001_2	EXO	001	2	Binangon dagiti Israelita ti Pitom ken Rameses, dua a siudad a pagidulinan iti makan.	Kanilang ipinagtayo si Faraon ng mga lunsod imbakan, ang Pitom at Rameses.
EXO_001_2	EXO	001	2	Isut' gapuna a kinabuteng ida dagiti Egipcio.	At kinasuklaman nila ang mga anak ni Israel.
EXO_001_2	EXO	001	2	Dida naasian kadakuada.	at sa lahat ng kanilang gawain ay malupit silang pinapaglingkod.
EXO_001_2	EXO	001	2	Nalakada nga aganak. Sakbay nga adda sumangpet a partera, naipasngayen ti ubing.	Sila'y malalakas at nakapanganak na bago dumating ang hilot sa kanila.
EXO_002_1	EXO	002	1	Nagdanag ni Moises ket kinunana iti nakemna, Naammoanda gayamen ti inaramidko.	Subalit si Moises ay tumakas mula kay Faraon at nanirahan sa lupain ng Midian. Siya'y umupo sa tabi ng isang balon.
EXO_002_1	EXO	002	1	Limmabas ti adu a tawen. Natay ti ari ti Egipto, ngem nagtuloy latta ti pannakaparigat dagiti Israelita gapu iti pannakatagabuda. Immasugda a patulongan iti Dios	At tiningnan ng Diyos ang mga anak ni Israel at nalaman ng Diyos ang kanilang kalagayan.
EXO_002_1	EXO	002	1	Iti sumuno nga aldaw, nagsubli ni Moises ket nakitana ti dua a Hebreo nga aggubgubal.	Sinabi niya, Sinong naglagay sa iyo bilang pinuno at hukom sa amin?
EXO_002_1	EXO	002	1	Kinuna ti anak ti ari iti ina, Alaem daytoy nga ubing.	Sinabi ng anak ng Faraon sa kanya, Dalhin mo ang batang ito at alagaan mo para sa akin at uupahan kita.
EXO_002_1	EXO	002	1	Sige, isapulannak, insungbatna.	Sinabi sa kanya ng anak ng Faraon, Umalis ka.
EXO_002_1	EXO	002	1	Apay? Siasino kadi ti nangisaad kenka a mangituray ken mangukom kadakami? insungbatna. Patayennak met kadi a kas iti panangpataymo iti Egipcio?	Nang mabalitaan ng Faraon ang bagay na ito, ninais niyang patayin si Moises.
EXO_002_1	EXO	002	1	Innala ti ina ti maladaga ket tinagibina.	Ang bata ay lumaki at kanyang dinala ito sa anak ng Faraon, at ito'y naging kanyang anak. Kanyang pinangalanan siyang Moises, dahil sinabi niya, Sapagkat aking iniahon siya sa tubig.
EXO_002_1	EXO	002	1	Idi madamag daytoy ti ari, kayatna a patayen ni Moises, ngem nakalibas ni Moises ket napan nagnaed idiay Midian.	Ang pari noon sa Midian ay may pitong anak na babae. Sila'y dumating at umigib ng tubig at kanilang pinuno ang mga inuman upang painumin ang kawan ng kanilang ama.
EXO_002_1	EXO	002	1	Iti maysa nga aldaw, idi agtugtugaw ni Moises iti asideg ti maysa a bubon,	Ang mga pastol ay dumating at sila'y ipinagtabuyan; ngunit si Moises ay tumindig at sila'y ipinagtanggol, at pinainom ang kanilang kawan.
EXO_002_1	EXO	002	1	dimteng ti pito a babbai tapno sumakdoda. Annak ida ni Jetro a padi ti Midian. Pinunnoda dagiti pagkargaan ti danum tapno painumenda dagiti karnero ken kalding ni amada.	Nang sila'y dumating kay Reuel na kanilang ama ay sinabi nito, Bakit napakadali ninyong dumating ngayon?
EXO_002_1	EXO	002	1	Ngem adda dagiti agpaspastor a dimteng ket pinapanawda dagiti babbai. Inarayat ida ni Moises sana pinainum dagiti animalda.	Kanilang sinabi, Iniligtas kami ng isang Ehipcio mula sa kamay ng mga pastol at saka iniigib pa niya kami ng tubig at pinainom ang kawan.
EXO_002_1	EXO	002	1	Idi nagawidda, sinaludsod ni amada, Apay a nasapakayo a simmangpet?	Sinabi niya sa kanyang mga anak, Saan siya naroon? Bakit ninyo iniwan ang lalaking iyon? Tawagin ninyo siya upang makakain ng tinapay.
EXO_002_1	EXO	002	1	Kinunada, Adda dagiti agpaspastor a nangpapanaw kadakami iti pagpainuman. Ngem tinulongannakami ti maysa nga Egipcio. Insakduannakami ken pinainumna pay dagiti animal.	Si Moises ay nasiyahang makitira sa lalaking iyon at kanyang ibinigay kay Moises si Zifora na kanyang anak na babae.
EXO_002_1	EXO	002	1	Sadino ti ayanna? sinaludsodna. Apay a pinanawanyo? Inkay ayaban ta makipangan kadatayo.	Nanganak siya ng isang lalaki at kanyang pinangalanang Gershom sapagkat sinabi ni Moises, Ako'y manlalakbay sa ibang lupain.
EXO_002_1	EXO	002	1	Inkeddeng ni Moises ti agnaed sadiay.	Pagkaraan ng maraming araw, ang hari ng Ehipto ay namatay. Ang bayang Israel ay dumaing dahil sa pagkaalipin at sila'y humingi ng tulong.
EXO_002_1	EXO	002	1	Immasideg ti manang ti ubing ket kinunana, Apo, kayatmo kadi nga isapulanka iti Hebreo a mangtagibi iti dayta nga ubing?	Nang magkagayo'y sinabi ng kanyang kapatid na babae sa anak ng Faraon, Aalis ba ako upang itawag kita ng isang tagapag-alaga mula sa mga babaing Hebrea na mag-aalaga ng bata para sa iyo?
EXO_002_1	EXO	002	1	Nangipasngay ni Sefora iti maysa a lalaki. Gapu ta ganggannaet ni Moises iti sabali a daga, pinanagananna iti Gersom ti anakna.	Narinig ng Diyos ang kanilang daing at naalala ng Diyos ang kanyang tipan kina Abraham, Isaac, at Jacob.
EXO_002_1	EXO	002	1	Inwaras ni Moises ti panagkitana ket idi awan makitana a sabali a tao, pinatayna ti Egipcio sana inkali ti bangkay iti kadaratan.	Nang siya'y lumabas nang sumunod na araw, may dalawang lalaking Hebreo na naglalaban; at kanyang sinabi sa gumawa ng masama, Bakit mo sinasaktan ang iyong kasama?
EXO_002_1	EXO	002	1	Iti maysa nga aldaw, idi maysan nga agtutubo ni Moises, sinarungkaranna dagiti kadaraanna a Hebreo. Naimatanganna ti pannakaparparigatda. Nadagsen ti trabahoda. Nakitana ti maysa nga Egipcio a mangkabkabil iti maysa a Hebreo.	Siya'y tumingin sa magkabi-kabilang dako at nang siya'y walang makitang tao, kanyang pinatay ang Ehipcio at kanyang itinago sa buhanginan.
EXO_002_1	EXO	002	1	Idi luktan ti prinsesa ti basket, nakitana ti maysa nga ubing nga agsangsangit ket naasian.	Nang kanyang buksan ito, nakita niya ang bata; at narito, ang sanggol ay umiyak.
EXO_002_1	EXO	002	1	Iti daydi a panawen, adda lalaki a nagtaud iti kaputotan ni Levi a nangasawa iti katribuanna.	May isang lalaki sa lipi ni Levi na humayo at nag-asawa ng isang anak na babae ni Levi.
EXO_002_1	EXO	002	1	Nagsikog ti babai ket nangipasngay iti lalaki.	Ang babae ay naglihi at nanganak ng isang lalaki.
EXO_002_1	EXO	002	1	Iti saan a mabayag, simmalog ti babai nga anak ti ari ti Egipto tapno agdigos iti karayan.	Noon, ang anak na babae ni Faraon ay lumusong upang maligo sa ilog, at naglakad ang kanyang mga alalay na babae sa tabi ng ilog.
EXO_002_1	EXO	002	1	Ngem idi dinan mailemmeng, nangala iti basket a naaramid iti runo ket pinastaanna iti alketran tapno saan a makastrek ti danum.	Nang hindi na niya ito maitago pa, ikinuha niya ito ng isang basket na yari sa papiro, at pinahiran niya ng betun at alkitran.
EXO_002_1	EXO	002	1	Iti saan unay nga adayo, nagtakder ti manang ti ubing tapno makitana ti mapasamak iti adingna.	Tumayo sa malayo ang kanyang kapatid na babae upang malaman ang mangyayari sa bata.
EXO_002_1	EXO	002	1	Idi makadakkel bassit ti ubing, impanna iti prinsesa a nangibilang iti ubing a kas anakna.	Nang mga araw na iyon, nang malaki na si Moises, nagtungo siya sa kanyang mga kapatid, at nakita ang kanilang sapilitang paggawa.
EXO_002_2	EXO	002	2	Inkargana ti ubing iti uneg ti basket sana inkabil iti karunoan iti igid ti karayan.	Kanyang isinilid ang bata roon at inilagay sa talahiban sa tabi ng ilog.
EXO_002_2	EXO	002	2	Idi makitana a nalungpo ti ubing, inlemmengna iti las-ud ti tallo a bulan.	Nang kanyang makita na ito ay maganda, kanyang itinago ito ng tatlong buwan.
EXO_002_2	EXO	002	2	Nakitana ti basket iti karunoan ket pinaalana iti maysa kadagiti babbai nga agserserbi kenkuana nga agpagnapagna iti igid ti karayan.	Kanyang nakita ang basket sa talahiban at ipinakuha sa kanyang alalay.
EXO_002_2	EXO	002	2	Gapu ta inaonko iti danum daytoy nga ubing, panaganak iti Moises, kinuna ti prinsesa.	Kanyang nakita ang isang Ehipcio na binubugbog ang isang Hebreo na isa sa kanyang mga kapatid.
EXO_002_2	EXO	002	2	Anak ti Hebreo daytoy! kinunana.	At kanyang kinaawaan siya at sinabi, Ito'y isa sa mga anak ng mga Hebreo.
EXO_002_2	EXO	002	2	Impaasawa ni Jetro kenkuana ni Sefora nga anakna.	Ang kanilang daing dahil sa pagkaalipin ay nakarating sa Diyos.
EXO_002_2	EXO	002	2	Napan ngarud ti balasitang ket inayabanna ti ina ti maladaga.	Ang batang babae ay umalis at tinawag ang ina ng bata.
EXO_002_2	EXO	002	2	Apay a kabkabilem ti padam a Hebreo?	Iniisip mo bang patayin ako, gaya nang pagpatay mo sa Ehipcio?
EXO_002_2	EXO	002	2	Tagibiem a kas anakko ket tangdanankanto.	Kaya't kinuha ng babae ang bata at inalagaan ito.
EXO_002_3	EXO	002	3	kinunana iti nakabasol.	Natakot si Moises at kanyang inisip, Tiyak na ang bagay na ito ay alam na.
EXO_003_1	EXO	003	1	Ngem usarekto ti pannakabalinko ket dusaekto ti Egipto; nakabutbutengto dagiti aramidek sadiay. Kalpasan dayta, palubosannakayton.	Pagkakalooban ko ang bayang ito ng biyaya sa paningin ng mga Ehipcio at sa pag-alis ninyo ay hindi kayo aalis na walang dala.
EXO_003_1	EXO	003	1	Ita, ibaonka iti ari tapno iruarmo dagiti tattaok nga Israelita manipud Egipto.	Sinabi ni Moises sa Diyos, Sino ako upang pumaroon kay Faraon at upang ilabas sa Ehipto ang mga anak ni Israel?
EXO_003_1	EXO	003	1	Ay-aywanan idi ni Moises dagiti karnero ken kalding ni Jetro a katuganganna a padi ti Midian.	Noon ay inaalagaan ni Moises ang kawan ni Jetro na kanyang biyenan na pari sa Midian;
EXO_003_1	EXO	003	1	Sadiay, nagparang kenkuana ti anghel ni Yahweh a kas gumilgil-ayab nga apuy nga aggapu iti tengnga ti bassit a kayo.	Ang anghel ng Panginoon ay nagpakita sa kanya sa isang ningas ng apoy na mula sa gitna ng isang mababang punungkahoy.
EXO_003_1	EXO	003	1	Itan-okkonto dagiti tattaok tapno raemen ida dagiti Egipcio ket inton pumanawda, saandanto nga ima-ima.	Bawat babae ay hihingi sa kanyang kapwa at ang dayuhan sa kanyang bahay ng mga hiyas na pilak, mga hiyas na ginto at mga damit, at inyong ipapasuot sa inyong mga anak na lalaki at babae. Sa ganito ay inyong sasamsaman ang mga Ehipcio.
EXO_003_1	EXO	003	1	Ammok a dinakayto palubosan ti ari malaksid no mapilit.	Kaya't aking iuunat ang aking kamay at sasaktan ko ang Ehipto sa pamamagitan ng lahat kong kababalaghan na aking gagawin sa gitna niyon at pagkatapos, papahintulutan niya kayong umalis.
EXO_003_1	EXO	003	1	Kinunana iti nakemna, Nakaskasdaaw daytoy. Apay ngata a saan a mauram ti kayo? Umasidegak man ta kitaek.	Sinabi ni Moises, Ako'y pupunta sa kabila at titingnan ko itong dakilang panooring ito, kung bakit ang punungkahoy ay hindi nasusunog.
EXO_003_1	EXO	003	1	Ipangagto dagiti tattaok ti saom. Kalpasanna, kakuyogmonto dagiti pangulo ti Israel a mapan iti ari ti Egipto ket kunayonto kenkuana, Nakisao kadakami ni Yahweh a Dios dagiti Hebreo. Palubosannakami koma a mapan idiay let-ang iti tallo nga aldaw tapno agidatagkami iti daton ken ni Yahweh a Diosmi.	Alam ko na hindi kayo papahintulutan ng hari ng Ehipto na umalis maliban sa pamamagitan ng isang makapangyarihang kamay.
EXO_003_1	EXO	003	1	Idi makita ni Yahweh nga umas-asideg ni Moises, inawaganna manipud iti tengnga ti kayo.	Nang makita ng Panginoon na siya'y pumunta sa kabila upang tumingin ay tinawag siya ng Diyos mula sa gitna ng mababang punungkahoy, Moises, Moises.
EXO_003_1	EXO	003	1	Adtoyak, insungbat ni Moises.	Kanyang sinabi, Huwag kang lumapit dito. Hubarin mo ang sandalyas sa iyong mga paa sapagkat ang dakong iyong kinatatayuan ay banal na lupa.
EXO_003_1	EXO	003	1	Dika umas-asideg, kinuna ti Dios.	Sinabi pa niya, Ako ang Diyos ng iyong ama, ang Diyos ni Abraham, ang Diyos ni Isaac, at ang Diyos ni Jacob.
EXO_003_1	EXO	003	1	Siak ti Dios ti amamda Abraham, Isaac ken Jacob.	Sinabi ng Panginoon , Aking nakita ang paghihirap ng aking bayan na nasa Ehipto at aking narinig ang kanilang daing dahil sa mga umaapi sa kanila.
EXO_003_1	EXO	003	1	Kinuna ni Yahweh, Nakitak ti nakakaasi a kasasaad dagiti tattaok idiay Egipto. Nangngegko ti panagdawatda iti tulong gapu iti pannakaparparigatda. Wen, ammok dagiti sagsagabaenda.	Ako'y bumaba upang iligtas sila mula sa kamay ng mga Ehipcio at upang sila'y dalhin sa isang mabuting lupain at malawak, mula sa lupaing iyon, sa isang lupaing dinadaluyan ng gatas at pulot, sa lugar ng mga Cananeo, Heteo, Amoreo, Perezeo, Heveo at Jebuseo.
EXO_003_1	EXO	003	1	Inkeddengko nga iruarko ida idiay Egipto ket ipanko ida iti daga dagiti Cananeo, Heteo, Amorreo, Perezeo, Heveo ken Jebuseo.	Kanilang papakinggan ang iyong tinig. Ikaw at ang matatanda sa Israel ay pupunta sa hari ng Ehipto, at inyong sasabihin sa kanya, Ang Panginoon , ang Diyos ng mga Hebreo ay nakipagtagpo sa amin at ngayo'y pahintulutan mo kami na maglakbay ng tatlong araw sa ilang.
EXO_003_1	EXO	003	1	Inka ummongen dagiti pangulo ti Israel ket ibagam kadakuada a nagparang kenka ni Yahweh a Dios dagiti kapuonanyo, ti Dios da Abraham, Isaac ken Jacob. Ibagam a naimatanganna ti kasasaadyo ken ti ar-aramiden dagiti Egipcio kadakayo.	At aking sinabi, aking aalisin kayo sa kapighatian sa Ehipto at dadalhin ko kayo sa lupain ng Cananeo, Heteo, Amoreo, Perezeo, Heveo, at ng Jebuseo, sa isang lupaing dinadaluyan ng gatas at pulot.
EXO_003_1	EXO	003	1	Ibagamto kadagiti Israelita, a siak ni Yahweh a Dios dagiti kapuonanyo, ti Dios da Abraham, Isaac ken Jacob, imbaonka kadakuada. Daytoy ti naganko iti agnanayon. Isunto ti pangawag kaniak dagiti amin a kaputotan.	Humayo ka at tipunin mo ang matatanda sa Israel at sabihin mo sa kanila, Ang Panginoon , ang Diyos ng inyong mga ninuno, ang Diyos nina Abraham, Isaac, at Jacob ay nagpakita sa akin, na nagsasabi, Tunay na kayo'y aking dinalaw at aking nakita ang ginagawa sa inyo sa Ehipto.
EXO_003_1	EXO	003	1	Bimmabaak tapno ispalek ida kadagiti Egipcio. Iruarko ida iti dayta a daga ket ipanko ida iti daga a nadam-eg ken nalawa. Nabaknang ken nabunga daytoy a daga a pagnanaedan ita dagiti Cananeo, Heteo, Amorreo, Perezeo, Heveo ken Jebuseo.	At ngayon, ang daing ng mga anak ni Israel ay nakarating sa akin, at nakita ko rin ang pang-aapi na ginawa sa kanila ng mga Ehipcio.
EXO_003_1	EXO	003	1	Kinuna ti Dios, Siak ti siak.	Sinabi pa ng Diyos kay Moises, Ganito ang sasabihin mo sa mga anak ni Israel, Sinugo ako sa inyo ng Panginoon , ang Diyos ng inyong mga ninuno, ang Diyos ni Abraham, ang Diyos ni Isaac, at ang Diyos ni Jacob.
EXO_003_1	EXO	003	1	Kinuna ni Moises, Inton innak kadagiti Israelita ket ibagak kadakuada nga imbaonnak ti Dios dagiti kapuonanda, ket saludsodenda ti naganmo, ania ti ibagak?	Sinabi ng Diyos kay Moises, AKO AY ANG AKO NGA. At kanyang sinabi, Ganito ang sasabihin mo sa mga anak ni Israel, Sinugo ako sa inyo ni AKO NGA.
EXO_003_1	EXO	003	1	Addaakto kenka, insungbat ti Dios, ket daytoyto ti pagilasinan a siak ti nangibaon kenka: Inton mairuarmo dagiti tattaok iti Egipto, agdaydayawkayto kaniak ditoy a bantay.	Ngunit sinabi ni Moises sa Diyos, Pagdating ko sa mga anak ni Israel at sasabihin ko sa kanila, Sinugo ako sa inyo ng Diyos ng inyong mga ninuno, at sasabihin nila sa akin, Ano ang kanyang pangalan? Anong sasabihin ko sa kanila?
EXO_003_1	EXO	003	1	Wen, nangngegko ti asug dagiti tattaok ket makitak ti panangparparigat dagiti Egipcio kadakuada.	Halika, ikaw ay aking susuguin kay Faraon upang iyong ilabas sa Ehipto ang aking bayan, ang mga anak ni Israel.
EXO_003_1	EXO	003	1	Kinuna ni Moises iti Dios, Nanumoak laeng a tao.	Kanyang sinabi, Ako'y makakasama mo;
EXO_003_2	EXO	003	2	Nakita ni Moises a sumsumged ti kayo ngem saan a marunot.	Siya'y nagmasid at ang punungkahoy ay nagliliyab ngunit ito'y hindi nasusunog.
EXO_003_2	EXO	003	2	Moises, Moises! kinunana.	Sumagot siya, Narito ako.
EXO_003_2	EXO	003	2	Daytoy ti ibagamto kadagiti Israelita, Imbaonnak ti mangawag iti bagina iti SIAK.	Ito ang aking pangalan magpakailanman at ito ang itatawag sa akin ng lahat ng mga lahi.
EXO_003_2	EXO	003	2	Nadam-eg ken nabunga dayta a daga.	Nais naming makapaghandog sa Panginoon naming Diyos.
EXO_003_2	EXO	003	2	Liningdan ni Moises ti rupana ta mabuteng a kumita iti Dios.	Talagang nalalaman ko ang kanilang pagdurusa.
EXO_003_2	EXO	003	2	Kasano a mapanak iti ari tapno iruarko dagiti Israelita iti Egipto?	at ito'y magiging tanda sa iyo na ikaw ay aking sinugo: kapag iyong nailabas na sa Ehipto ang bayan, sasambahin ninyo ang Diyos sa bundok na ito.
EXO_003_2	EXO	003	2	Ikkatem ta pallokam ta nasantoan ti daga a pagtaktakderam.	Si Moises ay nagtakip ng kanyang mukha sapagkat siya'y natakot na tumingin sa Diyos.
EXO_003_2	EXO	003	2	Impanna ti arban iti labes ti let-ang ket dimteng idiay Horeb a bantay ti Dios.	kanyang pinatnubayan ang kawan sa kabila ng ilang at nakarating sa bundok ng Diyos, sa Horeb.
EXO_004_1	EXO	004	1	Kinuna ni Moises ken ni Yahweh, Saan, apo, saannak nga ibaon. Ni kaanoman saanak a nalaing nga agsao, ket diak met nagbalin a bumibitla manipud pay itay rugiam ti makisao kaniak. Nabannayat ket natabbed toy dilak.	Kaya ngayon ay humayo ka, ako'y sasaiyong bibig at ituturo ko sa iyo kung ano ang iyong sasabihin.
EXO_004_1	EXO	004	1	Ngem kinuna ni Moises, Saan, apo.	Ikaw ay magsasalita sa kanya at iyong ilalagay sa kanyang bibig ang mga salita; at ako'y sasaiyong bibig at sasakanyang bibig.
EXO_004_1	EXO	004	1	Dios ti kumuyog kenka, kinuna ni Jetro idi agrubbuat ni Moises.	Sinabi ng Panginoon kay Moises, Pagkabalik mo sa Ehipto, iyong gawin sa harap ng Faraon ang lahat ng kababalaghan na aking ipinagkatiwala sa iyong kamay. Ngunit aking papatigasin ang kanyang puso at hindi niya papayagang umalis ang bayan.
EXO_004_1	EXO	004	1	Idi adda pay laeng ni Moises idiay Midian, kinuna ni Yahweh kenkuana, Agsublika idiay Egipto. Natay aminen a nagpanggep a mangpatay kenka.	Iyong sasabihin sa Faraon, Ganito ang sabi ng Panginoon , ang Israel ang aking panganay na anak,
EXO_004_1	EXO	004	1	Sarukod, apo, insungbat ni Moises.	Kanyang sinabi, Ihagis mo sa lupa. Kanyang inihagis ito sa lupa at ito'y naging isang ahas. Si Moises ay lumayo sa ahas.
EXO_004_1	EXO	004	1	Ania ta ig-iggamam?	Sinabi naman sa kanya ng Panginoon , Ano iyang nasa iyong kamay?
EXO_004_1	EXO	004	1	Impasakay ngarud ni Moises ti asawana ken dagiti annakna iti asno tapno mapanda idiay Egipto.	at aking sinasabi sa iyo, Pahintulutan mong umalis ang aking anak upang siya'y makasamba sa akin.
EXO_004_1	EXO	004	1	Simmungbat ni Moises ken ni Yahweh, No ibagak kadakuada a nagparangkayo kaniak ket didanto mamati, anianto ti aramidek?	Si Moises ay sumagot at nagsabi, Ngunit hindi nila ako papaniwalaan o papakinggan man sapagkat kanilang sasabihin, Ang Panginoon ay hindi nagpakita sa iyo.
EXO_004_1	EXO	004	1	Aramidem daytoy, kinuna ni Yahweh, tapno mamatida a nagparang kenka ni Yahweh a Dios dagiti kapuonanda, ti Dios da Abraham, Isaac ken Jacob.	Sinabi pa sa kanya ng Panginoon , Ipasok mo ang iyong kamay sa iyong dibdib. Kanyang ipinasok ang kamay niya sa kanyang dibdib at nang kanyang ilabas, ang kanyang kamay ay ketongin, maputing parang niyebe.
EXO_004_1	EXO	004	1	Kinuna manen ni Yahweh ken ni Moises, Yunegmo ta imam iti badom.	Sinabi ng Diyos, Ipasok mo uli ang iyong kamay sa iyong dibdib.
EXO_004_1	EXO	004	1	Kinuna manen ni Yahweh ken ni Moises, Ita ta agsublikan idiay Egipto, aramidem dagiti amin a milagro iti sangoanan ti ari. Intedko kenka ti pannakabalin a mangaramid kadagitoy. Ngem patangkenekto ti pusona tapno dina ipalubos a pumanaw dagiti tattao.	Sa daan, sa isang lugar na pinagpalipasan nila ng gabi, sinalubong siya ng Panginoon at tinangka siyang patayin.
EXO_004_1	EXO	004	1	Kinuna ni Yahweh, Isuksokmo manen ta imam iti badom.	Kung sila'y hindi maniwala sa iyo, ni makinig sa unang tanda, kanilang paniniwalaan ang huling tanda.
EXO_004_1	EXO	004	1	Kasta ti inaramid ni Moises.	Kung sila'y hindi maniwala sa dalawang tandang ito, ni hindi makinig sa iyo, kukuha ka ng tubig mula sa Nilo at iyong ibubuhos sa tuyong lupa.
EXO_004_1	EXO	004	1	Kunamto kenkuana a kastoy ti sao ni Yahweh: Ni Israel ti inauna nga anakko a lalaki.	Ngunit kumuha si Zifora ng isang batong matalim, pinutol ang balat sa ari ng kanyang anak na lalaki at ipinahid sa mga paa ni Moises. Kanyang sinabi, Tunay na ikaw ay isang asawa sa dugo sa akin.
EXO_004_1	EXO	004	1	Kinuna ni Yahweh, No didakanto patien wenno dida maguyugoy a mamati iti umuna a milagro, mamatidanto iti daytoy maikadua.	Ngunit sinabi ni Moises sa Panginoon , O Panginoon, ako'y hindi mahusay magsalita, mula pa noon o kahit na mula nang magsalita ka sa iyong lingkod; sapagkat ako'y makupad sa pananalita at umid ang dila.
EXO_004_1	EXO	004	1	Ket no didakanto pay la patien uray no imparangmo dagitoy dua a milagro, mangalakanto iti danum iti Karayan Nile samo ibuyat iti namaga a daga.	Sinabi sa kanya ng Panginoon , Sino bang gumawa ng bibig ng tao? O sinong gumagawa ng pipi, o bingi, o may paningin, o bulag sa tao?
EXO_004_1	EXO	004	1	Ibagak kenka a palubosam a pumanaw tapno agdaydayaw kaniak ngem dimo pinalubosan. Ita, patayek ti inauna nga anakmo a lalaki.	Sa gayo'y kanyang binitiwan siya. Nang magkagayo'y kanyang sinabi, Ikaw ay isang asawa sa dugo sa akin, sa pamamagitan ng pagtutuli.
EXO_004_1	EXO	004	1	Kinuna ni Yahweh, Ipusem a piduten. Tiniliw ni Moises ti uleg babaen iti ipusna ket nagbalin manen a sarukod.	Nangyari ito upang sila'y maniwala na ang Panginoon , ang Diyos ng kanilang mga ninuno, ang Diyos ni Abraham, ang Diyos ni Isaac, at ang Diyos ni Jacob ay nagpakita sa iyo.
