id	book	chapter	sentence_no	source_text	target_text
GEN_031_1	GEN	031	1	Duapulo a tawen a nagkadkaduata. Pulos nga awan naalisan iti arbanmo ket immadu dagiti karnero ken kaldingmo.	Kahit hinalughog mo ang lahat ng aking kasangkapan, anong natagpuan mong kasangkapan ng iyong bahay?
GEN_031_1	GEN	031	1	Insungbat ni Jacob, Nagbutengak ta impagarupko a no maammoam a pumanawak, dimo ipalubos nga alaek dagiti annakmo.	Kahit kailangan mong umalis sapagkat nasasabik ka na sa bahay ng iyong ama, bakit mo ninakaw ang aking mga diyos?
GEN_031_1	GEN	031	1	Ammok a nagtalawka ta aggagarka unayen nga agawid.	Nasa aking kapangyarihan ang gawan kayo ng masama.
GEN_031_1	GEN	031	1	Kabaelanka a dangran ngem idi rabii, binallaagannak ti Dios ni amam a dika an-anoen.	Hindi mo man lamang ipinahintulot sa akin na mahalikan ang aking mga anak na lalaki at babae? Ang ginawa mo'y isang kahangalan.
GEN_031_1	GEN	031	1	Pinanaganan ni Laban daytoy iti Jegar-Sahaduta. Galed met ti impanagan ni Jacob.	At sinabi ni Jacob sa kanyang mga kamag-anak, Magtipon kayo ng mga bato, at kumuha sila ng mga bato at kanilang ginawang isang bunton at sila'y nagkainan doon sa malapit sa bunton.
GEN_031_1	GEN	031	1	Dinak pay inikkan iti gundaway a mangagek kadagiti appokok ken kadagiti annakko sakbay a pimmanawda.	Bakit ka lihim na tumakas at dinaya mo ako at hindi ka nagsabi sa akin?
GEN_031_1	GEN	031	1	Apay a naglibaska?	Sinabi ni Laban kay Jacob, Anong ginawa mo?
GEN_031_1	GEN	031	1	Ita ta nalpasen ti panangbukitkitmo iti amin nga alikamenko, adda kadi nasarakam a kukuam?	At si Jacob ay nagalit at nakipagtalo kay Laban.
GEN_031_1	GEN	031	1	Nakamakam ni Laban ni Jacob. Nagkampo ni Jacob iti maysa a bantay. Nagkampo met ni Laban ken dagiti kaduana iti katurturodan ti Galaad.	Subalit dumating ang Diyos kay Laban na Arameo sa panaginip sa gabi, at sinabi sa kanya, Ingatan mong huwag kang magsalita kay Jacob ng mabuti o masama man.
GEN_031_1	GEN	031	1	Iti dayta a rabii, natagtagainep ni Laban a nagparang ti Dios kenkuana ket kinunana, Kitaem ta dimo dangran ni Jacob.	Kaya't ipinagsama niya ang kanyang mga kamag-anak, at hinabol siya sa loob ng pitong araw hanggang sa kanyang inabutan siya sa bundok ng Gilead.
GEN_031_1	GEN	031	1	Innalana dagiti tattaona ket pito nga aldaw a sinursurotda ni Jacob agingga a nakamakamda iti katurturodan ti Galaad.	Nang ikatlong araw ay nabalitaan ni Laban na tumakas na si Jacob.
GEN_031_1	GEN	031	1	Tallo nga aldaw kalpasanna, naipadamag ken ni Laban a naglibas ni Jacob.	Kaya't tumakas siya dala ang lahat niyang ari-arian. Siya ay tumawid sa Ilog Eufrates, at pumunta sa maburol na lupain ng Gilead.
GEN_031_1	GEN	031	1	Innalana ti amin a sanikuana sa nagdardaras a pimmanaw. Binallasiwna ti Karayan Eufrates ket nagturong iti katurturodan ti Galaad.	At dinaya ni Jacob si Laban na Arameo, sapagkat hindi sinabi sa kanya na siya'y tatakas.
GEN_031_1	GEN	031	1	Kasta la a kasta iti unos ti duapulo a tawen a kaaddak kenka.	Naging ganoon ako;
GEN_031_1	GEN	031	1	Awan idi ni Laban ta pukpukisanna dagiti karnero. Bayat ti kaawanna, napan ni Raquel iti tolda ti amana ket tinakawna dagiti didiosen a kukua ni tatangna.	At kanyang dinala ang lahat niyang mga hayop, at ang lahat na pag-aari na kanyang natipon, ang hayop na kanyang natipon sa Padan-aram, upang pumunta sa lupain ng Canaan, kay Isaac na kanyang ama.
GEN_031_1	GEN	031	1	Nagrubbuat ngarud ni Jacob tapno agsubli iti Canaan, iti daga ti amana. Pinagsakayna dagiti annakna ken dagiti assawana kadagiti kamelio. Intugotna dagiti arbanna ken ti amin a sanikuana a naurnongna idiay Padan-aram.	Nang magkagayo'y tumayo si Jacob, at pinasakay sa mga kamelyo ang kanyang mga anak at asawa.
GEN_031_1	GEN	031	1	Kukuami kadagiti annakmi amin dagitoy a kinabaknang nga innala ti Dios ken ni tatangmi.	Lahat ng kayamanang inalis ng Diyos sa aming ama ay para sa amin at para sa aming mga anak.
GEN_031_1	GEN	031	1	Ibilangnakamin a kas ganggannaet.	Hindi ba niya kami itinuring na mga taga-ibang bayan?
GEN_031_1	GEN	031	1	Intuloy ni Jacob, Idi tiempo ti panagmaya dagiti arban, nagtagtagainepak. Nakitak kampay idi a pasig a garitan, labang, ken turikturikan dagiti kalakian a kalding a tumaktakba.	Sa panahong ang kawan ay nagtatalik, ako ay nanaginip at nakita ko na ang mga kambing na lalaki na nakipagtalik sa kawan ay may mga guhit, may batik at may dungis.
GEN_031_1	GEN	031	1	Nadamag ni Jacob nga ibagbaga dagiti kayongna nga innalana amin a sanikua ni Laban.	Narinig ni Jacob ang mga salita ng mga anak ni Laban, na nagsasabi, Kinuha ni Jacob ang lahat ng sa ating ama.
GEN_031_1	GEN	031	1	Nadlawna met a saanen a kas idi a naasideg ni Laban kenkuana.	Nakita ni Jacob na ang pagturing sa kanya ni Laban ay hindi na kagaya nang dati.
GEN_031_1	GEN	031	1	Kinuna ni Yahweh ken ni Jacob, Agsublika iti daga dagiti kapuonam ken kadagiti kakabagiam. Addaakto kenka.	Kaya't sinabi ng Panginoon kay Jacob, Bumalik ka sa lupain ng iyong mga ninuno at sa iyong kamag-anak, at ako'y kasama mo.
GEN_031_1	GEN	031	1	Nangibaon ngarud ni Jacob iti mapan mangibaga kada Raquel ken Lea nga agsasarakda iti taltalon a yan dagiti arbanna.	Kaya't si Jacob ay nagsugo at tinawag sina Raquel at Lea sa bukid na kinaroroonan ng kanyang kawan,
GEN_031_1	GEN	031	1	Kinunana kadakuada, Nadlawko a nagbaliwen ni tatangyo; saanen a kas idi a naasideg kaniak.	at sinabi sa kanila, Nakikita ko na ang pagturing sa akin ng inyong ama ay hindi na gaya nang dati;
GEN_031_1	GEN	031	1	Ammoyo nga inkabilko ti amin a kabaelak a nagserbi ken ni tatangyo.	Nalalaman ninyo na ang aking buong lakas ay ipinaglingkod ko sa inyong ama.
GEN_031_1	GEN	031	1	Kaskasdi a sinaurnak ket naminsangapulo a binaliwanna ti tulagan iti panangtangdanna kaniak. Ngem saan nga impalubos ti Dios a dangrannak.	Subalit dinaya ako ng inyong ama at binago ang aking sahod ng sampung ulit subalit hindi siya pinahintulutan ng Diyos na gawan ako ng masama.
GEN_031_1	GEN	031	1	No kuna ni Laban, Dagiti turikturikan a kalding ti tangdanmo, aganak amin nga arban kadagiti turikturikan nga urbon.	Kapag sinabi niya ang ganito, Ang mga may batik ang magiging sahod mo; kung magkagayo'y nanganganak ang lahat ng kawan ng mga may batik.
GEN_031_1	GEN	031	1	Innala ti Dios ti arban ni tatangyo sana inted kaniak.	Sa gayon inalis ng Diyos ang mga hayop ng inyong ama, at ibinigay sa akin.
GEN_031_1	GEN	031	1	Simmungbat da Raquel ken Lea: Awanen ti matawidmi ken ni tatangmi.	Nagsisagot sina Raquel at Lea, at sinabi sa kanya, Mayroon pa bang natitirang bahagi at mana para sa amin sa bahay ng aming ama?
GEN_031_1	GEN	031	1	Siak ti Dios a nagparang kenka idi idiay Betel. Malagipmo daydiay a lugar? Sadiay ti nagsapataam kaniak ken nangikonsagraram iti maysa a bato a pakalaglagipan babaen iti panangbuyatmo iti lana ti olibo.	Ako ang Diyos ng Bethel na doon mo pinahiran ng langis ang haligi at doon ka gumawa ng panata sa akin.
GEN_031_1	GEN	031	1	Kitaem, intuloyna, pasig a garitan, labang ken turikturikan dagiti kalakian a kalding a tumaktakba.	At kanyang sinabi, Tingnan mo at iyong makikita na ang lahat ng kambing na nakikipagtalik sa kawan ay may guhit, may batik at may dungis;
GEN_031_1	GEN	031	1	Iti tagtagainepko, nagsao kaniak ti anghel ti Apo . Jacob, kinunana. Ania, Apo? insungbatko.	Ang anghel ng Diyos ay nagsalita sa akin sa panaginip, Jacob, at sinabi ko, Narito ako.
GEN_031_1	GEN	031	1	Nangpatay iti animal sana indaton iti bantay ket inawisna dagiti tattaona iti pannangan.	At naghandog si Jacob ng handog sa bundok, at tinawag ang kanyang mga kamag-anak upang kumain ng tinapay;
GEN_031_1	GEN	031	1	Iti nagan ti Dios a nagdaydayawan ni Isaac nga amana, insapata ni Jacob a tungpalenna ti katulagan.	Nawa'y ang Diyos ni Abraham at ang Diyos ni Nahor, ang Diyos ng kanilang ama ang humatol sa atin. At si Jacob ay sumumpa ng ayon sa Kinatatakutan ng kanyang amang si Isaac.
GEN_031_1	GEN	031	1	Ti Dios ni Abraham, ti Dios ni Nahor, ti Dios ti amada ti mangukom kadata.	Ang buntong ito ay isang saksi, at ang haligi ay isang saksi na hindi ako lalampas sa buntong patungo sa inyo, at hindi ka lalampas sa buntong ito at sa haligi patungo sa akin upang saktan ako.
GEN_031_1	GEN	031	1	Agserbinto dagitoy a palagip kadata. Dagitoyto met ti agbalin a beddeng ket awanto kadata ti mabalin a bumallasiw tapno maliklikan ti panagrinnautta.	At sinabi ni Laban kay Jacob, Tingnan mo ang buntong ito at ang haligi na aking inilagay sa gitna natin.
GEN_031_1	GEN	031	1	Adda iti nagbaetanta ti bunton ti bato nga impasdekko ken ti inkabilmo a baton-lagip.	Kapag pinahirapan mo ang aking mga anak, o kung mag-asawa ka sa iba bukod sa aking mga anak, kahit wala tayong kasama, alalahanin mo, ang Diyos ay saksi sa akin at sa iyo.
GEN_031_1	GEN	031	1	Intuloy ni Laban, No saan a nasayaat ti panangtratarmo kadagiti annakko wenno mangasawaka iti sabali, uray no diak maammoan, laglagipem a sipsiputannata ti Dios.	at ang bantayog ay Mizpa sapagkat sinabi niya, Bantayan ng Panginoon ako at ikaw, kapag tayo'y hindi magkasama sa isa't isa.
GEN_031_1	GEN	031	1	Binilinna dagiti tattaona nga agalada iti batbato sada buntonen. Kalpasanna, nagpapanganda iti abay ti bunton dagiti batbato.	Kaya't kumuha si Jacob ng isang bato, at iyon ay itinayo bilang isang bantayog.
GEN_031_1	GEN	031	1	Kinuna pay ni Laban, Sapay koma ta sipsiputannata ti Apo bayat ti panaginnadayota.	Sinabi ni Laban, Ang buntong ito ay saksi sa akin at sa iyo ngayon.
GEN_031_1	GEN	031	1	Kinuna ni Laban ken ni Jacob, Agpaayto a baton-lagip kadata daytoy a bunton. Isu a napanaganan dayta a lugar iti Galed.	Tinawag ito ni Laban na Jegarsahadutha, subalit tinawag ito ni Jacob na Gilead.
GEN_031_2	GEN	031	2	Minamaag ti kasta nga inaramidmo!	Naihatid sana kita na may pagsasaya at awitan, may tambol at may alpa.
GEN_031_2	GEN	031	2	Saankon nga ipakita kenka tapno agpaay a pammaneknek a saan a siak ti nagliway iti ipapatayna. Ket sinapulmo kaniak ti sukat ti animal a matakaw iti aldaw wenno iti rabii.	ang iyong mga babaing tupa at ang iyong mga babaing kambing ay hindi nakunan, at hindi ako kumain ng mga tupang lalaki ng iyong kawan.
GEN_031_2	GEN	031	2	Kalpasan ti pannanganda, immianda iti bantay.	at sila'y kumain ng tinapay, at nanatili sa bundok.
GEN_031_2	GEN	031	2	Mangbuntonta iti batbato ket aramidenta a baton-lagip iti tulaganta.	Subalit anong magagawa ko ngayon sa mga anak kong babae, o sa kanilang mga anak na ipinanganak nila?
GEN_031_2	GEN	031	2	Nagtaud kano iti daytoy ti amin a kinabaknangna.	Mula sa ating ama ay tinamo niya ang lahat ng kanyang kayamanan.
GEN_031_2	GEN	031	2	Ngem ania pay ti maaramidko tapno agtalinaed kaniak dagiti annakko ken dagiti appokok?	Nakita ng Diyos ang aking kapighatian, ang aking pagpapagod, at sinaway ka niya kagabi.
GEN_031_2	GEN	031	2	No ibagana, Dagiti garitan a kalding ti tangdanmo, aganak amin nga arban kadagiti garitan nga urbon.	At kapag sinabi niya ang ganito, Ang mga may guhit ang magiging sahod mo; kung magkagayon, ang lahat ng kawan ay nanganganak ng mga may guhit.
GEN_031_2	GEN	031	2	Ngem nakita ti Dios ti panagsagabak ken dagiti panagbambannogko ket idi rabii, impaulogna ti pangngeddengna kenka.	Pinaglingkuran kita ng labing-apat na taon dahil sa iyong dalawang anak, at anim na taon dahil sa iyong kawan, at sampung ulit na binago mo ang aking sahod.
GEN_031_2	GEN	031	2	Siak ti akin-aramid iti daytoy ta nakitak ti amin nga ar-aramiden kenka ni Laban.	sapagkat nakita ko ang lahat na ginagawa sa iyo ni Laban.
GEN_031_2	GEN	031	2	Intuloy ni Laban ti nagbirok ngem dina nasarakan dagiti didiosenna.	Hinalughog ni Laban ang buong palibot ng tolda, ngunit hindi niya natagpuan.
GEN_031_2	GEN	031	2	Sangapulo ket uppat a tawen a nagpatagabuak kenka tapno maasawak dagiti dua nga annakmo.	sa araw ay pinahihirapan ako ng init, at sa gabi ay ng lamig;
GEN_031_2	GEN	031	2	Ita, agrubbuatka. Panawamon daytoy a daga ket agsublika iti daga a nakayanakam.	Tumayo ka ngayon, lumabas ka sa lupaing ito, at bumalik ka sa lupain na iyong sinilangan.
GEN_031_2	GEN	031	2	Nagsukisok ni Laban iti tolda ngem awan ti nasarakanna.	Lumabas siya sa tolda ni Lea at pumasok sa tolda ni Raquel.
GEN_031_2	GEN	031	2	Kakaasiak a malamlammiisan iti rabii.	ako mismo ang nagpasan ng pagkawala.
GEN_031_2	GEN	031	2	Inlakonakami ket nabusbosnan ti amin a kuarta a nakailakoanmi.	Sapagkat ipinagbili niya kami at inubos na rin niya ang aming salapi.
GEN_031_2	GEN	031	2	Iti kasta, napanaganan dayta a lugar iti Mizpa.	Kaya't tinawag niya ito sa pangalang Gilead;
GEN_031_2	GEN	031	2	Aramidem ti aniaman nga imbaga kenka ti Dios.	Ngayon nga, gawin mo ang lahat ng sinabi sa iyo ng Diyos.
GEN_031_2	GEN	031	2	Saanko a naitured ti nagparti iti uray maysa la koma a karnerom.	Ilagay mo rito sa harapan ng aking mga kamag-anak at ng iyong mga kamag-anak at hayaan mong magpasiya sila sa ating dalawa.
GEN_031_2	GEN	031	2	Ngem kanayon nga adda kaniak ti Dios ni tatangko.	subalit ang Diyos ng aking ama ay kasama ko.
GEN_031_2	GEN	031	2	No adda, iruarmo ditoy tapno makita dagiti tattaota ket ikeddengda no siasino kadata ti nalinteg.	Sinabi ni Jacob kay Laban, Ano ang aking paglabag at ang aking kasalanan, at habulin mo ako na may pag-iinit?
GEN_031_2	GEN	031	2	Apay nga impanawmo dagiti annakko a kasda la babbai a natiliw iti gubat?	at si Laban pati ng kanyang mga kamag-anak ay nagtirik din sa bundok ng Gilead.
GEN_031_2	GEN	031	2	Kasta met ti inaramidna iti tolda ni Lea ken iti tolda dagiti dua a babbai a tagabu ngem dina nasarakan dagiti didiosen.	Sa harapan ng ating mga kamag-anak, ituro mo kung anong iyo na nasa akin, at kunin mo iyon.
GEN_031_2	GEN	031	2	sinaludsodna.	sapagkat dinatnan ako ngayon.
GEN_031_2	GEN	031	2	No imbagam ti ipapanawmo, pinarubbuatanka koma nga adda ragragsak ken kankanta, iti baet ti musika ti pandereta ken arpa.	Dinaya mo ako at dinala ang aking mga anak na babae na parang mga bihag ng tabak?
GEN_031_2	GEN	031	2	Ngem apay a tinakawmo dagiti didiosek?	Ngunit ang Diyos ng inyong ama ay nagsalita sa akin kagabi, na sinasabi, Ingatan mong huwag kang magsalita kay Jacob ng mabuti o masama man.
GEN_031_2	GEN	031	2	Saan nga ammo ni Jacob a tinakaw ni Raquel dagiti didiosen.	iniisip ko na baka kunin mo nang sapilitan sa akin ang iyong mga anak.
GEN_031_3	GEN	031	3	Adda aya sinalungasingko a linteg ta kaskayo la aso a mangkamkamat kaniak?	Kaya't kanyang hinanap, ngunit hindi natagpuan ang mga diyos ng sambahayan.
GEN_031_3	GEN	031	3	Kalpasanna, simrek iti tolda ni Raquel.	Hindi nalalaman ni Jacob na si Raquel ang nagnakaw noon.
GEN_031_3	GEN	031	3	Mapuypuyatanak.	Sa aking kamay mo hiningi iyon, maging ninakaw sa araw o sa gabi.
GEN_031_3	GEN	031	3	Innem met a tawen nga inaywanak dagiti arbanmo, ket naminsangapulo a binaliwam ti rumbeng a tangdanko.	at ako ay nalipasan na ng antok.
GEN_032_1	GEN	032	1	Nagbuteng ken nariribukan ni Jacob.	Kaya't natakot nang husto at nabahala si Jacob;
GEN_032_1	GEN	032	1	Inkarim kaniak a saannakto a baybay-an ket awanto ti dakes a mapagtengko. Imbagam pay a paaduem dagiti kaputotak a kas iti kaadu ti darat iti igid ti baybay.	Hindi ba't ikaw ang nagsabi, Gagawa ako ng mabuti sa iyo at ang iyong binhi ay gagawin kong parang buhangin sa dagat na hindi mabibilang dahil sa karamihan.
GEN_032_1	GEN	032	1	Naturog sadiay ni Jacob iti dayta a rabii. Kabigatanna, insaganana dagiti regalona ken ni Esau. Nangpili iti dua gasut a kabaian a kalding ken duapulo a bulog, dua gasut a kabaian a karnero ken duapulo a kalakian, tallopulo a gagatasen a kamelio agraman dagiti urbonda, uppat a pulo a kabaian a baka ken sangapulo a toro, duapulo a kabaian nga asno ken sangapulo a kalakian.	Siya'y namalagi roon nang gabing iyon, at kumuha siya ng panregalo mula sa kanya para sa kanyang kapatid na si Esau;
GEN_032_1	GEN	032	1	Adda adipen a nadutokan a mangaywan iti tunggal arban. Kinunana kadakuada, Umun-unakayo, ngem saankayo nga aggigiddan; agsasarunokayo ket ikkanyo ti baet ti tunggal arban.	dalawang daang kambing na babae, dalawampung lalaking kambing, dalawang daang tupang babae, at dalawampung tupang lalaki,
GEN_032_1	GEN	032	1	Imbilinna iti umuna nga adipen, Inton masabatnaka ni kabsatko nga Esau ket saludsodenna, Siasino ti apom? Sadino ti papanam? Siasino ti akinkukua kadagitoy nga animal?	tatlumpung kamelyong inahin, kasama ng kanilang mga anak, apatnapung baka, at sampung toro, dalawampung babaing asno at sampung lalaking asno.
GEN_032_1	GEN	032	1	kastoyto ti isungbatmo, Kukua ni adipenmo a Jacob. Paitedna dagitoy a kas sagut ken ni apona nga Esau. Sumarsaruno kadakami ni Jacob.	Ang mga ito ay ibinigay niya sa kanyang mga alipin, ang bawat kawan ay nakabukod at sinabi niya sa kanyang mga alipin, Lumampas kayo sa aking unahan at lagyan ninyo ng pagitan ang bawat kawan.
GEN_032_1	GEN	032	1	Kasta met ti imbilinna iti maikadua, iti maikatlo ken kadagiti amin nga adipen nga adda aywanna nga arban, Kastoyto amin ti ibagayo ken ni Esau inton masabatyo.	Iniutos niya sa una, Kapag ikaw ay natagpuan ni Esau na aking kapatid, at tanungin ka, Kanino ka? Saan ka pupunta? At kanino itong nasa unahan mo?
GEN_032_1	GEN	032	1	Ibagayo pay, Wen, sumarsaruno kadakami ni Jacob nga adipenmo.	Kung magkagayo'y sasabihin mo, Sa iyong lingkod na si Jacob.
GEN_032_1	GEN	032	1	Bayat ti panangituloy ni Jacob iti panagdaliasatna, adda sumagmamano nga angheles a nangsabat kenkuana.	Nagpatuloy si Jacob sa kanyang paglakad, at sinalubong siya ng mga anghel ng Diyos.
GEN_032_1	GEN	032	1	Idi makitana ida, kinunana, Daytoy ti kampo ti Dios.	Nang makita sila ni Jacob ay sinabi niya sa kanila, Ito'y kampo ng Diyos!
GEN_032_1	GEN	032	1	Pinauna ni Jacob ti sumagmamano a tattaona a mapan ken ni kabsatna nga Esau iti pagilian ti Edom.	Si Jacob ay nagpasugo kay Esau na kanyang kapatid sa lupain ng Seir, sa bayan ng Edom.
GEN_032_1	GEN	032	1	Kastoy ti pinaibagana: Siak ni Jacob a kabsatmo ken natulnog nga adipenmo.	Sila'y kanyang inutusan na sinasabi, Ganito ang inyong sasabihin kay Esau na aking panginoon.
GEN_032_1	GEN	032	1	Kinuna ni Jacob, Nakitak ti Dios iti rupanrupa ket sibibiagak pay laeng. Daytoy ti gapuna a pinanagananna ti lugar iti Peniel.	Dahil dito, hanggang ngayon ay hindi kumakain ang mga anak ni Israel ng litid ng balakang na nasa kasu-kasuan ng hita, sapagkat dito hinampas ng taong nakipagbuno ang kasu-kasuan ng hita ni Jacob, sa litid ng balakang.
GEN_032_1	GEN	032	1	Adu ti baka, asno, kalding, karnero ken tagabuk.	Mayroon akong mga baka, mga asno, mga kawan, at mga aliping lalaki at babae;
GEN_032_1	GEN	032	1	Ngem insungbatna, Apay a kayatmo nga ammoen ti naganko?	Sinikatan siya ng araw nang siya'y dumaraan sa Penuel;
GEN_032_1	GEN	032	1	Ita, ibagamon kaniak ti naganmo, kinuna ni Jacob.	Tinawag ni Jacob ang pangalan ng lugar na iyon na Peniel na sinasabi, Sapagkat nakita ko ang Diyos sa harapan, at naligtas ang aking buhay.
GEN_032_1	GEN	032	1	Nagsubli dagiti naibaon ket kinunada ken ni Jacob, Nakasaomi ni Esau a kabsatmo ket umaynaka sabten. Addan iti dalan a kaduana ti 400 a lallaki.	Ang mga sugo ay bumalik kay Jacob, na nagsasabi, Nakarating kami sa iyong kapatid na si Esau, at siya ay darating din upang sumalubong sa iyo, at kasama niya ang apatnaraang tao.
GEN_032_1	GEN	032	1	Kinuna ti lalaki, Manipud ita, saanen a Jacob ti naganmo.	Siya'y tinanong ni Jacob, Hinihiling ko sa iyo na sabihin mo sa akin ang iyong pangalan.
GEN_032_1	GEN	032	1	Jacob, insungbatna.	Sinabi niya, Ang iyong pangalan ay hindi na tatawaging Jacob, kundi Israel; sapagkat ikaw ay nakipaglaban sa Diyos at sa mga tao, at ikaw ay nagtagumpay.
GEN_032_1	GEN	032	1	Kinunana iti bagina, No darupennakami ni Esau, mabalin a makalibas ti maysa a bunggoy.	At kanyang sinabi, Kung dumating si Esau sa isang pulutong at kanyang puksain ito, ang pulutong na natitira ay tatakas.
GEN_032_1	GEN	032	1	Ania ti naganmo?	Sinabi ng lalaki kay Jacob, Ano ang pangalan mo?
GEN_032_1	GEN	032	1	Dika palusposan no dinak umuna a bendisionan, insungbat ni Jacob.	Sinabi niya, Bitawan mo ako, sapagkat nagbubukang-liwayway na. At sinabi ni Jacob, Hindi kita bibitawan malibang ako ay mabasbasan mo.
GEN_032_1	GEN	032	1	Kinuna ti lalaki, Ibbatannakon ta bumigaten.	Nang makita ng lalaki na hindi siya manalo laban kay Jacob, hinawakan niya ang kasu-kasuan ng hita ni Jacob, at ang kasu-kasuan ni Jacob ay nalinsad samantalang nakikipagbuno sa kanya.
GEN_032_1	GEN	032	1	Idi madlaw ti lalaki a dina maparmek ni Jacob, tinapigna ti padingpading ni Jacob ket naligsi ti nagsuopan dagiti tulangna.	Naiwang nag-iisa si Jacob at nakipagbuno sa kanya ang isang lalaki hanggang sa magbukang-liwayway.
GEN_032_1	GEN	032	1	Sadiay, dimteng ti maysa a lalaki ket nakigabbo kenkuana agingga nga agbannawag.	Sila'y kanyang isinama at itinawid sa batis, at kanya ring itinawid ang lahat ng kanyang ari-arian.
GEN_032_1	GEN	032	1	Ket nagkararag ni Jacob, O Dios ni apongko nga Abraham ken ni tatangko nga Isaac, tulongannak koma. Imbagam kaniak, O Apo , nga agsubliak iti dagak ken kadagiti kakabagiak ket saannakto a baybay-an.	Sinabi ni Jacob, O Diyos ng aking amang si Abraham, at Diyos ng aking amang si Isaac, O Panginoon , na nagsabi sa akin, Bumalik ka sa iyong lupain at sa iyong kamag-anak at gagawa ako ng mabuti sa iyo.
GEN_032_1	GEN	032	1	ngem nagbati nga is-isuna.	Nang gabing iyon, siya'y bumangon at isinama niya ang kanyang dalawang asawa, ang kanyang dalawang aliping babae, at ang kanyang labing-isang anak at tumawid sa tawiran ng Jaboc.
GEN_032_1	GEN	032	1	Diak maikari iti amin nga imbag ken ayat nga impaaymo kaniak nga adipenmo. Idi bimmallasiwak iti Jordan, awan iggemko no di la sarukod, ngem ita ta nagsubliakon, duan a bunggoy ti kinakuyogko.	Hindi ako karapat-dapat sa lahat ng kaawaan, at lahat ng katotohanan na iyong ginawa sa iyong lingkod sapagkat dumaan ako sa Jordang ito na dala ang aking tungkod, at ngayo'y naging dalawang pulutong ako.
GEN_032_1	GEN	032	1	Kalpasanna, imballasiwna met dagiti amin a sanikuana	Kaya't ang regalo ay ipinadala na nauna sa kanya; at siya'y nanatili sa kampo nang gabing iyon.
GEN_032_1	GEN	032	1	Isalakannak koma iti pannakabalin ni kabsatko nga Esau.	Hinihiling ko sa iyo na iligtas mo ako sa kamay ng aking kapatid na si Esau.
GEN_032_1	GEN	032	1	Impaunana ngarud dagiti sagut ket immian iti kampo iti dayta a rabii.	Gayundin, iniutos niya sa ikalawa, sa ikatlo, at sa lahat ng sumusunod sa mga kawan, na sinasabi, Sasabihin ninyo ang gayunding bagay kay Esau, kapag nakasalubong ninyo siya,
GEN_032_1	GEN	032	1	Iti dayta met la a rabii, bimmangon ni Jacob sana imballasiw dagiti dua nga assawana, dagiti dua a nga adipen a babbai ken dagiti sangapulo ket maysa nga annakna iti Karayan Jabbok.	at sasabihin ninyo, Bukod dito, ang iyong lingkod na si Jacob ay nasa hulihan namin. Sapagkat kanyang iniisip, Baka mapaglubag ko ang kanyang galit sa pamamagitan ng regalo na ipinauna ko, at pagkatapos ay makikita ko ang kanyang mukha, marahil ay tatanggapin niya ako.
GEN_032_2	GEN	032	2	Kinuna ngamin ni Jacob iti bagina, Ay-aywek ni kabsatko babaen iti pannangtedko kenkuana kadagiti sagut ket inton agsarakkami, nalabit a pakawanennakon.	Ito ay isang regalo na padala para sa aking panginoong si Esau; at bukod dito, siya'y nasa hulihan namin.
GEN_032_2	GEN	032	2	sinaludsod ti lalaki.	At kanyang sinabi, Jacob.
GEN_032_2	GEN	032	2	Iti kasta, pinanagananna ti lugar iti Mahanaim.	Kaya't tinawag niya ang pangalan ng lugar na iyon na Mahanaim.
GEN_032_2	GEN	032	2	Kayatko nga ipakaammo a nabayagak a nakipagtaeng ken ni uliteg a Laban ket ita la ti panagsublik.	Ganito ang sabi ng iyong lingkod na si Jacob, Ako'y tumigil ng ilang panahon kay Laban at namalagi roon hanggang ngayon.
GEN_032_2	GEN	032	2	Mabutengak amangan no umaynakami patayen amin, pati dagiti babbai ken ubbing.	Ako'y natatakot sa kanya, baka siya'y dumating at kaming lahat ay pagpapatayin niya, ang mga ina pati ang mga anak.
GEN_032_2	GEN	032	2	Ket binendisionanna ni Jacob.	at siya'y papilay-pilay dahil sa kanyang hita.
GEN_032_2	GEN	032	2	Imbaonko dagitoy pannakabagik bareng magun-odko ti panagtalekmo.	at ako'y nagpasugo sa aking panginoon, upang ako'y makatagpo ng biyaya sa iyong paningin.
GEN_032_2	GEN	032	2	Gapu ta nakigabboka iti Dios ken iti tao ket nangabakka, Israel ti naganmon.	At kanyang sinabi, Bakit itinatanong mo ang aking pangalan? At siya'y binasbasan doon.
GEN_032_2	GEN	032	2	Biningayna iti dua a bunggoy dagiti tattaona, kasta met dagiti karnero, kalding, baka ken kamelio.	at kanyang hinati sa dalawa ang mga taong kasama niya, ang mga kawan, ang mga bakahan, at ang mga kamelyo.
GEN_033_1	GEN	033	1	Sinaludsod ni Esau, Ket daydiay sabali a bunggoy a nasabatko?	Subalit sinabi ni Esau, Sapat na ang nasa akin, kapatid ko.
GEN_033_1	GEN	033	1	Immun-una ni Jacob ngem isuda ket namimpito a nagrukob agingga a dimmanon iti sangoanan ti kabsatna.	At siya naman ay lumampas sa unahan nila, at pitong ulit na yumuko sa lupa hanggang sa siya ay mapalapit sa kanyang kapatid.
GEN_033_1	GEN	033	1	Kinuna ni Jacob, Awatem koma no pudno a pinakawannakon. Kasla nakitak ti Dios iti pannakakitak kenka, ita ta inawatnak a siaayat.	Sinabi niya, Tayo'y humayo at maglakbay at ako'y sasama sa iyo.
GEN_033_1	GEN	033	1	Kinuna ni Esau, Agrubbuatkayon ta intayon. Umun-unaak ngem dakayo.	Magpauna na ang aking panginoon sa kanyang lingkod at ako'y magpapatuloy na dahan-dahan, ayon sa hakbang ng mga hayop na nasa aking unahan, at sa hakbang ng mga bata, hanggang sa makarating ako sa aking panginoon sa Seir.
GEN_033_1	GEN	033	1	Ngem nagturong ni Jacob idiay Succot. Nangbangon sadiay iti balayna ken sapsapaw a paglinongan dagiti arbanna. Isu a napanaganan dayta a lugar iti Succot.	At siya'y nagtayo roon ng isang dambana at tinawag niya itong El-Elohe-Israel.
GEN_033_1	GEN	033	1	Nagluas ni Esau tapno agsubli idiay Seir iti dayta met la nga aldaw.	Binili niya sa halagang isandaang pirasong salapi ang bahaging iyon ng lupa na pinagtayuan ng kanyang tolda, sa kamay ng mga anak ni Hamor, na ama ni Shekem.
