id	book	chapter	sentence_no	source_text	target_text
GEN_014_1	GEN	014	1	Innala dagiti uppat nga ari ti amin nga adda idiay Sodoma ken Gomorra agraman dagiti taraon sada pimmanaw.	At kanilang sinamsam ang lahat ng pag-aari at pagkain ng Sodoma at Gomorra, at saka umalis.
GEN_014_1	GEN	014	1	Innalada met ni Lot ken ti amin a sanikuana. Agnanaed idi ti kaanakan ni Abram idiay Sodoma.	Dinala nila si Lot na anak ng kapatid ni Abram, na nakatira sa Sodoma, at ang kanyang mga pag-aari at sila'y umalis.
GEN_014_1	GEN	014	1	ti napan nanggubat iti lima nga ari: Bera nga ari ti Sodoma, Birsa nga ari ti Gomorra, Sinab nga ari ti Adma, Semeber nga ari ti Zeboiim ken ti ari ti Bela wenno Soar.	ang mga ito ay nakipagdigma laban kay Bera na hari ng Sodoma, kay Birsha na hari ng Gomorra, kay Shinab na hari ng Adma, kay Shemeber na hari ng Zeboyin, at ng hari sa Bela na si Zoar.
GEN_014_1	GEN	014	1	nga awan ti alaek a kukuam, uray la koma sinulid wenno kordon ti sapatos tapno dimonto kuna a sika ti nangpabaknang kaniak.	na hindi ako kukuha kahit isang sinulid, o isang panali ng sandalyas, o ng anumang para sa iyo, baka iyong sabihin, Pinayaman ko si Abram.
GEN_014_1	GEN	014	1	Apaman a naammoan ni Abram a natiliw ti kaanakanna, inummongna dagiti amin a mannakigubat iti kampona nga agdagup iti 318 ket sinunsonda dagiti uppat nga ari agingga idiay Dan.	Nang marinig ni Abram na nabihag ang kanyang kamag-anak, pinangunahan niya ang kanyang tatlong daan at labingwalong mga sanay na tauhan na ipinanganak sa kanyang bahay, at kanilang hinabol sila hanggang sa Dan.
GEN_014_1	GEN	014	1	Sadiay, biningayna dagiti tattaona iti dua a bunggoy, dinarupda ti kabusor iti rabii ket pinarmekda ida. Kinamatkamatda ida agingga idiay Hobah iti amianan ti Damasco.	Kinagabihan, sila'y nagpangkat-pangkat laban sa kaaway, siya at ang kanyang mga alipin, at sila'y kanilang ginapi at hinabol sila hanggang sa Hoba na nasa hilaga ng Damasco.
GEN_014_1	GEN	014	1	Naalada amin a nasamsam. Inyawidna met ni Lot a kaanakanna ken dagiti amin a sanikuana, agraman dagiti babbai ken dagiti dadduma a balud.	At iniuwi niya ang lahat ng pag-aari, gayundin si Lot na kanyang kamag-anak at ang kanyang mga pag-aari, at ang mga kababaihan at ang taong-bayan.
GEN_014_1	GEN	014	1	Idi agsubli ni Abram kalpasan ti panangparmekna ken ni Kedorlaomer ken dagiti dadduma nga ari, sinabat ti ari ti Sodoma idiay Tanap ti Save a maaw-awagan met iti Tanap ti Ari.	Siya'y sinalubong ng hari ng Sodoma pagkatapos na siya'y bumalik mula sa pagkatalo ni Kedorlaomer, at sa mga haring kasama niya sa libis ng Shave na siyang libis ng hari.
GEN_014_1	GEN	014	1	Nangyeg met ni Melkisedec nga ari ti Salem ken padi pay ti Kangatoan a Dios iti tinapay ken arak ken ni Abram.	At si Melquizedek, hari ng Salem na pari ng Kataas-taasang Diyos, ay naglabas ng tinapay at alak.
GEN_014_1	GEN	014	1	Indawat ni Melkisedec a mabendisionan ni Abram ket kinunana, Sapay koma ta bendisionan ti Kangatoan a Dios ni Abram.	Siya'y kanyang binasbasan na sinabi, Pagpalain si Abram ng Kataas-taasang Diyos, na lumikha ng langit at ng lupa;
GEN_014_1	GEN	014	1	Madaydayaw koma ti Kangatoan a Dios a nangted iti panagballigim kadagiti kabusormo.	at purihin ang Kataas-taasang Diyos, na nagbigay ng iyong mga kaaway sa iyong kamay.
GEN_014_1	GEN	014	1	Insungbat ni Abram, Isapatak iti Apo a Kangatoan a Dios, ti namarsua iti langit ken daga,	Sinabi ni Abram sa hari ng Sodoma, Ako'y sumumpa sa Panginoong Diyos na Kataas-taasan, na lumikha ng langit at ng lupa,
GEN_014_1	GEN	014	1	Kinuna ti ari ti Sodoma ken Abram, Alaem dagiti sinamsammo ngem isublim dagiti amin a tattaok.	Sinabi ng hari ng Sodoma kay Abram, Ibigay mo sa akin ang mga tao at kunin mo ang mga ari-arian para sa iyong sarili.
GEN_014_2	GEN	014	2	Ket inted ni Abram kenkuana ti apagkapullo ti amin a sinamsamna.	At binigyan siya ni Abram ng ikasampung bahagi ng lahat.
GEN_014_2	GEN	014	2	Kadua ni Abram ni Mamre agraman da Escol ken Aner a kakabsatna.	Ang mga ito ay mga kakampi ni Abram.
GEN_014_2	GEN	014	2	Lima nga ari kontra uppat nga ari.	apat na hari laban sa lima.
GEN_014_2	GEN	014	2	Ngem ipalubosmo koma nga alaen dagiti kakaduak, da Aner, Escol ken Mamre, ti bingayda.	Ibigay mo sa kanila ang kanilang bahagi.
GEN_015_1	GEN	015	1	dagiti Amorreo, dagiti Cananeo, dagiti Gergeseo ken dagiti Jebuseo.	at ng mga Amoreo, Cananeo, Gergeseo, at ng mga Jebuseo.
GEN_015_1	GEN	015	1	Mapalabasto ti uppat a kaputotan santo agsubli ditoy dagiti kaputotam agsipud ta sakonto la pagtalawen dagiti Amorreo inton nakaro ti kinadakesda ket masapul a madusada.	Sa ikaapat na salin ng iyong binhi, muli silang babalik rito sapagkat hindi pa nalulubos ang kasamaan ng mga Amoreo.
GEN_015_1	GEN	015	1	Kalpasan daytoy, nagparmata ni Abram ket nangngegna ni Yahweh a makisasao kenkuana: Dika agbuteng, Abram.	Pagkatapos ng mga bagay na ito, dumating ang salita ng Panginoon kay Abram sa isang pangitain, Huwag kang matakot, Abram;
GEN_015_1	GEN	015	1	Ngem kinuna ni Abram, O Apo Dios , ania ti serbi kaniak ti gunggona nga itedmo idinto ta awan anakko? Ni laeng Eleazar a taga-Damasco ti agtawid kadagiti sanikuak.	Ngunit sinabi ni Abram, O Panginoong Diyos , anong ibibigay mo sa akin, yamang ako'y patuloy na walang anak at ang tagapagmana ng aking bahay ay si Eliezer ng Damasco?
GEN_015_1	GEN	015	1	Dinak pinaraburan iti anak ket maysa kadagiti tagabuk ti agtawid iti sanikuak.	At sinabi ni Abram, Hindi mo ako binigyan ng anak at isang alipin na ipinanganak sa aking bahay ang magiging tagapagmana ko.
GEN_015_1	GEN	015	1	Kalpasanna, nangngegna manen ni Yahweh a makisasao kenkuana, Saan a ni Eleazar a tagabu ti agtawid iti sanikuam no di ket ti bukodmo nga anak.	Ngunit ang salita ng Panginoon ay dumating sa kanya, Hindi ang taong ito ang magiging tagapagmana mo; ang iyong sariling anak ang magiging tagapagmana mo.
GEN_015_1	GEN	015	1	Inruar ni Yahweh ni Abram ket kinunana, Tumangadka ket padasem a bilangen dagiti bituen.	Siya'y dinala niya sa labas at sinabi, Tumingala ka ngayon sa langit, at iyong bilangin ang mga bituin, kung mabibilang mo.
GEN_015_1	GEN	015	1	dagiti Heteo, dagiti Perezeo, dagiti Refaim,	ng mga Heteo, Perezeo, at Refaim,
GEN_015_1	GEN	015	1	Nagtalek ni Abram ken ni Yahweh ket gapu iti daytoy, naragsakan kenkuana ni Yahweh ket inawatna a kas nalinteg ni Abram.	Sumampalataya siya sa Panginoon ; at ito'y ibinilang na katuwiran sa kanya.
GEN_015_1	GEN	015	1	Kalpasanna, kinuna ni Yahweh kenkuana, Siak ni Yahweh a nangiruar kenka iti Ur idiay Caldea tapno ipatagikuak kenka daytoy a daga.	At sinabi niya sa kanya, Ako ang Panginoon na nagpaalis sa iyo sa Ur ng mga Caldeo, upang ibigay sa iyo ang lupaing ito para angkinin.
GEN_015_1	GEN	015	1	Ngem kinuna ni Abram, O Apo Dios , kasano a maammoak a kukuak daytoy a daga?	Sinabi niya, O Panginoong Diyos , paano ko malalaman na mamanahin ko iyon?
GEN_015_1	GEN	015	1	Insungbatna, Yegannak iti baka, kalding, kalakian a karnero nga agtawen iti tallo ti tunggal maysa, ken saggaysa a kalapati ken pagaw.	At sinabi sa kanya, Magdala ka rito ng isang dumalagang bakang tatlong taon ang gulang, isang babaing kambing na tatlong taon ang gulang, isang lalaking tupang tatlong taon ang gulang, isang inakay na batu-bato, at isang inakay na kalapati.
GEN_015_1	GEN	015	1	Indatag ni Abram dagiti animal iti Dios. Pinatayna ida sana ginudua dagiti bangkay. Inintarna ida iti dua a linia nga agbinnatog dagiti agkapisi ngem dina ginudua ti kalapati ken ti pagaw.	Dinala niya ang lahat ng ito sa kanya at hinati niya sa gitna, at kanyang inihanay na magkakatapat ang isa't isa subalit hindi niya hinati ang mga ibon.
GEN_015_1	GEN	015	1	Nagdisso dagiti buitre kadagiti bangkay dagiti animal ngem binugawna ida.	Nang bumaba ang mga ibong mandaragit sa mga bangkay, ang mga iyon ay binugaw ni Abram.
GEN_015_1	GEN	015	1	Idi lumnek ti init, immapay ken ni Abram ti nargaan a turog.	Nang lulubog na ang araw, nakatulog si Abram nang mahimbing;
GEN_015_1	GEN	015	1	agraman ti daga dagiti Kineo, dagiti Kenezeo, dagiti Kadmoneo,	ang lupain ng mga Kineo, Kenizeo, at ng mga Cadmoneo,
GEN_015_1	GEN	015	1	Kinuna ni Yahweh, Ganggannaetto dagiti kaputotam iti sabali a daga. Agbalindanto a tagabu sadiay ket 400 a tawen a maparparigatdanto.	Sinabi ng Panginoon kay Abram, Tunay na dapat mong malaman na ang iyong binhi ay magiging taga-ibang bayan sa lupaing hindi kanila, at sila'y magiging mga alipin doon, at sila'y pahihirapan sa loob ng apatnaraang taon;
GEN_015_1	GEN	015	1	Ngem dusaekto ti nasion a mangtagabu kadakuada ket inton pumanawda iti dayta a daga, adunto a kinabaknang ti alaenda.	ngunit ang bansang kanilang paglilingkuran ay aking hahatulan; at pagkatapos ay aalis sila na may malaking ari-arian.
GEN_015_1	GEN	015	1	Atiddogto ti panagbiagmo, mataykanto a sitatalna ket maitanemkanto.	Subalit ikaw ay payapang tutungo sa iyong mga ninuno, at ikaw ay malilibing sa panahong lubos na ang iyong katandaan.
GEN_015_1	GEN	015	1	Iti dayta met la a kanito, nakitulag ni Yahweh ken ni Abram. Kinunana, Ikarik nga itedko iti kaputotam amin daytoy a daga manipud iti beddeng ti Egipto agingga iti Karayan Eufrates,	Nang araw na iyon, ang Panginoon ay nakipagtipan kay Abram, na sinasabi, Ibinigay ko ang lupaing ito sa iyong binhi, mula sa ilog ng Ehipto hanggang sa malaking ilog, ang Ilog Eufrates,
GEN_015_1	GEN	015	1	Idi nakalneken ti init ket nagsaknapen ti sipnget, pagammoan adda nagparang nga umas-asuk a banga ken sumsumged nga aluten a limmasat iti nagbaetan dagiti nagudua-gudua nga animal.	Nang lumubog na ang araw at madilim na, isang hurnong umuusok at ang isang tanglaw na nagniningas ang dumaan sa gitna ng mga hinating hayop.
GEN_015_2	GEN	015	2	Salaknibanka iti amin a peggad ket ikkanka iti naindaklan a gunggona.	ako ang iyong kalasag, ang iyong gantimpala ay magiging napakadakila.
GEN_015_2	GEN	015	2	Nariknana ti panagbuteng ken panagamak gapu iti nakaro a kinasipnget.	isang makapal at nakakatakot na kadiliman ang dumating sa kanya.
GEN_015_2	GEN	015	2	Kastanto ti kaadu dagiti kaputotam.	At sinabi sa kanya, Magiging ganyan ang iyong binhi.
GEN_016_1	GEN	016	1	Ngem agbiagto ti anakmo a kas atap nga asno.	Kaya't kanyang pinangalanan ang Panginoon na nagsalita sa kanya, Ikaw ay Diyos na nakakakita;
GEN_016_1	GEN	016	1	Ket innayonna, Ikkankanto iti adu nga annak ken appoko ket dinto mabilang ti kaaduda.	At sinabi sa kanya ng anghel ng Panginoon , Ngayon, ikaw ay nagdadalang-tao at manganganak ng isang lalaki. Ang itatawag mo sa kanyang pangalan ay Ismael, sapagkat pinakinggan ng Panginoon ang iyong dalamhati.
GEN_016_1	GEN	016	1	Saan nga aganak ni Sarai nga asawa ni Abram.	Si Sarai na asawa ni Abram ay hindi nagkaanak sa kanya;
GEN_016_1	GEN	016	1	Kinuna ni Agar iti bagina, Pudno kadi a nakitak ti Dios ket sibibiagak pay laeng kalpasan ti pannakakitak kenkuana?	Kaya't pinangalanan ang balong iyon na Balon ng Nabubuhay na Nakakakita sa Akin;
GEN_016_1	GEN	016	1	Isu a kinunana ken ni Abram, Yantangay ta dinak pinaraburan ti Apo iti anak, apay a dimo kaiddaen ti tagabuk bareng no aganak iti agpaay kaniak?	Sinabi ni Sarai kay Abram, Ako'y hinadlangan ng Panginoon na magkaanak. Sumiping ka sa aking alilang babae; marahil ay magkakaanak ako sa pamamagitan niya.
GEN_016_1	GEN	016	1	Kinuna ni Sarai ken ni Abram, Sika ti nakaigapuan ti pananglais kaniak ni Agar.	At sinabi ni Sarai kay Abram, Mapasaiyo nawa ang kasamaang ginawa sa akin, ibinigay ko ang aking alila sa iyong kandungan;
GEN_016_1	GEN	016	1	Aganakkanto iti lalaki ket panaganamto iti Ismael agsipud ta impangag ti Apo ti asugmo.	Siya'y magiging isang taong gaya ng mailap na asno, ang kanyang kamay laban sa lahat, at ang kamay ng lahat ay laban sa kanya; at habang nabubuhay ay kalaban ng lahat niyang mga kapatid.
GEN_016_1	GEN	016	1	Daytoy ti gapuna a maaw-awagan ti bubon nga adda iti nagbaetan ti Kades ken Bered iti Beer-lahai-roi.	At nanganak si Hagar ng isang lalaki kay Abram at ang itinawag ni Abram sa kanyang anak na ipinanganak ni Hagar ay Ismael.
GEN_016_1	GEN	016	1	Kinuna ti anghel ni Yahweh, Agsublika ket agserbika kenkuana.	Sinabi din sa kanya ng anghel ng Panginoon , Pararamihin kong lubos ang iyong binhi, at sila'y hindi mabibilang dahil sa karamihan.
GEN_016_1	GEN	016	1	Tinalawak ti apok, insungbat ni Agar.	Sinabi sa kanya ng anghel ng Panginoon , Magbalik ka sa iyong panginoon, at pasakop ka sa kanyang mga kamay.
GEN_016_1	GEN	016	1	Kinunana, Agar, tagabu ni Sarai, sadino ti naggapuam ken sadino ti papanam?	At sinabi niya, Hagar, alila ni Sarai, saan ka nanggaling at saan ka pupunta? At kanyang sinabi, Ako'y tumatakas kay Sarai na aking panginoon.
GEN_016_1	GEN	016	1	Iti asideg ti maysa nga ubbog iti let-ang, iti dalan nga agturong idiay Sur, adda anghel ni Yahweh a nangsabat kenkuana.	Natagpuan siya ng anghel ng Panginoon sa tabi ng isang bukal sa ilang, sa bukal na nasa daang patungo sa Shur.
GEN_016_1	GEN	016	1	ket naited ni Agar kenkuana a kas asawa nga agserbi kenkuana. Sangapulo a tawen idin ni Abram iti daga ti Canaan.	Kaya't pagkaraan ng sampung taong paninirahan ni Abram sa lupain ng Canaan, kinuha ni Sarai na asawa ni Abram si Hagar na taga-Ehipto, na kanyang alila, at ibinigay kay Abram na kanyang asawa upang maging asawa niya.
GEN_016_1	GEN	016	1	Kinaidda ni Abram ni Agar ket nagsikog.	Siya'y sumiping kay Hagar at naglihi;
GEN_016_1	GEN	016	1	Kinuna ni Abram, Tagabum daytoy a babai.	Subalit sinabi ni Abram kay Sarai, Ang iyong alila ay nasa iyong kapangyarihan.
GEN_016_1	GEN	016	1	Lalaki ti impasngay ni Agar ket pinanaganan ni Abram iti Ismael.	Si Abram ay walumpu't anim na taon nang ipanganak ni Hagar si Ismael sa kanya.
GEN_016_2	GEN	016	2	Siak a mismo ti nangted kenka ngem um-umsiennakon manipud ammona a masikogen.	at nang kanyang makita na siya'y naglihi ay hinamak ako sa kanyang paningin.
GEN_016_2	GEN	016	2	Ngarud, pinanagananna ni Yahweh a nakisarita kenkuana iti Ti Dios a Makakita.	ito'y nasa pagitan ng Kadesh at Bered.
GEN_016_2	GEN	016	2	Idi madlaw ni Agar a masikogen, timmangsit ket inumsina pay ni Sarai.	at nang makita ni Hagar na siya'y naglihi, tiningnan niya na may paghamak ang kanyang panginoong babae.
GEN_016_2	GEN	016	2	Aramidem kenkuana ti aniaman a kayatmo.	Gawin mo sa kanya ang mabuti sa iyong paningin.
GEN_016_2	GEN	016	2	Immanamong ni Abram,	At pinakinggan ni Abram ang sinabi ni Sarai.
GEN_016_2	GEN	016	2	Kabusornanto ti tunggal maysa ket agbalinto met a kabusor ti amin. Saanto nga agnaed iti sidong dagiti kabagianna.	sapagkat sinabi niya, Talaga bang nakita ko ang Diyos at nanatiling buhy pagkatapos na makita siya?
GEN_016_2	GEN	016	2	Ngem adda tagabuna a babai a taga-Egipto nga agnagan iti Agar.	at siya'y may isang alilang babae na taga-Ehipto, na ang pangalan ay Hagar.
GEN_016_3	GEN	016	3	Ikeddeng koma ti Apo no siasino kadata ti mapabasol.	Ang Panginoon ang humatol sa akin at sa iyo.
GEN_016_3	GEN	016	3	Naranggas ni Sarai ken ni Agar agingga a nagtalaw ti tagabu.	Pinagmalupitan siya ni Sarai at si Hagar ay tumakas.
GEN_017_1	GEN	017	1	Kinuna ti Dios ken ni Abraham, Masapul a tungpalem met ti nagtulaganta, sika ken dagiti sumarsaruno a kaputotam.	Sinabi ng Diyos kay Abraham, At tungkol sa iyo, iingatan mo ang aking tipan, ikaw at ang iyong binhi pagkamatay mo sa buong lahi nila.
GEN_017_1	GEN	017	1	Ikkankanto iti adu a kaputotan. Agbalinto nga ari ti sumagmamano kadakuada. Adunto unay ti kaputotam.	Ikaw ay gagawin kong mayroong napakaraming anak at magmumula sa iyo ang mga bansa;
GEN_017_1	GEN	017	1	Nakugitda iti dayta nga aldaw,	At si Ismael ay labintatlong taon nang tuliin ang balat ng kanyang maselang bahagi.
GEN_017_1	GEN	017	1	ket sangapulo ket tallo met ni Ismael.	Si Abraham ay siyamnapu't siyam na taong gulang nang tuliin ang balat ng kanyang maselang bahagi.
GEN_017_1	GEN	017	1	Siam a pulo ket siam ti tawen ni Abraham idi makugit	Ipinagsama ni Abraham si Ismael, na kanyang anak, at ang lahat ng ipinanganak sa kanyang bahay, at ang lahat ng binili niya ng kanyang salapi, ang lahat ng lalaki sa mga kasambahay ni Abraham, at kanyang tinuli ang balat ng maselang bahagi ng kanilang katawan nang araw ding iyon, ayon sa sinabi ng Diyos sa kanya.
GEN_017_1	GEN	017	1	Iti dayta met la nga aldaw, tinungpal ni Abraham ti imbaga ti Dios. Kinugitna ni Ismael nga anakna ken amin a lallaki iti balayna, tagabu man a nayanak sadiay wenno dagiti ginatangna.	Pagkatapos makipag-usap sa kanya, ang Diyos ay pumaitaas na mula kay Abraham.
GEN_017_1	GEN	017	1	Pimmanaw ti Dios kalpasan ti panagsaona ken ni Abraham.	Aking itatatag ang aking tipan kay Isaac na ipapanganak sa iyo ni Sara sa panahong ito sa taong darating.
GEN_017_1	GEN	017	1	Ngem tungpalekto ti tulagko ken ni Isaac nga anakmo nga ipasngayto ni Sara iti kastoy a tiempo inton umay a tawen.	Tungkol kay Ismael ay narinig kita. Pinagpala ko siya at siya'y gagawin kong mabunga at lubos kong pararamihin. Labindalawang prinsipe ang kanyang magiging anak, at siya'y gagawin kong malaking bansa.
GEN_017_1	GEN	017	1	Saanen nga Abram ti naganmo no di ket Abraham agsipud ta pagbalinenka a kapuonan ti adu a nasion.	Ang pangalan mo ay hindi na tatawaging Abram, kundi Abraham ang magiging pangalan mo; sapagkat ikaw ay ginawa kong ama ng maraming bansa.
GEN_017_1	GEN	017	1	Nangngegko ti dawatmo maipapan ken ni Ismael, isu a bendisionakto ket ikkak iti adu a kaputotan.	Sinabi ng Diyos, Hindi! Ang iyong asawang si Sara ay tiyak na magkakaanak sa iyo, at tatawagin mo siya sa pangalang Isaac.
GEN_017_1	GEN	017	1	Ngem kinuna ti Dios, Saan. Aganakto ni Sara iti lalaki ket panaganamto iti Isaac. Tungpalekto ti pagtulaganmi ken ni Isaac ken kadagiti kaputotanna. Agnanayon daytoy a tulag.	At sinabi ni Abraham sa Diyos, Bakit hindi na lang si Ismael ang magmana ng mga ipinangako ninyo sa akin?
GEN_017_1	GEN	017	1	Kinunana iti Dios, Apay a dimo ipalubos a ni laengen Ismael ti agtawid kadagiti sanikuak?	Nang magkagayo'y nagpatirapa at tumawa si Abraham, at sinabi sa kanyang sarili, Magkakaanak pa kaya ang isang tao na isandaang taong gulang na? Manganak pa kaya si Sara na siyamnapung taong gulang na?
GEN_017_1	GEN	017	1	Daytoy ti katulagak: Ikarik nga agbalinkanto a kapuonan ti adu a nasion.	Para sa akin, ito ang aking pakikipagtipan sa iyo: Ikaw ang magiging ama ng maraming bansa.
GEN_017_1	GEN	017	1	Idi nangngegna daytoy, nagpakleb ni Abram iti daga. Kinuna ti Dios,	At nagpatirapa si Abram, at sinabi ng Diyos sa kanya,
GEN_017_1	GEN	017	1	Nagpakleb ni Abraham iti daga ngem nagkatawa idi malagipna ti kinalakayna.	Siya'y aking pagpapalain, at bibigyan kita ng anak sa pamamagitan niya.
GEN_017_1	GEN	017	1	Bendisionakto ket paraburankanto iti anak a lalaki nga ipasngayna. Bendisionakto ket agbalinto nga ina dagiti nasion. Agbalinto nga ari ti sumagmamano kadagiti kaputotanna.	At sinabi ng Diyos kay Abraham, Tungkol kay Sarai na iyong asawa, huwag siyang tatawaging Sarai, kundi Sara ang magiging pangalan niya.
GEN_017_1	GEN	017	1	Makitulagak kenka ket ikkankanto iti adu a kaputotam.	at ako'y makikipagtipan sa iyo at ikaw ay aking labis na pararamihin.
GEN_017_1	GEN	017	1	Kinuna ti Dios, Saanen a Sarai ti pangawagmo iti asawam.	Ang sinumang lalaking hindi tuli, na hindi tinuli ang balat ng maselang bahagi ay ititiwalag sa kanyang bayan;
GEN_017_1	GEN	017	1	Saanto a maibilang a taok ti siasinoman a lalaki a saan a nakugit agsipud ta dina tinungpal ti nagtulaganta.	Ang aliping ipinanganak sa bahay at ang binili ng iyong salapi ay dapat tuliin; at ang aking tipan ay makikita sa iyong laman bilang tipang walang hanggan.
GEN_017_1	GEN	017	1	Masapul a makugit ti tunggal maysa ket daytoy a marka ti bagi ti mangipakita nga agnanayon ti nagtulaganta.	Sa inyong buong lahi, bawat lalaking may gulang na walong araw sa inyo ay tutuliin, maging ang aliping ipinanganak sa inyong bahay, o ang binili ng salapi sa sinumang taga-ibang lupa na hindi sa iyong lahi.
GEN_017_1	GEN	017	1	Manipud ita, masapul a kugitem ti ubing a lalaki nga adda walo nga aldawnan, agraman dagiti tagabu a nayanak iti balaymo ken dagiti ginatangmo kadagiti ganggannaet. Daytoy ti pakakitaan nga adda nagtulaganta.	Inyong tutuliin ang balat ng inyong maselang bahagi, at ito ang magiging tanda ng aking tipan sa inyo.
GEN_017_1	GEN	017	1	Masapul nga umanamongkayo, sika ken dagiti kaputotam, a makugit ti amin a lalaki kadakayo.	Ito ang aking tipan na inyong iingatan, ang tipan natin at ng iyong binhi pagkamatay mo: Ang bawat lalaki sa inyo ay tutuliin.
GEN_017_1	GEN	017	1	agraman dagiti amin a tagabu ni Abraham.	Nang araw ding iyon ay tinuli si Abraham at si Ismael na kanyang anak.
GEN_017_1	GEN	017	1	Itedkonto kenka ken kadagiti kaputotam daytoy a daga a pagnanaedam ita a kas ganggannaet. Kukuanto dagiti kaputotam iti agnanayon ti entero a daga ti Canaan, ket siakto ti Diosda.	At ibibigay ko sa iyo at sa iyong binhi pagkamatay mo ang lupaing kung saan ka ngayon ay isang dayuhan, ang buong lupain ng Canaan bilang pag-aaring walang hanggan; at ako ang magiging Diyos nila.
GEN_017_1	GEN	017	1	Agnanayon daytoy a tulag ket tungpalekto ti karik kenka ken kadagiti sumarsaruno a kaputotam. Siakto ti Diosmo ken ti Dios dagiti kaputotam.	Aking itatatag ang aking tipan sa iyo at sa iyong binhi kahit sa iyong pagkamatay sa buong lahi nila, isang tipang walang hanggan, upang maging Diyos mo at ng iyong binhi.
GEN_017_1	GEN	017	1	Idi agtawen ni Abram iti 99, nagparang ni Yahweh kenkuana. Kinunana, Siak ti Dios a Mannakabalin-amin.	Nang si Abram ay siyamnapu't siyam na taon, ang Panginoon ay nagpakita kay Abram, at sa kanya'y nagsabi, Ako ang Diyos na Makapangyarihan sa lahat!
GEN_017_2	GEN	017	2	Ket agbalindanto nga adu a nasion.	at magbubuhat sa iyo ang mga hari.
GEN_017_2	GEN	017	2	Agtulnogka kaniak ket aramidem a kanayon ti naimbag.	Lumakad ka sa harapan ko, at maging walang kapintasan;
GEN_017_2	GEN	017	2	Manipud ita, Sara ti nagannan.	sinira niya ang aking tipan.
GEN_017_2	GEN	017	2	Kinunana iti bagina, Makaputot pay ngata ti lalaki a 100 ti tawenna?	Siya'y aking pagpapalain, at siya'y magiging ina ng mga bansa;
GEN_017_2	GEN	017	2	Isunto ti ama ti sangapulo ket dua a pangulo ket pagbalinekto a naindaklan a nasion dagiti kaputotanna.	Itatatag ko ang aking tipan sa kanya bilang isang walang hanggang tipan, at sa kanyang lahi pagkamatay niya.
GEN_017_3	GEN	017	3	Aganak pay ngata ni Sara idinto a 90 ti tawennan?	ang mga hari ng mga bayan ay magmumula sa kanya.
GEN_018_1	GEN	018	1	Yalaankayo met iti taraon tapno adda pamigsayo a mangituloy iti panagbiaheyo.	Kukuha ako ng kaunting tinapay upang makapagpalakas sa inyo, at pagkatapos ay magpatuloy na kayo, yamang kayo'y pumarito sa inyong lingkod.
GEN_018_1	GEN	018	1	Masapul a bumabaak tapno ammoek no pudno daytoy.	Malayong gagawa ka ng ganito, na ang banal ay iyong pataying kasama ng masama, anupa't ang banal ay makatulad sa masama! Malayong mangyari iyan! Di ba gagawa ng matuwid ang Hukom ng buong mundo?
GEN_018_1	GEN	018	1	ket idi tumangad, nakitana ti tallo a lallaki a nakatakder.	Itinaas niya ang kanyang paningin at nakita ang tatlong lalaki na nakatayo na malapit sa kanya.
GEN_018_1	GEN	018	1	Inasitgan ni Abraham ni Yahweh ket sinaludsodna, Pudno kadi nga iramanmo a pukawen dagiti awanan basol kadagiti nakabasol?	Sumagot si Abraham, at nagsabi, Mangangahas akong magsalita sa Panginoon, akong alabok at abo lamang.
GEN_018_1	GEN	018	1	sana kinuna, Appo, madadaanak nga agserbi kadakayo. Pangngaasiyo ta dumagaskayo iti taengko.	At sinabi, Panginoon ko, kung ako'y nakatagpo ng biyaya sa inyong paningin ay hinihiling ko sa inyo na huwag mong lampasan ang iyong lingkod.
GEN_018_1	GEN	018	1	Nagparang ni Yahweh ken ni Abraham idiay Mamre, iti ayan dagiti lugo a kayo. Agtugtugaw idi ni Abraham iti ruangan ti toldana iti kapudot ti aldaw	Ang Panginoon ay nagpakita kay Abraham sa may punong ensina ni Mamre habang siya'y nakaupo nang kainitan ang araw sa pintuan ng tolda.
GEN_018_1	GEN	018	1	Yalaankayo iti danum a pangbuggoyo kadagiti sakayo. Mabalinyo ti aginana ditoy sirok dagiti kayo.	Hayaan mong dalhan ko kayo rito ng kaunting tubig, at maghugas kayo ng inyong mga paa, at magpahinga kayo sa lilim ng kahoy.
GEN_018_1	GEN	018	1	No adda limapulo a tattao nga awanan basol iti siudad, pukawem pay la kadi ti entero a siudad?	Kung sakaling magkukulang ng lima sa limampung banal, lilipulin mo ba ang buong bayan dahil sa limang kulang?
GEN_018_1	GEN	018	1	Agyamankami, insungbatda.	Si Abraham ay nagmadaling pumunta sa tolda ni Sara, at sinabi, Dali!
GEN_018_1	GEN	018	1	Awan duadua a dimo iraman a patayen dagiti awanan basol kadagiti adda basolna. Saan a mabalin nga aramidem ti kasta. No kasta ti aramidem, mairaman a madusa dagiti awan basolna kadagiti adda basolna.	At siya'y muling nagsalita sa kanya, at nagsabi, Halimbawang may matatagpuang apatnapu.
GEN_018_1	GEN	018	1	Dinagdagus ni Abraham ti simrek iti toldana ket kinunana iti asawana, Sara, mangalaka iti sangasupot iti kasayaatan nga arina ket manglutoka iti tinapay. Darasem!	At tumakbo si Abraham sa bakahan at kumuha ng isang bata at malusog na baka, at ibinigay sa alipin na nagmamadaling inihanda ito.
GEN_018_1	GEN	018	1	Kalpasanna, nagtaray a napan iti ayan dagiti arban ket nangpili iti nalukmeg nga urbon ti baka.	Kinuha niya ang mantekilya, gatas, at ang bakang inihanda niya, at inihain sa harapan nila.
GEN_018_1	GEN	018	1	Insungbat ni Yahweh, No adda masarakak a 50 a tattao iti Sodoma nga awanan basol, ispalek ti entero a siudad gapu kadakuada.	Pagkatapos ay sinabi niya, O huwag sanang magalit ang Panginoon, at ako'y magsasalita. Kung sakaling may matatagpuan doong tatlumpu. At sinabi niya, Hindi ko gagawin kung makakatagpo ako roon ng tatlumpu.
GEN_018_1	GEN	018	1	Nangala ni Abraham iti keso, gatas, ken ti karne a pinalutona ket impasangona kadagiti lallaki.	At sinabi nila sa kanya, Nasaan si Sara na iyong asawa?
GEN_018_1	GEN	018	1	Nagsao manen ni Abraham.	At kanyang sinabi, Ako'y mangangahas magsalita sa Panginoon.
