id	source_text	target_text
EXO_021_0012	Awan kalintegan ti amongna a mangilako kenkuana kadagiti ganggannaet ta saan a nasayaat ti panangtratarna kenkuana.	No say laki et ag to sumpalen iray nepeg ton gawaen ed inmonan asawa to, nepeg ya itdan to na kawayangan tan nepeg ya ag bayaran imay laki.
EXO_021_0013	No gumatang ti maysa a tao iti babai a tagabu nga ipaasawana iti anakna, masapul nga ibilangna a kas bukodna nga anak.	Siopamay mangabil na kapara ton too tan apatey to, nepeg a pateyen.
EXO_021_0014	No mangasawa dayta a lalaki iti sabali, masapul nga ituloyna nga ited ti sigud a taraon, kawes ken kalinteganna.	Balet no ag to tinalaranan tan ag to ginagalan apatey imay too, nayarian toy ombatik ed sakey a pasen a pilien kon para sikayo.
EXO_021_0015	No dina tungpalen dagitoy a pagrebbengan, masapul a wayawayaanna ti babai ket saanen a masapul nga agbayad ti babai iti pannakawayawayana.	Balet no say sakey a too et akapasnuk tan ginagala ton pinatay so kapara ton too, nepeg ya alaen a pateyen anggan binmatik lad altar ko.
EXO_021_0016	Siasinoman a mangkabil iti maysa a tao a pakaigapuan ti ipapatayna, rumbeng met a mapapatay.	Siopamay mangabil na ama to odino ina to, nepeg a pateyen.
EXO_021_0017	No dina inggagara wenno pinanggep a patayen, mabalinna ti mapan agkamang iti lugar nga itudingkonto ket awanto ti pakaan-annoanna sadiay.	Siopamay mamasoot a mangala na too ya ilako to odino aripenen to, nepeg a pateyen.
EXO_021_0018	Ngem no makapungtot ti maysa a tao ket igagarana a patayen ti sabali, masapul a mapapatay uray no agkamang iti altarko.	Siopamay mangisamba ed ama to odino ina to, nepeg a pateyen.
EXO_021_0019	Siasinoman a mangkabil iti ama wenno inana, rumbeng a mapapatay.	No wala ray manlalaban tan say sakey et tapalan to na bato so sakey odino ponitien to, balet ta ag to apatey, nepeg ya ag dusaen.
EXO_021_0020	Siasinoman a mangkidnap iti maysa a tao tapno ilako wenno tagabuenna, rumbeng a mapapatay.	No say toon akabil et nepeg a manayam ed dokulan, insan makabangon lamlamang tan makaakar ed paway ya akabaston, say angabil ed sikato et nepeg a bayaran to so panaon ya ag to pakapankimey tan asikasoen to ya anggad ag to iyabig.
EXO_021_0021	Siasinoman a mangilunod iti ama wenno iti inana, rumbeng a mapapatay.	No say sakey a too et pekpeken toy aripen ton laki odino bii tan inatey ed samay bektan impamekpek to, nepeg a dusaen.
EXO_021_0022	No adda agapa ket madunor ti maysa babaen iti bato wenno gemgemna, saan a madusa no saan a matay ti dinangranna.	Balet no ag ompatey ed loob na sakey odino duaran agew, nepeg ya ag dusaen.
EXO_021_0023	Ngem no maidalit ti nadangran, ket mabalinna ti bumangon ken magna uray no agsarukod, bayadan ti nakadunor dagiti aldaw a napukawna ken taripatoenna agingga nga umimbag.	Masarag lan dusa to so inkaandi na kayaryan ton aripen.
EXO_021_0024	Siasinoman a mangpang-or iti tagabuna, lalaki man wenno babai, rumbeng a madusa no matay a dagus ti pinang-orna.	No walay pigaran totoon manlalaban tan apasakitan day sakey a biin malokun, et nakalan, balet ta ag nanliknay arum a kairapan, samay akapasakit ed sikato et nepeg a bayaran toy labay na asawa to may bii, onung na pangabubon na saray huis.
EXO_021_0025	Ngem no saan a matay ti tagabu kalpasan ti maysa wenno dua nga aldaw, saan a madusa ti amo ta umdasen a dusana ti pannakapukaw ti tagabuna.	Balet no manliknay arum a kairapan imay ina, saya so dusa: say bilay bayaran na bilay, say mata bayaran na mata, say ngipen bayaran na ngipen, say lima bayaran na lima, say sali bayaran na sali, say apoolan bayaran na apoolan, say sugat bayaran na sugat, tan say biret ed laman bayaran na biret ed laman.
EXO_021_0026	No adda agkakabil a lallaki ket masaktanda ti maysa a masikog a pakaigapuan ti pannakaalisna ngem awanen ti sabali a dunorna, mamulta ti nakadunor iti gatad nga ikeddeng ti asawa ti nadangran, kas mayannurot iti inkeddeng ti ukom.	No say sakey a too et kabilen tod mata so aripen ton laki odino bii tan aderal so matan nakna to, nepeg ton ibolus imay aripen a pinagkabayar tod pinmultak a mata.
EXO_021_0027	Ngem no madunor ti babai, madusa ti nangdangran: biag iti biag, mata iti mata, ngipen iti ngipen, ima iti ima, saka iti saka, puor iti puor, sugat iti sugat, dunor iti dunor.	No apangpangan to na ngipen, nepeg ton ibolus so aripen a pinagkabayar tod nakal a ngipen.
EXO_021_0028	No kabilen ti maysa a tao ti tagabuna, lalaki man wenno babai ket nabuldinganna, rebbengna a wayawayaan ti tagabu a kas bayad ti matana.	No bonoen na sakey a bakan kalakyan so sakey a too tan inatey, say baka nepeg a tupaken, tan ag kanen so laman to; balet ag nepeg a dusaen so akanbaka.
EXO_021_0029	Ket no natuppolanna ti tagabu, rebbengna a wayawayaan a kas bayad ti ngipenna.	Balet no say bakan kalakyan et kagagawa to lay mambono na too tan apasakbayan la so akanayep et ag to nin siansia ikolung ed koralinsan mamono yan baka tan inatey so binono to, nepeg a tupaken so baka tan nepeg met a pateyen so akanbaka.
EXO_021_0030	No matay ti siasinoman a sangdoen ti baka, masapul a maubor ti baka agingga a matay ket saan a sidaen ti karnena; nupay kasta, saan a madusa ti akimbaka.	Balet no naabuloyan a mambayar so akanayep pian ag pateyen, nepeg to ya iter so intiron bayar.
EXO_021_0031	Ngem no sumasangdo ti baka ken napakdaaran ti akinkukua ngem dina ipupok, ket matay ti tao a sinangdona, maubor ti baka agingga a matay; mapapatay pay ti akinkukua.	No ogaw a laki odino bii so apatey na baka, namparan totontonen so tombuken.
EXO_021_0032	Ngem no mapalubosan nga agmulta ti akimbaka tapno maispal ti biagna, bayadanna ti amin a naikeddeng a pagbayad.	No laki odino bii ya aripen so apatey na bakan kalakyan, nepeg a say akanbaka bayaran to na talomplon pilak a kuarta so akankayaryan na inatey ya aripen tan nepeg a tupaken so baka ya anggad ompatey.
EXO_021_0033	No ubing a lalaki wenno babai ti mapatay ti baka, daytoy met laeng a linteg ti masurot.	No ekalen na sakey a too so sakub na aralem ya abut odino mangotkot na aralem ya abut, et ag to sakuban, tan napelag diman so sakey a bakan kalakyan odino asno, nepeg a mambayar imay too.
EXO_021_0034	No tagabu a lalaki wenno babai ti mapatayna, agbayad ti akimbaka iti 30 a bagi ti pirak iti among ti tagabu ket mabato ti baka agingga a matay.	Bayaran to na kuarta so akanayep tan kayaryan to la may inatey ya ayep.
EXO_021_0035	No ikkaten ti maysa a tao ti kalub ti abut a pagurnongan iti danum wenno agkali iti sabali sa dina kaluban ket adda baka wenno asno a matnag ditoy, masapul a bayadanna ti animal.	No napatey na sakey a bakan kalakyan so sakey a bakan kalakyan na sananey a too, saramay akanayep nepeg da ya ilako so mabilay a baka tan panapagan day panlakoan; panapagan da met so karni to may inatey.
EXO_021_0036	Itedna ti kuarta iti akinkukua iti abut ket alaenna ti natay nga animal.	Balet no samay baka et kagagawa to lay mambono na too tan apasakbayan la may akanayep, et ag to nin siansia ikolung ed koral, nepeg ton itdan na mabilay a bakan kalakyan imay akanayep na inatey, pian nasalatan so naandi tan kayaryan to la may inatey ya ayep.
EXO_022_0001	No takawen ti maysa a tao ti maysa a baka wenno karnero ken partienna wenno ilakona, lima a baka ti isukatna iti maysa a baka ken uppat met a karnero ti isukatna iti maysa a karnero.	No say sakey a too et manakew na sakey a baka odino sakey a karniro tan pateyen to odino ilako to, nepeg to a bayaran na limaran baka so sakey a baka tan apatiran karniro so sakey a karniro.
EXO_022_0002	Masapul a bayadanna ti tinakawna.	Nepeg ton bayaran so tinakew to.
EXO_022_0003	No awan ti pagbayadna, isu ti mailako.	No anggapon balut so kayaryan to, nepeg ya ilako a sakey ya aripen pian nabayaran so tinakew to.
EXO_022_0004	No ti natakaw nga animal, baka man wenno asno wenno karnero, ket masarakan a sibibiag iti ikutna, dua ti isukatna.	No nalmo ed sikato a mabilay so tinakew to a baka odino asno odino karniro, nepeg to a bayaran na duara so sakey.
EXO_022_0005	No matiliwan ti mannanakaw nga agtaktakaw iti rabii iti maysa a balay ket mapapatay, awan sungsungbatan ti pimmatay.	No diad labi et nasiwa so sakey a matakew ya onloloob ed sakey ya abung tan apatey, say akapatey ed sikato et ag mankasalanan na impamatey.
EXO_022_0006	Ngem no mapasamak daytoy iti aldaw, makabasol ti pimmatay.	Balet no diad agew so kagawa to, mankasalanan na impamatey.
EXO_022_0007	No ipaarab ti maysa a tao dagiti animalna ket makabulosda sada mapan araben ti mula ti sabali a tao, masapul nga isukatna dagiti kasayaatan nga apit iti bukodna a talon wenno kaubasan.	No say sakey a too et ipastol to ray ayep to ed alog odino diad kaubasan, et akaarawi ra tan kinan da ray bunga na tanaman ed alog na sakey a too, say akanayep nepeg ton bayaran so kinen na ayep to na saray sankaabigan a bungay tanaman ed kaalogan to odino kaubasan to.
EXO_022_0008	No agpuor ti maysa a tao iti talonna ket agkayamkam ti apuy a mangsilmut kadagiti ruot iti talon ti sabali ket mapuoran dagiti dumakdakkel a trigo wenno dagiti pempen a dawa, masapul a bayadan ti nagpuor ti amin a nadadael.	No say sakey a too et mamool ed alog to tan onkayamkam so apoy ed alog na arum a too tan napoolan iray ontutubon tanaman diman odino saray pinalot a nisimbun diman, say angigapoy apoy et nepeg a bayaran toy adarak.
EXO_022_0009	No italek ti maysa a tao ti kuarta wenno aniaman a sanikuana iti sabali a tao ket matakaw dagitoy iti balay ti nagpaidulinanna, doble ti pagbayad ti matiliwan a nangtakaw.	No say sakey a too et mipaknaan ya isinup toy kuarta odino antokaman a mablin kayaryan na sakey a too, insan natakew ira ed abung to, say nantakew nepeg a dobli so ibayar to no narel.
EXO_022_0010	No saan a masarakan ti nagtakaw, maidatag ti nagpaidulinanna iti Dios ket isapatana a dina tinakaw dagiti sanikua.	Balet no ag narel so nantakew, say toon angisinup na kayaryan et nepeg ya iyakar ed pasen a panangigalangan tan diman mansamba ya ag to tinakew so kayaryan na toon akipaknaan to.
EXO_022_0011	Amin a kaso a pakaseknan iti sanikua, baka man wenno asno wenno karnero wenno pagan-anay wenno aniaman a napukaw, maipanda iti imatang ti Dios.	Diad balang kolkolan a nipaakar ed pankayaryan na bengatlan, singa bilang baka, asno, karniro, kawes, odino antokaman ya abalang, saray duaran totoon mangakayaryan et nepeg iran niyakar ed pasen a panangigalangan.
EXO_022_0012	Maidatag iti pagdaydayawan dagiti mangibaga a kukuada ti sanikua, ket ti siasinoman a sentensiaan ti Dios, doble ti bayadanna iti pudno nga agtagikua.	Say toon ibawag na Dios a sikatoy nankasalanan et nepeg a mambayar na dobli ed samay sakey a too.
EXO_022_0013	No umanamong ti maysa a tao nga aywananna ti asno wenno baka wenno karnero wenno uray ania nga animal ti sabali a tao, ket matay ti animal wenno masugatan wenno maitalaw, no awan ti makasaksi iti naaramid, masapul nga agsapata ti nagan ti Apo iti disso a pagdaydayawan a dina tinakaw ti animal.	No say sakey a too et mipaknaan ya asikasoen toy asno, baka, karniro odino arum ya ayep na sananey a too, tan samay ayep et inatey odino asugatan odino imbatik na matatakew, tan anggapoy makatasi ed inkagawa, samay too nepeg ya onlad pasen a panangigalangan tan sambaan to ya ag to tinakew imay ayep na sakey a too.
EXO_022_0014	No saan a natakaw ti animal, ibilang ti akinkukua a kas pukawna ket saan a masapul nga agbayad ti nangaywan.	No ag atakew, say akanayep nepeg ton akoen a naandi, tan samay sakey a too et ag la nepeg a mambayar; balet no atakew so ayep, samay too nepeg a bayaran to so akanayep.
EXO_022_0015	Ngem no matakaw ti animal, masapul nga agbayad ti agaywan.	No pinatey na saray ayep ed takel, say toon manaasikaso alaen to so laman na ayep a pamaneknek ed agawa; ag to nepeg a bayaran ed akanayep so pinatey na saray ayep ed takel.
EXO_022_0016	No pinatay dagiti narungsot nga animal, masapul nga ipakita ti agaywan ti narangrangkay nga animal a kas pammaneknek.	No say sakey a too et ombayes na sakey ya ayep ed sakey a too tan asugatan odino inatey imay ayep nen andid man so akanayep, say toon binmayes et nepeg a bayaran to may binayes to.
EXO_022_0017	Saan a nasken a bayadanna ti pinatay dagiti narungsot nga animal.	Balet no say akanayep et wadman nen abalang so ayep, say binmayes ag nepeg a mambayar.
EXO_022_0018	No buloden ti maysa a tao ti animal ti sabali ket masugatan wenno matay a saan a nakita ti akinkukua, masapul a bayadanna ti animal.	No inabangan ya ayep, say abang et pinagkabayar la.
EXO_022_0019	Ngem no mapasamak ti kasta iti imatang ti akinkukua, saan a masapul nga agbayad ti nangbulod.	No say sakey a laki et tuksoen toy sakey a marikit ya ag ni akisipanan a mikasal tan akdulan to, say laki nepeg ya iter toy bayar a para nobia tan asawaen to may bii.
EXO_022_0020	No naabangan ti animal, umdas ti abangna a pagbayadna iti natay nga animal.	Balet no ag onabuloy so ama ya asawaen day anak to, samay laki nepeg a bayaran to may ama na singa karakel na kuartan ibayar ed nobian marikit.
EXO_022_0021	No sulisogen ti maysa a lalaki ti balasang a birhen a saan a naitulag a mayasawa ket kaiddaenna, masapul nga ikasarna ti babai kalpasan iti pannangtedna iti sab-ong.	Nepeg a pateyen so siopaman a biin managsalamangka diad pananulong na maoges ya ispiritu.
EXO_022_0022	Ngem no madi ti ama ti babai nga ipaasawa ti anakna, masapul nga ited ti lalaki ti naituding a gatad ti sab-ong; yawatna daytoy iti ama ti babai.	Nepeg a pateyen so siopaman a lakin misiping ed ayep.
EXO_022_0023	Papatayenyo ti babai a manggagamud.	Nepeg a pateyen so siopaman a mangibagat ed anggan anton dios likud ed siak a Katawan .
EXO_022_0024	Papatayenyo ti siasinoman a makikaidda iti animal.	Ag yo lulukoen odino papairapen so sangkaili; ag yo lilingwanan a sangkaili kayo met nen saman ed Egipto.
EXO_022_0025	Papatayenyo ti siasinoman nga agidaton iti uray ania a didiosen, ta siak laeng, ni Yahweh, ti pagidatonan.	Ag yo papairapen so siopaman a balon bii odino siopaman ya olila.
EXO_022_0026	Diyo ranggasan wenno idadanes ti ganggannaet.	No pairapen yo ra, siak a Katawan ebatan ko ra no onkerew irad siak na tulong, tan mampasnuk ak tan pateyen ta kayo ed bakal.
EXO_022_0027	Laglagipenyo a ganggannaetkayo met idi idiay Egipto.	Nabalo ray kaasawaan yo tan naolila ed ama iray anak yo.
EXO_022_0028	Diyo irurumen ti uray siasinoman a balo wenno ulila.	No mampabayes kayo na kuarta ed siopaman a took a mairap so bilay to, ag yo ipapasey sikayon dili a managpaabang tan ag yo pangaabangen.
EXO_022_0029	No aramidenyo ti kasta, siak, ni Yahweh, ipangagkonto ti asug dagiti agpatulong kaniak.	No alaen yoy kawes na sakey a too a sikatoy kaletan a bayaran to kayo, nepeg yon ipawil kasakbayan ya onselek so agew, lapud sikato labat so nayarian ton ikawes a pamapetang na laman to.
EXO_022_0030	Sumgedto ti pungtotko ket patayenkayto iti gubat.	Anto niy arum a kawes a nayarian ton iyogip?
EXO_022_0031	Mabalonto dagiti assawayo ket maulilanto dagiti annakyo.	No onkerew ed siak na tulong, ebatan ko lapud mapangasi ak.
EXO_022_0032	No umutang kadakayo ti siasinoman a napanglaw a tattaok, diyo tultuladen ti usurero a paanakanna ti ipautangna.	Ag kayo mansasalita na maoges sumpad Dios, tan ag yo isasamba so pangulo na saray totoo yo.
EXO_022_0033	No alaenyo ti kagay ti siasinoman a kas pangigawidyo iti utangna, masapul nga isubliyo sakbay a lumnek ti init; ta dayta laeng ti pagimengna pangpapudot iti bagina.	Iter yod siak, no nasabi lay nigetar a panaon, iray bagat yon trigo, alak, tan saray larak na oliba.
EXO_022_0034	Anianto pay ti pagturogna?	Iter yod siak iray pangulowan ya anak yon lalaki.
EXO_022_0035	Inton umasug kaniak a patulongan, ipangagkonto agsipud ta manangngaasiak.	Iter yod siak iray besag ya anak na baka tan karniro yo.
EXO_022_0036	Dikay agsao iti maibusor iti Dios ket diyo ilunod ti siasinoman a panguloyo.	Piamung yon pitoran agew ed ina to so besag a kalakyan, insan yo ibagat ed siak no kumawalon agew.
EXO_022_0037	Itedyo kaniak a dagus dagiti daton nga agtaud iti apit, iti arak ken iti lanayo no tiempo ti panagited.	Sikayo ray totook, kanyan ag yo kakanen so karni na dinanman ya ayep a pinatey na saray ayep ed takel; iter yo lad saray aso.
EXO_023_0001	Dikay agiwaras iti sao nga awan kinapudnona.	Ag yo iwawakawak so tila-tilan balita, tan ag yo tutulongan so toon nankasalanan diad pantasi yo na tila.
EXO_023_0002	Dikay tulongan ti tao a nagbasol babaen iti panagsaksiyo iti ulbod.	Ag kayo mibibiang ed saray karaklan no maoges so gagawaen da, o no mantasi ra na tila diad pamikewret dad katonungan.
EXO_023_0003	Diyo suroten ti kaaduan no agaramidda iti dakes wenno agulbodda tapno dadaelenda ti hustisia.	Ag yo kikilingan so mairap-bilay no salaysayen ed korti.
EXO_023_0004	Ngem diyo ipakita nga ayonanyo ti napanglaw bayat ti pannakaidarumna.	No nanengneng yon nablus so baka odino asno na kalaban yo, ipawil yod sikato.
EXO_023_0005	No makitayo a nakabulos ti baka wenno asno ti kabusoryo, tiliwenyo ket isubliyo kenkuana.	No niparokul so asno na mamobosul ed sikayo, lapud belat na awit to, tulongan yon onalagey lamet imay asno; ag kayo ompapaliis.
EXO_023_0006	No nakusbo ti asnona gapu iti nadagsen nga awitna, diyo baybay-an ngem tulonganyo ketdi a mangpatakder.	Ag yo pipikeweten so katonungan na mairap-bilay no onapireng ed korti.
EXO_023_0007	No maisaklang ti napanglaw, diyo ipaidam ti hustisia kenkuana.	Ag kayo mantitila ed pandalem yo, tan ag yo papateyen so toon matonung tan anggapoy kasalanan, ta ag ko ipasen a matonung so toon manggawa na ontan a kaogsan.
EXO_023_0008	Dikay agpabasol no awan pammaneknekyo.	Ag kayo mangaawat na pasoksok, ta say pasoksok bulagen to so too, kanyan ag to la nanengneng so katonungan, tan deralen to so kanepegan da ray anggapoy kasalanan.
EXO_023_0009	Diyo papatayen ti tao a nalinteg ken awan basolna.	Ag yo papairapen so sangkaili; amta yo so liknaan na sangkaili lapud sangkaili kayo met nen saman ed Egipto.
EXO_023_0010	Dusaek ti siasinoman nga agaramid iti kasta a kinadakes.	Diad loob na anem taon taneman yoy dalin yo tan ani yoy bunga da ray tanaman to.
EXO_023_0011	Dikay umawat iti pasuksok, ta ti pasuksok pagbulsekenna ti tao ket dina makita ti nalinteg ken dadaelenna ti kalintegan dagiti awan basolna.	Balet diad kumapiton taon pampainawa yoy dalin yo, tan ag yo aanien so bunga na ontubon tanaman.
EXO_023_0012	Diyo idadanes ti ganggannaet.	Nayarin kanen la na saray mairap-bilay so antokaman ya ontubod man, tan nayarin buagen la na saray ayayep ed katakelan so antokaman a natilak.
EXO_023_0013	Ammoyo ti rikna ti maysa a ganggannaet ta ganggannaetkayo met idi idiay Egipto.	Onya met so gawaen yo ed saray kaubasan yo tan saray kaolibaan yo.
EXO_023_0014	Mulaanyo ti dagayo iti las-ud ti innem a tawen ket urnongenyo ti maapit.	Mankimey kayo na anem agew ed loob na sakey simba, balet ag kayo mankikimey ed kumapiton agew, pian makapampainawa ray aripen tan saray sangkailin kumikimey yo, a pati saray ayayep yo.
EXO_023_0015	Ngem iti maikapito a tawen, diyo mulmulaan ket diyo met ap-apiten ti aniaman nga agtubo.	Dengel kayod amin a bengatlan imbagak ed sikayo, siak a Katawan .
EXO_023_0016	Bay-anyo nga agpaay kadagiti napanglaw ti aniaman nga agtubo ket baginto met dagiti atap nga animal ti matda.	Ag kayo mampipikasi ed arum a diriyos; ag yo anggan bibitlaen so kangaranan da.
EXO_023_0017	Kasta met ti aramidenyo kadagiti mulayo nga ubas ken olibo.	Diad loob na sakey taon mamitlo kayon mampista a pamagalang ed siak.
EXO_023_0018	Innem nga aldaw nga agtrabahokayo, ngem aginanakayo iti maikapito nga aldaw tapno makainana dagiti tagabu ken ganggannaet nga agtartrabaho kadakayo, kasta met dagiti baka ken asnoyo.	Diad bulan na Abib, say bulan ya intaynan yod Egipto, silibraan yo so Pista na Tinapay ya Anggapoy Libadura onung na ingganggan kod sikayo.
EXO_023_0019	Ipangagyo ti amin nga imbagak kadakayo.	Ag kayo mamangan na tinapay a pinaalsa ed libadura legan na pitoran agew na sayan pista.
EXO_023_0020	Dikay agkararag kadagiti didiosen wenno baliksen la koma dagiti naganda.	Ag kayo ondadagon mangigalang ed siak ya anggapoy awit yon bagat.
EXO_023_0021	Tallo a fiesta ti rambakanyo iti tinawen kas pammadayaw kaniak.	Silibraan yo so Pista na Panagani no igapo yo lan anien iray bungay tanaman yo.
EXO_023_0022	Iti bulan ti Abib, ti bulan nga ipapanawyo idi idiay Egipto, rambakanyo ti Fiesta ti Tinapay nga Awan Lebadurana.	Silibraan yo so Pista na saray Abung-abung diad samput na taon, no borboren yo la ray bunga na kaubasan yo tan arum a tanaman yo.
EXO_023_0023	Kas imbilinko kadakayo, tinapay laeng nga awan lebadurana ti kanenyo iti las-ud ti pito nga aldaw bayat ti fiesta.	Kapag taon diad sarayan taloran pista amin da ray lalaki ed sikayo et nepeg ya ondagon mangigalang ed siak a Katawan a Dios yo.
EXO_023_0024	Dikay umay agdaydayaw kaniak no awan ti idatonyo.	Ag kayo mangisasaklang na tinapay a pinaalsad libadura no mangibagat kayod siak na ayep.
EXO_023_0025	Rambakanyo ti Fiesta ti Panagapit babaen iti panangidatonyo ti umuna a maapit kadagiti talonyo.	Say taba na saray ayep ya imbagat ed siak legan na sarayan pista et ag nepeg ya ikera ya anggad ontombuk a kabwasan.
EXO_023_0026	Rambakanyo ti Fiesta ti Abong-abong iti panaggibus ti tawen, inton burasenyo ti bunga dagiti kaubasan ken minuyonganyo.	Iyakar yo ed abung na Katawan a Dios yo so sankaabigan ya onaan a trigon naani yo.
EXO_023_0027	Tunggal tawen, kadagitoy a fiesta, masapul nga umay dagiti amin a lallaki tapno agdaydayawda kaniak nga Apo a Diosyo.	Ag yo ilulutod gatas na ina to so kordiro odino kilaw na kanding.
EXO_023_0028	Diyo pakuyogan iti tinapay nga adda lebadurana ti dara ti animal nga idatonyo kaniak.	Mangibaki ak na sakey ya anghil ya onona nen say sikayo, ta iyagel to kayo legan na pambiahi yo tan iyakar to kayo ed pasen ya imparaan ko.
EXO_023_0029	Diyo met ipabigat ti taba dagiti animal a maidatag kaniak kadagitoy a fiesta.	Dengel kayod sikato tan onur yo.
EXO_023_0030	Yegyo iti balay ni Yahweh a Diosyo ti bunga ti umuna nga apit ti talonyo tunggal tawen.	Ag kayo onsusumlang ed sikato, ta ag to pirdonaen iray onsumlang ed sikato.
EXO_023_0031	Diyo lutoen ti urbon a karnero wenno kalding iti gatas ti inana.	Sikato so imbakik.
EXO_023_0032	Ibaonko ti maysa nga anghel nga umun-una ngem dakayo tapno salaknibannakayo iti panagdaliasatyo ken ipannakayo iti lugar nga insaganak.	Balet no onuren yo tan sumpalen yo ray amin ya ingganggan ko, siak so mibakal ed saray amin a kalaban yo.
EXO_023_0033	Ipangagyo ket tungpalenyo ti amin nga ibagana.	Onlan onona nen say sikayo so anghil ko tan iyakar to kayo ed dalin na saray Amorreo, saray Heteo, saray Perezeo, saray Cananeo, saray Heveo, tan saray Jebuseo, tan deralen ko ra.
EXO_023_0034	Diyo sukiren gapu ta siak ti nangibaon kenkuana ket dinto mapakawan ti siasinoman nga agsukir.	Ag kayo ondadakmomo odino mangigagalang ed saray diriyos da, tan ag yo aaligen iray kagagawa rad panangigalang da.
EXO_023_0035	Ngem no ipangagyo ket aramidenyo ti amin nga ibagak, gubatek dagiti amin a kabusoryo.	Deral yo ray diriyos da tan igeba yo ray masanton lusek da a bato.
EXO_023_0036	Idalannakayto ti anghelko.	No igalang yo ak a Katawan a Dios yo, bindisionan ta kayo na kanen tan inomen tan ekalen ko ray sakisakit yo.
EXO_023_0037	Ipannakayo iti daga dagiti Amorreo, Heteo, Perezeo, Cananeo, Heveo ken Jebuseo ket dadaelekto ida.	Diad dalin yo anggapoy biin naekalan, o biin lepes.
EXO_023_0038	Dikay agrukbab wenno agdaydayaw kadagiti didiosenda.	Itdan ta kayo na andokey a bilay.
EXO_023_0039	Diyo tuladen dagiti ar-aramidenda.	Pagmaliwen kon antakot ed siak iray totoon onsumlang ed sikayo; gewgewen ko ray totoon bakalen yo tan papoliktaren kon amin iray kalaban yo tan ibatikan da kayo.
EXO_023_0040	Dadaelenyo dagiti didiosenda ket rebbaenyo dagiti nasantoan a bato nga adigida.	Gawaen kon mangamanga ray kalaban yo; pagiten ko ray Heveo, saray Cananeo, tan saray Heteo legan na pankukurang yo.
EXO_023_0041	No agdaydayawkayo kaniak, ni Yahweh a Diosyo, ikkankayo iti makan ken danum ken ilisikayo kadagiti amin a kita ti sakit.	Ag ko ra pagiten ed loob na sakey taon; no pagiten ko rad loob na sakey taon, say dalin magmaliw a begtebegtew tan saray ayayep ed takel et ondakerakel iran onlaban ed sikayo.
EXO_023_0042	Iti dagayo, awanto ti babai a maalisan ket awanto met ti lupes.	Ingen, inot-inoten ko ran pagiten ya anggad magenap lay karakel yon mangayaryan na dalin.
EXO_023_0043	Ikkankayto iti atiddog a biag.	Ipasabik iray ketegan na dalin yo manlapud Dayat ya Akaba ya anggad Ilog na Eufrates, tan manlapud Dayat na Mediteraneo ya anggad kalawakan.
EXO_023_0044	Gapu iti aramidek, agbutengto kaniak dagiti amin a bumusor kadakayo ket kiburekto dagiti kagubatyo.	Paoleyan kod sikayo ray amin a totoon manaayam ed dalin na Canaan tan pagiten yo ra legan na pankukurang yo.
EXO_023_0045	Pagsanudekto amin a kabusoryo ket itarayandakayto.	Ag kayo misisipanan ed sikara odino anggan diad saray diriyos da.
EXO_023_0046	Kellaatekto dagiti kabusoryo ket agtataraydanto amin nga agkakaribuso.	Ag yo aabuloyan a manayam ed bansa yo ira man a totoo; no abuloyan yo ra sagyaten da kayon mankasalanan ed siak.
EXO_023_0047	Paksiatekto dagiti Heveo, Cananeo, ken Heteo inton sumungadkayo.	No mangigalang kayod saray diriyos da, andi-duaruwan patit ya ed sikayo.
EXO_024_0001	Kinuna ni Yahweh ken ni Moises, Sumang-atka ditoy bantay.	Say Katawan kuantod kinen Moises, Laen yo ak ed palandey, sikayo di Aaron, Nadab, Abiu, tan saray pitomplon pangulo na Israel; no arawi ki ni tuek kayo lan mangigalang ed siak.
EXO_024_0002	Itugotmo da Aaron, Nadab, Abiu ken ti pitopulo kadagiti panglakayen ti Israel.	Sika labat tan anggapo lay arum so onsingger ed siak.
EXO_024_0003	Inton adayokayo pay laeng iti ayanko, agkurnokayo iti panagdaydayaw.	Saray totoo et ag ira anggan onkalab a kaibam.
EXO_024_0004	Sikanto laeng ti umasideg.	Linmay Moises ed saray totoo tan sinalita tod sikaray amin ya ingganggan tan imbilin na Katawan , et amin da ray totoo nankakasakey iran inmebat, Gawaen mi ray amin ya imbaga na Katawan .
EXO_024_0005	Dinto umasideg dagiti kakadduam.	Insulat nen Moises ya amin iray ganggan na Katawan .
