id	book	chapter	sentence_no	source_text	target_text
EXO_021_1	EXO	021	1	No ilako ti maysa nga ama ti anakna a babai a kas tagabu, saanto a mawayawayaan daytoy a kas iti pannakawayawaya ti tagabu a lalaki.	Kung ipagbili ng isang lalaki ang kanyang anak na babae bilang isang alipin, hindi siya aalis na gaya ng pag-alis ng mga aliping lalaki.
EXO_021_1	EXO	021	1	No mailako iti agpanggep a mangasawa kenkuana ngem dinto kayat ti lalaki, masapul a sakaen met laeng ti amana.	Kung hindi siya kinalugdan ng kanyang amo na umangkin sa kanya bilang asawa, ay kanyang ipapatubos siya;
EXO_021_1	EXO	021	1	No adda agapa ket madunor ti maysa babaen iti bato wenno gemgemna, saan a madusa no saan a matay ti dinangranna. Ngem no maidalit ti nadangran,	Kapag may nag-away at sinaktan ng isang tao ang kanyang kapwa sa pamamagitan ng bato o ng kanyang kamay, at hindi namatay ang tao, kundi naratay sa higaan;
EXO_021_1	EXO	021	1	No gumatang ti maysa a tao iti babai a tagabu nga ipaasawana iti anakna, masapul nga ibilangna a kas bukodna nga anak.	Kung siya ay itinalaga niya para sa kanyang anak na lalaki, kanyang papakitunguhan siya tulad sa isang malayang anak na babae.
EXO_021_1	EXO	021	1	No dina tungpalen dagitoy a pagrebbengan, masapul a wayawayaanna ti babai ket saanen a masapul nga agbayad ti babai iti pannakawayawayana.	Kung hindi niya gawin ang tatlong bagay na ito para sa kanya, siya ay aalis na walang bayad, na walang itinubos na salapi.
EXO_021_1	EXO	021	1	Siasinoman a mangkabil iti maysa a tao a pakaigapuan ti ipapatayna, rumbeng met a mapapatay.	Sinumang manakit ng isang tao at mamatay ito, ay walang pagsalang papatayin.
EXO_021_1	EXO	021	1	No ubing a lalaki wenno babai ti mapatay ti baka, daytoy met laeng a linteg ti masurot.	Kung suwagin nito ang anak na lalaki o babae ng isang tao ay gagawin sa kanya ayon sa kahatulang ito.
EXO_021_1	EXO	021	1	Ngem no makapungtot ti maysa a tao ket igagarana a patayen ti sabali, masapul a mapapatay uray no agkamang iti altarko.	Kung magbalak ang sinuman sa kanyang kapwa na patayin siya nang pataksil, aalisin mo siya sa aking dambana upang siya'y mamatay.
EXO_021_1	EXO	021	1	Siasinoman a mangkabil iti ama wenno inana, rumbeng a mapapatay.	Ang manakit sa kanyang ama o sa kanyang ina ay papatayin.
EXO_021_1	EXO	021	1	Siasinoman a mangkidnap iti maysa a tao tapno ilako wenno tagabuenna, rumbeng a mapapatay.	Ang magnakaw ng isang tao, ipagbili man siya o matagpuan sa kanyang kamay, siya ay papatayin.
EXO_021_1	EXO	021	1	Siasinoman a mangilunod iti ama wenno iti inana, rumbeng a mapapatay.	Ang magmura sa kanyang ama, o sa kanyang ina ay papatayin.
EXO_021_2	EXO	021	2	Awan kalintegan ti amongna a mangilako kenkuana kadagiti ganggannaet ta saan a nasayaat ti panangtratarna kenkuana.	wala siyang karapatang ipagbili siya sa isang dayuhan, yamang siya'y hindi niya pinakitunguhan nang tapat.
EXO_021_2	EXO	021	2	Ket tagabunanto agingga't tungpal biagna.	at siya'y maglilingkod sa kanya habambuhay.
EXO_021_2	EXO	021	2	Ti lalaki laeng ti pumanawto.	ang kanyang asawa at ang kanyang mga anak ay magiging sa kanyang amo, at siya'y aalis na mag-isa.
EXO_021_2	EXO	021	2	Pagguduaanda met ti natay nga animal.	at ang patay ay paghahatian din nila.
EXO_021_2	EXO	021	2	Itedna ti kuarta iti akinkukua iti abut ket alaenna ti natay nga animal.	magbabayad siya ng salapi sa may-ari niyon, at ang patay na hayop ay magiging kanya.
EXO_021_2	EXO	021	2	nupay kasta, saan a madusa ti akimbaka.	subalit ang may-ari ng baka ay pawawalang-sala.
EXO_022_1	EXO	022	1	ta dayta laeng ti pagimengna pangpapudot iti bagina. Anianto pay ti pagturogna? Inton umasug kaniak a patulongan, ipangagkonto agsipud ta manangngaasiak.	Kung iyong kunin ang damit ng iyong kapwa bilang sangla, isasauli mo iyon sa kanya bago lumubog ang araw;
EXO_022_1	EXO	022	1	Ngem no madi ti ama ti babai nga ipaasawa ti anakna, masapul nga ited ti lalaki ti naituding a gatad ti sab-ong; yawatna daytoy iti ama ti babai.	At kung akitin ng isang lalaki ang isang dalaga na hindi pa naipagkakasundong mag-asawa at kanyang sipingan, kanyang ibibigay ang kanyang dote at gagawing kanyang asawa.
EXO_022_1	EXO	022	1	Masapul a bayadanna ti tinakawna. No awan ti pagbayadna, isu ti mailako. No ti natakaw nga animal, baka man wenno asno wenno karnero, ket masarakan a sibibiag iti ikutna, dua ti isukatna.	Kung ang isang magnanakaw ay mahuling pumapasok at siya'y hinampas na kanyang ikinamatay, hindi magkakaroon ng pananagutan sa dugo ang nakapatay,
EXO_022_1	EXO	022	1	No matiliwan ti mannanakaw nga agtaktakaw iti rabii iti maysa a balay ket mapapatay, awan sungsungbatan ti pimmatay. Ngem no mapasamak daytoy iti aldaw, makabasol ti pimmatay.	ngunit kung sikatan siya ng araw ay magkakaroon siya ng pananagutan sa dugo.
EXO_022_1	EXO	022	1	No ipaarab ti maysa a tao dagiti animalna ket makabulosda sada mapan araben ti mula ti sabali a tao, masapul nga isukatna dagiti kasayaatan nga apit iti bukodna a talon wenno kaubasan.	Kung ang ninakaw ay matagpuang buhy sa kanyang kamay, maging baka o asno, o tupa, ay magbabayad siya ng doble.
EXO_022_1	EXO	022	1	No agpuor ti maysa a tao iti talonna ket agkayamkam ti apuy a mangsilmut kadagiti ruot iti talon ti sabali ket mapuoran dagiti dumakdakkel a trigo wenno dagiti pempen a dawa, masapul a bayadan ti nagpuor ti amin a nadadael.	Kung ang sinuman ay magpastol sa isang bukid, o sa isang ubasan, at pakawalan ang kanyang hayop at manginain sa bukid ng iba, siya'y magsasauli mula sa pinakamainam sa kanyang sariling bukid, at mula sa kanyang sariling ubasan.
EXO_022_1	EXO	022	1	No italek ti maysa a tao ti kuarta wenno aniaman a sanikuana iti sabali a tao ket matakaw dagitoy iti balay ti nagpaidulinanna, doble ti pagbayad ti matiliwan a nangtakaw.	Kung may magningas na apoy at umabot sa mga tinik, na anupa't ang mga mandala, o ang mga uhay, o ang bukid ay masunog, ang nagpaningas ng apoy ay magbabayad ng buo.
EXO_022_1	EXO	022	1	No saan a masarakan ti nagtakaw, maidatag ti nagpaidulinanna iti Dios ket isapatana a dina tinakaw dagiti sanikua.	Kung ang sinuman ay magpatago sa kanyang kapwa ng salapi o pag-aari, at ito'y ninakaw sa bahay ng taong iyon, at pagkatapos, kung matagpuan ang magnanakaw, magbabayad siya ng doble.
EXO_022_1	EXO	022	1	Amin a kaso a pakaseknan iti sanikua, baka man wenno asno wenno karnero wenno pagan-anay wenno aniaman a napukaw, maipanda iti imatang ti Dios. Maidatag iti pagdaydayawan dagiti mangibaga a kukuada ti sanikua, ket ti siasinoman a sentensiaan ti Dios, doble ti bayadanna iti pudno nga agtagikua.	Kung hindi matagpuan ang magnanakaw, lalapit ang may-ari ng bahay sa Diyos, upang ipakita kung pinakialaman niya o hindi ang pag-aari ng kanyang kapwa.
EXO_022_1	EXO	022	1	No umanamong ti maysa a tao nga aywananna ti asno wenno baka wenno karnero wenno uray ania nga animal ti sabali a tao, ket matay ti animal wenno masugatan wenno maitalaw, no awan ti makasaksi iti naaramid, masapul nga	Sapagkat sa lahat ng pagsuway, maging para sa baka, sa asno, sa tupa, sa kasuotan, o sa anumang bagay na nawala, na may magsabi na iyon nga ay sa kanya, dadalhin sa harapan ng Diyos ang usapin ng dalawa; ang parurusahan ng Diyos ay magbabayad ng doble sa kanyang kapwa.
EXO_022_1	EXO	022	1	agsapata ti nagan ti Apo iti disso a pagdaydayawan a dina tinakaw ti animal.	Kung ang sinuman ay maghabilin sa kanyang kapwa ng isang asno, o ng isang baka, o ng isang tupa, o ng anumang hayop;
EXO_022_1	EXO	022	1	Dakayo dagiti tattaok, isu a dikay agsida iti karne ti animal a pinatay dagiti narungsot nga ayup.	Gayundin ang gagawin mo sa iyong mga baka at sa iyong mga tupa: pitong araw itong makakasama ng kanyang ina;
EXO_022_1	EXO	022	1	Ngem no matakaw ti animal, masapul nga agbayad ti agaywan.	ang pagsumpa nilang dalawa sa Panginoon ang mamamagitan sa kanila upang makita kung pinakialaman niya o hindi ang pag-aari ng kanyang kapwa; at tatanggapin ng may-ari ang sumpa, at siya'y hindi magsasauli.
EXO_022_1	EXO	022	1	No pinatay dagiti narungsot nga animal, masapul nga ipakita ti agaywan ti narangrangkay nga animal a kas pammaneknek. Saan a nasken a bayadanna ti pinatay dagiti narungsot nga animal.	Subalit kung ninakaw ito sa kanya ay isasauli niya iyon sa may-ari.
EXO_022_1	EXO	022	1	No buloden ti maysa a tao ti animal ti sabali ket masugatan wenno matay a saan a nakita ti akinkukua, masapul a bayadanna ti animal.	Kung nilapa ito ng mga hayop, dadalhin niya ito bilang katibayan; hindi siya magsasauli ng anumang nilapa.
EXO_022_1	EXO	022	1	Ngem no mapasamak ti kasta iti imatang ti akinkukua, saan a masapul nga agbayad ti nangbulod. No naabangan ti animal, umdas ti abangna a pagbayadna iti natay nga animal.	Kung ang sinuman ay humiram ng anuman sa kanyang kapwa, at nasaktan ito, o namatay, na hindi kaharap ang may-ari, ang humiram ay magsasauli ng buo.
EXO_022_1	EXO	022	1	No sulisogen ti maysa a lalaki ti balasang a birhen a saan a naitulag a mayasawa ket kaiddaenna, masapul nga ikasarna ti babai kalpasan iti pannangtedna iti sab-ong.	Kung ang may-ari niyon ay kaharap, hindi siya magsasauli; kung ito'y inupahan, dumating ito para sa upa nito.
EXO_022_1	EXO	022	1	No takawen ti maysa a tao ti maysa a baka wenno karnero ken partienna wenno ilakona, lima a baka ti isukatna iti maysa a baka ken uppat met a karnero ti isukatna iti maysa a karnero.	Kung ang isang tao ay magnakaw ng isang baka, o ng tupa at patayin, o ipagbili, siya'y magbabayad ng limang baka para sa isang baka, at ng apat na tupa para sa isang tupa. Ang magnanakaw ay gagawa ng pagsasauli; kung wala siyang maisauli, siya'y ipagbibili dahil sa kanyang pagnanakaw.
EXO_022_1	EXO	022	1	Papatayenyo ti babai a manggagamud.	Kung mahigpit na tumutol ang kanyang ama na ibigay siya sa kanya, ay magbabayad siya ng salapi katumbas ng dote para sa mga dalaga.
EXO_022_1	EXO	022	1	Papatayenyo ti siasinoman a makikaidda iti animal.	Huwag mong pahintulutang mabuhay ang isang babaing mangkukulam.
EXO_022_1	EXO	022	1	Papatayenyo ti siasinoman nga agidaton iti uray ania a didiosen, ta siak laeng, ni Yahweh, ti pagidatonan.	Sinumang sumiping sa isang hayop ay papatayin.
EXO_022_1	EXO	022	1	Diyo ranggasan wenno idadanes ti ganggannaet. Laglagipenyo a ganggannaetkayo met idi idiay Egipto.	Ang maghandog sa alinmang diyos, maliban sa Panginoon lamang, ay lubos na pupuksain.
EXO_022_1	EXO	022	1	Diyo irurumen ti uray siasinoman a balo wenno ulila.	At huwag mong aapihin, o pahihirapan ang dayuhan, sapagkat kayo'y mga dayuhan din sa lupain ng Ehipto.
EXO_022_1	EXO	022	1	No aramidenyo ti kasta, siak, ni Yahweh, ipangagkonto ti asug dagiti agpatulong kaniak.	Huwag ninyong pahihirapan ang sinumang babaing balo, o batang ulila.
EXO_022_1	EXO	022	1	Sumgedto ti pungtotko ket patayenkayto iti gubat. Mabalonto dagiti assawayo ket maulilanto dagiti annakyo.	Kung iyong pahihirapan sila sa anumang paraan, at dumaing sa akin, tiyak na aking diringgin ang kanilang daing;
EXO_022_1	EXO	022	1	No umutang kadakayo ti siasinoman a napanglaw a tattaok, diyo tultuladen ti usurero a paanakanna ti ipautangna.	ang aking poot ay mag-aalab, at papatayin ko kayo ng tabak, at ang inyong mga asawa ay magiging mga balo, at ang inyong mga anak ay magiging mga ulila.
EXO_022_1	EXO	022	1	No alaenyo ti kagay ti siasinoman a kas pangigawidyo iti utangna, masapul nga isubliyo sakbay a lumnek ti init;	Kung magpautang ka ng salapi sa kaninuman sa aking bayan sa dukhang kasama mo, huwag mo silang papakitunguhan bilang tagapagpautang; huwag mo siyang papatungan ng tubo.
EXO_022_1	EXO	022	1	Dikay agsao iti maibusor iti Dios ket diyo ilunod ti siasinoman a panguloyo.	sapagkat iyon lamang ang kanyang saplot, iyon ang kanyang pantakip sa kanyang katawan, ano pa ang kanyang ipapantulog? At kapag siya'y dumaing sa akin ay aking diringgin sapagkat ako'y mahabagin.
EXO_022_1	EXO	022	1	Itedyo kaniak a dagus dagiti daton nga agtaud iti apit, iti arak ken iti lanayo no tiempo ti panagited.	Huwag mong lalapastanganin ang Diyos, ni lalaitin man ang pinuno ng iyong bayan.
EXO_022_1	EXO	022	1	Itedyo kaniak ti inauna nga anakyo a lalaki,	Huwag mong ipagpapaliban ang paghahandog ng mula sa iyong mga ani, at ng mula sa umagos sa iyong mga pisaan.
EXO_022_1	EXO	022	1	agraman ti inauna a kalakian dagiti baka ken karneroyo; agyan pay laeng ti urbon iti inana iti las-ud ti pito nga aldaw ket maidaton kaniak iti maikawalo nga aldaw.	Ang panganay sa iyong mga anak na lalaki ay ibibigay mo sa akin.
EXO_022_2	EXO	022	2	No saan a natakaw ti animal, ibilang ti akinkukua a kas pukawna ket saan a masapul nga agbayad ti nangaywan.	at namatay ito, o nasaktan, o hinuli, na walang nakakakitang sinuman,
EXO_022_2	EXO	022	2	Itedyo ketdi dagitoy kadagiti aso.	sa ikawalong araw ay ibibigay mo ito sa akin.
EXO_023_1	EXO	023	1	Yegyo iti balay ni Yahweh a Diosyo ti bunga ti umuna nga apit ti talonyo tunggal tawen.	Huwag mong pakukuluan ang batang kambing sa gatas ng kanyang ina.
EXO_023_1	EXO	023	1	Ipangagyo ti amin nga imbagak kadakayo.	Ingatan ninyo ang lahat ng mga bagay na aking sinabi sa inyo;
EXO_023_1	EXO	023	1	Dikay agiwaras iti sao nga awan kinapudnona.	Huwag kang magkakalat ng di-totoong balita.
EXO_023_1	EXO	023	1	Diyo suroten ti kaaduan no agaramidda iti dakes wenno agulbodda tapno dadaelenda ti hustisia.	Huwag kang susunod sa marami upang gumawa ng masama, ni magbibigay patotoo sa isang usapin na kumakampi sa marami upang baluktutin ang katarungan;
EXO_023_1	EXO	023	1	Ngem diyo ipakita nga ayonanyo ti napanglaw bayat ti pannakaidarumna.	ni huwag mo ring papanigan ang dukha sa kanyang usapin.
EXO_023_1	EXO	023	1	No makitayo a nakabulos ti baka wenno asno ti kabusoryo, tiliwenyo ket isubliyo kenkuana.	Kung iyong makita ang baka ng iyong kaaway o ang kanyang asno na nakawala, ito ay ibabalik mo sa kanya.
EXO_023_1	EXO	023	1	No nakusbo ti asnona gapu iti nadagsen nga awitna, diyo baybay-an ngem tulonganyo ketdi a mangpatakder.	Kung iyong makita ang asno ng napopoot sa iyo na nakalugmok sa ilalim ng kanyang pasan, huwag mo siyang iiwan sa gayong kalagayan, tulungan mo siyang buhatin ito.
EXO_023_1	EXO	023	1	No maisaklang ti napanglaw, diyo ipaidam ti hustisia kenkuana.	Huwag mong babaluktutin ang katarungang nararapat sa iyong dukha sa kanyang usapin.
EXO_023_1	EXO	023	1	Dikay agpabasol no awan pammaneknekyo. Diyo papatayen ti tao a nalinteg ken awan basolna. Dusaek ti siasinoman nga agaramid iti kasta a kinadakes.	Layuan mo ang maling paratang at huwag mong papatayin ang walang sala at ang matuwid, sapagkat hindi ko pawawalang-sala ang masama.
EXO_023_1	EXO	023	1	Dikay umawat iti pasuksok, ta ti pasuksok pagbulsekenna ti tao ket dina makita ti nalinteg ken dadaelenna ti kalintegan dagiti awan basolna.	Huwag kang tatanggap ng suhol, sapagkat ang suhol ay bumubulag sa mga pinuno at sinisira ang mga salita ng mga banal.
EXO_023_1	EXO	023	1	Diyo idadanes ti ganggannaet. Ammoyo ti rikna ti maysa a ganggannaet ta ganggannaetkayo met idi idiay Egipto.	Ang dayuhan ay huwag mong aapihin, sapagkat alam ninyo ang puso ng dayuhan yamang kayo'y naging mga dayuhan sa lupain ng Ehipto.
EXO_023_1	EXO	023	1	Mulaanyo ti dagayo iti las-ud ti innem a tawen ket urnongenyo ti maapit.	Anim na taong hahasikan mo ang iyong lupa at aanihin mo ang bunga niyon;
EXO_023_1	EXO	023	1	Ngem iti maikapito a tawen, diyo mulmulaan ket diyo met ap-apiten ti aniaman nga agtubo.	subalit sa ikapitong taon ay iyong pagpahingahin ito at hayaang tiwangwang, upang ang dukha sa iyong bayan ay makakain.
EXO_023_1	EXO	023	1	Innem nga aldaw nga agtrabahokayo, ngem aginanakayo iti maikapito nga aldaw tapno makainana dagiti tagabu ken ganggannaet nga agtartrabaho kadakayo, kasta met dagiti baka ken asnoyo.	Anim na araw na gagawin mo ang iyong gawain, ngunit sa ikapitong araw ay magpapahinga ka upang ang iyong baka at ang iyong asno ay makapagpahinga, at ang anak na lalaki ng iyong aliping babae, at ang taga-ibang bayan ay makapagpahinga.
EXO_023_1	EXO	023	1	Tallo a fiesta ti rambakanyo iti tinawen kas pammadayaw kaniak.	Tatlong beses sa bawat taon na magdiriwang ka ng pista para sa akin.
EXO_023_1	EXO	023	1	Iti bulan ti Abib, ti bulan nga ipapanawyo idi idiay Egipto, rambakanyo ti Fiesta ti Tinapay nga Awan Lebadurana.	Ang pista ng tinapay na walang pampaalsa ay iyong ipagdiriwang;
EXO_023_1	EXO	023	1	Rambakanyo ti Fiesta ti Panagapit babaen iti panangidatonyo ti umuna a maapit kadagiti talonyo.	Iyong ipagdiriwang ang pista ng pag-aani ng mga unang bunga ng iyong pagpapagal, na iyong inihasik sa bukid. Ipagdiriwang mo rin ang pista ng pag-aani, sa katapusan ng taon, kapag inaani mo mula sa bukid ang bunga ng iyong pagpapagal.
EXO_023_1	EXO	023	1	Rambakanyo ti Fiesta ti Abong-abong iti panaggibus ti tawen, inton burasenyo ti bunga dagiti kaubasan ken minuyonganyo.	Tatlong ulit sa bawat taon na ang lahat ng iyong mga kalalakihan ay haharap sa Panginoong Diyos .
EXO_023_1	EXO	023	1	Tunggal tawen, kadagitoy a fiesta, masapul nga umay dagiti amin a lallaki tapno agdaydayawda kaniak nga Apo a Diosyo.	Huwag mong iaalay ang dugo ng aking handog na kasabay ng tinapay na may pampaalsa; o iiwan mo man ang taba ng aking pista hanggang sa kinaumagahan.
EXO_023_1	EXO	023	1	Diyo pakuyogan iti tinapay nga adda lebadurana ti dara ti animal nga idatonyo kaniak. Diyo met ipabigat ti taba dagiti animal a maidatag kaniak kadagitoy a fiesta.	Ang mga pinakauna ng mga unang bunga ng iyong lupa ay iyong dadalhin sa bahay ng Panginoon mong Diyos.
EXO_023_1	EXO	023	1	Diyo lutoen ti urbon a karnero wenno kalding iti gatas ti inana.	Aking isinusugo ang isang anghel sa unahan mo, upang ingatan ka sa daan, at upang dalhin ka sa dakong aking inihanda.
EXO_023_1	EXO	023	1	Ibaonko ti maysa nga anghel nga umun-una ngem dakayo tapno salaknibannakayo iti panagdaliasatyo ken ipannakayo iti lugar nga insaganak.	Mag-ingat kayo sa harap niya at dinggin ninyo ang kanyang tinig; huwag kayong maghimagsik sa kanya, sapagkat hindi niya patatawarin ang inyong pagsuway, sapagkat ang aking pangalan ay nasa kanya.
EXO_023_1	EXO	023	1	Dikay makitulag kadakuada wenno kadagiti didiosenda.	Sila'y hindi dapat manirahan sa iyong lupain, baka gawin pa nilang magkasala ka laban sa akin; sapagkat kung ikaw ay maglingkod sa kanilang mga diyus-diyosan, tiyak na magiging bitag iyon sa iyo.
EXO_023_1	EXO	023	1	Mangruginto ti beddengyo iti Baybay a Nalabaga agingga iti Baybay a Mediterranean ken manipud let-ang agingga iti Karayan Eufrates. Ikkankayto iti pannakabalin a mangparmek kadagiti taga-sadiay ket pagtalawenyonto ida iti isusungadyo.	Huwag kang makikipagtipan sa kanila, ni sa kanilang mga diyus-diyosan.
EXO_023_1	EXO	023	1	In-inutekto a papanawen ida agingga nga umadukayo ket kabaelanyo a tagikuaen ti daga.	Aking ilalagay ang iyong hangganan mula sa Dagat na Pula hanggang sa dagat ng Filistia, at mula sa ilang hanggang sa Eufrates sapagkat aking ibibigay sa iyong kamay ang mga nananahan sa lupain at iyong papalayasin sila sa harapan mo.
EXO_023_1	EXO	023	1	Saankonto pay laeng a pagtalawen amin ida iti uneg ti maysa a tawen tapno saan a mabaybay-an ti daga ken saan nga umadu unay dagiti atap nga animal a pagpeggadanyo.	Unti-unti ko silang papalayasin sa harapan mo, hanggang sa ikaw ay dumami at manahin mo ang lupain.
EXO_023_1	EXO	023	1	Ipangagyo ket tungpalenyo ti amin nga ibagana. Diyo sukiren gapu ta siak ti nangibaon kenkuana ket dinto mapakawan ti siasinoman nga agsukir.	Subalit kung diringgin mong mabuti ang kanyang tinig at gagawin mo ang lahat ng aking sinasabi ay magiging kaaway ako ng iyong mga kaaway, at kalaban ng iyong mga kalaban.
EXO_023_1	EXO	023	1	Kellaatekto dagiti kabusoryo ket agtataraydanto amin nga agkakaribuso.	Hindi ko sila papalayasin sa harapan mo sa loob ng isang taon;
EXO_023_1	EXO	023	1	Gapu iti aramidek, agbutengto kaniak dagiti amin a bumusor kadakayo ket kiburekto dagiti kagubatyo. Pagsanudekto amin a kabusoryo ket itarayandakayto.	Aking susuguin sa unahan mo ang mga putakti na magpapalayas sa Heveo, sa Cananeo, at Heteo sa harapan mo.
EXO_023_1	EXO	023	1	Iti dagayo, awanto ti babai a maalisan ket awanto met ti lupes. Ikkankayto iti atiddog a biag.	Aking susuguin ang sindak sa unahan mo, at lilituhin ko ang buong bayan na iyong paroroonan, at aking patatalikurin sa iyo ang lahat ng iyong mga kaaway.
EXO_023_1	EXO	023	1	No agdaydayawkayo kaniak, ni Yahweh a Diosyo, ikkankayo iti makan ken danum ken ilisikayo kadagiti amin a kita ti sakit.	Walang babaing makukunan, o magiging baog man sa iyong lupain; aking lulubusin ang bilang ng iyong mga araw.
EXO_023_1	EXO	023	1	Dikay agrukbab wenno agdaydayaw kadagiti didiosenda. Diyo tuladen dagiti ar-aramidenda. Dadaelenyo dagiti didiosenda ket rebbaenyo dagiti nasantoan a bato nga adigida.	Inyong sasambahin ang Panginoon ninyong Diyos, at aking pagpapalain ang inyong tinapay at ang inyong tubig, at aalisin ko ang sakit sa gitna ninyo.
EXO_023_1	EXO	023	1	Idalannakayto ti anghelko. Ipannakayo iti daga dagiti Amorreo, Heteo, Perezeo, Cananeo, Heveo ken Jebuseo ket dadaelekto ida.	Huwag kang yuyukod sa kanilang mga diyos, o maglilingkod man sa mga iyon, o gagawa man ng ayon sa kanilang mga gawa, kundi iyong wawasakin at iyong dudurugin ang kanilang mga haligi.
EXO_023_1	EXO	023	1	Ngem no ipangagyo ket aramidenyo ti amin nga ibagak, gubatek dagiti amin a kabusoryo.	Sapagkat ang aking anghel ay hahayo sa unahan mo at dadalhin ka sa mga Amoreo, mga Heteo, mga Perezeo, mga Cananeo, mga Heveo, at sa mga Jebuseo, at aking lilipulin sila.
EXO_023_2	EXO	023	2	Dikay tulongan ti tao a nagbasol babaen iti panagsaksiyo iti ulbod.	Huwag kang makikipagkapit-kamay sa taong masama upang maging isang saksing may masamang hangarin.
EXO_023_2	EXO	023	2	Bay-anyo nga agpaay kadagiti napanglaw ti aniaman nga agtubo ket baginto met dagiti atap nga animal ti matda.	Ang kanilang maiiwan ay kakainin ng hayop sa bukid.
EXO_023_2	EXO	023	2	Paksiatekto dagiti Heveo, Cananeo, ken Heteo inton sumungadkayo.	baka ang lupa'y maging ilang, at ang mababangis na hayop ay magsidami laban sa iyo.
EXO_023_2	EXO	023	2	Dikay agkararag kadagiti didiosen wenno baliksen la koma dagiti naganda.	at huwag ninyong banggitin ang pangalan ng ibang diyos, o marinig man sa inyong bibig.
EXO_023_2	EXO	023	2	Kas imbilinko kadakayo, tinapay laeng nga awan lebadurana ti kanenyo iti las-ud ti pito nga aldaw bayat ti fiesta.	pitong araw na kakain ka ng tinapay na walang pampaalsa, gaya ng iniutos ko sa iyo, sa takdang panahon, sa buwan ng Abib, sapagkat noon ka umalis sa Ehipto.
EXO_023_3	EXO	023	3	Dikay umay agdaydayaw kaniak no awan ti idatonyo.	Walang lalapit sa harap ko na walang dala.
EXO_023_3	EXO	023	3	Kasta met ti aramidenyo kadagiti mulayo nga ubas ken olibo.	Gayundin ang iyong gagawin sa iyong ubasan at sa iyong taniman ng olibo.
EXO_024_1	EXO	024	1	Inkabil ni Moises kadagiti palanggana ti kagudua ti dara dagiti napapatay nga animal ket insuyatna iti altar ti nabati.	Kanyang kinuha ang aklat ng tipan, binasa sa pandinig ng bayan, at kanilang sinabi, Lahat ng sinabi ng Panginoon ay aming gagawin, at kami ay magiging masunurin.
EXO_024_1	EXO	024	1	Innala ni Moises ti dara nga adda kadagiti palanggana ket winarisanna dagiti tattao. Kinunana, Daytoy ti dara a mangpatalged iti pannakitulag ti Apo kadakayo idi intedna amin dagitoy a bilin.	Nang magkagayo'y umakyat sina Moises, Aaron, Nadab, at Abihu, at ang pitumpung matatanda sa Israel,
EXO_024_1	EXO	024	1	Bimmaba iti rabaw ti bantay ti makapurar a lawag a mangipakdaar iti kaadda ni Yahweh. Iti panagkita dagiti Israelita, ti lawag ket kasla apuy a gumilgil-ayab iti tapaw ti bantay. Innem nga aldaw a kinumotan ti ulep ti bantay. Iti maikapito nga aldaw, manipud iti ulep, inawagan ni Yahweh ni Moises.	Noon, ang anyo ng kaluwalhatian ng Panginoon ay tulad ng apoy na nagliliyab sa ibabaw ng taluktok ng bundok, sa paningin ng mga anak ni Israel.
EXO_024_1	EXO	024	1	Iti agsapa iti sumuno nga aldaw, nangbangon iti altar iti arisadsad ti bantay ken nangipatakder iti 12 a baton-lagip a mangibagi kadagiti 12 a tribu ti Israel.	Kanyang sinugo ang mga kabataang lalaki mula sa mga anak ni Israel, na nag-alay ng mga handog na sinusunog at nag-alay ng mga baka bilang handog pangkapayapaan sa Panginoon .
EXO_024_1	EXO	024	1	Kalpasanna, binilinna ti sumagmamano nga agtutubo a lallaki a mangpuor kadagiti animal a kas sagut ken ni Yahweh ken mangidatag iti sumagmamano a toro a baka a kas daton a pakikappia.	Kinuha ni Moises ang kalahati ng dugo at inilagay sa mga palanggana, at ang kalahati ng dugo ay iwinisik sa ibabaw ng dambana.
EXO_024_1	EXO	024	1	Napan imbaga ni Moises kadagiti tattao ti amin a bilin ken alagaden nga inted ni Yahweh.	Dumating si Moises at sinabi sa bayan ang lahat ng mga salita ng Panginoon at ang lahat ng mga tuntunin;
EXO_024_1	EXO	024	1	Simrek ni Moises iti ulep iti isasang-atna iti bantay.	Pumasok si Moises sa ulap, at umakyat sa bundok.
EXO_024_1	EXO	024	1	Kinuna ni Yahweh ken ni Moises, Sumang-atka ditoy bantay. Itugotmo da Aaron, Nadab, Abiu ken ti pitopulo kadagiti panglakayen ti Israel. Inton adayokayo pay laeng iti ayanko, agkurnokayo iti panagdaydayaw.	Kanyang sinabi kay Moises, Umakyat ka sa kinaroroonan ng Panginoon , ikaw, at sina Aaron, Nadab at Abihu, at pitumpu sa matatanda sa Israel, at sumamba kayo mula sa malayo.
EXO_024_1	EXO	024	1	Simmang-at ni Moises ket adda ulep a nangkumot iti Bantay Sinai.	Ang kaluwalhatian ng Panginoon ay nanatili sa ibabaw ng bundok ng Sinai, at tinakpan ito ng ulap ng anim na araw; at sa ikapitong araw ay tinawag niya si Moises sa gitna ng ulap.
EXO_024_1	EXO	024	1	Sikanto laeng ti umasideg. Dinto umasideg dagiti kakadduam.	Si Moises lamang ang lalapit sa Panginoon ;
EXO_024_1	EXO	024	1	Innalana ti libro ti tulag a nakailanadan dagiti bilin ni Yahweh sana binasa iti napigsa. Kinuna dagiti tattao, Agtulnogkami iti Apo ket tungpalenmi amin nga imbilinna.	At kinuha ni Moises ang dugo at iwinisik sa bayan, at sinabi, Tingnan ninyo ang dugo ng tipan na ginawa ng Panginoon sa inyo ayon sa lahat ng mga salitang ito.
