id	book	chapter	sentence_no	source_text	target_text
EXO_001_1	EXO	001	1	Ang hari nagsiling sa iya mga ginsakpan, Tan-awa ninyo, ini nga mga tawo nga Israelinhon nagadamo kag nagabakod, kag nabutang kita sa katalagman.	Nganang sinabi karing sasakupan na, Lawan yu, mas dakal la at masikan kesa kekatamu deting Israelita.
EXO_001_1	EXO	001	1	Karon pamatii ninyo! Pangitaan naton sang paagi nga indi na gid sila magdamo.	Nung sakaling lusuban da katamu ding kalaban pota makikampi la pa karela at kaybat takasan de ing bansa tamu.
EXO_001_1	EXO	001	1	Ruben, Simeon, Levi, Juda,	i Ruben, Simeon, Levi, Juda,
EXO_001_1	EXO	001	1	Isacar, Zabulon, Benjamin,	Isacar, Zebulun, Benjamin,
EXO_001_1	EXO	001	1	Dan, Neftali, Gad, kag Aser.	Dan, Neftali, Gad ampon i Aser.
EXO_001_1	EXO	001	1	Ang kadamuon sang mga kaliwat ni Jacob setenta tanan.	Pitu lang pulu kabilangan ding heganaganang lahi nang Jacob.
EXO_001_1	EXO	001	1	Dayon ang hari nagmando sa tanan niya nga mga ginsakpan: Ihaboy ninyo sa Suba sang Nilo ang tagsa ka bata nga lalaki nga matawo sa mga Hebreo, pero pabay-i lang ninyo ang mga bata nga babayi nga mabuhi.	Uling atin lang takut ding ilut king Dios, binendisyunan na la ning Dios at dininan sarasariling pamilya.
EXO_001_1	EXO	001	1	Sang ulihi si Jose kag ang iya mga utod nga lalaki nagkalamatay, subong man yadtong bug-os nga henerasyon.	Kaybat na nita, mete ya i Jose at ding sabla nang kapatad ampon ding anak da ring anak da.
EXO_001_1	EXO	001	1	Pero ang mga kaliwat ni Israel may madamo nga mga kaanakan, nagmuad gid sila kag nagmabakod, sa bagay nga naglapnag sila sa duta sang Ehipto.	Oneng menganak la ding Israelita a lahi da at merakal na lang merakal; mabilis lang merakal at tutung masikan angga king milaganapan ya karela ing Ehipto.
EXO_001_1	EXO	001	1	Karon may isa ka bag-o nga hari nga naggahom sa Ehipto. Wala sia makakilala kay Jose.	Linabas ing panaun at ing Ehipto mika bayu yang ari a ala nang bitasang balu tungkul kang Jose.
EXO_001_1	EXO	001	1	Amo ini ang mga ngalan sang mga anak nga lalaki ni Jacob nga nagkadto sa Ehipto upod sa iya, ang tagsatagsa upod sa iya panimalay. Sila amo sanday	Oreti ding lagyu da ring anak nang lalaking Jacob a minta karin Ehipto a kayabe na at ding pamilya ra
EXO_001_1	EXO	001	1	Bangod kay nagakahadlok ang mga paltera sa Dios, ang Dios nagmaayo sa ila kag ginhatagan niya sila sang ila kaugalingon nga mga panimalay kag nagdamo nga nagdamo ang mga Israelinhon, kag nangingamhanan sila.	Metula ya ing Dios karing ilut at lalu lang merakal ampon mesikan ding Israelita.
EXO_001_1	EXO	001	1	Pero ang mga paltera wala magtuman sa hari kay nahadlok sila sa Dios.	Oneng ding ilut, uli na ning takut da king Dios, e ra pemintuan ing utus na ning ari.
EXO_001_1	EXO	001	1	Gani ginbutangan sila sing mga mapintas nga mga kabo sa pagpaobra sa ila sing pataypatay agod magluya sila.	Inya mibili lang kapatas karing Israelita ban pasakitan da la king kapamilatan na ning mabayat a obra.
EXO_001_1	EXO	001	1	Nagsabat sila, Ang mga babayi nga Hebreo indi pareho sang mga babayi nga Ehiptohanon; mahapos sila magbata nga sa wala pa gani kami makaabot nakabata na sila.	Ngarang mekibat ding ilut king ari, Kasi pu deng babaing Hebreo e ra la pu kalupa ding babai tamu keti Ehipto; e la pu magkasakit manganak at akakua rang makapanganak bayu na akuang datang ning ninuman kekami.
EXO_001_1	EXO	001	1	Pero sa nagadugang ang pagpigos sang mga Ehiptohanon sa mga Israelinhon, tapat pa gani nga nagadamo kag nagalapnag sila.	Oneng kabang pasakitan da la ring Israelita kanita la lalung merakal at mikalat.
EXO_001_1	EXO	001	1	Gani ginpatawag sang hari ang mga paltera kag ginpamangkot, Ngaa bala nga ginhimo ninyo ini kag ginpabay-an nga mabuhi ang mga lapsag nga lalaki?	Inya pepayaus na la ning ari ning Ehipto at ngana karela, Obat makanyan ing depat yu? Obat pepaburen yu lang mebie ding anak a lalaki?
EXO_001_1	EXO	001	1	Gani mapintas nga gin-ulipon nila ang mga Israelinhon,	Inya lalu da la pang inalipusta.
EXO_001_1	EXO	001	1	kag ginpabudlay ang ila pagkabuhi paagi sa pagpaobra sa ila sa lunang kag sa tisa, kag sang tanan nga sahi sang obra sa uma. Ginpilit nila sila sa paghimo sang tanan nga mabug-at nga mga obra.	At alang lunus da lang pepagawan laryu at binie da karela ing sablang mabayat a obra king marangle.
EXO_001_1	EXO	001	1	Dayon ang hari sang Ehipto naghambal sa mga paltera nga nagapabata sa mga babayi nga mga Hebreo. Ang isa ginhingalanan kay Sipra kag ang isa kay Pua.	Misan a aldo, pekisabian na la ning ari na ning Ehipto di Sipra at Pua, ding aduang ilut a papanganak karing babaing Hebreo.
EXO_001_1	EXO	001	1	Nagsiling ang hari, Kon nagapabata kamo sang Hebreo nga mga babayi amo ini ang inyo pagahimuon: kon ang lapsag lalaki, patyon ninyo; pero kon babayi ini, pabayai lang nga mabuhi.	Ngana karela, Potang papanganak kayu, kabud akit yu king ing anak a mibait lalaki ya, paten ye. Nung babai ya paburen yeng mie.
EXO_001_2	EXO	001	2	Si Jose nga iya anak didto na nga daan sa Ehipto.	Atyu ne kanita i Jose karin Ehipto.
EXO_001_2	EXO	001	2	Sa baylo ginpabay-an nila nga mabuhi ang mga lapsag nga lalaki.	E da la pete ding anak a lalaking mibait.
EXO_001_2	EXO	001	2	Ang mga Ehiptohanon nagkahadlok sa mga Israelinhon.	Makanyan lang mitakutan ding tau Ehipto karing Israelita.
EXO_001_2	EXO	001	2	Ang mga Israelinhon nagpatindog sang mga siudad sang Pitom kag Rameses para sa hari nga pagatipunan nila sing mga pagkaon.	Makanyan lang mengapuersa ding Israelita king pamitalakad karing siudad ning Pitom at Rameses a pipagponduan nang kabiayan at kagamitan ning ari.
EXO_001_2	EXO	001	2	Kay kon may inaway, basi magdampig sila sa aton mga kaaway sa pag-away batok sa aton, kag magpalagyo sila sa aton pungsod.	Inya kailangan tamung lumawe paralan ban e na la dakal pa.
EXO_002_1	EXO	002	1	Nag-abot man ang iban nga mga manugbantay sang mga karnero kag gintabog nila palayo ang mga anak ni Jetro.	Ating dinatang a pastul at penabi da la reting babai. Tinalakad ya i Moises ban saupan ding babai.
EXO_002_1	EXO	002	1	Sang nabatian ini sang hari, gintinguhaan niya nga patyon si Moises, pero nagpalagyo si Moises kag nagkadto sa duta sang Midian, sa diin sia nag-estar.	Inyang abalitan na ning ari iting mepalyari buri neng ipapate i Moises. Oneng mekatakas ya at miras king Midian at karin ya menuknangan.
EXO_002_1	EXO	002	1	Nagbusong ang iya asawa kag nagbata sing isa ka lalaki.	Mikayanak lang metung a lalaki.
EXO_002_1	EXO	002	1	Sang magdakudaku na ang bata, gindala niya ini sa anak sang hari kag gin-ayop niya ini subong nga iya anak.	Inyang meragul ne ing anak, dela ne king prinsesa at tinuring ne iting sarili nang anak.
EXO_002_1	EXO	002	1	Pero sang indi na niya matago ang bata, nagkuha sia sang isa ka basket nga nahimo sa tabun-ak, kag iya ini ginbutangan sing balaw agod indi makasulod ang tubig.	Inyang e na ne agyung isalikut, kinangwa yang maragul a takba a megawa king tangke ning timbu, at penapalan neng alketran ban e ne aluban ning danum.
EXO_002_1	EXO	002	1	Isa sadto ka adlaw, sang daku na si Moises, nagduaw sia sa iya mga kasimanwa nga Hebreo, kag iya nakita kon daw ano ang pagpilit sa ila sa paghimo sang mabug-at nga mga obra.	Inyang meragul ne i Moises linual ya ban dalawan na la ding kabalen na, at ikit na nung makananu lang mengapuersa ding Israelita king obrang mangabayat.
EXO_002_1	EXO	002	1	Ang iya utod nga babayi nagtindog sa ulounhan sa pagbantay kon ano ang mahanabo sa iya.	Makabante ya ing atsi na ning anak king makarayung bagya ban lawan na nung nanu ing mapalyari king wali na.
EXO_002_1	EXO	002	1	Nagpanghulonghulong sia, kag sang wala sia sing may nakita, ginpatay niya ang Ehiptohanon kag iya ginlubong ang bangkay sa balas.	Miglalawe ya i Moises king makapadurut at inyang ikit nang alang aliwang manakit, pete ne ing tau Ehipto at kitkut ne ing bangke king balas.
EXO_002_1	EXO	002	1	Sang madason nga adlaw nagbalik sia, kag iya na man nakita ang duha ka mga Hebreo nga nagaaway.	Kabukasan migbalik ya i Moises at ikit na lang mipapate ding aduang Hebreo.
EXO_002_1	EXO	002	1	Karon ang anak nga babayi sang hari nagkadto sa suba sa pagpaligo, samtang ang iya manug-atipan nga mga babayi nagdayandayan sa pangpang sang suba.	Dinulung ya king ilug ing prinsesang anak ning ari ban mandilu kabang ding babaing mamantabe king prinsesa lakad-lakad la king pampang ning ilug.
EXO_002_1	EXO	002	1	Nagsabat sia, Sin-o bala ang naghimo sa imo nga pangulo kag manughukom sa amon?	Mekibat ya ing taung kitnan na, Ninu ing minie upaya keka ban maging pamuntuk ka at ukum kekami?
EXO_002_1	EXO	002	1	Karon may isa ka tawo sa tribo ni Levi nga nagpangasawa sa isa ka babayi sa amo man nga tribo.	Ating metung a lalaking mibait king tribu nang Levi a mekapakiasawa king metung a babaing mibait munaman king tribung ita.
EXO_002_1	EXO	002	1	Ginbuksan ini sang anak sang hari kag iya nakita ang lapsag nga lalaki nga nagahibi.	Inyang biklat ne ning prinsesa ing takba ikit ne ing anak a lalaking kikiak.
EXO_002_1	EXO	002	1	kag nabatian niya ang ila pagpanghakroy. Dayon nadumdoman sang Dios ang iya kasugtanan kay Abraham, kay Isaac kag kay Jacob.	Dimdam na ing saingsing da at aganaka na ning Dios itang kasunduan na kari Abraham, Isaac, at Jacob.
EXO_002_1	EXO	002	1	Isa ka adlaw, sang pag-abot niya didto, nagpungko sia sa tupad sang bubon.	Atin yang pitung anak a babai i Jetro, ing pari ning Midian.
EXO_002_1	EXO	002	1	Dayon ang utod nga babayi sang lapsag nagpamangkot sa iya, Luyag mo bala nga malakat ako sa pagpangita sang isa ka babayi nga Hebreo nga magaatipan sini nga bata para sa imo?	Kanita linapit ya ing atsi na ning anak king prinsesa at nganang kinutang, Bisa kayu pung panintun kung babaing Hebreo a maningat king anak para kekayo?
EXO_002_1	EXO	002	1	Nagsabat sia, Lakat ka.	Wa, panintun mu ku, nganang mekibat ning prinsesa.
EXO_002_1	EXO	002	1	Sang pagpauli nila sa ila amay nga si Jetro, nagpamangkot sia, Ngaa temprano pa kamo nakapauli karon nga adlaw?	Inyang minuli na la, kitang nang Jetro a tata ra, Obat maranun kayung minuli ngeni?
EXO_002_1	EXO	002	1	Nagsabat sila, Ang isa ka Ehiptohanon nagluwas sa amon sa mga manugbantay sang karnero kag gintimbaan pa niya kag ginpainom ang amon mga kahayupan.	Ngarang mekibat, Pemingua na kami ning metung a tau Ehipto karing lalaking magpastul, at saka na ke pa piniaklung danum, at ya ing minie inuman karing animal a dela mi karin.
EXO_002_1	EXO	002	1	Ginpamangkot niya ang iya mga anak nga babayi, Diin na sia?	Antayu ing taung yan? nganang tata ra.
EXO_002_1	EXO	002	1	Ang anak sang hari nagsiling sa iya, Dalha ini nga bata kag saguron mo sia para sa akon, kay suholan ko ikaw.	Nganang sinabi ning prinsesa king babai, Kuanan me ing anak a ini at sesen me para kanaku at bayaran da ka.
EXO_002_1	EXO	002	1	Nakita sang Dios ang pag-ulipon sa mga Israelinhon, kag nabalaka sia sa ila.	Ikit ning Dios ing kabilian da ring Israelita, at melunus ya karela.
EXO_002_1	EXO	002	1	Nagpamat-od si Moises sa pag-estar didto, kag ginpaasawa ni Jetro sa iya ang iya anak nga si Sipora.	Mebisa ya i Moises ing karin ne manuknangan at binie neng Jetro kang Moises ing anak nang i Zipora ban maging asawa na.
EXO_002_1	EXO	002	1	Nagbata sia sing lalaki kag ginhingalanan ni Moises ang bata kay Gersom, kay nagsiling sia sa iya kaugalingon, Dumoluong ako diri sa sini nga duta.	Mikayanak lang metung a lalaki. At nganang Moises king lub na, Metung ku mung dayuan a miras keti. Inya pemalagyuan neng Gersom ing anak na.
EXO_002_1	EXO	002	1	Sang makaligad ang madamo nga mga tinuig, ang hari sang Ehipto napatay.	Mapilan pang banua kaybat na nita, mete ya ing ari ning Ehipto at ipus la pa mu rin ding Israelita.
EXO_002_2	EXO	002	2	Patyon mo man bala ako subong sang pagpatay mo sa isa ka Ehiptohanon?	Buri mu ku munaman galang paten antimo nung makananu meng pete itang tau Ehipto?
EXO_002_2	EXO	002	2	Ginpahigda niya ang bata sa sini nga basket kag ginbutang niya ini sa bibi sang suba nga may matag-as nga mga tabun-ak.	Lilan ne keting takba iting anak, at kaybat binili ne ing takba libutad ding timbu king pampang ning ilug.
EXO_002_2	EXO	002	2	Ang mga Israelinhon nag-antos sa gihapon tungod sang pag-ulipon sa ila kag nagpangayo sila sing bulig.	E la patugut sasaingsing at maniawad saup uli na ning kasakitan a daralanan da.
EXO_002_2	EXO	002	2	Gani ginkuha sang babayi ang bata kag ginsagod.	Inya kinua ne ing anak at sinese ne.
EXO_002_2	EXO	002	2	Ngaa ginbayaan ninyo sia didto?	Obat likuan yu nia mu kabud karin?
EXO_002_2	EXO	002	2	Gani naglakat ang bata nga babayi kag gintawag ang iloy mismo sang bata.	Meko ya ing atsi na ning anak at ing inaus na ya mismu ing ima ning anak.
EXO_002_2	EXO	002	2	Pero gintabangan sila ni Moises, kag ginpainom niya ang ila mga kahayupan.	Kaybat na nita, pepainum na lang Moises ding sese rang animal.
EXO_002_2	EXO	002	2	Karon nag-abot sa bubon ang pito ka mga anak nga babayi ni Jetro nga pari sang Midian. Nagtimba sila sing tubig kag nagpuno sang palaimnan sang mga karnero kag mga kanding sang ila amay.	Misan a aldo, makalukluk ya i Moises king lele ning talaga; dinatang la deting mikakapatad ban saklung danum para karing tupa at kambing nang tata ra.
EXO_002_2	EXO	002	2	Naluoy sia sa bata kag nagsiling, Isa ini sang mga bata sang mga Hebreo.	Melunus ya ing prinsesa king anak at ngana, Metung ya iti karing anak da ring Hebreo.
EXO_002_2	EXO	002	2	Sang makita sang iya iloy nga ang bata gwapo kag maayo sing lawas, gintago niya sia sa sulod sang tatlo ka bulan.	Masanting ya ing anak, inya selikut ne ning ima kilub ding atlung bulan.
EXO_002_2	EXO	002	2	Sa hinali nakita niya ang basket sa mga tabun-ak, kag ginsugo niya ang iya ulipon nga babayi sa pagkuha sini.	Ikit ne ning prinsesa ing takba a makalibutad karing timbu. Pepakua ne king metung karing babaing mamantabe.
EXO_002_2	EXO	002	2	Nagsiling sia sa isa nga nakahimo sing sayop, Ngaa bala ginasakit mo ang kapareho mo nga Hebreo?	Nganang Moises king maki kasalanan, Obat bubuatanan meng gamat ing kalupa mung Hebreo?
EXO_002_2	EXO	002	2	Nakita niya ang isa ka Ehiptohanon nga nagpatay sang isa ka Hebreo, isa sang iya mga kasimanwa.	Ikit nia naman nung makananu neng pete ning tau Ehipto ing metung a Hebreo.
EXO_002_2	EXO	002	2	Nagsiling ang anak sang hari, Ginkuha ko sia sa tubig, gani hingalanan ko sia kay Moises.	Pemalagyuan neng Moises uling agpang king prinsesa ya ing misaka king anak inyang atyu ya king danum.
EXO_002_3	EXO	002	3	Ang ila pagpangayo sing bulig nakalambot sa Dios,	Miras king Dios ing saingsing da.
EXO_002_3	EXO	002	3	Dayon kinulbaan si Moises kag nagpanghunahuna, Nahibal-an gali sang mga tawo ang akon ginhimo.	Mitakutan ya i Moises at ngana king lub na, Abalu da na pala deng tau ing depat ku.
EXO_002_3	EXO	002	3	Lakat kag tawga ninyo sia agod makakaon upod sa aton.	Puntalan ye at agkatan makipangan kekatamu.
EXO_003_1	EXO	003	1	Si Moises nagpanghunahuna, Mapalapit ako kag tan-awon ining makatilingala nga butang.	Makapagmulala iti, ngana king lub na. Obat e ya masisilab ing tanaman kabang mitatau ne man?
EXO_003_1	EXO	003	1	Ang tagsa ka babayi nga Hebreo magapangayo sa babayi nga Ehiptohanon nga nagadayon sa iya, kag sa iya kaingod, sing mga bayu kag mga alahas nga pilak kag bulawan.	Munta ya ing balang babai kekayu karing babaing tau Ehiptong kasiping nang bale at kenu pa mang babai a katubale na at maniawad yang imalan, alahas a gintu at pilak.
EXO_003_1	EXO	003	1	Karon si Moises nagabantay sang mga karnero kag mga kanding sang iya ugangan nga si Jetro, ang pari sang Midian. Gindala niya ang panong sa tabok sang desierto, kag nakaabot sia sa Sinai, ang balaan nga bukid.	Misan a aldo, kabang papastulan na lang Moises ding tupa at kambing ning katuangan nang i Jetro, ing pari ning Midian, dela na la ding papastulan na lipat na ning disyerto at miras ya king Horeb, ing bunduk ning Dios.
EXO_003_1	EXO	003	1	Didto ang anghel sang Ginoo nagpakita sa iya sa dagway sang nagadabdab nga kalayo sa tunga sang magamay nga kahoy.	At karin pepakit ya kang Moises ing anghel ning Ginu antimong milalablab a api a manibatan libutad ning metung a tanaman a mababa.
EXO_003_1	EXO	003	1	Lakat kag tipuna ang mga pangulo sang Israel, kag singgani sila, Ang Ginoo , ang Dios sang inyo mga katigulangan, ang Dios ni Abraham, ni Isaac, kag ni Jacob, nagpakita kag nagsugo sa akon sa pagsiling sa inyo: nag-abot ako kag nakita ko kon ano ang ginahimo sang mga Ehiptohanon sa inyo.	Puntalan mu na la at tipunan ding manimuna ning Israel at sabian mu karela king aku, ing Ginu , ing Dios ding makatua da, ing Dios nang Abraham, Isaac, at Jacob, pepakit ku keka. At sabian mu karela king ikit ku ing pamipasakit a daraptan da karela ding tau Ehipto.
EXO_003_1	EXO	003	1	Nagpamat-od ako nga pagwaon kamo sa Ehipto, sa diin ginapintasan kamo.	Inari ku king lub ku king ilual ku la king bansang babie kasakitan karela.
EXO_003_1	EXO	003	1	Sang makita sang Ginoo nga nagapalapit sia, ang Dios nagtawag sa iya halin sa tunga sang magamay nga kahoy nga nagasiling, Moises, Moises!	Inyang ikit na ning Ginu king lalapit ya i Moises, inaus ne ibat king milalablab a tanaman. Ngana, Moises, Moises!
EXO_003_1	EXO	003	1	Kag nagsabat sia, Yari ako.	Nanu pu? nganang mekibat Moises.
EXO_003_1	EXO	003	1	Ang Dios nagsiling, Indi ka gid magpalapit.	Kanita ngana ning Dios, E ka lalapit.
EXO_003_1	EXO	003	1	Magapamati ang akon mga katawhan sang imo isiling sa ila.	Makiramdam la ding memalen ku king sabian mu karela.
EXO_003_1	EXO	003	1	Ako amo ang Dios sang imo mga katigulangan, ang Dios ni Abraham, ang Dios ni Isaac, kag ang Dios ni Jacob.	Aku ing Dios ding makatua mu, ing Dios nang Abraham, Isaac, at Jacob.
EXO_003_1	EXO	003	1	Nahibal-an ko nga ang hari sang Ehipto indi magtugot sa inyo sa paglakat, kon indi sia pagpiliton.	Balu ku king e na kayu paintulutan mako ning ari ning Ehipto, nung e ya mangapuersa.
EXO_003_1	EXO	003	1	Dayon ang Ginoo nagsiling, Nakita ko kon daw ano ang pagpintas sa akon mga tawo didto sa Ehipto. Nabatian ko ang ila pagpangayo sing bulig batok sa mga kabo nga nagapamintas sa ila. Nahibaluan ko ang tanan nila nga mga pag-antos.	Kanita ngana ning Ginu , Ikit ku nung makananu lang mipasakitan ding memalen kung Israelita karin Ehipto; dimdam ku ing saingsing da king gamat da ring babie kasakitan karela at balu ku ing kasakitan a daralanan da.
EXO_003_1	EXO	003	1	Gani nagpanaog ako sa pagluwas sa ila sa mga Ehiptohanon, kag sa pagpagwa sa ila sa amo nga duta, pakadto sa isa ka malapad nga duta.	Inya tinipa ku ban iligtas ku la king gamat da ring tau Ehipto at idala ku lang lual Ehipto king gabun a malualas at mataba nung nukarin labis-labis ing kabiayan.
EXO_003_1	EXO	003	1	Pero gamiton ko ang akon gahom sa pagsilot sa mga Ehiptohanon paagi sa mga milagro nga akon himuon sa ila.	Inya gamitan ku ing upaya ku at ipagpa ku king mabilug a Ehipto ing makapangilabut a parusa.
EXO_003_1	EXO	003	1	Nabatian ko gid ang pagpanawag sang mga Israelinhon, kag nakita ko kon daw ano ang pagpigos sang mga Ehiptohanon sa ila.	Dimdam ku ing saingsing da ring memalen ku at ikit ku nung makananu da lang alipitan ding tau Ehipto.
EXO_003_1	EXO	003	1	Karon ipadala ko ikaw sa hari agod sa pagpagwa sang akon mga tawo nga Israelinhon sa Ehipto.	Me keni; tuburan da ka king ari ning Ehipto ban kanita ilual me king Ehipto ing balen kung Israel.
EXO_003_1	EXO	003	1	Pero si Moises nagsiling sa Dios, Sin-o bala ako nga magkadto sa hari kag magpagwa sang mga Israelinhon sa Ehipto?	Nganang mekibat Moises, Ninu mo pu aku a makiarap king ari ning Ehipto at ilual king Ehipto ing balen Israel?
EXO_003_1	EXO	003	1	Ang Dios nagsabat, Ako magaupod sa imo, kag ini mangintanda nga ako nagpadala sa imo: kon imo na mapagwa ang mga Israelinhon sa Ehipto, magasimba kamo sa akon sa sini nga bukid.	Ngana ning Dios, Patnubayan da ka at oyni ing tanda king aku ing mitubud keka. Potang ikua mu na lang alual Ehipto ding Israelita, samban yu ku keting bunduk.
EXO_003_1	EXO	003	1	Si Moises nagsiling sa Dios, Karon, kon magkadto ako sa mga Israelinhon kag magsiling sa ila, Ang Dios sang inyo mga katigulangan nagpadala sa akon sa inyo, kag kon sila mamangkot sa akon, Ano ang iya ngalan?	Nganang Moises, Pota pung miras na ku karing Israelita at sabian ku karela king ikayu, ing Dios ding makatua da, ya ing mitubud kanaku at nung sakaling ikutang da kanaku, Nanu ing lagyu na?
EXO_003_1	EXO	003	1	Himuon ko nga ang mga Ehiptohanon magtahod sa inyo agod nga kon maglakat kamo, indi kamo maglakat nga wala sing dala.	Paratangan ku la ganaka kekayu ding tau Ehipto ban kanita e ra kayu palakuan a alang bitbit a daralan.
EXO_003_1	EXO	003	1	Ang Dios nagsiling kay Moises, Ako nga Amo sa Gihapon.	Ngana ning Dios kang Moises, Aku ing Aku.
EXO_003_1	EXO	003	1	Ang Dios naghambal pa gid kay Moises, Amo ini ang dapat mo isiling sa mga Israelinhon, Ang Ginoo , ang Dios sang inyo mga katigulangan, ang Dios ni Abraham, ang Dios ni Isaac, kag ang Dios ni Jacob, nagpadala sa akon sa inyo.	Sabian mu karing memalen ning Israel king aku, ing Ginu, ing Dios ding makatua da, ing Dios nang Abraham, Isaac, at Jacob ya ing mitubud keka karela.
EXO_003_2	EXO	003	2	Gani gintabunan ni Moises ang iya guya, tungod kay nahadlok sia sa pagtulok sa Dios.	Tikpan neng Moises ing lupa na uling tatakut neng lawan ing Dios.
EXO_003_2	EXO	003	2	Ipasuksok ninyo ini sa inyo mga anak nga lalaki kag babayi, kag paagi sini, madala ninyo ang manggad sang mga Ehiptohanon.	Ipasulud yu la deti karing anak yu. Makanyan yung akua ing pibandian da ring tau Ehipto.
EXO_003_2	EXO	003	2	Ini amo ang akon ngalan tubtob sa katubtoban. Ini amo ang itawag sa akon sang tanan nga palaabuton nga mga kaliwatan.	Iti ing lagyu ku king kapilan pa man; iti ya ing yaus dang lagyu kanaku ding sablang lahi king kapilan pa man.
EXO_003_2	EXO	003	2	Ano bala ang isabat ko sa ila?	nanu mo pu ing ipakibat ku karela?
EXO_003_2	EXO	003	2	Pagkatapos sina, tugotan niya kamo sa paglakat.	Kaybat na nita, paintulutan na na kayung mako.
EXO_003_2	EXO	003	2	Maayo kag mapatubasan ini nga duta, kag karon ginaestaran sang mga Canaanhon, mga Hethanon, mga Amornon, mga Peresnon, mga Hevhanon kag mga Jebusnon.	Iti ya ing gabun da ring Cananeo, Hiteo, Amoreo, Perezeo, Heveo, at Jebuseo.
EXO_003_2	EXO	003	2	Kag nagsiling pa gid sia, Amo ini ang dapat mo isiling sa mga Israelinhon: Si Ako nga Amo sa Gihapon amo ang nagpadala sa akon sa inyo.	At ngana pa ning Dios, Sabian mu karela ini: Ing ausan dang i Aku tinubud na ku kekayu.
EXO_003_2	EXO	003	2	Dayon, kadto ka sa hari sang Ehipto upod sa mga pangulo sang Israel kag singgani sia, Ang Ginoo , ang Dios sang mga Hebreo nagpakigkita sa amon.	Kaybat na nita, ika at ding manimuna ning Israel puntalan ye ing ari ning Ehipto at sabian yu ing anti kanini: Ing Ginu , ing Dios ding Hebreo, pepakit ya kekami.
EXO_003_2	EXO	003	2	Ubaha ang imo mga sandalyas, tungod kay ang lugar nga imo ginatindugan balaan.	Ilukas mu la ding sandalyas mu uling sagradu ing gabun a tutukluan mu.
EXO_003_2	EXO	003	2	Dalhon ko kamo sa duta sang mga Canaanhon, Hethanon, Amornon, Peresnon, Hevhanon, kag mga Jebusnon. Isa ini ka maayo kag mapatubason nga duta.	Idala ku la king gabun nung nu labis-labis ing kabiayan, ing gabun a ngeni tutuknangan da ring Cananeo, Hiteo, Amoreo, Perezeo, Heveo, at Jebuseo.
EXO_003_2	EXO	003	2	Ngaa ining magamay nga kahoy indi masunog?	Lumapit ku pa mo at lawan ku.
EXO_003_2	EXO	003	2	Gintan-aw ni Moises ang magamay nga kahoy kag natalupangdan niya nga nagadabdab ini, pero wala ini masunog.	Apansin nang Moises king mitatau ya ing tanaman, oneng e ne man masisilab.
EXO_003_3	EXO	003	3	Karon kon mahimo palakta kami sing tatlo ka adlaw sa desierto sa pagdulot sing mga halad sa Ginoo nga amon Dios.	Ngeni ipakisabi ming mayap king paintulutan yu kami sanang maglakbe atlung aldo king disyerto ban makaibie kaming ain-sakripisyu king Ginung kekaming Dios!
EXO_004_1	EXO	004	1	Dalha ini nga sungkod, kag paagi sini magahimo ikaw sing mga milagro.	Idala me ing kekang tukud-pastul a kekang gamitan ban makagawa kang bage pagmumulalan.
EXO_004_1	EXO	004	1	Dayon si Moises nagsabat sa Ginoo , Pero abi kon ang mga Israelinhon indi magpati sa akon, kag indi magpamati sa akon ginasiling, kundi magsiling sila, Ang Ginoo wala magpakita sa imo, ano ang akon himuon?	Kanita nganang mekibat Moises, O nu mo pung e ra ku paniwalan ding Israelita at e la makiramdam king sabian ku karela? Nanu pu ing gawan ku potang sabian da king e ya tutung pepakit kanaku ing Ginu ?
EXO_004_1	EXO	004	1	Nagbalik si Moises kay Jetro nga iya ugangan, kag nagsiling sa iya, Kon mahimo tugoti ako sa pagbalik sa akon mga pariente sa Ehipto, sa pagtan-aw sa ila kon buhi pa sila.	Mibalik ya i Moises kang Jetro, ing katuangan na, at ngana, Tatang, paintulutan yu ku sanang makapagbalik karing kamaganak ku karin Ehipto ban lawan ku nung mabie la pa.
EXO_004_1	EXO	004	1	Gani ang Ginoo nagpamangkot sa iya, Ano bala ang ginauyatan mo?	Nanu ya ing tatalnan mu? nganang kinutang ning Ginu .
EXO_004_1	EXO	004	1	Sang didto pa si Moises sa Midian, ang Ginoo nagsiling sa iya, Magbalik ka sa Ehipto kay ang tanan nga luyag magpatay sa imo nagkalamatay na.	Ngana ning Ginu kanitang atyu ya pa i Moises king Midian, Moises, magbalik na ka karin Ehipto, uling mete na la detang bisang makamate keka.
EXO_004_1	EXO	004	1	Gani gindala ni Moises ang iya asawa kag ang iya mga kabataan nga lalaki, ginpasakay niya sila sa asno, kag nagbalik sila sa Ehipto.	Inya tiki neng Moises ing asawa na at ding anak nang lalaki.
EXO_004_1	EXO	004	1	Nagsabat sia, Isa ka sungkod.	Tukud ya pung pastul, nganang mekibat Moises.
EXO_004_1	EXO	004	1	Ang Ginoo nagsiling liwat kay Moises, Karon kay manugbalik ka na sa Ehipto, himuon mo gid ang tanan nga mga milagro sa atubang sang hari paagi sa gahom nga ginhatag ko sa imo.	Ngana ning Ginu , Moises, anti na ning magbalik na ka Ehipto, e mu la sana kakalinguan gagawan detang sablang bage pagmumulalan king arapan ning ari. Dininan da kang upayang makarapat kareti.
EXO_004_1	EXO	004	1	Ang Ginoo nagsiling, Ihaboy ina sa duta.	Ngana ning Ginu , Moises, iyatsa me king gabun.
