id	source_text	target_text
EXO_019_0028	Ang aso nagtub-ok subong sang aso halin sa hornohan, kag ang tanan nga mga tawo nagkulurog gid sa kahadlok.	<MISSING TRANSLATION>
EXO_019_0029	Ang tunog sang budyong nagtudo pa gid.	<MISSING TRANSLATION>
EXO_019_0030	Naghambal si Moises, kag ang Dios nagsabat sa iya sa daguob.	<MISSING TRANSLATION>
EXO_019_0031	Ang Ginoo nagpanaog pakadto sa putokputokan sang Bukid sang Sinai.	<MISSING TRANSLATION>
EXO_019_0032	Gintawag niya si Moises sa pagkadto sa putokputokan sang bukid kag si Moises nagtaklad.	<MISSING TRANSLATION>
EXO_019_0033	Ang Ginoo nagsiling kay Moises, Dulhog ka kag paandami ang mga tawo nga indi sila maglakbang sa mga dulonan sa pagpalapit kag sa pagtulok sa akon, kay basi madamo sa ila ang magakalamatay.	<MISSING TRANSLATION>
EXO_019_0034	Bisan ang mga pari nga magpalapit sa akon, kinahanglan magpakabalaan sila sang ila kaugalingon, kay kon indi silutan ko sila.	<MISSING TRANSLATION>
EXO_019_0035	Si Moises nagsiling sa Ginoo , Ang mga tawo indi makataklad tungod kay ikaw nagpaandam sa amon nga nagasiling, Butangi sing mga dulonan ang bukid kag pakabalaana ini.	<MISSING TRANSLATION>
EXO_019_0036	Ang Ginoo nagsiling sa iya, Dulhog ka, kag dalha si Aaron sa pagtaklad upod sa imo.	<MISSING TRANSLATION>
EXO_019_0037	Pero ang mga pari kag ang mga tawo indi dapat maglakbang sa mga dulonan sa pagtaklad pakadto sa akon, kay kon maglakbang sila silutan ko sila.	<MISSING TRANSLATION>
EXO_019_0038	Gani si Moises nagdulhog sa mga tawo kag ginsugiran sila sang ginsiling sang Ginoo .	<MISSING TRANSLATION>
EXO_020_0001	Ang Dios naghambal sini nga mga pulong Ako amo ang Ginoo nga imo Dios, nga nagdala sa imo pagwa sa Ehipto, sa diin gin-ulipon ka.	Binigkas ng Diyos ang lahat ng salitang ito, na sinasabi, Ako ang Panginoon mong Diyos na naglabas sa iyo sa lupain ng Ehipto, mula sa bahay ng pagkaalipin.
EXO_020_0002	Indi ka magsimba sa iban nga mga dios, luas sa akon.	Huwag kang magkakaroon ng ibang mga diyos sa harap ko.
EXO_020_0003	Indi ka maghimo para sa imo kaugalingon sang isa ka diosdios ukon isa ka larawan sang bisan ano nga tinuga sa langit, ukon sa duta, ukon sa tubig nga yara sa idalom sang duta.	Huwag kang gagawa para sa iyong sarili ng inukit na larawan o ng anumang kawangis ng anumang nasa langit sa itaas, o ng nasa lupa sa ibaba, o ng nasa tubig sa ilalim ng lupa.
EXO_020_0004	Indi ka magluhod ukon magsimba sa bisan ano nga diosdios, tungod kay ako ang Ginoo nga imo Dios, kag maimon ako nga Dios.	Huwag mo silang yuyukuran, o paglingkuran man sila; sapagkat akong Panginoon mong Diyos ay Diyos na mapanibughuin, na aking pinarurusahan ang mga anak dahil sa kasamaan ng mga magulang hanggang sa ikatlo at ikaapat na salinlahi ng mga napopoot sa akin; ngunit pinagpapakitaan ko ng wagas na pag-ibig ang libu-libong umiibig sa akin at tumutupad ng aking mga utos.
EXO_020_0005	Sa mga nagadumot sa akon silutan ko ang ila mga kaanakan tubtob sa ikatlo kag ikap-at nga kaliwatan.	Huwag mong babanggitin ang pangalan ng Panginoon mong Diyos sa walang kabuluhan, sapagkat hindi pawawalang-sala ng Panginoon ang sinumang gumagamit ng kanyang pangalan sa walang kabuluhan.
EXO_020_0006	Pero sa mga nagahigugma sa akon kag nagatuman sang akon mga sugo, ipakita ko sa ila ang akon malig-on nga paghigugma sa linibo nga mga kaliwatan.	Alalahanin mo ang araw ng Sabbath, upang ingatan itong banal.
EXO_020_0007	Indi mo paggamiton sa wala sing pulos ang akon ngalan kay ako ang Ginoo nga imo Dios, magasilot sang bisan sin-o nga maggamit sang akon ngalan sa wala sing kapuslanan.	Anim na araw kang gagawa at iyong gagawin ang lahat ng iyong gawain; ngunit ang ikapitong araw ay Sabbath sa Panginoon mong Diyos.
EXO_020_0008	Dumdoma ang Adlaw nga Inugpahuway, kag pakabalaana ini.	Sa araw na ito ay huwag kang gagawa ng anumang gawain, ikaw o ang iyong anak na lalaki, ang iyong anak na babae, ang iyong aliping lalaki, ang iyong aliping babae, ang iyong mga baka, ang dayuhang nasa loob ng iyong mga pintuan; sapagkat sa loob ng anim na araw ay ginawa ng Panginoon ang langit at lupa, ang dagat, at lahat ng naroroon, at nagpahinga sa ikapitong araw; kaya't binasbasan ng Panginoon ang araw ng Sabbath, at ginawa itong banal.
EXO_020_0009	Mag-obra ka sa sulod sang anom ka adlaw, pero ang ikapito nga adlaw amo ang Adlaw nga Inugpahuway nga imo igahalad sa akon.	Igalang mo ang iyong ama at ang iyong ina, upang ang iyong mga araw ay humaba sa lupaing ibinibigay sa iyo ng Panginoon mong Diyos.
EXO_020_0010	Indi ka mag-obra sa sina nga adlaw, ikaw, ukon ang imo mga kaanakan, ukon ang imo mga ulipon, ukon ang imo mga kahayupan, ukon ang mga dumoluong nga nagaestar sa imo banwa.	Huwag kang papatay.
EXO_020_0011	Sa sulod sang anom ka adlaw ako, ang Ginoo , nagtuga sang langit kag duta, sang dagat, kag sang tanan nga yara sa ila, pero sa ikapito nga adlaw nagpahuway ako.	Huwag kang mangangalunya.
EXO_020_0012	Gani ako, ang Ginoo , nagbendisyon sang Adlaw nga Inugpahuway kag ginpakabalaan ko ini.	Huwag kang magnanakaw.
EXO_020_0013	Tahura ang imo amay kag iloy, agod nga magkabuhi ka sing malawig sa duta nga ginahatag ko sa imo.	Huwag kang magiging sinungaling na saksi laban sa iyong kapwa.
EXO_020_0014	Indi ka magpatay.	Huwag mong iimbutin ang bahay ng iyong kapwa; huwag mong iimbutin ang asawa ng iyong kapwa, o ang kanyang aliping lalaki o ang kanyang aliping babae, o ang kanyang baka, o ang kanyang asno, o ang anumang bagay ng iyong kapwa.
EXO_020_0015	Indi ka magpanginbabayi ukon magpanginlalaki.	Nang masaksihan ng buong bayan ang mga kulog at kidlat, ang tunog ng trumpeta at ang bundok na umuusok, ay natakot sila at nanginig, at sila'y tumayo sa malayo.
EXO_020_0016	Indi ka magpangawat.	Sinabi nila kay Moises, Magsalita ka sa amin, at aming papakinggan, subalit huwag mong pagsalitain ang Diyos sa amin, baka kami ay mamatay.
EXO_020_0017	Indi ka magsaksi sing binutig sa imo isigkatawo.	Sinabi ni Moises sa bayan, Huwag kayong matakot, sapagkat ang Diyos ay naparito upang subukin kayo, at upang ang takot sa kanya ay sumainyo, upang huwag kayong magkasala.
EXO_020_0018	Indi ka magkaibog sang balay sang imo isigkatawo.	Ang taong-bayan ay tumayo sa malayo at si Moises ay lumapit sa makapal na kadiliman na kinaroroonan ng Diyos.
EXO_020_0019	Indi ka magkaibog sang iya asawa, ukon sang iya mga ulipon, sang iya mga baka, ukon sang iya mga asno, ukon sang bisan ano niya nga mga pagkabutang.	Sinabi ng Panginoon kay Moises, Ganito ang sasabihin mo sa mga anak ni Israel: Kayo ang nakakita na ako'y nakipag-usap sa inyo mula sa langit.
EXO_020_0020	Sang mabatian sang mga tawo ang daguob kag ang tunog sang budyong, kag sang makita ang kilat kag ang bukid nga nagaaso, nagkulurog sila sa kahadlok kag nagtindog sa malayo.	Huwag kayong gagawa ng mga diyos na pilak na iaagapay sa akin ni huwag kayong gagawa para sa inyo ng mga diyos na ginto.
EXO_020_0021	Nagsiling sila kay Moises, Ikaw ang maghambal sa amon kag mamati kami, kay nahadlok kami nga kon ang Dios ang maghambal sa amon, magakalamatay kami.	Isang dambanang lupa ang iyong gagawin para sa akin, at iyong iaalay doon ang iyong mga handog na sinusunog, mga handog pangkapayapaan, mga tupa, at mga baka.
EXO_020_0022	Nagsiling si Moises sa mga tawo, Indi kamo magkahadlok, ang Dios nag-abot sa pagtilaw sa inyo, agod magpadayon kamo sa pagtuman sa iya, kag indi magpakasala.	Sa lahat ng dakong aking ipapaalala ang aking pangalan ay pupunta ako sa iyo at pagpapalain kita.
EXO_020_0023	Pero ang mga tawo nagtindog gihapon sa malayo, kag si Moises lamang ang nagpalapit sa maitom nga gal-om sa diin yara ang Dios.	Kung igagawa mo ako ng isang dambanang bato ay huwag mong itatayo ito na may mga tapyas na bato, sapagkat kung iyong gamitin ang iyong patalim doon ay iyong nilapastangan iyon.
EXO_020_0024	Ang Ginoo nagsugo kay Moises, Amo ini ang dapat mo isiling sa mga Israelinhon: Nakita ninyo nga ako, ang Ginoo , nagpakighambal sa inyo halin sa langit.	Huwag kang aakyat sa aking dambana sa pamamagitan ng mga baytang, upang ang iyong kahubaran ay huwag mahayag sa ibabaw niyon.
EXO_020_0025	Indi kamo maghimo para sa inyo kaugalingon sing mga dios nga pilak ukon bulawan nga simbahon man ninyo subong dugang sang inyo pagsimba sa akon.	<MISSING TRANSLATION>
EXO_020_0026	Maghimo kamo sing altar nga duta para sa akon, kag sa sini maghalad kamo sing mga karnero kag sang mga baka subong mga dulot nga pagasunogon sang bug-os kag subong mga dulot sa paghiambit.	<MISSING TRANSLATION>
EXO_020_0027	Sa tagsa ka lugar nga ginasiling ko sa inyo nga magsimba kamo sa akon, magaduaw ako sa inyo kag magabendisyon sa inyo.	<MISSING TRANSLATION>
EXO_020_0028	Kon maghimo kamo sing altar nga bato para sa akon, indi ninyo paghimuon ini halin sa binasbasan nga mga bato, tungod kay kon gamitan ninyo ini sang inyo mga sinsil ginadagtaan ninyo ini.	<MISSING TRANSLATION>
EXO_020_0029	Indi kamo magsaka sa akon altar paagi sa mga halintang, agod indi kamo diri mabihangan.	<MISSING TRANSLATION>
EXO_021_0001	Amo ini ang mga pagsulondan nga ihatag mo sa mga Israelinhon Kon magbakal kamo sing ulipon nga Hebreo, magaalagad sia sa inyo sing anom ka tuig.	Ito naman ang mga tuntunin na igagawad mo sa harap nila.
EXO_021_0002	Sa ikapito nga tuig pagahilwayon sia nga wala sing balayran.	Kapag ikaw ay bumili ng isang lalaking alipin na Hebreo, siya ay maglilingkod ng anim na taon, ngunit sa ikapito ay aalis siyang malaya, walang pananagutan.
EXO_021_0003	Kon sa iya pag-abot subong ulipon wala pa sia sing asawa, magahalin sia nga sia lang.	Kung siya'y pumasok na mag-isa, siya ay aalis na mag-isa, kung siya ay pumasok na may asawa, ang kanyang asawa nga ay aalis na kasama niya.
EXO_021_0004	Pero kon sa iya pag-abot subong ulipon may asawa na sia, ti sa iya paghalin magaupod sa iya ang iya asawa.	Kung siya'y bibigyan ng kanyang amo ng asawa at nagkaanak sa kanya ng mga lalaki o mga babae; ang kanyang asawa at ang kanyang mga anak ay magiging sa kanyang amo, at siya'y aalis na mag-isa.
EXO_021_0005	Kon paasawahan sia sang iya agalon, kag ang iya asawa magpamata sing mga lalaki kag mga babayi, dayon ang iya asawa kag ang mga kabataan iya sang iya agalon, kag ang bana lamang amo ang magahalin.	Subalit kung maliwanag na sasabihin ng alipin, Mahal ko ang aking amo, ang aking asawa, at ang aking mga anak, ako'y hindi aalis na malaya; ay dadalhin siya ng kanyang amo sa Diyos, dadalhin siya sa pinto, o sa haligi ng pinto, at bubutasan ng kanyang amo ang kanyang tainga ng isang pambutas; at siya'y maglilingkod sa kanya habambuhay.
EXO_021_0006	Pero kon ang ulipon magsiling, Palangga ko ang akon agalon, ang akon asawa, kag ang akon mga kabataan, indi ako luyag maghalin, dayon pagadalhon sia sang iya agalon sa lugar nga ginasimba ang Dios, kag pagadalhon sia sa pwertahan ukon sa bakalan kag buhoan ang iya dulonggan.	Kung ipagbili ng isang lalaki ang kanyang anak na babae bilang isang alipin, hindi siya aalis na gaya ng pag-alis ng mga aliping lalaki.
EXO_021_0007	Sia mangin-ulipon niya tubtob nga buhi sia.	Kung hindi siya kinalugdan ng kanyang amo na umangkin sa kanya bilang asawa, ay kanyang ipapatubos siya; wala siyang karapatang ipagbili siya sa isang dayuhan, yamang siya'y hindi niya pinakitunguhan nang tapat.
EXO_021_0008	Kon ang isa ka tawo magbaligya sang iya anak nga babayi nga mangin-ulipon, indi sia paghilwayon pareho sang paghilway sang mga ulipon nga lalaki.	Kung siya ay itinalaga niya para sa kanyang anak na lalaki, kanyang papakitunguhan siya tulad sa isang malayang anak na babae.
EXO_021_0009	Kon wala sia maluyagi sang iya agalon nga may tuyo sa paghimo sa iya nga iya asawa, dayon tugotan niya nga gawaron sia sang iya amay.	Kung siya'y mag-asawa ng iba, ang kanyang pagkain, damit, at karapatan bilang asawa ay hindi niya babawasan.
EXO_021_0010	Wala sing kinamatarong ang iya agalon sa pagbaligya sa iya sa mga dumoluong tungod kay indi matarong ang pagkabig niya sa iya.	Kung hindi niya gawin ang tatlong bagay na ito para sa kanya, siya ay aalis na walang bayad, na walang itinubos na salapi.
EXO_021_0011	Kon ipaasawa niya sia sa iya anak nga lalaki, pagakabigon niya sia nga iya kaugalingon nga anak nga babayi.	Sinumang manakit ng isang tao at mamatay ito, ay walang pagsalang papatayin.
EXO_021_0012	Kon magpangasawa sia sang iban pa gid nga babayi, kinahanglan padayunon niya ang paghatag sa nahauna niya nga asawa sing amo man nga kadamuon nga pagkaon kag panapton, kag amo man nga kinamatarong.	Ngunit kung hindi ito sinasadya ng isang tao, kundi Diyos ang naghulog sa kanyang kamay; ay ipaglalaan kita ng isang lugar na maaaring takbuhan ng nakamatay.
EXO_021_0013	Kon wala sia nagatuman sini nga mga katungdanan sa iya, pagahilwayon niya sia, kag indi na sia dapat magpabayad sing kwarta.	Kung magbalak ang sinuman sa kanyang kapwa na patayin siya nang pataksil, aalisin mo siya sa aking dambana upang siya'y mamatay.
EXO_021_0014	Ang bisan sin-o nga nagasakit sang isa ka tawo sa bagay nga mapatay sia, pagapatyon man.	Ang manakit sa kanyang ama o sa kanyang ina ay papatayin.
EXO_021_0015	Pero kon indi niya hungod ini, kag wala sia sing tuyo sa pagpatay sa iya, makapalagyo sia sa lugar nga akon pilion para sa inyo sa diin indi sia maano.	Ang magnakaw ng isang tao, ipagbili man siya o matagpuan sa kanyang kamay, siya ay papatayin.
EXO_021_0016	Pero kon ang isa ka tawo magkaakig kag patyon niya sing hungod ang isa ka tawo, sarang sia makuha sa akon altar, agod pagapatyon sia.	Ang magmura sa kanyang ama, o sa kanyang ina ay papatayin.
EXO_021_0017	Ang bisan sin-o nga nagasakit sa iya amay kag sang iya iloy, pagapatyon.	Kapag may nag-away at sinaktan ng isang tao ang kanyang kapwa sa pamamagitan ng bato o ng kanyang kamay, at hindi namatay ang tao, kundi naratay sa higaan; kung makabangon siya uli at makalakad sa tulong ng kanyang tungkod, ligtas sa parusa ang nanakit sa kanya; babayaran lamang niya ang panahong nasayang, at kanyang ipapagamot siyang lubos.
EXO_021_0018	Ang bisan sin-o nga nagakuha sang isa ka tawo sa pakusog, agod iya ibaligya ukon himuon nga ulipon, pagapatyon.	Kung saktan ng sinuman ang kanyang aliping lalaki o aliping babae ng tungkod at mamatay sa kanyang kamay, siya ay parurusahan.
EXO_021_0019	Ang bisan sin-o nga nagapakamalaut sa iya amay ukon sa iya iloy pagapatyon.	Gayunma'y, kung tumagal ang alipin ng isa o dalawang araw, hindi siya parurusahan; sapagkat siya'y kanyang salapi.
EXO_021_0020	Kon may mga tawo nga mag-away, kag ang isa magpulpog sing bato ukon magsumbag sa iya kaaway, pero wala sia mapatay, indi sia pagsilutan.	Kung mag-away ang dalawang lalaki at makasakit ng isang babaing nagdadalang-tao, na anupa't makunan, at gayunma'y walang pinsalang sumunod, pagbabayarin ang nakasakit, ayon sa iaatang sa kanya ng asawa ng babae; at siya'y magbabayad ng ayon sa ipasiya ng mga hukom.
EXO_021_0021	Kon ang tawo nga iya ginsakit kinahanglan maghigda gid, pero sang ulihi makabangon man kag makalakat sa gwa sa bulig sang sungkod, ang tawo nga nagsakit sa iya magabayad sang tinion nga nausik niya kag magaatipan sa iya tubtob mag-ayo sia.	Subalit kung may anumang pinsalang sumunod, magbibigay ka nga ng buhay para sa buhay, mata sa mata, ngipin sa ngipin, kamay sa kamay, paa sa paa, pas sa pas, sugat sa sugat, hagupit sa hagupit.
EXO_021_0022	Kon may tawo nga magbunal sang iya ulipon nga lalaki ukon babayi kag mapatay ini gilayon, pagasilutan sia.	At kung saktan ng sinuman ang mata ng kanyang aliping lalaki, o ang mata ng kanyang aliping babae at mabulag, kanyang papalayain ang alipin upang matumbasan ang mata.
EXO_021_0023	Pero kon ang ulipon mabuhi pa sa sulod sing isa ukon duha ka adlaw, ang agalon indi pagsilutan, kay ang ulipon kaugalingon niya nga pagkabutang, kag ang pagkadula sang iya ulipon tuman na nga silot sa iya.	Kung kanyang bungian ng ngipin ang kanyang aliping lalaki o babae ay kanyang palalayain ang alipin dahil sa kanyang ngipin.
EXO_021_0024	Kon may mga tawo nga mag-away kag makasakit sing isa ka babayi nga nagabusong sa bagay nga mahulogan sia, pero wala gid man sia maano, ang nakasakit sa iya pagamultahan suno sa ginapangayo sang bana sang babayi, kag magabayad sia suno sa ginpamatbat sang mga hukom.	Kung suwagin ng isang baka ang isang lalaki o ang isang babae, anupa't namatay, babatuhin ang baka at ang kanyang laman ay hindi kakainin; subalit ang may-ari ng baka ay pawawalang-sala.
EXO_021_0025	Pero kon mapatay ang babayi, ang silot amo ang kabuhi sa kabuhi, mata sa mata, ngipon sa ngipon, kamot sa kamot, tiil sa tiil, paso sa paso, pilas sa pilas, labod sa labod.	Ngunit kung ang baka ay dati nang nanunuwag at naisumbong na sa may-ari ngunit hindi niya ikinulong, anupa't nakamatay ng isang lalaki, o isang babae, babatuhin ang baka at ang may-ari niyon ay papatayin din.
EXO_021_0026	Kon may tawo nga magbunal sang iya ulipon nga lalaki ukon babayi sa mata kag mabulag ini, pagahilwayon niya ang iya ulipon bilang bayad para sa iya mata.	Kung siya'y atangan ng pantubos, magbibigay siya ng pantubos sa kanyang buhay anuman ang iniatang sa kanya.
EXO_021_0027	Kon makabingaw sia sang isa ka ngipon, pagahilwayon niya ang iya ulipon subong bayad para sa iya ngipon.	Kung suwagin nito ang anak na lalaki o babae ng isang tao ay gagawin sa kanya ayon sa kahatulang ito.
EXO_021_0028	Kon may baka nga magsungay sing bisan sin-o nga tawo kag mapatay, batuhon ini nga baka, kag indi pagkaunon ang iya unod, pero ang tag-iya indi pagsilutan.	Kung suwagin ng baka ang isang aliping lalaki o babae ay magbabayad ang may-ari ng tatlumpung siklong pilak sa kanilang amo, at ang baka ay babatuhin.
EXO_021_0029	Pero kon ang baka palasungay sang tawo, kag ang tag-iya ginpaandaman nahanungod sang iya baka, pero wala niya pagbantayi kag makasungay ini sing bisan sin-o nga tawo kag mapatay gid, batuhon ang baka kag ang tag-iya pagapatyon man.	Kung iwanang bukas ng sinuman ang isang balon, o kung huhukay ng isang balon at hindi ito tatakpan, at ang isang baka o ang isang asno ay mahulog dito, magbabayad ang may-ari ng balon; magbabayad siya ng salapi sa may-ari niyon, at ang patay na hayop ay magiging kanya.
EXO_021_0030	Pero kon may ginpabili nga multa sa tag-iya para sa iya kabuhi, pagabayaran niya ang bug-os nga kantidad nga ginakinahanglan sa pagluwas sang iya kabuhi.	Kung ang baka ng sinuman ay nanakit sa baka ng iba, na anupa't namatay, kanila ngang ipagbibili ang bakang buhy, at kanilang paghahatian ang halaga niyon; at ang patay ay paghahatian din nila.
EXO_021_0031	Kon ang baka makapatay sing bata nga lalaki ukon babayi, ang amo man nga pagsulondan ang pagatumanon.	O kung kilala na ang baka ay dati nang manunuwag, at hindi ikinulong ng may-ari, magbabayad siya ng baka sa baka, at ang patay na hayop ay magiging kanya.
EXO_021_0032	Kon ang baka makapatay sing ulipon nga lalaki ukon babayi, ang tag-iya sang baka magabayad sa tag-iya sang ulipon sing traynta ka bilog nga pilak kag ang baka pagabatuhon tubtob mapatay.	<MISSING TRANSLATION>
EXO_021_0033	Kon may tawo nga nagkuha sang tabon sang bubon, ukon magkutkot sang isa ka bubon kag wala niya pagtabuni ini, kag may mahulog nga baka ukon asno sa amo nga bubon, dapat niya bayran ini.	<MISSING TRANSLATION>
EXO_021_0034	Magabayad sia sa tag-iya sini nga sapat, kag mangin-iya ang hayop nga patay.	<MISSING TRANSLATION>
EXO_021_0035	Kon ang baka sang isa ka tawo makapatay sang isa ka baka sang isa ka tawo, sila nga duha magabaligya sang buhi nga baka, kag tung-on ang kwarta nga bili sini.	<MISSING TRANSLATION>
EXO_021_0036	Tungaon man nila ang karne sang patay nga hayop.	<MISSING TRANSLATION>
EXO_021_0037	Pero kon nahibal-an na nga daan nga ang baka palasungay, kag wala ini ginbantayi sang tag-iya, dapat magbayad sia, kag magahatag sing buhi nga baka nga baylo sa napatay, kag ang napatay nga baka mangin-iya.	<MISSING TRANSLATION>
EXO_022_0001	Kon ang tawo magkawat sang baka ukon karnero, kag iya ini ihawon ukon ibaligya, dapat sia magbayad sing lima ka baka para sa isa ka baka, kag apat ka karnero para sa isa ka karnero.	Kung ang isang tao ay magnakaw ng isang baka, o ng tupa at patayin, o ipagbili, siya'y magbabayad ng limang baka para sa isang baka, at ng apat na tupa para sa isang tupa.
EXO_022_0002	Dapat niya bayaran ini.	Ang magnanakaw ay gagawa ng pagsasauli; kung wala siyang maisauli, siya'y ipagbibili dahil sa kanyang pagnanakaw.
EXO_022_0003	Kon wala sia sing pagkabutang, ibaligya sia subong ulipon kag ang kwarta ibayad sa iya ginkawat.	Kung ang isang magnanakaw ay mahuling pumapasok at siya'y hinampas na kanyang ikinamatay, hindi magkakaroon ng pananagutan sa dugo ang nakapatay, ngunit kung sikatan siya ng araw ay magkakaroon siya ng pananagutan sa dugo.
EXO_022_0004	Kon ang kinawat nga hayop, baka, asno, ukon karnero, makita sa iya nga buhi, magabayad sia sing duha ka pilo.	Kung ang ninakaw ay matagpuang buhy sa kanyang kamay, maging baka o asno, o tupa, ay magbabayad siya ng doble.
EXO_022_0005	Kon ang tawo madakpan nga sa isa ka gab-i nga nagapangawat sa balay kag ginpatay sia, ang nagpatay sa iya wala sing salabton sa pagpatay.	Kung ang sinuman ay magpastol sa isang bukid, o sa isang ubasan, at pakawalan ang kanyang hayop at manginain sa bukid ng iba, siya'y magsasauli mula sa pinakamainam sa kanyang sariling bukid, at mula sa kanyang sariling ubasan.
EXO_022_0006	Pero kon matabo ini sa tapos makabutlak ang adlaw, nakasala sia sa pagpatay.	Kung may magningas na apoy at umabot sa mga tinik, na anupa't ang mga mandala, o ang mga uhay, o ang bukid ay masunog, ang nagpaningas ng apoy ay magbabayad ng buo.
EXO_022_0007	Kon ang tawo magpahalab sang iya mga hayop sa uma ukon sa talamnan sang ubas, kag kon makabuhi ang iya hayop kag maghalab sa uma sang iban, dapat sia magbayad sang pinakamaayo niya nga patubas sang iya uma ukon talamnan sang ubas.	Kung ang sinuman ay magpatago sa kanyang kapwa ng salapi o pag-aari, at ito'y ninakaw sa bahay ng taong iyon, at pagkatapos, kung matagpuan ang magnanakaw, magbabayad siya ng doble.
EXO_022_0008	Kon may tawo nga magtutod sang iya talamnan kag ang kalayo maglapta sa mga hilamon, pakadto sa uma sang isa ka tawo kag magsunog sang tinumpi ukon alanyon ukon sang bug-os nga uma nga may tanom, ang nagtutod magabayad sang kapierdihan.	Kung hindi matagpuan ang magnanakaw, lalapit ang may-ari ng bahay sa Diyos, upang ipakita kung pinakialaman niya o hindi ang pag-aari ng kanyang kapwa.
EXO_022_0009	Kon ang isa ka tawo magpatago sang iya kwarta ukon malahalon nga pagkabutang sa iya kaingod kag kon kawaton ini sa iya balay, magabayad sing duha ka pilo ang makawat kon madakpan sia.	Sapagkat sa lahat ng pagsuway, maging para sa baka, sa asno, sa tupa, sa kasuotan, o sa anumang bagay na nawala, na may magsabi na iyon nga ay sa kanya, dadalhin sa harapan ng Diyos ang usapin ng dalawa; ang parurusahan ng Diyos ay magbabayad ng doble sa kanyang kapwa.
EXO_022_0010	Kon ang makawat indi madakpan, ang tag-iya sang balay pagadalhon sa lugar nga ginasimba ang Dios agod mahibal-an kon bala ginkuha niya ang pagkabutang sang isa ka tawo ukon wala.	Kung ang sinuman ay maghabilin sa kanyang kapwa ng isang asno, o ng isang baka, o ng isang tupa, o ng anumang hayop; at namatay ito, o nasaktan, o hinuli, na walang nakakakitang sinuman, ang pagsumpa nilang dalawa sa Panginoon ang mamamagitan sa kanila upang makita kung pinakialaman niya o hindi ang pag-aari ng kanyang kapwa; at tatanggapin ng may-ari ang sumpa, at siya'y hindi magsasauli.
EXO_022_0011	Nahanungod sa mga pagkabutang nga ginaagawan, subong sang baka, asno, karnero, mga bayu, ukon bisan ano nga pagkabutang nga nadula, kon may duha ka tawo nga nagaangkon sini, sila nga duha pagadalhon sa lugar nga ginasimba ang Dios.	Subalit kung ninakaw ito sa kanya ay isasauli niya iyon sa may-ari.
EXO_022_0012	Ang pagahukman sang Dios nga nakasala magabayad sing duha ka pilo sa isa ka tawo.	Kung nilapa ito ng mga hayop, dadalhin niya ito bilang katibayan; hindi siya magsasauli ng anumang nilapa.
EXO_022_0013	Kon may tawo nga magpasagod sa isa ka tawo sing asno, baka, karnero ukon bisan ano nga hayop, kag mapatay ini, ukon mapilasan, ukon pagakawaton, kag wala sing saksi, ang pagsumpa sa lugar nga ginasimba ang Ginoo amo ang magapat-od kon bala ginkawat niya ang sapat sang isa ka tawo ukon wala.	Kung ang sinuman ay humiram ng anuman sa kanyang kapwa, at nasaktan ito, o namatay, na hindi kaharap ang may-ari, ang humiram ay magsasauli ng buo.
EXO_022_0014	Kon ang hayop wala niya ginkawat, ang tag-iya magabaton sang kapierdihan kag ang nagsagod indi magbayad, pero kon ang hayop ginkawat, magbayad sia sa tag-iya.	Kung ang may-ari niyon ay kaharap, hindi siya magsasauli; kung ito'y inupahan, dumating ito para sa upa nito.
EXO_022_0015	Kon ini ginpatay sang talunon nga mga hayop, dalhon niya ang lawas nga patay subong pamatuod, kag indi sia kinahanglan magbayad sing ginpatay sang talunon nga mga hayop.	At kung akitin ng isang lalaki ang isang dalaga na hindi pa naipagkakasundong mag-asawa at kanyang sipingan, kanyang ibibigay ang kanyang dote at gagawing kanyang asawa.
EXO_022_0016	Kon may tawo nga maghulam sang isa ka hayop sang isa ka tawo, kag mapilasan ini ukon mapatay kag wala dira ang tag-iya ang naghulam dapat magbayad sini.	Kung mahigpit na tumutol ang kanyang ama na ibigay siya sa kanya, ay magbabayad siya ng salapi katumbas ng dote para sa mga dalaga.
EXO_022_0017	Pero kon yara ang tag-iya, sang natabo ini, ang naghulam indi na kinahanglan magbayad.	Huwag mong pahintulutang mabuhay ang isang babaing mangkukulam.
EXO_022_0018	Kon gin-alkilahan ang hayop, ang kapierdihan nabayaran na sa alkila.	Sinumang sumiping sa isang hayop ay papatayin.
EXO_022_0019	Kon may tawo nga maghaylo sa isa ka birhen nga indi pa kalaslon, kag magpakighilawas sa iya, dapat sia magbayad sang ginapangayo para sa kasal kag pangasaw-on niya sia.	Ang maghandog sa alinmang diyos, maliban sa Panginoon lamang, ay lubos na pupuksain.
