id	source_text	target_text
GEN_011_0012	Ang siudad gintawag Babilonia, tungod kay didto gintublag sang Ginoo ang linggwahe sang tanan nga mga tawo, kag halin didto ginpalapta niya sila sa bug-os nga kalibutan.	Sikara yay kabyangay boleg nen Sem.
GEN_011_0013	Amo ini ang mga kaliwat ni Sem.	Kalabas na duay taon kayari to may linmabas a delap, si Sem, nen mantaon na sanlasus, walay anak ton laki a manngaray Arpaksad.
GEN_011_0014	Duha ka tuig sa tapos sang anaw, sang si Sem nagaedad sing 100 ka tuig, natawo ang iya anak nga lalaki nga si Arfaxad.	Nambilay ni na liman lasus a taon tan wala ni ray arum ya anak ton lalaki tan bibii.
GEN_011_0015	Sa tapos sini, nagkabuhi sia sing 500 pa ka tuig kag may iban pa sia nga mga kabataan.	Nen mantaon na talomplo tan lima si Arpaksad, awalaay ilalak a laki a si Sela; nambilay ni na apat a lasus tan taloy taon tan wala ni ray arum ya anak ton lalaki tan bibii.
GEN_011_0016	Sang si Arfaxad nagaedad na sing trayntay singko ka tuig, natawo ang iya anak nga lalaki nga si Sela.	Nen mantaoy talomplo si Sela, walay anak ton laki a si Eber; nambilay ni na apat a lasus tan taloran taon tan wala ni ray arum ya anak ton lalaki tan bibii.
GEN_011_0017	Sa tapos sini, nagkabuhi sia sing 403 pa ka tuig kag may iban pa sia nga mga kabataan.	Nen mantaoy talomplo tan apat si Eber, walay anak ton laki a si Peleg; nambilay ni na apat a lasus tan talomplon taon tan wala ni ray arum ya anak ton lalaki tan bibii.
GEN_011_0018	Sang si Sela nagaedad na sing traynta ka tuig, natawo ang iya anak nga lalaki nga si Eber.	Nen mantaon na talomplo si Peleg, walay anak ton laki a si Reu; nambilay ni na duan lasus tan siamira a taon tan wala ni ray arum ya anak ton lalaki tan bibii.
GEN_011_0019	Sa tapos sini, nagkabuhi sia sing 403 pa ka tuig kag may iban pa sia nga mga kabataan.	Nen mantaon na talomplo tan dua si Reu, walay anak ton laki a si Serug; nambilay ni na duan lasus tan piton taon tan wala ni ray anak ton lalaki tan bibii.
GEN_011_0020	Sang si Eber nagaedad sing trayntay kwatro ka tuig, natawo ang iya anak nga lalaki nga si Peleg.	Nen mantaon na talomplo si Serug, walay anak ton laki a si Nacor; nambilay ni na duan lasus taon tan wala ni ray arum ya anak ton lalaki tan bibii.
GEN_011_0021	Sa tapos sini, nagkabuhi sia sing 430 pa ka tuig kag may iban pa sia nga mga kabataan.	Nen mantaon na duamplo tan siam si Nacor, walay anak ton laki a si Tare; nambilay ni na sanlasus tan labinsiam taon tan wala ni ray arum ya anak ton lalaki tan bibii.
GEN_011_0022	Sang si Peleg nagaedad sing traynta ka tuig, natawo ang iya anak nga lalaki nga si Reu.	Nen mantaon na pitomplo si Tare, walay anak ton lalaki a di Abram, Nacor, tan Haran.
GEN_011_0023	Sa tapos sini, nagkabuhi sia sing 209 pa ka tuig kag may iban pa sia nga mga kabataan.	Sikara yay kabyangay boleg nen Tare: si Tare so ama di Abram, Nacor, tan Haran.
GEN_011_0024	Sang si Reu nagaedad sing trayntay dos ka tuig, natawo ang iya anak nga lalaki nga si Serug.	Si Haran so ama nen Lot, tan inatey si Haran diad dilin baley ton Ur na Babilonia nen mabilay niy ama to.
GEN_011_0025	Sa tapos sini, nagkabuhi sia sing 207 pa ka tuig kag may iban pa sia nga mga kabataan.	Inasawa nen Abram si Sarai, tan inasawa nen Nacor si Milca ya anak nen Haran ya ama nen Isca.
GEN_011_0026	Sang si Serug nagaedad sing traynta ka tuig, natawo ang iya anak nga lalaki nga si Nahor.	Anggapoy anak nen Sarai, ta lepes.
GEN_011_0027	Sa tapos sini, nagkabuhi sia sing 200 pa ka tuig kag may iban pa sia nga mga kabataan.	Tinmaynan si Tare ed baley na Ur na Babilonia, a kaiba toy anak ton Abram, si apo ton Lot ya anak nen Haran, tan si manugang ton Sarai ya asawa nen Abram.
GEN_011_0028	Sang si Nahor nagaedad sing baynte nwebe ka tuig, natawo ang iya anak nga lalaki nga si Tera.	Linma rad dalin na Canaan, et nen asabi ray dalin na Haran, diman la ra nanayam.
GEN_011_0029	Sa tapos sini, nagkabuhi sia sing 119 pa ka tuig kag may iban pa sia nga mga kabataan.	Inatey diman si Tare nen mantaoy duan lasus tan lima.
GEN_012_0001	Karon ang Ginoo nagsiling kay Abram, Halin ka sa imo kaugalingon nga duta, sa imo mga pariente, kag sa panimalay sang imo amay, kag magkadto ka sa isa ka duta nga igapakita ko sa imo.	Inkuan na Katawan ed kinen Abram, Taynan moy baley mo, saray kakanayon mo, tan say abung na amam, insan ka onlad bansan ipanengneng kod sika.
GEN_012_0002	Hatagan ko ikaw sing madamo nga mga kaliwat kag mangin-isa sila ka daku nga pungsod.	Itdan ta kay amayamay a kabyangay boleg mo, tan magmaliw iran sakey a bansan matalonggaring.
GEN_012_0003	Bendisyunan ko ikaw kag himuon ko nga manginbantog ang imo ngalan, agod nga paagi sa imo madamo ang makabaton sing mga kaayuhan.	Bindisionan ta ka tan pagmaliwen kon bantug so ngaran mo, pian sikay pakabindisionan na arum a totoo.
GEN_012_0004	Pakamaayuhon ko ang mga nagapakamaayo sa imo, pero pakamalauton ko ang mga nagapakamalaut sa imo.	Bindisionan ko ray mamindision ed sika, Balet isambak iray mangisambad sika.
GEN_012_0005	Ang tanan nga mga pungsod sa duta magapangayo sa akon nga pakamaayuhon ko subong sang akon pagpakamaayo sa imo.	Diad panamegley mo bindisionan kon amin iray bansa ed mundo.
GEN_012_0006	Sang si Abram nagaedad sing setentay singko ka tuig, naghalin sia sa Haran, suno sa ginsiling sang Ginoo sa iya, kag si Lot nag-upod sa iya.	Nen mantaon na pitomplo tan lima si Abram, tinaynan toy Haran, onung na imbagay Katawan ed sikato.
GEN_012_0007	Gindala ni Abram ang iya asawa nga si Sarai, ang iya hinablos nga si Lot, ang tanan nga manggad kag ang tanan nga mga ulipon nga ila nakuha sa Haran, kag naglakat sila pakadto sa duta sang Canaan.	Inawit nen Abram si Sarai ya asawa to, si Lot a kaanakan to, tan amin iray kayamanan tan saray aripen ya atipon da nen wala rad Haran, insan ira amaarap ed dalin na Canaan.
GEN_012_0008	Sang pag-abot nila sa Canaan, si Abram naglatas sa duta tubtob nakalambot sia sa balaan nga kahoy sang More sa balaan nga lugar sa Siquem.	Nen sinmabi rad Canaan, tinmuloy si Abram ya anggad masanton kiew ed More, say masanton lugar na Sikem.
GEN_012_0009	Sa sadto nga panahon ang mga Canaanhon nagaestar pa sa sadto nga duta.	Diad saman a panaon, manaayam ni rad may Cananeo.
GEN_012_0010	Ang Ginoo nagpakita kay Abram kag nagsiling sa iya, Amo ining duta nga ihatag ko sa imo mga kaliwat.	Pinmanengneng so Katawan ed kinen Abram tan inkuantod sikato, Sikato yay bansa ya iter kod saray kabyangay boleg mo.
GEN_012_0011	Dayon si Abram nagpatindog didto sing altar para sa Ginoo nga nagpakita sa iya.	Nanggawad may Abram na altar a para Katawan a pinmanengneng ed sikato.
GEN_012_0012	Sa tapos sini, nagsaylo sia sa bagatnan didto sa bukid sa sidlangan sang siudad sang Betel kag didto nagpatindog sia sang iya tolda sa gintung-an sang Betel kag Ay.	Insan tinmuloy ed bandad abalaten diad nipokdul a pasen a nibokig na Betel, tan nankampod nanleetan na Betel tan Hai diad bokig.
GEN_012_0013	Ang Betel sa nakatundan kag ang Ay sa sidlangan.	Nanggawa met diman na altar tan inggalang toy Katawan .
GEN_012_0014	Didto naghimo man sia sang altar kag nagsimba sa Ginoo .	Manlapud man, tinmonda-tondan nanaayam ed nandoroman pasen ya anggad akasabid bandad abalaten a parti na Canaan.
GEN_012_0015	Sang ulihi si Abram nagpadayon sa pagpanglakaton pakadto sa bagatnan sang Canaan.	Balet walay eras ed saman a lugar, et lapud mapalalo la linmay Abram ed bandad abalaten, diad Egipto, ta manayam diman a magano.
GEN_012_0016	Karon may tiggulotom sa Canaan.	Nen asingger to lan beltangen so ketegan a mamaarap ed Egipto, inkuantod kinen Sarai ya asawa to, Maganggana kan bii.
GEN_012_0017	Tungod kay tama gid ang tiggulotom, si Abram nagpabagatnan pa gid tubtob sa Ehipto, sa pag-estar didto sa malip-ot nga tion.	No nanengneng da ka ray Egipsio, ibaga ran asawa ta ka.
GEN_012_0018	Sang nagahinampot na sila sa dulonan pakadto sa Ehipto, nagsiling si Abram sa iya asawa, Sarai, matahom ikaw nga babayi.	Pateyen da ak ed satan, balet bilayen da ka.
GEN_012_0019	Kon makita ikaw sang mga Ehiptohanon magasiling sila, Asawa sia ni Abram, kag pagapatyon nila ako kag tugotan ka nga mabuhi.	Walay maung, ibagam ed sikaran agi ta ka, pian ag da ak pateyen, no ag ingen asikasoen da ak lapud sika.
GEN_012_0020	Maayo pa nga singganon mo sila nga utod ko ikaw.	Nen akasabi rad Egipto, anengneng a tua na saray tagad man a magangganay asawa nen Abram.
GEN_012_0021	Dayon tungod sa imo indi nila ako pagpatyon kag ayuhan nila ako.	Anengneng na pigarad saray opisyal na palasio tan imbalita rad ari so ontan lan ganggana to; kanyan inawit day Sarai ed palasio na ari.
GEN_012_0022	Sang makaabot na sila sa Ehipto, nakita matuod sang mga Ehiptohanon nga ang iya asawa matahom.	Lapud sikato, maung so imapangasikaso na ari ed kinen Abram tan initdan to na saray karniro tan kanding, saray baka tan asno, saray kamilyo tan pati saray aripen a lalaki tan bibii.
GEN_012_0023	May mga opisyales sang hari nga nakakita sa iya kag ginsugiran nila ang hari kon daw ano katahom sa iya, gani gindala sia sa palasyo sang hari.	Balet lapud inalay ari si Sarai, say Katawan impansakit to na ambelat so ari tan saray totood palasio.
GEN_012_0024	Tungod kay Sarai, gin-ayuhan sang hari si Abram kag ginhatagan sia sing mga karnero kag mga kanding, mga baka, mga asno, mga ulipon kag mga kamelyo.	Impaawit na ari si Abram tan tinepet to, Antoy ginawam ed siak?
GEN_012_0025	Pero tungod kay ginkuha sang hari si Sarai, ang Ginoo nagpadala sing mga makangilidlis nga mga balatian sa hari kag sa iya mga ginsakpan sa palasyo.	Akin et ag mo imbagad siak ya asawam manaya si Sarai?
GEN_012_0026	Gani ginpatawag sang hari si Abram kag ginpamangkot, Ano ining ginhimo mo sa akon?	Akin et imbagam ya agim tan inabuloyan mon inalak ya asawa?
GEN_012_0027	Ngaa wala ka magsiling sa akon nga asawa mo sia?	Niay asawam, alam la tan taynan ki la!
GEN_012_0028	Ngaa nagsiling ka nga utod mo sia kag gintugotan mo nga kuhaon ko sia subong akon asawa?	Ingganggan na ari ray totoo to a paekalen da rad bansa, kanyan pinataynan day Abram, samay asawa to tan amin a kayaryan to.
GEN_013_0001	Halin sa Ehipto si Abram nagpaaminhan padulong sa bagatnan nga bahin sang Canaan, upod sang iya asawa kag sang tanan nila nga mga pagkabutang.	Manlapud Egipto linmay Abram ed bandad abalaten na Canaan a kaiba to si Sarai ya asawa to tan amin a kayaryan to; akilad sikato si Lot.
GEN_013_0002	Si Lot nag-upod man sa iya.	Mayamyaman lay Abram, ta amayamay la ray karniro, kanding, baka, pilak tan balituk to.
GEN_013_0003	Si Abram manggaranon kaayo.	Tinmaynan lamet diman tan nanalis-alis so nankampoan to ya anggad akasabid Betel.
GEN_013_0004	May mga karnero sia, mga kanding, mga baka, kag subong man mga pilak kag mga bulawan.	Insan asabi to may pasen a nanleetan na Betel tan Ai a nanayaman to nen saman tan nanggawaan toy altar.
GEN_013_0005	Nagpanglakaton sia halin sa isa ka lugar pakadto sa isa padulong sa Betel, sa lugar nga iya man anay ginpatindugan sang iya tolda sa gintung-an sang Betel kag Ay, sa diin sia man anay naghimo sing altar, kag didto nagsimba sia sa Ginoo .	Diman to inggalang so Katawan .
GEN_013_0006	Si Lot nga nag-upod kay Abram may mga karnero man, mga kanding, kag mga baka kag may iya man kaugalingon nga panimalay kag mga suloguon.	Si Lot a kaiba nen Abram et wala met iray karniro to, kanding tan saray baka to; wala met so dilin pamilya to tan saray dilin aripen to.
GEN_013_0007	Tungod kay sila nga duha may madamo gid nga mga kasapatan indi sila makapadayon sa pag-estar sing tingob kay ang palahalban indi makaigo sa ila.	Kulang so pampastolan no manolup iran dua, ta dakerakel iray ayayep da.
GEN_013_0008	Gani ang mga tinawo ni Abram kag ni Lot nga nagaatipan sang ila mga kasapatan nagailinaway.	Lapud saya mabetbet so siblangan da ray pumapastol nen Abram tan saray pumapastol nen Lot.
GEN_013_0009	Sa sadto nga tion ang mga Canaanhon kag mga Peresnon nagaestar pa sa sadto nga duta.	Diad saman a panaon, manaayam nid man iray Cananeo tan saray Perezeo.
GEN_013_0010	Gani si Abram nagsiling kay Lot, Hinablos ko ikaw, kag indi dapat nga mag-ilinaway ang aton mga tinawo.	Inkuanen Abram ed kinen Lot, Sankanayon ita, tan ag nepeg a mansebeg iray totook tan saray totoom.
GEN_013_0011	Kinahanglan magbulagay kita.	Say maung, mansiyan ita la.
GEN_013_0012	Pilia ang bisan diin nga bahin sang duta nga imo naluyagan.	Pilim so labalabay mon dalin.
GEN_013_0013	Kon mapatuo ka, mapawala ako, kag kon mapawala ka, mapatuo ako.	Lakad sakey a pasen; onla ak balet ed sananey.
GEN_013_0014	Si Lot nagpanghulonghulong kag nakita niya ang Kapatagan sang Jordan tubtob sa Zoar may bugana nga tubig kasubong sang Katamnan sang Ginoo , ukon kasubong sang duta sang Ehipto.	Ninengneng sirin nen Lot so kaliber-liber tan abantag ton say patar na Jordan ya anggad Zoar et dakel so danum to, a singa Tanamanan na Katawan o singa dalin na Egipto.
GEN_013_0015	Ini sang wala pa malaglag sang Ginoo ang mga siudad sang Sodoma kag Gomorra.	Diad saman a panaon, ag ni dineral na Katawan so siudad na Sodoma tan say siudad na Gomorra.
GEN_013_0016	Gani si Lot nagpili para sa iya kaugalingon sang bug-os nga Kapatagan sang Jordan, kag nagpasidlangan sia.	Kanyan pinili nen Lot a betang to so intiron Patar na Jordan, insan amaarap diman ed bokig.
GEN_013_0017	Amo ini ang ila pagbulagay.	Onyay impansian dan dua.
GEN_013_0018	Si Abram nagpabilin sa duta sang Canaan, samtang si Lot nag-estar sa mga siudad sang kapatagan kag nagpatindog sang iya mga tolda malapit sa Sodoma, nga ang mga tawo sini malaut kag nagpakasala batok sa Ginoo .	Tinmilak si Abram ed Canaan, balet nanayam si Lot ed saray siudad diad patar ya asingger ed Sodoma.
GEN_013_0019	Sang nakahalin na si Lot, ang Ginoo nagsiling kay Abram, Halin sa imo ginatindugan lantawa sing maayo ang imo palibot.	Maoges iray totood man; mapalaloy kasalanan dad Katawan .
GEN_013_0020	Ihatag ko sa imo kag sa imo mga kaliwat ang tanan nga mga duta nga malambot sang imo panulok, kag ini mangin-imo sa wala sing katubtoban.	Kasiput nen Lot, inkuan na Katawan ed kinen Abram, Manlapud tan ed kawalaan mo, nengneng mon maung so kaliber-liber mo; amin a dalin a nabantag mo, iter kod sika tan diad saray kabyangay boleg mo, tan kayaryan mo ra ya anggad angga.
GEN_013_0021	Hatagan ko ikaw sing madamo nga mga kaliwat, nga wala sing may makaisip sa ila tanan, subong nga wala sing may makaisip sang yab-ok sa duta.	Diad karakel na iter kod sikan kabyangay boleg mo, no bilangen mo ra singa ka mambibilang na dabuk.
GEN_013_0022	Karon lakat ka kag latasa ang bug-os nga duta, tungod kay ihatag ko ini tanan sa imo.	Natan sirin, liber mo yan dalin, ta iter kod sikan amin.
GEN_013_0023	Gani ginhalin ni Abram ang iya mga tolda kag nag-estar sia malapit sa balaan nga mga kahoy ni Mamre sa Hebron, kag didto naghimo sia sing altar para sa Ginoo .	Inyalis nen Abram so tulda to ed abay na saray masanton kiew ed Mamre diad Hebron tan nanayam diman.
GEN_014_0001	Ang apat ka mga hari nga amo sanday Amrafel nga hari sang Babilonia, Arioc nga hari sang Elasar, Kedorlaomer nga hari sang Elam, kag Tidal nga hari sang Goim nagpakig-away batok sa lima ka mga hari nga amo sanday Bera nga hari sang Sodoma, Birsa nga hari sang Gomorra, Sinab nga hari sang Adma, Semeber nga hari sang Zeboim, kag sa hari sang Bela ukon Zoar.	Saray apatiran arari a di Amrafel na Babilonia, Arioc na Elasar, Kedorlaomer na Elam, tan Tidal na Goiim et akibakal irad limaran arari a di Bera na Sodoma, Birsa na Gomorra, Sinab na Adma, Semeber na Ziboiim, tan say ari na Bela o Zoar.
GEN_014_0002	Ining lima ka mga hari nagdampiganay kag nagtingob sang ila kusog sa nalupyakan sang Sidim nga amo karon ang Patay nga Dagat.	Sarayan limaran ari nankakasakey ira tan impanoolup da ray sondalo ra ed Patar na Sidim ya Inatey a Dayat natan.
GEN_014_0003	Gingamhan sila ni Kedorlaomer sa sulod sang dose ka tuig, pero sang ika-13 ka tuig nagbato sila sa iya.	Labinduay taon la ran walad silong na pakaoley nen Kedorlaomer, balet diad kumalabintalon taon nilabanan da.
GEN_014_0004	Sang ika-14 ka tuig si Kedorlaomer kag ang iya mga kadampig nag-abot nga may mga soldado kag gindaog nila ang mga Refaimnon sa Astarot Karnaim, ang mga Zuzimnon sa Ham, ang mga Emimnon sa kapatagan sang Kiryataim, kag ang mga Horhanon sa kabukiran sang Edom tubtob sa Elparan, nga yara sa higad sang desierto.	Diad kumalabinapat taon si Kedorlaomer, saray ararin kakaiba to, tan saray sondalo ra et linma ran linmaban ed saramay limara.
GEN_014_0005	Sang ulihi nagbalik sila sa Kades nga ginatawag sadto nga Enmispat, kag gin-agaw nila ang tanan nga kadutaan sang mga Amaleknon, kag ginlutos nila ang mga Amornon nga nag-estar sa Hasason Tamar.	Diad inyakar da tinalo da ray Refaita ed Astarot-Carnaim, saray Zuzita ed Ham, saray Emita ed Save-kiryataim.
GEN_014_0006	Dayon ang mga hari sang Sodoma, Gomorra, Adma, Zeboim, kag Bela nagtipon sang ila mga soldado para sa inaway sa nalupyakan sang Sidim kag nagpakig-away sila batok kay Kedorlaomer nga hari sang Elam, kay Tidal nga hari sang Goim, kay Amrafel nga hari sang Babilonia, kag kay Arioc nga hari sang Elasar, lima ka mga hari batok sa apat.	Tinalo da met iray Horeo diad kapalandeyan na Edom, tan inosilan da ra ya anggad Elparan, diad samput na kalawakan.
GEN_014_0007	Karon ang nalupyakan sang Sidim may madamo nga buho nga may aspalto, kag sang magpalagyo sa inaway ang mga hari sang Sodoma kag Gomorra, nadagdag sila sa sini nga mga buho.	Insan ira amoliktar, pinmawil irad Cades Enmispat nen saman, sinakop da ray amin a dalin na saray Amalecita, tan tinalo da ray Amorreo a manaayam ed Hazazontamar.
GEN_014_0008	Ang tatlo ka mga hari nagpalagyo pakadto sa kabukiran.	Tinipon na saray ari na Sodoma, Gomorra, Adma, Zeboim, tan Bela ed patar na Sidim iray sondalo ra tan akilaban irad saray ari na Elam, Goiim, Babilonia, tan Elasar; limara laban ed apatira.
GEN_014_0009	Ang apat ka mga hari nagkuha sang tanan nga makuha nila sa Sodoma kag Gomorra, lakip ang mga kalan-on, kag naglakat sila.	Dakel diman iray maawang a bobun na alkitran, et nen ibabatikan day bakal ira may ari na Sodoma tan Gomorra naplag irad saraman a bobun, balet akabatik ed kapalandeyan ira may taloran ari.
GEN_014_0010	Gindala man nila si Lot kag ang iya tanan nga mga pagkabutang tungod kay nagaestar sia sa Sodoma.	Inala na apatiran arari iray amin a walad Sodoma tan Gomorra, pati saray kakanen, insan la ra tinmaynan.
GEN_014_0011	Pero may isa ka tawo nga nakapalagyo kag nagpanugid kay Abram nga Hebreo nahanungod sining natabo.	Manaayam diman si Lot a kaanakan nen Abram, kanyan inala ra met tan amin a kayaryan to.
GEN_014_0012	Si Abram nagaestar sadto malapit sa balaan nga mga kahoy ni Mamre nga Amornon nga utod ni Escol kag ni Aner.	Balet walay toon akabatik tan imbaga to ra yan amin ed kinen Abram a Hebreo, a manaayam ed abay na saray masanton kiew nen Mamre ya Amorreo.
GEN_014_0013	Ini sila mga kadampig ni Abram.	Si Mamre tan di Escol tan Aner ya agagi to et kagampi ray Abram.
GEN_014_0014	Sang pagkabati ni Abram nga ang iya hinablos ginbihag, gintawag niya sing tingob ang tanan nga mga hangaway sa iya kampo nga may kadamuon nga 318, kag ginlagas nila ang apat ka mga hari tubtob sa Dan.	Nen nadngelan nen Abram ya adakep si kaanakan to, tinawag ton amin iray totoo ton sarag day mibakal tan akatipon na talon lasus tan labinwalon lalaki.
GEN_014_0015	Didto gintunga niya ang iya mga tinawo sa duha ka grupo, kag sang gab-i, ginsalakay nila ang mga kaaway kag ginlutos nila sila.	Inosilan to ya anggad Dan ira may apatiran arari.
GEN_014_0016	Ginlagas nila sila tubtob sa Hoba, sa aminhan sang Damasco, kag nabawi nila ang tanan nga mga pagkabutang nga inagaw.	Kasabi tod man, impankadwa to ray totoo to, dinogpaan dad labi iray kalaban da tan tinalo da ra.
GEN_014_0017	Gindala man niya pabalik ang iya hinablos nga si Lot kag ang iya tanan nga mga pagkabutang, upod ang mga babayi kag ang iban nga mga binilanggo.	Inosilan to ran anggad Hoba a walad baybay na Damasco, tan abawi to ray amin ya asamsam da.
GEN_014_0018	Sang pagbalik ni Abram sa iya pagdaog kay Kedorlaomer kag sa iban pa nga mga hari, ang hari sang Sodoma nagsugata sa iya sa Kapatagan sang Save nga ginatawag man nga Kapatagan sang Hari.	Abawi to met si Lot tan saray kayaryan to, pati saray bibii tan arum ni ran totoon adakep.
GEN_014_0019	Kag si Melquisedec nga hari sang Salem kag subong man pari sang Labing Mataas nga Dios, nagdala sing kalan-on kag bino kay Abram, kag ginbendisyunan niya sia kag nagsiling, Kabay nga ang Labing Mataas nga Dios nga naghimo sang langit kag duta magbendisyon kay Abram!	Nen pinmawil si Abram, kayari ton tinalo si Kedorlaomer tan saramay arum ya arari, inabet na ari na Sodoma diad Patar na Save tatawagen met na Patar na Ari.
GEN_014_0020	Kabay nga pagdayawon ang Labing Mataas nga Dios nga nagpadaog sa imo batok sa imo mga kaaway!	Inabet met nen Melkisedek ya ari na Salem tan pari na Sankatageyan a Dios.
GEN_014_0021	Kag si Abram naghatag sa iya sang ikapulo nga bahin sang tanan nga iya nabawi.	Inawitan toy Abram na tinapay tan alak, binindisionan to, tan inkuanto, Say Sankatageyan a Dios ya amalsay tawen tan dalin et bindisionan to komuy Abram.
GEN_014_0022	Karon, ang hari sang Sodoma nagsiling kay Abram, Imo na lang ang mga butang nga napanguha mo, pero iuli sa akon ang tanan ko nga mga tinawo.	Nagalang komun so Sankatageyan a Dios ya angiter ed sikay pananalod saray kalaban mo.
GEN_014_0023	Si Abram nagsabat, Ginasumpa ko sa presensya sang Ginoo , ang Labing Mataas nga Dios, nga Manunuga sang langit kag duta, nga indi ako magkuha sing bisan ano sang imo pagkabutang, indi ako magkuha bisan hilo lang ukon higot sang sandalyas, agod nga indi ka makasiling nga ikaw ang nagpamanggad sa akon.	Inter nen Abram ed kinen Melkisedek so kakaplo na amin ya asamsam to.
GEN_014_0024	Indi ako magkuha bisan ano para sa akon kaugalingon.	Inkuan na samay ari na Sodoma ed kinen Abram, Kayaryan mo la tay asamsam mo; ipawil mo labat ed siak iray amin a totook.
GEN_014_0025	Ang akon lamang batunon amo ang gingamit na sang akon mga tinawo.	Inmebat si Abram, Sambaan kod Katawan , say Sankatageyan a Dios a Manamalsay tawen tan dalin, ya ag kon balut mangala na antokaman a kayaryan mo, anggan tinebey o sakey a bariber na sandalya.
GEN_014_0026	Pero tugoti nga ang akon mga kadampig nga amo sanday Aner, Escol, kag Mamre magkuha sang ila parti.	Ag mon balut nibagad satan, Siak so nampayaman ed Abram.
GEN_015_0001	Sa tapos sini, si Abram may isa ka palanan-awon kag nabatian niya ang Ginoo nga nagahambal sa iya, Indi ka mahadlok, Abram.	Kasumpal to yan inkagawa, walay pasingayew ed kinen Abram tan arengel ton inkuan na Katawan ed sikato, Ag ka natatakot, Abram.
GEN_015_0002	Apinan ko ikaw sa katalagman, kag hatagan ko ikaw sing daku nga balos.	Salimbengan ta kad kaatapan tan itdan ta kay baleg a tumang.
GEN_015_0003	Pero si Abram nagsiling, O Ginoo nga Gamhanan, ano bala ang pulos sang imo balos kay wala man ako sing mga kabataan?	Balet inkuanen Abram, Katawan a DIOS , antoy kaabigan ya iter ed siak na tumang mo, anta anggapo met so anak ko.
GEN_015_0004	Ang akon manunubli amo gid lang si Eliezer nga taga-Damasco.	Si Eliezer labat a taga Damasco so tumatawir ko.
GEN_015_0005	Wala mo ako paghatagi sing mga kabataan, gani ang isa sang akon mga ulipon magapanubli sang akon pagkabutang.	Ag mo ak initday anak, kanyan say sakey ed saray aripen ko so manawir ed saray kayaryan ko.
GEN_015_0006	Dayon nabatian niya ang Ginoo nga nagahambal sa iya liwat: Ini nga ulipon indi makapanubli sang imo pagkabutang, kundi ang imo gid kaugalingon nga anak amo ang imo manunubli.	Arengel to lamet ya inkuan na Katawan , Ag tawiren nen Eliezer ya aripen mo iray kayaryan mo; say dilin anak mo so manawir.
GEN_015_0007	Gindala sia sang Ginoo sa gwa sang iya tolda kag ginsingganan, Tangla ka bala sa langit kag isipa ang mga bituon, kon maisipan mo.	Say Katawan pinapaway to tan inkuanto, Nengneng moy tawen tan salim a bilangen iray bitewen; ontan naani so karakel na saray kabyangay boleg mo.
GEN_015_0008	Ang imo mga kaliwat manginsubong sa ila kadamo.	Anisiay Abram ed Katawan , tan lapud sayan pananisia to say Katawan impasen ton matonung si Abram.
GEN_015_0009	Si Abram nagtuo sa Ginoo , kag tungod sini ang Ginoo nahamuot sa iya kag ginbaton sia.	Insan inkuan ed sikato na Katawan , Siak so Katawan ya amataynan ed sika manlapud Ur na Babilonia, pian niiter kod sika yan dalin.
GEN_015_0010	Dayon ang Ginoo nagsiling sa iya, Ako ang Ginoo nga nagtuytoy sa imo halin sa Ur sang Babilonia agod mahatag ko sa imo ining duta nga mangin-imo kaugalingon.	Balet tinepet nen Abram, Katawan a DIOS , panoy pakaamtak a nakayaryan ko yan dalin?
GEN_015_0011	Pero si Abram nagpamangkot, O Ginoo nga Gamhanan, ano ang pagkahibalo ko nga mangin-akon ini?	Inmebat, Awit ka diay sakey a baka, sakey a kanding, tan sakey a karniro, a mantaon iran amin na talora.
GEN_015_0012	Nagsabat sia, Dalhi ako diri sing isa ka tinday nga baka, isa ka kanding nga babayi, kag isa ka karnero nga lalaki nga tagtatlo ka tuig ang edad, kag isa man ka pating kag isa ka tukmo.	Awit ka dia met na sakey a sibong na malapati tan sakey a palekpek.
GEN_015_0013	Si Abram nagdala sa Dios sini nga mga hayop, ginpamihak niya sila, kag ginbutang niya ang mga pinihak sa duha ka kubay nga nagaatubangay, pero ang mga pispis wala niya pagpamihaka.	Inawit nen Abram ira yan ayayep ed Dios, pinaldua to ra likud ed saramay manok, insan to ra impandarasig a nampepetekan so balang kapaldua.
GEN_015_0014	Ang mga uwak naghugpa sa mga lawas sang mga hayop, pero ginpanabog sila ni Abram.	Dinapoan ira na saray buitri, balet inaabul ira nen Abram.
GEN_015_0015	Sang nagahinunod na ang adlaw, si Abram natulogan sing mahamuok gid, kag nag-abot sa iya ang kakugmat kag kahadlok.	Nen onseselek lay agew, akaogip na malmalet si Abram, tan balbaleg a takot so sinmabid sikato.
