id	source_text	target_text
GEN_009_0021	Ang mga anak ni Noe nga lalaki nga naggwa sa arka amo si Sem, si Ham, kag si Jafet.	Ang mga ito ang tatlong mga anak ni Noe at sa kanila nagmula ang lahat ng tao sa lupa.
GEN_009_0022	Si Ham amo ang amay ni Canaan.	Si Noe ay isang magbubukid at siyang pinakaunang nagtanim ng ubasan.
GEN_009_0023	Ining tatlo ka mga anak ni Noe amo ang ginhalinan sang tanan nga mga tawo sa duta.	Uminom siya ng alak at nalasing at siya'y nakahigang hubad sa loob ng kanyang tolda.
GEN_009_0024	Si Noe isa ka mangungoma.	At nakita ni Ham na ama ni Canaan ang kahubaran ng kanyang ama, at isinaysay sa kanyang dalawang kapatid na nasa labas.
GEN_009_0025	Sia ang nahauna nga nagpatanom sing mga ubas.	Kumuha sina Sem at Jafet ng isang balabal, inilagay sa balikat nilang dalawa, lumakad ng paatras, at tinakpan ang kahubaran ng kanilang ama.
GEN_009_0026	Sang makainom sia sang bino sang iya ubas, nahubog sia, nag-uba kag naghigda nga hublas sa iya tolda.	At ang mukha nila ay patalikod, at hindi nila nakita ang kahubaran ng kanilang ama.
GEN_009_0027	Sang makita ni Ham nga amay ni Canaan nga ang iya amay hublas, naglakat sia kag ginsugiran ang duha niya ka mga utod.	Nagising si Noe sa kanyang pagkalasing, at nalaman ang ginawa sa kanya ng kanyang bunsong anak.
GEN_009_0028	Dayon si Sem kag si Jafet nagkuha sing panapton kag gin-umbilay nila ini.	At kanyang sinabi, Sumpain si Canaan!
GEN_009_0029	Nagkadto sila sa tolda nga nagaisol kag gintabunan nila ang ila amay.	Siya'y magiging alipin ng mga alipin sa kanyang mga kapatid.
GEN_009_0030	Wala sila mag-atubang agod indi nila makita ang ila amay nga hublas.	At sinabi niya, Purihin ang Panginoon , ang Diyos ni Sem!
GEN_009_0031	Sang naumpawan si Noe kag sang mahibal-an niya ang ginhimo sa iya sang iya kamanghuran nga anak, nagsiling sia Ang pagpakamalaut mangin kay Canaan!	At si Canaan ay magiging alipin niya.
GEN_009_0032	Mangin-ulipon sia sang iya mga utod.	Palawakin ng Diyos si Jafet, at siya'y titira sa mga tolda ni Sem; at si Canaan ay magiging alipin niya.
GEN_009_0033	Dayawon ang Ginoo , ang Dios ni Sem!	Nabuhay si Noe ng tatlong daan at limampung taon pagkaraan ng baha.
GEN_009_0034	Si Canaan mangin-ulipon ni Sem.	Ang lahat ng naging araw ni Noe ay siyamnaraan at limampung taon.
GEN_009_0035	Kabay nga ang Dios magpamuad kay Jafet!	At siya ay namatay.
GEN_009_0036	Kag kabay nga ang iya kaliwat magpuyo upod sa mga kaliwat ni Sem!	<MISSING TRANSLATION>
GEN_009_0037	Si Canaan mangin-ulipon ni Jafet.	<MISSING TRANSLATION>
GEN_009_0038	Sa tapos ang anaw, si Noe nagkabuhi sing 350 pa ka tuig, kag sang nagaedad sia sing 950 ka tuig napatay sia.	<MISSING TRANSLATION>
GEN_010_0001	Amo ini ang mga kaliwat sang mga anak ni Noe nga amo sanday Sem, Ham, kag Jafet.	Ang mga ito ang mga salinlahi ng mga anak ni Noe: sina Sem, Ham, at Jafet: at sila'y nagkaanak pagkaraan ng baha.
GEN_010_0002	Ini sila nga tatlo may mga anak nga lalaki nga nagkalatawo sa tapos ang anaw.	Ang mga anak ni Jafet: sina Gomer, Magog, Madai, Javan, Tubal, Meshec, at si Tiras.
GEN_010_0003	Ang mga anak nga lalaki ni Jafet amo sanday Gomer, Magog, Madai, Javan, Tubal, Mesec, kag Tiras.	Ang mga anak ni Gomer: sina Askenaz, Rifat, at Togarma.
GEN_010_0004	Ang ila mga kaliwat nagdala sang ila mga ngalan.	Ang mga anak ni Javan: sina Elisha, Tarsis, Kittim, at Dodanim.
GEN_010_0005	Ang mga kaliwat ni Gomer amo ang mga tawo sang Askenaz, Rifat, kag Togarma.	Sa mga ito nahati ang mga pulo ng mga bansa sa kanilang mga lupain, ang bawat isa ayon sa kanyang wika, sa kanilang mga angkan at mga bansa.
GEN_010_0006	Ang mga kaliwat ni Javan amo ang mga tawo sang Elisa, Tarsis, Kitim, kag Dodanim.	Ang mga anak ni Ham ay sina Cus, Mizraim, Put, at Canaan.
GEN_010_0007	Sila ang mga katigulangan sang mga tawo nga nag-estar sa mga baybayon kag sa mga kapuloan sang dagat.	Ang mga anak ni Cus ay sina Seba, Havila, Sabta, Raama, at Sabteca; at ang mga anak ni Raama: sina Sheba, at Dedan.
GEN_010_0008	Ini tanan amo ang mga kaliwat ni Jafet nga nag-estar sa nagkalainlain nga mga tribo kag mga pungsod, kag ang tagsa ka grupo may kaugalingon nga linggwahe.	Naging anak ni Cus si Nimrod na siyang nagsimulang maging makapangyarihan sa lupa.
GEN_010_0009	Ang mga anak nga lalaki ni Ham amo sanday Cus, Ehipto, Put kag Canaan.	Siya'y makapangyarihang mangangaso sa harap ng Panginoon kaya't karaniwang sinasabi: Gaya ni Nimrod na makapangyarihang mangangaso sa harapan ng Panginoon .
GEN_010_0010	Ang ila mga kaliwat nagdala sang ila mga ngalan.	At ang simula ng kanyang kaharian ay ang Babel, ang Erec, ang Acad, ang Calne, sa lupain ng Shinar.
GEN_010_0011	Ang mga kaliwat ni Cus amo ang mga tawo sang Seba, Havila, Sabta, Raama, kag Sabteca.	Buhat sa lupaing iyon ay nagtungo siya sa Asiria at itinayo ang Ninive, Rehobot-ir, at ang Cale, ang Resen, sa pagitan ng Ninive at ng Cale na isang malaking bayan.
GEN_010_0012	Ang mga kaliwat ni Raama amo ang mga tawo sang Seba kag Dedan.	At naging anak ni Mizraim sina Ludim, Anamim, Lehabim, at Naphtuhim, sina Patrusim, at Casluim na siyang pinagmulan ng mga Filisteo, at ang Caftoreo.
GEN_010_0013	Si Cus may anak nga lalaki nga ginhingalanan kay Nimrod, nga amo ang nahauna nga mandadaog sa kalibutan.	At naging anak ni Canaan sina Sidon, na kanyang panganay, at si Het, at ang mga Jebuseo, Amoreo, ang mga Gergeseo; ang mga Heveo, Araceo, ang Sineo, ang mga taga-Arvad, Zemareo, Hamateo at pagkatapos ay kumalat ang mga angkan ng Cananeo.
GEN_010_0014	Sa bulig sang Ginoo nanginsampaton sia nga mangangayam, amo ina nga ang mga tawo nagasiling, Kabay nga ang Ginoo maghimo sa imo nga sampaton nga mangangayam pareho kay Nimrod!	Ang hangganan ng lupain ng mga Cananeo ay mula sa Sidon, patungo sa Gerar, hanggang sa Gaza, patungo sa Sodoma at Gomorra, at Adma, at Zeboyin hanggang Lasa.
GEN_010_0015	Ang nahauna niya nga ginharian nagsakop sang Babel, Erec, kag Akad.	Ito ang mga anak ni Ham ayon sa kanilang angkan, wika, mga lupain, at kanilang mga bansa.
GEN_010_0016	Ini tanan lunsay sa duta sang Babilonia.	Nagkaroon din ng mga anak si Sem, na ama ng lahat ng mga anak ni Eber, na siyang matandang kapatid ni Jafet.
GEN_010_0017	Halin sa sadto nga duta nagkadto sia sa Asiria kag nagpatindog sang mga siudad sang Ninive, Rehobot-ir, Cala, kag Rezin, nga yara sa gintung-an sang Ninive kag sang daku nga siudad sang Cala.	Ang mga anak ni Sem: sina Elam, Ashur, Arfaxad, Lud, at Aram.
GEN_010_0018	Ang mga kaliwat ni Ehipto amo ang mga tawo sang Lud, Anam, Lehab, Naftu, Patru, Caslu, kag Creta nga amo ang ginhalinan sang mga Filistinhon.	Ang mga anak ni Aram: sina Uz, Hul, Geter, at Mas.
GEN_010_0019	Ang mga anak ni Canaan amo sanday Sidon kag si Het.	Naging anak ni Arfaxad sina Shela; at naging anak ni Shela si Eber.
GEN_010_0020	Ang ila mga kaliwat nagdala sang ila mga ngalan.	Nagkaanak si Eber ng dalawang lalaki; ang pangalan ng una'y Peleg; sapagkat sa mga araw niya'y nahati ang lupa; at ang pangalan ng kanyang kapatid ay Joktan.
GEN_010_0021	Si Canaan amo man ang ginhalinan sang mga Jebusnon, Amornon, Girgasanhon, Hevhanon, Arquinhon, Sinhanon, Arvadnon, Zemarnon, kag Hamatnon.	Naging anak ni Joktan sina Almodad, Shelef, Hazar-mavet, at si Jerah, sina Hadoram, Uzal, at Dicla, sina Obal, Abimael, at Sheba, sina Ofir, Havila, at Jobab.
GEN_010_0022	Sang ulihi ang nagkalainlain nga mga tribo sang Canaanhon naglapta, kag ang ila dulonan halin sa Sidon naglambot sa bagatnan sa Gerar tubtob sa Gaza, sa sidlangan sa Sodoma, Gomorra, Adma, kag Zeboim nga malapit sa Lasa.	Lahat ng ito ay mga naging anak ni Joktan.
GEN_010_0023	Amo ini sila ang mga kaliwat ni Ham nga nagaestar sa nagkalainlain nga mga tribo kag mga pungsod, kag ang tagsa ka grupo may kaugalingon nga linggwahe.	Ang naging tahanan nila ay mula sa Mesha, patungo sa Sefar, na siyang bundok sa silangan.
GEN_010_0024	Si Sem, ang magulang nga utod ni Jafet, amo ang ginhalinan sang tanan nga mga Hebreo.	Ito ang mga anak ni Sem, ayon sa kanilang angkan, wika, lupain, at bansa.
GEN_010_0025	Ang mga anak nga lalaki ni Sem amo sanday Elam, Asur, Arfaxad, Lud kag Aram.	Ito ang mga angkan ng mga anak ni Noe, ayon sa kanilang lahi, at bansa.
GEN_010_0026	Ang ila mga kaliwat nagdala sang ila mga ngalan.	Sa mga ito nagsimulang kumalat ang mga bansa pagkatapos ng baha.
GEN_010_0027	Ang mga kaliwat ni Aram amo ang mga tawo sang Uz, Hul, Geter, kag Mesec.	<MISSING TRANSLATION>
GEN_010_0028	Si Arfaxad amay ni Sela kag si Sela amay ni Eber.	<MISSING TRANSLATION>
GEN_010_0029	Si Eber may duha ka mga anak nga lalaki: ang isa ginhingalanan kay Peleg, kay sa iya panag-on ang mga tawo sa kalibutan nabahinbahin, kag ang ngalan sang iya utod amo si Joctan.	<MISSING TRANSLATION>
GEN_010_0030	Ang mga kaliwat ni Joctan amo ang mga tawo sang Almodad, Selef, Hazarmavet, Jera, Hadoram, Uzal, Dicla, Obal, Abimael, Seba, Ofir, Havila, kag Jobab.	<MISSING TRANSLATION>
GEN_010_0031	Ini sila tanan naghalin kay Joctan.	<MISSING TRANSLATION>
GEN_010_0032	Nag-estar sila sa duta halin sa Mesa pakadto sa Sefer tubtob sa mga bukid sa sidlangan.	<MISSING TRANSLATION>
GEN_010_0033	Amo ini sila ang mga kaliwat ni Sem nga nag-estar sa nagkalainlain nga mga tribo kag mga pungsod, kag ang tagsa ka grupo may kaugalingon nga linggwahe.	<MISSING TRANSLATION>
GEN_010_0034	Ini tanan nga mga tawo ang mga kaliwat ni Noe, suno sa ila mga nagkalainlain nga linahi kag mga pungsod.	<MISSING TRANSLATION>
GEN_010_0035	Sa tapos ang anaw ang tanan nga mga pungsod sang kalibutan naghalin sa sini nga mga anak ni Noe.	<MISSING TRANSLATION>
GEN_011_0001	Sang una, ang mga tawo sa bug-os nga kalibutan may isa lang ka linggwahe kag pareho nga mga pulong ang ila ginagamit.	Noon, ang buong lupa ay iisa ang wika at magkakatulad ang salita.
GEN_011_0002	Samtang nagapakadto sila sa sidlangan, nakalambot sila sa patag sang duta sang Babilonia kag nag-estar sila didto.	Sa kanilang paglalakbay sa silangan, nakatagpo sila ng isang kapatagan sa lupain ng Shinar, at sila'y tumira doon.
GEN_011_0003	Dayon nagsiling sila sa isa kag isa, Dali kamo, mahimo kita sing mga tisa kag aton ini patig-ahon sa hornohan.	At sinabi nila sa isa't isa, Halikayo!
GEN_011_0004	Gani may tisa sila nga inugpatindog, kag aspalto sa pagpatapik sang mga tisa.	Tayo'y gumawa ng mga tisa at ating lutuing mabuti.
GEN_011_0005	Dayon nagsiling sila, Dali, mahimo kita sing isa ka siudad nga may tore nga nagalambot sa langit, agod manginbantog kita kag indi kita maglapta sa bug-os nga duta.	At ang kanilang bato ay tisa at alkitran ang kanilang semento.
GEN_011_0006	Karon ang Ginoo nagpanaog sa pagtan-aw sang siudad kag sang tore nga ginpatindog sang mga tawo.	Sinabi nila, Halikayo!
GEN_011_0007	Kag nagsiling sia, Karon, ini nga mga tawo may pag-isa kag isa lang ang ila linggwahe.	Magtayo tayo ng isang lunsod at isang tore na ang taluktok nito ay hanggang sa langit, at gumawa tayo ng pangalan para sa ating mga sarili, baka tayo magkawatak-watak sa ibabaw ng buong lupa.
GEN_011_0008	Pamuno pa lang ini sang ila pagahimuon.	Bumaba ang Panginoon upang tingnan ang lunsod at ang tore na itinayo ng mga anak ng mga tao.
GEN_011_0009	Sa indi madugay magahimo sila sang bisan ano nga luyag nila!	At sinabi ng Panginoon , Tingnan ninyo, sila'y iisang bayan at may isang wika; at ito ay pasimula pa lamang ng kanilang gagawin, at ngayon, walang makakapigil sa anumang kanilang binabalak gawin.
GEN_011_0010	Dali, manaog kita kag tublagon ta ang ila panghambal agod nga indi sila mag-intiendihanay.	Halikayo!
GEN_011_0011	Gani ginpaalaplaag sila sang Ginoo sa bug-os nga duta, kag nauntat ang ila paghimo sang siudad.	Tayo'y bumaba at ating guluhin ang kanilang wika, upang hindi nila maunawaan ang pananalita ng bawat isa.
GEN_011_0012	Ang siudad gintawag Babilonia, tungod kay didto gintublag sang Ginoo ang linggwahe sang tanan nga mga tawo, kag halin didto ginpalapta niya sila sa bug-os nga kalibutan.	Kaya't ikinalat sila ng Panginoon mula roon sa ibabaw ng buong lupa, at huminto sila sa pagtatayo ng lunsod.
GEN_011_0013	Amo ini ang mga kaliwat ni Sem.	Kaya't ang ipinangalan dito ay Babel, sapagkat doon ay ginulo ng Panginoon ang wika ng buong lupa, at mula roon ay ikinalat sila ng Panginoon sa ibabaw ng buong lupa.
GEN_011_0014	Duha ka tuig sa tapos sang anaw, sang si Sem nagaedad sing 100 ka tuig, natawo ang iya anak nga lalaki nga si Arfaxad.	Ito ang mga salinlahi ni Sem.
GEN_011_0015	Sa tapos sini, nagkabuhi sia sing 500 pa ka tuig kag may iban pa sia nga mga kabataan.	May isandaang taong gulang si Sem nang maging anak si Arfaxad, dalawang taon pagkatapos ng baha.
GEN_011_0016	Sang si Arfaxad nagaedad na sing trayntay singko ka tuig, natawo ang iya anak nga lalaki nga si Sela.	Nabuhay si Sem ng limandaang taon pagkatapos na maipanganak si Arfaxad, at nagkaanak pa ng mga lalaki at mga babae.
GEN_011_0017	Sa tapos sini, nagkabuhi sia sing 403 pa ka tuig kag may iban pa sia nga mga kabataan.	Nang si Arfaxad ay tatlumpu't limang taon, naging anak niya si Shela.
GEN_011_0018	Sang si Sela nagaedad na sing traynta ka tuig, natawo ang iya anak nga lalaki nga si Eber.	Nabuhay si Arfaxad ng apatnaraan at tatlong taon pagkatapos na maipanganak si Shela, at nagkaanak pa ng mga lalaki at mga babae.
GEN_011_0019	Sa tapos sini, nagkabuhi sia sing 403 pa ka tuig kag may iban pa sia nga mga kabataan.	Nabuhay si Shela ng tatlumpung taon, at naging anak si Eber.
GEN_011_0020	Sang si Eber nagaedad sing trayntay kwatro ka tuig, natawo ang iya anak nga lalaki nga si Peleg.	Nabuhay si Shela ng apatnaraan at tatlumpung taon pagkatapos na maipanganak si Eber, at nagkaanak pa ng mga lalaki at mga babae.
GEN_011_0021	Sa tapos sini, nagkabuhi sia sing 430 pa ka tuig kag may iban pa sia nga mga kabataan.	Nabuhay si Eber ng tatlumpu't apat na taon, at naging anak si Peleg.
GEN_011_0022	Sang si Peleg nagaedad sing traynta ka tuig, natawo ang iya anak nga lalaki nga si Reu.	Nabuhay si Eber ng apatnaraan at tatlumpung taon pagkatapos na maipanganak si Peleg, at nagkaanak pa ng mga lalaki at mga babae.
GEN_011_0023	Sa tapos sini, nagkabuhi sia sing 209 pa ka tuig kag may iban pa sia nga mga kabataan.	Nabuhay si Peleg ng tatlumpung taon, at naging anak si Reu.
GEN_011_0024	Sang si Reu nagaedad sing trayntay dos ka tuig, natawo ang iya anak nga lalaki nga si Serug.	Nabuhay si Peleg ng dalawang daan at siyam na taon pagkatapos na maipanganak si Reu, at nagkaanak pa ng mga lalaki at mga babae.
GEN_011_0025	Sa tapos sini, nagkabuhi sia sing 207 pa ka tuig kag may iban pa sia nga mga kabataan.	Nabuhay si Reu ng tatlumpu't dalawang taon, at naging anak si Serug.
GEN_011_0026	Sang si Serug nagaedad sing traynta ka tuig, natawo ang iya anak nga lalaki nga si Nahor.	Nabuhay si Reu ng dalawang daan at pitong taon pagkatapos na maipanganak si Serug, at nagkaanak pa ng mga lalaki at mga babae.
GEN_011_0027	Sa tapos sini, nagkabuhi sia sing 200 pa ka tuig kag may iban pa sia nga mga kabataan.	Nabuhay si Serug ng tatlumpung taon, at naging anak si Nahor.
GEN_011_0028	Sang si Nahor nagaedad sing baynte nwebe ka tuig, natawo ang iya anak nga lalaki nga si Tera.	Nabuhay si Serug ng dalawang daang taon pagkatapos maipanganak si Nahor, at nagkaanak pa ng mga lalaki at mga babae.
GEN_011_0029	Sa tapos sini, nagkabuhi sia sing 119 pa ka tuig kag may iban pa sia nga mga kabataan.	Nabuhay si Nahor ng dalawampu't siyam na taon, at naging anak si Terah.
GEN_011_0030	Sa tapos makaedad si Tera sing setenta ka tuig, natawo ang iya mga anak nga amo sanday Abram, Nahor, kag Haran.	Nabuhay si Nahor ng isandaan at labinsiyam na taon pagkatapos na maipanganak si Terah, at nagkaanak pa ng mga lalaki at mga babae.
GEN_011_0031	Amo ini ang mga kaliwat ni Tera.	At nabuhay si Terah ng pitumpung taon, at naging anak sina Abram, Nahor at Haran.
GEN_011_0032	Si Tera amay nanday Abram, Nahor, kag Haran.	Ito ang mga lahi ni Terah.
GEN_011_0033	Si Haran amay ni Lot.	Naging anak ni Terah sina Abram, Nahor, at Haran; at naging anak ni Haran si Lot.
GEN_011_0034	Si Haran napatay sa iya kaugalingon nga banwa sang Ur sakop sang Babilonia sang buhi pa ang iya amay.	Unang namatay si Haran kaysa sa kanyang amang si Terah sa lupaing kanyang tinubuan, sa Ur ng mga Caldeo.
GEN_011_0035	Si Abram nagpangasawa kay Sarai, kag si Nahor nagpangasawa kay Milca, ang bata nga babayi ni Haran nga amay man ni Isca.	At nagsipag-asawa sina Abram at Nahor.
GEN_011_0036	Si Sarai wala makapamata.	Ang pangalan ng asawa ni Abram ay Sarai, at ang pangalan ng asawa ni Nahor ay Milca, na anak na babae ni Haran na ama nina Milca at Iscah.
GEN_011_0037	Gindala ni Tera ang iya anak nga lalaki nga si Abram, ang iya apo nga lalaki nga si Lot nga anak nga lalaki ni Haran, kag ang iya umagad nga babayi nga si Sarai, nga asawa ni Abram, kag naghalin sila sa siudad sang Ur sang Babilonia sa pagkadto sa duta sang Canaan.	At si Sarai ay baog; siya'y walang anak.
GEN_011_0038	Naglakat sila tubtob sa Haran kag didto nag-estar sila.	Isinama ni Terah si Abram na kanyang anak, at si Lot na anak ni Haran, na anak ng kanyang anak, at si Sarai na kanyang manugang na asawa ni Abram na kanyang anak at sama-samang umalis sa Ur ng mga Caldeo upang magtungo sa lupain ng Canaan.
GEN_011_0039	Didto napatay si Tera sang nagaedad sia sang 205 ka tuig.	Dumating sila sa Haran, at nanirahan doon.
GEN_011_0040	<MISSING TRANSLATION>	At ang mga naging araw ni Terah ay dalawandaan at limang taon, at namatay si Terah sa Haran.
GEN_012_0001	Karon ang Ginoo nagsiling kay Abram, Halin ka sa imo kaugalingon nga duta, sa imo mga pariente, kag sa panimalay sang imo amay, kag magkadto ka sa isa ka duta nga igapakita ko sa imo.	Sinabi ng Panginoon kay Abram, Umalis ka sa iyong lupain, sa iyong mga kamag-anak, sa bahay ng iyong ama, at pumunta ka sa lupaing ituturo ko sa iyo.
GEN_012_0002	Hatagan ko ikaw sing madamo nga mga kaliwat kag mangin-isa sila ka daku nga pungsod.	Gagawin kitang isang malaking bansa, ikaw ay aking pagpapalain, gagawin kong dakila ang iyong pangalan, at ikaw ay magiging isang pagpapala.
GEN_012_0003	Bendisyunan ko ikaw kag himuon ko nga manginbantog ang imo ngalan, agod nga paagi sa imo madamo ang makabaton sing mga kaayuhan.	Pagpapalain ko ang magbibigay ng pagpapala sa iyo, at susumpain ko ang mga susumpa sa iyo; at sa pamamagitan mo ang lahat ng angkan sa lupa ay pagpapalain.
GEN_012_0004	Pakamaayuhon ko ang mga nagapakamaayo sa imo, pero pakamalauton ko ang mga nagapakamalaut sa imo.	Kaya't umalis si Abram ayon sa sinabi sa kanya ng Panginoon , at si Lot ay sumama sa kanya.
GEN_012_0005	Ang tanan nga mga pungsod sa duta magapangayo sa akon nga pakamaayuhon ko subong sang akon pagpakamaayo sa imo.	Si Abram ay may pitumpu't limang taong gulang nang umalis siya sa Haran.
GEN_012_0006	Sang si Abram nagaedad sing setentay singko ka tuig, naghalin sia sa Haran, suno sa ginsiling sang Ginoo sa iya, kag si Lot nag-upod sa iya.	Isinama ni Abram si Sarai na kanyang asawa, at si Lot na anak ng kanyang kapatid, at ang lahat ng pag-aaring kanilang natipon at ang mga taong kanilang nakuha sa Haran; at umalis sila upang pumunta sa lupain ng Canaan at nakarating sila roon.
GEN_012_0007	Gindala ni Abram ang iya asawa nga si Sarai, ang iya hinablos nga si Lot, ang tanan nga manggad kag ang tanan nga mga ulipon nga ila nakuha sa Haran, kag naglakat sila pakadto sa duta sang Canaan.	Dumaan sa lupain si Abram hanggang sa lugar ng Shekem, sa punong ensina ng More.
GEN_012_0008	Sang pag-abot nila sa Canaan, si Abram naglatas sa duta tubtob nakalambot sia sa balaan nga kahoy sang More sa balaan nga lugar sa Siquem.	Noon, ang mga Cananeo ay nasa lupaing iyon.
GEN_012_0009	Sa sadto nga panahon ang mga Canaanhon nagaestar pa sa sadto nga duta.	Nagpakita ang Panginoon kay Abram, at sinabi, Ibibigay ko ang lupaing ito sa iyong lahi.
GEN_012_0010	Ang Ginoo nagpakita kay Abram kag nagsiling sa iya, Amo ining duta nga ihatag ko sa imo mga kaliwat.	At siya'y nagtayo roon ng isang dambana sa Panginoon na nagpakita sa kanya.
GEN_012_0011	Dayon si Abram nagpatindog didto sing altar para sa Ginoo nga nagpakita sa iya.	Mula roon ay lumipat siya sa bundok na nasa silangan ng Bethel, at doon niya itinayo ang kanyang tolda, na nasa kanluran ang Bethel, at nasa silangan ang Ai.
GEN_012_0012	Sa tapos sini, nagsaylo sia sa bagatnan didto sa bukid sa sidlangan sang siudad sang Betel kag didto nagpatindog sia sang iya tolda sa gintung-an sang Betel kag Ay.	Siya'y nagtayo roon ng dambana sa Panginoon , at tinawag ang pangalan ng Panginoon .
GEN_012_0013	Ang Betel sa nakatundan kag ang Ay sa sidlangan.	Si Abram ay patuloy na naglakbay hanggang sa Negeb.
GEN_012_0014	Didto naghimo man sia sang altar kag nagsimba sa Ginoo .	Nagkagutom sa lupain kaya't bumaba si Abram sa Ehipto upang manirahan doon sapagkat mahigpit ang taggutom sa lupain.
GEN_012_0015	Sang ulihi si Abram nagpadayon sa pagpanglakaton pakadto sa bagatnan sang Canaan.	Nang siya'y malapit na sa Ehipto, sinabi niya kay Sarai na kanyang asawa, Alam kong ikaw ay isang babaing maganda sa paningin; at kapag nakita ka ng mga Ehipcio ay kanilang sasabihin, Ito'y kanyang asawa; at ako'y kanilang papatayin, subalit hahayaan ka nilang mabuhay.
GEN_012_0016	Karon may tiggulotom sa Canaan.	Sabihin mong ikaw ay aking kapatid upang ako'y mapabuti dahil sa iyo, at upang ang buhay ko'y makaligtas dahil sa iyo.
GEN_012_0017	Tungod kay tama gid ang tiggulotom, si Abram nagpabagatnan pa gid tubtob sa Ehipto, sa pag-estar didto sa malip-ot nga tion.	Nang dumating si Abram sa Ehipto, nakita ng mga Ehipcio na ang babae ay napakaganda.
GEN_012_0018	Sang nagahinampot na sila sa dulonan pakadto sa Ehipto, nagsiling si Abram sa iya asawa, Sarai, matahom ikaw nga babayi.	Nang makita siya ng mga pinuno ng Faraon, siya'y kanilang pinuri kay Faraon, at dinala ang babae sa bahay ng Faraon.
GEN_012_0019	Kon makita ikaw sang mga Ehiptohanon magasiling sila, Asawa sia ni Abram, kag pagapatyon nila ako kag tugotan ka nga mabuhi.	At pinagpakitaan niya ng magandang loob si Abram dahil kay Sarai at nagkaroon si Abram ng mga tupa, baka, lalaking asno, aliping lalaki at alilang babae, babaing asno, at mga kamelyo.
GEN_012_0020	Maayo pa nga singganon mo sila nga utod ko ikaw.	Subalit pinahirapan ng Panginoon ang Faraon at ang kanyang sambahayan ng malubhang salot dahil kay Sarai na asawa ni Abram.
GEN_012_0021	Dayon tungod sa imo indi nila ako pagpatyon kag ayuhan nila ako.	Tinawag ng Faraon si Abram, at sinabi, Ano itong ginawa mo sa akin?
GEN_012_0022	Sang makaabot na sila sa Ehipto, nakita matuod sang mga Ehiptohanon nga ang iya asawa matahom.	Bakit hindi mo sinabi sa akin na siya'y iyong asawa?
GEN_012_0023	May mga opisyales sang hari nga nakakita sa iya kag ginsugiran nila ang hari kon daw ano katahom sa iya, gani gindala sia sa palasyo sang hari.	Bakit mo sinabing, Siya'y aking kapatid?
GEN_012_0024	Tungod kay Sarai, gin-ayuhan sang hari si Abram kag ginhatagan sia sing mga karnero kag mga kanding, mga baka, mga asno, mga ulipon kag mga kamelyo.	na anupa't siya'y aking kinuha upang maging asawa.
GEN_012_0025	Pero tungod kay ginkuha sang hari si Sarai, ang Ginoo nagpadala sing mga makangilidlis nga mga balatian sa hari kag sa iya mga ginsakpan sa palasyo.	Kaya't ngayon, narito ang iyong asawa.
GEN_012_0026	Gani ginpatawag sang hari si Abram kag ginpamangkot, Ano ining ginhimo mo sa akon?	Siya'y kunin mo at umalis ka.
GEN_012_0027	Ngaa wala ka magsiling sa akon nga asawa mo sia?	At nag-utos ang Faraon sa mga tao tungkol sa kanya, at siya'y kanilang inihatid sa daan, ang kanyang asawa, at ang lahat ng kanyang pag-aari.
GEN_012_0028	Ngaa nagsiling ka nga utod mo sia kag gintugotan mo nga kuhaon ko sia subong akon asawa?	<MISSING TRANSLATION>
GEN_012_0029	Yari ang imo asawa!	<MISSING TRANSLATION>
GEN_012_0030	Kuhaa sia kag maghalin kamo diri!	<MISSING TRANSLATION>
GEN_012_0031	Ang hari nagmando sa iya mga tinawo nga kuhaon si Abram, gani ginkuha nila si Abram kag ginpahalin sia sa sadto nga duta upod sang iya asawa kag sang tanan nila nga mga pagkabutang.	<MISSING TRANSLATION>
GEN_013_0001	Halin sa Ehipto si Abram nagpaaminhan padulong sa bagatnan nga bahin sang Canaan, upod sang iya asawa kag sang tanan nila nga mga pagkabutang.	Umahon sa Negeb mula sa Ehipto si Abram, ang kanyang asawa, dala ang lahat ng kanyang pag-aari, at si Lot.
GEN_013_0002	Si Lot nag-upod man sa iya.	At si Abram ay napakayaman sa hayop, pilak, at ginto.
GEN_013_0003	Si Abram manggaranon kaayo.	Nagpatuloy si Abram ng kanyang paglalakbay mula sa Negeb hanggang sa Bethel, hanggang sa dakong kinaroroonan ng kanyang tolda sa pagitan ng Bethel at ng Ai; sa lugar ng dambana na kanyang ginawa roon nang una; at doon ay tinawag ni Abram ang pangalan ng Panginoon .
GEN_013_0004	May mga karnero sia, mga kanding, mga baka, kag subong man mga pilak kag mga bulawan.	Si Lot na sumama kay Abram ay mayroon ding mga tupa, baka, at mga tolda.
GEN_013_0005	Nagpanglakaton sia halin sa isa ka lugar pakadto sa isa padulong sa Betel, sa lugar nga iya man anay ginpatindugan sang iya tolda sa gintung-an sang Betel kag Ay, sa diin sia man anay naghimo sing altar, kag didto nagsimba sia sa Ginoo .	Hindi makayanan ng lupain na sila'y manirahang magkasama sapagkat napakarami ng kanilang pag-aari.
GEN_013_0006	Si Lot nga nag-upod kay Abram may mga karnero man, mga kanding, kag mga baka kag may iya man kaugalingon nga panimalay kag mga suloguon.	At nagkaroon ng pagtatalo ang mga pastol ng hayop ni Abram at ang mga pastol ng hayop ni Lot.
GEN_013_0007	Tungod kay sila nga duha may madamo gid nga mga kasapatan indi sila makapadayon sa pag-estar sing tingob kay ang palahalban indi makaigo sa ila.	Ang Cananeo at ang Perezeo ay naninirahan noon sa lupain.
GEN_013_0008	Gani ang mga tinawo ni Abram kag ni Lot nga nagaatipan sang ila mga kasapatan nagailinaway.	Sinabi ni Abram kay Lot, Huwag na tayong magkaroon ng pagtatalo, maging ang ating mga pastol, sapagkat tayo'y magkapatid.
GEN_013_0009	Sa sadto nga tion ang mga Canaanhon kag mga Peresnon nagaestar pa sa sadto nga duta.	Di ba nasa harapan mo ang buong lupain?
