id	book	chapter	sentence_no	source_text	target_text
GEN_030_1	GEN	030	1	Dayon naglakat sia palayo halin kay Jacob upod sa sining mga panong sa sulod sing tatlo ka adlaw.	Linaut ya kang Jacob; ing laut na kalupa na ning dasnan na ning taung maglakad atlung aldo.
GEN_030_1	GEN	030	1	Pero sadto nga adlaw ginpain ni Laban ang lalaki nga mga kanding nga may gurayguray ukon pintukpintok kag ang tanan nga babayi nga mga kanding nga may pintukpintok kag kambang ukon ang may puti. Ginpain man niya ang tanan nga mga karnero nga itom. Ginpaatipan niya ini sa iya mga anak nga lalaki.	Keta mu ring aldong ita kelilua na lang Laban ding maki tagpi at pultik-pultikan karing kambing, potru ya man o gaindu, antimu rin ding matuling a tupa at saka na la pepasese karing anak na.
GEN_030_1	GEN	030	1	tugoti ako sa pagtan-aw sang imo tanan nga mga panong kag sa pagkuha sang tanan nga itom nga kordero kag sang tanan nga kambang kag may pintukpintok nga mga tinday sang kanding.	Puntalan ku la ngeni ding tupa yu at ikawani ke ing balang tupang maki pultik a matuling at balang tupang matuling at ing balang kambing a maki tagpi at pultik-pultikan karing kanakung kambing.
GEN_030_1	GEN	030	1	Si Laban nagsabat, Sugot ako.	Mekibat ya i Laban, Wa, buri ku ing sinabi mu!
GEN_030_1	GEN	030	1	Sa ulihi mahapos mo mahibal-an kon nagdaya ako sa imo.	King daratang a panaun, potang lawan yu la deting upa ku, abalu yu nung tapat ku kekayu o ali.
GEN_030_2	GEN	030	2	Gani naghulid sia sa iya sadto nga gab-i.	Inya ketang benging ita siniping ya i Jacob kang Lea.
GEN_030_2	GEN	030	2	Gani ginhingalanan niya sia kay Jose.	Ngana wari, Dinan na ku pa sana ning Ginu metung pang anak a lalaki.
GEN_030_2	GEN	030	2	Himuon ta ang ginasiling mo.	Iti ya ing gawan ta.
GEN_030_2	GEN	030	2	Si Jacob nag-atipan sang nabilin nga mga panong ni Laban.	At pistulan na lang Jacob ding mitagan karing kawan nang Laban.
GEN_030_2	GEN	030	2	Ginbutang niya ini didto tungod kay ang mga hayop nagakastahanay kon mag-inom sila.	Binili na la karin uling mipangasta la karin ding animal
GEN_030_2	GEN	030	2	Karon dapat na man ako magpaninguha para sa akon kaugalingon nga panimalay.	Kapilan ku pa manatagan para king sarili kung pamilya?
GEN_030_2	GEN	030	2	Sa sini nga paagi nagdamo ang iya mga hayop kag wala niya pag-isimpon ini sa iya ni Laban.	Makanyan yang mika sariling kawan i Jacob, at e na la pekiabe deti karing kawan nang Laban.
GEN_030_2	GEN	030	2	Nagpanguha sia sini kag gindala niya sa iya iloy nga si Lea.	Dela na la kang ima nang i Lea.
GEN_030_2	GEN	030	2	Kon mag-usisa ka sang akon suhol, kon may kanding ako nga indi kambang ukon wala sang pintukpintok ukon karnero nga indi itom, dayon makasiling ka nga ina kinawatan ko.	Nung ala yang tagpi o pultikan ya ing kambing at nung e ya matuling ing tupa iti penako ya!
GEN_030_2	GEN	030	2	Ginpamatian niya ang akon pangamuyo kag ginhatagan niya ako sing isa ka anak nga lalaki.	Pekiramdaman na ing panalangin ku at dininan na kung anak a lalaki.
GEN_030_2	GEN	030	2	Huliri sia, agod magbata sia para sa akon. Sa sini nga paagi mangin-iloy ako sang isa ka bata.	Sipingnan me ban kanita mikayanak ku king kapamilatan na.
GEN_030_2	GEN	030	2	Nakahibalo gid ikaw kon daw ano ang akon pagpangalagad sa imo.	E naman makalingad kekayu nung makananu ra kayung masalese siyuan.
GEN_030_2	GEN	030	2	Amo lang ini nga suhol ang luyag ko.	Ila deti ring maging kanakung upa.
GEN_030_2	GEN	030	2	Gani ginhingalanan niya sia kay Isacar.	Inya pemalagyuan neng Isacar ing anak.
GEN_030_2	GEN	030	2	Gani ang mga maluya iya ni Laban, kag ang mga mabakod iya ni Jacob.	Makanyan lang miras kang Laban ding animal a mangaina, samantalang miras la ngan kang Jacob ding animal a mangasikan.
GEN_030_2	GEN	030	2	Karon ang akon bana magapasidungog sa akon, tungod kay nagbata ako sa iya sing anom ka lalaki.	Ngeni lubus na na kung luguran ning asawa ku uling anam na lang lalaki ding ayanak ku.
GEN_030_2	GEN	030	2	Gani ginhingalanan niya sia kay Neftali.	Inya pemalagyuan neng Neftali ing anak.
GEN_030_2	GEN	030	2	Gani ginhingalanan niya sia kay Gad.	Inya pemalagyuan neng Gad ing anak.
GEN_030_2	GEN	030	2	Ginpamatian niya ang pangamuyo ni Raquel kag ginbuot niya nga makapamata sia.	Pekiramdaman na ing panalangin na at leko ne pangabaug.
GEN_030_2	GEN	030	2	Nagsiling sia, Ginkuha sang Dios ang akon kahuloy-an paagi sa paghatag sa akon sang anak nga lalaki.	Ngana, Leko na ning Dios ing kamarinayan ku.
GEN_030_2	GEN	030	2	Karon ang mga babayi magatawag sa akon nga malipayon.	Ngeni ausan da kung masaya ding babai.
GEN_030_3	GEN	030	3	Gani ginhingalanan niya sia kay Zabulon.	Inya pemalagyuan neng Zebulun ing anak.
GEN_030_3	GEN	030	3	Gani ginhingalanan niya sia kay Aser.	Inya pemalagyuan neng Aser ing anak.
GEN_030_3	GEN	030	3	Gani ginhingalanan niya sia kay Dan.	Inya pemalagyuan neng Dan ing anak.
GEN_030_3	GEN	030	3	Si Raquel nagsiling kay Lea, Hatagi man ako sang mandragora sang imo anak.	Nganang Raquel kang Lea, Dinan mu na ku mo kareng mandragorang kalap ning anak mo.
GEN_031_1	GEN	031	1	Ako ang Dios nga nagpakita sa imo sa Betel, sa diin ginhibuan mo sing lana sang olivo kag ginhalad ang handumanan nga bato, kag sa diin nagsumpa ka.	Aku ing Dios a pepakit keka karin king Betel nung nu me telaga at linian ing metung a batu. Karin sinumpa ka kanaku.
GEN_031_1	GEN	031	1	Dali, mahimo kita sing kasugtanan, kag magtumpok kita sang mga bato sa pagpahanumdom sa aton sang aton kasugtanan.	Nganang Laban kang Jacob, Anak ku la deting babai; apu ku la ding anak da, at ding kawan, kawan ku la. Kanaku ing heganaganang akakit mu. Nanu ing malyari kung gawan ngeni kareting anak ku o karing anak a beit da?
GEN_031_1	GEN	031	1	Ang anghel sang Dios nagtawag sa akon paagi sa damgo kag nagsiling, Jacob!	At king paninap sinabi na kanaku ning anghel ning Dios, Jacob!
GEN_031_1	GEN	031	1	Sa tion sang pagpahigal sang mga hayop, nagdamgo ako, kag nakita ko nga ang lalaki nga mga kanding nga nagapangasta may gurayguray, may pintukpintok kag kambang.	Misan, panaun na kanita ning pamipapaglahi ra ding animal, meninap ku at ikit ku la ding potru a pawa ngang gulis-gulisan at tagpian.
GEN_031_1	GEN	031	1	Ang Dios nagkuha sang mga kahayupan sang inyo amay kag ginhatag sila sa akon.	Makanyan na lang linipat kanaku ning Dios ding kawan nang tata yu.
GEN_031_1	GEN	031	1	Sa madamo nga tion nag-antos ako sang tagiti sang init kon adlaw kag sang katugnaw kon gab-i kag wala ako matulogi.	Nung atin lang apate ding mabangis a animal e ku na la papakit kekayu; agad ku na lang alilan; meging katungkulan keng alilan ing mepanako neng aldo o neng bengi.
GEN_031_1	GEN	031	1	Kon magsiling gani sia, Ang mga may pintukpintok manginsuhol mo, ang tanan nga mga hayop nagbata sing may pintukpintok.	Potang sabian nang tata yu, Ding tagpian a kambing ila ding upa mu, manganak yang tagpian a biseru ing mabilug a kawan.
GEN_031_1	GEN	031	1	Kon ang isa ka karnero mapatay sang talunon nga mga sapat wala ko ina ginaisip sa imo parti, kundi ginaisip ko ina nga akon parti. Ang ginakawat sa adlaw ukon sa gab-i man ginapabayran mo sa akon.	Kilub ding aduang pulung banuang sinuyu ku kekayu, e la tinuknang merakal ding tupa yu o kambing at e ku mengangas mengan agyang metung mung tupa karing kekayung kawan.
GEN_031_1	GEN	031	1	Pero gindayaan niya ako, kag kanapulo gid niya gin-ilis-ilisan ang akon suhol.	Makanyan man pemiraitnan na ku pa at mekatapulu na nang besis inalilan ing upa na kanaku.
GEN_031_1	GEN	031	1	Kamo nga duha nakahibalo gid nga nagpangabudlay ako para sa inyo amay sa bug-os ko nga kusog.	Balu yu munaman nung makananu kung sinuyu kang tata yu king anggang agyu ku.
GEN_031_1	GEN	031	1	Nagsiling sia sa ila, Natalupangdan ko nga ang pagkabig sang inyo amay sa akon lain na gid sang sa una. Pero ang Dios sang akon amay nagaupod sa akon gihapon.	Ngana karela, Apansinan ku king menaliwa ya lawe kanaku i tata yu; e na anti kanitang milabas; pero e na ku kewanian ning Dios nang tata ku.
GEN_031_1	GEN	031	1	Gani ginpatawag ni Jacob si Raquel kag si Lea nga magkadto sila sa latagon sa diin yara ang iya mga panong.	Pepayaus na lang Jacob di Raquel at Lea at pepapuntalan na la king marangle nung nu la papastulan ding animal a sese na.
GEN_031_1	GEN	031	1	Dayon ang GINOO nagsiling sa iya, Magbalik ka sa duta sang imo mga ginikanan kag sa imo mga pariente kag ako manginkaupod mo.	Kanita ngana ning Ginu kang Jacob, Magbalik na ka king tuknangan da ring kekang makatua at kamaganak at antabayanan da ka!
GEN_031_1	GEN	031	1	Nakita man ni Jacob nga ang pagkabig sa iya ni Laban karon lain na gid sang sa una.	Apansinan na namang Jacob king menaliwa ya paglalawe i Laban; e na na kalupa ning sadia.
GEN_031_1	GEN	031	1	Si Jacob nakabati nga ang mga anak nga lalaki ni Laban nagasiling, Ginkuha ni Jacob ang tanan nga mga pagkabutang sang aton amay. Ang iya tanan nga manggad naghalin sa pagkabutang sang aton amay.	Abalitan nang Jacob king sasabian da ring bayo nang lalaki ing anti kaniti: Kinua nang Jacob ing heganaganang pibandian nang tatang mi at ketang pibandian nang tatang mi karin menibat ing heganaganang pibandian na.
GEN_031_1	GEN	031	1	Ang Dios ni Abraham kag ang Dios ni Nahor magahukom sa tunga naton. Dayon si Jacob naghimo sang panaad sa ngalan sang Dios nga ginsimba sang iya amay nga si Isaac.	Patutu la ring batung pitumpak-tumpak at iting batung telakad ku king alang lalagpas kekata kareti a ating e mayap a nasa.
GEN_031_1	GEN	031	1	Nag-ihaw sia sing isa ka sapat kag ginhalad niya ini sa bukid, kag gin-agda niya ang iya mga tinawo sa pagkaon.	Ing Dios nang Abraham at ing Dios nang Nahor, ing Dios da ring karelang pipumpunan, ilang matul kekatamu!
GEN_031_1	GEN	031	1	Sa sulod sang baynte ka tuig nga nag-estar ako sa imo, ang imo mga karnero kag mga kanding wala gid mahar-asi kag wala gid ako makaihaw sang imo karnero nga lalaki halin sa imo panong.	Ngening asiasat yu na ngan ing pibandian ku, menakit kayung nanumang bandi yo? Palto ya mu arapan da ring kamaganak yu at kamaganak ku at paburen yung ilang matul nung ninu kekatamung adua ing makamatulid.
GEN_031_1	GEN	031	1	Aga pa gid sang madason nga adlaw, ginhalukan ni Laban ang iya mga apo kag mga anak nga babayi sa pagpaalam sa ila, kag naglakat sia pauli.	Kaybat na nita miyampang yang metung a ain i Jacob karin king bunduk, at inagkat na lang makisulu ding kamaganak na. Kayari dang mengan, pepalabasan de ing bengi karin.
GEN_031_1	GEN	031	1	Nagsiling sia, Tan-awa, ang tanan nga mga kanding nga lalaki nga nagapangasta may gurayguray, may pintukpintok kag kambang. Ginahimo ko ini tungod kay nakita ko ang tanan nga ginahimo sa imo ni Laban.	Pakalawan mu la, ngana, pawa la ngang gulis-gulisan at tagpian ampon pultik-pultikan ding potrung maglahi king kawan; uli na ning e makalingad kanaku ing pamaniaptan nang Laban keka.
GEN_031_1	GEN	031	1	Karon nga nausisa mo ang tanan ko nga mga pagkabutang, ano bala nga pagkabutang ang nakita mo nga imo?	Inya mimua ya i Jacob at bignus na ing mua na kang Laban. Ngana, Nanu wari ing e ustung depat ku?
GEN_031_1	GEN	031	1	Si Raquel kag si Lea nagsabat kay Jacob, Wala na kami sing may nabilin nga panublion sa amon amay.	Kanita kitang da ri Raquel at Lea, Atin ke pa kayang dake king pimamanan king pibandian na ning kekaming tata?
GEN_031_1	GEN	031	1	Amo ini ang inagihan ko sa sulod sang baynte ka tuig sang akon pag-estar sa imo. Nagpangalagad ako sa imo sa sulod sang katorse ka tuig para sa duha mo ka mga anak nga babayi kag nag-alagad ako sing anom pa ka tuig para sa imo mga panong kag kapulo mo liwatliwaton ang akon suhol.	Pibabata ku ing maduluk king pali ning aldo at ing dimla ning bengi angga na king e ku mipapatudtud.
GEN_031_1	GEN	031	1	Ginakabig niya kami kasubong sang mga dumoluong. Ginbaligya niya kami, kag karon naubos na niya gasto ang bili namon.	Tuturing na na kami mung dayuan; pisali na kami at agastus na la ring ayabli na.
GEN_031_1	GEN	031	1	Ining tinumpok nga mga bato kag ining bato nga handumanan amo ang magapahanumdom sa aton. Indi ako maglabang sa sining tinumpok nga mga bato sa paggubat sa imo, kag indi ka maglabang sa sining bato nga handumanan sa paggubat sa akon.	Ngana pang Laban kang Jacob, Oreni ding batung pitumpak-tumpak ku at ing batung palatandanan a telakad ku pilatan ta.
GEN_031_1	GEN	031	1	Yari ang mga bato nga gintumpok ko sa tunga naton, kag yari ang bato nga handumanan.	Nung sakaling alipustan mu la ding anak kung babai o kaya makiasawa kang aliwa, tandanan mu king agyamang alang manakit, ing Dios ya ing saksi keka at kaku.
GEN_031_1	GEN	031	1	Si Laban nagsiling pa gid, Kon pintasan mo ang akon mga anak nga babayi, ukon magpangasawa ka sang iban nga mga babayi, bisan nga indi ako makahibalo sini, dumdoma nga ang Dios nagatan-aw sa aton.	Meyaus ya namang Mizpa, uling nganang Laban, Banten na kata sana ning Dios kabang e kata mikakit.
GEN_031_1	GEN	031	1	Dayon si Jacob nanginit kag naghambal nga may kaakig kay Laban, Ano bala ang akon sala?	Nganang Raquel kang tata na, Tatang, e yu sana pagkasala ing e ku mitalakad arapan yu; makaratang ing regla ku.
GEN_031_1	GEN	031	1	Si Laban nagsiling man, Kabay nga ang Ginoo magbantay sa aton samtang nagahilayuay kita.	Nganang Laban, Saksi ya iti keka at kaku king aldong iti.
GEN_031_1	GEN	031	1	Si Laban nagsiling kay Jacob, Ining tinumpok nga bato magapahanumdom sa aton nga duha. Amo ini ang kabangdanan kon ngaa ang lugar ginhingalanan Galeed.	Inaus neng Laban Yegar-sahaduta iting lugal, pero Galed naman ing inaus nang Jacob kaniti.
GEN_031_1	GEN	031	1	Si Laban naghingalan sini Jegar-sahaduta, pero ginhingalanan ini ni Jacob Galeed.	Nganang Jacob karing tauan na, Manipun kayung batu. Menipun la at pitumpak-tumpak da la at kaybat misulusulu lang mengan lele da ring makabuntun a batu.
GEN_031_1	GEN	031	1	Ginsugo niya ang iya mga tinawo sa pagtipon sang mga bato kag sa pagtumpok sini. Dayon nagkaon sila sa tupad sang tinumpok nga bato.	Kanita mibili yang batu i Jacob bilang palatandanan.
GEN_031_1	GEN	031	1	Gani si Jacob nagpatindog sang isa ka daku nga bato nga handumanan.	Mayap pa mikasundu kata. Gawa katang katumpuk a batu ban magsilbing katibayan king pikayarian ta.
GEN_031_1	GEN	031	1	Si Raquel nagsiling sa iya amay, Tatay, indi ka lang magkaakig kon indi ako makatindog sa imo atubang, kay yari ang pamulanon ko.	Kinua na lang Raquel ding dios nang tata na at saka na la linulan king bulsa na ning sia ning kamelyu, at kaybat liklukan na la.
GEN_031_1	GEN	031	1	Si Raquel nagkuha sang mga diosdios kag ginbutang niya sa siyasiya sang kamelyo kag ginpungkoan ini.	Kanita linub ya i Laban karing tolda da ri Jacob; kaybat king tolda nang Lea ampon king tolda da ring aduang ipus a babai, oneng e na la ikit ding kikilalanan nang dios.
GEN_031_1	GEN	031	1	Si Laban nagsabat kay Jacob, Ini nga mga babayi anak ko, ang ila mga kabataan akon, kag ini nga mga panong akon.	Nung e na ku mu inantabayanan ning Dios ding makatua ku, ing Dios nang Abraham at itang Dios a pitakutan nang Isaac, pepalakuan yu ku sanang alang daralan.
GEN_031_1	GEN	031	1	Si Laban nagkadto sa tolda ni Jacob, sa tolda ni Lea, kag sa tolda sang duha ka suloguon nga babayi, pero wala niya makita ang iya mga diosdios.	Tungkul naman karetang kikilalanan yung dios, paten ya itang nung kenu la mayakit. King akakit da ring kamaganak ku, nung sakaling atin kayung akit nanu pa mang kekayu, kuanan ye.
GEN_031_1	GEN	031	1	Kon ang Dios sang akon mga ginikanan, ang Dios ni Abraham, ang Dios nga ginsimba ni Isaac wala mag-upod sa akon, kuntani ginpalakat mo na ako nga wala gid sing dala.	Makanyan ing delanan ku kilub ding aduang pulung banuang sinuyu ku kekayu. Labing apat kung banuang sinuyu kekayu ban ayasawa ku la ding adua yung anak at anam a banua para karing kekayung kawan.
GEN_031_1	GEN	031	1	Ini tanan nga mga manggad nga ginkuha sang Dios sa amon amay amon ina kag ila sang amon mga anak.	Mangaintulid kekami at karing anak mi ing pibandian a leko na ning Dios kang tata mi.
GEN_031_1	GEN	031	1	Pero kon makita mo sa bisan kay sin-o diri ang imo mga diosdios, pagapatyon sia. Sa atubang sang aton mga tinawo subong mga saksi, pangitaa ang mga butang nga imo kag kuhaa ini. Si Jacob wala makahibalo nga ginkawat ni Raquel ang mga diosdios ni Laban.	Nganang mekibat Jacob, Tatakut ku uling pota bawalan yu lang tuki kanaku ding anak yu.
GEN_031_1	GEN	031	1	Gani si Jacob naghimos agod magbalik sa iya amay sa duta sang Canaan. Ginpasakay niya ang iya mga kabataan kag mga asawa sa mga kamelyo, kag ginpauna niya ang iya tanan nga mga hayop sa iya, upod ang tanan nga pagkabutang nga iya natipon sa Mesopotamia.	Kanita seke na na lang Jacob ding anak na at asawa karing kamelyu.
GEN_031_1	GEN	031	1	Si Laban naglakat sa paggunting sang iya mga karnero, kag sang wala sia, ginkawat ni Raquel ang mga diosdios sa ila balay nga iya ni tatay niya.	Dela na la ngan ding kawan na at pibandian a meging bandi na karin Padan-aram, at saka ne mibalik kang Isaac a tata na karin king sakup ning Canaan.
GEN_031_1	GEN	031	1	Si Jacob nagdaya kay Laban nga Aramnon paagi sa iya paglakat nga wala magpahibalo kay Laban.	Ala yu kanita i Laban uling meko ya ban ururan na la ding tupa na. Kabang ala yu penako na lang Raquel ding kikilalanan dang dios king bale nang tata na.
GEN_031_1	GEN	031	1	Gindala ni Jacob ang iya tanan nga mga pagkabutang kag dalidali nga naglakat. Nagtabok sia sa Suba sang Eufrates kag nagpadulong sa kabakuloran sang Galaad.	E na pepabalung Jacob kang Laban, ing Arameo, ing mamako ne at alinlang ne.
GEN_031_1	GEN	031	1	Sang makaligad ang tatlo ka adlaw ginsugiran si Laban nga si Jacob nagpalagyo.	Dela na ngan ing pibandian na at marapal neng meko. Lipatan ne ing Ilug ning Eufrates at minarap yang papunta king sakup ning Gilead.
GEN_031_1	GEN	031	1	Gindala niya ang iya mga tinawo kag ginlagas niya si Jacob sa sulod sang pito ka adlaw tubtob nalambot niya sia sa kabakuloran sang Galaad.	Kalabas da ring atlung aldo abalitan nang Laban ing meko ya i Jacob.
GEN_031_1	GEN	031	1	Sa isa ka damgo sina nga gab-i, ang Dios nagpakita kay Laban nga Aramnon kag nagpaandam sa iya, Indi mo pagpahugon si Jacob sa bisan ano nga paagi.	Penagal neng Laban at ding kamaganak na kilub ding pitung aldo, at atagal de king bunduk-bundukan na ning sakup ning Gilead.
GEN_031_1	GEN	031	1	Nalambot ni Laban si Jacob nga nagdulog kag nagpatindog sang iya tolda sa kabakuloran. Si Laban nagpatindog man sang iya tolda sa kabakuloran sang Galaad upod sang iya mga pariente.	Pero ketang benging ita pepakit ya ing Dios kang Laban, ing Arameo, king kapamilatan na ning paninap at sinabi na kang Laban king e ne sana nananan balang i Jacob.
GEN_031_1	GEN	031	1	Si Laban nagsiling kay Jacob, Ngaa gindayaan mo ako kag gindala mo ang akon mga bata nga babayi pareho sang mga babayi nga nabihag sa inaway?	Inyang datang ya i Laban atalakad na neng Jacob ing tolda ra king bunduk samantalang i Laban at ding kayabe na telakad da la ring tolda king bunduk-bundukan na ning Gilead.
GEN_031_1	GEN	031	1	Ngaa nga gindayaan mo ako kag naglakat ka nga wala gid magsiling sa akon? Kon ginpahibalo mo ako, kuntani ginpalakat ko ikaw nga may kinasadya kag pagkinanta sa musika sang mga tambor kag mga arpa.	Nganang Laban kang Jacob, Obat lininlang mu ku at tiki ding anak kung babai a balamu bihag ning gera?
GEN_031_1	GEN	031	1	Wala mo gid ako pagpahaluka sa akon mga apo kag sa akon mga bata nga babayi sang paglakat nila. Daw ano nga binuang ang ginhimo mo!	Obat meko kang pasalikut at meko kang e memun? Pepayantabe ra ka sanang masayang kantahan a babagayan da ring pandereta at alpa.
GEN_031_1	GEN	031	1	Makasarang ako sa paghalit sa imo, pero kagab-i ang Dios sang imo amay nagpaandam sa akon nga nagasiling, Indi mo pagpahugon si Jacob sa bisan ano nga paagi.	E mu man peintulut ing auma ku la ding apu ku at anak. E ustu ing gewa mu!
GEN_031_1	GEN	031	1	Nakahibalo ako nga nahidlaw ka na gid sa panimalay sang imo amay, amo ina nga naglakat ka, pero ngaa ginkawat mo ang akon mga diosdios?	Malyari da kang panasakitan, oneng nabengi ngana kanaku ning Dios nang tata mu, E me nananan balang i Jacob!
GEN_031_1	GEN	031	1	Si Jacob nagsabat, Nahadlok ako, tungod kay naghunahuna ako nga bawion mo sa akon ang imo mga anak.	Balu kung meko ka uli na ning tutu na kang bisang makauli; obat pati ring dios ku king bale penako mu?
GEN_031_2	GEN	031	2	Si Laban nagpangita sang iya mga diosdios, pero wala niya makita ini.	Asiasat na ne ngan Laban ing kilub na ning tolda nang Raquel oneng ala yang ikit.
GEN_031_2	GEN	031	2	Pero ang Dios wala magtugot nga mahalitan niya ako.	Pero e na peintulut ning Dios ing apanasakit na ku.
GEN_031_2	GEN	031	2	Dayon nagkadto sia sa tolda ni Raquel.	E na kamalayan Jacob king i Raquel ing menako karing kikilalanan nang dios tata na.
GEN_031_2	GEN	031	2	Kon sa bagay, ang tanan nga ginatan-aw mo akon. Pero karon, ano ang mahimo ko sa akon mga anak kag sa ila mga kabataan?	Pero ikit na ning Dios ing makalunus kung kabilian at ing kanakung kapagalan, at nabengi ya na ing minie kayatulan.
GEN_031_2	GEN	031	2	Si Laban nag-usisa sang bug-os nga tolda, pero wala gid niya ini makita.	Linual ya king tolda nang Lea at kaybat linub ya king tolda nang Raquel.
GEN_031_2	GEN	031	2	Nagsabat ako, Yari ako.	Nanu pu? ngakung mekibat.
GEN_031_2	GEN	031	2	Ano nga kasugoan ang akon ginlapas nga ginlagas mo ako nga may kaakig?	Penintun na lang Laban, oneng e na la ikit ding kikilalanan nang dios.
GEN_031_2	GEN	031	2	Karon, himua ang tanan nga ginsiling sa imo sang Dios.	Sulung, daptan mu ing sinabi na keka ning Dios.
GEN_031_2	GEN	031	2	Pero ang Dios nakakita sang akon pagpangabudlay kag pag-antos, kag kagab-i ginsaway niya ikaw.	Makanyan man apulu yung besis inalilan ing upa ku.
GEN_031_2	GEN	031	2	Karon maghimos ka kag maghalin sa sini nga duta kag magbalik sa imo duta nga natawhan.	Inya lumakad na ka at lakuan me ing lugal a iti at mibalik ka king lugal a tibuan mu.
GEN_031_2	GEN	031	2	Ibutang diri sa atubang sang imo kag sang akon mga tinawo kag sila ang pahukma kon sin-o sa aton ang matarong.	Nanu waring kasalanan ku? Obat tikian yu ku?
GEN_031_2	GEN	031	2	Sa tapos sila makakaon, nagtulog sila didto sa bukid.	Sinumpa ya i Jacob king lagyu na ning Dios a tune nang katakutan Isaac a tata na king tuparan na ing kasunduan da.
GEN_031_2	GEN	031	2	Gani ang lugar ginhingalanan man Mispa.	Makanyan yang meyaus Galed ing lugal a ita.
GEN_031_2	GEN	031	2	Kon magsiling sia, Ang may mga gurayguray manginsuhol mo, ang tanan nga mga hayop nagbata sing may mga gurayguray.	Pota namang sabian nang, Ding gulis-gulisan ila ding upa mu, kanita manganak yang gulis-gulisan a biseru ing mabilug a kawan.
GEN_032_1	GEN	032	1	Sang pagkakita niya sa ila nagsiling sia, Kampo ini sang Dios.	Ngana karelang Jacob, Iti ya ing kampu na ning Dios.
GEN_032_1	GEN	032	1	Pinauna niya ang mga regalo, kag nagpabilin sia sadtong gab-i sa kampo.	Makanyan munaman ing penabilin na king kaduang ipus, king katlu, at karing sablang maglakad kagulutan da ring kawan. Yan ing sabian yu kang Esau potang akatagpu yu ne.
GEN_032_1	GEN	032	1	Amo ini ang kabangdanan kon ngaa tubtob karon ang mga Israelinhon wala nagakaon sang unod sa lutalutahan sang balikawang tungod kay ginhampak si Jacob sa sini nga bahin.	Makaslag ne ing aldo inyang palako ne Peniel; tikul-tikul yang meko pauli na ning papaluan na.
GEN_032_1	GEN	032	1	Nagabutlak na ang adlaw sang paghalin ni Jacob sa Peniel, kag nagapiangpiang sia tungod sang iya lutalutahan.	Inya i Jacob inaus neng Peniel ing lugal a ita, ngana wari, Ing lupa na ning Dios, uling ikit ne lupa ing Dios, oneng e ya ninanu balang.
GEN_032_1	GEN	032	1	Si Jacob nagsiling, Nag-atubangay kami sang Dios, kag karon buhi pa gihapon ako.	Pekibat na, Obat buri meng abalu ing lagyu ku?
GEN_032_1	GEN	032	1	Pero nagsabat sia, Ngaa ginapamangkot mo ang akon ngalan? Dayon ginbendisyunan niya si Jacob.	Kanita nganang Jacob, Sabian yu ne mo kanaku ing lagyu yo.
GEN_032_1	GEN	032	1	Si Jacob nagsiling, Kon mahimo sugiri ako sang imo ngalan.	Kanita ngana ning lalaki, Manibat ngeni Israel na ing lagyu mu; e na Jacob uling akabatbatan me ing Dios ampon ding tau at miniambut ka.
GEN_032_1	GEN	032	1	Ang tawo nagsiling, Indi ka na pagtawgon nga Jacob. Nagpakigdumog ka sa Dios kag sa mga tawo kag nagdaog ka, gani pagatawgon ka nga Israel.	Jacob, nganang mekibat.
GEN_032_1	GEN	032	1	Nagsabat sia, Si Jacob.	Nanu waring lagyu mu? nganang kinutang ning lalaki.
GEN_032_1	GEN	032	1	Ang tawo nagpamangkot, Ano ang ngalan mo?	Oneng nganang Jacob, E ra kayu ibili anggang e yu ku bendisyunan.
GEN_032_1	GEN	032	1	Pero si Jacob nagsabat, Indi ko ikaw pagbuy-an kon indi mo ako pagbendisyunan.	Kanita ngana ning tau, Ibili mu na ku uling ganingaldo na.
GEN_032_1	GEN	032	1	Ang tawo nagsiling, Buy-i na ako, kay nagapamanagbanag na.	Inyang aulata na ning tau king e ne asaul i Jacob, sikmal ne king papaluan, at milisang ya ing butul na ning puad na king paglugalan na king papaluan.
GEN_032_1	GEN	032	1	Sang nabatyagan sang tawo nga indi sia makadaog kay Jacob, ginhampak niya si Jacob sa lutalutahan sang iya balikawang, kag nagliw-as ini.	melakuan yang magdili-dili i Jacob. Kanita dinatang ya ing metung a lalaki, at mekibatbatan ya kang Jacob angga na king miras ing ganingaldo.
GEN_032_1	GEN	032	1	Dayon may isa ka tawo nga nag-abot kag nagdumog sa iya tubtob sa kaagahon.	Inyang adalakit na na la at ing pibandian na,
GEN_032_1	GEN	032	1	Pero, nabilin sia nga isahanon lang.	Ketang bengi mu ring ita mibangun ya i Jacob. Tiki na la ding adua nang asawa, ding aduang babaing kasese na, at ding labing metung a anak na, at delakitan de ing Ilug ning Jabok.
GEN_032_1	GEN	032	1	Sang mapatabok na niya sila, ginpatabok man niya ang tanan niya nga mga pagkabutang.	Inya peparala nang makauna kang Esau ing regalu, at melakuan yang migpaynawa king kampu king benging ita.
