id	book	chapter	sentence_no	source_text	target_text
GEN_010_1	GEN	010	1	Patru, Caslu, kag Creta nga amo ang ginhalinan sang mga Filistinhon.	ding taga Patrusim, Kasluim, at ding Captorim nung nu la menibat ding Filisteo.
GEN_010_1	GEN	010	1	Ang mga anak ni Canaan amo sanday Sidon kag si Het. Ang ila mga kaliwat nagdala sang ila mga ngalan.	Anak neng Canaan i Sidon, ing pangane na, at i Het.
GEN_010_1	GEN	010	1	Si Canaan amo man ang ginhalinan sang mga Jebusnon, Amornon, Girgasanhon,	I Canaan ya naman ing pipumpunan da ring Jebuseo, Amoreo, at Girgaseo,
GEN_010_1	GEN	010	1	Hevhanon, Arquinhon, Sinhanon,	ding Heveo, Arkeo, at Sineo,
GEN_010_1	GEN	010	1	Arvadnon, Zemarnon, kag Hamatnon.	ding Arvadeo, Zemareo, at Hamateo.
GEN_010_1	GEN	010	1	Halin sa sadto nga duta nagkadto sia sa Asiria kag nagpatindog sang mga siudad sang Ninive, Rehobot-ir, Cala,	Ibat king lugal a ita minta ya king Asiria, at telakad ne ing Nineve, ing Rehobot Ir, ing Cala,
GEN_010_1	GEN	010	1	kag ang ila dulonan halin sa Sidon naglambot sa bagatnan sa Gerar tubtob sa Gaza, sa sidlangan sa Sodoma, Gomorra, Adma, kag Zeboim nga malapit sa Lasa.	Magumpisa ya ing sakup dang gabun king Sidon banda Gerar malapit Gaza angga na Sodoma at Gomorra, Adma, at Zeboiim angga karin Lasa.
GEN_010_1	GEN	010	1	Amo ini sila ang mga kaliwat ni Ham nga nagaestar sa nagkalainlain nga mga tribo kag mga pungsod, kag ang tagsa ka grupo may kaugalingon nga linggwahe.	Ila deti ring anak nang Ham, agpang karing pamilya ra at salita, tuknangan, at bansa.
GEN_010_1	GEN	010	1	Si Sem, ang magulang nga utod ni Jafet, amo ang ginhalinan sang tanan nga mga Hebreo.	I Sem, ing koya nang Jafet, ya i tata na ning penibatan da ring anak nang Eber.
GEN_010_1	GEN	010	1	Ang mga anak nga lalaki ni Sem amo sanday Elam, Asur, Arfaxad, Lud kag Aram. Ang ila mga kaliwat nagdala sang ila mga ngalan.	Ila deti ring anak nang Sem: i Elam, Asur, Arpaksad, Lud, at Aram.
GEN_010_1	GEN	010	1	Ang mga kaliwat ni Aram amo ang mga tawo sang Uz, Hul, Geter, kag Mesec.	Ding anak nang Aram ila di Uz, Hul, Geter, at Mas.
GEN_010_1	GEN	010	1	Si Arfaxad amay ni Sela kag si Sela amay ni Eber.	Anak neng Arpaksad i Sela, at anak neng Sela i Eber.
GEN_010_1	GEN	010	1	Si Eber may duha ka mga anak nga lalaki: ang isa ginhingalanan kay Peleg, kay sa iya panag-on ang mga tawo sa kalibutan nabahinbahin, kag ang ngalan sang iya utod amo si Joctan.	Mika adua yang anak i Eber: Peleg ya lagyu ing pangane uling king panaun na mepidua ya ing yatu. Joktan ya lagyu ing kapatad na.
GEN_010_1	GEN	010	1	Ang mga kaliwat ni Joctan amo ang mga tawo sang Almodad, Selef, Hazarmavet, Jera,	Anak na lang Joktan di Almodad, Selef, Hasarmavet, Jera,
GEN_010_1	GEN	010	1	Hadoram, Uzal, Dicla,	Hadoram, Uzal, Dikla,
GEN_010_1	GEN	010	1	Obal, Abimael, Seba,	Obal, Abimael, Seba,
GEN_010_1	GEN	010	1	Ofir, Havila, kag Jobab.	Ofir, Havila, at i Jobab.
GEN_010_1	GEN	010	1	kag Rezin, nga yara sa gintung-an sang Ninive kag sang daku nga siudad sang Cala.	at ing maragul a siudad, ing Resen, pilatan na ning Nineve at Cala.
GEN_010_1	GEN	010	1	Nag-estar sila sa duta halin sa Mesa pakadto sa Sefer tubtob sa mga bukid sa sidlangan.	Magumpisa ya king Mesa angga Sefar ing gabun a tutuknangan da, ing lugal a mabunduk king bandang aslagan.
GEN_010_1	GEN	010	1	Ang mga kaliwat ni Gomer amo ang mga tawo sang Askenaz, Rifat, kag Togarma.	Ding anak nang Gomer ila di Askenas, Rifat, at i Togarma.
GEN_010_1	GEN	010	1	Ini tanan nga mga tawo ang mga kaliwat ni Noe, suno sa ila mga nagkalainlain nga linahi kag mga pungsod.	Ila deti ring lahi da ring anak nang Noe agpang karing pipumpunan da at bansa.
GEN_010_1	GEN	010	1	Ang nahauna niya nga ginharian nagsakop sang Babel, Erec, kag Akad.	King pasimula ing kayarian na ila ding Babilonia, Erek, at Akkad.
GEN_010_1	GEN	010	1	Ang mga anak nga lalaki ni Jafet amo sanday Gomer, Magog, Madai, Javan, Tubal, Mesec, kag Tiras. Ang ila mga kaliwat nagdala sang ila mga ngalan.	Ding anak nang Jafet ila di Gomer, Magog, Madai, Javan, Tubal, Mesek, at i Tiras.
GEN_010_2	GEN	010	2	Ini sila nga tatlo may mga anak nga lalaki nga nagkalatawo sa tapos ang anaw.	Mikayanak la kaybat na ning albug.
GEN_010_2	GEN	010	2	Sa tapos ang anaw ang tanan nga mga pungsod sang kalibutan naghalin sa sini nga mga anak ni Noe.	Ila ding penibatan da ring miyayaliwang bansa keti king yatu kaybat nang milyari ning albug.
GEN_010_2	GEN	010	2	Ang mga kaliwat ni Raama amo ang mga tawo sang Seba kag Dedan.	Ding anak na namang Raama ila di Seba at Dedan.
GEN_010_2	GEN	010	2	Ini tanan lunsay sa duta sang Babilonia.	Atyu la ngan deti king sakup na ning Sinar.
GEN_010_2	GEN	010	2	Sang ulihi ang nagkalainlain nga mga tribo sang Canaanhon naglapta,	Manibat na kanita kinalat la ding lahi da ring Cananeo.
GEN_010_2	GEN	010	2	Ini sila tanan naghalin kay Joctan.	Deti lahi na la ngan Joktan.
GEN_011_1	GEN	011	1	Sa tapos sini, nagkabuhi sia sing 500 pa ka tuig kag may iban pa sia nga mga kabataan.	Mebie ya pang limang dalan a banua i Sem kaybat nang mibait Arpaksad, at mika aliwa ya pang anak a lalaki ampon babai.
GEN_011_1	GEN	011	1	Didto napatay si Tera sang nagaedad sia sang 205 ka tuig.	Mebie yang aduang dalan at limang banua i Tera. Kaybat na nita mete ya karin king Haran.
GEN_011_1	GEN	011	1	Ang siudad gintawag Babilonia, tungod kay didto gintublag sang Ginoo ang linggwahe sang tanan nga mga tawo, kag halin didto ginpalapta niya sila sa bug-os nga kalibutan.	Ita ya ing sangkan nung inya inaus deng Babel ing lugal a ita uling karin ne giluan ning Ginu ing salita da ring tau ning mabilug a yatu at simbulat ding tau king mabilug a yatu.
GEN_011_1	GEN	011	1	Amo ini ang mga kaliwat ni Sem.	Ila deti ring lahi nang Sem.
GEN_011_1	GEN	011	1	Gindala ni Tera ang iya anak nga lalaki nga si Abram, ang iya apo nga lalaki nga si Lot nga anak nga lalaki ni Haran, kag ang iya umagad nga babayi nga si Sarai, nga asawa ni Abram, kag naghalin sila sa siudad sang Ur sang Babilonia sa pagkadto sa duta sang Canaan.	Tiki neng Tera ing anak nang i Abram, ing apu nang i Lot a anak nang Haran at ing manuyang nang i Sarai a asawa nang Abram a anak na. Meko la king Ur da ring Caldeo at minta la king sakup ning Canaan.
GEN_011_1	GEN	011	1	Dayon nagsiling sila sa isa kag isa, Dali kamo, mahimo kita sing mga tisa kag aton ini patig-ahon sa hornohan.	Ngarang misabi-sabi, Tara, gawa tamung tisa at ilutu ta la king ornu.
GEN_011_1	GEN	011	1	Sang si Arfaxad nagaedad na sing trayntay singko ka tuig, natawo ang iya anak nga lalaki nga si Sela.	Kanitang atlu yang pulu't limang banua i Arpaksad ayanak ne i Sela.
GEN_011_1	GEN	011	1	Sa tapos sini, nagkabuhi sia sing 403 pa ka tuig kag may iban pa sia nga mga kabataan.	Mebie yang apat a ralan at atlung banua i Arpaksad kaybat nang mibait Sela, at mika aliwa ya pang anak a lalaki ampon babai.
GEN_011_1	GEN	011	1	Sang si Sela nagaedad na sing traynta ka tuig, natawo ang iya anak nga lalaki nga si Eber.	Kanitang atlu yang pulung banua i Sela ayanak ne i Eber.
GEN_011_1	GEN	011	1	Sa tapos sini, nagkabuhi sia sing 403 pa ka tuig kag may iban pa sia nga mga kabataan.	Mebie yang apat a ralan atlung banua i Sela kaybat nang mibait Eber, at mika aliwa ya pang anak a lalaki ampon babai.
GEN_011_1	GEN	011	1	Sang si Eber nagaedad sing trayntay kwatro ka tuig, natawo ang iya anak nga lalaki nga si Peleg.	Kanitang atlu yang pulu't apat a banua i Eber ayanak ne i Peleg.
GEN_011_1	GEN	011	1	Dali, manaog kita kag tublagon ta ang ila panghambal agod nga indi sila mag-intiendihanay.	Mayap pa ing puntalan ta la at guluan a salita ban e la mikakaintindi.
GEN_011_1	GEN	011	1	Sang una, ang mga tawo sa bug-os nga kalibutan may isa lang ka linggwahe kag pareho nga mga pulong ang ila ginagamit.	Kanitang minunang panaun metung ya mu salita ing mabilug a yatu at paraparehu la mu ding amanung magagamit.
GEN_011_1	GEN	011	1	Kag nagsiling sia, Karon, ini nga mga tawo may pag-isa kag isa lang ang ila linggwahe. Pamuno pa lang ini sang ila pagahimuon. Sa indi madugay magahimo sila sang bisan ano nga luyag nila!	Kanita sinabi na ning Ginu , Ngening misanmetung la at metung la salita agawa ra iti, e lumuat ala nang makasabat pa king buri dang gawan.
GEN_011_1	GEN	011	1	Karon ang Ginoo nagpanaog sa pagtan-aw sang siudad kag sang tore nga ginpatindog sang mga tawo.	Tinipa ya ing Ginu ban lawan ne ing siudad at ing toreng telakad da ring tau.
GEN_011_1	GEN	011	1	Dayon nagsiling sila, Dali, mahimo kita sing isa ka siudad nga may tore nga nagalambot sa langit, agod manginbantog kita kag indi kita maglapta sa bug-os nga duta.	Tara, ngara, mitalakad tamu ngening metung a siudad at gawa tamung toreng miraras banua ba tamung maging pikabaluan at e misalbag king mabilug a yatu.
GEN_011_1	GEN	011	1	Samtang nagapakadto sila sa sidlangan, nakalambot sila sa patag sang duta sang Babilonia kag nag-estar sila didto.	Kabang manintun lang pituknangan ding tau king bandang aslagan, miras la king lugal a patag king sakup ning Sinar at karin la menuknangan.
GEN_011_1	GEN	011	1	Si Sarai wala makapamata.	Ala yang anak i Sarai uli na ning baug ya.
GEN_011_1	GEN	011	1	Si Abram nagpangasawa kay Sarai, kag si Nahor nagpangasawa kay Milca, ang bata nga babayi ni Haran nga amay man ni Isca.	Mekiasawa la di Abram at Nahor. Sarai ya lagyu ing asawa nang Abram, at itang kang Nahor Milka ne man a lagyu. I Milka anak neng Haran a tata ra di Milka at Isca.
GEN_011_1	GEN	011	1	Gani ginpaalaplaag sila sang Ginoo sa bug-os nga duta, kag nauntat ang ila paghimo sang siudad.	Ibat karin peniambulat na la ning Ginu king mabilug a yatu, at tiknangan deng tatalakad ing siudad.
GEN_011_1	GEN	011	1	Sa tapos sini, nagkabuhi sia sing 430 pa ka tuig kag may iban pa sia nga mga kabataan.	Mebie yang apat a ralan atlung pulung banua i Eber kaybat nang mibait Peleg, at mika aliwa ya pang anak a lalaki ampon babai.
GEN_011_1	GEN	011	1	Sang si Peleg nagaedad sing traynta ka tuig, natawo ang iya anak nga lalaki nga si Reu.	Kanitang atlu yang pulung banua i Peleg ayanak ne i Reu.
GEN_011_1	GEN	011	1	Sa tapos sini, nagkabuhi sia sing 209 pa ka tuig kag may iban pa sia nga mga kabataan.	Mebie yang aduang dalan at siam a banua i Peleg kaybat nang mibait Reu, at mika aliwa ya pang anak a lalaki ampon babai.
GEN_011_1	GEN	011	1	Sang si Reu nagaedad sing trayntay dos ka tuig, natawo ang iya anak nga lalaki nga si Serug.	Kanitang atlu yang pulu't aduang banua i Reu ayanak ne i Serug.
GEN_011_1	GEN	011	1	Sa tapos sini, nagkabuhi sia sing 207 pa ka tuig kag may iban pa sia nga mga kabataan.	Mebie yang aduang dalan at pitung banua i Reu kaybat nang mibait Serug, at mika aliwa ya pang anak a lalaki ampon babai.
GEN_011_1	GEN	011	1	Sang si Serug nagaedad sing traynta ka tuig, natawo ang iya anak nga lalaki nga si Nahor.	Kanitang atlu yang pulung banua i Serug ayanak ne i Nahor.
GEN_011_1	GEN	011	1	Sa tapos sini, nagkabuhi sia sing 200 pa ka tuig kag may iban pa sia nga mga kabataan.	Mebie yang aduang dalan a banua i Serug kaybat nang mibait Nahor, at mika aliwa ya pang anak a lalaki ampon babai.
GEN_011_1	GEN	011	1	Sang si Nahor nagaedad sing baynte nwebe ka tuig, natawo ang iya anak nga lalaki nga si Tera.	Kanitang adua yang pulu't siam a banua i Nahor ayanak ne i Tera.
GEN_011_1	GEN	011	1	Sa tapos sini, nagkabuhi sia sing 119 pa ka tuig kag may iban pa sia nga mga kabataan.	Mebie yang dinalan at labing siam a banua i Nahor kaybat nang mibait Tera, at mika aliwa ya pang anak a lalaki ampon babai.
GEN_011_1	GEN	011	1	Sa tapos makaedad si Tera sing setenta ka tuig, natawo ang iya mga anak nga amo sanday Abram, Nahor, kag Haran.	Kanitang pitu yang pulung banua i Tera ayanak na la di Abram, Nahor, at i Haran.
GEN_011_1	GEN	011	1	Amo ini ang mga kaliwat ni Tera.	Ila deti ring lahi nang Tera.
GEN_011_1	GEN	011	1	Si Haran napatay sa iya kaugalingon nga banwa sang Ur sakop sang Babilonia sang buhi pa ang iya amay.	Minuna yang mete i Haran kang tata nang i Tera karin king balen a tibuan na, king Ur da ring Caldeo.
GEN_011_2	GEN	011	2	Si Tera amay nanday Abram, Nahor, kag Haran.	Anak na lang Tera di Abram, Nahor, at Haran.
GEN_011_2	GEN	011	2	Naglakat sila tubtob sa Haran kag didto nag-estar sila.	Oneng inyang miras la Haran, karin na la menuknangan.
GEN_011_2	GEN	011	2	Gani may tisa sila nga inugpatindog, kag aspalto sa pagpatapik sang mga tisa.	Ding tisa ilang peka batu ra at ing alketran ya ing peka semento ra.
GEN_011_2	GEN	011	2	Duha ka tuig sa tapos sang anaw, sang si Sem nagaedad sing 100 ka tuig, natawo ang iya anak nga lalaki nga si Arfaxad.	Kanitang dinalan yang banua i Sem ayanak ne i Arpaksad. Adua nang banua ing milabas kanita kaybat ning albug.
GEN_011_3	GEN	011	3	Si Haran amay ni Lot.	Anak neng Haran i Lot.
GEN_012_1	GEN	012	1	Karon ang Ginoo nagsiling kay Abram, Halin ka sa imo kaugalingon nga duta, sa imo mga pariente, kag sa panimalay sang imo amay, kag magkadto ka sa isa ka duta nga igapakita ko sa imo.	Ngana ning Ginu kang Abram, Lakuan me ing balen mu, ding kamaganak mu, at ing pibalebale nang tata mu, at munta ka king bansang ituldu ku keka.
GEN_012_1	GEN	012	1	Ngaa nagsiling ka nga utod mo sia kag gintugotan mo nga kuhaon ko sia subong akon asawa? Yari ang imo asawa! Kuhaa sia kag maghalin kamo diri!	Inutus na ning ari karing tauan na ing paburen da na lang mako a darala ing heganaganang pibandian da.
GEN_012_1	GEN	012	1	Hatagan ko ikaw sing madamo nga mga kaliwat kag mangin-isa sila ka daku nga pungsod.	Gawan da kang metung a maragul a bansa at bendisyunan da ka.
GEN_012_1	GEN	012	1	Gani ginpatawag sang hari si Abram kag ginpamangkot, Ano ining ginhimo mo sa akon?	Obat sinabi mung kapatad me? Kinua ke mo bilang asawa ku. Ngeni oyni ing asawa mo!
GEN_012_1	GEN	012	1	Pakamaayuhon ko ang mga nagapakamaayo sa imo,	Bendisyunan ku la ding mamendisyun keka,
GEN_012_1	GEN	012	1	pero pakamalauton ko ang mga nagapakamalaut sa imo.	oneng isumpa ku la ding maniumpa keka.
GEN_012_1	GEN	012	1	Ang tanan nga mga pungsod sa duta magapangayo sa akon nga pakamaayuhon ko subong sang akon pagpakamaayo sa imo.	At kapamilatan mu bendisyunan ku la ding sablang bansa.
GEN_012_1	GEN	012	1	Sang si Abram nagaedad sing setentay singko ka tuig, naghalin sia sa Haran, suno sa ginsiling sang Ginoo sa iya, kag si Lot nag-upod sa iya.	Meko ya i Abram antimo ing inutus na ning Ginu . Kayabe neng meko i Lot. Pitu yang pulu't limang banua i Abram inyang meko ya king Haran.
GEN_012_1	GEN	012	1	Gindala ni Abram ang iya asawa nga si Sarai, ang iya hinablos nga si Lot, ang tanan nga manggad kag ang tanan nga mga ulipon nga ila nakuha sa Haran, kag naglakat sila pakadto sa duta sang Canaan.	Tiki ne ing asawa nang i Sarai, ing pangunakan nang i Lot, ing heganaganang pibandian a atipun da at ding heganaganang ipus a meging bandi ra karin Haran. At miglakbe lang papunta king sakup ning Canaan. Karas da king sakup ning Canaan,
GEN_012_1	GEN	012	1	Sang pag-abot nila sa Canaan,	libutan neng Abram angga king miras ya king lele na ning sagradung tanaman ning More, ing banal a lugal karin Sikem. Manuknangan la pa kanita karin ding Cananeo.
GEN_012_1	GEN	012	1	si Abram naglatas sa duta tubtob nakalambot sia sa balaan nga kahoy sang More sa balaan nga lugar sa Siquem.	Pepakit ya karin ing Ginu kang Abram at ngana, Ibie ke ing gabun a iti karing kekang maging lahi.
GEN_012_1	GEN	012	1	Pero tungod kay ginkuha sang hari si Sarai, ang Ginoo nagpadala sing mga makangilidlis nga mga balatian sa hari kag sa iya mga ginsakpan sa palasyo.	Kanita pepayaus ne ning ari i Abram at ngana, Abram, nanu iting depat mu kanaku! Obat e mu sinabing asawa me?
GEN_012_1	GEN	012	1	Ang Ginoo nagpakita kay Abram kag nagsiling sa iya, Amo ining duta nga ihatag ko sa imo mga kaliwat.	Ibat karin sinulung ya pa at miras king mabunduk a lugal king dane nang aslagan ning Betel. Telakad ne ing tolda na pilatan na ning Betel, king dane albugan at ning Ai king dane aslagan.
GEN_012_1	GEN	012	1	Tungod kay Sarai, gin-ayuhan sang hari si Abram kag ginhatagan sia sing mga karnero kag mga kanding, mga baka, mga asno, mga ulipon kag mga kamelyo.	Oneng pepagpa yang mangabayat a parusa ing Ginu king ari at king pibalebale na uli na ning kinua ne i Sarai a asawa nang Abram.
GEN_012_1	GEN	012	1	May mga opisyales sang hari nga nakakita sa iya kag ginsugiran nila ang hari kon daw ano katahom sa iya, gani gindala sia sa palasyo sang hari.	Uli nang Sarai mesalese ya kabilian i Abram. Dininan deng tupa, kambing, baka, asno, kamelyu, at ipus a lalaki at babai.
GEN_012_1	GEN	012	1	Sa tapos sini, nagsaylo sia sa bagatnan didto sa bukid sa sidlangan sang siudad sang Betel kag didto nagpatindog sia sang iya tolda sa gintung-an sang Betel kag Ay. Ang Betel sa nakatundan kag ang Ay sa sidlangan. Didto naghimo man sia sang altar kag nagsimba sa Ginoo .	Kaybat na nita, sindu na ing pamaglakad na at miras ya banda nang mauli ning Canaan.
GEN_012_1	GEN	012	1	Sang ulihi si Abram nagpadayon sa pagpanglakaton pakadto sa bagatnan sang Canaan.	Mika maragul a danup king sakup na ning Canaan. Minta ya i Abram king Ehipto ban karin manuknangan uling tutung maragul ing danup.
GEN_012_1	GEN	012	1	Karon may tiggulotom sa Canaan. Tungod kay tama gid ang tiggulotom, si Abram nagpabagatnan pa gid tubtob sa Ehipto, sa pag-estar didto sa malip-ot nga tion.	Inyang malapit na la Ehipto ngana king asawa nang i Sarai, Balu kung malagu kang babai.
GEN_012_1	GEN	012	1	Sang nagahinampot na sila sa dulonan pakadto sa Ehipto, nagsiling si Abram sa iya asawa, Sarai, matahom ikaw nga babayi.	Potang akit da ka ding tau Ehipto sabian da, Asawa neng Abram yan. Kaybat paten da ku, oneng ika e ra ka nanan a balang.
GEN_012_1	GEN	012	1	Kon makita ikaw sang mga Ehiptohanon magasiling sila, Asawa sia ni Abram, kag pagapatyon nila ako kag tugotan ka nga mabuhi.	Ipakisabi ku keka king sabian mu sana ing kapatad mu ku ban uli mu e ra ku paten at pakiabayan da kung masalese.
GEN_012_1	GEN	012	1	Maayo pa nga singganon mo sila nga utod ko ikaw. Dayon tungod sa imo indi nila ako pagpatyon kag ayuhan nila ako.	Inyang miras la Ehipto, ikit da ring tau Ehipto king malagu yang babai i Sarai.
GEN_012_1	GEN	012	1	Sang makaabot na sila sa Ehipto, nakita matuod sang mga Ehiptohanon nga ang iya asawa matahom.	Panakit da ring panibalan na ning ari, belita re at pemuri arapan ning ari. Kaybat tiki da ne king palasyu na ning ari.
GEN_012_2	GEN	012	2	Dayon si Abram nagpatindog didto sing altar para sa Ginoo nga nagpakita sa iya.	Mitalakad yang altar karin para king Ginu at menalangin ya king lagyu na ning Ginu .
GEN_012_2	GEN	012	2	Ngaa wala ka magsiling sa akon nga asawa mo sia?	Kuanan mu ne at mako na kayu!
GEN_012_2	GEN	012	2	Sa sadto nga panahon ang mga Canaanhon nagaestar pa sa sadto nga duta.	Karin mitalakad yang altar para king Ginung pepakit kang Abram.
GEN_012_2	GEN	012	2	Bendisyunan ko ikaw kag himuon ko nga manginbantog ang imo ngalan, agod nga paagi sa imo madamo ang makabaton sing mga kaayuhan.	Maging pikabaluan ka lagyu at manatad kang bendisyun.
GEN_013_1	GEN	013	1	Kinahanglan magbulagay kita.	Makapanaya ing gabun arapan mu.
GEN_013_1	GEN	013	1	sa diin sia man anay naghimo sing altar, kag didto nagsimba sia sa Ginoo .	at karin ya naman minunang mitalakad altar, at menalangin king lagyu na ning Ginu .
GEN_013_1	GEN	013	1	Karon lakat ka kag latasa ang bug-os nga duta, tungod kay ihatag ko ini tanan sa imo.	Mako na ka at lakaran ing gabun, ing kaba at lapad na, uling keka ku babie iti.
GEN_013_1	GEN	013	1	Hatagan ko ikaw sing madamo nga mga kaliwat, nga wala sing may makaisip sa ila tanan, subong nga wala sing may makaisip sang yab-ok sa duta.	Parakalan ku lang anti ing alikabuk na ning yatu ding kekang lahi; nung sakaling abilang da ing alikabuk ning yatu, kanita abilang da la naman ding lahi mu.
GEN_013_1	GEN	013	1	Ihatag ko sa imo kag sa imo mga kaliwat ang tanan nga mga duta nga malambot sang imo panulok, kag ini mangin-imo sa wala sing katubtoban.	Ibie ku keka at karing maging lahi mu ing heganaganang gabun a akakit mu ban maging kekayu king kapilan pa man.
GEN_013_1	GEN	013	1	Sang nakahalin na si Lot, ang Ginoo nagsiling kay Abram, Halin sa imo ginatindugan lantawa sing maayo ang imo palibot.	Kalako nang Lot, migsalita ya ing Ginu kang Abram. Ngana, King kekang kabilian maglalawe ka; lumawe ka king dane norti, mauli, aslagan, at albugan.
GEN_013_1	GEN	013	1	nga ang mga tawo sini malaut kag nagpakasala batok sa Ginoo .	Oneng tune lang e mayap ding memalen na ning Sodoma; maragul la kasalanan king Ginu .
GEN_013_1	GEN	013	1	Si Abram nagpabilin sa duta sang Canaan, samtang si Lot nag-estar sa mga siudad sang kapatagan kag nagpatindog sang iya mga tolda malapit sa Sodoma,	Menatili ya i Abram king bansa ning Canaan samantalang migdatun ya i Lot karing siudad na ning kapatagan, at telakad na la ding tolda na siping na ning Sodoma.
GEN_013_1	GEN	013	1	Halin sa Ehipto si Abram nagpaaminhan padulong sa bagatnan nga bahin sang Canaan, upod sang iya asawa kag sang tanan nila nga mga pagkabutang.	Ibat Ehipto migbanda ya i Abram king dane norti papunta Canaan. Kayabe ne ing asawa na at ing heganaganang pibandian na.
GEN_013_1	GEN	013	1	Gani si Lot nagpili para sa iya kaugalingon sang bug-os nga Kapatagan sang Jordan, kag nagpasidlangan sia.	Inya pinili neng Lot ing mabilug a Kapatagan ning Jordan at minta ya bandang aslagan.
GEN_013_1	GEN	013	1	Si Abram manggaranon kaayo.	Mabandi yang talaga i Abram.
GEN_013_1	GEN	013	1	Si Lot nagpanghulonghulong kag nakita niya ang Kapatagan sang Jordan tubtob sa Zoar may bugana nga tubig kasubong sang Katamnan sang Ginoo , ukon kasubong sang duta sang Ehipto.	Linawe yang makapadurut i Lot at ikit nang mipaparanuman yang masalese ing mabilug a Kapatagan ning Jordan angga karin Zoar, kalupa na ning sarili nang mulahan ning Ginu o ning Ehipto.
GEN_013_1	GEN	013	1	Nagpanglakaton sia halin sa isa ka lugar pakadto sa isa padulong sa Betel, sa lugar nga iya man anay ginpatindugan sang iya tolda sa gintung-an sang Betel kag Ay,	Tunggal ditak miraras ya Betel; ketang lugal pilatan na ning Betel at Ai nung nu ne telakad ing tolda na kanitang minuna,
GEN_013_1	GEN	013	1	Gani ginhalin ni Abram ang iya mga tolda kag nag-estar sia malapit sa balaan nga mga kahoy ni Mamre sa Hebron, kag didto naghimo sia sing altar para sa Ginoo .	Linipat na lang Abram ding tolda na at menuknangan ya lele na ning sagradung tanaman ning Mamre ning Hebron. Mitalakad yang altar karin para king Ginu .
GEN_013_1	GEN	013	1	Gani si Abram nagsiling kay Lot, Hinablos ko ikaw, kag indi dapat nga mag-ilinaway ang aton mga tinawo.	Kanita nganang Abram kang Lot, E kata sana mipapate at ding magpastul ta. Mikamaganak kata!
GEN_013_1	GEN	013	1	Si Lot nga nag-upod kay Abram may mga karnero man, mga kanding, kag mga baka kag may iya man kaugalingon nga panimalay kag mga suloguon.	I Lot a kayabe nang Abram atin ya namang sese animal; atin ya namang dakal a tolda at katubale ampon magobra.
GEN_013_1	GEN	013	1	Gani ang mga tinawo ni Abram kag ni Lot nga nagaatipan sang ila mga kasapatan nagailinaway.	Maralas ing mipapate la ding pastul da ri Abram at Lot.
GEN_013_1	GEN	013	1	Tungod kay sila nga duha may madamo gid nga mga kasapatan indi sila makapadayon sa pag-estar sing tingob kay ang palahalban indi makaigo sa ila.	E ya sapat ing pipagpastulan nung miyabe la, uling dakal la sese animal.
GEN_013_2	GEN	013	2	Sa sadto nga tion ang mga Canaanhon kag mga Peresnon nagaestar pa sa sadto nga duta.	King panaun a ita ding Cananeo at Perezeo ilang manuknangan king lugal a ita.
GEN_013_2	GEN	013	2	Pilia ang bisan diin nga bahin sang duta nga imo naluyagan.	Mayap ing mikawani kata.
GEN_013_2	GEN	013	2	May mga karnero sia, mga kanding, mga baka, kag subong man mga pilak kag mga bulawan.	Dakal ya sese animal at tipun a pilak at gintu.
GEN_013_2	GEN	013	2	Ini sang wala pa malaglag sang Ginoo ang mga siudad sang Sodoma kag Gomorra.	E ne pa kanita silaban ning Ginu ing Sodoma at Gomorra.
GEN_013_2	GEN	013	2	Si Lot nag-upod man sa iya.	Kayabe nia naman i Lot.
GEN_013_2	GEN	013	2	Amo ini ang ila pagbulagay.	Makanyan lang mikawani.
GEN_013_3	GEN	013	3	Kon mapatuo ka, mapawala ako, kag kon mapawala ka, mapatuo ako.	Nung munta ka king dane kayli aku naman munta ku king dane wanan; nung munta ka king dane wanan aku munta na ku man king dane kayli.
GEN_014_1	GEN	014	1	Gindala man nila si Lot kag ang iya tanan nga mga pagkabutang tungod kay nagaestar sia sa Sodoma.	Pekidakap de i Lot a pangunakan nang Abram. Manuknangan ya kanita king Sodoma; dela ra pati pibandian na.
GEN_014_1	GEN	014	1	Ang apat ka mga hari nga amo sanday Amrafel nga hari sang Babilonia, Arioc nga hari sang Elasar, Kedorlaomer nga hari sang Elam, kag Tidal nga hari sang Goim	Ketang panaun da ri Aring Amrapel ning Sinar, Aring Ariok ning Ellasar, Aring Kedorlaumer ning Elam, at Aring Tidal ning Goiim
GEN_014_1	GEN	014	1	nagpakig-away batok sa lima ka mga hari nga amo sanday Bera nga hari sang Sodoma, Birsa nga hari sang Gomorra, Sinab nga hari sang Adma, Semeber nga hari sang Zeboim, kag sa hari sang Bela ukon Zoar.	mekigera la kari Aring Bera ning Sodoma, Aring Birsa ning Gomorra, Aring Sineab ning Adma, Aring Semeber ning Zeboiim, at king ari ning Bela o Zoar.
GEN_014_1	GEN	014	1	Ining lima ka mga hari nagdampiganay kag nagtingob sang ila kusog sa nalupyakan sang Sidim nga amo karon ang Patay nga Dagat.	Pikayari da reting ari a tauling mebanggit ing misanmetung la king pamakigera karin king Kapatagan ning Siddim ing Dagat a Mete.
GEN_014_1	GEN	014	1	Gingamhan sila ni Kedorlaomer sa sulod sang dose ka tuig, pero sang ika-13 ka tuig nagbato sila sa iya.	Makapailalam la kilub ding labing aduang banua kang Kedorlaumer, oneng karas ning kalabing atlung banua mig-rebeldi la laban kang Kedorlaumer.
GEN_014_1	GEN	014	1	Sang ika-14 ka tuig si Kedorlaomer kag ang iya mga kadampig nag-abot nga may mga soldado kag gindaog nila ang mga Refaimnon sa Astarot Karnaim, ang mga Zuzimnon sa Ham, ang mga Emimnon sa kapatagan sang Kiryataim,	King kalabing apat a banua dinatang ya i Kedorlaumer at ding aring kasanmetung na, at simbut da la ring Refaim karin Asterotkarnaim, ding Susim karin Ham, ding Emim karin Sabekiriataim,
