id	book	chapter	sentence_no	source_text	target_text
EXO_019_2	EXO	019	2	Amo ini ang isiling mo sa mga Israelinhon.	Kanaku ya ing mabilug a yatu, oneng ikayu mung bukud ding taung pinili ku,
EXO_019_2	EXO	019	2	Ang bisan sin-o nga makatandog sini, pagapatyon.	King aldo a ita kuldas ku king Bunduk ning Sinai ban malyari da kung akit ding sablang tau.
EXO_019_2	EXO	019	2	Pero kon patunogon ang budyong, dayon ang mga tawo magataklad sa bukid.	Paten ya ing ninumang munta king bunduk;
EXO_019_2	EXO	019	2	Ginlabhan nila ang ila mga bayu,	Kabud tiniup yang makaba ing trumpeta sukat na lang mukiat ding tau king bunduk.
EXO_019_2	EXO	019	2	Ang aso nagtub-ok subong sang aso halin sa hornohan, kag ang tanan nga mga tawo nagkulurog gid sa kahadlok.	Tinuknang la king angganan na ning bunduk.
EXO_019_2	EXO	019	2	Naghambal si Moises, kag ang Dios nagsabat sa iya sa daguob.	Minta babo ing asuk kalupa na ning asuk ning metung a ornu, at ginalgal lang e mu nanu ding tau.
EXO_020_1	EXO	020	1	Indi mo paggamiton sa wala sing pulos ang akon ngalan kay ako ang Ginoo nga imo Dios, magasilot sang bisan sin-o nga maggamit sang akon ngalan sa wala sing kapuslanan.	E ye gagamitan ing lagyu ku king e mayap a kapagnasan, uling aku, ing Ginung kekayung Dios, parusan ke ing ninumang gagamit e ustu king lagyu ku.
EXO_020_1	EXO	020	1	Dumdoma ang Adlaw nga Inugpahuway, kag pakabalaana ini.	Igalang ye ing Aldo ning Sabbath at ipangiling ye.
EXO_020_1	EXO	020	1	Indi kamo magsaka sa akon altar paagi sa mga halintang, agod indi kamo diri mabihangan.	E kayu naman mumukiat king altar a atin eran a matas, pota king pamanuklu yu karing balitang, mayakit king ala kayung salol.
EXO_020_1	EXO	020	1	Kon maghimo kamo sing altar nga bato para sa akon, indi ninyo paghimuon ini halin sa binasbasan nga mga bato, tungod kay kon gamitan ninyo ini sang inyo mga sinsil ginadagtaan ninyo ini.	Nung sakaling igawa yu kung altar a batu, e kayu gagamit batung tinabas, uling e ne maging karapatdapat kanaku kabud gemitanan yeng pataram.
EXO_020_1	EXO	020	1	Maghimo kamo sing altar nga duta para sa akon, kag sa sini maghalad kamo sing mga karnero kag sang mga baka subong mga dulot nga pagasunogon sang bug-os kag subong mga dulot sa paghiambit.	Igawa yu kung altar a gabun at babo na niti iyain yu la kanaku bilang ain ding tupa yu ampon baka. Iyain yu la bilang ain-a-durulukan at ain-a-pisulusuluan.
EXO_020_1	EXO	020	1	Indi kamo maghimo para sa inyo kaugalingon sing mga dios nga pilak ukon bulawan nga simbahon man ninyo subong dugang sang inyo pagsimba sa akon.	E kayu gagawang dios a pilak o gintu a pakipante yu kanaku at para samban subali kanaku.
EXO_020_1	EXO	020	1	Ang Ginoo nagsugo kay Moises, Amo ini ang dapat mo isiling sa mga Israelinhon: Nakita ninyo nga ako, ang Ginoo , nagpakighambal sa inyo halin sa langit.	Ngana pa ning Ginu kang Moises, Sabian mu iti karing memalen na ning Israel: Ikayu mismu ikit yu nung makananung aku, ing Ginu , migsalita ku kekayu ibat banua.
EXO_020_1	EXO	020	1	Pero ang mga tawo nagtindog gihapon sa malayo, kag si Moises lamang ang nagpalapit sa maitom nga gal-om sa diin yara ang Dios.	Menatili lang makatalakad king marayu ding tau at bukud mung i Moises ya ing linapit king makapal a biga nung nu ya atyu ing Dios.
EXO_020_1	EXO	020	1	Nagsiling si Moises sa mga tawo, Indi kamo magkahadlok, ang Dios nag-abot sa pagtilaw sa inyo, agod magpadayon kamo sa pagtuman sa iya, kag indi magpakasala.	Nganang Moises, E kayu tatakut; dinatang ya ing Dios ba na kayu mung subukan, at ban kanita e mako kapilan man king kaisipan yu ing pamamintu, at ban e kayu mikasala.
EXO_020_1	EXO	020	1	Nagsiling sila kay Moises, Ikaw ang maghambal sa amon kag mamati kami, kay nahadlok kami nga kon ang Dios ang maghambal sa amon, magakalamatay kami.	Ngara kang Moises, Makiramdam kami nung ika ing magsalita kekami, oneng e ne sana magsalita kekami ing Dios, pota mate kami.
EXO_020_1	EXO	020	1	Sang mabatian sang mga tawo ang daguob kag ang tunog sang budyong, kag sang makita ang kilat kag ang bukid nga nagaaso, nagkulurog sila sa kahadlok kag nagtindog sa malayo.	Ginalgal la king takut inyang dimdam da ring tau ing duldul, ing tiup na ning trumpeta, at ikit ing kildap ampon ing bunduk a mamasuk, at linaut la king bunduk.
EXO_020_1	EXO	020	1	Indi ka magkaibog sang balay sang imo isigkatawo.	E ye angkaminan ing bale na ning kalupa yung tau.
EXO_020_1	EXO	020	1	Indi ka magsaksi sing binutig sa imo isigkatawo.	E kayu sasaksi king e katutuan laban king kenu man.
EXO_020_1	EXO	020	1	Indi ka magpangawat.	E kayu manako.
EXO_020_1	EXO	020	1	Indi ka magpanginbabayi ukon magpanginlalaki.	E kayu makipangalugud.
EXO_020_1	EXO	020	1	Indi ka magpatay.	E kayu makamate kalupang tau.
EXO_020_1	EXO	020	1	Tahura ang imo amay kag iloy, agod nga magkabuhi ka sing malawig sa duta nga ginahatag ko sa imo.	Igalang ye i tata yu at i ima yu ban kumaba ing bie yu king gabun a babie ku kekayu.
EXO_020_1	EXO	020	1	Ang Dios naghambal sini nga mga pulong	Migsalita ya ing Dios at ila deti ring amanu na
EXO_020_1	EXO	020	1	Ako amo ang Ginoo nga imo Dios, nga nagdala sa imo pagwa sa Ehipto, sa diin gin-ulipon ka.	Aku ing Ginung kekayung Dios a milual kekayu ibat Ehipto nung nukarin kayu meging ipus.
EXO_020_1	EXO	020	1	Indi ka magsimba sa iban nga mga dios, luas sa akon.	E kayu mikaka aliwang dios subali kanaku.
EXO_020_1	EXO	020	1	Indi ka maghimo para sa imo kaugalingon sang isa ka diosdios ukon isa ka larawan sang bisan ano nga tinuga sa langit, ukon sa duta, ukon sa tubig nga yara sa idalom sang duta.	E kayu gagawang larawan para kekayu o nanumang kawangis ning nanumang atyu king banua, keti king yatu o king danuman king lalam ning yatu.
EXO_020_1	EXO	020	1	Indi ka magluhod ukon magsimba sa bisan ano nga diosdios, tungod kay ako ang Ginoo nga imo Dios, kag maimon ako nga Dios.	E kayu duruku karing idolo o sasamba kareti, uling aku, ing Ginung kekayung Dios, Dios kung mapangalalu.
EXO_020_1	EXO	020	1	Pero sa mga nagahigugma sa akon kag nagatuman sang akon mga sugo, ipakita ko sa ila ang akon malig-on nga paghigugma sa linibo nga mga kaliwatan.	Oneng papakit ku ing lugud ku karing libu-libung lahi ra a malugud kanaku at mamintu karing utus ku.
EXO_020_1	EXO	020	1	Sa sulod sang anom ka adlaw ako, ang Ginoo , nagtuga sang langit kag duta, sang dagat, kag sang tanan nga yara sa ila, pero sa ikapito nga adlaw nagpahuway ako.	Kilub ding anam a aldo, aku, ing Ginung kekayung Dios, lelangan ke ing yatu, ing banua, ding dagat, at ing sablang atyu kareti, oneng pepaynawa ku king kapitung aldo.
EXO_020_1	EXO	020	1	pero ang ikapito nga adlaw amo ang Adlaw nga Inugpahuway nga imo igahalad sa akon.	oneng ing kapitung aldo metung yang aldo ning pamagpaynawa a makatalaga para kanaku.
EXO_020_1	EXO	020	1	Mag-obra ka sa sulod sang anom ka adlaw,	Atin kayung anam a aldo ban daptan ing obra yu,
EXO_020_2	EXO	020	2	Sa mga nagadumot sa akon silutan ko ang ila mga kaanakan tubtob sa ikatlo kag ikap-at nga kaliwatan.	Parusan ku la detang masama kanaku, at pati na ding lahi ra angga na karing apu ra at apu king tud.
EXO_020_2	EXO	020	2	Indi ka mag-obra sa sina nga adlaw, ikaw, ukon ang imo mga kaanakan, ukon ang imo mga ulipon, ukon ang imo mga kahayupan, ukon ang mga dumoluong nga nagaestar sa imo banwa.	Ala metung man a malyaring magobra king aldong iti; e mu ikayu, nune pati na ding anak yu, ding ipus yu, ding sese yung animal o kaya ding dayuan a makipamalen kekayu.
EXO_020_2	EXO	020	2	Sa tagsa ka lugar nga ginasiling ko sa inyo nga magsimba kamo sa akon, magaduaw ako sa inyo kag magabendisyon sa inyo.	Datangan da kayu, at bendisyunan king balang lugal a ituldu ku para king pamanyamba yu kanaku.
EXO_020_2	EXO	020	2	Indi ka magkaibog sang iya asawa, ukon sang iya mga ulipon, sang iya mga baka, ukon sang iya mga asno, ukon sang bisan ano niya nga mga pagkabutang.	E ye angkaminan ing asawa na, ding ipus na, ding baka na, ding asno na o ing nanumang bandi na.
EXO_020_2	EXO	020	2	Gani ako, ang Ginoo , nagbendisyon sang Adlaw nga Inugpahuway kag ginpakabalaan ko ini.	Iti ing sangkan nung inya aku, ing Ginu , binendisyunan ke ing Aldo ning Sabbath at gewa keng banal.
EXO_021_1	EXO	021	1	Kon ang baka makapatay sing ulipon nga lalaki ukon babayi, ang tag-iya sang baka magabayad sa tag-iya sang ulipon sing traynta ka bilog nga pilak kag ang baka pagabatuhon tubtob mapatay.	Nung mekasagu ya ing toro at mekapate anak a lalaki o babai, ing mesabing tuntunan ya mu rin ing tukian.
EXO_021_1	EXO	021	1	Pero kon mapatay ang babayi, ang silot amo ang kabuhi sa kabuhi,	Nung apanasakit de king pamipate ra ding lalaki ing metung a babaing mabuktut at mekikuan ya uli na nita, pero e ne man mepinsala king makananu mang paralan, sukat yang mamayaran ing taung mekatud king aduan ning asawa na ning babai at mamayaran ya agpang king desisyun da ring ukum.
EXO_021_1	EXO	021	1	dapat niya bayran ini. Magabayad sia sa tag-iya sini nga sapat, kag mangin-iya ang hayop nga patay.	Nung lakuan neng alang takap ning ninuman ing talaga na o nung kaybat nang ginawang talaga e ne tikpan at mipaintagun ing metung a baka o kaya asno menabu ya karin,
EXO_021_1	EXO	021	1	Amo ini ang mga pagsulondan nga ihatag mo sa mga Israelinhon	Ibie mu la karing Israelita deting tuntunan
EXO_021_1	EXO	021	1	Kon may tawo nga nagkuha sang tabon sang bubon, ukon magkutkot sang isa ka bubon kag wala niya pagtabuni ini, kag may mahulog nga baka ukon asno sa amo nga bubon,	Nung ing segu na ning toro metung yang ipus a lalaki o babai, mamayaran yang atlung pulung pirasung pilak ing makibandi king makibandi king ipus at basibasan yang batu ing toro angga king mate ya.
EXO_021_1	EXO	021	1	Ang bisan sin-o nga nagasakit sang isa ka tawo sa bagay nga mapatay sia, pagapatyon man.	Ninuman ing dugpa gamat king metung a tau at kemate na iti, sukat yang paten ing mekamate.
EXO_021_1	EXO	021	1	Kon magpangasawa sia sang iban pa gid nga babayi, kinahanglan padayunon niya ang paghatag sa nahauna niya nga asawa sing amo man nga kadamuon nga pagkaon kag panapton, kag amo man nga kinamatarong.	Nung makiasawa yang kadua ing lalaki, e ne sukat babawasan a sustentu ing minuna nang ayasawa, maging king pamangan, imalan o ing katuliran bilang asawa na.
EXO_021_1	EXO	021	1	Kon ang baka makapatay sing bata nga lalaki ukon babayi, ang amo man nga pagsulondan ang pagatumanon.	Makanyan man, nung papamayaran dia mung multa ing makibandi bilang panatbus king bie na, bayaran na ing alaga a aduan da.
EXO_021_1	EXO	021	1	Pero kon may ginpabili nga multa sa tag-iya para sa iya kabuhi, pagabayaran niya ang bug-os nga kantidad nga ginakinahanglan sa pagluwas sang iya kabuhi.	Nung king milabas dakal ne segu at nung mirinan neng abiso ing makibandi at e ne pa kilung iti, nung wari't mekapate yang tau iting toro, paten ya king basibas at paten ya naman ing makibandi.
EXO_021_1	EXO	021	1	Pero kon ang baka palasungay sang tawo, kag ang tag-iya ginpaandaman nahanungod sang iya baka, pero wala niya pagbantayi kag makasungay ini sing bisan sin-o nga tawo kag mapatay gid, batuhon ang baka kag ang tag-iya pagapatyon man.	Nung asagu ne ning toro ing metung a tau at mete ya, sukat yang paten ing toro king basibas at e sukat kanan ing karni na; ala neng pakibatan ing makibandi king toro.
EXO_021_1	EXO	021	1	Kon may baka nga magsungay sing bisan sin-o nga tawo kag mapatay, batuhon ini nga baka, kag indi pagkaunon ang iya unod, pero ang tag-iya indi pagsilutan.	Nung atanggal ne ipan ing ipus nang lalaki o babai, sukat neng dinan kalayaan ing ipus bilang kabayaran king ipan na.
EXO_021_1	EXO	021	1	Pero kon nahibal-an na nga daan nga ang baka palasungay, kag wala ini ginbantayi sang tag-iya, dapat magbayad sia, kag magahatag sing buhi nga baka nga baylo sa napatay, kag ang napatay nga baka mangin-iya.	Nung pete ne ning baka na ning metung a tau ing baka na ning aliwang tau, pisali de ring makibandi ing baka a mabie at pipitnan da la ring abli; pipitnan dia naman ing mete baka.
EXO_021_1	EXO	021	1	Kon makabingaw sia sang isa ka ngipon, pagahilwayon niya ang iya ulipon subong bayad para sa iya ngipon.	Nung tiran ne mata ning ninuman ing ipus nang lalaki o babai at mebulag ya, sukat neng dinan kalayaan bilang kabayaran para king mata.
EXO_021_1	EXO	021	1	Kon may tawo nga magbunal sang iya ulipon nga lalaki ukon babayi sa mata kag mabulag ini, pagahilwayon niya ang iya ulipon bilang bayad para sa iya mata.	ing mepali king mepali, ing sugat king sugat, at ing galus king galus.
EXO_021_1	EXO	021	1	paso sa paso, pilas sa pilas, labod sa labod.	ing mata king mata, ing ipan king ipan, ing gamat king gamat, ing bitis king bitis,
EXO_021_1	EXO	021	1	mata sa mata, ngipon sa ngipon, kamot sa kamot, tiil sa tiil,	Nung mepinsala ya ing babai, bayaran bie ing bie,
EXO_021_1	EXO	021	1	Pero kon ang ulipon mabuhi pa sa sulod sing isa ukon duha ka adlaw, ang agalon indi pagsilutan, kay ang ulipon kaugalingon niya nga pagkabutang, kag ang pagkadula sang iya ulipon tuman na nga silot sa iya.	Nung pelupalu ne ning panginuan ing ipus na, lalaki ya man o babai, at mete ya ing ipus, sukat yang parusan ing mekapate.
EXO_021_1	EXO	021	1	Kon may mga tawo nga mag-away kag makasakit sing isa ka babayi nga nagabusong sa bagay nga mahulogan sia, pero wala gid man sia maano, ang nakasakit sa iya pagamultahan suno sa ginapangayo sang bana sang babayi, kag magabayad sia suno sa ginpamatbat sang mga hukom.	Nung ing ipus ikua na pang mebie metung o aduang aldo, ala yang pakibatan ing panginuan. Ing pangamate na ning ipus sapat nang kaparusan king panginuan.
EXO_021_1	EXO	021	1	Kon ang baka sang isa ka tawo makapatay sang isa ka baka sang isa ka tawo, sila nga duha magabaligya sang buhi nga baka, kag tung-on ang kwarta nga bili sini. Tungaon man nila ang karne sang patay nga hayop.	sukat yang mamayaran ing makibandi king talaga; bayaranan ne ing makibandi king animal at miyabie ya king maki bandi king talaga ing mete animal.
EXO_021_1	EXO	021	1	Kon wala sia nagatuman sini nga mga katungdanan sa iya, pagahilwayon niya sia, kag indi na sia dapat magpabayad sing kwarta.	Kabud pigkait na la king minuna nang ayasawa deting katungkulan na, ing asawa nang iti malaya yang mako; ala yang bayaran nanuman para king kalayaan na king panginuan na.
EXO_021_1	EXO	021	1	Ang bisan sin-o nga nagapakamalaut sa iya amay ukon sa iya iloy pagapatyon.	Paten ya ing ninumang lapastangan kang tata na o kang ima na.
EXO_021_1	EXO	021	1	Kon magbakal kamo sing ulipon nga Hebreo, magaalagad sia sa inyo sing anom ka tuig.	Nung sali kang ipus a lalaking Hebreo, suyuan na ka niti king anam a banua.
EXO_021_1	EXO	021	1	Kon may mga tawo nga mag-away, kag ang isa magpulpog sing bato ukon magsumbag sa iya kaaway, pero wala sia mapatay, indi sia pagsilutan.	Nung ating mipapate at ing metung apanasakit ne king metung a batu o king tumbuk, oneng e na ne man apate, ala yang pakibatan ing mekapanasakit.
EXO_021_1	EXO	021	1	Kon may tawo nga magbunal sang iya ulipon nga lalaki ukon babayi kag mapatay ini gilayon, pagasilutan sia.	kaybat makabangun ya at makalakad makatukud, sukat neng bayaranan nitang mekapanasakit ketang panaun nang mesira at kailangan neng paulu angga king kumayap ya.
EXO_021_1	EXO	021	1	Ang bisan sin-o nga nagakuha sang isa ka tawo sa pakusog, agod iya ibaligya ukon himuon nga ulipon, pagapatyon.	Paten ya ing ninumang dumukut tau ban pisali ne o kaya gawan neng sarili nang ipus.
EXO_021_1	EXO	021	1	Ang bisan sin-o nga nagasakit sa iya amay kag sang iya iloy, pagapatyon.	Paten ya ing ninumang dugpa gamat kang tata na o kang ima na.
EXO_021_1	EXO	021	1	Kon ipaasawa niya sia sa iya anak nga lalaki, pagakabigon niya sia nga iya kaugalingon nga anak nga babayi.	Nung telaga na ne man ning sinali ban ayasawa ne ning anak nang lalaki, ituring neng sarili nang anak.
EXO_021_1	EXO	021	1	Pero kon ang isa ka tawo magkaakig kag patyon niya sing hungod ang isa ka tawo, sarang sia makuha sa akon altar, agod pagapatyon sia.	Nung ing ninuman, king mua na seria neng pete ing kalupa nang tau, sukat yang paten agyang pang mulayi yang salikut king kakung altar.
EXO_021_1	EXO	021	1	Pero kon indi niya hungod ini, kag wala sia sing tuyo sa pagpatay sa iya, makapalagyo sia sa lugar nga akon pilion para sa inyo sa diin indi sia maano.	Nung e na sasarian at e ne seriang apate, malyari yang salikut ing mekapate ketang lugal a ituldu ku keka at e re ananu balang karin.
EXO_021_1	EXO	021	1	Kon sa iya pag-abot subong ulipon wala pa sia sing asawa, magahalin sia nga sia lang. Pero kon sa iya pag-abot subong ulipon may asawa na sia, ti sa iya paghalin magaupod sa iya ang iya asawa.	Nung e ya talasawa kanitang miras ya keka bilang ipus, mako ya namang alang asawa; nung dinatang ya keka a talasawa na, tuki ya ing asawa na potang malaya ne.
EXO_021_1	EXO	021	1	Kon wala sia maluyagi sang iya agalon nga may tuyo sa paghimo sa iya nga iya asawa, dayon tugotan niya nga gawaron sia sang iya amay.	Nung ing sinali buri neng maging asawa na at kaybat e ne kaluguran, malyari neng payatbus king tata na ning babai.
EXO_021_1	EXO	021	1	Kon ang isa ka tawo magbaligya sang iya anak nga babayi nga mangin-ulipon, indi sia paghilwayon pareho sang paghilway sang mga ulipon nga lalaki.	Nung pisali ne bilang ipus ning metung a tata ing anak nang babai, e ne malyaring dinan kalayaan anti ding ipus a lalaki.
EXO_021_1	EXO	021	1	Kon paasawahan sia sang iya agalon, kag ang iya asawa magpamata sing mga lalaki kag mga babayi, dayon ang iya asawa kag ang mga kabataan iya sang iya agalon, kag ang bana lamang amo ang magahalin.	Nung kabang ipus ya iting lalaki, pekiasawa ne ning panginuan na at mikayanak ya king ayasawa na, ing asawa na at ding anak maging bandi na la ning panginuan; mako yang dili na ing lalaking ipus.
EXO_021_1	EXO	021	1	dayon pagadalhon sia sang iya agalon sa lugar nga ginasimba ang Dios, kag pagadalhon sia sa pwertahan ukon sa bakalan kag buhoan ang iya dulonggan.	ituki ne kanita ning panginuan ing ipus king lugal a pisasamban king Dios. Karas da karin tairan ne king pasbul o kaya king amba na ning pasbul, at karin ne busbusan a balugbug.
EXO_021_1	EXO	021	1	Pero kon ang ulipon magsiling, Palangga ko ang akon agalon, ang akon asawa, kag ang akon mga kabataan, indi ako luyag maghalin,	Nung sabian na ning ipus king kaluguran ne ing panginuan na, ing asawa na, ding anak na, at e ya bisang maging malaya,
EXO_021_2	EXO	021	2	Sia mangin-ulipon niya tubtob nga buhi sia.	Maging ipus na ne kanita kabang bie.
EXO_021_2	EXO	021	2	Wala sing kinamatarong ang iya agalon sa pagbaligya sa iya sa mga dumoluong tungod kay indi matarong ang pagkabig niya sa iya.	E ne malyaring pisali karing dayuan, uling e ya meging tapat ing sinali.
EXO_021_2	EXO	021	2	Sa ikapito nga tuig pagahilwayon sia nga wala sing balayran.	Malyari na na kang lakuan king kapitung banua; dinan meng kalayaan at ala yang bayaran nanuman.
EXO_021_2	EXO	021	2	Kon ang tawo nga iya ginsakit kinahanglan maghigda gid, pero sang ulihi makabangon man kag makalakat sa gwa sa bulig sang sungkod, ang tawo nga nagsakit sa iya magabayad sang tinion nga nausik niya kag magaatipan sa iya tubtob mag-ayo sia.	Nung ing taung menasakit e ya makalakad,
EXO_022_1	EXO	022	1	Manginbalaan kamo nga mga tawo sa akon, gani indi kamo magkaon sing karne sang bisan ano nga hayop nga ginpatay sang mga hayop nga talunon, kundi ihatag ninyo ini sa mga ido.	Ikayu ing balen a pinili ku, inya e kayu mamangan king karni na ning animal a piglapak da ring lasip; pakan yu nia mu karing asu.
EXO_022_1	EXO	022	1	kag ako magakaakig gid sa inyo kag magapatay sa inyo sa inaway.	mibua ing mua ku at paten da kayu king kapamilatan ning gera.
EXO_022_1	EXO	022	1	Dapat niya bayaran ini.	Sukat yang mamayaran king penako na.
EXO_022_1	EXO	022	1	Ihatag man ninyo sa akon ang panganay sang inyo kabakahan kag sang inyo mga karnero.	Ibie yu la naman kanaku ding pangane karing baka yu at tupa.
EXO_022_1	EXO	022	1	Ihatag ninyo sa akon ang panganay sang inyo mga anak nga lalaki.	Iyain ye kanaku ing pangane karing anak yung lalaki.
EXO_022_1	EXO	022	1	Kon ang tawo madakpan nga sa isa ka gab-i nga nagapangawat sa balay kag ginpatay sia, ang nagpatay sa iya wala sing salabton sa pagpatay.	Nung mebante ya ing manlub neng bengi, at apate ne ning makibale, ala yang pakibatan ing mekapate.
EXO_022_1	EXO	022	1	Ihatag ninyo sa akon sa nagakaigo nga tion ang mga dulot halin sa inyo mga patubas, sa inyo bino, kag sa inyo lana nga olivo.	E yu piluat-luat ing pamiyain yu kaku karing sukat yung iyain ibat king pupul yu, king alak a apalto yu karing ubas yu, at king laru a ibat karing tanaman yung olibo.
EXO_022_1	EXO	022	1	Kon ang tawo magpahalab sang iya mga hayop sa uma ukon sa talamnan sang ubas, kag kon makabuhi ang iya hayop kag maghalab sa uma sang iban, dapat sia magbayad sang pinakamaayo niya nga patubas sang iya uma ukon talamnan sang ubas.	Nung king pamibulus nang animal ning metung a tau king metung a marangle o tamnanan ubas, at ikua rang miglub at minyira ding animal na king marangle ning aliwa, sukat yang mamayaran ketang dake pengan da ring animal na; alilan na king pupul na king sarili nang asikan o tamnanan ubas.
EXO_022_1	EXO	022	1	Kon may tawo nga magtutod sang iya talamnan kag ang kalayo maglapta sa mga hilamon, pakadto sa uma sang isa ka tawo kag magsunog sang tinumpi ukon alanyon ukon sang bug-os nga uma nga may tanom, ang nagtutod magabayad sang kapierdihan.	Nung magdapug ya ing ninuman king marangle na, at ikua nang mikalat king dikut, at mirasan ing marangle na ning aliwa, at minyilab king pupul na a makatalakad pa o kaya mepalut na at makatumpuk na, sukat yang mamayaran ing taung mekapasari king silab king sablang mesira.
EXO_022_1	EXO	022	1	Kon ang isa ka tawo magpatago sang iya kwarta ukon malahalon nga pagkabutang sa iya kaingod kag kon kawaton ini sa iya balay, magabayad sing duha ka pilo ang makawat kon madakpan sia.	Nung ating ninumang menilas salapi o nanumang bage king aliwa at mepanako la reti king bale na ning pipanilasan, nung marakap ya ing menako, sukat yang mamayad dobli.
EXO_022_1	EXO	022	1	Kon ang makawat indi madakpan, ang tag-iya sang balay pagadalhon sa lugar nga ginasimba ang Dios agod mahibal-an kon bala ginkuha niya ang pagkabutang sang isa ka tawo ukon wala.	Nung e ya merakap ing menako, sukat yang ituki ing pipanilasan king lugal a pisasamban king Dios, at karin na patunayan king e na la teginan ding penilas da bilang kargu na.
EXO_022_1	EXO	022	1	Nahanungod sa mga pagkabutang nga ginaagawan, subong sang baka, asno, karnero, mga bayu, ukon bisan ano nga pagkabutang nga nadula, kon may duha ka tawo nga nagaangkon sini, sila nga duha pagadalhon sa lugar nga ginasimba ang Dios. Ang pagahukman sang Dios nga nakasala magabayad sing duha ka pilo sa isa ka tawo.	Ing nanumang pisasabian tungkul king pibandian maging iti metung yang baka, asno, tupa, imalan o nanumang bage mebating, ding adua kataung parehung sasabing bandi re, sukat lang piyarapan king lugal a pisasamban king Dios; ninuman karela ing atulan nang mikasala ning Dios sukat yang mamayaran dobli king tune makibandi.
EXO_022_1	EXO	022	1	Kon may tawo nga magpasagod sa isa ka tawo sing asno, baka, karnero ukon bisan ano nga hayop, kag mapatay ini, ukon mapilasan, ukon pagakawaton, kag wala sing saksi,	Nung ing ninuman atin yang penabilin a asno, baka, tupa o kaya aliwa pang animal king aliwa, at mete ya ing animal o kaya mepinsala ya o mepanako ya at alang menakit king milyari,
EXO_022_1	EXO	022	1	ang pagsumpa sa lugar nga ginasimba ang Ginoo amo ang magapat-od kon bala ginkawat niya ang sapat sang isa ka tawo ukon wala.	sumpa ya ing penabilinan ketang lugal a pisasamban king Dios king ya e ne pigimbutan ing animal a mipanabilin bilang kargu na.
EXO_022_1	EXO	022	1	Indi ninyo pagpasipalahan ang Dios, kag indi ninyo pagpakamalauton ang pangulo sang inyo mga tawo.	E kayu magsalitang e mayap laban king Dios o panagkasan ing manimuna na ning balen yu.
EXO_022_1	EXO	022	1	pero kon ang hayop ginkawat, magbayad sia sa tag-iya.	Nung mepanako ya ing animal sukat yang mamayaran ing penabilinan king makibandi.
EXO_022_1	EXO	022	1	Kon ini ginpatay sang talunon nga mga hayop, dalhon niya ang lawas nga patay subong pamatuod, kag indi sia kinahanglan magbayad sing ginpatay sang talunon nga mga hayop.	Nung pete de ring lasip ing animal, iyapag ne ning penabilinan bilang katunayan king mete ya ing animal; e ya sukat mamayaran kanita para king animal a pete da ring lasip.
EXO_022_1	EXO	022	1	Kon may tawo nga maghulam sang isa ka hayop sang isa ka tawo, kag mapilasan ini ukon mapatay kag wala dira ang tag-iya ang naghulam dapat magbayad sini.	Nung mindam yang metung a animal ing ninuman king aliwa, at mepinsala ya ing animal o kaya mete ya king e na akakit ning makibandi, sukat yang mamayaran ing menandam.
EXO_022_1	EXO	022	1	Pero kon yara ang tag-iya, sang natabo ini, ang naghulam indi na kinahanglan magbayad.	Nung atyu ya ing pipanandaman inyang mete ya o mepinsala ing animal, e ya sukat mamayaran ing mindam.
EXO_022_1	EXO	022	1	tungod kay amo lamang ini ang iya kunop agod indi sia matugnawan.	uling ing balabal ya mu kabud ing malyari nang panakap king katawan na ban e ya dimla.
EXO_022_1	EXO	022	1	Kon may tawo nga maghaylo sa isa ka birhen nga indi pa kalaslon, kag magpakighilawas sa iya, dapat sia magbayad sang ginapangayo para sa kasal kag pangasaw-on niya sia.	Nung lininlang ne ning metung a lalaki ing metung a dalagang e na kakaburi at sipingnan ne, sukat nang bayaran ing duru na at pakasalan ne.
EXO_022_1	EXO	022	1	Pero kon ang iya amay indi gusto nga pangasaw-on sia sina nga tawo, dapat sia magbayad sa amay sang kantidad suno sa nagakabagay para sa kalaslon nga birhen.	Nung tutul ya ing tata na ning dalaga king pamiyasawa ra, sukat yang mamayaran king tata ing miglinlang king alagang katumbas ning karaniwan a duru para king metung a dalagang makiasawa.
EXO_022_1	EXO	022	1	Indi ninyo pagtugotan ang isa ka babayi nga manugbabaylan nga magkabuhi.	Paten ya ing ninumang babaing mangkukulam.
EXO_022_1	EXO	022	1	Ang bisan sin-o nga magpakighilawas sa hayop pagapatyon sia.	Paten ya ing ninumang lalaking mekipangatawan king metung a animal.
