id	source_text	target_text
EXO_001_0001	Amo ini ang mga ngalan sang mga anak nga lalaki ni Jacob nga nagkadto sa Ehipto upod sa iya, ang tagsatagsa upod sa iya panimalay.	Saray anak nen Jacob tan saray pamilya ra a kaiba to ran linmad Egipto et saraya Ruben, Simeon, Levi, Juda, Isacar, Zabulon, Benjamin, Dan, Neftali, Gad, tan Aser.
EXO_001_0002	Sila amo sanday Ruben, Simeon, Levi, Juda, Isacar, Zabulon, Benjamin, Dan, Neftali, Gad, kag Aser.	Pitomplo ya amin iray anak tan apo nen Jacob, a pati si Jose a wadman la ed Egipto.
EXO_001_0003	Ang kadamuon sang mga kaliwat ni Jacob setenta tanan.	Diad impankurang na panaon si Jose, saramay agagi to, tan amin a totoo ed saman a kailalakan et inaatey ira.
EXO_001_0004	Si Jose nga iya anak didto na nga daan sa Ehipto.	Balet amayamay iray anak tan apo na saman a kailalakan, a salanti saray Israelita; dinmakerakel ira tan nagmaliw iran makapanyarin tuloy, kanyan kinmayat iran nanayam ed intiron bansa na Egipto.
EXO_001_0005	Sang ulihi si Jose kag ang iya mga utod nga lalaki nagkalamatay, subong man yadtong bug-os nga henerasyon.	Sinmabiy panaon a walay balon ari na Egipto ya ag to kabat si Jose.
EXO_001_0006	Pero ang mga kaliwat ni Israel may madamo nga mga kaanakan, nagmuad gid sila kag nagmabakod, sa bagay nga naglapnag sila sa duta sang Ehipto.	Sayan ari inkuantod saray totoo to, Makapataktakot la ra yan Israelita, ta dakerakel tan makapanyari la ra nen say sikatayo.
EXO_001_0007	Karon may isa ka bag-o nga hari nga naggahom sa Ehipto.	Gawaen tayoy kasiliban a pamatonda na idadakel da, ta no walay onsabi-sabin bakal, ag la pigan migampi rad saray kalaban tayo.
EXO_001_0008	Wala sia makakilala kay Jose.	Onlaban irad satan ed sikatayo, insan da taynan so bansa tayo.
EXO_001_0009	Ang hari nagsiling sa iya mga ginsakpan, Tan-awa ninyo, ini nga mga tawo nga Israelinhon nagadamo kag nagabakod, kag nabutang kita sa katalagman.	Kanyan angipasen iray Egipsio na saray opisyal a mamairap ed saray Israelita.
EXO_001_0010	Karon pamatii ninyo!	Impankikimey da ra na ambelat diad impamaalagey dad saray siudad na Pitom tan Rameses a panangisempenay abasto na ari.
EXO_001_0011	Pangitaan naton sang paagi nga indi na gid sila magdamo.	Balet no panoy impanpapairap na saray Egipsio ed saray Israelita, lalon ondarakel ira tan onaawang so pasen a panaayaman da.
EXO_001_0012	Kay kon may inaway, basi magdampig sila sa aton mga kaaway sa pag-away batok sa aton, kag magpalagyo sila sa aton pungsod.	Apagaan ed satan iray Egipsio ed saray Israelita, kanyan impagmaliw dan masegsegang so bilay da.
EXO_001_0013	Gani ginbutangan sila sing mga mapintas nga mga kabo sa pagpaobra sa ila sing pataypatay agod magluya sila.	Pinapasoot da ran inaripen.
EXO_001_0014	Ang mga Israelinhon nagpatindog sang mga siudad sang Pitom kag Rameses para sa hari nga pagatipunan nila sing mga pagkaon.	Impankikimey da rad panagmasa na dalin tan diad panaggawa na laryo; impankikimey da met ni rad kaalogan da.
EXO_001_0015	Pero sa nagadugang ang pagpigos sang mga Ehiptohanon sa mga Israelinhon, tapat pa gani nga nagadamo kag nagalapnag sila.	Ag da ran balut kinasian.
EXO_001_0016	Ang mga Ehiptohanon nagkahadlok sa mga Israelinhon.	Insan say ari na Egipto akisalitad kindi Sifra tan Pua, saray duaran manamianak a Hebrea.
EXO_001_0017	Gani mapintas nga gin-ulipon nila ang mga Israelinhon, kag ginpabudlay ang ila pagkabuhi paagi sa pagpaobra sa ila sa lunang kag sa tisa, kag sang tanan nga sahi sang obra sa uma.	Inkuantod sikara, No mamaanak kayod saray bibiin Hebrea, patey yo so ogaw no laki, balet ag yo papateyen no bii.
EXO_001_0018	Ginpilit nila sila sa paghimo sang tanan nga mabug-at nga mga obra.	Balet sarayan manamianak, lapud walay takot dad Dios, ag da inonur imay ingganggan na ari ed sikara; ag da pinatey iray ogogaw a lalaki.
EXO_001_0019	Dayon ang hari sang Ehipto naghambal sa mga paltera nga nagapabata sa mga babayi nga mga Hebreo.	Impatawag to sirin ira yan manamianak tan tinepet tod sikara, Akin et onyay gagawaen yo?
EXO_001_0020	Ang isa ginhingalanan kay Sipra kag ang isa kay Pua.	Akin et ag yo papateyen iray ogogaw a lalaki?
EXO_001_0021	Nagsiling ang hari, Kon nagapabata kamo sang Hebreo nga mga babayi amo ini ang inyo pagahimuon: kon ang lapsag lalaki, patyon ninyo; pero kon babayi ini, pabayai lang nga mabuhi.	Inmebat ira may manamianak, Aliwan singa saray bibiin Egipsia iray bibiin Hebrea, ta mainomay iran mananak; ag ni sinmabiy manamianak et akapananak la ra.
EXO_001_0022	Pero ang mga paltera wala magtuman sa hari kay nahadlok sila sa Dios.	Lapud sarayan manamianak et walay takot dad Dios, tinumangan ira na Dios tan initdan to ray anak da.
EXO_001_0023	Sa baylo ginpabay-an nila nga mabuhi ang mga lapsag nga lalaki.	Ag tinmonda so indakel na saray Israelita tan nagmaliw iran makapanyarin tuloy.
EXO_001_0024	Gani ginpatawag sang hari ang mga paltera kag ginpamangkot, Ngaa bala nga ginhimo ninyo ini kag ginpabay-an nga mabuhi ang mga lapsag nga lalaki?	Diad satan, say ari angipaakseb na sakey a ganggan ed saray amin a totoo to: Ipaanur yod Ilog na Nilo so balang Hebreon laki a kapangyanak, balet ag yo papateyen iray kapangyanak a bibii.
EXO_002_0001	Karon may isa ka tawo sa tribo ni Levi nga nagpangasawa sa isa ka babayi sa amo man nga tribo.	Diad saman a panaon walay sakey a lakin kabyangay boleg nen Levi ya angasaway biin kabolegan to.
EXO_002_0002	Nagbusong ang iya asawa kag nagbata sing isa ka lalaki.	Nanlokun yan bii tan nananak na laki.
EXO_002_0003	Sang makita sang iya iloy nga ang bata gwapo kag maayo sing lawas, gintago niya sia sa sulod sang tatlo ka bulan.	Nen anengneng to a balibalin ogaw so anak to, inyamut ton taloy bulan.
EXO_002_0004	Pero sang indi na niya matago ang bata, nagkuha sia sang isa ka basket nga nahimo sa tabun-ak, kag iya ini ginbutangan sing balaw agod indi makasulod ang tubig.	Balet nen ag to la nayarian ya iyamut so anak to, angala na sakey a baskit a papiro; kinapolan to na beket, pian ag naloobay danum.
EXO_002_0005	Ginpahigda niya ang bata sa sini nga basket kag ginbutang niya ini sa bibi sang suba nga may matag-as nga mga tabun-ak.	Insan to inlogan ed baskit imay ogaw tan inggaton to ed gilig na ilog a kawalaay atatagey a dika.
EXO_002_0006	Ang iya utod nga babayi nagtindog sa ulounhan sa pagbantay kon ano ang mahanabo sa iya.	Say atsi to may ogaw nambantay ed bandad arawi, pian naamtaan to no antoy nagawad samay agi to.
EXO_002_0007	Karon ang anak nga babayi sang hari nagkadto sa suba sa pagpaligo, samtang ang iya manug-atipan nga mga babayi nagdayandayan sa pangpang sang suba.	Et nibana a say prinsisa ya anak na ari et linmasur ed ilog a manames; balet saray mamarikit a katulong to nanakarakar irad gilig na ilog.
EXO_002_0008	Sa hinali nakita niya ang basket sa mga tabun-ak, kag ginsugo niya ang iya ulipon nga babayi sa pagkuha sini.	Kabebekta anengneng to may baskit ed kawalaay atatagey a dika; ingganggan toy sakey a katulong to a mangalad samay baskit.
EXO_002_0009	Ginbuksan ini sang anak sang hari kag iya nakita ang lapsag nga lalaki nga nagahibi.	Nilokasan nen prinsisa imay baskit tan anengneng toy sakey ya ogaw a manakakis.
EXO_002_0010	Naluoy sia sa bata kag nagsiling, Isa ini sang mga bata sang mga Hebreo.	Naabagey to tan inkuanto, Sayan ogaw et anak na sakey ed saray bibiin Hebrea.
EXO_002_0011	Dayon ang utod nga babayi sang lapsag nagpamangkot sa iya, Luyag mo bala nga malakat ako sa pagpangita sang isa ka babayi nga Hebreo nga magaatipan sini nga bata para sa imo?	Insan samay atsi na ogaw inkuanto, Itawagan ta kayo na biin Hebrea, ta komisan to yan ogaw para sikayo?
EXO_002_0012	Nagsabat sia, Lakat ka.	Laka sirin, inkuanen prinsisa.
EXO_002_0013	Gani naglakat ang bata nga babayi kag gintawag ang iloy mismo sang bata.	Kanyan nila ton tinawag imay ina na ogaw.
EXO_002_0014	Ang anak sang hari nagsiling sa iya, Dalha ini nga bata kag saguron mo sia para sa akon, kay suholan ko ikaw.	Inkuan na prinsisa ed samay ina, Alam yan ogaw tan ikomisan mo ak; upaan ta ka.
EXO_002_0015	Gani ginkuha sang babayi ang bata kag ginsagod.	Inala to sirin imay ogaw tan kinomponi to.
EXO_002_0016	Sang magdakudaku na ang bata, gindala niya ini sa anak sang hari kag gin-ayop niya ini subong nga iya anak.	Nen baleg la may ogaw inyakar tod samay prinsisa ya anak na ari.
EXO_002_0017	Nagsiling ang anak sang hari, Ginkuha ko sia sa tubig, gani hingalanan ko sia kay Moises.	Samay prinsisa inala to may ogaw tan impasen ton anak ton dili.
EXO_002_0018	Isa sadto ka adlaw, sang daku na si Moises, nagduaw sia sa iya mga kasimanwa nga Hebreo, kag iya nakita kon daw ano ang pagpilit sa ila sa paghimo sang mabug-at nga mga obra.	Inkuanto, Diad danum so angaonan ko, kanyan ingaran ko na Moises.
EXO_002_0019	Nakita niya ang isa ka Ehiptohanon nga nagpatay sang isa ka Hebreo, isa sang iya mga kasimanwa.	Nen baleg lay Moises dinalaw to ray agagi ton Hebreo, et naimatunan toy kakairapan da.
EXO_002_0020	Nagpanghulonghulong sia, kag sang wala sia sing may nakita, ginpatay niya ang Ehiptohanon kag iya ginlubong ang bangkay sa balas.	Anengneng nen Moises so sakey ya Egipsio a mamapatey ed sakey a Hebreo a kadalaan to.
EXO_002_0021	Sang madason nga adlaw nagbalik sia, kag iya na man nakita ang duha ka mga Hebreo nga nagaaway.	Nanlingaw-lingaw si Moises; nen anggapoy toon nanengneng to, pinatey to may Egipsio tan intabun tod kabueran.
EXO_002_0022	Nagsiling sia sa isa nga nakahimo sing sayop, Ngaa bala ginasakit mo ang kapareho mo nga Hebreo?	Diad ontombuk ya agew pinmaway si Moises tan anengneng to ray duaran Hebreo a manlalaban.
EXO_002_0023	Nagsabat sia, Sin-o bala ang naghimo sa imo nga pangulo kag manughukom sa amon?	Inkuantod samay nankasalanan, Akin et kakabilen moy kaparam a Hebreo?
EXO_002_0024	Patyon mo man bala ako subong sang pagpatay mo sa isa ka Ehiptohanon?	Inmebat imay too, Siopa so anorod sika a manoley tan manintinsia ed sikami?
EXO_002_0025	Dayon kinulbaan si Moises kag nagpanghunahuna, Nahibal-an gali sang mga tawo ang akon ginhimo.	Labay mo ak a pateyen a singa impamatey mod samay Egipsio?
EXO_002_0026	Sang nabatian ini sang hari, gintinguhaan niya nga patyon si Moises, pero nagpalagyo si Moises kag nagkadto sa duta sang Midian, sa diin sia nag-estar.	Tinmakot ed satan si Moises tan inkuantod sikaton dili, Akabatan la na totoo imay ginawak.
EXO_002_0027	Isa ka adlaw, sang pag-abot niya didto, nagpungko sia sa tupad sang bubon.	Nen akabatan na ari so agawa, ingganggan ton pateyen si Moises.
EXO_002_0028	Karon nag-abot sa bubon ang pito ka mga anak nga babayi ni Jetro nga pari sang Midian.	Balet batik si Moises ed dalin na Madian tan diman nanayam.
EXO_002_0029	Nagtimba sila sing tubig kag nagpuno sang palaimnan sang mga karnero kag mga kanding sang ila amay.	Aminsan ya agew a manyodyorung si Moises ed abay na bobun, nitan la ray pitoran bibii ya anak nen Jetro a pari na Madian, ta onasul iray danum ya iyan dad saray atotung ya inoman na saray karniro tan saray kanding na ama ra.
EXO_002_0030	Nag-abot man ang iban nga mga manugbantay sang mga karnero kag gintabog nila palayo ang mga anak ni Jetro.	Balet sinmabi ray pumapastol tan pinapaarawi da ra may bibii.
EXO_002_0031	Pero gintabangan sila ni Moises, kag ginpainom niya ang ila mga kahayupan.	Inmalagey ed satan si Moises, tan inyagel to ra.
EXO_002_0032	Sang pagpauli nila sa ila amay nga si Jetro, nagpamangkot sia, Ngaa temprano pa kamo nakapauli karon nga adlaw?	Pinainom to ni ray ayep da.
EXO_002_0033	Nagsabat sila, Ang isa ka Ehiptohanon nagluwas sa amon sa mga manugbantay sang karnero kag gintimbaan pa niya kag ginpainom ang amon mga kahayupan.	Nen sinmempet ira may bibii, si Jetro ya ama ra tinepet tod sikara, Akin et asaksakbay kayon sinmempet natan?
EXO_002_0034	Ginpamangkot niya ang iya mga anak nga babayi, Diin na sia?	Inmebat ira, Walay sakey a lakin Egipsio ya inyagel to kamid saray pumapastol; inyasulan to kami tan pinainom to ni ray ayep tayo.
EXO_002_0035	Ngaa ginbayaan ninyo sia didto?	Tinepet nen ama ra, Iner so kawalaan to tan a too?
EXO_002_0036	Lakat kag tawga ninyo sia agod makakaon upod sa aton.	Akin et tinaynan yo?
EXO_002_0037	Nagpamat-od si Moises sa pag-estar didto, kag ginpaasawa ni Jetro sa iya ang iya anak nga si Sipora.	Tawag yo tan bagaan yon mangan dia.
EXO_002_0038	Nagbata sia sing lalaki kag ginhingalanan ni Moises ang bata kay Gersom, kay nagsiling sia sa iya kaugalingon, Dumoluong ako diri sa sini nga duta.	Si Moises inmabubon ed panayam tod saman a pamilya, tan impiasawa nen Jetro ed sikato si anak ton Zipora.
EXO_002_0039	Sang makaligad ang madamo nga mga tinuig, ang hari sang Ehipto napatay.	Nananak si Zipora na ogaw a laki.
EXO_002_0040	Ang mga Israelinhon nag-antos sa gihapon tungod sang pag-ulipon sa ila kag nagpangayo sila sing bulig.	Nipaakar ed sayan ogaw si Moises inkuanto, Sangkaili ak ed sayan dalin, kanyan Gersom so ngaran na sayan anak ko.
EXO_002_0041	Ang ila pagpangayo sing bulig nakalambot sa Dios, kag nabatian niya ang ila pagpanghakroy.	Kalabas na abayag a panaon inatey so ari ed Egipto, balet manngesnges ni ray Israelita ed kairapan na pakakaaripen da, kanyan kinmerew iray tulong ed Dios.
EXO_002_0042	Dayon nadumdoman sang Dios ang iya kasugtanan kay Abraham, kay Isaac kag kay Jacob.	Dinengel toy ngesnges da, ta anunotan toy impisipanan tod kindi Abraham, Isaac, tan Jacob.
EXO_002_0043	Nakita sang Dios ang pag-ulipon sa mga Israelinhon, kag nabalaka sia sa ila.	Say Dios anengneng toy pakakaaripen da ray Israelita tan inabagey to ra.
EXO_003_0001	Karon si Moises nagabantay sang mga karnero kag mga kanding sang iya ugangan nga si Jetro, ang pari sang Midian.	Aminsan ya agew, nen si Moises et mampapastol na saray ayep na katolangan ton Jetro a pari na Madian, imbeltang tod kalawakan iray ayep tan akasabid Sinai, say masanton palandey.
EXO_003_0002	Gindala niya ang panong sa tabok sang desierto, kag nakaabot sia sa Sinai, ang balaan nga bukid.	Diman pinmanengneng ed sikato so anghil na Katawan ed nengneng na apoy a manlalapud pegley na sakey ya abeban kiew; anengneng nen Moises a mandarlang imay kiew, balet ag napopoolan.
EXO_003_0003	Didto ang anghel sang Ginoo nagpakita sa iya sa dagway sang nagadabdab nga kalayo sa tunga sang magamay nga kahoy.	Maya, inkuanen Moises ed sikaton dili, Onasingger ak, ta nengnengen ko no anto yan pakelaw; ag napopoolan so kiew anta mandarlang.
EXO_003_0004	Gintan-aw ni Moises ang magamay nga kahoy kag natalupangdan niya nga nagadabdab ini, pero wala ini masunog.	Nen anengneng na Katawan a Dios ya onaasingger si Moises, tinmawag ed sikato manlapud pegley na abeban kiew, Moises, Moises!
EXO_003_0005	Si Moises nagpanghunahuna, Mapalapit ako kag tan-awon ining makatilingala nga butang.	Wadya ak, ebat nen Moises.
EXO_003_0006	Ngaa ining magamay nga kahoy indi masunog?	Ag ka onaasingger dia, inkuan na Dios, ekal mo ray sandalyam, ta masanto so dalin a kawalaan mo.
EXO_003_0007	Sang makita sang Ginoo nga nagapalapit sia, ang Dios nagtawag sa iya halin sa tunga sang magamay nga kahoy nga nagasiling, Moises, Moises!	Siak so Dios na saray lalakim, say Dios di Abraham, Isaac, tan Jacob.
EXO_003_0008	Kag nagsabat sia, Yari ako.	Sinakuban nen Moises so lupa to, ta tinmakot ya onnengneng ed Dios.
EXO_003_0009	Ang Dios nagsiling, Indi ka gid magpalapit.	Insan say Katawan inkuanto, Anengneng ko so ontan lan kakairapan na saray totook a wadman ed Egipto; nadngel koy tagleey da lapud saray maruksan opisyal da.
EXO_003_0010	Ubaha ang imo mga sandalyas, tungod kay ang lugar nga imo ginatindugan balaan.	Amtak so kakairapan da, kanyan linmasur ak, ta iyagel ko rad saray Egipsio, tan itaynan ko ra manlapud saman a dalin; insan ko ra iyakar ed mataba tan maawang a dalin, sakey a dalin a panagagosay gatas tan dilo, a panaayaman natan na saray Cananeo tan Heteo, saray Amorreo tan Perezeo, saray Heveo tan Jebuseo.
EXO_003_0011	Ako amo ang Dios sang imo mga katigulangan, ang Dios ni Abraham, ang Dios ni Isaac, kag ang Dios ni Jacob.	Nadngel koy tagleey na saray totook tan anengneng kon peteg so pamapairap na saray Egipsio ed sikara.
EXO_003_0012	Gani gintabunan ni Moises ang iya guya, tungod kay nahadlok sia sa pagtulok sa Dios.	Natan, ibaki ta ka ed ari na Egipto, pian nipaway mod bansa to iray totook ya Israelita.
EXO_003_0013	Dayon ang Ginoo nagsiling, Nakita ko kon daw ano ang pagpintas sa akon mga tawo didto sa Ehipto.	Balet si Moises inkuantod Dios, Siopa ak ya onarap ed ari tan mangipaway ed Egipto na saray Israelita?
EXO_003_0014	Nabatian ko ang ila pagpangayo sing bulig batok sa mga kabo nga nagapamintas sa ila.	Inmebat so Dios, Say katwaan to, siak so kaibam.
EXO_003_0015	Nahibaluan ko ang tanan nila nga mga pag-antos.	Say pakabirbiran ya imbaki ta ka saya: no nipaway mo lad Egipto iray totook, igalang yo ak diad sayan palandey.
EXO_003_0016	Gani nagpanaog ako sa pagluwas sa ila sa mga Ehiptohanon, kag sa pagpagwa sa ila sa amo nga duta, pakadto sa isa ka malapad nga duta.	Inkuanen Moises ed Dios, Onla ak ed saray Israelita, ta ibagak ed sikara, Say Dios na saray lalaki yo imbaki to ak ed sikayo; et no tepeten dad siak, Antoy ngaran to?
EXO_003_0017	Maayo kag mapatubasan ini nga duta, kag karon ginaestaran sang mga Canaanhon, mga Hethanon, mga Amornon, mga Peresnon, mga Hevhanon kag mga Jebusnon.	Antoy iyebat kod sikara?
EXO_003_0018	Nabatian ko gid ang pagpanawag sang mga Israelinhon, kag nakita ko kon daw ano ang pagpigos sang mga Ehiptohanon sa ila.	Siak si siak, inkuan na Dios.
EXO_003_0019	Karon ipadala ko ikaw sa hari agod sa pagpagwa sang akon mga tawo nga Israelinhon sa Ehipto.	Ibagam ed sikara, Say natatawag a SIAK ET SIAK, imbaki to ak ed sikayo.
EXO_003_0020	Pero si Moises nagsiling sa Dios, Sin-o bala ako nga magkadto sa hari kag magpagwa sang mga Israelinhon sa Ehipto?	Ibagam ed saray Israelita a siak a Katawan , say Dios na saray lalaki ra, say Dios nen Abraham, Isaac, tan Jacob, so angibakid sika ed sikara.
EXO_003_0021	Ang Dios nagsabat, Ako magaupod sa imo, kag ini mangintanda nga ako nagpadala sa imo: kon imo na mapagwa ang mga Israelinhon sa Ehipto, magasimba kamo sa akon sa sini nga bukid.	Sikato yay ngaran kod anggad angga; sikato yan ngaran so tawagan na amin a kailalakan.
EXO_003_0022	Si Moises nagsiling sa Dios, Karon, kon magkadto ako sa mga Israelinhon kag magsiling sa ila, Ang Dios sang inyo mga katigulangan nagpadala sa akon sa inyo, kag kon sila mamangkot sa akon, Ano ang iya ngalan?	Laka sirin, ta tipon mo ray pangulo na Israel tan ibagam ed sikara a siak, say Katawan na saray lalaki ra, say Dios di Abraham, Isaac, tan Jacob et pinmanengneng ak ed sika.
EXO_003_0023	Ano bala ang isabat ko sa ila?	Ibagam met ed sikara a dinalaw ko ra tan anengneng koy gagawaen na saray Egipsio ed sikara.
EXO_003_0024	Ang Dios nagsiling kay Moises, Ako nga Amo sa Gihapon.	Kanyan ginetmak lan ipaway ira ed Egipto a pakapapairapan da, tan iyakar ko ra ed mayaman tan mataba a dalin a panaayaman natan na saray Cananeo, saray Heteo, saray Amorreo, saray Perezeo, saray Heveo, tan saray Jebuseo.
EXO_003_0025	Kag nagsiling pa gid sia, Amo ini ang dapat mo isiling sa mga Israelinhon: Si Ako nga Amo sa Gihapon amo ang nagpadala sa akon sa inyo.	Dengelen day salitaen mod saray totook, insan ka nepeg ya onlad ari na Egipto a kaolup mo ray pangulo na Israel, tan ikuanyod sikato, Pinmanengneng ed sikami so Katawan a Dios min Israelita.
EXO_003_0026	Ang Dios naghambal pa gid kay Moises, Amo ini ang dapat mo isiling sa mga Israelinhon, Ang Ginoo , ang Dios sang inyo mga katigulangan, ang Dios ni Abraham, ang Dios ni Isaac, kag ang Dios ni Jacob, nagpadala sa akon sa inyo.	Abuloyan mo kami pan onlad kalawakan ed loob na taloy agew, ta mangibagat kamid Katawan a Dios mi.
EXO_003_0027	Ini amo ang akon ngalan tubtob sa katubtoban.	Amtak ya ag kayo abuloyan na ari na Egipto ya onla, anggad napasoot na biskeg na pakayari.
EXO_003_0028	Ini amo ang itawag sa akon sang tanan nga palaabuton nga mga kaliwatan.	Balet ipakanak so pakayarik ed Egipto tan dusaen ko na saray makapataktakot a pakelaw a gawaen kod man.
EXO_003_0029	Lakat kag tipuna ang mga pangulo sang Israel, kag singgani sila, Ang Ginoo , ang Dios sang inyo mga katigulangan, ang Dios ni Abraham, ni Isaac, kag ni Jacob, nagpakita kag nagsugo sa akon sa pagsiling sa inyo: nag-abot ako kag nakita ko kon ano ang ginahimo sang mga Ehiptohanon sa inyo.	Kasumpal na sarayan nagawa, abuloyan to kayo lan onla.
EXO_003_0030	Nagpamat-od ako nga pagwaon kamo sa Ehipto, sa diin ginapintasan kamo.	Paabigen koy linawa na saray Egipsio ed sikayo, pian ag kayo ontaynan a kalima-lima.
EXO_003_0031	Dalhon ko kamo sa duta sang mga Canaanhon, Hethanon, Amornon, Peresnon, Hevhanon, kag mga Jebusnon.	Onkerew so balang biin Israelita ed saray kaabay ton Egipsio, tan diad siopaman a biin Egipsio a manaayam ed abung to, na saray kawes tan saray alahas a balituk tan pilak.
EXO_003_0032	Isa ini ka maayo kag mapatubason nga duta.	Paisolung yo ra yan bengatla ed saray anak yon lalaki tan bibii et, diad ontan, naalaan yo na kayamanan iray Egipsio.
EXO_004_0001	Dayon si Moises nagsabat sa Ginoo , Pero abi kon ang mga Israelinhon indi magpati sa akon, kag indi magpamati sa akon ginasiling, kundi magsiling sila, Ang Ginoo wala magpakita sa imo, ano ang akon himuon?	Insan inmebat si Moises ed Katawan , Balet no ag ak bilang sisiaen na saray Israelita, tan ag da dengelen so ibagak, tan supyaten da ak a kuanda, Andi, ag pinmatnag ed sika so Katawan , antoy gawaen ko?
EXO_004_0002	Gani ang Ginoo nagpamangkot sa iya, Ano bala ang ginauyatan mo?	Say Katawan tinepet tod kinen Moises, Anto tay sankabembenan mo?
EXO_004_0003	Nagsabat sia, Isa ka sungkod.	Baston, ebat nen Moises.
EXO_004_0004	Ang Ginoo nagsiling, Ihaboy ina sa duta.	Ibontuk mod dalin, inkuay Katawan .
EXO_004_0005	Sang mahaboy na ini ni Moises sa duta, nahimo ini nga man-og, kag nagpalagyo si Moises gikan sini.	Imbontuk sirin nen Moises imay baston, et nagmaliw ya oleg, tan imbatikan to.
EXO_004_0006	Dayon ang Ginoo nagsiling kay Moises, Untaya ang imo kamot kag dakpa sa ikog.	Balet say Katawan inkuantod kinen Moises, Gawat mo tan egnaan mod ikul.
EXO_004_0007	Gani gin-untay ni Moises ang iya kamot kag gindakop ini kag nahimo ini liwat nga isa ka sungkod.	Ginawat sirin nen Moises imay oleg tan inegnaan to, et nagmaliw lamet a baston.
EXO_004_0008	Ang Ginoo nagsiling, Himua ini, agod nga magtuo sila nga ang Ginoo , ang Dios sang ila mga katigulangan, ang Dios ni Abraham, ang Dios ni Isaac, kag ang Dios ni Jacob, nagpakita sa imo.	Imbilin na Katawan ed kinen Moises, Gawam yan pakelaw a pamaneknek mod saray Israelita a say Katawan a Dios na samay lalaki ra, say Dios di Abraham, Isaac, tan Jacob, et pinmanengneng ed sika.
EXO_004_0009	Ang Ginoo naghambal liwat kay Moises, Ibutang ang imo kamot sa sulod sang imo bayu.	Say Katawan kuanto lamet ed kinen Moises, Isoksok moy limam ed dalem na kawes mo.
EXO_004_0010	Gintuman niya ini, kag sang pagwaon niya ang iya kamot, puno na ini sing aro kag nanginmaputi gid ini kaayo.	Insoksok nen Moises sirin so lima to, et nen inoyus to akating so lima to tan pinmoti a singa kinapoti na kapes.
EXO_004_0011	Dayon ang Ginoo nagsiling, Ibutang liwat ang imo kamot sa sulod sang imo bayu.	Inkuan na Katawan lamet ed sikato, Isoksok moy limam ed dalem na kawes mo.
EXO_004_0012	Gintuman niya ini, kag sang pagwaon niya ang iya kamot, nag-ayo na ini subong sang iban nga bahin sang iya lawas.	Insoksok toy lima to, et nen inoyus to malinis lamet a singa arum a parti na laman to.
EXO_004_0013	Ang Ginoo nagsiling, Kon indi sila magpati sa imo kag indi madala sa nahauna nga katingalahan nga buhat, magapati sila tungod sang ikaduha.	Inkuan na Katawan , No ag da ka sisiaen tan ag da italtalek so ononan pakelaw, nayarin manisia la ra no nanengneng day kumadwan pakelaw.
EXO_004_0014	Kon indi pa gid sila magpati sa sining duha ka mga katingalahan nga buhat, kag indi magpamati sa imo ginsiling, kuha ka sing tubig halin sa Suba sang Nilo kag ibubo mo sa mamala nga duta.	No ag da ka ni sisiaen ed sarayan duaran pakelaw tan ag da ni dengelen so ibabagam, mangala kay danum ed Ilog na Nilo, insan mo ikalbo ed amagan dalin, et magmaliw a dala.
EXO_004_0015	Ina nga tubig mahimo nga dugo.	Balet si Moises inkuanto, Katawan , gendat ya aliwa ak a marunong a mansalita, tan onya ak ni, anggaman ya akitongtong ka lad siak.
EXO_004_0016	Pero nagsiling si Moises sa Ginoo , Indi ako pag-ipadala, Ginoo .	Makapoy ak a mansalita tan ata-ata ak.
EXO_004_0017	Indi ako maayo nga manughambal, kag wala gid ako makaagi sa pagpamulongpulong halin sang una tubtob karon sang imo pagsugod hambal sa akon.	Inkuan na Katawan ed sikato, Siopay nanggawa na sangiy too?
EXO_004_0018	Indi ako maayo nga manughambal, kay nagautol-utol ako kon maghambal.	Siopay nanggagawa a telek tan omel so too?
EXO_004_0019	Ang Ginoo nagsiling sa iya, Sin-o bala ang naghimo sang baba sang tawo?	Siopay mangiiter na pakanengneng tan say pakabulag ed too?
EXO_004_0020	Sin-o bala naghimo sa iya nga bungol ukon apa?	Aliwa tan siak a Katawan ?
EXO_004_0021	Sin-o bala ang nagbuot nga makakita sia ukon mabulag?	Laka la sirin, tulongan ta kan mansalita, tan ibagak ed sika so salitaen mo.
EXO_004_0022	Ako, ang Ginoo !	Balet inmebat si Moises, Aliwan siak, Katawan, so ibakim.
EXO_004_0023	Karon lakat ka, kay ako ang magabulig sa imo sa paghambal, kag ako ang magatudlo sa imo kon ano ang imo ihambal!	Say sananey pa lan too.
EXO_004_0024	Pero nagsabat si Moises, Kon mahimo, O Ginoo , iban lang ang ipadala kag indi lang ako.	Lapud saya akapasnuk so Katawan ed kinen Moises tan kuanto, Anggapo tay kuyam a si Aaron a Levita?
EXO_004_0025	Tungod sini ang Ginoo naakig kay Moises kag nagsiling, Indi bala nga may utod ikaw nga si Aaron nga Levinhon?	Amtak a sikato et marunong a mansalita.
EXO_004_0026	Nahibal-an ko nga maayo sia maghambal.	Diad tuay tua, si Aaron et abeten to ka tan manliket ed pakanengneng tod sika.
EXO_004_0027	Kon sa bagay nagapalapit sia sa pagsugat sa imo, kag malipay sia sa pagpakigkita sa imo.	Mitongtong kad sikato tan ibagam so nepeg ton salitaen.
