id	source_text	target_text
GEN_031_0037	Si Laban nagsiling kay Jacob, Ngaa gindayaan mo ako kag gindala mo ang akon mga bata nga babayi pareho sang mga babayi nga nabihag sa inaway?	Ang ginawa mo'y isang kahangalan.
GEN_031_0038	Ngaa nga gindayaan mo ako kag naglakat ka nga wala gid magsiling sa akon?	Nasa aking kapangyarihan ang gawan kayo ng masama.
GEN_031_0039	Kon ginpahibalo mo ako, kuntani ginpalakat ko ikaw nga may kinasadya kag pagkinanta sa musika sang mga tambor kag mga arpa.	Ngunit ang Diyos ng inyong ama ay nagsalita sa akin kagabi, na sinasabi, Ingatan mong huwag kang magsalita kay Jacob ng mabuti o masama man.
GEN_031_0040	Wala mo gid ako pagpahaluka sa akon mga apo kag sa akon mga bata nga babayi sang paglakat nila.	Kahit kailangan mong umalis sapagkat nasasabik ka na sa bahay ng iyong ama, bakit mo ninakaw ang aking mga diyos?
GEN_031_0041	Daw ano nga binuang ang ginhimo mo!	At sumagot si Jacob kay Laban, Sapagkat ako'y natakot; iniisip ko na baka kunin mo nang sapilitan sa akin ang iyong mga anak.
GEN_031_0042	Makasarang ako sa paghalit sa imo, pero kagab-i ang Dios sang imo amay nagpaandam sa akon nga nagasiling, Indi mo pagpahugon si Jacob sa bisan ano nga paagi.	Ngunit kanino mo man matagpuan ang iyong mga diyos ay hindi mabubuhay.
GEN_031_0043	Nakahibalo ako nga nahidlaw ka na gid sa panimalay sang imo amay, amo ina nga naglakat ka, pero ngaa ginkawat mo ang akon mga diosdios?	Sa harapan ng ating mga kamag-anak, ituro mo kung anong iyo na nasa akin, at kunin mo iyon.
GEN_031_0044	Si Jacob nagsabat, Nahadlok ako, tungod kay naghunahuna ako nga bawion mo sa akon ang imo mga anak.	Hindi nalalaman ni Jacob na si Raquel ang nagnakaw noon.
GEN_031_0045	Pero kon makita mo sa bisan kay sin-o diri ang imo mga diosdios, pagapatyon sia.	Kaya pumasok si Laban sa tolda nina Jacob, Lea, at ng dalawang alilang babae, subalit hindi niya natagpuan.
GEN_031_0046	Sa atubang sang aton mga tinawo subong mga saksi, pangitaa ang mga butang nga imo kag kuhaa ini.	Lumabas siya sa tolda ni Lea at pumasok sa tolda ni Raquel.
GEN_031_0047	Si Jacob wala makahibalo nga ginkawat ni Raquel ang mga diosdios ni Laban.	Nakuha nga ni Raquel ang mga diyos ng sambahayan at inilagay ang mga ito sa mga dala-dalahan ng kamelyo at kanyang inupuan.
GEN_031_0048	Si Laban nagkadto sa tolda ni Jacob, sa tolda ni Lea, kag sa tolda sang duha ka suloguon nga babayi, pero wala niya makita ang iya mga diosdios.	Hinalughog ni Laban ang buong palibot ng tolda, ngunit hindi niya natagpuan.
GEN_031_0049	Dayon nagkadto sia sa tolda ni Raquel.	At sinabi ni Raquel sa kanyang ama, Huwag magalit ang aking panginoon na ako'y hindi makatayo sa harap mo; sapagkat dinatnan ako ngayon.
GEN_031_0050	Si Raquel nagkuha sang mga diosdios kag ginbutang niya sa siyasiya sang kamelyo kag ginpungkoan ini.	Kaya't kanyang hinanap, ngunit hindi natagpuan ang mga diyos ng sambahayan.
GEN_031_0051	Si Laban nag-usisa sang bug-os nga tolda, pero wala gid niya ini makita.	At si Jacob ay nagalit at nakipagtalo kay Laban.
GEN_031_0052	Si Raquel nagsiling sa iya amay, Tatay, indi ka lang magkaakig kon indi ako makatindog sa imo atubang, kay yari ang pamulanon ko.	Sinabi ni Jacob kay Laban, Ano ang aking paglabag at ang aking kasalanan, at habulin mo ako na may pag-iinit?
GEN_031_0053	Si Laban nagpangita sang iya mga diosdios, pero wala niya makita ini.	Kahit hinalughog mo ang lahat ng aking kasangkapan, anong natagpuan mong kasangkapan ng iyong bahay?
GEN_031_0054	Dayon si Jacob nanginit kag naghambal nga may kaakig kay Laban, Ano bala ang akon sala?	Ilagay mo rito sa harapan ng aking mga kamag-anak at ng iyong mga kamag-anak at hayaan mong magpasiya sila sa ating dalawa.
GEN_031_0055	Ano nga kasugoan ang akon ginlapas nga ginlagas mo ako nga may kaakig?	Ako'y kasama mo sa loob ng dalawampung taon; ang iyong mga babaing tupa at ang iyong mga babaing kambing ay hindi nakunan, at hindi ako kumain ng mga tupang lalaki ng iyong kawan.
GEN_031_0056	Karon nga nausisa mo ang tanan ko nga mga pagkabutang, ano bala nga pagkabutang ang nakita mo nga imo?	Ang nilapa ng mababangis na hayop ay hindi ko dinala sa iyo; ako mismo ang nagpasan ng pagkawala.
GEN_031_0057	Ibutang diri sa atubang sang imo kag sang akon mga tinawo kag sila ang pahukma kon sin-o sa aton ang matarong.	Sa aking kamay mo hiningi iyon, maging ninakaw sa araw o sa gabi.
GEN_031_0058	Sa sulod sang baynte ka tuig nga nag-estar ako sa imo, ang imo mga karnero kag mga kanding wala gid mahar-asi kag wala gid ako makaihaw sang imo karnero nga lalaki halin sa imo panong.	Naging ganoon ako; sa araw ay pinahihirapan ako ng init, at sa gabi ay ng lamig; at ako ay nalipasan na ng antok.
GEN_031_0059	Kon ang isa ka karnero mapatay sang talunon nga mga sapat wala ko ina ginaisip sa imo parti, kundi ginaisip ko ina nga akon parti.	Nitong dalawampung taon ay nakatira ako sa iyong bahay.
GEN_031_0060	Ang ginakawat sa adlaw ukon sa gab-i man ginapabayran mo sa akon.	Pinaglingkuran kita ng labing-apat na taon dahil sa iyong dalawang anak, at anim na taon dahil sa iyong kawan, at sampung ulit na binago mo ang aking sahod.
GEN_031_0061	Sa madamo nga tion nag-antos ako sang tagiti sang init kon adlaw kag sang katugnaw kon gab-i kag wala ako matulogi.	Kung ang Diyos ng aking ama, ang Diyos ni Abraham, at ang Kinatatakutan ni Isaac ay wala sa aking panig, tiyak na palalayasin mo ako ngayon na walang dala.
GEN_031_0062	Amo ini ang inagihan ko sa sulod sang baynte ka tuig sang akon pag-estar sa imo.	Nakita ng Diyos ang aking kapighatian, ang aking pagpapagod, at sinaway ka niya kagabi.
GEN_031_0063	Nagpangalagad ako sa imo sa sulod sang katorse ka tuig para sa duha mo ka mga anak nga babayi kag nag-alagad ako sing anom pa ka tuig para sa imo mga panong kag kapulo mo liwatliwaton ang akon suhol.	Sumagot si Laban kay Jacob, Ang mga anak na babae ay aking mga anak at ang mga anak ay mga anak ko, at ang mga kawan ay aking mga kawan at ang lahat ng iyong nakikita ay akin.
GEN_031_0064	Kon ang Dios sang akon mga ginikanan, ang Dios ni Abraham, ang Dios nga ginsimba ni Isaac wala mag-upod sa akon, kuntani ginpalakat mo na ako nga wala gid sing dala.	Subalit anong magagawa ko ngayon sa mga anak kong babae, o sa kanilang mga anak na ipinanganak nila?
GEN_031_0065	Pero ang Dios nakakita sang akon pagpangabudlay kag pag-antos, kag kagab-i ginsaway niya ikaw.	Halika ngayon, gumawa tayo ng isang tipan, ako at ikaw; at hayaang iyon ay maging saksi sa akin at sa iyo.
GEN_031_0066	Si Laban nagsabat kay Jacob, Ini nga mga babayi anak ko, ang ila mga kabataan akon, kag ini nga mga panong akon.	Kaya't kumuha si Jacob ng isang bato, at iyon ay itinayo bilang isang bantayog.
GEN_031_0067	Kon sa bagay, ang tanan nga ginatan-aw mo akon.	At sinabi ni Jacob sa kanyang mga kamag-anak, Magtipon kayo ng mga bato, at kumuha sila ng mga bato at kanilang ginawang isang bunton at sila'y nagkainan doon sa malapit sa bunton.
GEN_031_0068	Pero karon, ano ang mahimo ko sa akon mga anak kag sa ila mga kabataan?	Tinawag ito ni Laban na Jegarsahadutha, subalit tinawag ito ni Jacob na Gilead.
GEN_031_0069	Dali, mahimo kita sing kasugtanan, kag magtumpok kita sang mga bato sa pagpahanumdom sa aton sang aton kasugtanan.	Sinabi ni Laban, Ang buntong ito ay saksi sa akin at sa iyo ngayon.
GEN_031_0070	Gani si Jacob nagpatindog sang isa ka daku nga bato nga handumanan.	Kaya't tinawag niya ito sa pangalang Gilead; at ang bantayog ay Mizpa sapagkat sinabi niya, Bantayan ng Panginoon ako at ikaw, kapag tayo'y hindi magkasama sa isa't isa.
GEN_031_0071	Ginsugo niya ang iya mga tinawo sa pagtipon sang mga bato kag sa pagtumpok sini.	Kapag pinahirapan mo ang aking mga anak, o kung mag-asawa ka sa iba bukod sa aking mga anak, kahit wala tayong kasama, alalahanin mo, ang Diyos ay saksi sa akin at sa iyo.
GEN_031_0072	Dayon nagkaon sila sa tupad sang tinumpok nga bato.	At sinabi ni Laban kay Jacob, Tingnan mo ang buntong ito at ang haligi na aking inilagay sa gitna natin.
GEN_031_0073	Si Laban naghingalan sini Jegar-sahaduta, pero ginhingalanan ini ni Jacob Galeed.	Ang buntong ito ay isang saksi, at ang haligi ay isang saksi na hindi ako lalampas sa buntong patungo sa inyo, at hindi ka lalampas sa buntong ito at sa haligi patungo sa akin upang saktan ako.
GEN_031_0074	Si Laban nagsiling kay Jacob, Ining tinumpok nga bato magapahanumdom sa aton nga duha.	Nawa'y ang Diyos ni Abraham at ang Diyos ni Nahor, ang Diyos ng kanilang ama ang humatol sa atin.
GEN_031_0075	Amo ini ang kabangdanan kon ngaa ang lugar ginhingalanan Galeed.	At si Jacob ay sumumpa ng ayon sa Kinatatakutan ng kanyang amang si Isaac.
GEN_031_0076	Si Laban nagsiling man, Kabay nga ang Ginoo magbantay sa aton samtang nagahilayuay kita.	At naghandog si Jacob ng handog sa bundok, at tinawag ang kanyang mga kamag-anak upang kumain ng tinapay; at sila'y kumain ng tinapay, at nanatili sa bundok.
GEN_031_0077	Gani ang lugar ginhingalanan man Mispa.	Kinaumagahan, maagang bumangon si Laban, hinagkan ang kanyang mga anak na lalaki at babae, at binasbasan sila; at umalis siya at bumalik sa kanyang tahanan.
GEN_031_0078	Si Laban nagsiling pa gid, Kon pintasan mo ang akon mga anak nga babayi, ukon magpangasawa ka sang iban nga mga babayi, bisan nga indi ako makahibalo sini, dumdoma nga ang Dios nagatan-aw sa aton.	<MISSING TRANSLATION>
GEN_031_0079	Yari ang mga bato nga gintumpok ko sa tunga naton, kag yari ang bato nga handumanan.	<MISSING TRANSLATION>
GEN_031_0080	Ining tinumpok nga mga bato kag ining bato nga handumanan amo ang magapahanumdom sa aton.	<MISSING TRANSLATION>
GEN_031_0081	Indi ako maglabang sa sining tinumpok nga mga bato sa paggubat sa imo, kag indi ka maglabang sa sining bato nga handumanan sa paggubat sa akon.	<MISSING TRANSLATION>
GEN_031_0082	Ang Dios ni Abraham kag ang Dios ni Nahor magahukom sa tunga naton.	<MISSING TRANSLATION>
GEN_031_0083	Dayon si Jacob naghimo sang panaad sa ngalan sang Dios nga ginsimba sang iya amay nga si Isaac.	<MISSING TRANSLATION>
GEN_031_0084	Nag-ihaw sia sing isa ka sapat kag ginhalad niya ini sa bukid, kag gin-agda niya ang iya mga tinawo sa pagkaon.	<MISSING TRANSLATION>
GEN_031_0085	Sa tapos sila makakaon, nagtulog sila didto sa bukid.	<MISSING TRANSLATION>
GEN_031_0086	Aga pa gid sang madason nga adlaw, ginhalukan ni Laban ang iya mga apo kag mga anak nga babayi sa pagpaalam sa ila, kag naglakat sia pauli.	<MISSING TRANSLATION>
GEN_032_0001	Sang nagapadayon si Jacob sa iya dalanon, may mga anghel sang Dios nga nagsugata sa iya.	Nagpatuloy si Jacob sa kanyang paglakad, at sinalubong siya ng mga anghel ng Diyos.
GEN_032_0002	Sang pagkakita niya sa ila nagsiling sia, Kampo ini sang Dios.	Nang makita sila ni Jacob ay sinabi niya sa kanila, Ito'y kampo ng Diyos!
GEN_032_0003	Gani, ginhingalanan niya ang lugar nga Mahanaim.	Kaya't tinawag niya ang pangalan ng lugar na iyon na Mahanaim.
GEN_032_0004	Si Jacob nagpauna sing mga tawo sa pagpahibalo sa iya utod nga si Esau sa duta sang Seir nga sakop sang Edom.	Si Jacob ay nagpasugo kay Esau na kanyang kapatid sa lupain ng Seir, sa bayan ng Edom.
GEN_032_0005	Amo ini ang gintugon niya nga ihambal nila: Ako, si Jacob, ang imo matinumanon nga alagad, nagapanugid sa akon agalon nga si Esau, nga nag-estar ako upod kay Laban kag wala ako magpauli tubtob karon.	Sila'y kanyang inutusan na sinasabi, Ganito ang inyong sasabihin kay Esau na aking panginoon.
GEN_032_0006	May mga baka ako, mga asno, mga karnero, mga kanding kag mga ulipon.	Ganito ang sabi ng iyong lingkod na si Jacob, Ako'y tumigil ng ilang panahon kay Laban at namalagi roon hanggang ngayon.
GEN_032_0007	Nagapahibalo ako sa imo nga nagalaom nga magmaayo ka sa akon.	Mayroon akong mga baka, mga asno, mga kawan, at mga aliping lalaki at babae; at ako'y nagpasugo sa aking panginoon, upang ako'y makatagpo ng biyaya sa iyong paningin.
GEN_032_0008	Pagbalik sang mga ginsugo ni Jacob, nagsiling sila, Nagkadto kami sa imo utod nga si Esau, kag nagapadulong na sia sa pagsugata sa imo.	Ang mga sugo ay bumalik kay Jacob, na nagsasabi, Nakarating kami sa iyong kapatid na si Esau, at siya ay darating din upang sumalubong sa iyo, at kasama niya ang apatnaraang tao.
GEN_032_0009	May upod sia nga 400 ka mga tawo.	Kaya't natakot nang husto at nabahala si Jacob; at kanyang hinati sa dalawa ang mga taong kasama niya, ang mga kawan, ang mga bakahan, at ang mga kamelyo.
GEN_032_0010	Si Jacob hinadlukan gid kag indi mapahamtang.	At kanyang sinabi, Kung dumating si Esau sa isang pulutong at kanyang puksain ito, ang pulutong na natitira ay tatakas.
GEN_032_0011	Ginbahinbahin niya sa duha ka grupo ang mga tawo nga kaupod niya kag subong man ang iya mga karnero kag mga kanding, mga baka, kag mga kamelyo.	Sinabi ni Jacob, O Diyos ng aking amang si Abraham, at Diyos ng aking amang si Isaac, O Panginoon , na nagsabi sa akin, Bumalik ka sa iyong lupain at sa iyong kamag-anak at gagawa ako ng mabuti sa iyo.
GEN_032_0012	Naghunahuna sia sa iya kaugalingon, Kon si Esau mag-abot kag magsalakay sang nahauna nga grupo, ang ikaduha nga grupo makapalagyo.	Hindi ako karapat-dapat sa lahat ng kaawaan, at lahat ng katotohanan na iyong ginawa sa iyong lingkod sapagkat dumaan ako sa Jordang ito na dala ang aking tungkod, at ngayo'y naging dalawang pulutong ako.
GEN_032_0013	Dayon si Jacob nagpangamuyo, Dios sang akon lolo nga si Abraham, kag Dios sang akon amay nga si Isaac, pamatii ako!	Hinihiling ko sa iyo na iligtas mo ako sa kamay ng aking kapatid na si Esau.
GEN_032_0014	Nagsiling ka sa akon, O Ginoo , nga magbalik ako sa akon duta kag sa akon mga pariente, kag himuon mo nga ang tanan manginmaayo sa akon.	Ako'y natatakot sa kanya, baka siya'y dumating at kaming lahat ay pagpapatayin niya, ang mga ina pati ang mga anak.
GEN_032_0015	Indi ako takos sang tanan nga kaayo kag katutom nga imo ginpakita sa akon nga imo alagad.	Hindi ba't ikaw ang nagsabi, Gagawa ako ng mabuti sa iyo at ang iyong binhi ay gagawin kong parang buhangin sa dagat na hindi mabibilang dahil sa karamihan.
GEN_032_0016	Gintabok ko ang Jordan nga wala gid sing bisan ano, kundi baston gid lang, kag karon nagbalik ako nga may duha na ka mga grupo.	Siya'y namalagi roon nang gabing iyon, at kumuha siya ng panregalo mula sa kanya para sa kanyang kapatid na si Esau; dalawang daang kambing na babae, dalawampung lalaking kambing, dalawang daang tupang babae, at dalawampung tupang lalaki, tatlumpung kamelyong inahin, kasama ng kanilang mga anak, apatnapung baka, at sampung toro, dalawampung babaing asno at sampung lalaking asno.
GEN_032_0017	Ginapangamuyo ko, luwasa ako sa kamot sang akon utod nga si Esau.	Ang mga ito ay ibinigay niya sa kanyang mga alipin, ang bawat kawan ay nakabukod at sinabi niya sa kanyang mga alipin, Lumampas kayo sa aking unahan at lagyan ninyo ng pagitan ang bawat kawan.
GEN_032_0018	Nahadlok ako kay basi nagapadulong sia sa pagsalakay sa amon kag sa pagpamatay sa amon tanan, bisan pa sang mga babayi kag sang mga kabataan.	Iniutos niya sa una, Kapag ikaw ay natagpuan ni Esau na aking kapatid, at tanungin ka, Kanino ka?
GEN_032_0019	Dumdoma ang imo ginsaad, nga himuon mo ang tanan nga manginmaayo sa akon, kag magahatag ka sa akon sing mga kaliwat nga indi maisip.	Saan ka pupunta?
GEN_032_0020	Manginsubong sila kadamo sang balas sa baybayon.	At kanino itong nasa unahan mo?
GEN_032_0021	Sang makatener si Jacob didto sing isa ka gab-i, nagpili sia sa iya mga dala sing inugregalo sa iya utod nga si Esau: 200 ka babayi nga mga kanding kag baynte ka lalaki nga mga kanding, 200 ka babayi nga mga karnero kag baynte ka lalaki nga mga karnero, traynta ka gatasan nga mga kamelyo nga upod ang ila mga tinday, kwarenta ka mga baka nga babayi, napulo ka mga baka nga toro, baynte ka mga asna kag napulo ka mga asno.	Kung magkagayo'y sasabihin mo, Sa iyong lingkod na si Jacob.
GEN_032_0022	Ginbahinbahin niya ini sa mga panong kag gintugyan niya sa iya mga ulipon ang tagsa ka panong kag ginsingganan niya sila, Una kamo sa akon, kag butangi ninyo sing antad ang isa ka panong sa isa.	Ito ay isang regalo na padala para sa aking panginoong si Esau; at bukod dito, siya'y nasa hulihan namin.
GEN_032_0023	Ginmanduan niya ang nahauna nga ulipon, Kon ang akon utod nga si Esau magsugata sa imo kag magpamangkot, Sin-o ang imo agalon?	Gayundin, iniutos niya sa ikalawa, sa ikatlo, at sa lahat ng sumusunod sa mga kawan, na sinasabi, Sasabihin ninyo ang gayunding bagay kay Esau, kapag nakasalubong ninyo siya, at sasabihin ninyo, Bukod dito, ang iyong lingkod na si Jacob ay nasa hulihan namin.
GEN_032_0024	Diin ka makadto?	Sapagkat kanyang iniisip, Baka mapaglubag ko ang kanyang galit sa pamamagitan ng regalo na ipinauna ko, at pagkatapos ay makikita ko ang kanyang mukha, marahil ay tatanggapin niya ako.
GEN_032_0025	Sin-o ang tag-iya sining mga hayop nga ginadala mo?	Kaya't ang regalo ay ipinadala na nauna sa kanya; at siya'y nanatili sa kampo nang gabing iyon.
GEN_032_0026	Magsabat ka, Iya ini sang imo alagad nga si Jacob.	Nang gabing iyon, siya'y bumangon at isinama niya ang kanyang dalawang asawa, ang kanyang dalawang aliping babae, at ang kanyang labing-isang anak at tumawid sa tawiran ng Jaboc.
GEN_032_0027	Ginapadala niya ini nga regalo sa iya agalon nga si Esau.	Sila'y kanyang isinama at itinawid sa batis, at kanya ring itinawid ang lahat ng kanyang ari-arian.
GEN_032_0028	Si Jacob yara sa ulihi namon.	Naiwang nag-iisa si Jacob at nakipagbuno sa kanya ang isang lalaki hanggang sa magbukang-liwayway.
GEN_032_0029	Amo man ini ang ginsiling niya sa ikaduha, sa ikatlo, kag sa tanan nga nagasunod sa mga kasapatan: Amo ini ang inyo isiling kay Esau kon masugata ninyo sia, Si Jacob nga imo alagad yara sa ulihi namon.	Nang makita ng lalaki na hindi siya manalo laban kay Jacob, hinawakan niya ang kasu-kasuan ng hita ni Jacob, at ang kasu-kasuan ni Jacob ay nalinsad samantalang nakikipagbuno sa kanya.
GEN_032_0030	Si Jacob naghunahuna sa iya kaugalingon, Palugpayan ko sia sang mga regalo nga akon ginapauna, kag kon magkitaay kami, ayhan patawaron niya ako.	Sinabi niya, Bitawan mo ako, sapagkat nagbubukang-liwayway na.
GEN_032_0031	Pinauna niya ang mga regalo, kag nagpabilin sia sadtong gab-i sa kampo.	At sinabi ni Jacob, Hindi kita bibitawan malibang ako ay mabasbasan mo.
GEN_032_0032	Sadto nga gab-i nagbangon si Jacob, gindala niya ang duha niya ka mga asawa, ang iya duha ka mga babayi, ang iya onse ka mga kabataan, kag nagtabok sa Suba sang Jaboc.	Sinabi ng lalaki kay Jacob, Ano ang pangalan mo?
GEN_032_0033	Sang mapatabok na niya sila, ginpatabok man niya ang tanan niya nga mga pagkabutang.	At kanyang sinabi, Jacob.
GEN_032_0034	Pero, nabilin sia nga isahanon lang.	Sinabi niya, Ang iyong pangalan ay hindi na tatawaging Jacob, kundi Israel; sapagkat ikaw ay nakipaglaban sa Diyos at sa mga tao, at ikaw ay nagtagumpay.
GEN_032_0035	Dayon may isa ka tawo nga nag-abot kag nagdumog sa iya tubtob sa kaagahon.	Siya'y tinanong ni Jacob, Hinihiling ko sa iyo na sabihin mo sa akin ang iyong pangalan.
GEN_032_0036	Sang nabatyagan sang tawo nga indi sia makadaog kay Jacob, ginhampak niya si Jacob sa lutalutahan sang iya balikawang, kag nagliw-as ini.	At kanyang sinabi, Bakit itinatanong mo ang aking pangalan?
GEN_032_0037	Ang tawo nagsiling, Buy-i na ako, kay nagapamanagbanag na.	At siya'y binasbasan doon.
GEN_032_0038	Pero si Jacob nagsabat, Indi ko ikaw pagbuy-an kon indi mo ako pagbendisyunan.	Tinawag ni Jacob ang pangalan ng lugar na iyon na Peniel na sinasabi, Sapagkat nakita ko ang Diyos sa harapan, at naligtas ang aking buhay.
GEN_032_0039	Ang tawo nagpamangkot, Ano ang ngalan mo?	Sinikatan siya ng araw nang siya'y dumaraan sa Penuel; at siya'y papilay-pilay dahil sa kanyang hita.
GEN_032_0040	Nagsabat sia, Si Jacob.	Dahil dito, hanggang ngayon ay hindi kumakain ang mga anak ni Israel ng litid ng balakang na nasa kasu-kasuan ng hita, sapagkat dito hinampas ng taong nakipagbuno ang kasu-kasuan ng hita ni Jacob, sa litid ng balakang.
GEN_032_0041	Ang tawo nagsiling, Indi ka na pagtawgon nga Jacob.	<MISSING TRANSLATION>
GEN_032_0042	Nagpakigdumog ka sa Dios kag sa mga tawo kag nagdaog ka, gani pagatawgon ka nga Israel.	<MISSING TRANSLATION>
GEN_032_0043	Si Jacob nagsiling, Kon mahimo sugiri ako sang imo ngalan.	<MISSING TRANSLATION>
GEN_032_0044	Pero nagsabat sia, Ngaa ginapamangkot mo ang akon ngalan?	<MISSING TRANSLATION>
GEN_032_0045	Dayon ginbendisyunan niya si Jacob.	<MISSING TRANSLATION>
GEN_032_0046	Si Jacob nagsiling, Nag-atubangay kami sang Dios, kag karon buhi pa gihapon ako.	<MISSING TRANSLATION>
GEN_032_0047	Gani ginhingalanan niya ang lugar Peniel.	<MISSING TRANSLATION>
GEN_032_0048	Nagabutlak na ang adlaw sang paghalin ni Jacob sa Peniel, kag nagapiangpiang sia tungod sang iya lutalutahan.	<MISSING TRANSLATION>
GEN_032_0049	Amo ini ang kabangdanan kon ngaa tubtob karon ang mga Israelinhon wala nagakaon sang unod sa lutalutahan sang balikawang tungod kay ginhampak si Jacob sa sini nga bahin.	<MISSING TRANSLATION>
GEN_033_0001	Nakita ni Jacob nga si Esau nagapadulong upod sa iya 400 ka mga tinawo, gani ginpartida niya ang iya mga kabataan kay Lea, kay Raquel, kag sa duha niya ka mga babayi.	Tumanaw si Jacob at nakita niyang si Esau ay dumarating na may kasamang apatnaraang katao.
GEN_033_0002	Ginpauna niya ang duha niya ka mga babayi kag ang ila mga kabataan, madason si Lea kag ang iya mga kabataan, kag si Raquel kag si Jose sa ulihi.	Kaya't kanyang pinaghiwalay ang mga bata kina Lea at Raquel, at sa dalawang aliping babae.
GEN_033_0003	Si Jacob nag-una sa ila kag nagsaludo sia sing makapito nga ang iya guya nagaduot sa duta samtang nagapalapit sia sa iya utod.	Inilagay niya ang mga alipin na kasama ng kanilang mga anak sa unahan, at si Lea na kasama ng kanyang mga anak bilang pangalawa, at sina Raquel at Jose na pinakahuli.
GEN_033_0004	Pero si Esau nagdalagan sa pagsugata sa iya, kag naghakos kag naghalok sa iya.	At siya naman ay lumampas sa unahan nila, at pitong ulit na yumuko sa lupa hanggang sa siya ay mapalapit sa kanyang kapatid.
GEN_033_0005	Naghibi sila nga duha.	At tumakbo si Esau upang salubungin siya, niyakap siya, niyapos siya sa leeg, hinagkan at sila ay nag-iyakan.
GEN_033_0006	Sang pagpanghulonghulong ni Esau nakita niya ang mga babayi kag mga kabataan, gani nagpamangkot sia, Sin-o ining mga kaupod mo?	Nang itaas ni Esau ang kanyang paningin, at nakita ang mga babae at ang mga bata, ay kanyang sinabi, Sino itong mga kasama mo?
GEN_033_0007	Si Jacob nagsabat, Manong, amo ini ang mga kabataan nga tungod sa kaayo sang Dios ginhatag niya sa akon.	At kanyang sinabi, Ang mga anak na ipinagkaloob ng Diyos sa iyong lingkod.
GEN_033_0008	Dayon nagpalapit ang iya mga babayi upod sa ila mga kabataan kag nagsaludo.	Nang magkagayo'y lumapit ang mga aliping babae at ang kanilang mga anak, at nagsiyuko.
GEN_033_0009	Ang madason nga nagpalapit amo si Lea kag ang iya mga kabataan, kag sa ulihi si Jose kag si Raquel nagpalapit kag nagsaludo man.	Lumapit din si Lea at ang kanyang mga anak, at nagsiyuko, pagkatapos ay nagsilapit sina Jose at Raquel, at nagsiyuko.
GEN_033_0010	Si Esau nagpamangkot, Ano yadtong isa ka grupo nga nasugata ko?	Sinabi ni Esau, Ano ang kahulugan ng lahat na ito na nasalubong ko?
GEN_033_0011	Para bala sa ano yadto?	At sumagot si Jacob, Upang makakita ng biyaya sa paningin ng aking panginoon.
GEN_033_0012	Si Jacob nagsabat, Para yadto sa imo agod magmaayo ka sa akon.	Subalit sinabi ni Esau, Sapat na ang nasa akin, kapatid ko.
GEN_033_0013	Pero si Esau nagsabat, Madamo na ang akon pagkabutang, utod ko, imo na lang ina.	Ang nasa iyo ay sa iyo na.
GEN_033_0014	Si Jacob nagsiling, Sigi na, kon wala na gid ikaw sing kaakig sa akon batuna man ang ginaregalo ko sa imo.	Sinabi sa kanya ni Jacob, Hindi, nakikiusap ako sa iyo, na kung ngayo'y nakatagpo ako ng biyaya sa iyong paningin, ay tanggapin mo nga ang aking kaloob mula sa aking kamay; sapagkat nakita ko ang iyong mukha, na gaya ng nakakita ng mukha ng Diyos, at ikaw ay nalugod sa akin.
GEN_033_0015	Karon nga maayo ka gid sa akon, pareho lang nga nagatulok ako sa nawong sang Dios sa akon pagtulok sa imo nawong.	Nakikiusap ako sa iyo, tanggapin mo ang kaloob na dala ko sa iyo sapagkat lubos na ang ipinagkaloob sa akin ng Diyos, at mayroon ako ng lahat na kailangan ko.
GEN_033_0016	Batuna man ining regalo nga akon gindala para sa imo.	Kaya't hinimok ni Jacob si Esau at kanyang tinanggap.
GEN_033_0017	Ang Dios maalwan gid sa akon kag ginhatagan niya ako sang tanan ko nga kinahanglanon.	Sinabi niya, Tayo'y humayo at maglakbay at ako'y sasama sa iyo.
GEN_033_0018	Ginpilit gid niya si Esau tubtob ginbaton na lang niya ini.	Subalit sinabi ni Jacob sa kanya, Nalalaman ng aking panginoon na ang mga bata ay mahihina pa at mayroon sa mga kawan at mga baka na nagpapasuso; kapag sila'y pinagmadali nila sa isang araw lamang ay mamamatay ang lahat ng kawan.
GEN_033_0019	Si Esau nagsiling, Maghanda na kita kag maglakat.	Magpauna na ang aking panginoon sa kanyang lingkod at ako'y magpapatuloy na dahan-dahan, ayon sa hakbang ng mga hayop na nasa aking unahan, at sa hakbang ng mga bata, hanggang sa makarating ako sa aking panginoon sa Seir.
GEN_033_0020	Magauna lang ako sa imo.	Kaya't sinabi ni Esau, Pahintulutan mong iwan ko sa iyo ang ilan sa mga taong kasama ko.
GEN_033_0021	Si Jacob nagsabat, Nakahibalo ka nga ang kabataan maluya pa, kag ang mga karnero kag ang mga baka may mga tinday nga akon atipanon.	Kanyang sinabi, Bakit kailangan pa?
GEN_033_0022	Kon patam-an sila sing lakat, bisan isa lang ka adlaw, ang bug-os nga kasapatan magkalamatay.	Sapat na ang makakita ako ng biyaya sa paningin ng aking panginoon.
GEN_033_0023	Kon mahimo, una ka lang sa akon, kag masunod ako sa imo sing hinayhinay lang suno sa kadasigon sang kasapatan kag kabataan tubtob malambot ko ikaw sa Edom.	Kaya't nagbalik si Esau nang araw ding iyon sa kanyang lakad patungo sa Seir.
GEN_033_0024	Si Esau nagsiling, Ti, kon luyag mo, ibilin ko lang ang iban ko nga mga tinawo sa imo.	Si Jacob ay naglakbay sa Sucot, at nagtayo ng isang bahay para sa kanya, at iginawa niya ng mga balag ang kanyang hayop.
