id	source_text	target_text
GEN_031_0085	Sa tapos sila makakaon, nagtulog sila didto sa bukid.	Nia ray baton imbunton ko ed nanleetan ta, tan niay baton pakanudnunotan.
GEN_031_0086	Aga pa gid sang madason nga adlaw, ginhalukan ni Laban ang iya mga apo kag mga anak nga babayi sa pagpaalam sa ila, kag naglakat sia pauli.	Sayan bunton na bato tan sayan baton pakanudnunotan et sikaray manangipanunot.
GEN_032_0001	Sang nagapadayon si Jacob sa iya dalanon, may mga anghel sang Dios nga nagsugata sa iya.	Intuloy nen Jacob so pankukurang to.
GEN_032_0002	Sang pagkakita niya sa ila nagsiling sia, Kampo ini sang Dios.	Inabet na pigaran anghil.
GEN_032_0003	Gani, ginhingalanan niya ang lugar nga Mahanaim.	Nen anengneng to ra, inkuanto, Kampo ya na Dios; kanyan inngaran to man a pasen na Mahanaim.
GEN_032_0004	Si Jacob nagpauna sing mga tawo sa pagpahibalo sa iya utod nga si Esau sa duta sang Seir nga sakop sang Edom.	Angibakiy Jacob na totoo to ed kinen agi ton Esau diad dalin na Edom.
GEN_032_0005	Amo ini ang gintugon niya nga ihambal nila: Ako, si Jacob, ang imo matinumanon nga alagad, nagapanugid sa akon agalon nga si Esau, nga nag-estar ako upod kay Laban kag wala ako magpauli tubtob karon.	Imbilin tod sikaran onyay ibaga ra: Siak a si Jacob, say mapaabeban aripen mo, ipapakabat kod sika Esau, ya abayag ak a nanayam ed kindi pangamaen tan Laban tan natan ak labat ompawil.
GEN_032_0006	May mga baka ako, mga asno, mga karnero, mga kanding kag mga ulipon.	Wala ray bakak, asno, kanding, karniro, tan aripen ko.
GEN_032_0007	Nagapahibalo ako sa imo nga nagalaom nga magmaayo ka sa akon.	Imbakik ed sika ra yan totoo, ta labay koy mipulangan ed sika.
GEN_032_0008	Pagbalik sang mga ginsugo ni Jacob, nagsiling sila, Nagkadto kami sa imo utod nga si Esau, kag nagapadulong na sia sa pagsugata sa imo.	Nen pinmawil ed kinen Jacob ira may imbaki to, inkuanda, Linma kamid kinen agim ya Esau, tan wala lad dalan a mangabet ed sika.
GEN_032_0009	May upod sia nga 400 ka mga tawo.	Kaiba toy apat a lasus a lalaki.
GEN_032_0010	Si Jacob hinadlukan gid kag indi mapahamtang.	Ataktakot tan agunigon si Jacob.
GEN_032_0011	Ginbahinbahin niya sa duha ka grupo ang mga tawo nga kaupod niya kag subong man ang iya mga karnero kag mga kanding, mga baka, kag mga kamelyo.	Impankadwa to ray totoon kaiba to, saray karniro, kanding, baka, tan saray kamilyo.
GEN_032_0012	Naghunahuna sia sa iya kaugalingon, Kon si Esau mag-abot kag magsalakay sang nahauna nga grupo, ang ikaduha nga grupo makapalagyo.	Inkuantod sikaton dili, No dogpaan toy onaan ya olup, nayarin makabatik so walad onur ya olup.
GEN_032_0013	Dayon si Jacob nagpangamuyo, Dios sang akon lolo nga si Abraham, kag Dios sang akon amay nga si Isaac, pamatii ako!	Insan nampikasiy Jacob, Dios nen lakik ya Abraham tan Dios nen amak ya Isaac, dengel mo ak pa!
GEN_032_0014	Nagsiling ka sa akon, O Ginoo , nga magbalik ako sa akon duta kag sa akon mga pariente, kag himuon mo nga ang tanan manginmaayo sa akon.	Imbagam ed siak, Katawan , ya ompawil ak ed dalin ko tan saray kakanayon ko, tan ag mo ak paolyan pian maung so pansumpalan ko.
GEN_032_0015	Indi ako takos sang tanan nga kaayo kag katutom nga imo ginpakita sa akon nga imo alagad.	O matoor a Katawan , ag ak manepeg a mangawat na panangarom tan panangasim ya impatnag mod siak a mapaabeban aripen mo.
GEN_032_0016	Gintabok ko ang Jordan nga wala gid sing bisan ano, kundi baston gid lang, kag karon nagbalik ako nga may duha na ka mga grupo.	Binaliw koy Jordan ya anggapoy awit ko no ag say baston labat, balet natan pinmawil ak a kaibak ira yan duaran olup.
GEN_032_0017	Ginapangamuyo ko, luwasa ako sa kamot sang akon utod nga si Esau.	Kerewen kod sika ya iyagel mo ak ed kinen Esau.
GEN_032_0018	Nahadlok ako kay basi nagapadulong sia sa pagsalakay sa amon kag sa pagpamatay sa amon tanan, bisan pa sang mga babayi kag sang mga kabataan.	Antakot ak ta ompan onla dian ondogpad sikami et pateyen to kamin amin, pati saray bibii tan saray ogogaw.
GEN_032_0019	Dumdoma ang imo ginsaad, nga himuon mo ang tanan nga manginmaayo sa akon, kag magahatag ka sa akon sing mga kaliwat nga indi maisip.	Ag mo pa lilingwanan ya insipan mon ag mo ak paolyan pian maung so pansumpalan ko; insipan mo met ya itdan mo ak na saray kabyangay boleg ko a diad kinarakel da et ag ira nabilang, ta singa kinarakel na buer ed gilig na dayat so bilang da.
GEN_032_0020	Manginsubong sila kadamo sang balas sa baybayon.	Kasumpal na impamalabas day labid man, nampiliy Jacob ed saray ayayep to na irigalo tod kinen Esau: duan lasus a kabatyan a kanding tan duamplon kanding a kalakyan, duan lasus a kabatyan a karniro tan duamplon karniron kalakyan, talomplon kamilyon mampapasuso tan saray kilaw da, apataplon kabatyan a baka tan samploran bakan kalakyan, duamplon kabatyan ya asno tan samploran asno a kalakyan.
GEN_032_0021	Sang makatener si Jacob didto sing isa ka gab-i, nagpili sia sa iya mga dala sing inugregalo sa iya utod nga si Esau: 200 ka babayi nga mga kanding kag baynte ka lalaki nga mga kanding, 200 ka babayi nga mga karnero kag baynte ka lalaki nga mga karnero, traynta ka gatasan nga mga kamelyo nga upod ang ila mga tinday, kwarenta ka mga baka nga babayi, napulo ka mga baka nga toro, baynte ka mga asna kag napulo ka mga asno.	Impansisian to rad pigaran grupo tan impaasikaso tod sakey ya aripen to so balang grupo.
GEN_032_0022	Ginbahinbahin niya ini sa mga panong kag gintugyan niya sa iya mga ulipon ang tagsa ka panong kag ginsingganan niya sila, Una kamo sa akon, kag butangi ninyo sing antad ang isa ka panong sa isa.	Inkuantod sikara, Onona kayo, balet panaarawian yoy balang sakey a grupo.
GEN_032_0023	Ginmanduan niya ang nahauna nga ulipon, Kon ang akon utod nga si Esau magsugata sa imo kag magpamangkot, Sin-o ang imo agalon?	Imbilin tod walad onaan ya aripen, No naabet moy Esau a kuyak tan tepeten to, Siopay amom?
GEN_032_0024	Diin ka makadto?	Iner so laen mo?
GEN_032_0025	Sin-o ang tag-iya sining mga hayop nga ginadala mo?	Siopay akankien ed saray ayayep a walad onaan mo?
GEN_032_0026	Magsabat ka, Iya ini sang imo alagad nga si Jacob.	onyay iyebat mo, Kien ira nen aripen mon Jacob.
GEN_032_0027	Ginapadala niya ini nga regalo sa iya agalon nga si Esau.	Ipapayakar to ran rigalo ed kuya ton Esau.
GEN_032_0028	Si Jacob yara sa ulihi namon.	Onya met so imbilin tod kumadwan aripen, say kumatlo, tan amin da ni ray arum a managasikasoy ayayep: Onyay ibaga yod kinen Esau no naabet yo On, say aripen yon Jacob et wadtad bandad onur.
GEN_032_0029	Amo man ini ang ginsiling niya sa ikaduha, sa ikatlo, kag sa tanan nga nagasunod sa mga kasapatan: Amo ini ang inyo isiling kay Esau kon masugata ninyo sia, Si Jacob nga imo alagad yara sa ulihi namon.	Inisip nen Jacob a diad pangiter to na rigalo napakepa toy pasnuk nen Esau, tan no naabet to, pirdonaen da.
GEN_032_0030	Si Jacob naghunahuna sa iya kaugalingon, Palugpayan ko sia sang mga regalo nga akon ginapauna, kag kon magkitaay kami, ayhan patawaron niya ako.	Impaiyona to la ra may rigalo to, tan naogip nid kampo to diad saman a labi.
GEN_032_0031	Pinauna niya ang mga regalo, kag nagpabilin sia sadtong gab-i sa kampo.	Diad saman lamlamang a labi, binmangon si Jacob, intagar to ra may duaran asawa to, saramay duaran inamung ton aripen a bibii, tan saramay labinsakey ya anak to, insan da binaliw so Ilog na Jabok.
GEN_032_0032	Sadto nga gab-i nagbangon si Jacob, gindala niya ang duha niya ka mga asawa, ang iya duha ka mga babayi, ang iya onse ka mga kabataan, kag nagtabok sa Suba sang Jaboc.	Kasumpal to ran pinabaliw, impaibaliw to met iray amin a kayaryan to, balet tinmilak a bukbukor to.
GEN_032_0033	Sang mapatabok na niya sila, ginpatabok man niya ang tanan niya nga mga pagkabutang.	Insan sinmabiy sakey a too tan akibalsakan ed kinen Jacob ya anggad palbangon.
GEN_032_0034	Pero, nabilin sia nga isahanon lang.	Nen alikas na samay too ya ag manalo, pinoniti tod tapi si Jacob, et apiley.
GEN_032_0035	Dayon may isa ka tawo nga nag-abot kag nagdumog sa iya tubtob sa kaagahon.	Inkuanto may too, Paonlam ak la, ta asingger lay kabwasan.
GEN_032_0036	Sang nabatyagan sang tawo nga indi sia makadaog kay Jacob, ginhampak niya si Jacob sa lutalutahan sang iya balikawang, kag nagliw-as ini.	Andi, no ag mo ak ni bindisionan, ebat nen Jacob.
GEN_032_0037	Ang tawo nagsiling, Buy-i na ako, kay nagapamanagbanag na.	Antoy ngaran mo?
GEN_032_0038	Pero si Jacob nagsabat, Indi ko ikaw pagbuy-an kon indi mo ako pagbendisyunan.	tepet na samay too.
GEN_032_0039	Ang tawo nagpamangkot, Ano ang ngalan mo?	Jacob, ebat to.
GEN_032_0040	Nagsabat sia, Si Jacob.	Inkuanto may too, Aliwa lan Jacob so ngaran mo.
GEN_032_0041	Ang tawo nagsiling, Indi ka na pagtawgon nga Jacob.	Akibalsakan kad Dios tan saray totoo, et analo ka; kanyan Israel la so ngaran mo.
GEN_032_0042	Nagpakigdumog ka sa Dios kag sa mga tawo kag nagdaog ka, gani pagatawgon ka nga Israel.	Inkuanen Jacob, Ibagam met sirin so ngaran mo.
GEN_032_0043	Si Jacob nagsiling, Kon mahimo sugiri ako sang imo ngalan.	Balet inmebat, Akin et labay mo nin naamtaan so ngaran ko?
GEN_032_0044	Pero nagsabat sia, Ngaa ginapamangkot mo ang akon ngalan?	Binindisionan tod satan si Jacob.
GEN_032_0045	Dayon ginbendisyunan niya si Jacob.	Inkuanen Jacob, Anengneng koy Dios ed lupa-lupaan, et mabilay ak ni; kanyan inngaran toy Peniel iman a pasen.
GEN_032_0046	Si Jacob nagsiling, Nag-atubangay kami sang Dios, kag karon buhi pa gihapon ako.	Pinmaway lay agew nen ontataynan lay Jacob manlapud Peniel; mankitley lapud samay tapi to.
GEN_032_0047	Gani ginhingalanan niya ang lugar Peniel.	Anggad natan, ag mangakan iray kabyangay boleg nen Israel na laman na tapi, ta diad sayan laman so aponiti ed kinen Jacob.
GEN_033_0001	Nakita ni Jacob nga si Esau nagapadulong upod sa iya 400 ka mga tinawo, gani ginpartida niya ang iya mga kabataan kay Lea, kay Raquel, kag sa duha niya ka mga babayi.	Anengneng nen Jacob si Esau a nitan lan kaiba to ray apat a lasus a totoo to, kanyan inapag to ray ogogaw ed kindi Lea, Raquel, tan saramay duaran bibiin aripen to.
GEN_033_0002	Ginpauna niya ang duha niya ka mga babayi kag ang ila mga kabataan, madason si Lea kag ang iya mga kabataan, kag si Raquel kag si Jose sa ulihi.	Walad onaan ira may aripen tan saray anak da, insan mantombuk si Lea tan saray anak to, tan diad onur si Raquel tan si Jose.
GEN_033_0003	Si Jacob nag-una sa ila kag nagsaludo sia sing makapito nga ang iya guya nagaduot sa duta samtang nagapalapit sia sa iya utod.	Inmonay Jacob ed sikaran amin tan nandakmomon amimpito legan ya onaasingger ed kinen agi to.
GEN_033_0004	Pero si Esau nagdalagan sa pagsugata sa iya, kag naghakos kag naghalok sa iya.	Balet binatik nen Esau ya inabet, nilakap to, insan to inanguban.
GEN_033_0005	Naghibi sila nga duha.	Manakis iran dua.
GEN_033_0006	Sang pagpanghulonghulong ni Esau nakita niya ang mga babayi kag mga kabataan, gani nagpamangkot sia, Sin-o ining mga kaupod mo?	Nen anengneng nen Esau ira may bibii tan saramay ogogaw, tinepet to, Siopa ra yay kaibam?
GEN_033_0007	Si Jacob nagsabat, Manong, amo ini ang mga kabataan nga tungod sa kaayo sang Dios ginhatag niya sa akon.	Inmebat si Jacob, Sikara yay ogogaw ya inter na Dios ed siak lapud panangaro to.
GEN_033_0008	Dayon nagpalapit ang iya mga babayi upod sa ila mga kabataan kag nagsaludo.	Inmasingger ira may aripen tan saramay anak da tan dinmakmomo ran angigalang; sinmoblay si Lea tan saramay anak to, tan say kaonuran si Jose tan si Raquel.
GEN_033_0009	Ang madason nga nagpalapit amo si Lea kag ang iya mga kabataan, kag sa ulihi si Jose kag si Raquel nagpalapit kag nagsaludo man.	Tinepet nen Esau, Antoy kabaliksan da ra may onaan a nabet ko?
GEN_033_0010	Si Esau nagpamangkot, Ano yadtong isa ka grupo nga nasugata ko?	Inmebat si Jacob, Rigalok ira man ed sika, ta labay koy mipulangan ed sika.
GEN_033_0011	Para bala sa ano yadto?	Balet inkuanen Esau, Malaem la ray kayaryan ko, agi; kien mo la ray kayaryan mo.
GEN_033_0012	Si Jacob nagsabat, Para yadto sa imo agod magmaayo ka sa akon.	Inkuanen Jacob, Andi komun.
GEN_033_0013	Pero si Esau nagsabat, Madamo na ang akon pagkabutang, utod ko, imo na lang ina.	No talagan pirdonaen mo ak, awat moy panangarok.
GEN_033_0014	Si Jacob nagsiling, Sigi na, kon wala na gid ikaw sing kaakig sa akon batuna man ang ginaregalo ko sa imo.	Say pakanengneng kod lupam et singa pakanengneng kod lupa na Dios, natan ta maung so impatnag mod siak.
GEN_033_0015	Karon nga maayo ka gid sa akon, pareho lang nga nagatulok ako sa nawong sang Dios sa akon pagtulok sa imo nawong.	Awat mo kariy panangarok ya awit kon para sika, kinasian ak na Dios, ta inter ton amin iray nakaukolan ko.
GEN_033_0016	Batuna man ining regalo nga akon gindala para sa imo.	Ag to tinondaan ya anggad inawat nen Esau ira may rigalo.
GEN_033_0017	Ang Dios maalwan gid sa akon kag ginhatagan niya ako sang tanan ko nga kinahanglanon.	Inkuanen Esau, Onla itayo la.
GEN_033_0018	Ginpilit gid niya si Esau tubtob ginbaton na lang niya ini.	Siak so onona.
GEN_033_0019	Si Esau nagsiling, Maghanda na kita kag maglakat.	Inmebat si Jacob, Naksawan tan makapoy la ra yay ogogaw, insan sakey ni, nakaukolan ya asikasoen ko ra yay karniro tan baka tan saray kilaw da.
GEN_033_0020	Magauna lang ako sa imo.	No dagdagen iran manakar a masiglat ed sanagew labat, ompatey iran amin.
GEN_033_0021	Si Jacob nagsabat, Nakahibalo ka nga ang kabataan maluya pa, kag ang mga karnero kag ang mga baka may mga tinday nga akon atipanon.	Onona ka la, ta ontombuk ak lan mantantan.
GEN_033_0022	Kon patam-an sila sing lakat, bisan isa lang ka adlaw, ang bug-os nga kasapatan magkalamatay.	Manakar kami, onung na anggaay nayarian na saray ayayep tan saray ogogaw, anggad naabot ta kad Edom.
GEN_033_0023	Kon mahimo, una ka lang sa akon, kag masunod ako sa imo sing hinayhinay lang suno sa kadasigon sang kasapatan kag kabataan tubtob malambot ko ikaw sa Edom.	Inkuanen Esau, No ontan sirin, mangitilak ak ed sika na pigaran totook.
GEN_033_0024	Si Esau nagsiling, Ti, kon luyag mo, ibilin ko lang ang iban ko nga mga tinawo sa imo.	Balet inkuanen Jacob, Andi-bali la tan; masarag lay impamirdonam ed siak.
GEN_033_0025	Pero si Jacob nagsabat, Indi na ina kinahanglan.	Kanyan diad saman ya agew, amaarap lad Edom si Esau.
GEN_033_0026	Ang akon lang luyag amo nga magmaayo ka sa akon.	Si Jacob balet linmad Sukot tan diman angipaalagey na dilin abung to tan saray salimbengan na ayayep to.
GEN_033_0027	Gani sadto nga adlaw nagbalik si Esau sa Edom.	Kanyan atawag na Sukot iman a pasen.
GEN_033_0028	Pero si Jacob naglakat padulong sa Sucot, sa diin nagpatindog sia sang iya balay kag sing mga palasilungan sang iya mga kasapatan.	Nen ompawil si Jacob a manlapud Mesopotamia, maliket ya akasabid Sikem diad sakop na Canaan, tan nankampod sakey ya alog ya asingger ed siudad.
GEN_033_0029	Amo ina nga ang lugar ginhingalanan Sucot.	Sinaliw to man a parti na alog ed saray kabyangay boleg nen Hamor ya ama nen Sikem; sanlasus a kuartan pilak so imbayar to.
GEN_033_0030	Si Jacob nag-abot nga wala man maano sa siudad sang Siquem sa duta sang Canaan, sang iya pagbalik halin sa Mesopotamia.	Nanggawad may sakey ya altar tan nginaranan to para El, say Dios na Israel.
GEN_034_0001	Karon si Dina nga anak nga babayi ni Jacob kag ni Lea naggwa sa pagduaw sang mga babayi nga taga-Canaan.	Aminsan ya agew, si Dina a biin anak nen Jacob tan Lea et linman dinmalaw ed pigaran bibiid Canaan.
GEN_034_0002	Sang pagkakita ni Siquem kay Dina, gindakop niya sia kag ginlugos.	Nen anengneng nen Sikem a lakin anak nen Hamor a Heveo imbatik to, insan to pinasoot ya inakdulan.
GEN_034_0003	Si Siquem ang anak nga lalaki ni Hamor nga Hevhanon, kag pangulo sadto nga lugar.	Balet nen naimano ton magangganan tuloy si Dina, sinmabiy baleg a panibeg tod sikato tan kinokoyung to.
GEN_034_0004	Pero nakita niya nga makabilihag sia gani nagtubo ang iya gugma kay Dina, kag gintinguhaan nga maluyag si Dina sa iya.	Inkuantod kinen ama to, Labay kon asawaen yan bii.
GEN_034_0005	Dayon si Siquem nagsiling kay tatay niya, Pasugoi ninyo ining dalaga agod nga akon mangin-asawa.	Ala yo pa a para siak.
GEN_034_0006	Nabalitaan ni Jacob nga ang iya bata nga babayi gindagtaan, pero tungod kay ang iya mga anak nga lalaki didto sa latagon nga nagaatipan sang mga hayop, naghipos lang sia anay tubtob nakaabot sila.	Naamtaan nen Jacob so impamasoot dad anak ton Dina, balet lapud saray anak ton lalaki et wala rad kaalogan anggapoy ginawa to ya anggad insabi ra.
GEN_034_0007	Si Hamor nga amay ni Siquem nagkadto kay Jacob kag nagpakighambal sa iya, sang nagahinampot halin sa latagon ang mga anak nga lalaki ni Jacob.	Nen nitan la ray lalakin anak nen Jacob a nanlapud kaalogan, sinmabi met si Hamor ya ama nen Sikem, ta labay toy mitongtong ed kinen Jacob.
GEN_034_0008	Sang pagkabati nila sini, nakibot sila kag naakig gid tungod sang malain nga butang nga ginhimo ni Siquem kag tungod kay ginpakahuy-an niya ang mga tawo sang Israel paagi sa paglugos niya sang anak nga babayi ni Jacob.	Nen nadngelan day agawa, abigla ra tan mapalaloy pasnuk da ed sayan impamasoot nen Sikem ed agi ran bii tan say impamaabeba tod saray totood Israel.
GEN_034_0009	Si Hamor nagsiling sa ila, Ang akon anak nga si Siquem naluyag gid sa imo bata nga babayi.	Inkuanen Hamor ed sikara, Si anak kon Sikem et naibegan toy anak mon marikit; paasawam la kari ed sikato.
GEN_034_0010	Kon mahimo ipaasawa sia sa akon anak.	Mampapaknaan tayo ya iyabuloy tayoy panaasawaan na totoo tayo.
GEN_034_0011	Maghimo kita sing kasugtanan nga mag-alasawahay ang aton mga kabataan.	Diad ontan, nayarian yoy manayam diad bansa mi; nayarian yoy manayam ed inerman a labay yo, mannigosio kayo, tan mankayaryan kayo na antokaman.
GEN_034_0012	Dayon sarang kamo makaestar sa amon duta upod sa amon.	Insan inkuanen Sikem ed kinen ama nen Dina tan saray agagi ton lalaki, Iter yo yan kekerewen ko, et iter koy antokaman a labay yo.
GEN_034_0013	Sarang kamo makaestar bisan diin nga luyag ninyo, makanegosyo, kag makaangkon sing mga pagkabutang.	Ibaga yod siak no anto ray labay yon irigalok, tan no pigay labay yon ibayar ko; iter koy antokaman a kerewen yo, dapot no paasawa yod siak si Dina.
GEN_034_0014	Dayon si Siquem nagsiling sa amay kag sa mga utod nga lalaki ni Dina, Ihatag man ninyo ang akon ginapangayo, kag hatagan ko kamo sang bisan ano nga pangayuon ninyo.	Saramay lalakin anak nen Jacob et inebatan day marakep si Sikem tan si ama to, balet walad kanunotan dan palikdoen da ra lapud agawa ed kinen Dina ya agi ra.
GEN_034_0015	Magsiling lang kamo kon ano nga mga regalo ang luyag ninyo, kag bisan pila ang pangayuon ninyo para sa nobya kay ihatag ko sa inyo, kon inyo lang sia ipaasawa sa akon.	Inkuandad kinen Sikem, Ag mi iyabuloy a miasaway agi mi ed sakey a lakin ag asegat; makapabaing yad sikami.
GEN_034_0016	Ang mga anak nga lalaki ni Jacob nagsabat kay Siquem kag sa iya amay nga si Hamor, sa tuyo nga madayaan sila tungod kay gindagtaan ni Siquem ang ila utod nga babayi nga si Dina.	Onabuloy kami labat no magmaliw kayon singa sikami, diad pamasegat yod amin a lalaki ed sikayo.
GEN_034_0017	Nagsiling sila sa iya, Indi namon pag-ipaasawa ang amon utod sa lalaki nga wala matuli, kay kahuloy-an ina sa amon.	Onabuloy kami met a manaasawaan iray totoo mi tan saray totoo yo.
GEN_034_0018	Mapasugot lamang kami kon manginsubong kamo sa amon, kag ina kon inyo tulion ang tanan ninyo nga mga lalaki.	Manayam kami dia tan mikasakey kamid sikayo.
GEN_034_0019	Dayon mapasugot kami nga mag-alasawahay ang aton mga kabataan.	Balet no ag kayo onabubon ed saraya, awiten miy Dina tan ontaynan kami la.
GEN_034_0020	Magaestar kami upod sa inyo kag mangin-isa kita ka grupo sang mga tawo.	Inmabubon si Hamor tan si anak ton si Sikem.
GEN_034_0021	Pero kon indi kamo magpasugot sang amon ginapangayo kag indi kamo magpatuli, dalhon namon sia pauli.	Ag la nanabalay Sikem ya anumpal ed tongtongan da, ta inaro to may biin anak nen Jacob.
GEN_034_0022	Nakita ni Hamor kag sang iya anak nga si Siquem nga ang ginapangayo daw nagakabagay man, gani ang pamatan-on wala na mag-usik sing tion sa paghimo sang ginapangayo sa iya, tungod kay naluyag gid sia sa bata ni Jacob nga babayi.	Manona si Sikem ed amin da ray kabyangay pamilya to.
GEN_034_0023	Si Siquem ginatahod sing labi sa bug-os nga panimalay sang iya amay.	Linma si Hamor tan si anak ton Sikem ed pandaragupan na totoo diad puirtay baley, tan inkuandad saray kabaleyan da, Makaaro ra yay totoon sinmabi diad sikatayo; panayamen ti la ra dia tan paolyan ti ran mannigosio dia.
GEN_034_0024	Si Hamor kag ang iya anak nga si Siquem nagkadto sa ginatipunan sang mga tawo sa pwerta sang siudad, kag nagsiling sa ila mga kasimanwa Ini nga mga tawo mainabyanon.	Maawang met ingen yay lugar tayo.
GEN_034_0025	Paestaron naton sila diri sa aton duta kag tugotan nga magnegosyo.	Asawaen ti ray mamarikit da tan ipaasawa tayo ray mamarikit tayo ed sikara.
GEN_034_0026	Ang aton duta may lugar pa man para sa ila.	Balet manayam ira dia tan mikasakey irad sikatayo, no pasegat tayon amin iray lalaki ed sikatayo a singa sikara.
GEN_034_0027	Pangasaw-on ta ang ila mga anak nga babayi kag ipaasawa ta man sa ila ang aton mga anak nga babayi.	Diad onya, nakayaryan tayoy amin ya ayayep da tan arum ni ran kayaryan da.
GEN_034_0028	Pero ini nga mga tawo magapasugot lang sa pag-estar upod sa aton kag mangin-isa sa aton, kon tulion ta ang tanan naton nga mga lalaki, subong sa ila.	Kanyan onabuloy ti lan manayam ira diad sikatayo.
GEN_034_0029	Sa ulihi ang tanan nila nga mga kahayupan, mga pagkabutang, kag mga baka mangin-aton.	Inmabuloy ya amin iray ombaley ed imbaga di Hamor tan Sikem.
GEN_034_0030	Gani magpasugot kita nga makaestar sila upod sa aton.	Kanyan nampasegat ya amin iray lalaki.
GEN_034_0031	Ang tanan nga mga pumoluyo sang siudad nagpasugot sang ginhingyo ni Hamor kag ni Siquem kag ang tanan nga mga lalaki gintuli.	Kasumpal na taloy agew nen ag ni inmabig ira may nampasegat, saray duaran lalakin anak nen Jacob tan agagi nen Dina a di Simeon tan si Levi et inala ray ispada ra, linma rad siudad ya anggapoy makaamtad getma ra, insan da pinatey ya amin iray lalaki.
GEN_034_0032	Sang makaligad ang tatlo ka adlaw, sang ginahapdian pa ang mga lalaki sa ila pagpatuli, ang duha ka mga anak nga lalaki ni Jacob, si Simeon kag si Levi nga mga utod ni Dina, nagkuha sang ila mga espada, nagsulod sa siudad nga wala mahibal-i nga malain ang ila tuyo, kag ginpamatay nila ang tanan nga mga lalaki.	Pinatey da met si Hamor tan si anak ton Sikem, inala ray Dina ed abung nen Sikem, insan la ra tinmaynan.
GEN_034_0033	Ginpatay nila si Hamor kag ang iya anak nga si Siquem, ginkuha nila si Dina sa balay ni Siquem kag naglakat.	Kasumpal na impanpapatey nen Simeon tan si Levi, sinmabi ray arum ya anak nen Jacob tan inala ray amin a naala ra ed baley.
GEN_034_0034	Sa tapos sang pagpamatay, ang iban nga mga anak nga lalaki ni Jacob nagpanguha sang tanan nga mapuslan nila sa siudad agod sa pagtimalos, tungod kay ang ila utod nga babayi gindagtaan.	Ginawa ra ya, pian makabawi ra ed inkaderal na kagalangan na agi ra.
GEN_034_0035	Ginpanguha nila ang mga panong, mga baka, mga asno, kag ang tanan nga makuha nila sa siudad kag sa latagon.	Inala ray amin a karniro, baka, asno, tan amin a bengatlan walad baley tan diad kaalogan.
GEN_034_0036	Ginkuha nila ang tanan nga mga butang nga mapuslan, gindakop ang tanan nga mga babayi kag mga kabataan, kag gindala nila ang tanan nga makuha nila halin sa mga balay.	Inala ray amin a makana; inala ra met iray bibii tan saray ogogaw, tan amin a bengatlan walad kaabungan.
GEN_034_0037	Si Jacob nagsiling kay Simeon kag kay Levi, Ginhatagan ninyo ako sing palaligban.	Inkuanen Jacob ed kindi Simeon tan Levi, Initdan yo ak na gunigon; natan bosulen ak na saray Cananeo, saray Perezeo, tan amin iray wadyad sayan pasen.
GEN_034_0038	Karon ang mga Canaanhon, ang mga Peresnon kag ang tanan nga mga pumoluyo sang duta magadumot sa akon.	Dagdaiset iray totook; no mankakasakey iran amin, insan da ak labanan, ompatey so intiron pamilya tayo.
GEN_034_0039	Wala ako sing madamo nga mga tinawo.	Balet inmebat ira, Ag nayarin gawaen dan singa marotak a bii si Dina ya agi mi.
GEN_035_0001	Ang Dios nagsiling kay Jacob, Maghimos ka kag magkadto gilayon sa Betel, kag didto mag-estar.	Inkuan na Dios ed kinen Jacob, Lakan tampol ed Betel tan manayam kad man.
GEN_035_0002	Maghimo ka didto sing altar para sa akon, ang Dios nga nagpakita sa imo sang nagapalagyo ikaw sa imo utod nga si Esau.	Manggawa kad may altar a para siak a Dios a pinmayawar ed sika nen ibabatikan moy agim ya Esau.
GEN_035_0003	Gani, si Jacob nagsiling sa iya panimalay kag sa tanan nga kaupod niya, Ipamilak ang dumoluong nga mga diosdios nga yara sa inyo, dayon magpaninlo kamo kag magsuksok sing matinlo nga mga bayu.	Kanyan inkuanen Jacob ed pamilya to tan amin a kaiba to, Ibantak yo ray diriyos na arum a bansa ya awit yo; linisan yoy sikayon dili, insan kayo mampales na malinis.
GEN_035_0004	Magahalin kita diri kag magakadto sa Betel, sa diin magahimo ako sing altar sa Dios nga nagbulig sa akon sa tion sang akon kabudlayan, kag nag-upod sa akon bisan diin ako magkadto.	Onekal itayo la dia tan onla itayo ed Betel, a dimay panggawaan koy altar a para Dios a tinmulong ed siak nen wala ak ed kairapan tan inoolup to ak ed inerman a nilak.
GEN_035_0005	Gani, ginhatag nila kay Jacob ang tanan nga dumoluong nga mga diosdios nga yara sa ila, kag ginhatag man nila ang ila mga aritos nga ila ginasuksok.	Inter da sirin ed kinen Jacob iray amin a walad sikaran diriyos na arum a bansa, pati saray ikaw ya akabitin ed saray layag da.
GEN_035_0006	Ginlubong niya yadto sa idalom sang kahoy nga terebinto nga malapit sa Siquem.	Inkotkot to ra yan amin ed silong na kiew a robli ya asingger ed Sikem.
GEN_035_0007	Sang maghalin si Jacob kag ang iya mga anak nga lalaki, ang kahadlok halin sa Dios nag-abot sa mga tawo sa mga banwa sa palibot, kag wala nila ginlagas ang mga anak ni Jacob.	Nen onsisiput si Jacob tan saray anak ton lalaki, sinmabiy baleg a takot ed saray totood kaliber-liber iran baley, kanyan ag da ra inosilan.
