id	source_text	target_text
EXO_001_0001	Amo ini ang mga ngalan sang mga anak nga lalaki ni Jacob nga nagkadto sa Ehipto upod sa iya, ang tagsatagsa upod sa iya panimalay.	Ito ang mga pangalan ng mga anak ni Israel na dumating sa Ehipto kasama si Jacob; bawat isa ay kasama ang kanya-kanyang sambahayan sina Ruben, Simeon, Levi, Juda, Isacar, Zebulon, Benjamin, Dan, Neftali, Gad, at Aser.
EXO_001_0002	Sila amo sanday Ruben, Simeon, Levi, Juda, Isacar, Zabulon, Benjamin, Dan, Neftali, Gad, kag Aser.	Lahat ng taong nagmula sa balakang ni Jacob ay pitumpung katao, at si Jose ay nasa Ehipto na.
EXO_001_0003	Ang kadamuon sang mga kaliwat ni Jacob setenta tanan.	Namatay si Jose at ang lahat ng kanyang mga kapatid at ang buong salinlahing iyon.
EXO_001_0004	Si Jose nga iya anak didto na nga daan sa Ehipto.	Ang mga anak ni Israel ay lumago at nadagdagang mabuti; sila'y dumami at naging napakalakas kaya't ang lupain ay napuno nila.
EXO_001_0005	Sang ulihi si Jose kag ang iya mga utod nga lalaki nagkalamatay, subong man yadtong bug-os nga henerasyon.	At may bumangong isang bagong hari sa Ehipto na hindi kilala si Jose.
EXO_001_0006	Pero ang mga kaliwat ni Israel may madamo nga mga kaanakan, nagmuad gid sila kag nagmabakod, sa bagay nga naglapnag sila sa duta sang Ehipto.	Sinabi niya sa kanyang bayan, Tingnan ninyo, ang sambayanan ng mga anak ni Israel ay mas marami at higit na malakas kaysa atin.
EXO_001_0007	Karon may isa ka bag-o nga hari nga naggahom sa Ehipto.	Halikayo, pakitunguhan natin sila nang may katusuhan, baka sila'y dumami at mangyari na kapag nagkaroon ng digmaan ay umanib sila sa ating mga kaaway, lumaban sa atin, at umalis sa lupain.
EXO_001_0008	Wala sia makakilala kay Jose.	Kaya't naglagay sila ng mga tagapangasiwa upang pahirapan sila sa kanilang mga sapilitang paggawa.
EXO_001_0009	Ang hari nagsiling sa iya mga ginsakpan, Tan-awa ninyo, ini nga mga tawo nga Israelinhon nagadamo kag nagabakod, kag nabutang kita sa katalagman.	Kanilang ipinagtayo si Faraon ng mga lunsod imbakan, ang Pitom at Rameses.
EXO_001_0010	Karon pamatii ninyo!	Subalit habang kanilang pinahihirapan sila, lalo silang dumarami at lalong lumalaganap.
EXO_001_0011	Pangitaan naton sang paagi nga indi na gid sila magdamo.	At kinasuklaman nila ang mga anak ni Israel.
EXO_001_0012	Kay kon may inaway, basi magdampig sila sa aton mga kaaway sa pag-away batok sa aton, kag magpalagyo sila sa aton pungsod.	Malupit na pinapaglingkod ng mga Ehipcio ang mga anak ni Israel; at kanilang pinapait ang kanilang buhay sa pamamagitan ng mahirap na paglilingkod, sa luwad at sa tisa, at sa lahat ng uri ng gawain sa bukid; at sa lahat ng kanilang gawain ay malupit silang pinapaglingkod.
EXO_001_0013	Gani ginbutangan sila sing mga mapintas nga mga kabo sa pagpaobra sa ila sing pataypatay agod magluya sila.	Ang hari ng Ehipto ay nagsalita sa mga hilot na mga Hebrea, na ang pangalan ng isa ay Sifra, at ang pangalan ng ikalawa ay Pua.
EXO_001_0014	Ang mga Israelinhon nagpatindog sang mga siudad sang Pitom kag Rameses para sa hari nga pagatipunan nila sing mga pagkaon.	Kanyang sinabi, Paghilot ninyo sa mga babaing Hebrea at pagtingin ninyo sa kanila sa upuang panganganakan, kung lalaki ay papatayin ninyo; ngunit kung babae ay mabubuhay ito.
EXO_001_0015	Pero sa nagadugang ang pagpigos sang mga Ehiptohanon sa mga Israelinhon, tapat pa gani nga nagadamo kag nagalapnag sila.	Subalit ang mga hilot ay natakot sa Diyos at hindi nila ginawa ang gaya nang iniutos sa kanila ng hari ng Ehipto, kundi hinayaan nilang mabuhay ang mga batang lalaki.
EXO_001_0016	Ang mga Ehiptohanon nagkahadlok sa mga Israelinhon.	Ipinatawag ng hari ng Ehipto ang mga hilot at sinabi sa kanila, Bakit ninyo ginawa ang bagay na ito at hinayaan ninyong mabuhay ang mga batang lalaki?
EXO_001_0017	Gani mapintas nga gin-ulipon nila ang mga Israelinhon, kag ginpabudlay ang ila pagkabuhi paagi sa pagpaobra sa ila sa lunang kag sa tisa, kag sang tanan nga sahi sang obra sa uma.	Sinabi ng mga hilot sa Faraon, Sapagkat ang mga babaing Hebrea ay hindi gaya ng mga babaing Ehipcia.
EXO_001_0018	Ginpilit nila sila sa paghimo sang tanan nga mabug-at nga mga obra.	Sila'y malalakas at nakapanganak na bago dumating ang hilot sa kanila.
EXO_001_0019	Dayon ang hari sang Ehipto naghambal sa mga paltera nga nagapabata sa mga babayi nga mga Hebreo.	Kaya't ang Diyos ay naging mabuti sa mga hilot; at ang taong-bayan ay dumami at naging napakalakas.
EXO_001_0020	Ang isa ginhingalanan kay Sipra kag ang isa kay Pua.	Dahil ang mga hilot ay natakot sa Diyos, kanyang binigyan sila ng mga sambahayan.
EXO_001_0021	Nagsiling ang hari, Kon nagapabata kamo sang Hebreo nga mga babayi amo ini ang inyo pagahimuon: kon ang lapsag lalaki, patyon ninyo; pero kon babayi ini, pabayai lang nga mabuhi.	Pagkatapos, iniutos ni Faraon sa kanyang buong bayan, Itatapon ninyo sa ilog ang bawat lalaking ipanganak ngunit bawat babae ay hayaan ninyong mabuhay.
EXO_001_0022	Pero ang mga paltera wala magtuman sa hari kay nahadlok sila sa Dios.	<MISSING TRANSLATION>
EXO_001_0023	Sa baylo ginpabay-an nila nga mabuhi ang mga lapsag nga lalaki.	<MISSING TRANSLATION>
EXO_001_0024	Gani ginpatawag sang hari ang mga paltera kag ginpamangkot, Ngaa bala nga ginhimo ninyo ini kag ginpabay-an nga mabuhi ang mga lapsag nga lalaki?	<MISSING TRANSLATION>
EXO_001_0025	Nagsabat sila, Ang mga babayi nga Hebreo indi pareho sang mga babayi nga Ehiptohanon; mahapos sila magbata nga sa wala pa gani kami makaabot nakabata na sila.	<MISSING TRANSLATION>
EXO_001_0026	Bangod kay nagakahadlok ang mga paltera sa Dios, ang Dios nagmaayo sa ila kag ginhatagan niya sila sang ila kaugalingon nga mga panimalay kag nagdamo nga nagdamo ang mga Israelinhon, kag nangingamhanan sila.	<MISSING TRANSLATION>
EXO_001_0027	Dayon ang hari nagmando sa tanan niya nga mga ginsakpan: Ihaboy ninyo sa Suba sang Nilo ang tagsa ka bata nga lalaki nga matawo sa mga Hebreo, pero pabay-i lang ninyo ang mga bata nga babayi nga mabuhi.	<MISSING TRANSLATION>
EXO_002_0001	Karon may isa ka tawo sa tribo ni Levi nga nagpangasawa sa isa ka babayi sa amo man nga tribo.	May isang lalaki sa lipi ni Levi na humayo at nag-asawa ng isang anak na babae ni Levi.
EXO_002_0002	Nagbusong ang iya asawa kag nagbata sing isa ka lalaki.	Ang babae ay naglihi at nanganak ng isang lalaki.
EXO_002_0003	Sang makita sang iya iloy nga ang bata gwapo kag maayo sing lawas, gintago niya sia sa sulod sang tatlo ka bulan.	Nang kanyang makita na ito ay maganda, kanyang itinago ito ng tatlong buwan.
EXO_002_0004	Pero sang indi na niya matago ang bata, nagkuha sia sang isa ka basket nga nahimo sa tabun-ak, kag iya ini ginbutangan sing balaw agod indi makasulod ang tubig.	Nang hindi na niya ito maitago pa, ikinuha niya ito ng isang basket na yari sa papiro, at pinahiran niya ng betun at alkitran.
EXO_002_0005	Ginpahigda niya ang bata sa sini nga basket kag ginbutang niya ini sa bibi sang suba nga may matag-as nga mga tabun-ak.	Kanyang isinilid ang bata roon at inilagay sa talahiban sa tabi ng ilog.
EXO_002_0006	Ang iya utod nga babayi nagtindog sa ulounhan sa pagbantay kon ano ang mahanabo sa iya.	Tumayo sa malayo ang kanyang kapatid na babae upang malaman ang mangyayari sa bata.
EXO_002_0007	Karon ang anak nga babayi sang hari nagkadto sa suba sa pagpaligo, samtang ang iya manug-atipan nga mga babayi nagdayandayan sa pangpang sang suba.	Noon, ang anak na babae ni Faraon ay lumusong upang maligo sa ilog, at naglakad ang kanyang mga alalay na babae sa tabi ng ilog.
EXO_002_0008	Sa hinali nakita niya ang basket sa mga tabun-ak, kag ginsugo niya ang iya ulipon nga babayi sa pagkuha sini.	Kanyang nakita ang basket sa talahiban at ipinakuha sa kanyang alalay.
EXO_002_0009	Ginbuksan ini sang anak sang hari kag iya nakita ang lapsag nga lalaki nga nagahibi.	Nang kanyang buksan ito, nakita niya ang bata; at narito, ang sanggol ay umiyak.
EXO_002_0010	Naluoy sia sa bata kag nagsiling, Isa ini sang mga bata sang mga Hebreo.	At kanyang kinaawaan siya at sinabi, Ito'y isa sa mga anak ng mga Hebreo.
EXO_002_0011	Dayon ang utod nga babayi sang lapsag nagpamangkot sa iya, Luyag mo bala nga malakat ako sa pagpangita sang isa ka babayi nga Hebreo nga magaatipan sini nga bata para sa imo?	Nang magkagayo'y sinabi ng kanyang kapatid na babae sa anak ng Faraon, Aalis ba ako upang itawag kita ng isang tagapag-alaga mula sa mga babaing Hebrea na mag-aalaga ng bata para sa iyo?
EXO_002_0012	Nagsabat sia, Lakat ka.	Sinabi sa kanya ng anak ng Faraon, Umalis ka.
EXO_002_0013	Gani naglakat ang bata nga babayi kag gintawag ang iloy mismo sang bata.	Ang batang babae ay umalis at tinawag ang ina ng bata.
EXO_002_0014	Ang anak sang hari nagsiling sa iya, Dalha ini nga bata kag saguron mo sia para sa akon, kay suholan ko ikaw.	Sinabi ng anak ng Faraon sa kanya, Dalhin mo ang batang ito at alagaan mo para sa akin at uupahan kita.
EXO_002_0015	Gani ginkuha sang babayi ang bata kag ginsagod.	Kaya't kinuha ng babae ang bata at inalagaan ito.
EXO_002_0016	Sang magdakudaku na ang bata, gindala niya ini sa anak sang hari kag gin-ayop niya ini subong nga iya anak.	Ang bata ay lumaki at kanyang dinala ito sa anak ng Faraon, at ito'y naging kanyang anak.
EXO_002_0017	Nagsiling ang anak sang hari, Ginkuha ko sia sa tubig, gani hingalanan ko sia kay Moises.	Kanyang pinangalanan siyang Moises, dahil sinabi niya, Sapagkat aking iniahon siya sa tubig.
EXO_002_0018	Isa sadto ka adlaw, sang daku na si Moises, nagduaw sia sa iya mga kasimanwa nga Hebreo, kag iya nakita kon daw ano ang pagpilit sa ila sa paghimo sang mabug-at nga mga obra.	Nang mga araw na iyon, nang malaki na si Moises, nagtungo siya sa kanyang mga kapatid, at nakita ang kanilang sapilitang paggawa.
EXO_002_0019	Nakita niya ang isa ka Ehiptohanon nga nagpatay sang isa ka Hebreo, isa sang iya mga kasimanwa.	Kanyang nakita ang isang Ehipcio na binubugbog ang isang Hebreo na isa sa kanyang mga kapatid.
EXO_002_0020	Nagpanghulonghulong sia, kag sang wala sia sing may nakita, ginpatay niya ang Ehiptohanon kag iya ginlubong ang bangkay sa balas.	Siya'y tumingin sa magkabi-kabilang dako at nang siya'y walang makitang tao, kanyang pinatay ang Ehipcio at kanyang itinago sa buhanginan.
EXO_002_0021	Sang madason nga adlaw nagbalik sia, kag iya na man nakita ang duha ka mga Hebreo nga nagaaway.	Nang siya'y lumabas nang sumunod na araw, may dalawang lalaking Hebreo na naglalaban; at kanyang sinabi sa gumawa ng masama, Bakit mo sinasaktan ang iyong kasama?
EXO_002_0022	Nagsiling sia sa isa nga nakahimo sing sayop, Ngaa bala ginasakit mo ang kapareho mo nga Hebreo?	Sinabi niya, Sinong naglagay sa iyo bilang pinuno at hukom sa amin?
EXO_002_0023	Nagsabat sia, Sin-o bala ang naghimo sa imo nga pangulo kag manughukom sa amon?	Iniisip mo bang patayin ako, gaya nang pagpatay mo sa Ehipcio?
EXO_002_0024	Patyon mo man bala ako subong sang pagpatay mo sa isa ka Ehiptohanon?	Natakot si Moises at kanyang inisip, Tiyak na ang bagay na ito ay alam na.
EXO_002_0025	Dayon kinulbaan si Moises kag nagpanghunahuna, Nahibal-an gali sang mga tawo ang akon ginhimo.	Nang mabalitaan ng Faraon ang bagay na ito, ninais niyang patayin si Moises.
EXO_002_0026	Sang nabatian ini sang hari, gintinguhaan niya nga patyon si Moises, pero nagpalagyo si Moises kag nagkadto sa duta sang Midian, sa diin sia nag-estar.	Subalit si Moises ay tumakas mula kay Faraon at nanirahan sa lupain ng Midian.
EXO_002_0027	Isa ka adlaw, sang pag-abot niya didto, nagpungko sia sa tupad sang bubon.	Siya'y umupo sa tabi ng isang balon.
EXO_002_0028	Karon nag-abot sa bubon ang pito ka mga anak nga babayi ni Jetro nga pari sang Midian.	Ang pari noon sa Midian ay may pitong anak na babae.
EXO_002_0029	Nagtimba sila sing tubig kag nagpuno sang palaimnan sang mga karnero kag mga kanding sang ila amay.	Sila'y dumating at umigib ng tubig at kanilang pinuno ang mga inuman upang painumin ang kawan ng kanilang ama.
EXO_002_0030	Nag-abot man ang iban nga mga manugbantay sang mga karnero kag gintabog nila palayo ang mga anak ni Jetro.	Ang mga pastol ay dumating at sila'y ipinagtabuyan; ngunit si Moises ay tumindig at sila'y ipinagtanggol, at pinainom ang kanilang kawan.
EXO_002_0031	Pero gintabangan sila ni Moises, kag ginpainom niya ang ila mga kahayupan.	Nang sila'y dumating kay Reuel na kanilang ama ay sinabi nito, Bakit napakadali ninyong dumating ngayon?
EXO_002_0032	Sang pagpauli nila sa ila amay nga si Jetro, nagpamangkot sia, Ngaa temprano pa kamo nakapauli karon nga adlaw?	Kanilang sinabi, Iniligtas kami ng isang Ehipcio mula sa kamay ng mga pastol at saka iniigib pa niya kami ng tubig at pinainom ang kawan.
EXO_002_0033	Nagsabat sila, Ang isa ka Ehiptohanon nagluwas sa amon sa mga manugbantay sang karnero kag gintimbaan pa niya kag ginpainom ang amon mga kahayupan.	Sinabi niya sa kanyang mga anak, Saan siya naroon?
EXO_002_0034	Ginpamangkot niya ang iya mga anak nga babayi, Diin na sia?	Bakit ninyo iniwan ang lalaking iyon?
EXO_002_0035	Ngaa ginbayaan ninyo sia didto?	Tawagin ninyo siya upang makakain ng tinapay.
EXO_002_0036	Lakat kag tawga ninyo sia agod makakaon upod sa aton.	Si Moises ay nasiyahang makitira sa lalaking iyon at kanyang ibinigay kay Moises si Zifora na kanyang anak na babae.
EXO_002_0037	Nagpamat-od si Moises sa pag-estar didto, kag ginpaasawa ni Jetro sa iya ang iya anak nga si Sipora.	Nanganak siya ng isang lalaki at kanyang pinangalanang Gershom sapagkat sinabi ni Moises, Ako'y manlalakbay sa ibang lupain.
EXO_002_0038	Nagbata sia sing lalaki kag ginhingalanan ni Moises ang bata kay Gersom, kay nagsiling sia sa iya kaugalingon, Dumoluong ako diri sa sini nga duta.	Pagkaraan ng maraming araw, ang hari ng Ehipto ay namatay.
EXO_002_0039	Sang makaligad ang madamo nga mga tinuig, ang hari sang Ehipto napatay.	Ang bayang Israel ay dumaing dahil sa pagkaalipin at sila'y humingi ng tulong.
EXO_002_0040	Ang mga Israelinhon nag-antos sa gihapon tungod sang pag-ulipon sa ila kag nagpangayo sila sing bulig.	Ang kanilang daing dahil sa pagkaalipin ay nakarating sa Diyos.
EXO_002_0041	Ang ila pagpangayo sing bulig nakalambot sa Dios, kag nabatian niya ang ila pagpanghakroy.	Narinig ng Diyos ang kanilang daing at naalala ng Diyos ang kanyang tipan kina Abraham, Isaac, at Jacob.
EXO_002_0042	Dayon nadumdoman sang Dios ang iya kasugtanan kay Abraham, kay Isaac kag kay Jacob.	At tiningnan ng Diyos ang mga anak ni Israel at nalaman ng Diyos ang kanilang kalagayan.
EXO_002_0043	Nakita sang Dios ang pag-ulipon sa mga Israelinhon, kag nabalaka sia sa ila.	<MISSING TRANSLATION>
EXO_003_0001	Karon si Moises nagabantay sang mga karnero kag mga kanding sang iya ugangan nga si Jetro, ang pari sang Midian.	Noon ay inaalagaan ni Moises ang kawan ni Jetro na kanyang biyenan na pari sa Midian; kanyang pinatnubayan ang kawan sa kabila ng ilang at nakarating sa bundok ng Diyos, sa Horeb.
EXO_003_0002	Gindala niya ang panong sa tabok sang desierto, kag nakaabot sia sa Sinai, ang balaan nga bukid.	Ang anghel ng Panginoon ay nagpakita sa kanya sa isang ningas ng apoy na mula sa gitna ng isang mababang punungkahoy.
EXO_003_0003	Didto ang anghel sang Ginoo nagpakita sa iya sa dagway sang nagadabdab nga kalayo sa tunga sang magamay nga kahoy.	Siya'y nagmasid at ang punungkahoy ay nagliliyab ngunit ito'y hindi nasusunog.
EXO_003_0004	Gintan-aw ni Moises ang magamay nga kahoy kag natalupangdan niya nga nagadabdab ini, pero wala ini masunog.	Sinabi ni Moises, Ako'y pupunta sa kabila at titingnan ko itong dakilang panooring ito, kung bakit ang punungkahoy ay hindi nasusunog.
EXO_003_0005	Si Moises nagpanghunahuna, Mapalapit ako kag tan-awon ining makatilingala nga butang.	Nang makita ng Panginoon na siya'y pumunta sa kabila upang tumingin ay tinawag siya ng Diyos mula sa gitna ng mababang punungkahoy, Moises, Moises.
EXO_003_0006	Ngaa ining magamay nga kahoy indi masunog?	Sumagot siya, Narito ako.
EXO_003_0007	Sang makita sang Ginoo nga nagapalapit sia, ang Dios nagtawag sa iya halin sa tunga sang magamay nga kahoy nga nagasiling, Moises, Moises!	Kanyang sinabi, Huwag kang lumapit dito.
EXO_003_0008	Kag nagsabat sia, Yari ako.	Hubarin mo ang sandalyas sa iyong mga paa sapagkat ang dakong iyong kinatatayuan ay banal na lupa.
EXO_003_0009	Ang Dios nagsiling, Indi ka gid magpalapit.	Sinabi pa niya, Ako ang Diyos ng iyong ama, ang Diyos ni Abraham, ang Diyos ni Isaac, at ang Diyos ni Jacob.
EXO_003_0010	Ubaha ang imo mga sandalyas, tungod kay ang lugar nga imo ginatindugan balaan.	Si Moises ay nagtakip ng kanyang mukha sapagkat siya'y natakot na tumingin sa Diyos.
EXO_003_0011	Ako amo ang Dios sang imo mga katigulangan, ang Dios ni Abraham, ang Dios ni Isaac, kag ang Dios ni Jacob.	Sinabi ng Panginoon , Aking nakita ang paghihirap ng aking bayan na nasa Ehipto at aking narinig ang kanilang daing dahil sa mga umaapi sa kanila.
EXO_003_0012	Gani gintabunan ni Moises ang iya guya, tungod kay nahadlok sia sa pagtulok sa Dios.	Talagang nalalaman ko ang kanilang pagdurusa.
EXO_003_0013	Dayon ang Ginoo nagsiling, Nakita ko kon daw ano ang pagpintas sa akon mga tawo didto sa Ehipto.	Ako'y bumaba upang iligtas sila mula sa kamay ng mga Ehipcio at upang sila'y dalhin sa isang mabuting lupain at malawak, mula sa lupaing iyon, sa isang lupaing dinadaluyan ng gatas at pulot, sa lugar ng mga Cananeo, Heteo, Amoreo, Perezeo, Heveo at Jebuseo.
EXO_003_0014	Nabatian ko ang ila pagpangayo sing bulig batok sa mga kabo nga nagapamintas sa ila.	At ngayon, ang daing ng mga anak ni Israel ay nakarating sa akin, at nakita ko rin ang pang-aapi na ginawa sa kanila ng mga Ehipcio.
EXO_003_0015	Nahibaluan ko ang tanan nila nga mga pag-antos.	Halika, ikaw ay aking susuguin kay Faraon upang iyong ilabas sa Ehipto ang aking bayan, ang mga anak ni Israel.
EXO_003_0016	Gani nagpanaog ako sa pagluwas sa ila sa mga Ehiptohanon, kag sa pagpagwa sa ila sa amo nga duta, pakadto sa isa ka malapad nga duta.	Sinabi ni Moises sa Diyos, Sino ako upang pumaroon kay Faraon at upang ilabas sa Ehipto ang mga anak ni Israel?
EXO_003_0017	Maayo kag mapatubasan ini nga duta, kag karon ginaestaran sang mga Canaanhon, mga Hethanon, mga Amornon, mga Peresnon, mga Hevhanon kag mga Jebusnon.	Kanyang sinabi, Ako'y makakasama mo; at ito'y magiging tanda sa iyo na ikaw ay aking sinugo: kapag iyong nailabas na sa Ehipto ang bayan, sasambahin ninyo ang Diyos sa bundok na ito.
EXO_003_0018	Nabatian ko gid ang pagpanawag sang mga Israelinhon, kag nakita ko kon daw ano ang pagpigos sang mga Ehiptohanon sa ila.	Ngunit sinabi ni Moises sa Diyos, Pagdating ko sa mga anak ni Israel at sasabihin ko sa kanila, Sinugo ako sa inyo ng Diyos ng inyong mga ninuno, at sasabihin nila sa akin, Ano ang kanyang pangalan?
EXO_003_0019	Karon ipadala ko ikaw sa hari agod sa pagpagwa sang akon mga tawo nga Israelinhon sa Ehipto.	Anong sasabihin ko sa kanila?
EXO_003_0020	Pero si Moises nagsiling sa Dios, Sin-o bala ako nga magkadto sa hari kag magpagwa sang mga Israelinhon sa Ehipto?	Sinabi ng Diyos kay Moises, AKO AY ANG AKO NGA.
EXO_003_0021	Ang Dios nagsabat, Ako magaupod sa imo, kag ini mangintanda nga ako nagpadala sa imo: kon imo na mapagwa ang mga Israelinhon sa Ehipto, magasimba kamo sa akon sa sini nga bukid.	At kanyang sinabi, Ganito ang sasabihin mo sa mga anak ni Israel, Sinugo ako sa inyo ni AKO NGA.
EXO_003_0022	Si Moises nagsiling sa Dios, Karon, kon magkadto ako sa mga Israelinhon kag magsiling sa ila, Ang Dios sang inyo mga katigulangan nagpadala sa akon sa inyo, kag kon sila mamangkot sa akon, Ano ang iya ngalan?	Sinabi pa ng Diyos kay Moises, Ganito ang sasabihin mo sa mga anak ni Israel, Sinugo ako sa inyo ng Panginoon , ang Diyos ng inyong mga ninuno, ang Diyos ni Abraham, ang Diyos ni Isaac, at ang Diyos ni Jacob.
EXO_003_0023	Ano bala ang isabat ko sa ila?	Ito ang aking pangalan magpakailanman at ito ang itatawag sa akin ng lahat ng mga lahi.
EXO_003_0024	Ang Dios nagsiling kay Moises, Ako nga Amo sa Gihapon.	Humayo ka at tipunin mo ang matatanda sa Israel at sabihin mo sa kanila, Ang Panginoon , ang Diyos ng inyong mga ninuno, ang Diyos nina Abraham, Isaac, at Jacob ay nagpakita sa akin, na nagsasabi, Tunay na kayo'y aking dinalaw at aking nakita ang ginagawa sa inyo sa Ehipto.
EXO_003_0025	Kag nagsiling pa gid sia, Amo ini ang dapat mo isiling sa mga Israelinhon: Si Ako nga Amo sa Gihapon amo ang nagpadala sa akon sa inyo.	At aking sinabi, aking aalisin kayo sa kapighatian sa Ehipto at dadalhin ko kayo sa lupain ng Cananeo, Heteo, Amoreo, Perezeo, Heveo, at ng Jebuseo, sa isang lupaing dinadaluyan ng gatas at pulot.
EXO_003_0026	Ang Dios naghambal pa gid kay Moises, Amo ini ang dapat mo isiling sa mga Israelinhon, Ang Ginoo , ang Dios sang inyo mga katigulangan, ang Dios ni Abraham, ang Dios ni Isaac, kag ang Dios ni Jacob, nagpadala sa akon sa inyo.	Kanilang papakinggan ang iyong tinig.
EXO_003_0027	Ini amo ang akon ngalan tubtob sa katubtoban.	Ikaw at ang matatanda sa Israel ay pupunta sa hari ng Ehipto, at inyong sasabihin sa kanya, Ang Panginoon , ang Diyos ng mga Hebreo ay nakipagtagpo sa amin at ngayo'y pahintulutan mo kami na maglakbay ng tatlong araw sa ilang.
EXO_003_0028	Ini amo ang itawag sa akon sang tanan nga palaabuton nga mga kaliwatan.	Nais naming makapaghandog sa Panginoon naming Diyos.
EXO_003_0029	Lakat kag tipuna ang mga pangulo sang Israel, kag singgani sila, Ang Ginoo , ang Dios sang inyo mga katigulangan, ang Dios ni Abraham, ni Isaac, kag ni Jacob, nagpakita kag nagsugo sa akon sa pagsiling sa inyo: nag-abot ako kag nakita ko kon ano ang ginahimo sang mga Ehiptohanon sa inyo.	Alam ko na hindi kayo papahintulutan ng hari ng Ehipto na umalis maliban sa pamamagitan ng isang makapangyarihang kamay.
EXO_003_0030	Nagpamat-od ako nga pagwaon kamo sa Ehipto, sa diin ginapintasan kamo.	Kaya't aking iuunat ang aking kamay at sasaktan ko ang Ehipto sa pamamagitan ng lahat kong kababalaghan na aking gagawin sa gitna niyon at pagkatapos, papahintulutan niya kayong umalis.
EXO_003_0031	Dalhon ko kamo sa duta sang mga Canaanhon, Hethanon, Amornon, Peresnon, Hevhanon, kag mga Jebusnon.	Pagkakalooban ko ang bayang ito ng biyaya sa paningin ng mga Ehipcio at sa pag-alis ninyo ay hindi kayo aalis na walang dala.
EXO_003_0032	Isa ini ka maayo kag mapatubason nga duta.	Bawat babae ay hihingi sa kanyang kapwa at ang dayuhan sa kanyang bahay ng mga hiyas na pilak, mga hiyas na ginto at mga damit, at inyong ipapasuot sa inyong mga anak na lalaki at babae.
EXO_003_0033	Magapamati ang akon mga katawhan sang imo isiling sa ila.	Sa ganito ay inyong sasamsaman ang mga Ehipcio.
EXO_003_0034	Dayon, kadto ka sa hari sang Ehipto upod sa mga pangulo sang Israel kag singgani sia, Ang Ginoo , ang Dios sang mga Hebreo nagpakigkita sa amon.	<MISSING TRANSLATION>
EXO_003_0035	Karon kon mahimo palakta kami sing tatlo ka adlaw sa desierto sa pagdulot sing mga halad sa Ginoo nga amon Dios.	<MISSING TRANSLATION>
EXO_003_0036	Nahibal-an ko nga ang hari sang Ehipto indi magtugot sa inyo sa paglakat, kon indi sia pagpiliton.	<MISSING TRANSLATION>
EXO_003_0037	Pero gamiton ko ang akon gahom sa pagsilot sa mga Ehiptohanon paagi sa mga milagro nga akon himuon sa ila.	<MISSING TRANSLATION>
EXO_003_0038	Pagkatapos sina, tugotan niya kamo sa paglakat.	<MISSING TRANSLATION>
EXO_003_0039	Himuon ko nga ang mga Ehiptohanon magtahod sa inyo agod nga kon maglakat kamo, indi kamo maglakat nga wala sing dala.	<MISSING TRANSLATION>
EXO_003_0040	Ang tagsa ka babayi nga Hebreo magapangayo sa babayi nga Ehiptohanon nga nagadayon sa iya, kag sa iya kaingod, sing mga bayu kag mga alahas nga pilak kag bulawan.	<MISSING TRANSLATION>
EXO_003_0041	Ipasuksok ninyo ini sa inyo mga anak nga lalaki kag babayi, kag paagi sini, madala ninyo ang manggad sang mga Ehiptohanon.	<MISSING TRANSLATION>
EXO_004_0001	Dayon si Moises nagsabat sa Ginoo , Pero abi kon ang mga Israelinhon indi magpati sa akon, kag indi magpamati sa akon ginasiling, kundi magsiling sila, Ang Ginoo wala magpakita sa imo, ano ang akon himuon?	Si Moises ay sumagot at nagsabi, Ngunit hindi nila ako papaniwalaan o papakinggan man sapagkat kanilang sasabihin, Ang Panginoon ay hindi nagpakita sa iyo.
EXO_004_0002	Gani ang Ginoo nagpamangkot sa iya, Ano bala ang ginauyatan mo?	Sinabi naman sa kanya ng Panginoon , Ano iyang nasa iyong kamay?
EXO_004_0003	Nagsabat sia, Isa ka sungkod.	Kanyang sinabi, Isang tungkod.
EXO_004_0004	Ang Ginoo nagsiling, Ihaboy ina sa duta.	Kanyang sinabi, Ihagis mo sa lupa.
EXO_004_0005	Sang mahaboy na ini ni Moises sa duta, nahimo ini nga man-og, kag nagpalagyo si Moises gikan sini.	Kanyang inihagis ito sa lupa at ito'y naging isang ahas.
EXO_004_0006	Dayon ang Ginoo nagsiling kay Moises, Untaya ang imo kamot kag dakpa sa ikog.	Si Moises ay lumayo sa ahas.
EXO_004_0007	Gani gin-untay ni Moises ang iya kamot kag gindakop ini kag nahimo ini liwat nga isa ka sungkod.	Sinabi ng Panginoon kay Moises, Iunat mo ang iyong kamay at hawakan mo sa buntot.
EXO_004_0008	Ang Ginoo nagsiling, Himua ini, agod nga magtuo sila nga ang Ginoo , ang Dios sang ila mga katigulangan, ang Dios ni Abraham, ang Dios ni Isaac, kag ang Dios ni Jacob, nagpakita sa imo.	Kanyang iniunat ang kanyang kamay, kanyang hinawakan, at naging isang tungkod sa kanyang kamay.
EXO_004_0009	Ang Ginoo naghambal liwat kay Moises, Ibutang ang imo kamot sa sulod sang imo bayu.	Nangyari ito upang sila'y maniwala na ang Panginoon , ang Diyos ng kanilang mga ninuno, ang Diyos ni Abraham, ang Diyos ni Isaac, at ang Diyos ni Jacob ay nagpakita sa iyo.
EXO_004_0010	Gintuman niya ini, kag sang pagwaon niya ang iya kamot, puno na ini sing aro kag nanginmaputi gid ini kaayo.	Sinabi pa sa kanya ng Panginoon , Ipasok mo ang iyong kamay sa iyong dibdib.
EXO_004_0011	Dayon ang Ginoo nagsiling, Ibutang liwat ang imo kamot sa sulod sang imo bayu.	Kanyang ipinasok ang kamay niya sa kanyang dibdib at nang kanyang ilabas, ang kanyang kamay ay ketongin, maputing parang niyebe.
EXO_004_0012	Gintuman niya ini, kag sang pagwaon niya ang iya kamot, nag-ayo na ini subong sang iban nga bahin sang iya lawas.	Sinabi ng Diyos, Ipasok mo uli ang iyong kamay sa iyong dibdib.
