id	source_text	target_text
MAT_023_0038	Mga Pariseo kag mga paratukdo san Kasuguan, makaluluoy gayod kamo kay mga pakitan-tawo lang!	Kaya ni gamitn nen deyaman a manumpa en altar, ay ginamit na iyud pati en alay ten altar.
MAT_023_0039	Baga kamon mga pantyon na ginpaputi.	Ni ginamit nen deyaman a manumpa en Templo ti pangaku ay ginamit na maski en Diyos a mgyan ten Templo.
MAT_023_0040	Sa luwas matahom kitaon pero sa sulod puno san mga tul-ang san mga tawo na namatay kag san tanan na mga kaatian.	Sakay ni ginamit nen deyaman a manumpa en langet, ay ginamit na en trono nen Diyos, sakay en Diyos a mggetnud a haud.
MAT_023_0041	Pareho man kamo sana!	Kakakagbi kam a tagapagtoldu hidi nen Kautusan sakay sikam a Pariseo hidi!
MAT_023_0042	Sa luwas bagan matanos pero sa sulod mga pagpakitan-tawo lang kag makasal-anon.	Magkukunwari kam!
MAT_023_0043	Mga Pariseo kag mga paratukdo san Kasuguan, makaluluoy gayod kamo kay mga pakitan-tawo lang!	Magikapu kam maski ten naani moy hidi ten pangrikadu hidi.
MAT_023_0044	Nagatindog kamon mga rulubngan san mga propeta kag ginadikuraran an mga monumento san mga kasadto na matanos na tawo.	Peru linimon moy bi en mas mahalaga hidi a adal a ked ten Kautusan, kona ten katarungan, habag, sakay katapatan.
MAT_023_0045	An ginasabi niyo, Kun buhay na kami sa panahon san amon mga kalulululuhi, dili gayod kami nadamay sa mga nagpatay san mga propeta!	Tama la a gamitn moy iyud peru awan dapat a kalimunan en agum.
MAT_023_0046	Kaya kamo man gihapon an nagatestigo kontra sa iyo sadiri na kamo mga lahi san nagpapatay sa mga propeta!	Sikam a burk a tagagiyya!
MAT_023_0047	Sige, tapusa na lang niyo an maraot na gintunaan san iyo mga kalulululuhi.	Saran moy en insektu hidi ten inumn moy, peru itlmok moy bi en kamelyu!
MAT_023_0048	Mga sawa kamo kag mga lahi sani!	Kakakagbi kam a tagapagtoldu hidi nen Kautusan sakay sikam a Pariseo hidi!
MAT_023_0049	Kakastiguhon kamo san Dios sa impyerno.	Magkukunwari kam!
MAT_023_0050	Pan-o kamo makalibre sani?	ugasan moy en luwas nen tasa sakay penggan moy, peru ten disalad ay putat ti kasakiman sakay pagkamakasadili.
MAT_023_0051	Kun kaya ngani mapadara ako sin mga propeta, mga madunong na tawo kag mga paratukdo san Kasuguan na an iba sa inda iyo pagapatayon kag igapako sa krus.	Burk a Pariseo!
MAT_023_0052	An iba naman iyo pagalatiguhon sa mga sinagoga kag pagapasakitan sa mga kalungsudan.	Ugasan mu pa en disalad nen tasa sakay penggan, sakay magin malinis dn bi en luwas na!
MAT_023_0053	Dahilan sani may magaabot sa iyo na kastigo sa pagpatay san tanan na matanos na tawo sa kinab-an magtuna sa pagpatay sa waran sala na si Abel hasta sa pagpatay sa anak ni Baraquias na si Zacarias na iyo ginpatay sa katung-anan san pinakabanal na lugar sa templo kag san altar.	Kakakagbi kam a tagapagtoldu hidi nen Kautusan sakay sikam a Pariseo hidi!
MAT_023_0054	Ginasiguro ko sa iyo na ini tanan mangyayari sa mga tawo na nabubuhay yana.	Magkukunwari kam!
MAT_023_0055	Mga taga-Jerusalem!	Kumn kam a en lbbng a pininturan ti mapudew, maganda ten luwas na.
MAT_023_0056	Mga taga-Jerusalem!	Peru ten disalad ay putat ti bungu sakay atanan a madingt.
MAT_023_0057	Marasa pa na ginapatay niyo an mga propeta kag ginabato idton mga ginsugo sa iyo san Dios!	Kona kam han!
MAT_023_0058	Kadamo na beses ngani na ako naghandom na tipunon kamo pareho san umagak na ginatiripon an iya mga piso sa idalom san iya mga pakpak pero ginhabuan niyo!	Ten pangileng ay mgkabait kam a tolay.
MAT_023_0059	Bahala na kamo kay pagapabayaan an iyo kabalayan kag dili na pagaistaran.	Peru disalad ay putat kam ti pgkukunwari sakay kadukssan.
MAT_023_0060	Tandaan an masasabi ko na sa iyo: dili na niyo ako makikita gihapon hasta na magsabi kamon, Palabihon lugod san Dios an nagapakadi sa ngaran san Ginoo!	Kakakagbi kam a tagapagtoldu hidi nen Kautusan sakay sikam a Pariseo hidi!
MAT_023_0061	,	Magkukunwari kam!
MAT_023_0062	<MISSING TRANSLATION>	Naggamet kam ti mgkaganda a pglbbngngan nen propeta hidi tenhud, sakay pinaganda moy en pglbbngngan nen mgkabait hidi a tolay.
MAT_023_0063	<MISSING TRANSLATION>	Sakay kkkagiyn moy a, Ni biyag kami la ten panahun nen ninunu mi hidi, ay awan kami nakuwan kaguman a nangbunu ten propeta hidi.
MAT_023_0064	<MISSING TRANSLATION>	Kaya gapu ti kinagi moyen, ay sikamon a mismu en nangpatunay a anak kam nen nangbunu hidi ten propeta hidi!
MAT_023_0065	<MISSING TRANSLATION>	Hala sigi!
MAT_023_0066	<MISSING TRANSLATION>	Tapusn moy en sinapulan nen ninunu moy hidi!
MAT_023_0067	<MISSING TRANSLATION>	Sikam a lahi hidi ni biklat!
MAT_023_0068	<MISSING TRANSLATION>	Awan moy maginanan en parusa moy ti impiyerno!
MAT_023_0069	<MISSING TRANSLATION>	Kaya mngpaangayk han dikomoy ti propeta hidi, mgkatalinu a tolay sakay tagapagtoldu hidi!
MAT_023_0070	<MISSING TRANSLATION>	Bunuwn moy en agum, sakay en agum ay ipaku moy ten kudus.
MAT_023_0071	<MISSING TRANSLATION>	En agum ay blbggn moy ten sinagoga moy hidi, sakay usign moy hidi ten banu-banuwan.
MAT_023_0072	<MISSING TRANSLATION>	Kaya pagtknangan kam nen parusa nen kkkabunu nen atanan a matuwid a tolay ti munduwiday.
MAT_023_0073	<MISSING TRANSLATION>	Sapul ten pngbunu knni Abel a awan ti kasalanan.
MAT_023_0074	<MISSING TRANSLATION>	Hanggan ten pngbunu knni Zacarias a anak ni Baraquias a binunu moy ten pag-itan nen pgtutudan ti alay ten Templo.
MAT_023_0075	<MISSING TRANSLATION>	Kagiyn ku dikomoy, a pagtknangan nen parusa en tolay hidi nadid a panahun gapu ti atananid a iyd.
MAT_023_0076	<MISSING TRANSLATION>	Sikam a taga-Jerusalem hidi!
MAT_023_0077	<MISSING TRANSLATION>	Bbbunuwn moy en propeta hidi, sakay bbbatuwn moy en inutusan hidi nen Diyos a angay dikomoy!
MAT_023_0078	<MISSING TRANSLATION>	Pumensangan ku dn a gustu a puronn en anak mu hidi a kona ten pnglkkp nen inahin a manok ten sepsep na hidi.
MAT_023_0079	<MISSING TRANSLATION>	Peru umd kam!
MAT_023_0080	<MISSING TRANSLATION>	Kaya en Templo moy ay mapabayan, awan ti mamgyan.
MAT_023_0081	<MISSING TRANSLATION>	Kagiyn ku dikomoy, a awank moy dn keketan hanggan ni dumemt en odas a kagiyn moy a, Pagpalan en dumddadedemt ten ngaran nen Panginoon!
MAT_024_0001	Paghali ni Jesus sa templo, nagharalapit an mga disipulos agod ipakita sa iya na matahom ini.	Lummakad ti Jesus ten Templo.
MAT_024_0002	Pero sinabat niya sinda, Nakikita niyo ini tanan?	Mentras a maglakad siya ay ummadeni dikona en disepulus na hidi sakay intoldu di dikona en bilay hidi ten laguwerta nen Templo.
MAT_024_0003	Ginasiguro ko sa iyo na waran nagaturumbawan na bato didi na mabibilin ni usad kay an tanan maruruba.	Peru kinagi na dikodi, Namalas moy i bilayid a hidi iyn!
MAT_024_0004	San nakaingkod si Jesus sa may Bukid San Kaolibohan nagkaradto sa iya an mga disipulos na sinda-sinda lang tapos nagsabi, Sabihi kami kun san-o ini mangyayari kag nano an tanda na igapakita san imo pagbalik kag san katapusan san kinab-an.	Tatarudan i kagiyn kuwidi!
MAT_024_0005	Nagsabat si Jesus, Maglikay gayod kamo na dili maluko san sin-o man, kay damo an magaabot na masambit san ngaran ko kag magaangkon, Ako an Cristo.	Dumemt en panahun a awan han ti batu a tumttopu ten kaparehu na a batu.
MAT_024_0006	Kaya damo na mga tawo an pagalukuhon ninda.	Atanan ay makuray-kuray!
MAT_024_0007	Ayaw kamo pagkahandal sa mga barita na may mga gyera o mga nagasabi-sabi na may gyera na maabot.	Dikona a mggetnud ti Jesus ten Bukid nen Olibo hidi, ay pasekretu a ummadeni dikona en disepulus na hidi sakay nagtanung, Nikan a mangyari i bagayid a hidi iyd?
MAT_024_0008	Dapat ini mangyari pero dili pa ina an katapusan.	nya i maariyid a senyal a paketan ten kssoli mu a ruway sakay ten katapusan ni munduwiday?
MAT_024_0009	Magagyerera pa man an mga nasyon kag an mga kahadian naman magapauruataki.	Tummbbig ti Jesus, Mangilag kam tnni awan kam metawtaw nen deyaman!
MAT_024_0010	Magkakaigwa sin grabe na gutom kag mga paglinog sa damon lugar.	Gapu makpal a lumitaw a magkagi a, Sikn en Cristo!
MAT_024_0011	Ini tanan pagtuna pa lang san kalisudan na bagan pagsakit sa pag-anak.	Makpal en metawtaw di.
MAT_024_0012	Tapos dadakupon kamo kag iintriga agod kastiguhon kag ipapatay.	Makasanig kam ti labanan sakay makabareta ti gera ti iba a lugar.
MAT_024_0013	Pagakabadlian man kamo san katawuhan san tanan na nasyon dahilan sa akon.	Dyan kam mabalisa dapat a mangyari hidi iyd.
MAT_024_0014	Sani na panahon may damo na mawawaraan sin pagsarig.	Peru bakn palla a iyd en katapusan ni munduwiday.
MAT_024_0015	May mga magapaturutraydoran kag magaururitan sa kada usad.	Maglaban-laban en bansa hidi, kona bi hud en kahariyan ten kaparehu na a kahariyan.
MAT_024_0016	Damon maruluwas na mga buwaon na mga propeta.	Magkahud ti alp sakay maglinug ti iba-iba a lugar.
MAT_024_0017	Damo sindan pagalukuhon kag dahilan sa paglukop san karautan sa kinab-an mawawara an pagkamuot san haros tanan na mga tawo sa Dios.	Atananid a iyd ay sapul palla nen pghirap a kona ten magenak.
MAT_024_0018	Pero masasalbar an may masarig na pagtuod hasta sa katapusan san buhay.	Ti panahunid a iyud ay dikppn di kam, pahirapan sakay bunuwn.
MAT_024_0019	Igapahayag man sa bilog na kinab-an ini na Maayo Na Barita manungod san kahadian agod makabati an tanan na katawuhan.	Sakay kaiyamutan kam nen atanan gapu dikoku.
MAT_024_0020	Sani pa lang mangyayari an katapusan.	Makpal en mangadg ten pnnampalataya di ti panahunid a iyud.
MAT_024_0021	Niyan kasadto pa ginpahayag san propeta na si Daniel an manungod san bagay na mauuritan gayod san Dios kag magapasira sa tawo.	Mamagiyamutan en balang essa sakay mamgpasubuwan.
MAT_024_0022	Dapat gayod na masabutan ini san nagabasa.	Sakay makpal bi a lumitaw a awan tatarudan a propeta, sakay itawtaw di en makpal a tolay.
MAT_024_0023	Pakakita niyo na ini nakatungtong na sa banal na lugar, dapat magdulag na sa mga kabukidan idton adto sa Judea.	Gapu ten kkkakpal nen kadukssan ay manglamig en pgmahal nen kakpalan.
MAT_024_0024	Kun may tawo na adto sa atop dili na siya dapat maglusad pa agod magkuha san iya mga garamiton.	Peru en manatili a tapat hanggan ten katapusan ay maligtas.
MAT_024_0025	Kun may tawo naman na adto na sa uma, dili na gayod siya dapat mag-uli pa para magkuha san iya bado.	Sakay ipangaral en Maganda a Bareta tungkul ten pghari nen Diyos ti buuwiday a mundu, tnni masanig nen atanan a bansa.
MAT_024_0026	Kun sugad kamakaluluoy man sadton mga budos kag may mga ginapadudo pag-abot sana na panahon!	Sakay dumemt dn en katapusan.
MAT_024_0027	Mangadyi kamo na an iyo pagdulag dili makatagbo na tighagkutan o Adlaw San Pagpahuway.	Intendiyn moy iyd ti mapiyya: ni ketan moy dn a mangyari ten Banal a Lugar en tunay ti duks a gamet a awan ti kaparehu a kinagi ni propeta Daniel, ay en ked hidi ti Judea ay dapat a guminan dn ten bukid hidi.
MAT_024_0028	Nasabi ko ini kay sana na panahon magkakaigwa sin grabe na pagtios an katawuhan na dili pa nabatyagan tuna san katuna-tunai san kinab-an hasta yana kag dili na mangyayari gihapon hasta na lang.	En ked ten bubungan ay dyan dn magabala a mngngay ti nyaman ten disalad nen bilay na.
MAT_024_0029	Mala ngani kun wara pagpahalip-uta san Ginoo ina na mga adlaw wara gayod sin mabibilin na buhay.	Sakay en ked ten uma na ay dyan dn umuli para mngngay ti pagalikbkb na.
MAT_024_0030	Pero alang-alang sa iya mga pinili pinahalip-ot niya ina.	Kakakagbi en mgkabuktet hidi sakay en tehud hidi a anak a sumusu ti aldewid a hidi iyud!
MAT_024_0031	Kun may nagasabi sa iyo sana na panahon na, Kitaa, adi an Cristo!	Ipagdasal moy a en kgginan moy ay awan metaun ti skdgnen sakay Aldew ni Kimang.
MAT_024_0032	o Kitaa, adto siya!	Gapu ti panahunid a iyud ay magdanas en atanan a tolay ti dikl a kahirapan a awan palla naranasan sapul dikona lalangn i munduwiday a hanggan nadid.
MAT_024_0033	ayaw pagtuod sana.	Sakay awan dn iyud mangyari a ruway.
MAT_024_0034	Nasabi ko ini kay damo an maruluwas na magapatuod na mga Cristo kag mga propeta sinda.	Sakay ni awan paaperitn nen Diyos i aldewid a hidi iyud ay awan ti maburay a tolay.
MAT_024_0035	Makakahimo sinda sin mga makangangawa na mga bagay kag mga milagro agod makaluko bisan sa mga pinili san Dios kun mahimo ninda.	Peru alang-alang ten pinili na hidi ay paaperitn nen Diyos i aldewid a hidi iyud.
MAT_024_0036	Pamatii gayod kay ginpadaanan ta na kamo antes pa ini mangyari.	Sakay ni tehud a magkagi dikomoy a, En Cristo laid!
MAT_024_0037	Kun magsabi sinda sa iyo, Kitaa, adto siya sa disyerto, ayaw kamo pagkadto didto.	oni Ked siya hudi!
MAT_024_0038	Kun magsabi naman sinda, Kitaa, adi siya nagatago, dili man kamo magtuod, kay pareho san kilat na nagaidlap sa sirangan hasta sa kalundan an pag-abot ko na Anak San Tawo.	ay dyan kam maniwala.
MAT_024_0039	Mangyayari gayod ini pareho san pagtiripon san mga uwak kun diin may patay.	Gapu tehud a lumitaw a awan tatarudan a Mesias, sakay awan tatarudan a propeta.
MAT_024_0040	Pakatapos lang san mga patios sana na mga adlaw pagapadulumon an adlaw, mawawar-an sin pawa an bulan, magakahurulog an mga bituon sa langit kag an mga makagagahom sa kalangitan pagauy-ugon.	Mngpeta hidi ti senyales sakay makataka hidi a himala, tnni itawtaw di en makpal pati en pinili hidi nen Diyos.
MAT_024_0041	Sana mismo maganguruyngoy an tanan na katawuhan san kinab-an kay makikita ninda sa langit an tanda ko na Anak San Tawo.	Tandaan moy, indipalongu ku dn iyd a ingkagi dikomoy tnni makapaghanda kam.
MAT_024_0042	Taud-taod magaabot ako na nakatungtong sa mga dampog sa langit kag makikita san mga tawo na may gahom ako kag masilaw gayod na glorya.	Kaya ni kagiyn di a, Ked siya ti parangud, dyan kam angay haud.
MAT_024_0043	Tapos sa makusog na tunog san trumpita susuguon ko an akon mga anghel na tiripunon an akon mga pinili na katawuhan hali sa bilog na kinab-an.	Ni kagiyn di a, Ked siya disddp, dyan kam maniwala.
MAT_024_0044	Dapat kamo makaaram sin leksyon hali sa puno san kahoy na ginatawag higera.	Gapu ni sakonya a kabilis en kilat ti sikatan a mangdemlag hanggan ti sarmman, ay kona bi hud en kddemt nen Anak nen Tolay.
MAT_024_0045	Pagsaringsing san mga sanga sani kag pag-uruslot san mga dahon naaaraman niyo na halapit na an kwaresma didi sa aton.	Ni hdya i pppgyananid nen bangkay ay ked bi hud en wakwak hidi.
MAT_024_0046	Sugad man kun makita niyo idton tanan na mga pangyayari, maaaraman niyo na halapit na ako mag-abot, bagan ada na lang gayod sa pwertahan.	Kttapos ni panahunid a iyud ni kahirapan, ay dumiklm en aldew, sakay awan dn dumemlag en bulan.
MAT_024_0047	Ginasiguro ko sa iyo na mangyayari idton tanan antes na magkamaratay an mga tawo na nabuhay yana.	Mgkaragrag en biton hidi dilanget, sakay mayang en kapangyariyan hidi ten kalawakan.
MAT_024_0048	An langit kag duta mawawara pero magapadayon hasta na lang an akon mga surmaton.	Sakay lumitaw dn en senyal nen Anak nen Tolay dilanget.
MAT_024_0049	Nagpadayon si Jesus, Niyan manungod san oras kag adlaw san akon pagbalik waran iba na maaram kundi an Ama lang.	Magkahud ti kalungkutan en atanan a tolay ti munduwiday pkketa di ten Anak nen Tolay a ked ten panganurin.
MAT_024_0050	Bisan ngani an mga anghel sa langit kag ako mismo na iya anak dili maaram.	Dumemt siya a tehud a dakila a kapangyariyan sakay dikl a karangalan.
MAT_024_0051	Pero makapareho san kamutangan san kapanahunan ni Noe an kamutangan didi sa kinab-an pagbalik ko na Anak San Tawo.	Sakay ten kttnnug nen trumpeta ti mabegsk ay utusan na en anghel na hidi ten atanan a suluk ni munduwiday, puronn di en atanan a tolay a pinili nen Diyos ten bawat lugar.
MAT_024_0052	Sadto na panahon antes nagbaha an kinab-an wara pag-intyindiha san mga tawo.	Ilingn moy en adal ten kayu a igos; kapag ni sumariwa en pinget na hidi sakay magduun ay makagi moy a adeni dn a kssinag.
MAT_024_0053	Adlaw-adlaw nagakaraon sinda, nagairinom kag kun minsan nagaarasawa hasta sa adlaw na nag-sulod si Noe sadton sarakyan sa tubig na ginatawag arka.	Kona labi hud, ni ketan moy dn i atananid a iyd, ay makagi moy a adeni dn en kssoli na, kumn a pasddp dn ten pintuwan.
MAT_024_0054	Wara ninda namangnuhi an mangyayari hasta na bumuhos an baha kag inanod sinda tanan.	Kagiyn ku dikomoy, mangyari i atananid a iyd bagu a matay en tolay hidi a biyag nadid.
MAT_024_0055	Sugad man sani an kamutangan sa pag-abot ko na Anak San Tawo.	Mawan en langet ay ten luta, peru en upos ku ay manatili a awan ti katapusan.
MAT_024_0056	Sana man mismo may duha na lalaki na nagatrabaho sa umahan.	Peru awan ti makatukoy ten aldew ay ten odas a mangyari iyd.
MAT_024_0057	Kukuhaon an usad kag an iya kaupod ibibilin.	Magin en anghel hidi dilanget oni en Anak ay awan makatukoy, nan en Ama la.
MAT_024_0058	May duha naman na babayi na nagagiling.	En kddemt nen Anak nen Tolay ay magkakona ten kddemt nen lonsu ten panahun ni Noe.
MAT_024_0059	Kukuhaon an usad kag an iya kaupod ibibilin.	Ti panahunid a iyud ay mamagkainan, mamaginoman, sakay mamagkabingaan en tolay hidi.
MAT_024_0060	Kaya magbantay kamo kay dili niyo aram kun san-o maabot an iyo Ginoo.	Hanggan dikona a sumakay dn ti Noe ten barku.
MAT_024_0061	Tandai ini: kun may tag-iya san balay na aram an oras pagkagab-i na magaabot an makawat, magabantay gayod siya kag dili niya pagatugutan na masulod an iya balay.	Kaya dummemt en lonsu a awan hidi ti nangmalayan, sakay ngkalims hidi a atanan.
MAT_024_0062	Kaya kamo man dapat na pirme magbantay kay magaabot ako na Anak San Tawo sa oras na dili niyo ginalauman.	Kona labi hud i mangyariyid ten kddemt nen Anak nen Tolay.
MAT_024_0063	Niyan kun sin-o man an matinumanon kag madunong na suruguon, siya an ginpaniwalaan san iya amo sa iba pa na mga suruguon agod magpakaon sa inda sa tama na oras.	Ti panahunid a iyud, ay tehud a duwwa a lllaki a magtarabahu ten uma di; maalap en essa sakay mawarak en essa.
MAT_024_0064	Kaya malipay ina na suruguon kun ina an ginahimo niya pagbalik san iya amo.	Tehud a duwwa bbbi a maggiling; maalap en essa sakay mawarak en essa.
MAT_024_0065	Ginasiguro ko sa iyo na igapaniwala sa iya san amo an tanan niya na kasadirihan.	Kaya humanda kam gapu awan moy tukoy ni nikan a dumemt en Panginoon moy.
MAT_024_0066	Pero kun maraot ina na suruguon, iisipon niya, Madudugay pa an akon amo.	Tandaan moy iddi: ni tukoy la nen pinunu nen sabilay ni nya a odas ten gibi a dumemt en mgtakaw, ay magbantay siya sakay awan na pabayan a masddp en bilay na.
MAT_024_0067	Kaya pagabalbagon an iya mga kapwa suruguon, tapos makikaon kag makiinuman kaupod san mga parahubog.	Kaya dapat kam bi a magin handa, gapu dumemt en Anak nen Tolay ten odas a awan moy inasaan.
MAT_024_0068	Tapos sa adlaw na dili niya ginalauman magaabot an iya amo sa oras na dili niya aram.	Ni deyaman en matapat sakay matalinu ten tagapagserbi hidi ay siya i pamahalannid nen amu di ten agum a tagapagserbi.
MAT_024_0069	Didi kakastiguhon siya kag ibibiyo sa mga pakitan-tawo lang.	Siya en mangatd dikodi ti pagkain ten tama a panahun.
MAT_024_0070	Didto maganguruyngoy an mga tawo kag magararagot an inda mga ngipon sa kasakit.	Pinagpala i tagapagserbiyid a iyud ni demttan siya nen amu na a saiyud i gamitn naid!
MAT_024_0071	<MISSING TRANSLATION>	Kagiyn ku dikomoy, a gamitn siya nen amu na a mamahala ten atanan a ari-ariyan na.
MAT_024_0072	<MISSING TRANSLATION>	Peru ni kagiyn ni tagapagserbiyid a iyud a, Malay padi a sumoli en amu ku.
MAT_024_0073	<MISSING TRANSLATION>	Kaya sapulan na a bulbugn en kaparehu na hidi a tagapagserbi.
MAT_024_0074	<MISSING TRANSLATION>	Sakay mkpagkainan siya, sakay mkpaginoman ten lasinggeru hidi.
MAT_024_0075	<MISSING TRANSLATION>	Sumoli en amu ni tagapagserbiyid a iyud ten aldew a awan na inasaan, sakay ten odas a awan na tukoy.
MAT_024_0076	<MISSING TRANSLATION>	Sakay parusaan siya nen amu na ti mahigpit, sakay ipisan na siya ten magkukunwari hidi.
MAT_024_0077	<MISSING TRANSLATION>	Haud siya a mgsasangitn sakay mggaaduyn.
MAT_025_0001	Nagpadayon si Jesus, Sana na panahon san pagbalik ko an pagsulod sa kahadian san langit pareho san napulo na abay na kadaragahan na nagruluwas agod sugaton an karaslon na lalaki.	En kahariyan dilanget ay kona ten sapulu a dalaga a tehud a manga tawid a simbuwan, angay hidi tumagbu ten lllaki a ikasal.
MAT_025_0002	Nagdara man sinda san inda mga ilawan.	En limma dikodi ay mangmang sakay en limma ay mgkatalinu.
MAT_025_0003	Lima sa inda an mga patal kag lima an mga madunong.	En limma a mangmang ay tehud a manga simbuwan, peru awan hidi nangtawid ti riserba di a langis a pangask di ten simbu di.
MAT_025_0004	An mga patal may dara na mga ilawan pero wara magdaran risirba na lana.	Samantala en limma a mgkatalinu ay nagtawid ti riserba bukud pa ten ked ten simbu di.
MAT_025_0005	An mga madunong naman may dara man na mga ilawan, amo man an puno na surudlan san lana.	Minaatrasadu en kddemt nen lllaki a ikasal kaya minagtongka hidi sakay minetidug a atanan.
MAT_025_0006	Nadugay an karaslon na lalaki kaya inabot sin kapirawon an mga daraga kag nagkaraturog an tanan.	Peru dikona hatinggabi dn ay tehud a pinumkraw, Ked dn en lllaki a ikasal!
MAT_025_0007	San matungan gab-i na may nagsiyak, Adi na an karaslon na lalaki!	Tagbuwn moy dn!
MAT_025_0008	Luwas na kamo agod sugaton siya!	Pagdaka a ummikat en sapulu a dalaga sakay hinusay di en simbuwan di hidi.
MAT_025_0009	Kaya nagbarangon an mga daraga tapos ginpreparar an inda mga ilawan.	Kinagi nen mangmang hidi ten mgkatalinu, tdenan moy kami pay ti langis moyen, maadp dn i simbuwan miyiday hidi.
MAT_025_0010	Didi naghangyo an mga iba sa mga madunong, Hatagi man kami san iyo lana kay mapaparong na an amon ilawan.	Bakay awan dn maghustu dikotam a atanan, mas maganda pa ni angay kam dlla mamali ti tindaanon ti para kao moy, tbbig nen mgkatalinu hidi.
MAT_025_0011	Pero nagsabat an mga madunong, Basi dili makaigo sa aton tanan.	Kaya angay namali en limma a mangmang.
MAT_025_0012	Mas maayo pa na kumadto kamo sa nagabaligya kag magbakal san para sa iyo.	Mentras a mamali hidi, ay dummemt en lllaki a ikasal.
MAT_025_0013	Nakahali lang sinda agod magbakal sin lana san mag-abot an karaslon na lalaki.	Nakaguman na a summddp ten kasalan en limma a nakahanda, sakay insiradu en pintuwan.
MAT_025_0014	Idton mga preparado nakaupod sa iya pagsulod sa ponsya san kasalan, tapos sinirahan an pwertahan.	Kttapos, ay dummemt bi en limma a mangmang.
MAT_025_0015	Taud-taod nag-abot naman an iba na mga abay na nagatarawag, Sir, Sir, abrihi man kami.	Magpkraw hidi, Panginoon, pasddppn mu kami!
MAT_025_0016	Pero ginsabat san karaslon na lalaki, Dili ini maabri kay dili ta gayod kamo kilala.	Peru tummbbig siya, Tatarudan i kagiyn kuwidi dikomoy, awan takam matenggi.
MAT_025_0017	, Tapos ginsabihan sinda ni Jesus, Magin maikmat gayod kamo pareho sadton mga madunong kay dili niyo aram an adlaw o an oras san akon pagbalik.	Kttapos ay kinagi ni Jesus, Kaya ngani a magbantay kam, gapu awan moy tukoy en aldew ay ten odas.
MAT_025_0018	Nagpadayon si Jesus, Amo gihapon ini nakapareho sa tawo na mapakadto sa iba na lugar.	En kahariyan dilanget ay kona ten essa a tolay a magbiyahi.
MAT_025_0019	Antes maglakat ginpatawag niya an iya mga suruguon kag ginpaniwala sa inda an iya kapital.	Dinulaw na en tagapagserbi na hidi sakay inyentrega na dikodi en ari-ariyan na hidi.
MAT_025_0020	Ginhatagan niya an kada usad susog sa inda kakayahan sa pagnegosyo.	Intdenan na ti pilak en balang essa ayun ten kaya na.
MAT_025_0021	An una hinatagan niyan lima ka kwarta na oro, an ikaduha, duha ka kwarta na oro, kag an ikatulo, usad ka kwarta na oro.	En essa ay intdenan na ti limmang libu, en essa ay duwanglibu, sakay en essa ay sanglibu.
MAT_025_0022	Pakatapos lumakat na siya.	Kttapos ay lummakad dn siya.
MAT_025_0023	An ginhatagan sin lima ka kwarta na oro lumakat man dayon, tapos ginnegosyo kag nakaganansya sin lima pa.	Lummakad a pagdaka en nakatanggap ti limmang libu sakay innigosyu na.
MAT_025_0024	An nakabaton naman sin duha ka kwarta na oro amo man an ginhimo kag nakaganansya sin duha pa.	Sakay kinumita ti limmang libu pa.
MAT_025_0025	Pero an nakabaton sin usad ka kwarta na oro nag-uli, tapos nagbuho sa duta kag didto gintago an kwarta san iya amo.	Kona bi hud ten nakatanggap ti duwanglibu, sakay kinumita bi ti duwanglibu pa.
MAT_025_0026	Sa kadugayan, nagbalik an amo sadton mga suruguon kag ginkwenta an mga ginbilin sa inda.	Peru en nakatanggap ti sanglibu ay ingkali na ten luta en pilak nen amu na.
MAT_025_0027	Naghalapit an nakabaton sin lima ka kwarta na oro na dara an ganansya na lima pa.	Dikona makalipas en nalay a panahun ay dummemt en amu ni tagapagserbiyid a hidi iyud sakay nkpagkuwentaan dikodi.
MAT_025_0028	Tapos nagsumat siya, Sir, adi an lima ka kwarta na oro na ginbilin mo sa akon kag san ganansya pa na lima.	Ummadeni en nakatanggap ti limmang libu sakay kinagi na, Maistu, sadnnid en pilak mu a limmang libu sakay i limmang libu paidi a kinita ku.
MAT_025_0029	Didi sinabihan siya san iya amo, Maayo an ginhimo mo, masarig kag matinumanon na suruguon.	Kinagi nen amu na, Malalaki!
MAT_025_0030	Kay matinumanon ka sa pira na mga bagay, kaya ginapamahala ko sa imo an mas damo.	Matapat sakay mahusay a tagapagserbi!
MAT_025_0031	Kadi kag makiglipay ka kaupod ko na imo amo!	Gapu nagin matapat ka ten sabadit a halaga, ay pamahalan taka ti dikl a halaga.
MAT_025_0032	Tapos naghalapit man an ginbilinan niya sin duha ka kwarta na oro na nagasabi, Sir, adi man an ginbilin mo sa akon na duha ka kwarta kag san ganansya pa na duha.	Mkpagkasayaan ka dikoku.
MAT_025_0033	Didi ginsabihan man siya, Maayo an ginhimo mo, masarig kag matinumanon na suruguon.	Ummadeni bi en nakatanggap ti duwanglibu, sakay kinagi na, Maistu, sadnnid en pilak mu a duwanglibu a inyatd mu dikoku.
MAT_025_0034	Kay matinumanon ka sa pira na mga bagay, kaya igapamahala ko man sa imo an mas damo.	Sakay i duwanglibu paidi a kinita ku.
MAT_025_0035	Kadi kag makiglipay ka kaupod ko na imo amo!	Kinagi nen amu na, Malalaki!
MAT_025_0036	Idto naman na ginbilinan sin usad ka kwarta na oro naghalapit man na nagasabi, Sir, aram ko na maisog ka na tawo na nagaani san dili mo tinanom kag nagatipon san dili mo sinabwag.	Matapat sakay mahusay a tagapagserbi!
