id	source_text	target_text
LUK_008_0020	Waran nagasindi sin ilawan pakatapos ginatahuban agod dili makapawa o ginabutang sa sirong san katri kundi ginatungtong ina agod makita an kapawa sana san mga tawo na nagasurulod.	En ngkeragrag bi hidi ten kabatuwan ay en nakasanig hidi ten Upos sakay tinanggap di a masaya, peru awan iyud tummiim ten pusu di.
LUK_008_0021	Sugad sani, wara sin natago na dili mahahayag kag wara sin ginsikreto na dili maaaraman kag mahahayag man.	Awan la nalay a naniwala hidi, kddemt nen pagsubuk ay hinumiwalay hidi.
LUK_008_0022	Kaya pamati gayod sin maayo kay siya na igwa pagahatagan pa, pero an wara bisan sing-ano ka dyutay an ginahuna-huna niya na ada sa iya pagakuhaon pa.	En ngkeragrag bi hidi ten kalamonan a masaet ay en ngsanig hidi ten upos nen Diyos, peru dikona umalay, ay nadaig hidi nen kabalisaan hidi ti biyag, kayamanan sakay ten sor di a mapagustuwan ten nyaman a magustuwan di.
LUK_008_0023	Niyan, nagpakadto kan Jesus an iya iloy kag san mga kamaranghod na lalaki pero dili sinda nakaapiki tungod san kadamuan san tawo.	Kaya awan malutu en bunga di hidi.
LUK_008_0024	Kaya may nagsabi kan Jesus, Ada sa luwas an imo iloy kag mga kamaranghod na lalaki kay gusto makigkita sa imo.	Sakay en nesabug bi ten matabi a luta ay en ngsanig hidi ten upos nen Diyos sakay pinahalagaan di ten pusu di a matapat sakay malinis, sakay magbunga hidi gapu ten tiyaga di.
LUK_008_0025	Pero ginsabat niya sinda, An akon iloy kag mga kamaranghod na lalaki amo idton mga nagapamarati san surmaton san Dios kag nagatuman sani.	Awan ti tolay a magtab ti simbuwan sakay taklbban na ti timba oni isarok na ten katri.
LUK_008_0026	Usad sin adlaw sinabihan ni Jesus an iya mga disipulos, Hamos kita patabok san danaw.	Nan itupu na iyud ten talaga a pgtupuwan tnni mademlagan en sumddp hidi ten bilay.
LUK_008_0027	Kaya nagsakay siya sa dako na baruto kaurupod sinda kag nagpalawod.	Awan ti netagu a awan melantad, sakay awan ti lihim a awan mehayag.
LUK_008_0028	Taud-taod nakakaturog si Jesus.	Kaya husayn moy en pgsanig moy, gapu en tehud ay tdenan pa, peru en awan ay ibutan pa maski en inakala na a ked dikona.
LUK_008_0029	Sa katung-anan san danaw inabot sinda sin subasko kag may tubig na nakasulod na sa inda sarakyan.	Dummemt en ina sakay kkkapatkaka hidi ni Jesus, peru awan hidi makaadeni dikona gapu ten kakpal nen tolay.
LUK_008_0030	Nasa peligro gayod sinda.	Kaya tehud a nngkagi dikona a, Ked ti luwason a mgtakng en ina mu sakay en kkkapatkaka mu hidi, gustu di ka a ketan.
LUK_008_0031	Kaya gintulos ninda siya kag ginpukaw na nagasabi, Sir, Sir, malulunod na kita.	Peru kinagi ni Jesus, En mgsanig hidi sakay mangsunud ten upos nen Diyos, ay hidi i ina kuwid sakay kkkapatkaka ku.
LUK_008_0032	Nagbangon siya kag ginsugo an hangin kag an grabe na mga balod tapos nag-udong ini.	Nadid, ten essa a aldew ay summakay de Jesus ay ten disepulus na hidi ten abeng.
LUK_008_0033	Tapos malinaw na.	Kinagi na dikodi, Umarabes kitam dibelyu.
LUK_008_0034	Sinabihan niya sinda, Nano kay wara kamon pagsarig sa akon?	Kaya ummarabes ngani hidi.
LUK_008_0035	Nagkaharadlok sinda kag nagngalas, tapos nagapahurunga-hunga, Sin-o daw ini kay an hangin kag mga balod ngani nagasunod sa iya kun suguon niya?	Dikona pasiyaan dn hidi a maggaud ay netidug ti Jesus.
LUK_008_0036	Nagdungka sinda Jesus sa lugar san Geraseno na katabok san Galilea.	Nagabutan hidi ni mabegsk a bagyu, sakay sinddp dn ni limas en abeng di, kaya ngari-ngari dn hidi a omld.
LUK_008_0037	Paghaw-as pa lang ni Jesus, may nagsugat sa iya na tagalungsod na lalaki na nasudlan sin mga demonyo.	Kaya inadeniyan siya nen disepulus hidi sakay linukag di.
LUK_008_0038	Dugay na, wara ini siya nagabado o nagaistar sin balay kundi sa mga rulubngan na mga kweba.	Kinagi di, Panginoon, Panginoon, marombak kitamon!
LUK_008_0039	Pakakita lang niya kan Jesus sumiyak kag natumba sa atubangan niya.	Ummikat ti Jesus sakay pinaimang na en pars ay ten dddekl a tagmk.
LUK_008_0040	Pakatapos nagsurmaton sin makusog, Jesus, anak san Pinakalabaw na Dios, nano an pakilabot mo sa akon?	Ummimang ngani en pars ay ten tagmk sakay gummanda en panahun.
LUK_008_0041	Nakimaluoy ako sa imo, ayaw man ako pagpasakiti.	Nadid ay tinanung hidi ni Jesus, Hdya dn en pnnampalataya moy?
LUK_008_0042	Nakasabi sani an tawo kay ginmandahan na ni Jesus an malaw-ay na espirito na lumuwas sa lawas san tawo.	Peru nentengan hidi sakay nagtaka.
LUK_008_0043	Ini na espirito damo nan beses ginapakisay-kisay an tawo.	Kagi di ten balang essa, Deya wd iyd?
LUK_008_0044	Kaya, ginapabantayan, ginakadenahan kag ginapusasan sa tiil agod mapaukoy siya, pero iya ini ginapangbugto kag ginatabog siya san demonyo sa kabukidan.	Utusan na pati pars ay ti tagmk sakay sumunud dikona!
LUK_008_0045	Kaya ginhunga siya ni Jesus, Nano an ngaran mo?	Dummung hidi ten lugar nen Gergeseno hidi, a ked ten dibelyu ni Galilea.
LUK_008_0046	Nagsabat ini, Damo, kay damu-damo na mga demonyo an nagsulod sa iya.	Kawas ni Jesus ten abeng, ay tinagbu siya nen essa a lllaki a taga haud a sinddp ni dimonyo.
LUK_008_0047	Nakimaluoy sinda kan Jesus na dili sinda pagpalayason pakadto sa kahidaluman na waran sukol.	Nanalay dn siya a awan ti badu sakay awan dn ummuli nan ten pglbbngngan en pppgyanan na.
LUK_008_0048	Niyan, didto sa higad san bukid may damu-damo na mga baboy na nanginginaon.	Pkketa na knni Jesus ay pummkraw en lllaki, lummuhud ten atubengn ni Jesus sakay kinagi na ti mabegsk, Jesus Anak nen Kataasan a Diyos, nya i gustu muwid a gamitn dikoku?
LUK_008_0049	Pakakita sani nakimaluoy sa iya an mga demonyo na pasudlon na lang sinda sa mga baboy.	Ipkpgguron ku dikomu a dyank mu pahirapan!
LUK_008_0050	Kaya tinugutan niya sinda.	Kaya konahud en kinagi na ay gapu inutusan ni Jesus en maduks a ispiritu a lumuwas dikona.
LUK_008_0051	Pakatapos, an mga demonyo nagruluwas sa lawas san tawo kag nagsulod sa mga baboy.	Pirmi siya a sssaniban nen mgkaduks a ispiritu.
LUK_008_0052	Nagharabas ini pagdaralagan palusad sa pangpang, nagkahurulog sa danaw kag nagkarulumos.	Kaya maski ni pakabantayan di siya sakay punguwn di ti kadena en bsset na ay ten lima na ay bgsutn na la iyud.
LUK_008_0053	Pakakita san mga parabantay san kababuyan sa nangyari, nagdaralagan sinda palungsod kag ginpamarita an inda nakita sa lungsod kag sa mga baryo didto sa patalibod.	Iyangay siya nen maduks a ispiritu ten kaparangan.
LUK_008_0054	Kaya, nagkaradto an mga tawo para makita kun nano man gayod an nangyari.	Tinanung siya ni Jesus, nya i ngaran muwid?
LUK_008_0055	Pag-abot ninda kan Jesus nakita man ninda na nakaingkod sa may tiilan niya an tawo na ginluwasan san mga demonyo.	Batalyon, kagi na gapu makpal en dimonyo a summanib dikona.
LUK_008_0056	Adto na siya nakaliwan na kag maayo an kaisipan kaya nagkaharadlok an mga tawo.	Nadid, nkkekagbi en dimonyo hidi knni Jesus a dyan na hidi utusan a sumegbu ten bbut a awan ti katapusan ti kadsalad.
LUK_008_0057	Idto naman na mga nakakita amo an nag-istorya sa inda kun pan-o nag-ayo ini na tawo na nasudlan san mga demonyo.	Nadid, tehud a makpal a babuy a mamagsbbukan ten bumbbukid a adeni haud.
LUK_008_0058	Pakaaram ninda sani, an tanan na mga taga-Geraseno nagahangyo kan Jesus na maghali sa inda lugar kay nagkaharadlok gayod sinda.	Nkkekagbi en dimonyo hidi knni Jesus a pasddppn na hidi ten kababuyan, sakay pinayagan bi hidi ni Jesus.
LUK_008_0059	Kaya, nagsakay gihapon sinda Jesus sa inda sarakyan agod mag-uli.	Lummuwas ten tolay en dimonyo hidi sakay sinomdp hidi ten kababuyan.
LUK_008_0060	An tawo naman na ginluwasan san mga demonyo nakimaluoy kan Jesus na tugutan siya mag-upod pero ginpauli siya ni Jesus na sinabihan, Mag-uli ka sa iyo kag ipaaram mo sa tanan an kaayuhan na hinimo san Dios sa imo.	Pagdaka a namagginanan en kababuyan a padagson sakay tulos hidi a ngkatknig ten minalnu sakay ngkalims.
LUK_008_0061	Kaya, naglakat an tawo kag ginparapanumat niya sa tanan na katawuhan san syudad an hinimo sa iya ni Jesus.	Pkketa nen mggalaga hidi ten kababuyan ten nangyari, ay gumminan hidi sakay imbbbareta di iyud ten banuwan sakay ten babaryu.
LUK_008_0062	Pag-abot gihapon ni Jesus sa luyo san danaw malipayon na ginsugat siya san kadamuan kay adto na sinda nagapahurulat sa iya.	Kaya lummuwas en tolay hidi gapu gustu di a ilingn en nangyari.
LUK_008_0063	Taud-taod may nag-abot man na lalaki na an ngaran Jairo na usad na namumuno san sinagoga.	Kddemt di knni Jesus ay netan di en tolay a dati a sinddp nen dimonyo hidi.
LUK_008_0064	Lumuhod siya sa may tiilan ni Jesus kag nakimaluoy siya na kun mahimo na makakadto siya sa inda balay, kay an iya usad-usadi na anak na babayi, na dose anyos an edad, tikamatayon.	Nggetnud siya ten tttaknggan ni Jesus, nakabadu dn siya sakay mahusay dn en isip na.
LUK_008_0065	San pakadto na si Jesus, nagasurusuan an kadamuan.	Nentingan hidi a atanan.
LUK_008_0066	Didto may babayi na ginadugo sa sulod sin dose ka tuig kag wara pa man sin bisan sin-o na nakabulong sa iya.	Insaysay bi nen naketa hidi ten nangyari ten katolayan ni konya a nagpiyya en lllaki a dati a sinddp nen dimonyo hidi.
LUK_008_0067	Kaya nakisu-suan man siya sa may likudan ni Jesus kag gindutdot an sidsid san iya ginasul-ot, Insigida naudong dayon an pagparadugo sa iya.	Kinagi nen atanan nen Gergeseno hidi knni Jesus a lumakad dn siya ten banuwan di gapu tunay en nteng di.
LUK_008_0068	Paglingi ni Jesus naghunga siya, Sin-o an nagdutdot sa akon?	Kaya summakay dn ti Jesus ten abeng sakay lummakad.
LUK_008_0069	San magpaambot an tanan nagsurmaton si Pedro, Maestro, nano kay nakahunga ka na ada an katawuhan nagapatalibod kag nagadiris-ukan pakada sa imo?	Nadid, nkkekagbi knni Jesus en lllaki a linakadan nen dimonyo hidi a kinagi na, Mkkuyugk pay dikomu.
LUK_008_0070	Pero nagsabat si Jesus, Igwa gayod sin nagdutdot sa akon kay nabatyagan ko na may nagguwa sa akon na gahom.	Peru kinagi ni Jesus dikona, Kadmudn dibilay moy sakay ibareta mu en ginamet nen Diyos dikomu.
LUK_008_0071	Pakamalisyahi san babayi na dili gali siya makatago, naghalapit na nagapangudog, nagluhod sa may tiilan ni Jesus kag ginpahayag sa atubangan san mga tawo kun nano kay gindutdot niya si Jesus kag kun pan-o siya naayo sadto mismo.	Lummakad ngani en lllaki sakay imbbbareta na ten buu a banuwan en ginamet ni Jesus dikona.
LUK_008_0072	Kaya, ginsabihan siya ni Jesus, Tia, an imo pagtuod amo an nakaayo sa imo.	Dikona a nagsoli ti Jesus ten dibelyu, ay masaya siya a tinanggap nen katolayan gapu orayn di dn siya.
LUK_008_0073	Makalakat ka na sa kalinaw san isip.	Dummemt tenhud en essa a lllaki a Jairo en ngaran na, essa siya a pinunu ten sinagoga.
LUK_008_0074	Nagasurmaton pa si Jesus san may nag-abot na hali sa balay ni Jairo kag nagsumat, Sir, an imo anak patay na.	Lummuhud siya ten atubengn ni Jesus, sakay nkkekagbi a umangay ti Jesus ten bilay na.
LUK_008_0075	Siguro, dili mo na kinahanglan na samukon pa an Maestro.	Gapu magipepatay dn en eessa a anak na a bbbi, sapulu dn ay ti duwwa a taon en idad na.
LUK_008_0076	Pero san nabatian ini ni Jesus sinabihan niya si Jairo, Ayaw kahadlok, magtuod ka lang sa akon kag maaayo siya.	Mentras a maglakad ti Jesus a tamu ten bilay ni Jairo ay sssnsnnn siya nen makpal a tolay.
LUK_008_0077	San pag-abot ni Jesus sa balay ni Jairo wara siyan gintugutan na mag-upod sa iya sa sulod pwera lang kanda Pedro, Juan kag Santiago, kag san mga ginikanan san bata.	Ked bi haud en essa a bbbi a sapulu ay ti duwwa dn a taon a mgdadigiyn sakay awan mapagpiyya nen deyaman.
LUK_008_0078	Nagatarangis an tanan kag nagamundo sa nangyari sa bata.	Naubus dn en atanan a kabiyagan na gapu ti pgpapagamot.
LUK_008_0079	Pero nagsurmaton si Jesus, Udong na kamo pagtangis.	Ummadeni siya ten adggan ni Jesus sakay tinawidan na en garayan nen badu na.
LUK_008_0080	Dili siya patay kundi natuturog lang.	Pagdaka a ummimang en pgdadigi na.
LUK_008_0081	Pero gintarawhan siya kay aram ninda na patay na gayod an bata.	Tinanung hidi ni Jesus, Deya en nangtawid ten badu ku?
LUK_008_0082	An hinimo naman niya kinaptan an bata sa kamot kag tinawag, Anak, bumangon ka.	Ten dikona awan ti umamin ay kinagi ni Pedro, Panginoon, napalebutan ka ni tolayen hidi sakay sssnsnnn di ka!
LUK_008_0083	Nabuhay gihapon an bata kag insigida bumangon.	Peru kinagi ni Jesus, Tehud a nangtawid ten badu ku!
LUK_008_0084	Kaya nagsugo si Jesus na hatagan an bata sin makaon.	Nabati ku a tehud a kapangyariyan a lummuwas dikoku.
LUK_008_0085	Nangarat an mga ginikanan san bata, pero ginmandahan sinda ni Jesus na dili magpanumat bisan kanin-o san nangyari.	Dikona matukuyan nen bbbi a awan bali melihim en ginamet na, ay magpgpg siya a ummadeni knni Jesus sakay lummuhud ten atubengn na.
LUK_008_0086	<MISSING TRANSLATION>	Sakay kinagi na ten atanan a ked haud ni bakin tinawidan na en badu ni Jesus, sakay ni konya siya a nagpiyya a pagdaka.
LUK_008_0087	<MISSING TRANSLATION>	Kinagi ni Jesus dikona, Anak ku pinagpiyya ka nen pnnampalataya mu.
LUK_008_0088	<MISSING TRANSLATION>	Umuli ka a mapayapa.
LUK_008_0089	<MISSING TRANSLATION>	Mentras a magupos ti Jesus ay tehud a dummemt a essa lllaki a gubwat ten bilay ni Jairo.
LUK_008_0090	<MISSING TRANSLATION>	Patay dn en anak mu a bbbi dyan mu dn abalan i Maistuwen!
LUK_008_0091	<MISSING TRANSLATION>	kagi na knni Jairo.
LUK_008_0092	<MISSING TRANSLATION>	Dikona a nasanig iyud ni Jesus ay kinagi na knni Jairo, Dyan ka manteng, maniwala ka la ay magpiyya siya.
LUK_008_0093	<MISSING TRANSLATION>	Kddemt ni Jesus ten bilay, ay awan siya ti iba a ingkuyug ten sddp nan de Pedro, Juan, Santiago sakay en dddikl hidi nen dalagita.
LUK_008_0094	<MISSING TRANSLATION>	Mamagsangetan en atanan a ked haud sakay maglungkut ten patay.
LUK_008_0095	<MISSING TRANSLATION>	Peru kinagi ni Jesus, Dyan kam magsanget.
LUK_008_0096	<MISSING TRANSLATION>	Awan patay i anaken, nan tidug la.
LUK_008_0097	<MISSING TRANSLATION>	Nagtawaan di ti Jesus gapu tukoy di a patay dn en dalagita.
LUK_008_0098	<MISSING TRANSLATION>	Peru tinawidan ni Jesus en lima na sakay kinagi na, Anak ku, umikat ka.
LUK_008_0099	<MISSING TRANSLATION>	Summoli en angs nen dalagita sakay pagdaka a ummikat.
LUK_008_0100	<MISSING TRANSLATION>	Kttapos ay pinaatd siya ni Jesus ti makan.
LUK_008_0101	<MISSING TRANSLATION>	Narknid en dddikl na hidi, peru imbilin ni Jesus dikodi a dyan di kagiyn maski kndeya en nangyari.
LUK_009_0001	Usad naman sin adlaw gintiripon ni Jesus an dose kag hinatagan sin gahom kag otoridad na makapaluwas san tanan na mga demonyo kag makabulong san mga masakiton.	Dinulaw ni Jesus en disepulus na hidi a sapulu ay ti duwwa, sakay intdenan na hidi ti kapangyariyan sakay karapatan a magpalayas ti dimonyo, sakay magpapiyya ten tehud hidi a saket.
LUK_009_0002	Tapos sinugo niya sinda para itukdo an manungod san kahadian san Dios kag magpangbulong.	Inutusan na hidi a angay mangaral tungkul ten pghari nen Diyos sakay magpapiyya ten tehud hidi a saket.
LUK_009_0003	Gintugon niya sinda, Ayaw pagdara sin nano pa man sa iyo paglakat bisan tungkod, surudlan, pagkaon o kwarta kag liwanan.	Sakay imbilin na dikodi a, Dyan kam magbalon ti maski ni nyaman ten angayan moy kona ti sarukud, hembeg, makan, pilak oni paglewasan.
LUK_009_0004	An sin-o man na panimalay na magapadayon sa iyo, didto na lang kamo mag-istar hasta na maghali kamo sana na lugar.	Mktulos kam ten bilay nen deyaman a mangtanggap dikomoy.
LUK_009_0005	Sadto naman na lungsod na dili magpadayon sa iyo paghali niyo sa inda taphuda anay an alpog sa iyo tiil bilang padaan na may paghusgar na maabot sa inda.	Mgyan kam la haud mentras awan kam palla lumakad ti banuwanid a iyud.
LUK_009_0006	Kaya nagralakat sinda kag nagpangburubaryo sa pagtukdo san Maayo Na Barita kag pagpamulong san katawuhan bisan diin.	Mara ni awan kam tanggapn nen tolay hidi ten essa a banuwan ay lumakad kam haud.
LUK_009_0007	Niyan nabaritaan ni Herodes na namumuno san Galilea an tanan na nangyayari manungod kan Jesus didto kaya nalisang siya kay basi nabuhay gihapon si Juan na Parabunyag susog sa ginasarabi san iba na mga tawo.	Peru bagu kam a lumakad ay ipagpag moy pa en alikabuk nen babsset moy, tanda iyud a tehud hidi a parusa ten awan di pngtanggap dikomoy.
LUK_009_0008	An iba man nagasarabi na si Elias nagpakita gihapon kag may iba pa gayod na nagasarabi na an usad san mga kasadto na mga propeta nabuhay gihapon.	Sakay lummakad en disepulus na hidi.
LUK_009_0009	Pero nagsurmaton si Herodes, Dili ako matuod na si Juan ini kay ginpapugutan ko siya, pero sin-o ini na akon nababaritaan?	Angay hidi nangaral ten babaryu tungkul ten Maganda a Bareta sakay pinagpiyya di en tehud hidi a saket ten atanan a lugar.
LUK_009_0010	Kaya mas lalo na nagahandom siya na makita si Jesus.	Nadid, nabareta ni Herodes a pinunu ti Galilea en atanan a nangyari.
LUK_009_0011	Pagbalik san mga apostoles ginsumatan ninda si Jesus san inda nagkahirimuan.	Naguluwan en isip na, gapu tehud a sangan a nagkagi a nabiyag a ruway ti Juan a Mgbinyag.
LUK_009_0012	Tapos gin-agda niya ini na sinda-sinda lang pakadto sa usad na lungsod na ginatawag Betsaida.	Tehud bi a sangan a nagkagi a lummitaw ti Elias, sakay kagi bi nen agum ay nabiyag a ruway en essa ten propeta hidi tenhud pa a panahun.
LUK_009_0013	Pakaaram san katawuhan, nagsurunod man sinda kan Jesus.	Kaya kinagi ni Herodes, Pinaputol ku dn en ulu ni Juan, peru deya wd nabareta kuwiday?
LUK_009_0014	Kaya, gin-agda niya sinda kag gin-istoryahan manungod sa kahadian san Dios.	Makpalk a nasanig tungkul dikona.
LUK_009_0015	Ginbulong man niya idton nagakinahanglan na mabulong.	Kaya pinilit ni Herodes a ketan ti Jesus.
LUK_009_0016	San takop na an kahapunanon nagharalapit sa iya an dose kag nagsabi, Pahalia na an mga tawo agod makakadto sa mga baryo kag mga sitio para makapanghanap sin maistaran kag sin makaon kay adi kita didi sa mamingaw na lugar.	Nadid, dikona nagsoli en apostol hidi ay kinagi di knni Jesus en atanan a ginamet di.
LUK_009_0017	Pero nagsabat lugod si Jesus, Hatagi na lang niyo sindan makaon.	Kttapos ay ingkuyug hidi ni Jesus a ummangay ten banuwan a Betsaida.
LUK_009_0018	Pero nagreklamo sinda, Lima lang ka bilog na tinapay kag duha ka bilog na isda an amon dara pwera lang kun magbakal kita sin pagkaon para sani tanan na katawuhan.	Ummunud en tolay hidi dikona matukuyan di, sakay masaya hidi a tinanggap ni Jesus.
LUK_009_0019	Kay mga lima ka libo na kalalakihan an adto didto.	Tinolduwan na hidi tungkul ten pghari nen Diyos, sakay pinagpiyya na en tehud hidi a saket.
LUK_009_0020	Pero sinabihan niya an iya mga disipulos, Paingkuda sinda sin tigsurusingkwenta kada grupo.	Dikona a mgsasasarm dn en aldew ay ummadeni knni Jesus en disepulus na hidi a sapulu ay ti duwwa, sakay kinagi di dikona, Palakadn mu dn i tolayen hidi tnni umangay hidi ti a babaryuwen sakay uma, tnni makaaryok hidi ti makan di sakay matidugan.
LUK_009_0021	Sinunod ninda kag pinaingkod an tanan.	Ked kitam ti adeyuwidi a lugar a awan ti tolay.
LUK_009_0022	Tapos, kinuha ni Jesus an lima ka bilog na tinapay kag an duha ka bilog na isda, humangad siya sa langit kag nagpasalamat sa Dios.	Peru kinagi ni Jesus, Sikam i mangatddid ti makan dikodi.
LUK_009_0023	Pagkatapos gin-utud-utod ini kag gintunol sa iya mga disipulos agod ipanghatag sa mga tawo.	Kagi di ay, Awan kitam ti balon, lilimma la iddi a mommon a tinapay, sakay duwwa a ikan.
LUK_009_0024	Nagkaraon sinda tanan hasta na nagkaburusog.	Mamali kami beman para ti atanan diyen?
LUK_009_0025	Pakatapos gintipon san mga disipulos an sobra na dose pa ka bangkat.	Peru kinagi na ten disepulus na hidi, Paetnudn moy hidi a atanan ti tglalimmapulu balang essa a grupu.
LUK_009_0026	Usad sin adlaw san si Jesus sulo lang na nagapangadyi, naghalapit an iya mga disipulos.	Tehud a limmang libu en lllaki hidi a ked haud.
LUK_009_0027	Tapos nagsabi siya sa inda, Sumati daw niyo ako kun nano an pagkakilala sa akon san mga tawo.	Pinggetnud di ngani hidi a atanan.
LUK_009_0028	Nagsabat sinda, Sabi san iba na ikaw si Juan na parabunyag.	Kttapos ay inalap ni Jesus en limma a mommon a tinapay sakay en duwwa a ikan.
LUK_009_0029	An iba man na ikaw kuno si Elias, kag an iba pa gayod na ikaw kuno usad san mga kasadto na mga propeta na nabuhay gihapon.	Tummangad siya dilanget sakay nagpasalamat ten Diyos.
LUK_009_0030	Naghunga gihapon si Jesus, Pero kamo, nano an pagkakilala niyo sa akon?	Tinppeng-tppeng na iyud sakay inyatd na ten disepulus na hidi tnni itagtag di ten katolayan.
LUK_009_0031	Nagsabat si Pedro, Ikaw an Cristo san Dios.	Nakakan hidi a atanan sakay ngkabssug.
LUK_009_0032	Niyan, ginpadaanan gayod niya sinda na dili magpanumat bisan kanin-o man manungod sa iya.	Kttapos ay pinuron nen disepulus hidi en naburay sakay nakaputat hidi ti sapulu ay ti duwwa a lkba.
LUK_009_0033	Pakatapos ginsabihan pa niya sinda.	Nadid, dikona a pasiyaan a magdasal ti Jesus a mggeessa ay ummadeni dikona en disepulus na hidi.
LUK_009_0034	Dapat ako na Anak San Tawo magtios sin grabe.	Tinanung hidi ni Jesus, nya en palagay nen tolay hidi tungkul dikoku?
LUK_009_0035	Pagapaambutan san mga kamagurangan na namumuno san mga Judio, mga namumuno san kapadian kag mga paratukdo san Kasuguan, tapos papatayon pero sa ikatulo ka adlaw bubuhayon gihapon.	Deyak kan?
LUK_009_0036	Pagpadayon ni Jesus ginsabihan niya hasta an tanan, Kun may gusto mag-upod sa akon bilang disipulos ko, dili niya dapat sundon an sadiri niya na kabubut-on kundi sundon lugod an kaburut-on ko kag pas-anon an iya krus uruadlaw na amo an pagtios tungod sa akon.	Tummbbig hidi, Tehud a sangan a nagkagi a ti Juan a Mgbinyag ka kan.
LUK_009_0037	Nasabi ko ini kay an nagahandom masalbar an iya buhay para sa iya sadiri mawawar-an sani, pero an maghalad san iya buhay alang-alang sa akon masasalbar lugod sani.	Tehud bi a nagkagi a ti Elias ka kan, sakay kagi bi nen agum a nabiyag kan a ruway en essa ten propeta tenhud pa a panahun.
LUK_009_0038	Kay nano man an pakinabang san tawo kun mapasa iya an bilog na kinab-an kag an balyo sani amo an pagsuko o pagkawara san iya buhay?	Tinanung dmman hidi ni Jesus, Sikam, nya bi i makagi moyid tungkul dikoku?
LUK_009_0039	Syimpre wara gayod!	Kinagi ni Pedro, Siko en Cristo a impangaku nen Diyos!
LUK_009_0040	Sugad man kun may tawo na dili magaako sa akon kay ginakaalo niya ako kag san akon katukduan, ako na Anak San Tawo igakaalo man siya kag dili ko aakuon pag-abot ko sa akon glorya kag sa glorya man san akon Ama kag san mga banal na anghel.	Impakebibilin ni Jesus ten disepulus na hidi a dyan di iyud kagiyn maski kndeya.
LUK_009_0041	Ginasiguro ko sa iyo na igwa sin pira sa iyo na nagatindog didi na dili mapapatay hasta na makita an kahadian san Dios.	Sakay kinagi na pa dikodi, Magtiis pa ti dikl a hirap en Anak nen Tolay.
LUK_009_0042	Mga walo ka adlaw pakatapos niya pagsabi sani, gin-agda ni Jesus sinda Pedro, Juan kag Santiago pagsagka sa bukid para magpangadyi.	Itakwil siya nen pinunu hidi nen lahi ni Israel, nen pinunu hidi nen padi hidi, sakay nen mgtoldu hidi ten Kautusan.
LUK_009_0043	Myintras nagapangadyi siya didto, nag-iba an hitsura san iya bayhon kag nagsinggat gayod an iya bado sa kaputi.	Pabunu di siya peru ten katllu a aldew ay biyagn siya a ruway nen Diyos.
LUK_009_0044	Bigla na lang may duha na lalaki na nag-abot kag nakisurmaton sa iya.	Nadid, kinagi pa ni Jesus ten atanan a tolay, Ni deyaman en masor a sumunud dikoku ay kailangan a limunn na en para ten sadili na.
LUK_009_0045	Amo ini sinda Moises kag Elias.	Bklayn na en kudus na aldew-aldew sakay sumunud dikoku.
LUK_009_0046	Nagpakita ini na duha na may langitnon na glorya na nakasilaw bagan adlaw, kag nagsurmaton manungod sa pagtaliwan ni Jesus na mangyayari sa Jerusalem.	Gapu en tolay a maghangad a mngligtas ten sadili na a biyag ay siya i mawananid ti biyag.
LUK_009_0047	Niyan naman si Pedro kag san iya mga kaurupod mga maanok gayod an katurog pero pagmata ninda nakita an glorya ni Jesus kag an duha na lalaki na nagatindog kaupod niya.	Peru ni deyaman en mng-alay ten biyag na alang-alang dikoku ay magkahud ti biyag.
LUK_009_0048	San mahali na an duha, sinabihan ni Pedro si Jesus, Sir, maayo man na adi kita.	nya beman i pakinabangid nen tolay ni makao na man i buuwid a mundu, ni mepahamak labi en sadili na?
LUK_009_0049	Tugutan kami na magtindog didi sin tulo na kubung-kubong na usad sa imo, usad naman kan Moises kag usad pa kan Elias.	Ni ikasanikiyk moy sakay en upos ku hidi ay ikasaniki kam bi nen Anak nen Tolay ten kssoli na had a tehud a karangalan, sakay karangalan nen Ama sakay nen banal hidi a anghel.
LUK_009_0050	Dili niya namangnuhan an iya ginasabi.	Saiddi kagiyn kuwid dikomoy, tehud a sangan hddi dikomoy a awan matay mentras a awan di ketan en pghari nen Diyos.
LUK_009_0051	Myintras nagasurmaton pa siya may madakmol na dampog kag nahandungan sinda.	Kllipas nen sasimba kttapos na a kagiyn i bagayid a hidi iyd ay summangkay ti Jesus ten bukid tnni magdasal.
LUK_009_0052	San matahuban na nagkaharadlok sinda.	Ingkuyug na de Pedro, Juan sakay ti Santiago.
LUK_009_0053	Tapos, may nabati sinda na nagasurmaton hali sa dampog, Amo ini an akon Anak na ginpili ko.	Dikona pasiyaan siya a magdasal ay nagbagu en rupa na, sakay tunay ti pudew en sulot na a badu a magbanaag, sakay magdemlag.
LUK_009_0054	Pamatii niyo siya.	Kttapos ay bigla la a lummitaw en duwwa a lllaki, a de Moises ay ti Elias, dumddemlagan bi hidi a pummeta.
LUK_009_0055	Pakatapos sadto, nakita ninda na si Jesus na lang.	Nkpgguron hidi knni Jesus tungkul ten adeni dn a kkkatay na ti Jerusalem.
LUK_009_0056	Kaya, ginpasabuot san mga disipulos an inda nakita kag wara gayod sin ginsumatan sadto na kaurason.	Nadid, mahusay en tidug ni Pedro pati en kakagumanan na hidi, peru bigla hidi a nalukag.
LUK_009_0057	Pagkasunod na adlaw naglugsad na sinda hali sa bukid kag didto damu-damo na mga tawo an nagsugat kan Jesus.	Netan di ti Jesus a magdemlag ti makasili, kaguman en duwwa a lllaki a mkpgtakng dikona.
LUK_009_0058	Insigida may lalaki sa kadamuan na nagsiyak, Maestro, nakimaluoy ako sa imo, pakikita man tabi san akon bugtong na anak na lalaki.	Dikona palakad dn en duwwa a lllaki ay kinagi ni Pedro, Panginoon, maganda ta ked kami hddi.
