id	source_text	target_text
GEN_010_0031	Magumpisa ya king Mesa angga Sefar ing gabun a tutuknangan da, ing lugal a mabunduk king bandang aslagan.	<MISSING TRANSLATION>
GEN_010_0032	Oreti ding lahi nang Sem agpang karing pamilya ra at salita, gabun, at bansa.	<MISSING TRANSLATION>
GEN_010_0033	Ila deti ring lahi da ring anak nang Noe agpang karing pipumpunan da at bansa.	<MISSING TRANSLATION>
GEN_010_0034	Ila ding penibatan da ring miyayaliwang bansa keti king yatu kaybat nang milyari ning albug.	<MISSING TRANSLATION>
GEN_011_0001	Kanitang minunang panaun metung ya mu salita ing mabilug a yatu at paraparehu la mu ding amanung magagamit.	Noon, ang buong lupa ay iisa ang wika at magkakatulad ang salita.
GEN_011_0002	Kabang manintun lang pituknangan ding tau king bandang aslagan, miras la king lugal a patag king sakup ning Sinar at karin la menuknangan.	Sa kanilang paglalakbay sa silangan, nakatagpo sila ng isang kapatagan sa lupain ng Shinar, at sila'y tumira doon.
GEN_011_0003	Ngarang misabi-sabi, Tara, gawa tamung tisa at ilutu ta la king ornu.	At sinabi nila sa isa't isa, Halikayo!
GEN_011_0004	Ding tisa ilang peka batu ra at ing alketran ya ing peka semento ra.	Tayo'y gumawa ng mga tisa at ating lutuing mabuti.
GEN_011_0005	Tara, ngara, mitalakad tamu ngening metung a siudad at gawa tamung toreng miraras banua ba tamung maging pikabaluan at e misalbag king mabilug a yatu.	At ang kanilang bato ay tisa at alkitran ang kanilang semento.
GEN_011_0006	Tinipa ya ing Ginu ban lawan ne ing siudad at ing toreng telakad da ring tau.	Sinabi nila, Halikayo!
GEN_011_0007	Kanita sinabi na ning Ginu , Ngening misanmetung la at metung la salita agawa ra iti, e lumuat ala nang makasabat pa king buri dang gawan.	Magtayo tayo ng isang lunsod at isang tore na ang taluktok nito ay hanggang sa langit, at gumawa tayo ng pangalan para sa ating mga sarili, baka tayo magkawatak-watak sa ibabaw ng buong lupa.
GEN_011_0008	Mayap pa ing puntalan ta la at guluan a salita ban e la mikakaintindi.	Bumaba ang Panginoon upang tingnan ang lunsod at ang tore na itinayo ng mga anak ng mga tao.
GEN_011_0009	Ibat karin peniambulat na la ning Ginu king mabilug a yatu, at tiknangan deng tatalakad ing siudad.	At sinabi ng Panginoon , Tingnan ninyo, sila'y iisang bayan at may isang wika; at ito ay pasimula pa lamang ng kanilang gagawin, at ngayon, walang makakapigil sa anumang kanilang binabalak gawin.
GEN_011_0010	Ita ya ing sangkan nung inya inaus deng Babel ing lugal a ita uling karin ne giluan ning Ginu ing salita da ring tau ning mabilug a yatu at simbulat ding tau king mabilug a yatu.	Halikayo!
GEN_011_0011	Ila deti ring lahi nang Sem.	Tayo'y bumaba at ating guluhin ang kanilang wika, upang hindi nila maunawaan ang pananalita ng bawat isa.
GEN_011_0012	Kanitang dinalan yang banua i Sem ayanak ne i Arpaksad.	Kaya't ikinalat sila ng Panginoon mula roon sa ibabaw ng buong lupa, at huminto sila sa pagtatayo ng lunsod.
GEN_011_0013	Adua nang banua ing milabas kanita kaybat ning albug.	Kaya't ang ipinangalan dito ay Babel, sapagkat doon ay ginulo ng Panginoon ang wika ng buong lupa, at mula roon ay ikinalat sila ng Panginoon sa ibabaw ng buong lupa.
GEN_011_0014	Mebie ya pang limang dalan a banua i Sem kaybat nang mibait Arpaksad, at mika aliwa ya pang anak a lalaki ampon babai.	Ito ang mga salinlahi ni Sem.
GEN_011_0015	Kanitang atlu yang pulu't limang banua i Arpaksad ayanak ne i Sela.	May isandaang taong gulang si Sem nang maging anak si Arfaxad, dalawang taon pagkatapos ng baha.
GEN_011_0016	Mebie yang apat a ralan at atlung banua i Arpaksad kaybat nang mibait Sela, at mika aliwa ya pang anak a lalaki ampon babai.	Nabuhay si Sem ng limandaang taon pagkatapos na maipanganak si Arfaxad, at nagkaanak pa ng mga lalaki at mga babae.
GEN_011_0017	Kanitang atlu yang pulung banua i Sela ayanak ne i Eber.	Nang si Arfaxad ay tatlumpu't limang taon, naging anak niya si Shela.
GEN_011_0018	Mebie yang apat a ralan atlung banua i Sela kaybat nang mibait Eber, at mika aliwa ya pang anak a lalaki ampon babai.	Nabuhay si Arfaxad ng apatnaraan at tatlong taon pagkatapos na maipanganak si Shela, at nagkaanak pa ng mga lalaki at mga babae.
GEN_011_0019	Kanitang atlu yang pulu't apat a banua i Eber ayanak ne i Peleg.	Nabuhay si Shela ng tatlumpung taon, at naging anak si Eber.
GEN_011_0020	Mebie yang apat a ralan atlung pulung banua i Eber kaybat nang mibait Peleg, at mika aliwa ya pang anak a lalaki ampon babai.	Nabuhay si Shela ng apatnaraan at tatlumpung taon pagkatapos na maipanganak si Eber, at nagkaanak pa ng mga lalaki at mga babae.
GEN_011_0021	Kanitang atlu yang pulung banua i Peleg ayanak ne i Reu.	Nabuhay si Eber ng tatlumpu't apat na taon, at naging anak si Peleg.
GEN_011_0022	Mebie yang aduang dalan at siam a banua i Peleg kaybat nang mibait Reu, at mika aliwa ya pang anak a lalaki ampon babai.	Nabuhay si Eber ng apatnaraan at tatlumpung taon pagkatapos na maipanganak si Peleg, at nagkaanak pa ng mga lalaki at mga babae.
GEN_011_0023	Kanitang atlu yang pulu't aduang banua i Reu ayanak ne i Serug.	Nabuhay si Peleg ng tatlumpung taon, at naging anak si Reu.
GEN_011_0024	Mebie yang aduang dalan at pitung banua i Reu kaybat nang mibait Serug, at mika aliwa ya pang anak a lalaki ampon babai.	Nabuhay si Peleg ng dalawang daan at siyam na taon pagkatapos na maipanganak si Reu, at nagkaanak pa ng mga lalaki at mga babae.
GEN_011_0025	Kanitang atlu yang pulung banua i Serug ayanak ne i Nahor.	Nabuhay si Reu ng tatlumpu't dalawang taon, at naging anak si Serug.
GEN_011_0026	Mebie yang aduang dalan a banua i Serug kaybat nang mibait Nahor, at mika aliwa ya pang anak a lalaki ampon babai.	Nabuhay si Reu ng dalawang daan at pitong taon pagkatapos na maipanganak si Serug, at nagkaanak pa ng mga lalaki at mga babae.
GEN_011_0027	Kanitang adua yang pulu't siam a banua i Nahor ayanak ne i Tera.	Nabuhay si Serug ng tatlumpung taon, at naging anak si Nahor.
GEN_011_0028	Mebie yang dinalan at labing siam a banua i Nahor kaybat nang mibait Tera, at mika aliwa ya pang anak a lalaki ampon babai.	Nabuhay si Serug ng dalawang daang taon pagkatapos maipanganak si Nahor, at nagkaanak pa ng mga lalaki at mga babae.
GEN_011_0029	Kanitang pitu yang pulung banua i Tera ayanak na la di Abram, Nahor, at i Haran.	Nabuhay si Nahor ng dalawampu't siyam na taon, at naging anak si Terah.
GEN_011_0030	Ila deti ring lahi nang Tera.	Nabuhay si Nahor ng isandaan at labinsiyam na taon pagkatapos na maipanganak si Terah, at nagkaanak pa ng mga lalaki at mga babae.
GEN_011_0031	Anak na lang Tera di Abram, Nahor, at Haran.	At nabuhay si Terah ng pitumpung taon, at naging anak sina Abram, Nahor at Haran.
GEN_011_0032	Anak neng Haran i Lot.	Ito ang mga lahi ni Terah.
GEN_011_0033	Minuna yang mete i Haran kang tata nang i Tera karin king balen a tibuan na, king Ur da ring Caldeo.	Naging anak ni Terah sina Abram, Nahor, at Haran; at naging anak ni Haran si Lot.
GEN_011_0034	Mekiasawa la di Abram at Nahor.	Unang namatay si Haran kaysa sa kanyang amang si Terah sa lupaing kanyang tinubuan, sa Ur ng mga Caldeo.
GEN_011_0035	Sarai ya lagyu ing asawa nang Abram, at itang kang Nahor Milka ne man a lagyu.	At nagsipag-asawa sina Abram at Nahor.
GEN_011_0036	I Milka anak neng Haran a tata ra di Milka at Isca.	Ang pangalan ng asawa ni Abram ay Sarai, at ang pangalan ng asawa ni Nahor ay Milca, na anak na babae ni Haran na ama nina Milca at Iscah.
GEN_011_0037	Ala yang anak i Sarai uli na ning baug ya.	At si Sarai ay baog; siya'y walang anak.
GEN_011_0038	Tiki neng Tera ing anak nang i Abram, ing apu nang i Lot a anak nang Haran at ing manuyang nang i Sarai a asawa nang Abram a anak na.	Isinama ni Terah si Abram na kanyang anak, at si Lot na anak ni Haran, na anak ng kanyang anak, at si Sarai na kanyang manugang na asawa ni Abram na kanyang anak at sama-samang umalis sa Ur ng mga Caldeo upang magtungo sa lupain ng Canaan.
GEN_011_0039	Meko la king Ur da ring Caldeo at minta la king sakup ning Canaan.	Dumating sila sa Haran, at nanirahan doon.
GEN_011_0040	Oneng inyang miras la Haran, karin na la menuknangan.	At ang mga naging araw ni Terah ay dalawandaan at limang taon, at namatay si Terah sa Haran.
GEN_011_0041	Mebie yang aduang dalan at limang banua i Tera.	<MISSING TRANSLATION>
GEN_011_0042	Kaybat na nita mete ya karin king Haran.	<MISSING TRANSLATION>
GEN_012_0001	Ngana ning Ginu kang Abram, Lakuan me ing balen mu, ding kamaganak mu, at ing pibalebale nang tata mu, at munta ka king bansang ituldu ku keka.	Sinabi ng Panginoon kay Abram, Umalis ka sa iyong lupain, sa iyong mga kamag-anak, sa bahay ng iyong ama, at pumunta ka sa lupaing ituturo ko sa iyo.
GEN_012_0002	Gawan da kang metung a maragul a bansa at bendisyunan da ka.	Gagawin kitang isang malaking bansa, ikaw ay aking pagpapalain, gagawin kong dakila ang iyong pangalan, at ikaw ay magiging isang pagpapala.
GEN_012_0003	Maging pikabaluan ka lagyu at manatad kang bendisyun.	Pagpapalain ko ang magbibigay ng pagpapala sa iyo, at susumpain ko ang mga susumpa sa iyo; at sa pamamagitan mo ang lahat ng angkan sa lupa ay pagpapalain.
GEN_012_0004	Bendisyunan ku la ding mamendisyun keka, oneng isumpa ku la ding maniumpa keka.	Kaya't umalis si Abram ayon sa sinabi sa kanya ng Panginoon , at si Lot ay sumama sa kanya.
GEN_012_0005	At kapamilatan mu bendisyunan ku la ding sablang bansa.	Si Abram ay may pitumpu't limang taong gulang nang umalis siya sa Haran.
GEN_012_0006	Meko ya i Abram antimo ing inutus na ning Ginu .	Isinama ni Abram si Sarai na kanyang asawa, at si Lot na anak ng kanyang kapatid, at ang lahat ng pag-aaring kanilang natipon at ang mga taong kanilang nakuha sa Haran; at umalis sila upang pumunta sa lupain ng Canaan at nakarating sila roon.
GEN_012_0007	Kayabe neng meko i Lot.	Dumaan sa lupain si Abram hanggang sa lugar ng Shekem, sa punong ensina ng More.
GEN_012_0008	Pitu yang pulu't limang banua i Abram inyang meko ya king Haran.	Noon, ang mga Cananeo ay nasa lupaing iyon.
GEN_012_0009	Tiki ne ing asawa nang i Sarai, ing pangunakan nang i Lot, ing heganaganang pibandian a atipun da at ding heganaganang ipus a meging bandi ra karin Haran.	Nagpakita ang Panginoon kay Abram, at sinabi, Ibibigay ko ang lupaing ito sa iyong lahi.
GEN_012_0010	At miglakbe lang papunta king sakup ning Canaan.	At siya'y nagtayo roon ng isang dambana sa Panginoon na nagpakita sa kanya.
GEN_012_0011	Karas da king sakup ning Canaan, libutan neng Abram angga king miras ya king lele na ning sagradung tanaman ning More, ing banal a lugal karin Sikem.	Mula roon ay lumipat siya sa bundok na nasa silangan ng Bethel, at doon niya itinayo ang kanyang tolda, na nasa kanluran ang Bethel, at nasa silangan ang Ai.
GEN_012_0012	Manuknangan la pa kanita karin ding Cananeo.	Siya'y nagtayo roon ng dambana sa Panginoon , at tinawag ang pangalan ng Panginoon .
GEN_012_0013	Pepakit ya karin ing Ginu kang Abram at ngana, Ibie ke ing gabun a iti karing kekang maging lahi.	Si Abram ay patuloy na naglakbay hanggang sa Negeb.
GEN_012_0014	Karin mitalakad yang altar para king Ginung pepakit kang Abram.	Nagkagutom sa lupain kaya't bumaba si Abram sa Ehipto upang manirahan doon sapagkat mahigpit ang taggutom sa lupain.
GEN_012_0015	Ibat karin sinulung ya pa at miras king mabunduk a lugal king dane nang aslagan ning Betel.	Nang siya'y malapit na sa Ehipto, sinabi niya kay Sarai na kanyang asawa, Alam kong ikaw ay isang babaing maganda sa paningin; at kapag nakita ka ng mga Ehipcio ay kanilang sasabihin, Ito'y kanyang asawa; at ako'y kanilang papatayin, subalit hahayaan ka nilang mabuhay.
GEN_012_0016	Telakad ne ing tolda na pilatan na ning Betel, king dane albugan at ning Ai king dane aslagan.	Sabihin mong ikaw ay aking kapatid upang ako'y mapabuti dahil sa iyo, at upang ang buhay ko'y makaligtas dahil sa iyo.
GEN_012_0017	Mitalakad yang altar karin para king Ginu at menalangin ya king lagyu na ning Ginu .	Nang dumating si Abram sa Ehipto, nakita ng mga Ehipcio na ang babae ay napakaganda.
GEN_012_0018	Kaybat na nita, sindu na ing pamaglakad na at miras ya banda nang mauli ning Canaan.	Nang makita siya ng mga pinuno ng Faraon, siya'y kanilang pinuri kay Faraon, at dinala ang babae sa bahay ng Faraon.
GEN_012_0019	Mika maragul a danup king sakup na ning Canaan.	At pinagpakitaan niya ng magandang loob si Abram dahil kay Sarai at nagkaroon si Abram ng mga tupa, baka, lalaking asno, aliping lalaki at alilang babae, babaing asno, at mga kamelyo.
GEN_012_0020	Minta ya i Abram king Ehipto ban karin manuknangan uling tutung maragul ing danup.	Subalit pinahirapan ng Panginoon ang Faraon at ang kanyang sambahayan ng malubhang salot dahil kay Sarai na asawa ni Abram.
GEN_012_0021	Inyang malapit na la Ehipto ngana king asawa nang i Sarai, Balu kung malagu kang babai.	Tinawag ng Faraon si Abram, at sinabi, Ano itong ginawa mo sa akin?
GEN_012_0022	Potang akit da ka ding tau Ehipto sabian da, Asawa neng Abram yan.	Bakit hindi mo sinabi sa akin na siya'y iyong asawa?
GEN_012_0023	Kaybat paten da ku, oneng ika e ra ka nanan a balang.	Bakit mo sinabing, Siya'y aking kapatid?
GEN_012_0024	Ipakisabi ku keka king sabian mu sana ing kapatad mu ku ban uli mu e ra ku paten at pakiabayan da kung masalese.	na anupa't siya'y aking kinuha upang maging asawa.
GEN_012_0025	Inyang miras la Ehipto, ikit da ring tau Ehipto king malagu yang babai i Sarai.	Kaya't ngayon, narito ang iyong asawa.
GEN_012_0026	Panakit da ring panibalan na ning ari, belita re at pemuri arapan ning ari.	Siya'y kunin mo at umalis ka.
GEN_012_0027	Kaybat tiki da ne king palasyu na ning ari.	At nag-utos ang Faraon sa mga tao tungkol sa kanya, at siya'y kanilang inihatid sa daan, ang kanyang asawa, at ang lahat ng kanyang pag-aari.
GEN_012_0028	Uli nang Sarai mesalese ya kabilian i Abram.	<MISSING TRANSLATION>
GEN_012_0029	Dininan deng tupa, kambing, baka, asno, kamelyu, at ipus a lalaki at babai.	<MISSING TRANSLATION>
GEN_012_0030	Oneng pepagpa yang mangabayat a parusa ing Ginu king ari at king pibalebale na uli na ning kinua ne i Sarai a asawa nang Abram.	<MISSING TRANSLATION>
GEN_012_0031	Kanita pepayaus ne ning ari i Abram at ngana, Abram, nanu iting depat mu kanaku!	<MISSING TRANSLATION>
GEN_012_0032	Obat e mu sinabing asawa me?	<MISSING TRANSLATION>
GEN_012_0033	Obat sinabi mung kapatad me?	<MISSING TRANSLATION>
GEN_012_0034	Kinua ke mo bilang asawa ku.	<MISSING TRANSLATION>
GEN_012_0035	Ngeni oyni ing asawa mo!	<MISSING TRANSLATION>
GEN_012_0036	Kuanan mu ne at mako na kayu!	<MISSING TRANSLATION>
GEN_012_0037	Inutus na ning ari karing tauan na ing paburen da na lang mako a darala ing heganaganang pibandian da.	<MISSING TRANSLATION>
GEN_013_0001	Ibat Ehipto migbanda ya i Abram king dane norti papunta Canaan.	Umahon sa Negeb mula sa Ehipto si Abram, ang kanyang asawa, dala ang lahat ng kanyang pag-aari, at si Lot.
GEN_013_0002	Kayabe ne ing asawa na at ing heganaganang pibandian na.	At si Abram ay napakayaman sa hayop, pilak, at ginto.
GEN_013_0003	Kayabe nia naman i Lot.	Nagpatuloy si Abram ng kanyang paglalakbay mula sa Negeb hanggang sa Bethel, hanggang sa dakong kinaroroonan ng kanyang tolda sa pagitan ng Bethel at ng Ai; sa lugar ng dambana na kanyang ginawa roon nang una; at doon ay tinawag ni Abram ang pangalan ng Panginoon .
GEN_013_0004	Mabandi yang talaga i Abram.	Si Lot na sumama kay Abram ay mayroon ding mga tupa, baka, at mga tolda.
GEN_013_0005	Dakal ya sese animal at tipun a pilak at gintu.	Hindi makayanan ng lupain na sila'y manirahang magkasama sapagkat napakarami ng kanilang pag-aari.
GEN_013_0006	Tunggal ditak miraras ya Betel; ketang lugal pilatan na ning Betel at Ai nung nu ne telakad ing tolda na kanitang minuna, at karin ya naman minunang mitalakad altar, at menalangin king lagyu na ning Ginu .	At nagkaroon ng pagtatalo ang mga pastol ng hayop ni Abram at ang mga pastol ng hayop ni Lot.
GEN_013_0007	I Lot a kayabe nang Abram atin ya namang sese animal; atin ya namang dakal a tolda at katubale ampon magobra.	Ang Cananeo at ang Perezeo ay naninirahan noon sa lupain.
GEN_013_0008	E ya sapat ing pipagpastulan nung miyabe la, uling dakal la sese animal.	Sinabi ni Abram kay Lot, Huwag na tayong magkaroon ng pagtatalo, maging ang ating mga pastol, sapagkat tayo'y magkapatid.
GEN_013_0009	Maralas ing mipapate la ding pastul da ri Abram at Lot.	Di ba nasa harapan mo ang buong lupain?
GEN_013_0010	King panaun a ita ding Cananeo at Perezeo ilang manuknangan king lugal a ita.	Humiwalay ka sa akin.
GEN_013_0011	Kanita nganang Abram kang Lot, E kata sana mipapate at ding magpastul ta.	Kapag kinuha mo ang nasa kaliwa, ako ay pupunta sa kanan; o kapag kinuha mo ang nasa kanan, ako ay pupunta sa kaliwa.
GEN_013_0012	Mikamaganak kata!	Inilibot ni Lot ang kanyang paningin, at natanaw niya ang buong libis ng Jordan na pawang natutubigang mabuti gaya ng halamanan ng Panginoon , gaya ng lupain ng Ehipto, sa gawi ng Zoar; ito ay bago winasak ng Panginoon ang Sodoma at Gomorra.
GEN_013_0013	Makapanaya ing gabun arapan mu.	Kaya't pinili ni Lot para sa kanya ang buong libis ng Jordan; at si Lot ay naglakbay sa silangan at sila'y kapwa naghiwalay.
GEN_013_0014	Mayap ing mikawani kata.	Nanirahan si Abram sa lupain ng Canaan, at si Lot ay nanirahan sa mga bayan ng libis, at inilipat ang kanyang tolda hanggang sa Sodoma.
GEN_013_0015	Nung munta ka king dane kayli aku naman munta ku king dane wanan; nung munta ka king dane wanan aku munta na ku man king dane kayli.	Ang mga tao nga sa Sodoma ay napakasama at makasalanan sa harap ng Panginoon .
GEN_013_0016	Linawe yang makapadurut i Lot at ikit nang mipaparanuman yang masalese ing mabilug a Kapatagan ning Jordan angga karin Zoar, kalupa na ning sarili nang mulahan ning Ginu o ning Ehipto.	Sinabi ng Panginoon kay Abram pagkatapos na humiwalay si Lot sa kanya, Itaas mo ngayon ang iyong paningin, at tumanaw ka mula sa dakong iyong kinalalagyan, sa dakong hilaga, timog, silangan, at sa kanluran; sapagkat ang buong lupaing natatanaw mo ay ibibigay ko sa iyo, at sa iyong binhi magpakailanman.
GEN_013_0017	E ne pa kanita silaban ning Ginu ing Sodoma at Gomorra.	Gagawin kong parang alabok ng lupa ang iyong binhi, at kung mabibilang ng sinuman ang alabok ng lupa, ang iyong binhi ay mabibilang din.
GEN_013_0018	Inya pinili neng Lot ing mabilug a Kapatagan ning Jordan at minta ya bandang aslagan.	Tumindig ka!
GEN_013_0019	Makanyan lang mikawani.	Lakarin mo ang lupain, ang kanyang haba at luwang sapagkat ibibigay ko ito sa iyo.
GEN_013_0020	Menatili ya i Abram king bansa ning Canaan samantalang migdatun ya i Lot karing siudad na ning kapatagan, at telakad na la ding tolda na siping na ning Sodoma.	At inilipat ni Abram ang kanyang tolda, at humayo at nanirahan sa gitna ng mga punong ensina ni Mamre na nasa Hebron, at siya'y nagtayo roon ng dambana sa Panginoon .
GEN_013_0021	Oneng tune lang e mayap ding memalen na ning Sodoma; maragul la kasalanan king Ginu .	<MISSING TRANSLATION>
GEN_013_0022	Kalako nang Lot, migsalita ya ing Ginu kang Abram.	<MISSING TRANSLATION>
GEN_013_0023	Ngana, King kekang kabilian maglalawe ka; lumawe ka king dane norti, mauli, aslagan, at albugan.	<MISSING TRANSLATION>
GEN_013_0024	Ibie ku keka at karing maging lahi mu ing heganaganang gabun a akakit mu ban maging kekayu king kapilan pa man.	<MISSING TRANSLATION>
GEN_013_0025	Parakalan ku lang anti ing alikabuk na ning yatu ding kekang lahi; nung sakaling abilang da ing alikabuk ning yatu, kanita abilang da la naman ding lahi mu.	<MISSING TRANSLATION>
GEN_013_0026	Mako na ka at lakaran ing gabun, ing kaba at lapad na, uling keka ku babie iti.	<MISSING TRANSLATION>
GEN_013_0027	Linipat na lang Abram ding tolda na at menuknangan ya lele na ning sagradung tanaman ning Mamre ning Hebron.	<MISSING TRANSLATION>
GEN_013_0028	Mitalakad yang altar karin para king Ginu .	<MISSING TRANSLATION>
GEN_014_0001	Ketang panaun da ri Aring Amrapel ning Sinar, Aring Ariok ning Ellasar, Aring Kedorlaumer ning Elam, at Aring Tidal ning Goiim mekigera la kari Aring Bera ning Sodoma, Aring Birsa ning Gomorra, Aring Sineab ning Adma, Aring Semeber ning Zeboiim, at king ari ning Bela o Zoar.	Nang mga araw ni Amrafel, hari ng Shinar, ni Arioc na hari ng Elasar, ni Kedorlaomer na hari ng Elam, at ni Tidal na hari ng mga Goiim, ang mga ito ay nakipagdigma laban kay Bera na hari ng Sodoma, kay Birsha na hari ng Gomorra, kay Shinab na hari ng Adma, kay Shemeber na hari ng Zeboyin, at ng hari sa Bela na si Zoar.
GEN_014_0002	Pikayari da reting ari a tauling mebanggit ing misanmetung la king pamakigera karin king Kapatagan ning Siddim ing Dagat a Mete.	Silang lahat ay nagsama-sama sa libis ng Siddim na siyang Dagat na Patay.
GEN_014_0003	Makapailalam la kilub ding labing aduang banua kang Kedorlaumer, oneng karas ning kalabing atlung banua mig-rebeldi la laban kang Kedorlaumer.	Labindalawang taon silang naglingkod kay Kedorlaomer, at sa ikalabintatlong taon ay naghimagsik.
GEN_014_0004	King kalabing apat a banua dinatang ya i Kedorlaumer at ding aring kasanmetung na, at simbut da la ring Refaim karin Asterotkarnaim, ding Susim karin Ham, ding Emim karin Sabekiriataim, ding Horiteo king mabunduk a lugal ning Seir angga king Elparan a malapit king disyerto.	Sa ikalabing-apat na taon ay dumating si Kedorlaomer at ang mga haring kasama niya, at nilupig ang mga Refaim sa Astarot-carnaim, ang mga Zuzita sa Ham, ang mga Emita sa Save-Kiryataim, at ang mga Horeo sa kanilang kabundukan ng Seir hanggang Elparan na nasa tabi ng ilang.
GEN_014_0005	Kaybat na nita, migbalik la at miras Enmispat a pikabaluan kanitang Kades, at binihag de ing mabilug a bansa da ring Amalekita at Amoreo a manuknangan Hazazon Tamar.	Pagkatapos, sila'y bumalik at tumungo sa Enmispat na siyang Kadesh, at kanilang nilupig ang buong lupain ng mga Amalekita at pati ng mga Amoreo na nakatira sa Hazazon-tamar.
GEN_014_0006	Kanita ding ari na ning Sodoma, Gomorra, Adma, Zeboiim, at Bela linage lang kayabe ding sundalus da king Kapatagan ning Siddim ban labanan da la ri Aring Kedorlaumer ning Elam, Tidal ning Goiim, Amrapel na ning Sinar, at Ariok ning Ellasar; apat a ari laban karing lima.	At lumabas ang mga hari ng Sodoma, Gomorra, Adma, Zeboyin, Bela na si Zoar; at sila'y sumama sa pakikidigma sa libis ng Siddim laban kay Kedorlaomer na hari ng Elam, kay Tidal na hari ng mga Goiim, kay Amrafel na hari ng Shinar, at kay Arioc na hari ng Elasar; apat na hari laban sa lima.
GEN_014_0007	Mitmu yang talaga a pikukuanan alketran ing Kapatagan ning Siddim.	Ang libis ng Siddim ay pun ng hukay ng betun, at nang tumakas ang mga hari ng Sodoma at ng Gomorra, ang ilan ay nahulog doon, at ang natira ay tumakas sa kabundukan.
GEN_014_0008	Kabang tatakas la ding ari na ning Sodoma at Gomorra menabu la karing talagang alketran kabang ding aliwa naman pesitakas la karing bunduk.	At kanilang sinamsam ang lahat ng pag-aari at pagkain ng Sodoma at Gomorra, at saka umalis.
GEN_014_0009	Kinua ra ngan ding apat a aring miniambut ing pibandian ampon pamangan karin Sodoma at Gomorra at saka la meko.	Dinala nila si Lot na anak ng kapatid ni Abram, na nakatira sa Sodoma, at ang kanyang mga pag-aari at sila'y umalis.
GEN_014_0010	Pekidakap de i Lot a pangunakan nang Abram.	At dumating ang isang nakatakas at ibinalita kay Abram na Hebreo na naninirahan sa mga puno ng ensina ni Mamre na Amoreo, kapatid nina Escol at Aner.
GEN_014_0011	Manuknangan ya kanita king Sodoma; dela ra pati pibandian na.	Ang mga ito ay mga kakampi ni Abram.
GEN_014_0012	Oneng dinatang ya ing metung a mekatakas at belita na kang Abram a Hebreo a manuknangan lele na ning sagradung tanaman ning Mamre, ing Amoreo at kamaganak da ri Escol at Aner.	Nang marinig ni Abram na nabihag ang kanyang kamag-anak, pinangunahan niya ang kanyang tatlong daan at labingwalong mga sanay na tauhan na ipinanganak sa kanyang bahay, at kanilang hinabol sila hanggang sa Dan.
GEN_014_0013	Kakampi na lang Abram deting adua.	Kinagabihan, sila'y nagpangkat-pangkat laban sa kaaway, siya at ang kanyang mga alipin, at sila'y kanilang ginapi at hinabol sila hanggang sa Hoba na nasa hilaga ng Damasco.
GEN_014_0014	Kabud dimdam nang Abram ing balitang mebihag ya ing pangunakan nang i Lot, tinipun yang atlung dalan at labing walu kataung makilaban.	At iniuwi niya ang lahat ng pag-aari, gayundin si Lot na kanyang kamag-anak at ang kanyang mga pag-aari, at ang mga kababaihan at ang taong-bayan.
GEN_014_0015	Kayabe na na la deti ibat na inyang mibait la.	Siya'y sinalubong ng hari ng Sodoma pagkatapos na siya'y bumalik mula sa pagkatalo ni Kedorlaomer, at sa mga haring kasama niya sa libis ng Shave na siyang libis ng hari.
GEN_014_0016	Tinagal la angga karin Dan.	At si Melquizedek, hari ng Salem na pari ng Kataas-taasang Diyos, ay naglabas ng tinapay at alak.
GEN_014_0017	Mig-adua lang grupu at kaybat linusub la inyang kabengian karing kalaban da.	Siya'y kanyang binasbasan na sinabi, Pagpalain si Abram ng Kataas-taasang Diyos, na lumikha ng langit at ng lupa; at purihin ang Kataas-taasang Diyos, na nagbigay ng iyong mga kaaway sa iyong kamay.
GEN_014_0018	Simbut da la at tegal angga karin Hoba a atyu king dane norti na ning Damasco.	At binigyan siya ni Abram ng ikasampung bahagi ng lahat.
GEN_014_0019	Abawi nang pasibayu ing heganaganang pibandian a meyakua at ayuli ne ing kamaganak nang i Lot ampon ing pibandian na at pati na ding babai at aliwa pang mebihag.	Sinabi ng hari ng Sodoma kay Abram, Ibigay mo sa akin ang mga tao at kunin mo ang mga ari-arian para sa iyong sarili.
GEN_014_0020	Kabalik nang Abram king matagumpe nang pamakilaban kang Kedorlaumer at ding aring kakampi na, seganan ne ning ari na ning Sodoma karin king Kapatagan ning Save a mayayaus munamang Ing Kapatagan ning Ari.	Sinabi ni Abram sa hari ng Sodoma, Ako'y sumumpa sa Panginoong Diyos na Kataas-taasan, na lumikha ng langit at ng lupa, na hindi ako kukuha kahit isang sinulid, o isang panali ng sandalyas, o ng anumang para sa iyo, baka iyong sabihin, Pinayaman ko si Abram.
