id	source_text	target_text
GEN_032_0017	Lipatan ke ing Ilug ning Jordan agyamang tukud ya mu kabud ing darala ku.	Ang mga ito ay ibinigay niya sa kanyang mga alipin, ang bawat kawan ay nakabukod at sinabi niya sa kanyang mga alipin, Lumampas kayo sa aking unahan at lagyan ninyo ng pagitan ang bawat kawan.
GEN_032_0018	Ngeni, king pamagbalik ku adua lang grupu ding kayabe ku.	Iniutos niya sa una, Kapag ikaw ay natagpuan ni Esau na aking kapatid, at tanungin ka, Kanino ka?
GEN_032_0019	Iligtas yu ku sana kang Esau a kapatad ku.	Saan ka pupunta?
GEN_032_0020	Tatakut ku pota karatang na pamaten na kami at pati na ding ima ampon ding anak da.	At kanino itong nasa unahan mo?
GEN_032_0021	Ngayung mengaku kanaku: E ra ka paburen at parakalan ku la ring maging lahi mu, maging kasing dakal da la ring balas na ning dagat a e abilang-bilang.	Kung magkagayo'y sasabihin mo, Sa iyong lingkod na si Jacob.
GEN_032_0022	Kaybat nang linabas ing bengi karin, kewani na lang Jacob deting mapilan a bage ban iregalu king kapatad nang i Esau aduang dalan a babaing kambing at aduang pulung lalaking kambing; aduang dalan a babaing tupa at aduang pulung lalaking tupa; atlung pulung gatasan a kamelyu at ding karelang biseru; apat apulung baka at apulung toro; aduang pulung babaing asno at apulung lalaking asno.	Ito ay isang regalo na padala para sa aking panginoong si Esau; at bukod dito, siya'y nasa hulihan namin.
GEN_032_0023	Pepanibala na la deti karing ipus na a mamahala balang grupu.	Gayundin, iniutos niya sa ikalawa, sa ikatlo, at sa lahat ng sumusunod sa mga kawan, na sinasabi, Sasabihin ninyo ang gayunding bagay kay Esau, kapag nakasalubong ninyo siya, at sasabihin ninyo, Bukod dito, ang iyong lingkod na si Jacob ay nasa hulihan namin.
GEN_032_0024	Kaybat ngana karing ipus, Muna na kayu kanaku at dinan yeng pilatan ing balang grupu.	Sapagkat kanyang iniisip, Baka mapaglubag ko ang kanyang galit sa pamamagitan ng regalo na ipinauna ko, at pagkatapos ay makikita ko ang kanyang mukha, marahil ay tatanggapin niya ako.
GEN_032_0025	Ngana ketang ipus a atyu king pekamumuna, Potang asaganan na ka ning kapatad kung i Esau at kutnan na ka nung kenu ka ipus at nung nu ka munta at nung kenu la ding animal ipakibat mu, Kang Jacob la a kekayung talasuyu; papabie na la kekayu.	Kaya't ang regalo ay ipinadala na nauna sa kanya; at siya'y nanatili sa kampo nang gabing iyon.
GEN_032_0026	Katuki mi ya.	Nang gabing iyon, siya'y bumangon at isinama niya ang kanyang dalawang asawa, ang kanyang dalawang aliping babae, at ang kanyang labing-isang anak at tumawid sa tawiran ng Jaboc.
GEN_032_0027	Makanyan munaman ing penabilin na king kaduang ipus, king katlu, at karing sablang maglakad kagulutan da ring kawan.	Sila'y kanyang isinama at itinawid sa batis, at kanya ring itinawid ang lahat ng kanyang ari-arian.
GEN_032_0028	Yan ing sabian yu kang Esau potang akatagpu yu ne.	Naiwang nag-iisa si Jacob at nakipagbuno sa kanya ang isang lalaki hanggang sa magbukang-liwayway.
GEN_032_0029	At sabian yu pa, I Jacob a talasuyu yu atyu ne kagulutan mi.	Nang makita ng lalaki na hindi siya manalo laban kay Jacob, hinawakan niya ang kasu-kasuan ng hita ni Jacob, at ang kasu-kasuan ni Jacob ay nalinsad samantalang nakikipagbuno sa kanya.
GEN_032_0030	Nganang minisip Jacob, Nung sakaling apalubak ke lub karing regalu a peparala kung makapauna kanaku, potang akayarap ke, mekad patawaran na ku.	Sinabi niya, Bitawan mo ako, sapagkat nagbubukang-liwayway na.
GEN_032_0031	Inya peparala nang makauna kang Esau ing regalu, at melakuan yang migpaynawa king kampu king benging ita.	At sinabi ni Jacob, Hindi kita bibitawan malibang ako ay mabasbasan mo.
GEN_032_0032	Ketang bengi mu ring ita mibangun ya i Jacob.	Sinabi ng lalaki kay Jacob, Ano ang pangalan mo?
GEN_032_0033	Tiki na la ding adua nang asawa, ding aduang babaing kasese na, at ding labing metung a anak na, at delakitan de ing Ilug ning Jabok.	At kanyang sinabi, Jacob.
GEN_032_0034	Inyang adalakit na na la at ing pibandian na, melakuan yang magdili-dili i Jacob.	Sinabi niya, Ang iyong pangalan ay hindi na tatawaging Jacob, kundi Israel; sapagkat ikaw ay nakipaglaban sa Diyos at sa mga tao, at ikaw ay nagtagumpay.
GEN_032_0035	Kanita dinatang ya ing metung a lalaki, at mekibatbatan ya kang Jacob angga na king miras ing ganingaldo.	Siya'y tinanong ni Jacob, Hinihiling ko sa iyo na sabihin mo sa akin ang iyong pangalan.
GEN_032_0036	Inyang aulata na ning tau king e ne asaul i Jacob, sikmal ne king papaluan, at milisang ya ing butul na ning puad na king paglugalan na king papaluan.	At kanyang sinabi, Bakit itinatanong mo ang aking pangalan?
GEN_032_0037	Kanita ngana ning tau, Ibili mu na ku uling ganingaldo na.	At siya'y binasbasan doon.
GEN_032_0038	Oneng nganang Jacob, E ra kayu ibili anggang e yu ku bendisyunan.	Tinawag ni Jacob ang pangalan ng lugar na iyon na Peniel na sinasabi, Sapagkat nakita ko ang Diyos sa harapan, at naligtas ang aking buhay.
GEN_032_0039	Nanu waring lagyu mu?	Sinikatan siya ng araw nang siya'y dumaraan sa Penuel; at siya'y papilay-pilay dahil sa kanyang hita.
GEN_032_0040	nganang kinutang ning lalaki.	Dahil dito, hanggang ngayon ay hindi kumakain ang mga anak ni Israel ng litid ng balakang na nasa kasu-kasuan ng hita, sapagkat dito hinampas ng taong nakipagbuno ang kasu-kasuan ng hita ni Jacob, sa litid ng balakang.
GEN_032_0041	Jacob, nganang mekibat.	<MISSING TRANSLATION>
GEN_032_0042	Kanita ngana ning lalaki, Manibat ngeni Israel na ing lagyu mu; e na Jacob uling akabatbatan me ing Dios ampon ding tau at miniambut ka.	<MISSING TRANSLATION>
GEN_032_0043	Kanita nganang Jacob, Sabian yu ne mo kanaku ing lagyu yo.	<MISSING TRANSLATION>
GEN_032_0044	Pekibat na, Obat buri meng abalu ing lagyu ku?	<MISSING TRANSLATION>
GEN_032_0045	at binendisyunan ne i Jacob.	<MISSING TRANSLATION>
GEN_032_0046	Inya i Jacob inaus neng Peniel ing lugal a ita, ngana wari, Ing lupa na ning Dios, uling ikit ne lupa ing Dios, oneng e ya ninanu balang.	<MISSING TRANSLATION>
GEN_032_0047	Makaslag ne ing aldo inyang palako ne Peniel; tikul-tikul yang meko pauli na ning papaluan na.	<MISSING TRANSLATION>
GEN_032_0048	Iti ya ing sangkan nung inya e la mamangan ding Israelita king laman a atyu king pikalukaluan na ning papaluan uli na ning kepilayan ya karin i Jacob king pangasakmal na.	<MISSING TRANSLATION>
GEN_033_0001	Minatna ya ampon miglalawe i Jacob at ikit neng daratang i Esau; kayabe na la ding apat a ralan a tauan na.	Tumanaw si Jacob at nakita niyang si Esau ay dumarating na may kasamang apatnaraang katao.
GEN_033_0002	Inya pirakerakayan na la ring anak kari Lea, Raquel, at ding aduang babaing kasese na.	Kaya't kanyang pinaghiwalay ang mga bata kina Lea at Raquel, at sa dalawang aliping babae.
GEN_033_0003	Pepaunan na la ding babaing kasese na at ding anak da; kaybat da i Lea ampon ding anak na, at keta lang tauli di Raquel at Jose.	Inilagay niya ang mga alipin na kasama ng kanilang mga anak sa unahan, at si Lea na kasama ng kanyang mga anak bilang pangalawa, at sina Raquel at Jose na pinakahuli.
GEN_033_0004	Ya naman migpauna ya karela; dinuku yang makatapitu king gabun angga king milapit ya king kapatad na.	At siya naman ay lumampas sa unahan nila, at pitong ulit na yumuko sa lupa hanggang sa siya ay mapalapit sa kanyang kapatid.
GEN_033_0005	Milayi yang sinalubung i Esau; pengaul ne at inuma kabang tatangis lang parehu.	At tumakbo si Esau upang salubungin siya, niyakap siya, niyapos siya sa leeg, hinagkan at sila ay nag-iyakan.
GEN_033_0006	Inyang minatna ya i Esau ikit na la ding babai at ding anak.	Nang itaas ni Esau ang kanyang paningin, at nakita ang mga babae at ang mga bata, ay kanyang sinabi, Sino itong mga kasama mo?
GEN_033_0007	Ninu deting kayabe mu?	At kanyang sinabi, Ang mga anak na ipinagkaloob ng Diyos sa iyong lingkod.
GEN_033_0008	nganang mengutang.	Nang magkagayo'y lumapit ang mga aliping babae at ang kanilang mga anak, at nagsiyuko.
GEN_033_0009	Pekibat nang Jacob, Ila deti ring anak a malugud nang binie ning Dios king kekang talasuyu.	Lumapit din si Lea at ang kanyang mga anak, at nagsiyuko, pagkatapos ay nagsilapit sina Jose at Raquel, at nagsiyuko.
GEN_033_0010	Kanita linapit la ding babaing kasese nang Jacob at ding anak da at dinuku la arapan na.	Sinabi ni Esau, Ano ang kahulugan ng lahat na ito na nasalubong ko?
GEN_033_0011	Linapit ya naman i Lea at ding anak na at dinuku; katataulian linapit ya i Raquel at i Jose at dinuku la naman.	At sumagot si Jacob, Upang makakita ng biyaya sa paningin ng aking panginoon.
GEN_033_0012	Kanita kitang nang Esau, Para nanu no man ding grupung asaganan ku?	Subalit sinabi ni Esau, Sapat na ang nasa akin, kapatid ko.
GEN_033_0013	Nganang mekibat Jacob, Regalu ku la keka ban milako ing mua mu kanaku.	Ang nasa iyo ay sa iyo na.
GEN_033_0014	Dakal na ku pibandian, nganang Esau, keka na mu ing pibandian mu.	Sinabi sa kanya ni Jacob, Hindi, nakikiusap ako sa iyo, na kung ngayo'y nakatagpo ako ng biyaya sa iyong paningin, ay tanggapin mo nga ang aking kaloob mula sa aking kamay; sapagkat nakita ko ang iyong mukha, na gaya ng nakakita ng mukha ng Diyos, at ikaw ay nalugod sa akin.
GEN_033_0015	Nganang Jacob, Nung talagang e ka mua kanaku tanggapan mu sana iting babie ku keka.	Nakikiusap ako sa iyo, tanggapin mo ang kaloob na dala ko sa iyo sapagkat lubos na ang ipinagkaloob sa akin ng Diyos, at mayroon ako ng lahat na kailangan ko.
GEN_033_0016	Ngening tinggap mu ku balamu akakit ku ne keka ing lupa na ning Dios.	Kaya't hinimok ni Jacob si Esau at kanyang tinanggap.
GEN_033_0017	Tanggapan mu na sana iting babie ku keka anti na ning dininan na ku ning Dios king heganaganang kailangan ku at dakal na ku pibandian.	Sinabi niya, Tayo'y humayo at maglakbay at ako'y sasama sa iyo.
GEN_033_0018	Pemilit ne angga king mebisa ya.	Subalit sinabi ni Jacob sa kanya, Nalalaman ng aking panginoon na ang mga bata ay mahihina pa at mayroon sa mga kawan at mga baka na nagpapasuso; kapag sila'y pinagmadali nila sa isang araw lamang ay mamamatay ang lahat ng kawan.
GEN_033_0019	Kanita nganang Esau, Lumakad ta na at magpauna na ku kekayu.	Magpauna na ang aking panginoon sa kanyang lingkod at ako'y magpapatuloy na dahan-dahan, ayon sa hakbang ng mga hayop na nasa aking unahan, at sa hakbang ng mga bata, hanggang sa makarating ako sa aking panginoon sa Seir.
GEN_033_0020	Pekibat nang Jacob, Balu mu, kapatad ku, maina la pamikakatawan ding anak at kailangan lang ingatan ding tupa at baka ampon ding biseru dang sususu.	Kaya't sinabi ni Esau, Pahintulutan mong iwan ko sa iyo ang ilan sa mga taong kasama ko.
GEN_033_0021	Pota mangamate la nung sakaling mipalalu lang lumakad kilub ning patingapun.	Kanyang sinabi, Bakit kailangan pa?
GEN_033_0022	Muna na ka at tuki ku kagulutan mu.	Sapat na ang makakita ako ng biyaya sa paningin ng aking panginoon.
GEN_033_0023	Mabagal kung lumakad; antabayanan ku la ring bakang atyu arapan ku at ding anak.	Kaya't nagbalik si Esau nang araw ding iyon sa kanyang lakad patungo sa Seir.
GEN_033_0024	Mikit ta na mu karin Seir.	Si Jacob ay naglakbay sa Sucot, at nagtayo ng isang bahay para sa kanya, at iginawa niya ng mga balag ang kanyang hayop.
GEN_033_0025	Kanita nganang Esau, Lakuan ku la keka ding mapilan a kataung kayabe ku.	Kaya't tinawag ang pangalan ng lugar na iyon na Sucot.
GEN_033_0026	Nganang Jacob, E na kailangan.	Payapang dumating si Jacob sa bayan ng Shekem, na nasa lupain ng Canaan, nang siya'y dumating mula sa Padan-aram; at siya'y tumigil sa tapat ng bayan.
GEN_033_0027	Labis-labis na ing ganaka mu kanaku!	Binili niya sa halagang isandaang pirasong salapi ang bahaging iyon ng lupa na pinagtayuan ng kanyang tolda, sa kamay ng mga anak ni Hamor, na ama ni Shekem.
GEN_033_0028	Kanita mu ring aldong ita tiglus nang Esau ing pamagbalik na Seir.	At siya'y nagtayo roon ng isang dambana at tinawag niya itong El-Elohe-Israel.
GEN_033_0029	Tinaglus ya Sucot i Jacob at mitalakad yang bale na karin.	<MISSING TRANSLATION>
GEN_033_0030	Ginawa ya namang kural para karing kawan na.	<MISSING TRANSLATION>
GEN_033_0031	Iti ing sangkan nung inya ausan deng Sucot ing lugal a ita.	<MISSING TRANSLATION>
GEN_033_0032	King pamagbalik na manibat Padan-aram masalese yang miras i Jacob king siudad ning Sikem a atyu king sakup ning Canaan.	<MISSING TRANSLATION>
GEN_033_0033	Telakad na la ding tolda na e binang malaut king siudad.	<MISSING TRANSLATION>
GEN_033_0034	Asali ne ing gabun a pitalakaran nang tolda karing anak nang Hamor a tata nang Sikem king alagang dinalan a kapirasung pilak.	<MISSING TRANSLATION>
GEN_033_0035	Karin ya ginawang altar at inaus neng El, ing Dios ning Israel.	<MISSING TRANSLATION>
GEN_034_0001	Misan a aldo, i Dina a anak nang Jacob kang Lea meko ya ban dalawan na la ding babaing tubu Canaan.	Si Dina na anak ni Lea, na ipinanganak nito kay Jacob, ay lumabas upang tingnan ang mga babae ng lupaing iyon.
GEN_034_0002	Ikit neng Sikem a anak nang Hamor, ing Heveo a pekapun karin.	Nang makita siya ni Shekem, anak ni Hamor na Heveo na siyang pinuno sa lupain, kanyang kinuha siya at sapilitang sinipingan.
GEN_034_0003	Sebat ne at sinira ne puri.	Siya ay napalapit kay Dina, na anak ni Jacob at kanyang inibig ang dalaga, at nangusap sa kanya na may pagmamahal.
GEN_034_0004	Ikit na ing makabighani ya at dinatang ya sinta kang Dina a anak nang Jacob.	Kaya't si Shekem ay nagsalita sa kanyang amang si Hamor, na sinasabi, Kunin mo para sa akin ang dalagang ito upang maging asawa ko.
GEN_034_0005	Milsinta ya at pekipagsalitan ne kapamilatan da ring amanung mangalambing.	Nabalitaan nga ni Jacob na pinagsamantalahan ni Shekem ang kanyang anak na si Dina; subalit ang kanyang mga anak na lalaki ay kasama ng mga hayop niya sa parang kaya't nanatiling tahimik si Jacob hanggang sa sila'y nakarating.
GEN_034_0006	Inya nganang Sikem kang Hamor a tata na, Gawa kayu sanang paralan ban ayasawa ke ing babaing ita.	Lumabas si Hamor na ama ni Shekem upang makipag-usap kay Jacob, nang ang mga anak na lalaki ni Jacob ay magsiuwi mula sa parang.
GEN_034_0007	Abalitan nang Jacob king sinira ne puring Sikem ing anak nang i Dina.	Nang ito'y kanilang mabalitaan, galit na galit ang mga lalaki, sapagkat gumawa si Shekem ng kalapastanganan sa Israel sa pamamagitan ng pagsiping sa anak ni Jacob, sapagkat ang gayong bagay ay di-nararapat gawin.
GEN_034_0008	Atyu la kanita ding anak nang lalaking Jacob king marangle, magpastul la karing baka na.	Subalit nagsalita si Hamor sa kanila, na sinasabi, Ang puso ng aking anak na si Shekem ay nasasabik sa iyong anak.
GEN_034_0009	Ala yang sinabi nanuman i Jacob.	Hinihiling ko sa inyo na ipagkaloob ninyo siya sa kanya upang maging asawa niya.
GEN_034_0010	Penaya na lang minuli ding anak na.	Magsipag-asawa kayo sa amin; ibigay ninyo sa amin ang inyong mga anak na babae, at ibibigay namin sa inyo ang aming mga anak na babae.
GEN_034_0011	Kanita pintalan neng Hamor a tata nang Sikem i Jacob ba neng pakisabian.	Kayo'y maninirahang kasama namin, at ang lupain ay magiging bukas sa inyo.
GEN_034_0012	Minuli lang ibat king marangle ding anak nang Jacob inyang abalu ra ing milyari.	Mangalakal kayo at magkaroon kayo ng mga pag-aari dito.
GEN_034_0013	Mibua la king mua uling ginawa yang kalapastangan i Sikem karing memalen na ning Israel king kapamilatan na ning pamanyirang puri na kang Dina, uling ing bage anti kaniti e kailangan merapat.	Sinabi rin ni Shekem sa ama ni Dina at sa kanyang mga kapatid, Makatagpo sana ako ng biyaya sa inyong paningin at ang hingin ninyo sa akin ay aking ibibigay.
GEN_034_0014	Pekisabian na lang Hamor.	Humingi kayo sa akin ng kahit anong bigay-kaya at regalo na nais ninyo at aking ibibigay ayon sa sinabi ninyo sa akin; subalit ibigay ninyo sa akin ang dalaga upang maging asawa ko.
GEN_034_0015	Ngana kang Jacob, Tune neng palsintan ning anak kung i Sikem i Dina a anak mu.	At nagsisagot na may pandaraya ang mga anak na lalaki ni Jacob kina Shekem at Hamor na kanyang ama, sapagkat kanyang pinagsamantalahan si Dina na kanilang kapatid.
GEN_034_0016	Ipakisabi ku kekayu king paintulutan yu neng ayasawa ne.	Sinabi nila sa kanila, Hindi namin magagawang ibigay ang aming kapatid sa isang hindi tuli; sapagkat ito'y kahihiyan namin.
GEN_034_0017	Paintulut yung miyayasawa la ring anak yu at ding anak mi.	Sa ganitong paraan lamang kami papayag: kung kayo'y magiging gaya namin, na ang lahat ng lalaki sa inyo ay tuliin.
GEN_034_0018	Manuknangan kayung kayabe mi; keti na kayu makipanuknangan, mangalakal, at manialing gabun.	Pagkatapos ay ibibigay namin sa inyo ang aming mga anak na babae, at makikisama kami sa inyong mga anak na babae, at maninirahan kami sa inyo, at magiging isang bayan.
GEN_034_0019	Kanita nganang Sikem kang tata na at karing kapatad nang Dina, Panusigan yu na ku at ibie ku kekayu ing nanumang aduan yu kanaku.	Subalit kung ayaw ninyo kaming pakinggan na kayo'y matuli, ay kukunin namin ang aming anak na babae at kami ay aalis.
GEN_034_0020	Bayaran ke ing duru agyang magkanu ya.	Nasiyahan sa kanilang mga salita si Hamor at ang kanyang anak na si Shekem.
GEN_034_0021	Paintulutan yu mung ayasawa ke ing anak yung dalaga.	Hindi nag-atubili ang binata na gawin iyon, sapagkat nalugod siya sa anak na babae ni Jacob.
GEN_034_0022	Makisamut pamaglinlang ing pekibat da ring anak nang Jacob kang Sikem at kang tata na uling sinira na ne puri ing kapatad dang i Dina.	Si Shekem ay ang pinakamarangal sa buong sambahayan ng kanyang ama.
GEN_034_0023	Ngarang sinabi, E mi malyaring paintulutan iti.	Kaya't si Hamor at ang anak niyang si Shekem ay pumunta sa pintuang-bayan ng kanilang lunsod, at sila'y nagsalita sa mga tao sa kanilang lunsod, na sinasabi, Ang mga taong ito ay mabuting makitungo sa atin; kaya't hayaan natin silang manirahan sa lupain at magsipangalakal sila riyan, sapagkat ang lupain ay sapat ang laki para sa kanila.
GEN_034_0024	E mi ya malyaring pakiasawa ing kapatad mi king metung a taung e mesirkunsisyun.	Ipakasal natin ang ating mga anak sa kanilang mga anak na babae, at ating ibigay sa kanila ang ating mga anak na babae.
GEN_034_0025	Maragul a kamarinayan ita para kekami.	Sa ganito lamang paraan sila papayag na tumirang kasama natin, upang maging isang bayan: na patuli ang lahat ng lalaki sa atin, na gaya naman nila na mga tuli.
GEN_034_0026	Mabisa kami nung makitulad kayu kekami at pasirkunsisyun yu la ngan ding lalaki kekayu.	Di ba magiging atin ang kanilang mga baka at ang kanilang mga pag-aari at ang lahat nilang hayop?
GEN_034_0027	Kanita paintulut ming ayasawa yu la ring dalaga mi at ikami naman makiasawa kami karing dalaga yu.	Sumang-ayon lamang tayo sa kanila at sila ay mabubuhay na kasama natin.
GEN_034_0028	Mibalebale kami libutad yu at maging metung ta na mung balen.	At pinakinggan si Hamor at si Shekem na kanyang anak ng lahat na lumabas sa pintuan ng kanyang lunsod.
GEN_034_0029	Nung e yu na ke man pakiramdaman at nung e kayu pasirkunsisyun, kuanan mi ya ing kapatad mi at saka na kami mako.	Kaya't ang lahat ng lalaki na lumabas sa pintuan ng kanyang lunsod ay tinuli.
GEN_034_0030	Mebisa ya i Hamor at ing anak nang i Sikem king dimdam da.	Sa ikatlong araw, nang mahapdi pa ang mga sugat ng mga tinuli, ang dalawa sa mga anak ni Jacob, sina Simeon at Levi, na mga kapatid ni Dina, ay kumuha ng kanilang tabak, palihim na pumasok sa bayan, at kanilang pinatay ang lahat ng mga lalaki.
GEN_034_0031	Agad yang pepasirkunsisyun i Sikem uling malsinta ya kang Dina.	Kanilang pinatay si Hamor at si Shekem na kanyang anak sa pamamagitan ng tabak, at kanilang kinuha si Dina sa bahay ni Shekem, at nagsialis.
GEN_034_0032	Lalawan deng marangal dili i Sikem king pamilya na at gagalang de ring kamaganak na.	Nagtungo ang mga anak na lalaki ni Jacob sa mga pinatay, at kanilang sinamsaman ang bayan, sapagkat pinagsamantalahan ang kanilang kapatid.
GEN_034_0033	Minta ya i Hamor at ing anak nang i Sikem king lugal a pititipunan da ring tau at ngara karing kabalen da, Kakaluguran ta la ding taung deti.	Kinuha nila ang kanilang mga kawan, mga bakahan, mga asno, at anumang nasa bayan, at nasa parang.
GEN_034_0034	Paburen ta lang manuknangan king gabun tamu ampon mangalakal.	Sinamsam nila ang kanilang buong kayamanan, ang lahat ng kanilang mga anak at mga asawa at lahat na nasa bahay.
GEN_034_0035	Atin namang lugal para karela keti kekatamu.	Sinabi ni Jacob kina Simeon at Levi, Ako'y inyong binagabag, na gawin akong kasuklamsuklam sa mga nakatira sa lupain, sa mga Cananeo at mga Perezeo.
GEN_034_0036	Makiasawa tamu karing dalaga ra at ila naman makapakiasawa la karing dalaga tamu.	Iilan lamang ang aking tauhan at sila ay magtitipon laban sa akin, at ako'y kanilang sasalakayin, at ang aking sambahayan ay pupuksain.
GEN_034_0037	Pero ating metung a bage a aduan da.	Subalit sinabi nila, Ang amin bang kapatid ay ituturing na parang isang masamang babae?
GEN_034_0038	Pasirkunsisyun la sana ding lalaki kekatamu antimo ila.	<MISSING TRANSLATION>
GEN_034_0039	E wari ding sese rang baka at pibandian ampon ding aliwa pang sese rang animal maging kekatamu la?	<MISSING TRANSLATION>
GEN_034_0040	Inya manusig tamu king buri da ba lang manuknangan kayabe tamu.	<MISSING TRANSLATION>
GEN_034_0041	Pekiramdaman de ring heganaganang mekipulung i Hamor at ing anak nang i Sikem, at pepasirkunsisyun la ring lalaki.	<MISSING TRANSLATION>
GEN_034_0042	King katlung aldo kabang masakit la pa panamdaman ding pepasirkunsisyun, i Simeon at i Levi a kapatad nang Dina kinua da la ring karelang espada at lihim lang linub king siudad.	<MISSING TRANSLATION>
GEN_034_0043	Pete da la ngan ding lalaki.	<MISSING TRANSLATION>
GEN_034_0044	Pete ria naman i Hamor at ing anak nang i Sikem.	<MISSING TRANSLATION>
GEN_034_0045	Kaybat tiki de i Dina at saka na la meko.	<MISSING TRANSLATION>
GEN_034_0046	Pemangua da ring aliwa nang anak Jacob ing nanumang bage akua ra king siudad anting pamanablas king pangasira na puri ning kapatad dang i Dina.	<MISSING TRANSLATION>
GEN_034_0047	Kinua da la ring kawan; dela da la ngan ding baka ampon asno, at ing sablang atyu kilub at kilual ning siudad.	<MISSING TRANSLATION>
GEN_034_0048	Kinua da ngan ing heganaganang bage maulaga; binihag da la ring asawa ra at anak at nipnap da la laman ding pibalebale ra.	<MISSING TRANSLATION>
GEN_034_0049	Nganang Jacob kari Simeon at Levi, Karagul na ning problemang pepasari yo!	<MISSING TRANSLATION>
GEN_034_0050	Uli na ning gewa yu pikasaman da ku ding memalen na ning lugal a iti, ding tau Canaan, at ding Perezeo.	<MISSING TRANSLATION>
GEN_034_0051	Ditak la mu ding tauan ku.	<MISSING TRANSLATION>
GEN_034_0052	Nung sakaling misanmetung la at lusuban da ku, siguradung magisan tamu lahi.	<MISSING TRANSLATION>
GEN_034_0053	Pekibat da, E mi apaintulut ing ituring deng balamu babaing magtinda king katawan na ing kapatad mi!	<MISSING TRANSLATION>
GEN_035_0001	Ngana ning Dios kang Jacob, Gayak ka at munta ka Betel.	Sinabi ng Diyos kay Jacob, Tumayo ka, umahon ka sa Bethel, at doon ka manirahan.
GEN_035_0002	Manuknangan ka karin.	Gumawa ka roon ng isang dambana para sa Diyos na nagpakita sa iyo nang ikaw ay tumatakas mula sa iyong kapatid na si Esau.
GEN_035_0003	Gawa kang altar karin para kanaku, ing Dios, a pepakit keka inyang tatakasan me ing kapatad mung i Esau.	Kaya't sinabi ni Jacob sa kanyang sambahayan, at sa lahat niyang kasama, Alisin ninyo ang mga banyagang diyos na nasa inyo, at maglinis kayo ng inyong sarili, at palitan ninyo ang inyong mga suot.
GEN_035_0004	Inya nganang Jacob karing katubale na at karing kayabe na, Iyugse yu na la ring kikilalanan yung dios a atyu keti kayabe yu.	Tayo'y umahon sa Bethel; at gagawa ako roon ng dambana para sa Diyos na sumagot sa akin sa araw ng aking kabalisahan at naging kasama ko saanman ako nagtungo.
GEN_035_0005	Linisan yu ing sarili yu at miblas kayu.	Kaya ibinigay nila kay Jacob ang lahat ng mga banyagang diyos na nasa kanilang kamay at ang mga hikaw na nasa kanilang mga tainga; at itinago iyon ni Jacob sa ilalim ng punong ensina na malapit sa Shekem.
GEN_035_0006	Kaybat mako tamu at munta karin Betel.	Habang sila'y naglalakbay, ang matinding takot sa Diyos ay dumating sa mga bayang nasa palibot nila, at hindi nila hinabol ang mga anak ni Jacob.
GEN_035_0007	Karin gawa kung altar para king Dios a sinaup kanaku inyang maliligalig ku at parating matnube kanaku nukarin ku man munta.	Dumating si Jacob sa Luz na siyang Bethel, na nasa lupain ng Canaan, siya at ang lahat ng mga taong kasama niya.
GEN_035_0008	Binie da la kang Jacob ding heganaganang kikilalanan dang dios at ding susulud dang tingga.	Nagtayo siya roon ng isang dambana at tinawag niya ang lugar na iyon na El-bethel; sapagkat ang Diyos ay nagpakita sa kanya roon, nang siya'y tumakas mula sa kanyang kapatid.
GEN_035_0009	Kitkut na la ngang Jacob lalam na ning tanaman a ausan dang ensina a atyu malapit Sikem.	Namatay si Debora na yaya ni Rebecca, at inilibing sa paanan ng Bethel, sa ilalim ng ensina, at ang pangalan nito ay tinawag niyang Allon-bacuth.
GEN_035_0010	Inyang lalakuan da ne ing lugal a ita, pepagpa na ning Dios ing maragul a takut karing memalen da ring siudad a makalapit karin.	Muling nagpakita ang Diyos kay Jacob nang siya'y manggaling sa Padan-aram, at siya'y pinagpala.
GEN_035_0011	Inya e re tegal i Jacob at ing pamilya na.	Sinabi ng Diyos sa kanya, Ang pangalan mo'y Jacob; hindi ka na tatawagin pang Jacob kundi Israel ang magiging pangalan mo.
GEN_035_0012	Makanyan yang miras Luz i Jacob at ding kayabe na.	Kaya siya ay tinawag na Israel.
GEN_035_0013	Betel ya naman a lagyu ing lugal a ita; atyu iti king sakup na ning Canaan.	At sinabi ng Diyos sa kanya, Ako ang Diyos na Makapangyarihan sa lahat.
GEN_035_0014	Karin ya ginawang altar at inaus neng El-Betel ing lugal a ita, uling karin ya pepakit ing Dios inyang tatakas ya king kapatad na.	Ikaw ay lumago at magpakarami; isang bansa at maraming mga bansa ang magmumula sa iyo, at mga hari ay magmumula sa iyo.
GEN_035_0015	Karin ya mete i Debora a menese kang Rebeca.	Ang lupaing ibinigay ko kina Abraham at Isaac ay ibibigay ko sa iyo at sa iyong lahi pagkamatay mo.
