id	source_text	target_text
EXO_022	No takawen ti maysa a tao ti maysa a baka wenno karnero ken partienna wenno ilakona, lima a baka ti isukatna iti maysa a baka ken uppat met a karnero ti isukatna iti maysa a karnero.<NEWLINE>Masapul a bayadanna ti tinakawna. No awan ti pagbayadna, isu ti mailako. No ti natakaw nga animal, baka man wenno asno wenno karnero, ket masarakan a sibibiag iti ikutna, dua ti isukatna.<NEWLINE>No matiliwan ti mannanakaw nga agtaktakaw iti rabii iti maysa a balay ket mapapatay, awan sungsungbatan ti pimmatay. Ngem no mapasamak daytoy iti aldaw, makabasol ti pimmatay.<NEWLINE>No ipaarab ti maysa a tao dagiti animalna ket makabulosda sada mapan araben ti mula ti sabali a tao, masapul nga isukatna dagiti kasayaatan nga apit iti bukodna a talon wenno kaubasan.<NEWLINE>No agpuor ti maysa a tao iti talonna ket agkayamkam ti apuy a mangsilmut kadagiti ruot iti talon ti sabali ket mapuoran dagiti dumakdakkel a trigo wenno dagiti pempen a dawa, masapul a bayadan ti nagpuor ti amin a nadadael.<NEWLINE>No italek ti maysa a tao ti kuarta wenno aniaman a sanikuana iti sabali a tao ket matakaw dagitoy iti balay ti nagpaidulinanna, doble ti pagbayad ti matiliwan a nangtakaw.<NEWLINE>No saan a masarakan ti nagtakaw, maidatag ti nagpaidulinanna iti Dios ket isapatana a dina tinakaw dagiti sanikua.<NEWLINE>Amin a kaso a pakaseknan iti sanikua, baka man wenno asno wenno karnero wenno pagan-anay wenno aniaman a napukaw, maipanda iti imatang ti Dios. Maidatag iti pagdaydayawan dagiti mangibaga a kukuada ti sanikua, ket ti siasinoman a sentensiaan ti Dios, doble ti bayadanna iti pudno nga agtagikua.<NEWLINE>No umanamong ti maysa a tao nga aywananna ti asno wenno baka wenno karnero wenno uray ania nga animal ti sabali a tao, ket matay ti animal wenno masugatan wenno maitalaw, no awan ti makasaksi iti naaramid, masapul nga<NEWLINE>agsapata ti nagan ti Apo iti disso a pagdaydayawan a dina tinakaw ti animal. No saan a natakaw ti animal, ibilang ti akinkukua a kas pukawna ket saan a masapul nga agbayad ti nangaywan.<NEWLINE>Ngem no matakaw ti animal, masapul nga agbayad ti agaywan.<NEWLINE>No pinatay dagiti narungsot nga animal, masapul nga ipakita ti agaywan ti narangrangkay nga animal a kas pammaneknek. Saan a nasken a bayadanna ti pinatay dagiti narungsot nga animal.<NEWLINE>No buloden ti maysa a tao ti animal ti sabali ket masugatan wenno matay a saan a nakita ti akinkukua, masapul a bayadanna ti animal.<NEWLINE>Ngem no mapasamak ti kasta iti imatang ti akinkukua, saan a masapul nga agbayad ti nangbulod. No naabangan ti animal, umdas ti abangna a pagbayadna iti natay nga animal.<NEWLINE>No sulisogen ti maysa a lalaki ti balasang a birhen a saan a naitulag a mayasawa ket kaiddaenna, masapul nga ikasarna ti babai kalpasan iti pannangtedna iti sab-ong.<NEWLINE>Ngem no madi ti ama ti babai nga ipaasawa ti anakna, masapul nga ited ti lalaki ti naituding a gatad ti sab-ong; yawatna daytoy iti ama ti babai.<NEWLINE>Papatayenyo ti babai a manggagamud.<NEWLINE>Papatayenyo ti siasinoman a makikaidda iti animal.<NEWLINE>Papatayenyo ti siasinoman nga agidaton iti uray ania a didiosen, ta siak laeng, ni Yahweh, ti pagidatonan.<NEWLINE>Diyo ranggasan wenno idadanes ti ganggannaet. Laglagipenyo a ganggannaetkayo met idi idiay Egipto.<NEWLINE>Diyo irurumen ti uray siasinoman a balo wenno ulila.<NEWLINE>No aramidenyo ti kasta, siak, ni Yahweh, ipangagkonto ti asug dagiti agpatulong kaniak.<NEWLINE>Sumgedto ti pungtotko ket patayenkayto iti gubat. Mabalonto dagiti assawayo ket maulilanto dagiti annakyo.<NEWLINE>No umutang kadakayo ti siasinoman a napanglaw a tattaok, diyo tultuladen ti usurero a paanakanna ti ipautangna.<NEWLINE>No alaenyo ti kagay ti siasinoman a kas pangigawidyo iti utangna, masapul nga isubliyo sakbay a lumnek ti init;<NEWLINE>ta dayta laeng ti pagimengna pangpapudot iti bagina. Anianto pay ti pagturogna? Inton umasug kaniak a patulongan, ipangagkonto agsipud ta manangngaasiak.<NEWLINE>Dikay agsao iti maibusor iti Dios ket diyo ilunod ti siasinoman a panguloyo.<NEWLINE>Itedyo kaniak a dagus dagiti daton nga agtaud iti apit, iti arak ken iti lanayo no tiempo ti panagited.<NEWLINE>Itedyo kaniak ti inauna nga anakyo a lalaki,<NEWLINE>agraman ti inauna a kalakian dagiti baka ken karneroyo; agyan pay laeng ti urbon iti inana iti las-ud ti pito nga aldaw ket maidaton kaniak iti maikawalo nga aldaw.<NEWLINE>Dakayo dagiti tattaok, isu a dikay agsida iti karne ti animal a pinatay dagiti narungsot nga ayup. Itedyo ketdi dagitoy kadagiti aso.	Kon mangawat hin usa nga baka o karnero in usa ka tawo, ngan ihawon o igbaligya ini, kinahanglan pagbaydan niya hin lima nga baka an usa nga baka, ngan upat nga karnero an usa nga karnero.<NEWLINE>Kinahanglan pagbaydan niya an iya kinawat. Kon waray hiya igbarayad, igbabaligya hiya hin kaoripon basi hiya makabayad han iya kinawat. Kon an kinawat nga hayop, ma baka, asno, o karnero, hiagian nga buhi dida ha iya, babaydan niya hin duha an usa nga iya kinawat.<NEWLINE>Kon hidakpan in usa nga kawatan nga nasulod hin balay ha gab-i ngan patayon hiya, diri salaan hin pagpatay an nakamatay ha iya. Kundi kon mahinabo ini ha adlaw, salaan hiya hin pagpatay.<NEWLINE>Kon tugotan hin usa ka tawo nga manabsab an iya mga hayop didto hin usa nga uma o urubasan ngan magsarang ini ngan kaonon an mga tanom didto hin uma hin lain nga tawo, kinahanglan pagbaydan niya an napirde han mga bunga tikang han iya kalugaringon nga kaumhan o urubasan.<NEWLINE>Kon magsurit han iya uma in usa ka tawo ngan maglarab ini ngadto hin uma hin lain nga tawo ngan makasunog hin trigo nga naturok o inani ngan tinambak na, magbabayad han ngatanan nga napirde an tawo nga nakasurit.<NEWLINE>Kon tumangdo in usa ka tawo hin paghimos han kwarta o iba pa nga mahal nga mga butang hin lain nga tawo ngan kawaton ini ha iya balay, pababaydon an kawatan hin doble kon hidakpan hiya.<NEWLINE>Kundi kon diri hidakpan an kawatan, pagdadad-on an tawo nga naghimos han mahal nga mga butang ngadto han dapit hin pagsingba, ngan didto magsusumpa hiya nga waray hiya magkawat han mga butang han tawo.<NEWLINE>Ha tagsa nga kalipongan hiunong hin hiagi, bisan baka ini, asno, karnero, panapton, o bisan ano nga nawara nga butang, dadad-on an duha ka tawo nga nag-aangkon han hiagi ngadto han dapit hin pagsingba. Magbabayad hin doble ngadto han usa ka tawo an tawo nga salaan sumala han pagpahayag han Dyos.<NEWLINE>Kon tumangdo in usa ka tawo hin paghupot hin asno, baka, karnero, o iba nga hayop hin lain nga tawo, ngan mamatay an hayop, o masamad, o madara dida hin usa nga panikas, ngan kon waray man testigo,<NEWLINE>kinahanglan kumadto an tawo han dapit hin pagsingba ngan magsumpa hiya nga waray hiya magkawat han hayop han tag-iya. Kon waray man kawata han naghupot an hayop, aangkonon han tag-iya an napirde ngan diri kinahanglan magbayad ha iya an naghupot;<NEWLINE>kundi kon kawaton an hayop, kinahanglan pagbaydan han naghupot an tag-iya.<NEWLINE>Kon ginpatay ini hin magpintas nga mga mananap, pagdadad-on han naghupot an mga nanhisalin han ginpatay sugad nga saksi; diri hiya kinahanglan magbayad han ginpatay hin magpintas nga mga mananap.<NEWLINE>Kon humuram hin hayop in usa ka tawo tikang hin lain nga tawo, ngan masamad o mamatay ini nga waray dida an tag-iya, kinahanglan nga magbayad han hayop an hinmuram.<NEWLINE>Kundi kon mahinabo ini nga nakada an tag-iya, diri kinahanglan magbayad an hinmuram. Kon ginplitehan ini nga hayop, an plite igo na nga bayad han napirde nga hayop.<NEWLINE>Kon maglumay in usa nga lalake hin usa nga uray pa nga daraga nga waray pa niya kasabot, ngan makighilawas ha iya, kinahanglan baydan niya an bugay hin pagkasal ngan pangasaw-on niya an babaye.<NEWLINE>Kundi kon dumiri an amay han daraga nga pangasaw-on han lalake an iya anak, kinahanglan baydan han lalake an amay han daraga hin kwarta nga tupong han bugay para hin uray pa nga daraga nga karaslon.<NEWLINE>Pataya niyo an bisan hin-o nga babaye nga diwatahan.<NEWLINE>Pataya niyo an bisan hin-o nga tawo nga makighilawas hin mananap.<NEWLINE>Pataya niyo an bisan hin-o nga maghalad ngadto hin bisan ano nga diyos labot ha akon nga Ginoo .<NEWLINE>Ayaw niyo pagtalimpigosa o pagraogdaoga in lumalangyaw; panumdom nga mga lumalangyaw kamo hadto anay didto ha Ehipto.<NEWLINE>Ayaw niyo pagraogdaoga an bisan hin-o nga balo nga babaye o ilo.<NEWLINE>Kon pagbuhaton niyo ini, mabaton ha ira ako nga Ginoo kon magtawag hira ha akon hin pakibulig,<NEWLINE>ngan masisina ako ngan pamamatayon ko kamo didto ha pag-awayan. Mababalo an iyo kaasaw-an, ngan maiilo an iyo mga anak.<NEWLINE>Kon mapahuram kamo hin kwarta ngadto hin bisan hin-o nga kablas han akon mga tawo, ayaw kamo pagsugad hin usa nga parapautang, ngan ayaw hiya pagsukti hin patubo.<NEWLINE>Kon an bisan hin-o kuhaan niyo in kurugpos nga garantiya hin iya utang, kinahanglan ig-uli niyo ini ha iya nga diri pa matutunod an adlaw,<NEWLINE>kay amo gudla ito an iya igkukurugpos basi hiya kapasoan. Ano pa man an iya ighihigda? Kon magtawag hiya ha akon hin pakibulig, babatonon ko hiya, kay maloloy-on ako.<NEWLINE>Ayaw niyo pagpakaraota an Dyos, ngan ayaw kamo pagtunglo hin usa nga pangulo han iyo mga tawo.<NEWLINE>Ighatag niyo ha akon an mga halad tikang han iyo trigo, han iyo bino, ngan han iyo lana hin olibo kon panahon na hin paghalad hini.<NEWLINE>Ighatag ha akon an iyo suhag nga kalalaken-an.<NEWLINE>Ighatag ha akon an suhag han iyo mga baka ug mga karnero. An suhag nga lalaki magpabilin upod han iroy niya sulod hin pito ka adlaw ngan ighalad ini ha akon dida han ikawalo ka adlaw.<NEWLINE>Akon kamo mga tawo, sanglit kinahanglan diri kamo kumaon han karne hin bisan ano nga mananap nga ginpatay hin ihalas nga mga mananap; ighatag lugod ini ngadto han kaayaman.
EXO_023	Dikay agiwaras iti sao nga awan kinapudnona. Dikay tulongan ti tao a nagbasol babaen iti panagsaksiyo iti ulbod.<NEWLINE>Diyo suroten ti kaaduan no agaramidda iti dakes wenno agulbodda tapno dadaelenda ti hustisia.<NEWLINE>Ngem diyo ipakita nga ayonanyo ti napanglaw bayat ti pannakaidarumna.<NEWLINE>No makitayo a nakabulos ti baka wenno asno ti kabusoryo, tiliwenyo ket isubliyo kenkuana.<NEWLINE>No nakusbo ti asnona gapu iti nadagsen nga awitna, diyo baybay-an ngem tulonganyo ketdi a mangpatakder.<NEWLINE>No maisaklang ti napanglaw, diyo ipaidam ti hustisia kenkuana.<NEWLINE>Dikay agpabasol no awan pammaneknekyo. Diyo papatayen ti tao a nalinteg ken awan basolna. Dusaek ti siasinoman nga agaramid iti kasta a kinadakes.<NEWLINE>Dikay umawat iti pasuksok, ta ti pasuksok pagbulsekenna ti tao ket dina makita ti nalinteg ken dadaelenna ti kalintegan dagiti awan basolna.<NEWLINE>Diyo idadanes ti ganggannaet. Ammoyo ti rikna ti maysa a ganggannaet ta ganggannaetkayo met idi idiay Egipto.<NEWLINE>Mulaanyo ti dagayo iti las-ud ti innem a tawen ket urnongenyo ti maapit.<NEWLINE>Ngem iti maikapito a tawen, diyo mulmulaan ket diyo met ap-apiten ti aniaman nga agtubo. Bay-anyo nga agpaay kadagiti napanglaw ti aniaman nga agtubo ket baginto met dagiti atap nga animal ti matda. Kasta met ti aramidenyo kadagiti mulayo nga ubas ken olibo.<NEWLINE>Innem nga aldaw nga agtrabahokayo, ngem aginanakayo iti maikapito nga aldaw tapno makainana dagiti tagabu ken ganggannaet nga agtartrabaho kadakayo, kasta met dagiti baka ken asnoyo.<NEWLINE>Ipangagyo ti amin nga imbagak kadakayo. Dikay agkararag kadagiti didiosen wenno baliksen la koma dagiti naganda.<NEWLINE>Tallo a fiesta ti rambakanyo iti tinawen kas pammadayaw kaniak.<NEWLINE>Iti bulan ti Abib, ti bulan nga ipapanawyo idi idiay Egipto, rambakanyo ti Fiesta ti Tinapay nga Awan Lebadurana. Kas imbilinko kadakayo, tinapay laeng nga awan lebadurana ti kanenyo iti las-ud ti pito nga aldaw bayat ti fiesta. Dikay umay agdaydayaw kaniak no awan ti idatonyo.<NEWLINE>Rambakanyo ti Fiesta ti Panagapit babaen iti panangidatonyo ti umuna a maapit kadagiti talonyo.<NEWLINE>Rambakanyo ti Fiesta ti Abong-abong iti panaggibus ti tawen, inton burasenyo ti bunga dagiti kaubasan ken minuyonganyo.<NEWLINE>Tunggal tawen, kadagitoy a fiesta, masapul nga umay dagiti amin a lallaki tapno agdaydayawda kaniak nga Apo a Diosyo.<NEWLINE>Diyo pakuyogan iti tinapay nga adda lebadurana ti dara ti animal nga idatonyo kaniak. Diyo met ipabigat ti taba dagiti animal a maidatag kaniak kadagitoy a fiesta.<NEWLINE>Yegyo iti balay ni Yahweh a Diosyo ti bunga ti umuna nga apit ti talonyo tunggal tawen.<NEWLINE>Diyo lutoen ti urbon a karnero wenno kalding iti gatas ti inana.<NEWLINE>Ibaonko ti maysa nga anghel nga umun-una ngem dakayo tapno salaknibannakayo iti panagdaliasatyo ken ipannakayo iti lugar nga insaganak.<NEWLINE>Ipangagyo ket tungpalenyo ti amin nga ibagana. Diyo sukiren gapu ta siak ti nangibaon kenkuana ket dinto mapakawan ti siasinoman nga agsukir.<NEWLINE>Ngem no ipangagyo ket aramidenyo ti amin nga ibagak, gubatek dagiti amin a kabusoryo.<NEWLINE>Idalannakayto ti anghelko. Ipannakayo iti daga dagiti Amorreo, Heteo, Perezeo, Cananeo, Heveo ken Jebuseo ket dadaelekto ida.<NEWLINE>Dikay agrukbab wenno agdaydayaw kadagiti didiosenda. Diyo tuladen dagiti ar-aramidenda. Dadaelenyo dagiti didiosenda ket rebbaenyo dagiti nasantoan a bato nga adigida.<NEWLINE>No agdaydayawkayo kaniak, ni Yahweh a Diosyo, ikkankayo iti makan ken danum ken ilisikayo kadagiti amin a kita ti sakit.<NEWLINE>Iti dagayo, awanto ti babai a maalisan ket awanto met ti lupes. Ikkankayto iti atiddog a biag.<NEWLINE>Gapu iti aramidek, agbutengto kaniak dagiti amin a bumusor kadakayo ket kiburekto dagiti kagubatyo. Pagsanudekto amin a kabusoryo ket itarayandakayto.<NEWLINE>Kellaatekto dagiti kabusoryo ket agtataraydanto amin nga agkakaribuso. Paksiatekto dagiti Heveo, Cananeo, ken Heteo inton sumungadkayo.<NEWLINE>Saankonto pay laeng a pagtalawen amin ida iti uneg ti maysa a tawen tapno saan a mabaybay-an ti daga ken saan nga umadu unay dagiti atap nga animal a pagpeggadanyo.<NEWLINE>In-inutekto a papanawen ida agingga nga umadukayo ket kabaelanyo a tagikuaen ti daga.<NEWLINE>Mangruginto ti beddengyo iti Baybay a Nalabaga agingga iti Baybay a Mediterranean ken manipud let-ang agingga iti Karayan Eufrates. Ikkankayto iti pannakabalin a mangparmek kadagiti taga-sadiay ket pagtalawenyonto ida iti isusungadyo.<NEWLINE>Dikay makitulag kadakuada wenno kadagiti didiosenda.<NEWLINE>Diyo ipalubos nga agnaed dagitoy a tattao iti pagilianyo. No ipalubosyo nga agnaedda, pagbasolendakayto iti maibusor kaniak. No agdaydayawkayo kadagiti didiosenda, isunto ti pakaigapuan ti pannakadadaelyo.	Ayaw kamo pagpasarang hin buwa nga mga hurobhurob, ngan ayaw kamo pagbulig hin salaan nga tawo pinaagi hin buwa nga pagsaksi.<NEWLINE>Ayaw kamo pagsunod han kadam-an kon magbuhat hira hin sayop, o kon magsaksi hira hin paglubag han katadongan.<NEWLINE>Ayaw kamo pagpakita hin pagdapig hin usa nga kablasanon dida han iya bista.<NEWLINE>Kon hikit-an niyo nga nakabuhi in baka o asno han iyo kaaway, ig-uli ini ha iya.<NEWLINE>Kon matumba an iya asno tungod han mabug-at karga, buligi hiya hin pagpatindog han iya asno; ayaw pagpabay-i la hiya.<NEWLINE>Ayaw niyo iglirong an katadongan ngadto hin usa nga kablasanon kon naatubang hiya han hukmanan.<NEWLINE>Ayaw paghimohimo hin buwa nga mga sumbong, ngan ayaw pagpataya in tawo nga waray sala, kay paghuhukman ko ha karat-an in bisan hin-o nga magbuhat hin sugad kamaraot nga butang.<NEWLINE>Ayaw kamo pagkarawat hin hukip, kay nakakabuta ini hin mga tawo hin pagkita han matadong, ngan nakakabungkag ini han katadongan nga tinitindogan hadton mga waray sala.<NEWLINE>Ayaw niyo pagraogdaoga in lumalangyaw; maaram kamo kon ano in binabati hin usa nga lumalangyaw, kay nagin mga lumalangyaw man kamo didto ha Ehipto.<NEWLINE>Sulod hin unom ka tuig, tamni an iyo tuna ngan tiroka an mga abot han iyo uma.<NEWLINE>Kundi ayaw pagtamni an iyo uma dida han ikapito ka tuig, ngan ayaw niyo pag-aniha in bisan ano nga maturok dida han iyo uma. Makakakaon an mga kablas han mga naturok dida han uma, ngan makakakaon an ihalas nga kamanampan han nahisalin. Amo ngahaw an buhata han iyo mga urubasan ngan han iyo mga kahoy nga olibo.<NEWLINE>Pagtrabaho kamo sulod hin unom ka adlaw ha usa ka simana, kundi ayaw kamo pagtrabaho dida han ikapito ka adlaw, basi makapahuway an iyo mga oripon ngan an mga lumalangyaw nga nagtratrabaho para ha iyo, pati an iyo mga hayop.<NEWLINE>Pamatii an ngatanan nga iginsiring ko, nga Ginoo , ha iyo. Ayaw kamo pag-ampo han iba nga kadiyosan; ayaw bisan hin paghinabi han ira mga ngaran.<NEWLINE>Sauroga hin pagpasidungog ha akon in tulo nga mga pyesta ha kada tuig.<NEWLINE>Dida han bulan han Abib, nga amo ngahaw an bulan nga ibinaya niyo han Ehipto, sauroga niyo an Pyesta han Tinapay nga Waray Patubo ha paagi nga akon iginsugo ha iyo. Ayaw kamo pagkaon hin tinapay nga may-ada patubo sulod hin pito ka adlaw hini nga pyesta. Ayaw gud kamo pagkanhi hin pagsingba ha akon nga waray niyo dara nga halad.<NEWLINE>Sauroga niyo an Pyesta han Pag-ani kon magtikang na kamo hin pag-ani han iyo mga abot.<NEWLINE>Sauroga niyo an Pyesta han mga Payagpayag dida han tikatarapos na an katsirak kon manguha na kamo han mga bunga han iyo mga urubasan ngan mga tanom nga igos ug olibo ngan iyo na hiposon ha kamalig.<NEWLINE>Ha kada tuig dida hini nga tulo nga mga pyesta kinahanglan kumanhi an ngatanan nga iyo kalalaken-an basi magsingba ha akon, an Ginoo nga iyo Dyos.<NEWLINE>Ayaw kamo paghalad hin tinapay nga may patubo kon maghalad kamo ha akon hin hayop. Kinahanglan diri igsalin tubtob han pagkaaga an tambok han mga hayop nga iginhalad ha akon sulod hini nga mga pyesta.<NEWLINE>Kada tuig dad-a niyo ngadto han balay han Ginoo nga iyo Dyos an syahan nga trigo nga iyo pag-anihon.<NEWLINE>Ayaw niyo paglutoa in nati nga karnero o kanding dida han gatas han iroy hini.<NEWLINE>Papag-unhon ko ha iyo in usa nga anghel basi manalipod ha iyo samtang nga naglalakat kamo, ngan hin pagdara ha iyo ngadto han dapit nga akon gin-andam.<NEWLINE>Pamatii ngan sugta hiya niyo. Ayaw kamo pagsupil ha iya. Diri hiya mapasaylo hin sugad nga pagsupil kay ginsugo ko hiya.<NEWLINE>Kundi kon magsugot kamo ha iya ngan magbuhat kamo han ngatanan nga akon pinapatuman ha iyo, ako an maasdang han ngatanan niyo nga mga kaaway.<NEWLINE>Mag-uuna ha iyo an akon anghel ngan pagdadad-on kamo ngadto han tuna han mga Amoreohanon, han mga Perizeohanon, han mga Canaanhon, han mga Hibeohanon, ngan han mga Jebuseohanon, ngan pagpupuohon ko hira.<NEWLINE>Ayaw kamo pagyukbo o pagsingba han ira kadiyosan, ngan ayaw niyo pagsunda an mga buruhaton han ira tuluohan. Bungkaga an ira kadiyosan ngan rub-a an ira baraan nga mga harigi nga bato.<NEWLINE>Kon iyo pagsingbahon ako, an Ginoo nga iyo Dyos, tatagan ko kamo hin pagkaon ug tubig ngan tatambalon ko an ngatanan niyo nga mga sakit.<NEWLINE>Didto han iyo tuna waray mapupunitan o mababaw-as nga babaye. Tatagan ko kamo hin higlawig nga kinabuhi.<NEWLINE>Hahadlokon ko an mga tawo nga nakontra ha iyo; sasamokon ko an mga tawo nga nakikig-away ha iyo, ngan paiisolon ko tikang ha iyo an ngatanan niyo nga mga kaaway.<NEWLINE>Lilisangon ko an iyo mga kaaway; paiiwason ko an mga Hibeohanon, an mga Canaanhon, ngan an mga Hiteohanon samtang nasulong kamo.<NEWLINE>Diri ko hira paiiwason sulod la hin usa ka tuig; kon pagbuhaton ko ini mawawaray tawo an tuna ngan magdadamo hin duro an ihalas nga kamanampan.<NEWLINE>Paiiwason ko lugod hira hin hinayhinay tubtob nga igo na an iyo kadamo hin pagtag-iya han tuna.<NEWLINE>Paaaboton ko an mga pag-ultan han iyo tuna tikang han Dagat Aqaba ngadto han Salog han Eufrates, ngan tikang han Dagat Mediteraneo ngadto han kamingawan. Igtutubyan ko ha iyo gahom an mga umurukoy han tuna ngan tatabogon hira niyo samtang nasulong kamo.<NEWLINE>Ayaw kamo pakigsabot ha ira o han ira kadiyosan.<NEWLINE>Ayaw niyo pagtugoti ini nga mga tawo hin pag-ukoy ha iyo nasod; kay kon tugotan niyo, hira an mag-aghat ha iyo hin pakasala kontra ha akon. Kon magsingba kamo han ira kadiyosan, magigin makamaratay ini nga bitik para ha iyo.
EXO_024	Kinuna ni Yahweh ken ni Moises, Sumang-atka ditoy bantay. Itugotmo da Aaron, Nadab, Abiu ken ti pitopulo kadagiti panglakayen ti Israel. Inton adayokayo pay laeng iti ayanko, agkurnokayo iti panagdaydayaw.<NEWLINE>Sikanto laeng ti umasideg. Dinto umasideg dagiti kakadduam. Ket saan met a mapalubosan dagiti tattao a sumang-at iti bantay.<NEWLINE>Napan imbaga ni Moises kadagiti tattao ti amin a bilin ken alagaden nga inted ni Yahweh. Sangsangkamaysada amin a simmungbat, Aramidenmi ti amin nga imbaga ti Apo .<NEWLINE>Insurat ni Moises dagiti amin a bilin ni Yahweh.<NEWLINE>Iti agsapa iti sumuno nga aldaw, nangbangon iti altar iti arisadsad ti bantay ken nangipatakder iti 12 a baton-lagip a mangibagi kadagiti 12 a tribu ti Israel.<NEWLINE>Kalpasanna, binilinna ti sumagmamano nga agtutubo a lallaki a mangpuor kadagiti animal a kas sagut ken ni Yahweh ken mangidatag iti sumagmamano a toro a baka a kas daton a pakikappia.<NEWLINE>Inkabil ni Moises kadagiti palanggana ti kagudua ti dara dagiti napapatay nga animal ket insuyatna iti altar ti nabati.<NEWLINE>Innalana ti libro ti tulag a nakailanadan dagiti bilin ni Yahweh sana binasa iti napigsa. Kinuna dagiti tattao, Agtulnogkami iti Apo ket tungpalenmi amin nga imbilinna.<NEWLINE>Innala ni Moises ti dara nga adda kadagiti palanggana ket winarisanna dagiti tattao. Kinunana, Daytoy ti dara a mangpatalged iti pannakitulag ti Apo kadakayo idi intedna amin dagitoy a bilin.<NEWLINE>Simmang-at da Moises, Aaron, Nadab, Abiu ken ti 70 kadagiti panglakayen ti Israel iti bantay.<NEWLINE>Nakitada ti Dios ti Israel. Adda iti babaen ti sakana ti umasping iti pagnaan a nabaldosaan iti safiro ken asul a kas iti tangatang.<NEWLINE>Saan nga inan-ano ti Dios dagitoy a panglakayen iti Israel. Nakitada ti Dios. Kalpasanna, nagpapangan ken nagiinumda.<NEWLINE>Kinuna ni Yahweh ken ni Moises, Sumang-atka iti bantay ket umayka iti ayanko. Agyanka ditoy ket itedkonto kenka dagiti dua a tapi a bato a nakailanadan dagiti linteg ken bilin nga insuratko nga annuroten dagiti tattao.<NEWLINE>Nagsagana ni Moises ken ni Josue a katulonganna ket simmang-at ni Moises iti nasantoan a bantay.<NEWLINE>Kinuna ni Moises kadagiti panglakayen, Urayendakami ditoy agingga nga agsublikami. Mabati da Aaron ken Hur. Isuda ti papanan ti siasinoman nga adda parikutna.<NEWLINE>Simmang-at ni Moises ket adda ulep a nangkumot iti Bantay Sinai.<NEWLINE>Bimmaba iti rabaw ti bantay ti makapurar a lawag a mangipakdaar iti kaadda ni Yahweh. Iti panagkita dagiti Israelita, ti lawag ket kasla apuy a gumilgil-ayab iti tapaw ti bantay. Innem nga aldaw a kinumotan ti ulep ti bantay. Iti maikapito nga aldaw, manipud iti ulep, inawagan ni Yahweh ni Moises.<NEWLINE>Simrek ni Moises iti ulep iti isasang-atna iti bantay. Nagyan idiay iti las-ud ti 40 nga aldaw ken rabii.	Nagsiring kan Moises an Ginoo , Sagka han bukid ngadi ha akon, ikaw ngan hira Aaron, Nadab, Abiu, ngan hin 70 han mga pangulo han Israel; ngan yukbo kamo hin pagsingba samtang antaw pa kamo ha akon.<NEWLINE>Ikaw la an mahirani ha akon, an iba diri maupod ha imo. Diri ngani angay sumagka han bukid an mga tawo.<NEWLINE>Ginkadto ni Moises an mga tawo ngan ginsumatan niya han ngatanan nga mga sugo han Ginoo ngan han ngatanan nga mga turumanon. Nagdurungan hin pagbaton an mga tawo, Pagtutumanon namon an ngatanan nga iginsiring han Ginoo .<NEWLINE>Iginsurat ni Moises an ngatanan nga mga sugo han Ginoo . Temprano pa han pagkaaga nagtindog hiya hin usa nga altar didto ha ubos han bukid ngan nagbutang hin 12 nga mga bato, nga natindog han 12 nga mga tribo han Israel.<NEWLINE>Niyan nagsugo hiya hin batan-on nga kalalaken-an, basi maghalad han Ginoo hin mga hayop nga tutuboron ngan hin mga tudo nga baka nga ighahalad para hin pagkaurosa.<NEWLINE>Kinuha ni Moises an katunga han dugo han mga hayop ngan iginsulod ini dida han mga makaong; ngan an nahisalin nga katunga iginsablig niya ngada han altar.<NEWLINE>Niyan kinuha niya an basahan han ginsaaran, diin nahisurat an mga sugo han Ginoo , ngan ginbasa ini niya hin dako nga tingog basi hinbatian han mga tawo. Nagsiring hira, Pagsusugton namon an Ginoo ngan pagtutumanon namon an ngatanan nga iya iginsugo.<NEWLINE>Niyan kinuha ni Moises an dugo dida han mga makaong ngan iginsablig ini ngadto han mga tawo. Nagsiring hiya, Amo ini an dugo nga nagparig-on han ginsaaran nga ginhimo han Ginoo ha iyo dida han paghatag niya ha iyo hini ngatanan nga mga sugo.<NEWLINE>Sinmagka han bukid hira Moises, Aaron, Nadab, Abiu, ngan an 70 nga mga pangulo han Israel,<NEWLINE>ngan hinkit-an nira an Dyos han Israel. Ha ubos han iya mga tiil hinkit-an nira in sugad hin safiro nga taramakan nga maasol sugad han mahayag nga langit.<NEWLINE>Waray paglabti han Dyos ini nga mga pangulo han Israel; hinkit-an nira an Dyos, ngan kahuman nangaon ngan nag-irignom hira.<NEWLINE>Nagsiring kan Moises an Ginoo , Sagka han bukid ngadi ha akon ngan samtang aadi ka, ighahatag ko ha imo in duha nga mga papan nga bato nga ginsuratan ko han ngatanan nga mga balaod nga igtututdo mo han mga tawo.<NEWLINE>Nag-andam hira Moises ug Josue nga iya kabulig ngan nagtikang hi Moises hin pagsagka han baraan nga bukid.<NEWLINE>Ginsiring ni Moises an mga pangulo, Hulata kami dinhe ha kampo tubtob han amon pagbalik. Aanhi man ha iyo hira Aaron ug Ur; makakahimo hin pagdangop ha ira an bisan hin-o nga may turuhayon nga sumbong.<NEWLINE>Sinmagka hi Moises han Bukid Sinai ngan natahoban an bukid hin dampog.<NEWLINE>Hinmugdon ha bukid an himaya han Ginoo . Hinkit-an han mga Israelita an himaya han Ginoo nga sugad hin naglalahinggab nga kalayo didto ha bawbaw han bukid. Natahoban han dampog an bukid sulod hin unom ka adlaw, ngan dida han ikapito ka adlaw, nagtawag an Ginoo kan Moises tikang han dampog.<NEWLINE>Nagtipaunhan hi Moises hin pagsagka han bukid ngadto han dampog. Didto nagpabilin hiya sulod hin 40 ka adlaw ug gab-i.
