id	source_text	target_text
EXO_001	Dagitoy ti nagan dagiti annak ni Jacob a kimmuyog kenkuana a napan idiay Egipto agraman dagiti familiada<NEWLINE>Ruben, Simeon, Levi, Juda,<NEWLINE>Issacar, Zabulon, Benjamin,<NEWLINE>Dan, Neftali, Gad ken Aser.<NEWLINE>Pitopulo ti dagup dagiti annak a nagtaud ken ni Jacob. Adda idin ni Jose nga anakna idiay Egipto.<NEWLINE>Natay sadiay ni Jose, kasta met amin a kakabsatna ken amin daydi a kaputotan.<NEWLINE>Nupay kasta, napardas ti panagadu dagiti Israelita, isu a pimmigsada ket nagwaras dagiti kaputotanda iti entero nga Egipto.<NEWLINE>Naglabas ti tiempo. Nagturay idiay Egipto ti baro nga ari nga awan ti ammona maipapan ken ni Jose.<NEWLINE>Kitaenyo, kinuna ti ari kadagiti iturayanna. Agpeggadtayo ta nakaad-adu ken nabileg unayen dagiti Israelita.<NEWLINE>Masapul nga agaramidtayo iti pamuspusan tapno malapdan ti panagaduda. Ta no adda gubat, amangan no kumapponda kadagiti kabusor a manggubat kadatayo, ket aglibasda a pumanaw iti dagatayo.<NEWLINE>Iti kasta, nangdutokda kadagiti narungsot a kapatas a mangparigat kadagiti Israelita nga agtrabaho iti nadagdagsen pay ngem iti sigud nga ar-aramidenda. Binangon dagiti Israelita ti Pitom ken Rameses, dua a siudad a pagidulinan iti makan.<NEWLINE>Ngem no kasano ti panangparparigat dagiti Egipcio kadakuada, immad-aduda ketdi ket nagwarasda. Isut' gapuna a kinabuteng ida dagiti Egipcio.<NEWLINE>Naranggas ti panangtagabuda kadagiti Israelita.<NEWLINE>Rimmigat ti biagda. Pinilitda ida nga agtrabaho kadagiti talonda ken agipasdek kadagiti patakderda. Dida naasian kadakuada.<NEWLINE>Kinasao ti ari ti Egipto dagiti partera a Hebreo ket imbilinna kadakuada, No paanakenyo dagiti Hebreo, patayenyo ti maladaga no lalaki. Ngem no babai, bay-anyo nga agbiag.<NEWLINE>Maysa kadagitoy a partera ti agnagan iti Zifra ket Pua ti nagan met ti sabali.<NEWLINE>Ngem managbuteng dagiti partera iti Dios ket saanda a tinungpal ti bilin ti ari. Binay-anda nga agbiag dagiti maladaga a lallaki.<NEWLINE>Pinaayaban ngarud ti ari dagiti partera. Sinaludsodna, Apay a kasta ti ar-aramidenyo? Apay a palpalubosanyo nga agbiag dagiti lallaki a maladaga?<NEWLINE>Sabali ngamin dagiti babbai a Hebreo, apo, insungbatda. Saanda a kas kadagiti babbai nga Egipcio. Nalakada nga aganak. Sakbay nga adda sumangpet a partera, naipasngayen ti ubing.<NEWLINE>Gapu ta managbuteng dagiti partera iti Dios, binendisionanna dagitoy, ket naikkanda iti bukodda a familia.<NEWLINE>Immad-adu ken bimmilbileg dagiti Israelita.<NEWLINE>Imbilin ti ari ti Egipto kadagiti amin nga iturayanna nga ibellengda iti karayan Nile ti amin a kaippasngay a lallaki a Hebreo, ngem palubosanda nga agbiag dagiti babbai.	An mga anak ni Jacob nga inmupod ha iya ngadto ha Ehipto ngan an kada usa upod an iya panimalay,<NEWLINE>amo hira Ruben, Simeon, Levi, Juda,<NEWLINE>Isacar, Zabulon, Benjamin,<NEWLINE>Dan, Neftali, Gad ug Aser.<NEWLINE>Setenta hira ngatanan nga mga tawo nga tunay nga tulin ni Jacob. Hi Jose nga iya anak nakadto na ngadaan ha Ehipto.<NEWLINE>Linmabay in maiha nga katuigan ngan nagkamatay hira Jose, an ngatanan nga iya kabugtoan, ngan an ngatanan hini nga katulinan,<NEWLINE>kundi damo an mga anak han ira mga tulin nga mga Israelita. Nagdamo hira hin duro ngan nagmakusog gud hira ug nakaluob hira han Ehipto.<NEWLINE>Nagkamay-ada bag-o nga hadi didto ha Ehipto nga waray gud niya hinbaroan mahitungod kan Jose.<NEWLINE>Nagsiring hiya ha iya mga tawo, Damo na hin duro ug magkusog na ini nga mga Israelita ngan makaharadlok na hira para ha aton.<NEWLINE>Ha panahon hin araway, bangin dumapig hira han aton mga kaaway ngan makig-away hira kontra ha aton, ngan kumalagiw hira tikang han nasod. Kinahanglan mamiling kita hin paagi hin pagpugong nga diri hira magtikadamo.<NEWLINE>Sanglit iginbutang hira han mga Ehiptohanon ha ubos hin mga mag-isog nga mga kapatas nga magpapaantos ha ira pinaagi hin makuri nga trabaho. Gintindog han mga Israelita an mga syudad han Piton ug Rameses nga mga sentro nga hirimosan hin pagkaon han hadi.<NEWLINE>Kundi mas nga ginpakurian han mga Ehiptohanon an mga Israelita, nagtikadamo lugod hira ngan nalukop nira an tuna. Nagkahadlok han mga Israelita an mga Ehiptohanon,<NEWLINE>ngan ginpakurian gud an ira mga kinabuhi pinaagi hin pagpirit ha ira ngadto hin mapait nga pagkaoripon. Ginpatrabaho hira didto han ira mga buruhaton hin pagbalay ngan didto han ira kaumhan, ngan waray gud nira pagkalooy ha ira.<NEWLINE>Niyan ginsiring han hadi han Ehipto hira Sifra ug Pua nga duha nga mga parahilot nga nagbulig hin pagpaanak han Hebreo nga kababayen-an,<NEWLINE>Kon magpapaanak kamo han Hebreo nga kababayen-an, pataya niyo an bata, kon lalake ini; kundi kon babaye, pabay-i nga mabuhi an bata.<NEWLINE>Kundi mahadlokon han Dyos an mga parahilot sanglit waray nira pagsugta an hadi; ira lugod tinugotan nga mabuhi an kabataan nga kalalaken-an.<NEWLINE>Ginpasugoan han hadi an mga parahilot ngan ginpakianhan hira, Kay ano nga ginbuhat niyo ini? Kay ano nga tinugotan niyo nga mabuhi an kabataan nga kalalaken-an?<NEWLINE>Binmaton hira, Diri sugad han Hebreo nga kababayen-an an Ehiptohanon nga kababayen-an, madagmit la hira mag-anak, ngan natatawo na an bata ha diri pa kami naabot.<NEWLINE>Tungod nga mahadlokon han Dyos an mga parahilot, ginpakaupay hira han Dyos ngan gintagan hira hin mga panimalay nga ira kalugaringon. Ngan nagpadayon hin pagdamo ngan pagmakusog an mga Israelita.<NEWLINE>Ha kataposan nagsugo an hadi han ngatanan niya nga mga tawo, Kuhaa niyo an tagsa nga bag-o nga natatawo nga lalake nga Hebreo ngan ilabog hiya ngadto han Salog Nilo, kundi tugoti nga mabuhi an ngatanan nga kabataan nga kababayen-an.
EXO_002	Iti daydi a panawen, adda lalaki a nagtaud iti kaputotan ni Levi a nangasawa iti katribuanna.<NEWLINE>Nagsikog ti babai ket nangipasngay iti lalaki. Idi makitana a nalungpo ti ubing, inlemmengna iti las-ud ti tallo a bulan.<NEWLINE>Ngem idi dinan mailemmeng, nangala iti basket a naaramid iti runo ket pinastaanna iti alketran tapno saan a makastrek ti danum. Inkargana ti ubing iti uneg ti basket sana inkabil iti karunoan iti igid ti karayan.<NEWLINE>Iti saan unay nga adayo, nagtakder ti manang ti ubing tapno makitana ti mapasamak iti adingna.<NEWLINE>Iti saan a mabayag, simmalog ti babai nga anak ti ari ti Egipto tapno agdigos iti karayan. Nakitana ti basket iti karunoan ket pinaalana iti maysa kadagiti babbai nga agserserbi kenkuana nga agpagnapagna iti igid ti karayan.<NEWLINE>Idi luktan ti prinsesa ti basket, nakitana ti maysa nga ubing nga agsangsangit ket naasian. Anak ti Hebreo daytoy! kinunana.<NEWLINE>Immasideg ti manang ti ubing ket kinunana, Apo, kayatmo kadi nga isapulanka iti Hebreo a mangtagibi iti dayta nga ubing?<NEWLINE>Sige, isapulannak, insungbatna. Napan ngarud ti balasitang ket inayabanna ti ina ti maladaga.<NEWLINE>Kinuna ti anak ti ari iti ina, Alaem daytoy nga ubing. Tagibiem a kas anakko ket tangdanankanto.<NEWLINE>Innala ti ina ti maladaga ket tinagibina.<NEWLINE>Idi makadakkel bassit ti ubing, impanna iti prinsesa a nangibilang iti ubing a kas anakna. Gapu ta inaonko iti danum daytoy nga ubing, panaganak iti Moises, kinuna ti prinsesa.<NEWLINE>Iti maysa nga aldaw, idi maysan nga agtutubo ni Moises, sinarungkaranna dagiti kadaraanna a Hebreo. Naimatanganna ti pannakaparparigatda. Nadagsen ti trabahoda. Nakitana ti maysa nga Egipcio a mangkabkabil iti maysa a Hebreo.<NEWLINE>Inwaras ni Moises ti panagkitana ket idi awan makitana a sabali a tao, pinatayna ti Egipcio sana inkali ti bangkay iti kadaratan.<NEWLINE>Iti sumuno nga aldaw, nagsubli ni Moises ket nakitana ti dua a Hebreo nga aggubgubal. Apay a kabkabilem ti padam a Hebreo? kinunana iti nakabasol.<NEWLINE>Apay? Siasino kadi ti nangisaad kenka a mangituray ken mangukom kadakami? insungbatna. Patayennak met kadi a kas iti panangpataymo iti Egipcio?<NEWLINE>Nagdanag ni Moises ket kinunana iti nakemna, Naammoanda gayamen ti inaramidko.<NEWLINE>Idi madamag daytoy ti ari, kayatna a patayen ni Moises, ngem nakalibas ni Moises ket napan nagnaed idiay Midian.<NEWLINE>Iti maysa nga aldaw, idi agtugtugaw ni Moises iti asideg ti maysa a bubon,<NEWLINE>dimteng ti pito a babbai tapno sumakdoda. Annak ida ni Jetro a padi ti Midian. Pinunnoda dagiti pagkargaan ti danum tapno painumenda dagiti karnero ken kalding ni amada.<NEWLINE>Ngem adda dagiti agpaspastor a dimteng ket pinapanawda dagiti babbai. Inarayat ida ni Moises sana pinainum dagiti animalda.<NEWLINE>Idi nagawidda, sinaludsod ni amada, Apay a nasapakayo a simmangpet?<NEWLINE>Kinunada, Adda dagiti agpaspastor a nangpapanaw kadakami iti pagpainuman. Ngem tinulongannakami ti maysa nga Egipcio. Insakduannakami ken pinainumna pay dagiti animal.<NEWLINE>Sadino ti ayanna? sinaludsodna. Apay a pinanawanyo? Inkay ayaban ta makipangan kadatayo.<NEWLINE>Inkeddeng ni Moises ti agnaed sadiay. Impaasawa ni Jetro kenkuana ni Sefora nga anakna.<NEWLINE>Nangipasngay ni Sefora iti maysa a lalaki. Gapu ta ganggannaet ni Moises iti sabali a daga, pinanagananna iti Gersom ti anakna.<NEWLINE>Limmabas ti adu a tawen. Natay ti ari ti Egipto, ngem nagtuloy latta ti pannakaparigat dagiti Israelita gapu iti pannakatagabuda. Immasugda a patulongan iti Dios<NEWLINE>ket impangagna ida; nalagipna ti tulagna ken ni Abraham, ni Isaac ken ni Jacob.<NEWLINE>Nakitana ti kasasaad dagiti Israelita ket naasian kadakuada.	Dida hini nga panahon may-ada usa ka tawo nga sakop han tribo ni Levi, nga nangasawa hin babaye nga sakop han iya kalugaringon nga tribo<NEWLINE>ngan nag-anak hira hin lalake. Han paghikit-i han iroy nga mahusay hiya nga bata, iya gintago an bata sulod hin tulo ka bulan.<NEWLINE>Kundi han makuri na niya matago an bata, kinmuha hiya hin basket nga hinimo hin mga tangbo, ngan ginbuli ini hin alkitran basi diri sudlon hin tubig. Iginsulod niya an bata, ngan iya iginbutang ini didto han higtaas nga mga tangbo ha ligid han salog.<NEWLINE>Didto ha uruunhan nagtukdaw an bugto nga babaye han bata hin pag-inaw kon ano an mahinanabo han bata.<NEWLINE>Linmugsong ha salog an anak nga babaye han hadi hin pagkarigo, samtang naglalakat an iya mga surugoon nga kadaragan-an ha pangpang han salog. Ha gilayon iya hinkit-an an basket didto han higtaas nga mga tangbo, ngan ginsugo niya in usa nga oripon nga babaye hin pagkuha han basket.<NEWLINE>Ginbuksan han prinsesa an basket ngan hinkit-an niya in usa nga bata nga lalake. Nagtitinangis ini ngan nalooy hiya ngan nagsiring, Usa gud ini han kabataan nga Hebreo.<NEWLINE>Niyan ginpakianhan an prinsesa han babayehay nga bugto han bata, Makadto ba ako hin pagtawag hin usa nga babaye nga Hebreo nga magpapasuso han bata para ha imo?<NEWLINE>Alayon, hin pagkadto, binmaton hiya. Sanglit linmakat an babayehay ngan gindara niya an kalugaringon nga iroy han bata.<NEWLINE>Ginsiring han prinsesa an babaye, Dad-a ini nga bata ngan pasusoha ini para ha akon, ngan susuholan ko ikaw. Sanglit gindara han babaye an bata ngan ginpasuso ini niya.<NEWLINE>Han dakolaay na an bata, iya gindara an bata ngadto han babaye nga anak han hadi, nga naghablos hini nga bata sugad nga iya kalugaringon nga anak. Nagsiring hiya ha iya ngahaw, Ginkuha ko hiya tikang han tubig, sanglit pagngangaranan ko hiya nga Moises.<NEWLINE>Han dako na hi Moises, ginmawas hiya hin pagduaw han iya mga tawo nga mga Hebreo, ngan hinkit-an niya kon gin-unan-o hin pagpirita ha ira hin pagbuhat hin magbug-at nga buruhaton. Hinkit-an pa ngani niya in usa nga Ehiptohanon nga nagpapatay hin usa nga Hebreo, nga usa han iya kalugaringon nga mga tawo.<NEWLINE>Tinman-aw anay hi Moises, ngan han pakakita niya nga waray man nagkikita, ginpatay niya an Ehiptohanon ngan ginlubong niya an lawas dida han baras.<NEWLINE>Han pagkabuwas binmalik hiya ngan hinkit-an niya nga nag-aaway in duha nga mga Hebreo. Ginsiring niya an nakasayop, Kay ano nga gintutubal mo in usa nga imo igkasi-Hebreo?<NEWLINE>Binmaton an tawo, Hin-o an naghimo ha imo nga amon punoan ngan maghurukom? Papatayon mo ba liwat ako sugad han pagpatay mo han Ehiptohanon? Nahadlok hi Moises ngan nakapanhunahuna, Nahibaroan ngay-an han mga tawo an akon ginbuhat.<NEWLINE>Han pakabati han hadi hiunong han nahinabo, nagtinguha hiya hin pagpatay kan Moises, kundi pinmalagiw hi Moises ngan kinmadto hiya hin pag-ukoy didto ha tuna han Madian.<NEWLINE>Usa ka adlaw han nalingkod hi Moises ha ligid hin usa nga atabay, nagkaabot in pito nga mga anak nga kababayen-an ni Jetro nga padi han Madian, hin pag-alog ngan pagpuno han mga irimnan han kahayopan para han mga karnero ngan mga kanding han ira amay.<NEWLINE>Kundi pinaiwas hin mga magmarangno hin mga karnero an kababayen-an nga mga anak ni Jetro. Niyan ginbuligan hira ni Moises ngan iya ginpainom an ira kahayopan.<NEWLINE>Han pagbalik nira ngadto han ira amay, nagpakiana hiya, Kay ano nga timprano pa man kamo manguli yana nga adlaw?<NEWLINE>Binmaton hira, Ginbuligan kami hin usa nga Ehiptohanon, sanglit nahiuna kami han mga magmarangno hin mga karnero, ngan iginsarok pa ngani kami niya hin tubig ngan ginpainom niya an amon mga hayop.<NEWLINE>Hain man hiya? ginpakianhan niya an iya mga anak. Kay ano nga ginbayaan la niyo an tawo didto ha gawas? Kadtoa ngan dapita hiya pagkaon upod ha aton.<NEWLINE>Sanglit didto hi Moises pag-ukoy, ngan iginpaasawa ha iya ni Jetro hi Sefora nga iya anak.<NEWLINE>Nag-anak hira hin lalake. Nagsiring hi Moises ha iya la ngahaw, Usa ako nga lumalangyaw dinhe hini nga tuna, sanglit pagngangaranan ko hiya nga Gerson.<NEWLINE>Han paglabay hin pira ka tuig namatay an hadi han Ehipto, kundi waray hunong an araba han mga Israelita hiunong han ira pagkaoripon ngan nagtawag hira hin pakibulig. Inmabot an ira mga pangaraba ngadto han Dyos<NEWLINE>nga nakabati han ira mga pag-araba, ngan nahinumdom hiya han iya ginsaaran kanda Abraham, Isaac ug Jacob.<NEWLINE>Hinkit-an niya an pagkaoripon han mga Israelita, ngan nalooy hiya ha ira.
EXO_003	Ay-aywanan idi ni Moises dagiti karnero ken kalding ni Jetro a katuganganna a padi ti Midian. Impanna ti arban iti labes ti let-ang ket dimteng idiay Horeb a bantay ti Dios.<NEWLINE>Sadiay, nagparang kenkuana ti anghel ni Yahweh a kas gumilgil-ayab nga apuy nga aggapu iti tengnga ti bassit a kayo. Nakita ni Moises a sumsumged ti kayo ngem saan a marunot.<NEWLINE>Kinunana iti nakemna, Nakaskasdaaw daytoy. Apay ngata a saan a mauram ti kayo? Umasidegak man ta kitaek.<NEWLINE>Idi makita ni Yahweh nga umas-asideg ni Moises, inawaganna manipud iti tengnga ti kayo. Moises, Moises! kinunana.<NEWLINE>Adtoyak, insungbat ni Moises.<NEWLINE>Dika umas-asideg, kinuna ti Dios. Ikkatem ta pallokam ta nasantoan ti daga a pagtaktakderam.<NEWLINE>Siak ti Dios ti amamda Abraham, Isaac ken Jacob. Liningdan ni Moises ti rupana ta mabuteng a kumita iti Dios.<NEWLINE>Kinuna ni Yahweh, Nakitak ti nakakaasi a kasasaad dagiti tattaok idiay Egipto. Nangngegko ti panagdawatda iti tulong gapu iti pannakaparparigatda. Wen, ammok dagiti sagsagabaenda.<NEWLINE>Bimmabaak tapno ispalek ida kadagiti Egipcio. Iruarko ida iti dayta a daga ket ipanko ida iti daga a nadam-eg ken nalawa. Nabaknang ken nabunga daytoy a daga a pagnanaedan ita dagiti Cananeo, Heteo, Amorreo, Perezeo, Heveo ken Jebuseo.<NEWLINE>Wen, nangngegko ti asug dagiti tattaok ket makitak ti panangparparigat dagiti Egipcio kadakuada.<NEWLINE>Ita, ibaonka iti ari tapno iruarmo dagiti tattaok nga Israelita manipud Egipto.<NEWLINE>Kinuna ni Moises iti Dios, Nanumoak laeng a tao. Kasano a mapanak iti ari tapno iruarko dagiti Israelita iti Egipto?<NEWLINE>Addaakto kenka, insungbat ti Dios, ket daytoyto ti pagilasinan a siak ti nangibaon kenka: Inton mairuarmo dagiti tattaok iti Egipto, agdaydayawkayto kaniak ditoy a bantay.<NEWLINE>Kinuna ni Moises, Inton innak kadagiti Israelita ket ibagak kadakuada nga imbaonnak ti Dios dagiti kapuonanda, ket saludsodenda ti naganmo, ania ti ibagak?<NEWLINE>Kinuna ti Dios, Siak ti siak. Daytoy ti ibagamto kadagiti Israelita, Imbaonnak ti mangawag iti bagina iti SIAK.<NEWLINE>Ibagamto kadagiti Israelita, a siak ni Yahweh a Dios dagiti kapuonanyo, ti Dios da Abraham, Isaac ken Jacob, imbaonka kadakuada. Daytoy ti naganko iti agnanayon. Isunto ti pangawag kaniak dagiti amin a kaputotan.<NEWLINE>Inka ummongen dagiti pangulo ti Israel ket ibagam kadakuada a nagparang kenka ni Yahweh a Dios dagiti kapuonanyo, ti Dios da Abraham, Isaac ken Jacob. Ibagam a naimatanganna ti kasasaadyo ken ti ar-aramiden dagiti Egipcio kadakayo.<NEWLINE>Inkeddengko nga iruarko ida idiay Egipto ket ipanko ida iti daga dagiti Cananeo, Heteo, Amorreo, Perezeo, Heveo ken Jebuseo. Nadam-eg ken nabunga dayta a daga.<NEWLINE>Ipangagto dagiti tattaok ti saom. Kalpasanna, kakuyogmonto dagiti pangulo ti Israel a mapan iti ari ti Egipto ket kunayonto kenkuana, Nakisao kadakami ni Yahweh a Dios dagiti Hebreo. Palubosannakami koma a mapan idiay let-ang iti tallo nga aldaw tapno agidatagkami iti daton ken ni Yahweh a Diosmi.<NEWLINE>Ammok a dinakayto palubosan ti ari malaksid no mapilit.<NEWLINE>Ngem usarekto ti pannakabalinko ket dusaekto ti Egipto; nakabutbutengto dagiti aramidek sadiay. Kalpasan dayta, palubosannakayton.<NEWLINE>Itan-okkonto dagiti tattaok tapno raemen ida dagiti Egipcio ket inton pumanawda, saandanto nga ima-ima.<NEWLINE>Mapanto ti tunggal babai nga Israelita iti babai nga agnaed iti balay ti kaarrubana nga Egipcio ket dumawat iti pagan-anay ken alahas a pirak ken balitok. Yarruatdanto dagitoy kadagiti annakyo. Kastoyto ti panangalada iti kinabaknang dagiti Egipcio.	Usa ka adlaw, han nagmamangno hi Moises han mga karnero ngan mga kanding ni Jetro nga iya ugangan nga lalake, nga padi han Madian, igintabok niya ha kamingawan an panon, ngan inmabot hiya didto ha Sinai, an baraan nga bukid.<NEWLINE>Didto pinmakita ha iya an anghel han Ginoo sugad hin usa nga laga nga nagawas tikang ha butnga hin tanom. Hinkit-an ni Moises nga naglalaga an tanom, kundi waray ini kauugtang.<NEWLINE>Urosahon ini, naghunahuna hiya. Kay ano nga diri nauugtang an tanom? Maduok daw ako ngan kikitaon ko.<NEWLINE>Han paghikit-i han Ginoo nga naduok hi Moises, nagtawag hiya ha butnga han tanom ngan nagsiring, Moises, Moises!<NEWLINE>Binmaton hiya, Aadi ako.<NEWLINE>Nagsiring an Dyos, Ayaw na pagduruduok pa ngadi. Hukasa an imo sandalyas kay natukdaw ka dida hin baraan nga tuna.<NEWLINE>Ako amo an Dyos han imo kaapoy-apoyan, an Dyos nira Abraham, Isaac ug Jacob. Sanglit gintahoban ni Moises an iya bayhon kay nahadlok hiya hin pagtan-aw han Dyos.<NEWLINE>Niyan nagsiring an Ginoo , Hinkit-an ko an maraogdaog nga pagdumara han akon mga tawo didto ha Ehipto; hinbatian ko an ira pangaraba nga talwason ko hira tikang han mga mag-isog nga mga kapatas nira. Sayod ako han ngatanan ira mga pag-antos,<NEWLINE>sanglit linmusad ako hin pagtalwas ha ira tikang han mga Ehiptohanon, ngan pagdara ha ira tikang ha Ehipto ngadto hin usa nga malangbo ngan hiluag nga tuna, hin usa nga hura ngan matambok nga tuna nga inuokyan na yana han mga Canaanhon, han mga Hiteohanon, han mga Amoreohanon, han mga Periseohanon han mga Hibeohanon, ngan han mga Jebuseohanon.<NEWLINE>Hinbatian ko gud an pangaraba han akon mga tawo, ngan hinkit-an ko an pagraogdaoga ha ira han mga Ehiptohanon.<NEWLINE>Yana sinusugo ko ikaw ngadto han hadi han Ehipto basi makagmando ka han akon mga tawo hin paggawas tikang han iya nasod.<NEWLINE>Kundi nagsiring han Dyos hi Moises, Diri man ako kinikilala. Uunanhon ko hin pagkadto han hadi ngan pagpagawas han mga Israelita tikang ha Ehipto?<NEWLINE>Binmaton an Dyos, Maupod ako ha imo, ngan kon pagpagawson mo na an mga tawo tikang ha Ehipto, magsisingba kamo ha akon dinhe hini nga bukid. Amo ito an magpapamatuod nga ako an nagsugo ha imo.<NEWLINE>Kundi binmaton hi Moises, Kon kumadto ako han mga Israelita ngan sumiring ako ha ira, Ginsugo ako han Dyos han iyo kaapoy-apoyan nganhi ha iyo, mapakiana hira ha akon, Ano an iya ngaran? ano man an akon igsusumat ha ira?<NEWLINE>Nagsiring an Dyos, Ako amo hi ako. Kinahanglan sidngon mo hira: An Amo Ako amo an nagsugo ha akon nganhi ha iyo.<NEWLINE>Sumati an mga Israelita nga ako amo an Ginoo nga Dyos han iyo kaapoy-apoyan, nga Dyos nira Abraham, Isaac, ug Jacob nga nagsugo ha imo ngadto ha ira. Amo ini an akon ngaran ha kadayonan; amo ini an igtatawag ha akon han ngatanan nga tiarabot nga mga katulinan.<NEWLINE>Kadto ngan tiroka an mga pangulo han Israel, ngan sumati hira nga pinmakita ha imo ako nga Ginoo nga Dyos han ira kaapoy-apoyan, nga Dyos nira Abraham, Isaac, ug Jacob. Sumati hira nga kinmadto ako ha ira ngan hinkit-an ko an binubuhat ha ira han mga Ehiptohanon.<NEWLINE>Nagbuot na ako nga pagagawson ko hira tikang ha Ehipto, diin ginraraogdaog hira, ngan pagdadad-on ko hira ngadto hin usa nga hura ngan matambok nga tunaan tuna han mga Canaanhon, han mga Hiteohanon, han mga Amoreohanon, han mga Periseohanon, han mga Hibeohanon, ngan han mga Jebuseohanon.<NEWLINE>Mamamati an akon mga tawo han imo igsisiring ha ira. Katapos kinahanglan kumadto ka han hadi han Ehipto upod han mga pangulo han Israel, ngan sidnga hiya, Nagpadayag ha amon an Ginoo nga Dyos han mga Hebreo. Yana tugoti kami hin paglakat hin tulo ka adlaw ngadto ha kamingawan hin paghalad hin mga halad nga tinubod ngadto han Ginoo nga amon Dyos.<NEWLINE>Maaram ako nga diri matugot ha iyo an hadi han Ehipto gawas kon piriton gud hiya.<NEWLINE>Kundi gagamiton ko an akon gahom, ngan kakastigohon ko an Ehipto pinaagi hin pagbuhat hin magpakaharadlok nga mga butang didto. Katapos hito, palalakton kamo niya.<NEWLINE>Patatahoron ko ha iyo an mga taga-Ehipto basi kon bumaya na an akon mga tawo, diri hira malakat nga waray dara.<NEWLINE>Makadto an tagsa nga babaye nga Israelita han iya mga amyaw nga Ehiptohanon ngan ha bisan hin-o nga babaye nga Ehiptohanon nga nag-uokoy dida han iya balay, ngan mangangaro hin panapton ngan hin mga alahas nga bulawan ug salapi. Igsusul-ot ini han mga Israelita dida han ira mga anak nga kalalaken-an ug kababayen-an, ngan pagdadad-on nira an mga manggad han mga taga-Ehipto.
