id	source_text	target_text
EXO_001	Amo ini ang mga ngalan sang mga anak nga lalaki ni Jacob nga nagkadto sa Ehipto upod sa iya, ang tagsatagsa upod sa iya panimalay. Sila amo sanday<NEWLINE>Ruben, Simeon, Levi, Juda,<NEWLINE>Isacar, Zabulon, Benjamin,<NEWLINE>Dan, Neftali, Gad, kag Aser.<NEWLINE>Ang kadamuon sang mga kaliwat ni Jacob setenta tanan. Si Jose nga iya anak didto na nga daan sa Ehipto.<NEWLINE>Sang ulihi si Jose kag ang iya mga utod nga lalaki nagkalamatay, subong man yadtong bug-os nga henerasyon.<NEWLINE>Pero ang mga kaliwat ni Israel may madamo nga mga kaanakan, nagmuad gid sila kag nagmabakod, sa bagay nga naglapnag sila sa duta sang Ehipto.<NEWLINE>Karon may isa ka bag-o nga hari nga naggahom sa Ehipto. Wala sia makakilala kay Jose.<NEWLINE>Ang hari nagsiling sa iya mga ginsakpan, Tan-awa ninyo, ini nga mga tawo nga Israelinhon nagadamo kag nagabakod, kag nabutang kita sa katalagman.<NEWLINE>Karon pamatii ninyo! Pangitaan naton sang paagi nga indi na gid sila magdamo. Kay kon may inaway, basi magdampig sila sa aton mga kaaway sa pag-away batok sa aton, kag magpalagyo sila sa aton pungsod.<NEWLINE>Gani ginbutangan sila sing mga mapintas nga mga kabo sa pagpaobra sa ila sing pataypatay agod magluya sila. Ang mga Israelinhon nagpatindog sang mga siudad sang Pitom kag Rameses para sa hari nga pagatipunan nila sing mga pagkaon.<NEWLINE>Pero sa nagadugang ang pagpigos sang mga Ehiptohanon sa mga Israelinhon, tapat pa gani nga nagadamo kag nagalapnag sila. Ang mga Ehiptohanon nagkahadlok sa mga Israelinhon.<NEWLINE>Gani mapintas nga gin-ulipon nila ang mga Israelinhon,<NEWLINE>kag ginpabudlay ang ila pagkabuhi paagi sa pagpaobra sa ila sa lunang kag sa tisa, kag sang tanan nga sahi sang obra sa uma. Ginpilit nila sila sa paghimo sang tanan nga mabug-at nga mga obra.<NEWLINE>Dayon ang hari sang Ehipto naghambal sa mga paltera nga nagapabata sa mga babayi nga mga Hebreo. Ang isa ginhingalanan kay Sipra kag ang isa kay Pua.<NEWLINE>Nagsiling ang hari, Kon nagapabata kamo sang Hebreo nga mga babayi amo ini ang inyo pagahimuon: kon ang lapsag lalaki, patyon ninyo; pero kon babayi ini, pabayai lang nga mabuhi.<NEWLINE>Pero ang mga paltera wala magtuman sa hari kay nahadlok sila sa Dios. Sa baylo ginpabay-an nila nga mabuhi ang mga lapsag nga lalaki.<NEWLINE>Gani ginpatawag sang hari ang mga paltera kag ginpamangkot, Ngaa bala nga ginhimo ninyo ini kag ginpabay-an nga mabuhi ang mga lapsag nga lalaki?<NEWLINE>Nagsabat sila, Ang mga babayi nga Hebreo indi pareho sang mga babayi nga Ehiptohanon; mahapos sila magbata nga sa wala pa gani kami makaabot nakabata na sila.<NEWLINE>Bangod kay nagakahadlok ang mga paltera sa Dios, ang Dios nagmaayo sa ila kag ginhatagan niya sila sang ila kaugalingon nga mga panimalay kag nagdamo nga nagdamo ang mga Israelinhon, kag nangingamhanan sila.<NEWLINE>Dayon ang hari nagmando sa tanan niya nga mga ginsakpan: Ihaboy ninyo sa Suba sang Nilo ang tagsa ka bata nga lalaki nga matawo sa mga Hebreo, pero pabay-i lang ninyo ang mga bata nga babayi nga mabuhi.	Ito ang mga pangalan ng mga anak ni Israel na dumating sa Ehipto kasama si Jacob; bawat isa ay kasama ang kanya-kanyang sambahayan<NEWLINE>sina Ruben, Simeon, Levi, Juda,<NEWLINE>Isacar, Zebulon, Benjamin,<NEWLINE>Dan, Neftali, Gad, at Aser.<NEWLINE>Lahat ng taong nagmula sa balakang ni Jacob ay pitumpung katao, at si Jose ay nasa Ehipto na.<NEWLINE>Namatay si Jose at ang lahat ng kanyang mga kapatid at ang buong salinlahing iyon.<NEWLINE>Ang mga anak ni Israel ay lumago at nadagdagang mabuti; sila'y dumami at naging napakalakas kaya't ang lupain ay napuno nila.<NEWLINE>At may bumangong isang bagong hari sa Ehipto na hindi kilala si Jose.<NEWLINE>Sinabi niya sa kanyang bayan, Tingnan ninyo, ang sambayanan ng mga anak ni Israel ay mas marami at higit na malakas kaysa atin.<NEWLINE>Halikayo, pakitunguhan natin sila nang may katusuhan, baka sila'y dumami at mangyari na kapag nagkaroon ng digmaan ay umanib sila sa ating mga kaaway, lumaban sa atin, at umalis sa lupain.<NEWLINE>Kaya't naglagay sila ng mga tagapangasiwa upang pahirapan sila sa kanilang mga sapilitang paggawa. Kanilang ipinagtayo si Faraon ng mga lunsod imbakan, ang Pitom at Rameses.<NEWLINE>Subalit habang kanilang pinahihirapan sila, lalo silang dumarami at lalong lumalaganap. At kinasuklaman nila ang mga anak ni Israel.<NEWLINE>Malupit na pinapaglingkod ng mga Ehipcio ang mga anak ni Israel;<NEWLINE>at kanilang pinapait ang kanilang buhay sa pamamagitan ng mahirap na paglilingkod, sa luwad at sa tisa, at sa lahat ng uri ng gawain sa bukid; at sa lahat ng kanilang gawain ay malupit silang pinapaglingkod.<NEWLINE>Ang hari ng Ehipto ay nagsalita sa mga hilot na mga Hebrea, na ang pangalan ng isa ay Sifra, at ang pangalan ng ikalawa ay Pua.<NEWLINE>Kanyang sinabi, Paghilot ninyo sa mga babaing Hebrea at pagtingin ninyo sa kanila sa upuang panganganakan, kung lalaki ay papatayin ninyo; ngunit kung babae ay mabubuhay ito.<NEWLINE>Subalit ang mga hilot ay natakot sa Diyos at hindi nila ginawa ang gaya nang iniutos sa kanila ng hari ng Ehipto, kundi hinayaan nilang mabuhay ang mga batang lalaki.<NEWLINE>Ipinatawag ng hari ng Ehipto ang mga hilot at sinabi sa kanila, Bakit ninyo ginawa ang bagay na ito at hinayaan ninyong mabuhay ang mga batang lalaki?<NEWLINE>Sinabi ng mga hilot sa Faraon, Sapagkat ang mga babaing Hebrea ay hindi gaya ng mga babaing Ehipcia. Sila'y malalakas at nakapanganak na bago dumating ang hilot sa kanila.<NEWLINE>Kaya't ang Diyos ay naging mabuti sa mga hilot; at ang taong-bayan ay dumami at naging napakalakas.<NEWLINE>Dahil ang mga hilot ay natakot sa Diyos, kanyang binigyan sila ng mga sambahayan.<NEWLINE>Pagkatapos, iniutos ni Faraon sa kanyang buong bayan, Itatapon ninyo sa ilog ang bawat lalaking ipanganak ngunit bawat babae ay hayaan ninyong mabuhay.
EXO_002	Karon may isa ka tawo sa tribo ni Levi nga nagpangasawa sa isa ka babayi sa amo man nga tribo.<NEWLINE>Nagbusong ang iya asawa kag nagbata sing isa ka lalaki. Sang makita sang iya iloy nga ang bata gwapo kag maayo sing lawas, gintago niya sia sa sulod sang tatlo ka bulan.<NEWLINE>Pero sang indi na niya matago ang bata, nagkuha sia sang isa ka basket nga nahimo sa tabun-ak, kag iya ini ginbutangan sing balaw agod indi makasulod ang tubig. Ginpahigda niya ang bata sa sini nga basket kag ginbutang niya ini sa bibi sang suba nga may matag-as nga mga tabun-ak.<NEWLINE>Ang iya utod nga babayi nagtindog sa ulounhan sa pagbantay kon ano ang mahanabo sa iya.<NEWLINE>Karon ang anak nga babayi sang hari nagkadto sa suba sa pagpaligo, samtang ang iya manug-atipan nga mga babayi nagdayandayan sa pangpang sang suba. Sa hinali nakita niya ang basket sa mga tabun-ak, kag ginsugo niya ang iya ulipon nga babayi sa pagkuha sini.<NEWLINE>Ginbuksan ini sang anak sang hari kag iya nakita ang lapsag nga lalaki nga nagahibi. Naluoy sia sa bata kag nagsiling, Isa ini sang mga bata sang mga Hebreo.<NEWLINE>Dayon ang utod nga babayi sang lapsag nagpamangkot sa iya, Luyag mo bala nga malakat ako sa pagpangita sang isa ka babayi nga Hebreo nga magaatipan sini nga bata para sa imo?<NEWLINE>Nagsabat sia, Lakat ka. Gani naglakat ang bata nga babayi kag gintawag ang iloy mismo sang bata.<NEWLINE>Ang anak sang hari nagsiling sa iya, Dalha ini nga bata kag saguron mo sia para sa akon, kay suholan ko ikaw. Gani ginkuha sang babayi ang bata kag ginsagod.<NEWLINE>Sang magdakudaku na ang bata, gindala niya ini sa anak sang hari kag gin-ayop niya ini subong nga iya anak. Nagsiling ang anak sang hari, Ginkuha ko sia sa tubig, gani hingalanan ko sia kay Moises.<NEWLINE>Isa sadto ka adlaw, sang daku na si Moises, nagduaw sia sa iya mga kasimanwa nga Hebreo, kag iya nakita kon daw ano ang pagpilit sa ila sa paghimo sang mabug-at nga mga obra. Nakita niya ang isa ka Ehiptohanon nga nagpatay sang isa ka Hebreo, isa sang iya mga kasimanwa.<NEWLINE>Nagpanghulonghulong sia, kag sang wala sia sing may nakita, ginpatay niya ang Ehiptohanon kag iya ginlubong ang bangkay sa balas.<NEWLINE>Sang madason nga adlaw nagbalik sia, kag iya na man nakita ang duha ka mga Hebreo nga nagaaway. Nagsiling sia sa isa nga nakahimo sing sayop, Ngaa bala ginasakit mo ang kapareho mo nga Hebreo?<NEWLINE>Nagsabat sia, Sin-o bala ang naghimo sa imo nga pangulo kag manughukom sa amon? Patyon mo man bala ako subong sang pagpatay mo sa isa ka Ehiptohanon? Dayon kinulbaan si Moises kag nagpanghunahuna, Nahibal-an gali sang mga tawo ang akon ginhimo.<NEWLINE>Sang nabatian ini sang hari, gintinguhaan niya nga patyon si Moises, pero nagpalagyo si Moises kag nagkadto sa duta sang Midian, sa diin sia nag-estar.<NEWLINE>Isa ka adlaw, sang pag-abot niya didto, nagpungko sia sa tupad sang bubon. Karon nag-abot sa bubon ang pito ka mga anak nga babayi ni Jetro nga pari sang Midian. Nagtimba sila sing tubig kag nagpuno sang palaimnan sang mga karnero kag mga kanding sang ila amay.<NEWLINE>Nag-abot man ang iban nga mga manugbantay sang mga karnero kag gintabog nila palayo ang mga anak ni Jetro. Pero gintabangan sila ni Moises, kag ginpainom niya ang ila mga kahayupan.<NEWLINE>Sang pagpauli nila sa ila amay nga si Jetro, nagpamangkot sia, Ngaa temprano pa kamo nakapauli karon nga adlaw?<NEWLINE>Nagsabat sila, Ang isa ka Ehiptohanon nagluwas sa amon sa mga manugbantay sang karnero kag gintimbaan pa niya kag ginpainom ang amon mga kahayupan.<NEWLINE>Ginpamangkot niya ang iya mga anak nga babayi, Diin na sia? Ngaa ginbayaan ninyo sia didto? Lakat kag tawga ninyo sia agod makakaon upod sa aton.<NEWLINE>Nagpamat-od si Moises sa pag-estar didto, kag ginpaasawa ni Jetro sa iya ang iya anak nga si Sipora.<NEWLINE>Nagbata sia sing lalaki kag ginhingalanan ni Moises ang bata kay Gersom, kay nagsiling sia sa iya kaugalingon, Dumoluong ako diri sa sini nga duta.<NEWLINE>Sang makaligad ang madamo nga mga tinuig, ang hari sang Ehipto napatay. Ang mga Israelinhon nag-antos sa gihapon tungod sang pag-ulipon sa ila kag nagpangayo sila sing bulig. Ang ila pagpangayo sing bulig nakalambot sa Dios,<NEWLINE>kag nabatian niya ang ila pagpanghakroy. Dayon nadumdoman sang Dios ang iya kasugtanan kay Abraham, kay Isaac kag kay Jacob.<NEWLINE>Nakita sang Dios ang pag-ulipon sa mga Israelinhon, kag nabalaka sia sa ila.	May isang lalaki sa lipi ni Levi na humayo at nag-asawa ng isang anak na babae ni Levi.<NEWLINE>Ang babae ay naglihi at nanganak ng isang lalaki. Nang kanyang makita na ito ay maganda, kanyang itinago ito ng tatlong buwan.<NEWLINE>Nang hindi na niya ito maitago pa, ikinuha niya ito ng isang basket na yari sa papiro, at pinahiran niya ng betun at alkitran. Kanyang isinilid ang bata roon at inilagay sa talahiban sa tabi ng ilog.<NEWLINE>Tumayo sa malayo ang kanyang kapatid na babae upang malaman ang mangyayari sa bata.<NEWLINE>Noon, ang anak na babae ni Faraon ay lumusong upang maligo sa ilog, at naglakad ang kanyang mga alalay na babae sa tabi ng ilog. Kanyang nakita ang basket sa talahiban at ipinakuha sa kanyang alalay.<NEWLINE>Nang kanyang buksan ito, nakita niya ang bata; at narito, ang sanggol ay umiyak. At kanyang kinaawaan siya at sinabi, Ito'y isa sa mga anak ng mga Hebreo.<NEWLINE>Nang magkagayo'y sinabi ng kanyang kapatid na babae sa anak ng Faraon, Aalis ba ako upang itawag kita ng isang tagapag-alaga mula sa mga babaing Hebrea na mag-aalaga ng bata para sa iyo?<NEWLINE>Sinabi sa kanya ng anak ng Faraon, Umalis ka. Ang batang babae ay umalis at tinawag ang ina ng bata.<NEWLINE>Sinabi ng anak ng Faraon sa kanya, Dalhin mo ang batang ito at alagaan mo para sa akin at uupahan kita. Kaya't kinuha ng babae ang bata at inalagaan ito.<NEWLINE>Ang bata ay lumaki at kanyang dinala ito sa anak ng Faraon, at ito'y naging kanyang anak. Kanyang pinangalanan siyang Moises, dahil sinabi niya, Sapagkat aking iniahon siya sa tubig.<NEWLINE>Nang mga araw na iyon, nang malaki na si Moises, nagtungo siya sa kanyang mga kapatid, at nakita ang kanilang sapilitang paggawa. Kanyang nakita ang isang Ehipcio na binubugbog ang isang Hebreo na isa sa kanyang mga kapatid.<NEWLINE>Siya'y tumingin sa magkabi-kabilang dako at nang siya'y walang makitang tao, kanyang pinatay ang Ehipcio at kanyang itinago sa buhanginan.<NEWLINE>Nang siya'y lumabas nang sumunod na araw, may dalawang lalaking Hebreo na naglalaban; at kanyang sinabi sa gumawa ng masama, Bakit mo sinasaktan ang iyong kasama?<NEWLINE>Sinabi niya, Sinong naglagay sa iyo bilang pinuno at hukom sa amin? Iniisip mo bang patayin ako, gaya nang pagpatay mo sa Ehipcio? Natakot si Moises at kanyang inisip, Tiyak na ang bagay na ito ay alam na.<NEWLINE>Nang mabalitaan ng Faraon ang bagay na ito, ninais niyang patayin si Moises.<NEWLINE>Subalit si Moises ay tumakas mula kay Faraon at nanirahan sa lupain ng Midian. Siya'y umupo sa tabi ng isang balon.<NEWLINE>Ang pari noon sa Midian ay may pitong anak na babae. Sila'y dumating at umigib ng tubig at kanilang pinuno ang mga inuman upang painumin ang kawan ng kanilang ama.<NEWLINE>Ang mga pastol ay dumating at sila'y ipinagtabuyan; ngunit si Moises ay tumindig at sila'y ipinagtanggol, at pinainom ang kanilang kawan.<NEWLINE>Nang sila'y dumating kay Reuel na kanilang ama ay sinabi nito, Bakit napakadali ninyong dumating ngayon?<NEWLINE>Kanilang sinabi, Iniligtas kami ng isang Ehipcio mula sa kamay ng mga pastol at saka iniigib pa niya kami ng tubig at pinainom ang kawan.<NEWLINE>Sinabi niya sa kanyang mga anak, Saan siya naroon? Bakit ninyo iniwan ang lalaking iyon? Tawagin ninyo siya upang makakain ng tinapay.<NEWLINE>Si Moises ay nasiyahang makitira sa lalaking iyon at kanyang ibinigay kay Moises si Zifora na kanyang anak na babae.<NEWLINE>Nanganak siya ng isang lalaki at kanyang pinangalanang Gershom sapagkat sinabi ni Moises, Ako'y manlalakbay sa ibang lupain.<NEWLINE>Pagkaraan ng maraming araw, ang hari ng Ehipto ay namatay. Ang bayang Israel ay dumaing dahil sa pagkaalipin at sila'y humingi ng tulong. Ang kanilang daing dahil sa pagkaalipin ay nakarating sa Diyos.<NEWLINE>Narinig ng Diyos ang kanilang daing at naalala ng Diyos ang kanyang tipan kina Abraham, Isaac, at Jacob.<NEWLINE>At tiningnan ng Diyos ang mga anak ni Israel at nalaman ng Diyos ang kanilang kalagayan.
EXO_003	Karon si Moises nagabantay sang mga karnero kag mga kanding sang iya ugangan nga si Jetro, ang pari sang Midian. Gindala niya ang panong sa tabok sang desierto, kag nakaabot sia sa Sinai, ang balaan nga bukid.<NEWLINE>Didto ang anghel sang Ginoo nagpakita sa iya sa dagway sang nagadabdab nga kalayo sa tunga sang magamay nga kahoy. Gintan-aw ni Moises ang magamay nga kahoy kag natalupangdan niya nga nagadabdab ini, pero wala ini masunog.<NEWLINE>Si Moises nagpanghunahuna, Mapalapit ako kag tan-awon ining makatilingala nga butang. Ngaa ining magamay nga kahoy indi masunog?<NEWLINE>Sang makita sang Ginoo nga nagapalapit sia, ang Dios nagtawag sa iya halin sa tunga sang magamay nga kahoy nga nagasiling, Moises, Moises!<NEWLINE>Kag nagsabat sia, Yari ako.<NEWLINE>Ang Dios nagsiling, Indi ka gid magpalapit. Ubaha ang imo mga sandalyas, tungod kay ang lugar nga imo ginatindugan balaan.<NEWLINE>Ako amo ang Dios sang imo mga katigulangan, ang Dios ni Abraham, ang Dios ni Isaac, kag ang Dios ni Jacob. Gani gintabunan ni Moises ang iya guya, tungod kay nahadlok sia sa pagtulok sa Dios.<NEWLINE>Dayon ang Ginoo nagsiling, Nakita ko kon daw ano ang pagpintas sa akon mga tawo didto sa Ehipto. Nabatian ko ang ila pagpangayo sing bulig batok sa mga kabo nga nagapamintas sa ila. Nahibaluan ko ang tanan nila nga mga pag-antos.<NEWLINE>Gani nagpanaog ako sa pagluwas sa ila sa mga Ehiptohanon, kag sa pagpagwa sa ila sa amo nga duta, pakadto sa isa ka malapad nga duta. Maayo kag mapatubasan ini nga duta, kag karon ginaestaran sang mga Canaanhon, mga Hethanon, mga Amornon, mga Peresnon, mga Hevhanon kag mga Jebusnon.<NEWLINE>Nabatian ko gid ang pagpanawag sang mga Israelinhon, kag nakita ko kon daw ano ang pagpigos sang mga Ehiptohanon sa ila.<NEWLINE>Karon ipadala ko ikaw sa hari agod sa pagpagwa sang akon mga tawo nga Israelinhon sa Ehipto.<NEWLINE>Pero si Moises nagsiling sa Dios, Sin-o bala ako nga magkadto sa hari kag magpagwa sang mga Israelinhon sa Ehipto?<NEWLINE>Ang Dios nagsabat, Ako magaupod sa imo, kag ini mangintanda nga ako nagpadala sa imo: kon imo na mapagwa ang mga Israelinhon sa Ehipto, magasimba kamo sa akon sa sini nga bukid.<NEWLINE>Si Moises nagsiling sa Dios, Karon, kon magkadto ako sa mga Israelinhon kag magsiling sa ila, Ang Dios sang inyo mga katigulangan nagpadala sa akon sa inyo, kag kon sila mamangkot sa akon, Ano ang iya ngalan? Ano bala ang isabat ko sa ila?<NEWLINE>Ang Dios nagsiling kay Moises, Ako nga Amo sa Gihapon. Kag nagsiling pa gid sia, Amo ini ang dapat mo isiling sa mga Israelinhon: Si Ako nga Amo sa Gihapon amo ang nagpadala sa akon sa inyo.<NEWLINE>Ang Dios naghambal pa gid kay Moises, Amo ini ang dapat mo isiling sa mga Israelinhon, Ang Ginoo , ang Dios sang inyo mga katigulangan, ang Dios ni Abraham, ang Dios ni Isaac, kag ang Dios ni Jacob, nagpadala sa akon sa inyo. Ini amo ang akon ngalan tubtob sa katubtoban. Ini amo ang itawag sa akon sang tanan nga palaabuton nga mga kaliwatan.<NEWLINE>Lakat kag tipuna ang mga pangulo sang Israel, kag singgani sila, Ang Ginoo , ang Dios sang inyo mga katigulangan, ang Dios ni Abraham, ni Isaac, kag ni Jacob, nagpakita kag nagsugo sa akon sa pagsiling sa inyo: nag-abot ako kag nakita ko kon ano ang ginahimo sang mga Ehiptohanon sa inyo.<NEWLINE>Nagpamat-od ako nga pagwaon kamo sa Ehipto, sa diin ginapintasan kamo. Dalhon ko kamo sa duta sang mga Canaanhon, Hethanon, Amornon, Peresnon, Hevhanon, kag mga Jebusnon. Isa ini ka maayo kag mapatubason nga duta.<NEWLINE>Magapamati ang akon mga katawhan sang imo isiling sa ila. Dayon, kadto ka sa hari sang Ehipto upod sa mga pangulo sang Israel kag singgani sia, Ang Ginoo , ang Dios sang mga Hebreo nagpakigkita sa amon. Karon kon mahimo palakta kami sing tatlo ka adlaw sa desierto sa pagdulot sing mga halad sa Ginoo nga amon Dios.<NEWLINE>Nahibal-an ko nga ang hari sang Ehipto indi magtugot sa inyo sa paglakat, kon indi sia pagpiliton.<NEWLINE>Pero gamiton ko ang akon gahom sa pagsilot sa mga Ehiptohanon paagi sa mga milagro nga akon himuon sa ila. Pagkatapos sina, tugotan niya kamo sa paglakat.<NEWLINE>Himuon ko nga ang mga Ehiptohanon magtahod sa inyo agod nga kon maglakat kamo, indi kamo maglakat nga wala sing dala.<NEWLINE>Ang tagsa ka babayi nga Hebreo magapangayo sa babayi nga Ehiptohanon nga nagadayon sa iya, kag sa iya kaingod, sing mga bayu kag mga alahas nga pilak kag bulawan. Ipasuksok ninyo ini sa inyo mga anak nga lalaki kag babayi, kag paagi sini, madala ninyo ang manggad sang mga Ehiptohanon.	Noon ay inaalagaan ni Moises ang kawan ni Jetro na kanyang biyenan na pari sa Midian; kanyang pinatnubayan ang kawan sa kabila ng ilang at nakarating sa bundok ng Diyos, sa Horeb.<NEWLINE>Ang anghel ng Panginoon ay nagpakita sa kanya sa isang ningas ng apoy na mula sa gitna ng isang mababang punungkahoy. Siya'y nagmasid at ang punungkahoy ay nagliliyab ngunit ito'y hindi nasusunog.<NEWLINE>Sinabi ni Moises, Ako'y pupunta sa kabila at titingnan ko itong dakilang panooring ito, kung bakit ang punungkahoy ay hindi nasusunog.<NEWLINE>Nang makita ng Panginoon na siya'y pumunta sa kabila upang tumingin ay tinawag siya ng Diyos mula sa gitna ng mababang punungkahoy, Moises, Moises. Sumagot siya, Narito ako.<NEWLINE>Kanyang sinabi, Huwag kang lumapit dito. Hubarin mo ang sandalyas sa iyong mga paa sapagkat ang dakong iyong kinatatayuan ay banal na lupa.<NEWLINE>Sinabi pa niya, Ako ang Diyos ng iyong ama, ang Diyos ni Abraham, ang Diyos ni Isaac, at ang Diyos ni Jacob. Si Moises ay nagtakip ng kanyang mukha sapagkat siya'y natakot na tumingin sa Diyos.<NEWLINE>Sinabi ng Panginoon , Aking nakita ang paghihirap ng aking bayan na nasa Ehipto at aking narinig ang kanilang daing dahil sa mga umaapi sa kanila. Talagang nalalaman ko ang kanilang pagdurusa.<NEWLINE>Ako'y bumaba upang iligtas sila mula sa kamay ng mga Ehipcio at upang sila'y dalhin sa isang mabuting lupain at malawak, mula sa lupaing iyon, sa isang lupaing dinadaluyan ng gatas at pulot, sa lugar ng mga Cananeo, Heteo, Amoreo, Perezeo, Heveo at Jebuseo.<NEWLINE>At ngayon, ang daing ng mga anak ni Israel ay nakarating sa akin, at nakita ko rin ang pang-aapi na ginawa sa kanila ng mga Ehipcio.<NEWLINE>Halika, ikaw ay aking susuguin kay Faraon upang iyong ilabas sa Ehipto ang aking bayan, ang mga anak ni Israel.<NEWLINE>Sinabi ni Moises sa Diyos, Sino ako upang pumaroon kay Faraon at upang ilabas sa Ehipto ang mga anak ni Israel?<NEWLINE>Kanyang sinabi, Ako'y makakasama mo; at ito'y magiging tanda sa iyo na ikaw ay aking sinugo: kapag iyong nailabas na sa Ehipto ang bayan, sasambahin ninyo ang Diyos sa bundok na ito.<NEWLINE>Ngunit sinabi ni Moises sa Diyos, Pagdating ko sa mga anak ni Israel at sasabihin ko sa kanila, Sinugo ako sa inyo ng Diyos ng inyong mga ninuno, at sasabihin nila sa akin, Ano ang kanyang pangalan? Anong sasabihin ko sa kanila?<NEWLINE>Sinabi ng Diyos kay Moises, AKO AY ANG AKO NGA. At kanyang sinabi, Ganito ang sasabihin mo sa mga anak ni Israel, Sinugo ako sa inyo ni AKO NGA.<NEWLINE>Sinabi pa ng Diyos kay Moises, Ganito ang sasabihin mo sa mga anak ni Israel, Sinugo ako sa inyo ng Panginoon , ang Diyos ng inyong mga ninuno, ang Diyos ni Abraham, ang Diyos ni Isaac, at ang Diyos ni Jacob. Ito ang aking pangalan magpakailanman at ito ang itatawag sa akin ng lahat ng mga lahi.<NEWLINE>Humayo ka at tipunin mo ang matatanda sa Israel at sabihin mo sa kanila, Ang Panginoon , ang Diyos ng inyong mga ninuno, ang Diyos nina Abraham, Isaac, at Jacob ay nagpakita sa akin, na nagsasabi, Tunay na kayo'y aking dinalaw at aking nakita ang ginagawa sa inyo sa Ehipto.<NEWLINE>At aking sinabi, aking aalisin kayo sa kapighatian sa Ehipto at dadalhin ko kayo sa lupain ng Cananeo, Heteo, Amoreo, Perezeo, Heveo, at ng Jebuseo, sa isang lupaing dinadaluyan ng gatas at pulot.<NEWLINE>Kanilang papakinggan ang iyong tinig. Ikaw at ang matatanda sa Israel ay pupunta sa hari ng Ehipto, at inyong sasabihin sa kanya, Ang Panginoon , ang Diyos ng mga Hebreo ay nakipagtagpo sa amin at ngayo'y pahintulutan mo kami na maglakbay ng tatlong araw sa ilang. Nais naming makapaghandog sa Panginoon naming Diyos.<NEWLINE>Alam ko na hindi kayo papahintulutan ng hari ng Ehipto na umalis maliban sa pamamagitan ng isang makapangyarihang kamay.<NEWLINE>Kaya't aking iuunat ang aking kamay at sasaktan ko ang Ehipto sa pamamagitan ng lahat kong kababalaghan na aking gagawin sa gitna niyon at pagkatapos, papahintulutan niya kayong umalis.<NEWLINE>Pagkakalooban ko ang bayang ito ng biyaya sa paningin ng mga Ehipcio at sa pag-alis ninyo ay hindi kayo aalis na walang dala.<NEWLINE>Bawat babae ay hihingi sa kanyang kapwa at ang dayuhan sa kanyang bahay ng mga hiyas na pilak, mga hiyas na ginto at mga damit, at inyong ipapasuot sa inyong mga anak na lalaki at babae. Sa ganito ay inyong sasamsaman ang mga Ehipcio.
