id	source_text	target_text
GEN_009	Ginbendisyunan sang Dios si Noe kag ang iya mga anak nga lalaki kag ginsingganan niya sila, Magpamata kamo sing madamo agod ang inyo mga kaliwat maglapnag sa bug-os nga duta.<NEWLINE>Ang tanan nga mga sapat, mga pispis, kag mga isda, magakahadlok sa inyo. Kamo ang magagahom sa ila.<NEWLINE>Karon makakaon kamo sang tanan nga mga sapat kag subong man sang tanan nga mga tanom. Ginahatag ko ini tanan sa inyo nga inyo kalan-on.<NEWLINE>May isa lamang ka butang nga indi ninyo pagkaunon. Ini amo ang karne nga may dugo pa, kay ang kabuhi yara sa dugo.<NEWLINE>Kon may magkuha sang kabuhi sang tawo, pagasilutan ko sia. Pagapatyon ko ang sapat nga magapatay sang tawo.<NEWLINE>Ang bisan sin-o nga magpatay sang tawo pagapatyon man sang pareho niya nga tawo. Kay ang tawo ginhimo nga kaanggid sa Dios.<NEWLINE>Dapat kamo magbata sing madamo, agod ang inyo mga kaliwat magadamo kag magalapnag sa bug-os nga duta.<NEWLINE>Dayon ang Dios nagsiling kay Noe kag sa iya mga anak nga lalaki,<NEWLINE>Karon magahimo ako sing kasugtanan sa inyo kag sa inyo mga kaliwat,<NEWLINE>kag sa tanan nga mga tinuga nga nagakabuhimga pispis, tanan nga mga sapatang tanan nga naggwa sa arka upod sa inyo.<NEWLINE>Sa sini nga mga pulong magahimo ako sing kasugtanan sa inyo: indi ko na gid liwat paglaglagon ang tanan nga nagakabuhi nga mga tinuga paagi sa anaw. Indi na gid mag-anaw liwat sa paglaglag sang duta.<NEWLINE>Subong tanda sang walay katapusan nga kasugtanan nga akon ginahimo upod sa inyo kag sa tanan nga mga tinuga nga nagakabuhi,<NEWLINE>ginabutang ko ang akon balangaw sa mga panganod. Ini mangintanda sang akon kasugtanan sa kalibutan.<NEWLINE>Kon magpadala ako sing panganod sa kahawaan, kag ang balangaw magapakita sa mga panganod,<NEWLINE>dumdomon ko ang akon saad sa inyo kag sa tanan nga mga sapat, nga wala na sing anaw nga magalaglag liwat sang tanan nga nagakabuhi nga mga tinuga.<NEWLINE>Kon ang balangaw magpakita sa mga panganod, makita ko ini kag dumdomon ko ang akon walay katubtoban nga kasugtanan sa tanan nga mga tinuga nga nagakabuhi sa duta.<NEWLINE>Ang Dios nagsiling kay Noe, Amo ini ang tanda sang akon saad sa tanan nga mga tinuga nga nagakabuhi sa duta.<NEWLINE>Ang mga anak ni Noe nga lalaki nga naggwa sa arka amo si Sem, si Ham, kag si Jafet. Si Ham amo ang amay ni Canaan.<NEWLINE>Ining tatlo ka mga anak ni Noe amo ang ginhalinan sang tanan nga mga tawo sa duta.<NEWLINE>Si Noe isa ka mangungoma. Sia ang nahauna nga nagpatanom sing mga ubas.<NEWLINE>Sang makainom sia sang bino sang iya ubas, nahubog sia, nag-uba kag naghigda nga hublas sa iya tolda.<NEWLINE>Sang makita ni Ham nga amay ni Canaan nga ang iya amay hublas, naglakat sia kag ginsugiran ang duha niya ka mga utod.<NEWLINE>Dayon si Sem kag si Jafet nagkuha sing panapton kag gin-umbilay nila ini. Nagkadto sila sa tolda nga nagaisol kag gintabunan nila ang ila amay. Wala sila mag-atubang agod indi nila makita ang ila amay nga hublas.<NEWLINE>Sang naumpawan si Noe kag sang mahibal-an niya ang ginhimo sa iya sang iya kamanghuran nga anak,<NEWLINE>nagsiling sia<NEWLINE>Ang pagpakamalaut mangin kay Canaan!<NEWLINE>Mangin-ulipon sia sang iya mga utod.<NEWLINE>Dayawon ang Ginoo , ang Dios ni Sem!<NEWLINE>Si Canaan mangin-ulipon ni Sem.<NEWLINE>Kabay nga ang Dios magpamuad kay Jafet!<NEWLINE>Kag kabay nga ang iya kaliwat magpuyo upod sa mga kaliwat ni Sem!<NEWLINE>Si Canaan mangin-ulipon ni Jafet.<NEWLINE>Sa tapos ang anaw, si Noe nagkabuhi sing 350 pa ka tuig,<NEWLINE>kag sang nagaedad sia sing 950 ka tuig napatay sia.	Binasbasan ng Diyos si Noe at ang kanyang mga anak at sa kanila'y sinabi, Kayo'y magkaroon ng mga anak at magpakarami, at inyong punuin ang lupa.<NEWLINE>Ang takot at sindak sa inyo ay darating sa bawat hayop sa lupa, sa bawat ibon sa himpapawid, sa lahat ng gumagapang sa lupa, at sa lahat ng isda sa dagat. Sila ay ibinibigay sa inyong kamay.<NEWLINE>Bawat gumagalaw na nabubuhay ay magiging pagkain ninyo; at kung paanong ibinigay ko sa inyo ang mga luntiang halaman, ibinibigay ko sa inyo ang lahat ng mga bagay.<NEWLINE>Ngunit huwag ninyong kakainin ang laman na kasama ang buhay nito, ito ay ang kanyang dugo.<NEWLINE>At tiyak na aking hihingan ng sulit ang umutang sa inyong dugo. Aking hihingin ito sa bawat hayop at sa mga tao, bawat isa para sa dugo ng iba. Hihingan ko ng sulit ang umutang sa buhay ng tao.<NEWLINE>Sinumang magpadanak ng dugo ng tao, ang dugo ng taong iyon ay papadanakin ng ibang tao; sapagkat nilalang ang tao sa larawan ng Diyos.<NEWLINE>At kayo'y magkaroon ng mga anak at magpakarami; magbunga kayo nang sagana sa lupa at magpakarami kayo roon.<NEWLINE>At nagsalita ang Diyos kay Noe at sa mga anak na kasama niya, na sinasabi,<NEWLINE>Narito, aking itinatatag ang tipan sa inyo, at sa inyong mga anak na susunod sa inyo;<NEWLINE>at sa bawat nilikhang may buhay na kasama ninyo, ang mga ibon, ang maamong hayop at bawat mailap na hayop sa lupa na kasama ninyo, sa lahat ng lumabas sa daong, sa bawat hayop sa lupa.<NEWLINE>Aking pinagtitibay ang aking tipan sa inyo; hindi ko na lilipulin ang lahat ng mga tao sa pamamagitan ng tubig ng baha at hindi na magkakaroon pa ng bahang magwawasak ng lupa.<NEWLINE>Sinabi ng Diyos, Ito ang tanda ng tipang gagawin ko sa inyo, at sa bawat nilalang na may buhay na kasama ninyo sa buong panahon.<NEWLINE>Inilagay ko ang aking bahaghari sa ulap, at ito ay magiging tanda ng tipan ko at ng lupa.<NEWLINE>At kapag tinipon ko ang mga ulap sa ibabaw ng lupa, ang bahaghari ay makikita sa ulap.<NEWLINE>Aalalahanin ko ang aking tipan sa inyo, at sa bawat nilalang na may buhay; at ang tubig ay hindi na magiging bahang lilipol ng lahat ng nabubuhay.<NEWLINE>Kapag ang bahaghari ay nasa ulap, ito ay aking makikita at maaalala ang walang hanggang tipan sa pagitan ng Diyos at ng bawat nilalang na may buhay na nasa ibabaw ng lupa.<NEWLINE>Sinabi ng Diyos kay Noe, Ito ang tanda ng tipan na aking itinatag sa lahat ng nabubuhay na nasa ibabaw ng lupa.<NEWLINE>Ang mga anak ni Noe na lumabas sa daong ay sina Sem, Ham, at Jafet. Si Ham ay siyang ama ni Canaan.<NEWLINE>Ang mga ito ang tatlong mga anak ni Noe at sa kanila nagmula ang lahat ng tao sa lupa.<NEWLINE>Si Noe ay isang magbubukid at siyang pinakaunang nagtanim ng ubasan.<NEWLINE>Uminom siya ng alak at nalasing at siya'y nakahigang hubad sa loob ng kanyang tolda.<NEWLINE>At nakita ni Ham na ama ni Canaan ang kahubaran ng kanyang ama, at isinaysay sa kanyang dalawang kapatid na nasa labas.<NEWLINE>Kumuha sina Sem at Jafet ng isang balabal, inilagay sa balikat nilang dalawa, lumakad ng paatras, at tinakpan ang kahubaran ng kanilang ama. At ang mukha nila ay patalikod, at hindi nila nakita ang kahubaran ng kanilang ama.<NEWLINE>Nagising si Noe sa kanyang pagkalasing, at nalaman ang ginawa sa kanya ng kanyang bunsong anak.<NEWLINE>At kanyang sinabi,<NEWLINE>Sumpain si Canaan!<NEWLINE>Siya'y magiging alipin ng mga alipin sa kanyang mga kapatid.<NEWLINE>At sinabi niya,<NEWLINE>Purihin ang Panginoon , ang Diyos ni Sem!<NEWLINE>At si Canaan ay magiging alipin niya.<NEWLINE>Palawakin ng Diyos si Jafet,<NEWLINE>at siya'y titira sa mga tolda ni Sem;<NEWLINE>at si Canaan ay magiging alipin niya.<NEWLINE>Nabuhay si Noe ng tatlong daan at limampung taon pagkaraan ng baha.<NEWLINE>Ang lahat ng naging araw ni Noe ay siyamnaraan at limampung taon. At siya ay namatay.
GEN_010	Amo ini ang mga kaliwat sang mga anak ni Noe nga amo sanday Sem, Ham, kag Jafet. Ini sila nga tatlo may mga anak nga lalaki nga nagkalatawo sa tapos ang anaw.<NEWLINE>Ang mga anak nga lalaki ni Jafet amo sanday Gomer, Magog, Madai, Javan, Tubal, Mesec, kag Tiras. Ang ila mga kaliwat nagdala sang ila mga ngalan.<NEWLINE>Ang mga kaliwat ni Gomer amo ang mga tawo sang Askenaz, Rifat, kag Togarma.<NEWLINE>Ang mga kaliwat ni Javan amo ang mga tawo sang Elisa, Tarsis, Kitim, kag Dodanim.<NEWLINE>Sila ang mga katigulangan sang mga tawo nga nag-estar sa mga baybayon kag sa mga kapuloan sang dagat. Ini tanan amo ang mga kaliwat ni Jafet nga nag-estar sa nagkalainlain nga mga tribo kag mga pungsod, kag ang tagsa ka grupo may kaugalingon nga linggwahe.<NEWLINE>Ang mga anak nga lalaki ni Ham amo sanday Cus, Ehipto, Put kag Canaan. Ang ila mga kaliwat nagdala sang ila mga ngalan.<NEWLINE>Ang mga kaliwat ni Cus amo ang mga tawo sang Seba, Havila, Sabta, Raama, kag Sabteca. Ang mga kaliwat ni Raama amo ang mga tawo sang Seba kag Dedan.<NEWLINE>Si Cus may anak nga lalaki nga ginhingalanan kay Nimrod, nga amo ang nahauna nga mandadaog sa kalibutan.<NEWLINE>Sa bulig sang Ginoo nanginsampaton sia nga mangangayam, amo ina nga ang mga tawo nagasiling, Kabay nga ang Ginoo maghimo sa imo nga sampaton nga mangangayam pareho kay Nimrod!<NEWLINE>Ang nahauna niya nga ginharian nagsakop sang Babel, Erec, kag Akad. Ini tanan lunsay sa duta sang Babilonia.<NEWLINE>Halin sa sadto nga duta nagkadto sia sa Asiria kag nagpatindog sang mga siudad sang Ninive, Rehobot-ir, Cala,<NEWLINE>kag Rezin, nga yara sa gintung-an sang Ninive kag sang daku nga siudad sang Cala.<NEWLINE>Ang mga kaliwat ni Ehipto amo ang mga tawo sang Lud, Anam, Lehab, Naftu,<NEWLINE>Patru, Caslu, kag Creta nga amo ang ginhalinan sang mga Filistinhon.<NEWLINE>Ang mga anak ni Canaan amo sanday Sidon kag si Het. Ang ila mga kaliwat nagdala sang ila mga ngalan.<NEWLINE>Si Canaan amo man ang ginhalinan sang mga Jebusnon, Amornon, Girgasanhon,<NEWLINE>Hevhanon, Arquinhon, Sinhanon,<NEWLINE>Arvadnon, Zemarnon, kag Hamatnon. Sang ulihi ang nagkalainlain nga mga tribo sang Canaanhon naglapta,<NEWLINE>kag ang ila dulonan halin sa Sidon naglambot sa bagatnan sa Gerar tubtob sa Gaza, sa sidlangan sa Sodoma, Gomorra, Adma, kag Zeboim nga malapit sa Lasa.<NEWLINE>Amo ini sila ang mga kaliwat ni Ham nga nagaestar sa nagkalainlain nga mga tribo kag mga pungsod, kag ang tagsa ka grupo may kaugalingon nga linggwahe.<NEWLINE>Si Sem, ang magulang nga utod ni Jafet, amo ang ginhalinan sang tanan nga mga Hebreo.<NEWLINE>Ang mga anak nga lalaki ni Sem amo sanday Elam, Asur, Arfaxad, Lud kag Aram. Ang ila mga kaliwat nagdala sang ila mga ngalan.<NEWLINE>Ang mga kaliwat ni Aram amo ang mga tawo sang Uz, Hul, Geter, kag Mesec.<NEWLINE>Si Arfaxad amay ni Sela kag si Sela amay ni Eber.<NEWLINE>Si Eber may duha ka mga anak nga lalaki: ang isa ginhingalanan kay Peleg, kay sa iya panag-on ang mga tawo sa kalibutan nabahinbahin, kag ang ngalan sang iya utod amo si Joctan.<NEWLINE>Ang mga kaliwat ni Joctan amo ang mga tawo sang Almodad, Selef, Hazarmavet, Jera,<NEWLINE>Hadoram, Uzal, Dicla,<NEWLINE>Obal, Abimael, Seba,<NEWLINE>Ofir, Havila, kag Jobab. Ini sila tanan naghalin kay Joctan.<NEWLINE>Nag-estar sila sa duta halin sa Mesa pakadto sa Sefer tubtob sa mga bukid sa sidlangan.<NEWLINE>Amo ini sila ang mga kaliwat ni Sem nga nag-estar sa nagkalainlain nga mga tribo kag mga pungsod, kag ang tagsa ka grupo may kaugalingon nga linggwahe.<NEWLINE>Ini tanan nga mga tawo ang mga kaliwat ni Noe, suno sa ila mga nagkalainlain nga linahi kag mga pungsod. Sa tapos ang anaw ang tanan nga mga pungsod sang kalibutan naghalin sa sini nga mga anak ni Noe.	Ang mga ito ang mga salinlahi ng mga anak ni Noe: sina Sem, Ham, at Jafet: at sila'y nagkaanak pagkaraan ng baha.<NEWLINE>Ang mga anak ni Jafet: sina Gomer, Magog, Madai, Javan, Tubal, Meshec, at si Tiras.<NEWLINE>Ang mga anak ni Gomer: sina Askenaz, Rifat, at Togarma.<NEWLINE>Ang mga anak ni Javan: sina Elisha, Tarsis, Kittim, at Dodanim.<NEWLINE>Sa mga ito nahati ang mga pulo ng mga bansa sa kanilang mga lupain, ang bawat isa ayon sa kanyang wika, sa kanilang mga angkan at mga bansa.<NEWLINE>Ang mga anak ni Ham ay sina Cus, Mizraim, Put, at Canaan.<NEWLINE>Ang mga anak ni Cus ay sina Seba, Havila, Sabta, Raama, at Sabteca; at ang mga anak ni Raama: sina Sheba, at Dedan.<NEWLINE>Naging anak ni Cus si Nimrod na siyang nagsimulang maging makapangyarihan sa lupa.<NEWLINE>Siya'y makapangyarihang mangangaso sa harap ng Panginoon kaya't karaniwang sinasabi: Gaya ni Nimrod na makapangyarihang mangangaso sa harapan ng Panginoon .<NEWLINE>At ang simula ng kanyang kaharian ay ang Babel, ang Erec, ang Acad, ang Calne, sa lupain ng Shinar.<NEWLINE>Buhat sa lupaing iyon ay nagtungo siya sa Asiria at itinayo ang Ninive, Rehobot-ir, at ang Cale,<NEWLINE>ang Resen, sa pagitan ng Ninive at ng Cale na isang malaking bayan.<NEWLINE>At naging anak ni Mizraim sina Ludim, Anamim, Lehabim, at Naphtuhim,<NEWLINE>sina Patrusim, at Casluim na siyang pinagmulan ng mga Filisteo, at ang Caftoreo.<NEWLINE>At naging anak ni Canaan sina Sidon, na kanyang panganay, at si Het,<NEWLINE>at ang mga Jebuseo, Amoreo, ang mga Gergeseo;<NEWLINE>ang mga Heveo, Araceo, ang Sineo,<NEWLINE>ang mga taga-Arvad, Zemareo, Hamateo at pagkatapos ay kumalat ang mga angkan ng Cananeo.<NEWLINE>Ang hangganan ng lupain ng mga Cananeo ay mula sa Sidon, patungo sa Gerar, hanggang sa Gaza, patungo sa Sodoma at Gomorra, at Adma, at Zeboyin hanggang Lasa.<NEWLINE>Ito ang mga anak ni Ham ayon sa kanilang angkan, wika, mga lupain, at kanilang mga bansa.<NEWLINE>Nagkaroon din ng mga anak si Sem, na ama ng lahat ng mga anak ni Eber, na siyang matandang kapatid ni Jafet.<NEWLINE>Ang mga anak ni Sem: sina Elam, Ashur, Arfaxad, Lud, at Aram.<NEWLINE>Ang mga anak ni Aram: sina Uz, Hul, Geter, at Mas.<NEWLINE>Naging anak ni Arfaxad sina Shela; at naging anak ni Shela si Eber.<NEWLINE>Nagkaanak si Eber ng dalawang lalaki; ang pangalan ng una'y Peleg; sapagkat sa mga araw niya'y nahati ang lupa; at ang pangalan ng kanyang kapatid ay Joktan.<NEWLINE>Naging anak ni Joktan sina Almodad, Shelef, Hazar-mavet, at si Jerah,<NEWLINE>sina Hadoram, Uzal, at Dicla,<NEWLINE>sina Obal, Abimael, at Sheba,<NEWLINE>sina Ofir, Havila, at Jobab. Lahat ng ito ay mga naging anak ni Joktan.<NEWLINE>Ang naging tahanan nila ay mula sa Mesha, patungo sa Sefar, na siyang bundok sa silangan.<NEWLINE>Ito ang mga anak ni Sem, ayon sa kanilang angkan, wika, lupain, at bansa.<NEWLINE>Ito ang mga angkan ng mga anak ni Noe, ayon sa kanilang lahi, at bansa. Sa mga ito nagsimulang kumalat ang mga bansa pagkatapos ng baha.
GEN_011	Sang una, ang mga tawo sa bug-os nga kalibutan may isa lang ka linggwahe kag pareho nga mga pulong ang ila ginagamit.<NEWLINE>Samtang nagapakadto sila sa sidlangan, nakalambot sila sa patag sang duta sang Babilonia kag nag-estar sila didto.<NEWLINE>Dayon nagsiling sila sa isa kag isa, Dali kamo, mahimo kita sing mga tisa kag aton ini patig-ahon sa hornohan. Gani may tisa sila nga inugpatindog, kag aspalto sa pagpatapik sang mga tisa.<NEWLINE>Dayon nagsiling sila, Dali, mahimo kita sing isa ka siudad nga may tore nga nagalambot sa langit, agod manginbantog kita kag indi kita maglapta sa bug-os nga duta.<NEWLINE>Karon ang Ginoo nagpanaog sa pagtan-aw sang siudad kag sang tore nga ginpatindog sang mga tawo.<NEWLINE>Kag nagsiling sia, Karon, ini nga mga tawo may pag-isa kag isa lang ang ila linggwahe. Pamuno pa lang ini sang ila pagahimuon. Sa indi madugay magahimo sila sang bisan ano nga luyag nila!<NEWLINE>Dali, manaog kita kag tublagon ta ang ila panghambal agod nga indi sila mag-intiendihanay.<NEWLINE>Gani ginpaalaplaag sila sang Ginoo sa bug-os nga duta, kag nauntat ang ila paghimo sang siudad.<NEWLINE>Ang siudad gintawag Babilonia, tungod kay didto gintublag sang Ginoo ang linggwahe sang tanan nga mga tawo, kag halin didto ginpalapta niya sila sa bug-os nga kalibutan.<NEWLINE>Amo ini ang mga kaliwat ni Sem. Duha ka tuig sa tapos sang anaw, sang si Sem nagaedad sing 100 ka tuig, natawo ang iya anak nga lalaki nga si Arfaxad.<NEWLINE>Sa tapos sini, nagkabuhi sia sing 500 pa ka tuig kag may iban pa sia nga mga kabataan.<NEWLINE>Sang si Arfaxad nagaedad na sing trayntay singko ka tuig, natawo ang iya anak nga lalaki nga si Sela.<NEWLINE>Sa tapos sini, nagkabuhi sia sing 403 pa ka tuig kag may iban pa sia nga mga kabataan.<NEWLINE>Sang si Sela nagaedad na sing traynta ka tuig, natawo ang iya anak nga lalaki nga si Eber.<NEWLINE>Sa tapos sini, nagkabuhi sia sing 403 pa ka tuig kag may iban pa sia nga mga kabataan.<NEWLINE>Sang si Eber nagaedad sing trayntay kwatro ka tuig, natawo ang iya anak nga lalaki nga si Peleg.<NEWLINE>Sa tapos sini, nagkabuhi sia sing 430 pa ka tuig kag may iban pa sia nga mga kabataan.<NEWLINE>Sang si Peleg nagaedad sing traynta ka tuig, natawo ang iya anak nga lalaki nga si Reu.<NEWLINE>Sa tapos sini, nagkabuhi sia sing 209 pa ka tuig kag may iban pa sia nga mga kabataan.<NEWLINE>Sang si Reu nagaedad sing trayntay dos ka tuig, natawo ang iya anak nga lalaki nga si Serug.<NEWLINE>Sa tapos sini, nagkabuhi sia sing 207 pa ka tuig kag may iban pa sia nga mga kabataan.<NEWLINE>Sang si Serug nagaedad sing traynta ka tuig, natawo ang iya anak nga lalaki nga si Nahor.<NEWLINE>Sa tapos sini, nagkabuhi sia sing 200 pa ka tuig kag may iban pa sia nga mga kabataan.<NEWLINE>Sang si Nahor nagaedad sing baynte nwebe ka tuig, natawo ang iya anak nga lalaki nga si Tera.<NEWLINE>Sa tapos sini, nagkabuhi sia sing 119 pa ka tuig kag may iban pa sia nga mga kabataan.<NEWLINE>Sa tapos makaedad si Tera sing setenta ka tuig, natawo ang iya mga anak nga amo sanday Abram, Nahor, kag Haran.<NEWLINE>Amo ini ang mga kaliwat ni Tera. Si Tera amay nanday Abram, Nahor, kag Haran. Si Haran amay ni Lot.<NEWLINE>Si Haran napatay sa iya kaugalingon nga banwa sang Ur sakop sang Babilonia sang buhi pa ang iya amay.<NEWLINE>Si Abram nagpangasawa kay Sarai, kag si Nahor nagpangasawa kay Milca, ang bata nga babayi ni Haran nga amay man ni Isca.<NEWLINE>Si Sarai wala makapamata.<NEWLINE>Gindala ni Tera ang iya anak nga lalaki nga si Abram, ang iya apo nga lalaki nga si Lot nga anak nga lalaki ni Haran, kag ang iya umagad nga babayi nga si Sarai, nga asawa ni Abram, kag naghalin sila sa siudad sang Ur sang Babilonia sa pagkadto sa duta sang Canaan. Naglakat sila tubtob sa Haran kag didto nag-estar sila.<NEWLINE>Didto napatay si Tera sang nagaedad sia sang 205 ka tuig.	Noon, ang buong lupa ay iisa ang wika at magkakatulad ang salita.<NEWLINE>Sa kanilang paglalakbay sa silangan, nakatagpo sila ng isang kapatagan sa lupain ng Shinar, at sila'y tumira doon.<NEWLINE>At sinabi nila sa isa't isa, Halikayo! Tayo'y gumawa ng mga tisa at ating lutuing mabuti. At ang kanilang bato ay tisa at alkitran ang kanilang semento.<NEWLINE>Sinabi nila, Halikayo! Magtayo tayo ng isang lunsod at isang tore na ang taluktok nito ay hanggang sa langit, at gumawa tayo ng pangalan para sa ating mga sarili, baka tayo magkawatak-watak sa ibabaw ng buong lupa.<NEWLINE>Bumaba ang Panginoon upang tingnan ang lunsod at ang tore na itinayo ng mga anak ng mga tao.<NEWLINE>At sinabi ng Panginoon , Tingnan ninyo, sila'y iisang bayan at may isang wika; at ito ay pasimula pa lamang ng kanilang gagawin, at ngayon, walang makakapigil sa anumang kanilang binabalak gawin.<NEWLINE>Halikayo! Tayo'y bumaba at ating guluhin ang kanilang wika, upang hindi nila maunawaan ang pananalita ng bawat isa.<NEWLINE>Kaya't ikinalat sila ng Panginoon mula roon sa ibabaw ng buong lupa, at huminto sila sa pagtatayo ng lunsod.<NEWLINE>Kaya't ang ipinangalan dito ay Babel, sapagkat doon ay ginulo ng Panginoon ang wika ng buong lupa, at mula roon ay ikinalat sila ng Panginoon sa ibabaw ng buong lupa.<NEWLINE>Ito ang mga salinlahi ni Sem. May isandaang taong gulang si Sem nang maging anak si Arfaxad, dalawang taon pagkatapos ng baha.<NEWLINE>Nabuhay si Sem ng limandaang taon pagkatapos na maipanganak si Arfaxad, at nagkaanak pa ng mga lalaki at mga babae.<NEWLINE>Nang si Arfaxad ay tatlumpu't limang taon, naging anak niya si Shela.<NEWLINE>Nabuhay si Arfaxad ng apatnaraan at tatlong taon pagkatapos na maipanganak si Shela, at nagkaanak pa ng mga lalaki at mga babae.<NEWLINE>Nabuhay si Shela ng tatlumpung taon, at naging anak si Eber.<NEWLINE>Nabuhay si Shela ng apatnaraan at tatlumpung taon pagkatapos na maipanganak si Eber, at nagkaanak pa ng mga lalaki at mga babae.<NEWLINE>Nabuhay si Eber ng tatlumpu't apat na taon, at naging anak si Peleg.<NEWLINE>Nabuhay si Eber ng apatnaraan at tatlumpung taon pagkatapos na maipanganak si Peleg, at nagkaanak pa ng mga lalaki at mga babae.<NEWLINE>Nabuhay si Peleg ng tatlumpung taon, at naging anak si Reu.<NEWLINE>Nabuhay si Peleg ng dalawang daan at siyam na taon pagkatapos na maipanganak si Reu, at nagkaanak pa ng mga lalaki at mga babae.<NEWLINE>Nabuhay si Reu ng tatlumpu't dalawang taon, at naging anak si Serug.<NEWLINE>Nabuhay si Reu ng dalawang daan at pitong taon pagkatapos na maipanganak si Serug, at nagkaanak pa ng mga lalaki at mga babae.<NEWLINE>Nabuhay si Serug ng tatlumpung taon, at naging anak si Nahor.<NEWLINE>Nabuhay si Serug ng dalawang daang taon pagkatapos maipanganak si Nahor, at nagkaanak pa ng mga lalaki at mga babae.<NEWLINE>Nabuhay si Nahor ng dalawampu't siyam na taon, at naging anak si Terah.<NEWLINE>Nabuhay si Nahor ng isandaan at labinsiyam na taon pagkatapos na maipanganak si Terah, at nagkaanak pa ng mga lalaki at mga babae.<NEWLINE>At nabuhay si Terah ng pitumpung taon, at naging anak sina Abram, Nahor at Haran.<NEWLINE>Ito ang mga lahi ni Terah. Naging anak ni Terah sina Abram, Nahor, at Haran; at naging anak ni Haran si Lot.<NEWLINE>Unang namatay si Haran kaysa sa kanyang amang si Terah sa lupaing kanyang tinubuan, sa Ur ng mga Caldeo.<NEWLINE>At nagsipag-asawa sina Abram at Nahor. Ang pangalan ng asawa ni Abram ay Sarai, at ang pangalan ng asawa ni Nahor ay Milca, na anak na babae ni Haran na ama nina Milca at Iscah.<NEWLINE>At si Sarai ay baog; siya'y walang anak.<NEWLINE>Isinama ni Terah si Abram na kanyang anak, at si Lot na anak ni Haran, na anak ng kanyang anak, at si Sarai na kanyang manugang na asawa ni Abram na kanyang anak at sama-samang umalis sa Ur ng mga Caldeo upang magtungo sa lupain ng Canaan. Dumating sila sa Haran, at nanirahan doon.<NEWLINE>At ang mga naging araw ni Terah ay dalawandaan at limang taon, at namatay si Terah sa Haran.
